1275402733	周末啦！[嘻嘻] ​​​	[<小太狼-Hao>: 回复 @血腥维也纳 :如果她现在没被牵走，你敢去非诚尝试牵走她吗[笑而不语],<奋斗中的青年手写的从前>: 已看2遍，强烈推荐[强],<三青zbrhxl>: 美女都不去看  看来50亿没问题  如你们这些女神都去看,<小太狼-Hao>: 回复 @YingGH_Alan :审美观这个很难说，但是价值认同这个或许值得商榷，因为自己有时是没办法知道自己的价值观是否有问题的，有的人明明在党同伐异，他或她，确认为这是替天行道，所以需要很的努力去建立自己正确的价值观，也因为这个目的，有时需要更多的宽容来对待其他的价值。这是我的理解不知对不对,<三青zbrhxl>: 回复 @血腥维也纳 :哎  你去  非  好了[嘻嘻],<三青zbrhxl>: 回复 @勇闯天涯PSBC :我在家看的  我喜欢一个人静静看电影[微笑],<三青zbrhxl>: 回复 @勇闯天涯PSBC :认真看  的确能让你  激动  [good],<YingGH_Alan>: 战狼2，估计你不会喜欢！电影太过用力，感情戏也很牵强，这些可能都与你的价值认同和审美观不符。。猜的,<小太狼-Hao>: 我就很少去电影院看电影，这么大，只去过一次。在电影院不过瘾，因为不能重复看。我喜欢在看电影时，看到好的台词，按暂停键，然后倒回去，重复看，直到看明白为止。而且神游一段时间，再继续看。所以很多人不太能接受和我看电影。我很少自己或者和别人看电影。[可爱][可爱][嘻嘻],<小太狼-Hao>: 回复 @正英必立liu :怪不得人说，爱情具有排他性，你释放出很大的排他性。在动物世界里，要得到配偶是需要决斗的，我想，你要做好心理准备。虽然你说邵逸凡不喜欢你，但是你还是可以尝试一下。坚持到底，会有非常不一样的结果。虽然未来可能一场空，但是你的能力已经锻炼了[嘻嘻][嘻嘻][嘻嘻],<勇闯天涯PSBC>: 真的非常好看，值得一看，强烈推荐,<勤奋的瑞泉>: 有一部新抗日神剧，里面有个日本人冒得名就是邵逸凡。有意思吧。那个剧叫李三枪,<滑水陈>: 找时间可以去看看凡姐，挺好看的！[嘻嘻],<我不会玩这>: 回复 @正英必立liu :我错了我错了[可怜][可怜],<__-___哦>: 坐等明晚的非诚！,<血腥维也纳>: 回复 @血腥维也纳 :我等的心都焦了~~[可爱][可爱][可爱][馋嘴][馋嘴][馋嘴],<没有故事的超同学_>: 等了一周又可以看到你啦。[哈哈],<梦之缘3399>: 战狼2不如看非诚勿扰的你,<血腥维也纳>: 周末到了，又到了我们二人世界的时候了~~[可爱][可爱][可爱][馋嘴][馋嘴][馋嘴],<朝霞一样>: 电影还可以，可能不适合女孩子看，,<只想与你更接近16518>: 真羡慕 你们还能有周末,<鉲怖奇诺言>: 自己可以好好玩一玩了[爱你][爱你],<邵逸凡_已弃疗>: 回复 @保罗-亚特兰蒂尼 :哈哈哈哈哈哈哈哈哈。嘲笑您。,<保罗-亚特兰蒂尼>: 又要录影咯[失望],<正英必立liu>: 回复 @Red93 :这样啊  我还以为是微信呢,<Red93>: 回复 @正英必立liu :明显是微博私信……,<正英必立liu>: 回复 @我不会玩这 :各族人民反对沙发分裂、维护沙发统一、维护沙发稳定的决心是坚定不移的，任何破坏沙发稳定、制造沙发分裂的图谋都是不得人心的，是注定要要失败的！[怒骂],<正英必立liu>: 回复 @我不会玩这 :[怒]严正声明！此帖在全世界只有一个沙发。本人是该沙发的唯一合法代表。自古以来本人一直对该沙发行使着主权。沙发两边的扶手是沙发不可分割的一部分，任何企图想制造两个沙发，或一个沙发一个扶手的行为，都必将遭到包括中国人民在内的全世界人民的反对！,<我不会玩这>: 回复 @正英必立liu :蹭楼蹭楼[太开心][太开心],<boss水瓶座>: 我也没看[doge],<正英必立liu>: 谁这么好命啊  有卲逸凡的微信   羡慕嫉妒恨   [怒],<不再年轻的兔子0_0>: 典型的一到周末就打了鸡血，一到周一就跟得了鸡瘟一样[二哈],<lee威尔泰>: 是啊  周末了   周末开学[喵喵][允悲],<小窝里的流浪猫>: 哈哈[开心]淑女也有调皮的一面,<方轩灵动>: 所以也不准备看了是吗？,<风筝之释>: [失望]忙得没时间去看，更何况还得抽时间看非诚勿扰逸凡baby,<chasel哈哈哈>: 朝阳剧院这里我有票，求女神一起！,<大圣小时候>: 又可以在非诚勿扰看到你啦[二哈],<Mr丶唯58066>: 我也没看过战狼2，光看预告了，腾讯哪会出来战狼2呀[羞嗒嗒],<正英必立liu>: 真好   沙发   终于抢到沙发了]
1275402733	还让不让人好好吃午饭了 ​​​	[<正英必立liu>: 回复 @溪姐说 :溪姐你好  幸会幸会  经常听到心凡提起你   有空来家里玩哈   我让心凡煎牛排给你吃   [可爱],<溪姐说>: 回复 @正英必立liu :天啦，你是有妄想症吗,<人生不止如初贱>: 原来你也玩这个游戏，求游戏ID @邵逸凡_已弃疗,<LZHWB517>: 性格决定命运，选择决定人生！,<三青zbrhxl>: 回复 @鹰爪铁布猫 :凡喜欢宠物哦  不知是猫  还是[狗][嘻嘻][哈哈][哈哈],<用户5410877448>: 下嘴唇饱满，上嘴唇不像颗痣，是什么呢,<pamw张>: 有痣并不影响美，美人痣。,<ZGM钟立华>: 回复 @正英必立liu :呦呦呦，有的人开始不打自招咯,<正英必立liu>: 回复 @ZGM钟立华 :不会啊  我哪敢啊  一般都是她叫我跪CPU  [委屈],<高手刘>: 回复 @哈提子 :那你 们让我笑笑,<劉灥淼>: 周末准备去哪，一起嗨皮啊[干杯],<小太狼-Hao>: 哈哈哈，不时留意微博，发现楼上楼下，越聊越骚。没准有一天，突然发现，原来聊的是别人的老婆。嘻嘻。[嘻嘻][嘻嘻][嘻嘻],<踢球小野鸡儿>: 果然平[阴险][阴险][阴险],<栺緊釦2016>: 回复 @正英必立liu :那也是重于泰山,<用户蓉儿粉>: 姐姐死胖子。这么能吃。不带我,<正英必立liu>: 回复 @栺緊釦2016 :挖吧  就怕你累不死  [笑而不语],<鹰爪铁布猫>: 回复 @zbrhxl :这都是朕的错[doge][doge][doge],<只想与你更接近16518>: @邵逸凡_已弃疗  这午饭吃的也太早了[思考],<我真是凉>: 回复 @栺緊釦2016 :她是我的 你们都走开,<檀影工作室>: 你被牵走了？[眼泪][眼泪],<月落乌啼霜满天和门泊动物万里船>: 看来各位粉丝的评论，感觉一个比一个撩骚！哈哈哈哈，别打我,<月落乌啼霜满天和门泊动物万里船>: 只有我认出来有炉石吗,<winter-200410>: 嘴唇[张嘴] 咋么啦，这是上火啦。,<栺緊釦2016>: 回复 @正英必立liu :只要锄头挥得好，没有墙脚挖不倒,<ZGM钟立华>: 楼下各位，你们无不无聊呀？一个个整天围着别人的女朋友转 @邵逸凡_已弃疗   ，小心家里那口子搓衣板伺候,<三青zbrhxl>: 回复 @邵逸凡_已弃疗 :痣  有长嘴唇上的  很少见   被咬的吧[微笑][哈哈][挤眼],<新时代枢纽>: 吃饭让我家女神等，点差评！绑着辫子和散着头发果然不一样[小黄人坏笑]，不过这样也是美美的！,<墩波波>: 我以为是看错了，想不到美女爱好广泛啊[可爱]弹得了琴，打的了炉石。今天版本更新，同事普遍反应进游戏慢，写等一分钟等实际等待都大于一分钟。再祝出各种实用传说卡~[haha],<实习驾驶员小爬>: 卧槽  小姐姐   求炉石好友啊[doge],<正英必立liu>: 回复 @守法公民大张张 :英雄和美人不是一国的,<正英必立liu>: 回复 @哈提子 :谢谢   但我和凡凡不会离婚的   永远永远在一起   海枯石烂   [心],<正英必立liu>: 未来霸气的女总裁   内心永远住着个小清新   [耶],<正英必立liu>: 我愿是一条激流，是山间的小河，穿过崎岖的道路，从山岩中间流过。只要我的爱人，是一条小鱼，在我的浪花里，愉快地游来游去； -------献给让我魂飞魄散爱人  卲逸凡兄弟  [色],<正英必立liu>: 心凡   口唇气泡了   上火了   少熬点夜    我跑不掉的   你安心的睡吧    [心],<正英必立liu>: 话不多说拆包好烟去 我被电的不轻  娇柔羞涩期盼的明眸 闪闪生辉   颤人心扉   让人怜香惜玉  喂     还让不让人安心工作了啊   我又没法安心工作了   我上辈子欠你什么了  我上辈子做什么孽啊    上苍派你来折磨我   让我魂也飞了  魄也散了   不要啊   我爱江山不爱美人的呀  好嘛  神救我 。。。[允,<邵逸凡_已弃疗>: 回复 @加菲宝宝好饿啊 :是嘴上有颗痣,<正英必立liu>: 心凡    真清秀哦  不过把17岁时的照片翻出来吓人  不太好吧   衣服也选的非常赞  完美搭配  [舔屏],<兜兜爸爸39543>: 还是这样好，真实,<滑水陈>: 小清新啊[开心],<听闻王者李白贼帅>: 炉石传说好玩么？,<栺緊釦2016>: 肯定是老板娘的主意,<屋古里>: 素颜吗，挺漂亮啊,<库瓜chey>: 你这脸怎么一下子小了那么多啊,<在情歌球场唱情歌>: 敢不敢回复一下下[坏笑],<路上有几头牛>: 炉石，哈哈[开心],<尛傻屌>: 姐姐，我也不知道你有什么吸引我的，反正单纯的觉得你特别好，我可能表达也不太好，所以我真的挺喜欢你的，我会一直关注你！,<郑秀晶是zjy的老婆>: 素颜也很好看哦[嘻嘻][嘻嘻],<加菲宝宝好饿啊>: 嘴巴破了[悲伤],<疯帽Alice>: 晚上一点睡，中午一点吃…… 一种与邵同学不在一个国家的感觉有没有……？难道我是在国外？[二哈],<京学2010>: 美！谁不让你吃饭，削他！,<lee威尔泰>: 美的美的[羞嗒嗒],<朝霞一样>: 这个表情是何意，饿了吗,<哈提子>: 姐姐十年之后我一定娶你[亲亲],<杨锋PKU>: 你工作那么忙，吃点方便餐得了[嘻嘻],<boss水瓶座>: 咬自己啊！秀色可餐。]
1275402733	这个耳环带上原来是这个效果？临上台前用透明胶（没耳洞）急忙粘了一下就上了[太开心] ​​​	[<天空的蓝本>: 女人啊，[允悲],<pamw张>: 非诚一大亮点人物。,<Taoge13579>: 耳环和你气场不和啊,<劉灥淼>: 这个，还凑合吧[鲜花],<丘辰__秋之雨晨>: 看着像古代蒙古少数民族女人，但若这耳环若不是玉石的，那真是有损形象,<只想与你更接近16518>: @邵逸凡_已弃疗  这挺好啊  未来的他又可以少准备一金啦,<只想与你更接近16518>: 这脑袋瓜够灵光啊,<清新74589>: 我也没有耳洞，这一辈子也不打算打了，就在必要的时候打算粘了,<奋斗中的青年手写的从前>: 急中生智，6666666666666666[鼓掌][赞],<夢想不死所以掙扎>: 你不适合这种很大的耳环，应该戴那种精巧的,<死猪不怕6020941037>: 我在想，你走台的时候，一晃脑袋，掉了。。。男嘉宾是会把你刷哪去？多尴尬，,<小太狼-Hao>: 哈哈哈，其实我想忍住不笑，但是没办法，我怎么看上去，那个耳环像两个大纸片，哈哈，很搞笑。[哈哈][哈哈][哈哈],<滑水陈>: 哇，我发现这款特别适合你！[嘻嘻],<凯歌_威海>: 相亲道路还是很丰富多彩的[赞],<三青zbrhxl>: 我一直认为你很严谨  没想到你也会写错字[微笑][嘻嘻]   因为我是很容易  不严谨    总在怀疑自己  总是为什么会出小小差错[嘻嘻]   或许这就是不能有一点所谓成功的关键原因之一所在[哈哈],<在情歌球场唱情歌>: 怎么有点呆萌的感觉,<雪梨宝宝r>: 找男朋友按星座，水瓶双子适合你，射手狮子也行,<郑秀晶是zjy的老婆>: 666不过即使是粘上去的也看不出来……[哈哈][哈哈],<摩羯追梦2013>: 透明胶粘上[哈哈]女孩子竟然没有耳洞，我左耳还有两耳洞呢[允悲],<默默无闻的努>: 颜色，款式很有乡土气息[允悲],<深蓝201707>: 怎么看起来像铜钱,<陈峰804>: 透明胶能粘住那么大个和氏璧？,<lee威尔泰>: 这耳环咋这么眼熟[允悲],<天外飞仙超级boy>: 耳环大，显着脸小了,<SNH48-汪涵>: 回复 @邵逸凡_已弃疗 :通假字,<鉲怖奇诺言>: 很好看呦[可爱][可爱],<Gao海晨>: 姐姐 这不是笑笑姐之前带过的么,<鹰爪铁布猫>: 怎么可以这么丑…[摊手],<听说下雨天跟巧克力更配哦>: 那你很棒棒(⊙o⊙)哦,<新时代枢纽>: 又将是一波心动女神！,<血腥维也纳>: 回复 @血腥维也纳 :不知道你有没有钻石耳环，闪闪发光的那种。[微笑][微笑][微笑][阴险],<血腥维也纳>: 这两个耳环看起来像两个硬币，一共两块钱。我还是喜欢钻石耳环，闪闪发光的那种。[微笑][微笑][微笑],<方轩灵动>: 还是上一次的长直黑更好看,<朝霞一样>: 半夜三更不睡觉，，你爸知道不打你,<LCN下一站>: 有点夸张呀，还是个白色的,<正英必立liu>: 心凡以后我们去敲钟  你再就这样打扮  大方  洋气  时髦   俏丽  干练   [舔屏],<正英必立liu>: 这个造型真漂亮 越来越漂亮了 [舔屏],<1-埋埋>: 回复 @邵逸凡_已弃疗 :不是错字，是别字，,<唉______________________>: 回复 @邵逸凡_已弃疗 :[可爱]还没睡啊？,<邵逸凡_已弃疗>: 回复 @唉______________________ :俞艳脖子上,<唉______________________>: 大项链呢[doge],<请叫我奶茶妹妹朱泽天吼吼吼>: 回复 @邵逸凡_已弃疗 :其实还不错[doge]毕竟你美,<IM吕吉祥>: 最喜欢这位:知性  亲切 美丽 大方 学识渊博！,<邵逸凡_已弃疗>: 回复 @saber胖子 :是哦，瞬间显得我脸小了有没有？（并没有,<邵逸凡_已弃疗>: 回复 @请叫我奶茶妹妹朱泽天吼吼吼 :身体力行cos圆圆,<请叫我奶茶妹妹朱泽天吼吼吼>: [二哈][二哈][二哈]耳环颜色]
1275402733	我发表了头条文章:《也聊聊选专业》 也聊聊选专业 ​​​	[<呜啦啦丹>: 咨询是不是也没有想象的工资高啊。。。,<閲盡丗微>: 回复 @lee威尔泰 :我就喜欢日语 到最后干了软件开发 挨踢男 总不能拍日本电影吧  哈哈哈哈  你就觉得第一个你喜欢的  当然以后也有可能用他吃饭的专业  就挺好,<lee威尔泰>: 回复 @御姐控的明先生1 :我的兴趣比较广泛[笑cry]工科理科法学还有。。。。哲学里都有我喜欢的专业[二哈],<邵逸凡_已弃疗>: 回复 @御姐控的明先生1 :说的对,<merlindoo>: 关注了有用啊，帮你在网红的道路上越走越远[哈哈],<閲盡丗微>: 回复 @lee威尔泰 :选一个喜欢的专业就好  喜欢才会去钻研,<lee威尔泰>: 回复 @御姐控的明先生1 :哈哈哈哈哈明先生你好，昨天老师来家访，问我想选什么专业。我就引用了你的理论。我妈差点想拍死我。不过她后来觉得说的也对[允悲],<血腥维也纳>: 青竹蛇儿口~~黄蜂尾上针~~两者皆不毒~~最毒妇人心~~[微笑][微笑][微笑],<lee威尔泰>: 选专业[允悲][允悲][允悲][允悲][允悲]从高一选到高三毕业[喵喵]]
1275402733	趣味小知识：三句话不离鸡汤的往往文化程度比较低。 ​​​	[<邵逸凡_已弃疗>: 回复 @大圣小时候 :当场灭灯,<大圣小时候>: 哈哈，我感觉有男嘉宾这样说过[偷笑],<邵逸凡_已弃疗>: 回复 @芃荔芫 :想打人[并不简单],<SNH48-汪涵>: 好看的非诚女嘉宾千篇一律，有趣的东北高圆圆万里挑一。,<琪琪琪琪琪-爱大MM>: [偷笑][偷笑][偷笑]]
1275402733	来来，装个逼啊！ ​​​	[<笙临此处的>: 那个也是最贵的。劳斯莱斯。你真会选,<小太狼-Hao>: 回复 @血腥维也纳 :比我有钱多了，我身上不超过200。,<李拜天他爸>: 回复 @栺緊釦2016 :其实宾利的风格也差不多如此，穿着西装的暴徒[酷],<血腥维也纳>: 回复 @血腥维也纳 :黄色代表皇权~~我喜欢至高无上的皇权~~[阴险][阴险][阴险][哈哈][哈哈][哈哈],<栺緊釦2016>: 回复 @李拜天他爸 :文艺狂野范，文艺界里最狂野的，狂野界里最文艺的。,<血腥维也纳>: 我喜欢第一辆~~有8字的那辆车~~黄色的~~冬天给人以温暖的感觉~~[微笑][微笑][微笑],<包记保>: 外地出差，住员工宿舍，没有网线[泪]刚用流量看完了新一期的非诚勿扰[太开心][太开心][太开心],<许佳琪的哲哥哥>: 女神早点睡啊 你上条微博还劝人家早点睡呢？自己不早点睡[微笑]好好休息[爱你][爱你][爱你],<血腥维也纳>: 我买不起车~~我现在身上只有四百多块钱，是我的全部家产~~[微笑][微笑][微笑],<邵逸凡_已弃疗>: 回复 @相辅相诚 :哈？,<相辅相诚>: 女神，要买豪车了？,<李拜天他爸>: 有品味，我也会选左下角那辆……劳斯莱斯[二哈]]
1275402733	明天要上班。睡不着。 ​​​	[<PENGJIAYUE>: 回复 @邵逸凡_已弃疗 :我和你们有时差呀[doge],<邵逸凡_已弃疗>: 回复 @PENGJIAYUE :您不也没睡,<PENGJIAYUE>: 哇老姐这都几点了,<和平不平和>: 小姐姐早点睡呀~]
1275402733	开始看节目啦！一边看一边讨论怎么样？ ​​​	[<懒豬包邮Zzzz>: 回复 @邵逸凡_已弃疗 :不过还是很认同你往期节目中所表达的观点的，加油[加油],<与梦留影>: 看节目看入迷了没看手机，评论晚了。然后回答问题，你今晚说话了。[挤眼][挤眼],<邵逸凡_已弃疗>: 回复 @獨勝寒 :也的确不合适,<獨勝寒>: 回复 @飞鱼38375 :说道有孩子的时候，男嘉宾表情确实明显一变，眉头一皱。,<王卫Dick顺丰>: 回复 @邵逸凡_已弃疗 :说了五年或者十年不会要孩子[挤眼],<飞鱼38375>: 回复 @獨勝寒 :说到了有孩子，后面所有的都是客套而已.,<朝霞一样>: 回复 @邵逸凡_已弃疗 :越看越迷茫,<獨勝寒>: 我发现大多数男嘉宾在看到自己换掉的女生其实给自己留灯了之后都是一脸懵逼和生无可恋。新版规则改的真是有点……以前的版本无论如何感觉至少是在尽力促合，比较从容。新版改的则是过程充满悬念和惊悚，还有反转。是不是有点过渡追求节目的娱乐效果了呢？,<CAOCharles>: 结婚了到时候就想要孩子了，这动词很难说。,<朝霞一样>: 如果满大街都是邵逸凡就好了,<獨勝寒>: 回复 @摘星楼之楼主 :看凡凡的直播说过丁克也可以接受。我就是一丁克。,<朝霞一样>: 估计有点文艺的都会喜欢你,<獨勝寒>: 回复 @邵逸凡_已弃疗 :在这么短的时间突然上来一个从来没见过没有任何印象的女士，确实很难做出这么重大的决定。换做是我可能会说谢谢你，对不起。,<I_Love_Daisy>: 回复 @邵逸凡_已弃疗 :对了，吃的是什么啊没看清，是哈尔滨特产烤冷面么[允悲],<天外飞仙超级boy>: 回复 @邵逸凡_已弃疗 :女神居然回复我，美疯了！[挤眼][二哈],<是超然啊>: 第一个男嘉宾有拍到你几个镜头  欲言又止的样子,<邵逸凡_已弃疗>: 回复 @獨勝寒 :挺得体的,<邵逸凡_已弃疗>: 回复 @一个买车的 :没事儿我没注意我假装不知道哈～,<獨勝寒>: 3号男嘉宾拒绝的意味很明显了，表达的很绅士。,<邵逸凡_已弃疗>: 回复 @一个买车的 :哈？,<朝霞一样>: 昨天发了一条后悔的评论，,<邵逸凡_已弃疗>: 回复 @懒豬包邮Zzzz :是的。。,<邵逸凡_已弃疗>: 回复 @天外飞仙超级boy :祝早日来电。空调。,<邵逸凡_已弃疗>: 回复 @一个买车的 :哈？,<朝霞一样>: 感觉自己像个渣渣，看了邵逸凡的微博。,<天外飞仙超级boy>: 倒霉，下雨小区停电。今晚看不到你了。,<懒豬包邮Zzzz>: 哈哈，这期基本没怎么发言啊[污],<踢球小野鸡儿>: 网红了已然[允悲][允悲],<邵逸凡_已弃疗>: 回复 @我是你恒叔 :[哈哈],<邵逸凡_已弃疗>: 回复 @摘星楼之楼主 :坐着比站着累,<摘星楼之楼主>: 回复 @邵逸凡_已弃疗 :你这样录一天腿早该酸了吧，我看有些观众说他们录一期屁股坐的都发麻[悲伤],<我是你恒叔>: 回复 @邵逸凡_已弃疗 :哈哈哈 那个小动作特可爱。,<月落乌啼霜满天和门泊动物万里船>: 直播直播直播直播,<邵逸凡_已弃疗>: 回复 @我是你恒叔 :哈哈哈哈哈哈是的。灭了灯歇会儿[哈哈],<凯歌_威海>: 回复 @邵逸凡_已弃疗 :台下的女生好勇敢[赞],<我是你恒叔>: 回复 @邵逸凡_已弃疗 :尤其是那些有些不对劲的问题时候，然后咔嚓灭灯,<邵逸凡_已弃疗>: 回复 @摘星楼之楼主 :不合适吧～我。。不喜欢长得帅的好像唔,<郭军828>: 回复 @郭军828 :支持你[鼓掌][鼓掌][鼓掌],<邵逸凡_已弃疗>: 回复 @凯歌_威海 :哎是哦。,<邵逸凡_已弃疗>: 回复 @獨勝寒 :哈哈哈哈哈哈哈哈哈是的,<邵逸凡_已弃疗>: 回复 @我是你恒叔 :哎。我不敢直视我害怕,<邵逸凡_已弃疗>: 回复 @郭军828 :好的～,<郭军828>: 我也是辽宁的，凡姐姐,<獨勝寒>: 回复 @邵逸凡_已弃疗 :华数有时候不灵，我今天用的是网页的卫视直播。,<我是你恒叔>: [喵喵]你每次当男嘉宾回答某些问题时候，总会偏着头微仰头眨眼,<獨勝寒>: 一号男嘉宾可以简单概括为“弃疗”。,<凯歌_威海>: 回复 @邵逸凡_已弃疗 :你还问了一见钟情的问题，你的灯已经灭了,<摘星楼之楼主>: 回复 @邵逸凡_已弃疗 :哈尔滨的这个你没看上嘛？,<凯歌_威海>: 回复 @邵逸凡_已弃疗 :微博互相关注吧,<邵逸凡_已弃疗>: 图片评论  http://t.cn/R9CkHph,<邵逸凡_已弃疗>: 回复 @凯歌_威海 :哈哈哈哈哈哈哈好,<凯歌_威海>: 回复 @邵逸凡_已弃疗 :你也是东北的，我说颜值怎么这么高[可爱]我齐齐哈尔的,<Hgx小小贤>: 没有电视看，明天去看你,<邵逸凡_已弃疗>: 回复 @凯歌_威海 :东北老乡啊！,<凯歌_威海>: 回复 @邵逸凡_已弃疗 :哈尔滨的小伙一出来，看你特别兴奋啊。,<Mr丶唯58066>: 回复 @邵逸凡_已弃疗 :哈哈[笑cry]对对,<邵逸凡_已弃疗>: 回复 @陈C-S胜 :[悲伤]]
1275402733	我的公主号。。。[衰] ​​​	[<邵逸凡_已弃疗>: 回复 @马盼IVY :谁说我乐在其中的！,<晨东_已弃疗>: 这个头像应该叫 假如生活有了活力,<风筝之释>: 嫌弃聊公众号[汗],<马盼_>: 天了个噜 我也不道为啥就关注了你 毕竟我喜欢男孩子 大概是因为你身上的热爱(天呢表白小姐姐好羞射 希望同为四大[狗]的我几个月后也能跟你一样 加班还酱乐在其中[doge],<YingGH_Alan>: 当繁华落尽，洗尽铅华，那个依然对你如痴如醉，相依相伴的，就不妨考虑一下吧～,<踢球小野鸡儿>: 弃疗日记[汗][汗]，有空发吗[哼][哼],<田安迪TAD>: 这个是微笑号吗[微笑],<凯歌_威海>: @邵逸凡_已弃疗   以关注,<用户6221618984>: 已加已加，多更新哦,<Mr丶唯58066>: 什么，是微信号吗,<滑水陈>: 哈哈，生活充满了活力！[嘻嘻][嘻嘻][嘻嘻],<飞鱼38375>: 卧槽，毛都没有饿]
