1275402733	铁岭罗玉凤无疑了 ​​​	[<三青zbrhxl>: [微笑][嘻嘻]你不会被同性相吸了吧[哈哈][微笑][挤眼],<小太狼-Hao>: 回复 @wangh160 :这个话题比较有趣，不过比较敏感。工业革命开始，中产阶级就产生，但是直到黑格尔时期，就比较有趣，黑格尔之后产生了现在的左派和右派，左派的代表马克思和右派的代表尼采。中产阶级长期被压制，后来有人受不了。一些上去成为上层阶级，一些下去领导无产阶级革命。俄国的列宁，中国的毛，周，邓[嘻嘻],<joke要加油916>: 话说，你上班都不用 @邵逸凡_已弃疗   穿高跟鞋就穿这种平底凉鞋啊[疑问][疑问]PS:你穿的可是真丝衬衫啊，没感觉到违和感吗[允悲][允悲][允悲][允悲],<会错意了嘛>: 想说你的笑容好甜 我看着,<wangh160>: 回复 @小太狼-Hao :父母是农民，我从小就被教育要脱离这个阶层，当接触到其他阶层时感觉不适合，所以要做自己！,<花开半夏英落北坡>: 你在偷看人家裙底！！！,<wangh160>: 回复 @小太狼-Hao :主要靠能力！,<wangh160>: 回复 @小太狼-Hao :现在哪还有无产阶级啊！,<wangh160>: 回复 @小太狼-Hao :哈哈，我不想站队，只想做自己！,<清风徐来小郎君>: 怎么说也得是个王熙凤[太开心][太开心],<小太狼-Hao>: 回复 @wangh160 :我不能说我是无产阶级，我也确实是底层阶级，底层阶级又可以称为群众阶级。其实正确来说，在世界上，没有那个阶级是真正好过的。你只能选择一个阶级，获得那个阶级的力量，然后付出应有的代价。就算是上层阶级，但是依然要付出代价的。这个不能详细说。你能不能做到上层阶级主要靠，你有没有那个信仰。,<徐永超68028>: 回复 @邵逸凡_已弃疗 :姐姐，我村里的,<wangh160>: 回复 @小太狼-Hao :底层表示我也不想夹你啊，奈何你拼命往上爬，现在还没爬上去！好无辜啊！,<没落ml>: 两位姑娘，太不住重形象了吧,<小太狼-Hao>: 回复 @Cc丶刘刘刘刘刘刘刘忻 :周星驰的“我是一个演员。”,<小太狼-Hao>: 回复 @无聊逛逛369 :其实你高估了大型外企和咨询行业了。我本科是不入流学校毕业的。有个女同学毕业去了英国，回来之后去了，深圳的房地产咨询五大行。和邵逸凡工资，工作时间和环境一样。但是依然不能在福田买房和别墅。邵逸凡已经是中产阶级了，但是还是被上层阶级和底层阶级夹在中间。一样不好过。[微笑][微笑][微笑],<在情歌球场唱情歌>: 憋不住了么[二哈],<清晨的翅膀qcdcb>: 象邻家女孩[并不简单]，是换下了行政装准备下班吗,<Mr狮子王>: 这是凤姐被夸得最美的一次,<阿甘Rod>: 回复 @邵逸凡_已弃疗 :你得去象牙山村寻找真爱,<不再年轻的兔子0_0>: 在段子手的道路上一去不复返[污][污][污],<微山湖的石头>: 回复 @邵逸凡_已弃疗 :[笑cry][笑cry],<风筝之释>: 我可以说还真像么[污],<离家的少侠ww>: 回复 @邵逸凡_已弃疗 :你老板该减肥了[笑cry],<紫罗兰花正传>: 凤姐，我也是铁岭的。。。。。。,<无聊逛逛369>: 回复 @星月传奇3125068271 :相比她 凡凡太少滋润了,<詹笨笨周叶萍>: 嫁给我嫁给我[泪],<boss水瓶座>: 凤姐没这么瘦[doge],<邵逸凡_已弃疗>: 回复 @阿甘Rod :期待一场乡村爱情,<小窝里的流浪猫>: 恩，好办法，不容易摔跤，摔了也不痛！……,<星月传奇3125068271>: 回复 @邵逸凡_已弃疗 :三年内，你会取代她的位置。,<冰山真的不喜欢阳光>: 你不用面子的吗哈哈哈哈哈哈[喵喵],<阿甘Rod>: 为啥老说你是铁岭的,<无聊逛逛369>: 跪得偏了点[嘻嘻][嘻嘻],<西安富昌机电科技有限公司>: 侧颜貌似凤姐[嘻嘻],<无聊逛逛369>: 非诚上 人是你最好，穿衣上是台湾妹子和美国妹子比较好。,<旧时光am>: 哎呦，裙底风光无限呀，凡姐[doge],<人影散乱着>: 哈哈哈哈哈哈原谅我不厚道地笑了 有点像诶哈哈哈,<邵逸凡_已弃疗>: 回复 @无聊逛逛369 :！我的真丝衬衫很美丽哒！,<无聊逛逛369>: 衣服打扮和你身份不符啊，你现在手里拿块布我一定以为你是清洁女工。[弱][弱][弱],<追风少年哲特姆>: 哈哈哈 你好 我是营口吴亦凡[并不简单],<韓小愚儿>: 都这样了还是很美[doge],<邵逸凡_已弃疗>: 回复 @星月传奇3125068271 :我老板！,<杨锋PKU>: 真会自嘲[偷笑],<ZGM钟立华>: 若无其事地偷看裙底，一本正经地玩着手机,<星月传奇3125068271>: 右边这个人是谁啊？,<柳名城_181_可丁克>: 自黑也是萌萌哒～,<Cc丶刘刘刘刘刘刘刘忻>: 一个演员的自我修养[笑而不语],<Mr丶唯58066>: 这种操作，很稳[笑哈哈],<迪_UPC>: 自黑这么逗的嘛？,<长用想>: 这张图亮点多多啊,<BOBO_3k>: 论自黑，你赢了……[doge],<清风徐来小郎君>: 自黑也是绝了，哈哈哈[允悲][允悲]]
1275402733	谁能教教我怎样才能不患得患失？ ​​​	[<邵逸凡_已弃疗>: 回复 @清晨的翅膀qcdcb :不给看,<掘港里奥>: 现在姐姐真的已经算是要直播一条道走到黑了,<长用想>: 今天晚上聊什么 @邵逸凡_已弃疗,<清晨的翅膀qcdcb>: 今晚还是跳舞吗，录个视频吧，想看,<徐永超68028>: 给我们粉丝团起个名字吧,<勇闯天涯PSBC>: 最近不加班赶PPT啦？,<刘涛lsy>: 求翻牌[爱你][爱你]爱你[爱心] 么么哒,<徐永超68028>: 姐姐姐姐，我们爱你[爱心] [爱心] [爱心]]
1275402733	谁能教教我怎样才能不患得患失？ ​​​	[<笙临此处的>: @邵逸凡_已弃疗   凡姐。我觉得你直播的时候有的不需要评论。就拿郭敬明的同性恋那都是网友千奇百怪猜测。真实的事情大家都不清楚。还有就是你直播的时候说话没有条理。看见什么就说什么。听得很模糊。也许是我的智力问题。或许你工作太忙导致的。个人建议。仅供参考。,<清晨的翅膀qcdcb>: 有舍才有得，所以这个案件不存在,<炫雨冰仙>: 从未拥有过，也没有失去什么,<弓长王耑>: 回复 @小太狼-Hao :生活融入佛经，佛经也融入生活。,<Young_21834>: 今晚什么时候直播 @邵逸凡_已弃疗,<明明可以靠脸吃饭偏做二手程序猿>: 无欲无求就可以做到不患得患失,<石璇best>: 4 没有必要去羡慕别人的人生，耕织好自家那一亩三分地就好。,<石璇best>: 1 把目光放长远，关注未来多于关注当下。 2 把注意力多放在自己身上，聚焦自己的成长。 3 允许自己的人生有一定的容错率。 暂时就这么多，一点拙见。,<人在1989>: 内心太敏感…让你自己强大，强大到在你的生活圈子里数三数四，再找个能相互扶持的伴侣,<西安富昌机电科技有限公司>: 建议辞职做非主流网红！,<米米就是米>: 回复 @sbzjsksbduebdbs :这确实是个好问题。关键在于就事论事，酌情分析,<刘恒进autumn>: 每当我烦恼的时候，照照镜子，看到这么帅的脸庞，一切浮云都散去了。,<小强_17622>: 小姐姐你在河北参加高考什么意思啊？,<在情歌球场唱情歌>: 来来来 晚上开直播 我们教教你 [坏笑],<OMG_10>: 回复 @小太狼-Hao :您是学哲学的么 受教了,<淡定明白>: 放弃欲望，就不会患得患失,<黄燕宏123456>: 珍惜拥有，知足常乐。,<三青zbrhxl>: 我好奇  你怎么会问这个问题[微笑],<三青zbrhxl>: 回复 @小太狼-Hao :本来无一物  何处惹尘埃    牛牛牛   这他娘的什么境界啊[祈祷][祈祷][祈祷],<ZGM钟立华>: 看破红尘，削发为尼 @邵逸凡_已弃疗,<夜---假面>: 不要太在意某些人某些事         毕竟能陪你灵魂的只有自己的肉身,<淘米零>: 话说，您不考CPA吗？快考试了，您还有时间晚上加完班直播[嘻嘻],<没落ml>: 不知道妳具体是什么情况，最好问心理医生,<江河大海-x>: 只有得到了才不会患得，只有未失去才不会患失。所以法门应当就是拥有。,<仰望星空下的蚂蚁>: 只要努力前进，并不断微调努力方向。每个阶段都会有得到该得到的，失去该失去的,<小太狼-Hao>: 回复 @弓长王耑 :禅语虽短，但是非常深奥，没有经过最艰苦的努力，恐怕做不到。拿爱情来说，我现在给你“爱”，你就感觉到被“爱”。这是不可能的。就像，你不能说，我看到磁场在那里跑。所以，我相信邵逸凡没有那个时间和心力做出这样的修行。禅宗那么多年，能真正顿悟的也就慧能一个。有“经”的，只有《坛经》一本。,<爱流口水的千里马>: 想太多了而已[doge][doge],<Evael--彬哥哥>: 得之坦然 失之淡然 顺其自然 争其必然 就这十六个字吧[心][心][心],<弓长王耑>: 佛家禅语:“春有百花秋有月，夏有凉风冬有雪。若无闲事心头挂，便是人间好时节。”这是宋朝无门慧开的作品，意即“平常心是道”。,<pamw张>: 凡事量力而行，随遇而安。,<小太狼-Hao>: 回复 @OMG_10 :一般说，工作岗位的产生，原因在于社会分工的明细。人为了活下去，而从事工作。工作本身不太可能让自己能持续成长。重点是持续。有的人工作得很有意义。那是因为他或她把工作和个人的价值，追求，使命和内心的召唤联系在一起。不断深层次的思考自己的人生。所以工作让邵感觉不到成长。那她如何理解成长,<无聊逛逛369>: 参考凯利公式 下25%仓位[嘻嘻][嘻嘻][嘻嘻],<旧时光am>: 不以物喜，不以己悲[doge],<张熙在不断反思>: 失去一切，也就不患得患失了。对未来悲观一些。,<用户6065953234>: 知道自己想要什么坚定自己的想要的，任何的事情都影响不了你,<小太狼-Hao>: 回复 @sbzjsksbduebdbs :这是个好问题。[微笑][微笑][微笑],<有梦想吗少年>: 竟然还有时间患得患失,<用户5308556961>: 前提是你分清楚那个着急重要，然后坚持走下去。,<小太狼-Hao>: 回复 @芃荔芫 :没有希望？前提是她还能不能活下去呢？[嘻嘻][嘻嘻][嘻嘻],<黑四六汉子ovo>: 那当然是 去吃啊 没有什么是吃解决不了的 一口吞一个大象[doge],<c-沐逾>: 专注！就像我喜欢你一样专注！[允悲][允悲],<a皮雅士>: @a皮雅士 : 不是弃疗了吗？还眼大肚子小，贪多嚼不烂吧？既想谈个好项目，又想选头如意嘉宾，满天飞还非诚、开直播，更不放过跨墙、5块缝衣、变现，恨不能[章鱼]吧！那得学学超人：罗杰斯边上跑步机边看新闻，撒切尔首相、川普一天睡四小时。你铁人三项高手？,<小太狼-Hao>: 对于患得患失，我更喜欢你这个微博的图片。哈哈。爬在那里。[哈哈][哈哈][哈哈],<小太狼-Hao>: 这个不好回答，回答得好，被认为是鸡汤，回得不好，也没有效果。难啊。难。[哈哈][哈哈][哈哈],<J_BIN>: 我们本来就是一无所有来到这个世界上的,<OMG_10>: 这么一来，患得患失好像就是能够帮助你成长的东西了吧，不太会表达，只是目前来说我觉得你的生活很充实必然也有很多人羡慕。所以患得患失的时候就想想我们吧，虽然并不认识，但知道在遥远的陌生的城市，有很多的人在为了你的患得患失而担心你可能也就会好过一点吧。祝好。,<魔小纯>: 晚上早点睡[酷],<轩照不明>: 不买彩票，买彩票中了五百万很高兴，患得，后来交税交了之后只剩四百多万，那就是患失一百多万,<OMG_10>: 前阵子我心情也蛮不好的，还是看了你的直播我才慢慢想一些事情才慢慢好起来，这个世界总有更大的美好让我们走下去吧。我的闺蜜名字里有个“舒”字。你必须舍弃一些东西上帝才会给予你你想要的生活。,<OMG_10>: 其实就像你的工作，换了又换总是想尝试新的东西。你自己也说 ，当这份工作无法再让你成长的时候就觉得即使自己擅长也没有做下去的意义了。这样很好啊不是么起码我觉得很好。人就是要尝试各种啊，反正年轻。所以我觉得患得患失虽不是褒义词但也不见得是贬义词，主要看你怎么活。,<手揣裤兜寂寞谁懂2015>: 有得必有失  得与失是相对的,<sbzjsksbduebdbs>: 是什么方面的失与得？,<半面留残生>: 失去的都不是自己的，得到的是自己应得。,<W先生6333288701>: 大家都这样，怎么教,<草革之湘>: 我也不知道，不过你哪天学会了顺便也教教我吧[可怜][可怜][可怜],<肩担日月携昆仑_86733>: 菩提本无树，明镜亦非台。本来无一物，何处惹尘埃。姑娘苦海无涯，回头是岸。先从正常的生活规律开始吧！,<雪梨宝宝r>: 我就是天秤座，严重患得患失]
1275402733	最近记性不大好，大概我晚上睡的不是记忆枕，是失忆枕 ​​​	[<Miric_x>: 可能是梦中的男朋友又在捣蛋了~[允悲],<大大的雪年>: 这么多人点赞……[斜眼][斜眼][斜眼],<Happy张文哲>: 看下周预告你好像进入終选区了啊，有没有牵手成功啊[嘻嘻],<邵逸凡_已弃疗>: 回复 @在情歌球场唱情歌 :然鹅发完这条掉了一个粉,<在情歌球场唱情歌>: 哈哈哈哈 好可爱的性格,<邵逸凡_已弃疗>: 回复 @c-沐逾 :。。。可以,<邵逸凡_已弃疗>: 回复 @hgfjuju_990 :所以进脑子里了吗[笑cry],<没落ml>: 失忆也挺好，有些记忆 失去没烦恼,<张伟18260498719>: 你是在搞逗嘛[偷笑][偷笑]]
1275402733	根本不想起床。 ​​​	[<京学2010>: 那就别起来了！终于-终于明白了，原来你不想和随讲话，就回复一个字，朕很生气！,<chasel哈哈哈>: 刚起，楼下一会见！,<刘涛lsy>: 私信可以回吗?女神姐姐[心][心][憧憬][可怜],<leonard_cohen_cn>: 我看了两个小时图咋不动呢…,<坚毅岩石>: 这是放假的节奏。,<勇敢的心F>: 不上班么[思考]？]
1275402733	晚上八点半聊怎么背单词吧。。#星期小情绪# ​​​	[<李长鹏大姐>: 可以的，我最近正在背单词,<是超然啊>: 昨晚的直播视频删了吗?,<大悦悦爱撒娇>: 学生党的福利吗[微笑],<菠菜小庄园>: 聊上非诚勿扰的感受吧[笑cry][笑cry][哈哈][哈哈][哈哈][哈哈][哈哈][哈哈][哈哈][哈哈][哈哈][哈哈],<飞鱼38375>: 你小学就开始背单词去？,<请叫我奶茶妹妹朱泽天吼吼吼>: [笑cry][笑cry]背单词,<创星若诗>: 好好，在线只等你,<黑四六汉子ovo>: 回复 @黑四六汉子ovo :没有WIFI的搬砖工 今夜开流量等你[二哈],<Nove_mbe>: 女神你的词汇量有多少[doge],<MBW117>: [污][污][污]好呀,<黑四六汉子ovo>: 好哦 准时等你哦(´-ω-`),<飞鱼38375>: 你小学就开始背单词？]
1275402733	要不然我。。重操旧业继续教英语好了。。。 ​​​	[<没落ml>: 英语不如日语容易,<方轩灵动>: 回复 @保罗-亚特兰蒂尼 :[赞],<旅行家Steven>: 每次去国外的时候才知道英语是多么的重要，当场发誓回国一定要练好口语，结果回来恶补三天，有时候恶补四天，等我把英语练的像你德语那么6就好了，给我加油吧加油,<leonard_cohen_cn>: 我要跟女神学外语[doge],<邵逸凡_已弃疗>: 回复 @保罗-亚特兰蒂尼 :哈哈哈哈哈哈哈。,<保罗-亚特兰蒂尼>: 图片评论  http://t.cn/RC7rOci,<湖湘股侠>: 你可以搞个英语直播[允悲],<普遍精进>: 学语言最好的方法叫男女朋友，不谢,<粉可可粉ko>: 报名[emoji],<话癌_超>: 要报名要报名[小黄人剪刀手],<大大的雪年>: 按顺序站队啊，后面的童鞋不许插队……,<远方在哪08>: 回复 @远方在哪08 :还有就是如今四六级证书对一般的工科学生找工作影响大吗？女神,<风筝之释>: 逸凡baby，你回答得好尽心。还问目的[笑而不语],<栺緊釦2016>: 英语圈舞蹈最美的，舞蹈圈音乐最好的，音乐圈英语最棒的。,<小窝里的流浪猫>: 回复 @merlindoo :基本是男生，[色][色][色],<栺緊釦2016>: 你可以去中国好声音,<画一席苍茫>: 我也想报个培训班，考个英语的证[笑cry],<merlindoo>: 你教肯定学员爆满的。]
1275402733	emmmmmmmm ​​​	[<赵宽666>: 回复 @保罗-亚特兰蒂尼 :…不得不吐槽一回,<鹰爪铁布猫>: 好大只[doge][doge][doge],<Bridgette昕>: 居然养的金毛🙊[好喜欢]我最喜欢的狗狗就是金毛,<默默无闻的努>: 快让他加我加我，我也在沈阳，也做市场，也要去国外读书[哈哈][互粉],<挑食阿姨>: 有灵气的小姐姐  笑起来眉眼弯弯好美丽  而且姐姐你还这么优秀    喜欢你和那个美国小姐姐   哈哈哈哈[允悲][心][心][心],<毛洪友也是毛旭啊>: 我觉得你和你司金鑫松还挺配的[笑而不语],<LCN下一站>: 不知道小姐姐是不是又在熬夜工作呢,<舒乔lenmon>: 普华永道[太开心],<trulymadlydeeply->: 狗子表情好傲娇[doge],<邵逸凡_已弃疗>: 回复 @保罗-亚特兰蒂尼 :打你,<邵逸凡_已弃疗>: 回复 @奥特曼雁渡寒潭77 :太可怕了,<MOYO颜夕>: 哈哈，周毛翩翩哪去了[笑cry][笑cry][笑cry],<轩照不明>: 甜美的笑，散发知性的魅力，修养就高，就是女神，可是我才19，要不然我就把你变成我的女朋友,<188天赐>: 女汉子[太开心],<王亚鹏Vv>: 女神，当之无愧[鲜花],<保罗-亚特兰蒂尼>: 回复 @邵逸凡_已弃疗 :原谅他吧，看照片记一遍，素颜来了记一遍，化了妆还要记一遍人家也不容易,<话癌_超>: 可以抱这条狗狗[二哈]试一下[偷笑],<只想与你更接近16518>: 女神  我想问下非诚勿扰最新一期怎么看不了啊,<邵逸凡_已弃疗>: 回复 @保罗-亚特兰蒂尼 :您分不清人还不分不清狗吗！！！有次张白菜把我叫出来说了半天话，我“你是找魏菡宁吧？”他：“那你是谁？”,<nekooz>: 哈哈哈哈哈哈哈哈我还想了一下你有抱狗嘛[喵喵],<湖湘股侠>: 表示很逗[允悲],<保罗-亚特兰蒂尼>: 你好，周毛翩翩[握手],<杨笑杨的正反世界>: 哈哈哈哈哈 抱狗那个好几期都没来了吧,<听闻王者李白贼帅>: 天啦噜，狗狗好可爱[二哈][二哈][doge],<ZZW小可爱啊>: 改版后第一次看到你就莫名喜欢你 然后觉得你的名字也挺好听的,<邱兰琨qlk>: 有周若的微信嘛[微笑][微笑],<liverpool2012>: 温婉可人，贤淑端庄，秀外慧中。抱歉，我词穷了，至于说你才貌双全之类的，版权早就已经不是我的了。,<我是令狐11>: 哈哈哈 印象比较深的有许思雨 许子萱,<栺緊釦2016>: 告诉我狗狗的名字,<哆啦A梦的纸牌屋>: 竟然被翻牌了妈呀[憧憬][憧憬][憧憬][憧憬][憧憬]感觉比中了彩票还要激动,<Lesliex___>: 耿直girl[笑cry]还要发照片证明自己没带[狗],<我是令狐11>: 哈哈哈 忘记抱狗谁了，印象深的就是许思雨、许子萱,<BOBO_3k>: 抱狗那个是好像是周毛翩翩[doge],<没落ml>: 印象挺好的，觉得妳名字很中性,<人影散乱着>: 我还在努力回想 抱狗的女嘉宾是哪一个[允悲],<Zz匿名zZ>: [允悲][允悲],<张伟18260498719>: 回复 @邵逸凡_已弃疗 :看我私信 好嘛,<邵逸凡_已弃疗>: 回复 @方轩灵动 :哈哈哈哈哈,<邵逸凡_已弃疗>: 回复 @用户5507038544 :偷笑  http://t.cn/RVTiXdX,<yahanwo>: 女神素颜也好美[good],<邵逸凡_已弃疗>: 回复 @用户5507038544 :沙发]
1275402733	刚在床上按死一只蟑螂 ​​​	[<窟窿冬儿>: 回复 @邵逸凡_已弃疗 :没有想到小姐姐会亲自回复我。。开心[可爱]  上期的节目也看了，我个人认为是这样，我会送女孩子喜欢的，或者需要的，当然是在我能力范围内的，比如她要求要别墅，显然当前我没有，但是我会记着，直到有一天兑现诺言，只是这一天也许会是10年后，折纸鹤是心意，但是略显幼稚，毕竟不再是懵懂的岁月了,<窟窿冬儿>: 回复 @ZGM钟立华 :蟑螂是卵生的，雌虫排卵前，在腹部先形成黄褐色的卵鞘，卵鞘里包着几十粒卵。卵鞘产出后，雌虫害怕其他东西吃掉或伤害，仍然会把卵鞘粘连在腹部末端，卵在卵鞘里发育，你把大蟑螂踩死后，卵鞘里的小蟑螂并没有死，因为它们太小了，之后从卵鞘里出来快速成长，变成一个个大蟑螂。所以叫踩不死的小强。,<ZGM钟立华>: 回复 @窟窿冬儿 :有何依据吗？我踩死了很多蟑螂，但还是很多，感觉跟之前差不多,<小神仙的微博>: 我都不敢，男生也害怕小强,<兜兜爸爸39543>: 康复新液，就是蟑螂提取的,<Gentleman_Zhang>: 拜耳公司有一种药，可以永久免小强骚扰，你可以上淘宝上搜一下 @邵逸凡_已弃疗,<你球都不懂>: 赶跑就好呀，按死汁液都在床上了[笑cry],<__振磊>: 小强最终败给了你,<hn0746>: 小强，你死得好惨啊！,<邵逸凡_已弃疗>: 回复 @斯维夫达斯 :按的很优雅,<天空的蓝本>: [允悲]，厉害了，,<蚂蚁de的梦想>: 经科学验证，屋里出现一直蟑螂，就会隐藏1000只小强[嘻嘻]，害怕了吧[允悲],<指派琉璃>: 先拍照再按死[微笑],<我是令狐11>: 弄死了小强 星爷会不高兴的,<手机用户2889957283>: 感觉你说话你真的很有学识 同时也很接地气 爱你[鼓掌],<丶往事只能回味丿>: 抓住后冲马桶里 活生生的冲进去 [二哈],<不再年轻的兔子0_0>: 小强爬行速度很快的，而且长得确实丑，由此得出一个结论，就是你的敏捷属性很高，力量属性也不错，精神属性爆表。美女，是时候换工作了，去转职成弓箭手吧[坏笑][坏笑][坏笑],<勇闯天涯PSBC>: 回复 @邵逸凡_已弃疗 :火烧,<三青zbrhxl>: 回复 @邵逸凡_已弃疗 :又一次  见到你用这个男生喜欢用的词[微笑][嘻嘻][哈哈],<微微一笑雷小勇>: 回复 @邵逸凡_已弃疗 :私信,<邵逸凡_已弃疗>: 回复 @木卯木登 :犷,<邵逸凡_已弃疗>: 回复 @窟窿冬儿 :卧槽，那怎么办,<小熊04079>: 你很恶心，看你就感到特烦,<窟窿冬儿>: 蟑螂不能按死的，会产生好多的小蟑螂。。,<木卯木登>: 好粗狂的画风……,<正英必立liu>: 嘻嘻  嘎哈呢   这么晚才睡   [心],<正英必立liu>: 回复 @芦荻一一风荷举 :我也是4点多才看完的  哈哈哈,<正英必立liu>: 回复 @天涯丿客 :南方的现在也有很小的   还跑的特别的快,<正英必立liu>: 回复 @邵逸凡_已弃疗 :4点半还没睡  8点半就起床了   姑娘  你真是一条好汉   [good],<飞鱼38375>: 小强，你死的好惨啊.,<_LLyip>: 你把我相依为命多年的小强拍死了，小强啊……,<小窝里的流浪猫>: 刚看完昨晚的非诚，在打瞌睡[哈欠],<最钟情无艳>: 不小心拍死了自己的宠物？[doge],<笙临此处的>: 小强被你打死了。哈哈,<修车的薛家BOY>: 只能看着你，俺喜欢你，但不能做什么，默默的祝福吧[泪][泪][泪][泪]，我还没见过蟑螂呢，是小强吧,<混吃等死爱汉子>: 死在你的床上也算死而无憾了，血赚[doge][doge][doge],<马超_China>: 陪你睡了一个夏天，你竟如此残忍[二哈][二哈][二哈][二哈],<願無嵗月可迴頭1999>: 很好奇你的睡觉环境,<学生___张仕伟Introvert>: 你还敢睡吗？ @邵逸凡_已弃疗,<陈C-S胜>: 你房邋遢[允悲],<Francis冬冬>: 小强，明年的今日是你的忌日。。,<晚秋马里奥>: 是吗，我可怜的同胞！,<何基雄_已弃疗>: 拍死就像她拍死一只蚂蚁一样,<蓝天白云下的黑骏马>: 我留言你总不回复我，我就像那蟑螂一样惹人生怜…,<小二黑黑小二黑>: 蟑螂要烧死 按死的话会产卵,<鹰爪铁布猫>: WC[喵喵][喵喵]好生猛[doge][doge][doge],<郑秀晶是zjy的老婆>: 女英雄！如果蟑螂在我床上我立马把它踢下床[嘻嘻][嘻嘻],<冰冷清风L>: 女孩纸不是怕蟑螂嘛？,<话癌_超>: 回复 @雪梨宝宝r :北方有蟑螂，我就是北方人,<天珠78804>: ，女神还有女汉子一面,<凉薄少年倾我心丶>: 你咋不上天呢[挖鼻]  胆大包天，不是吓得直接蹦上天，而直接弄死了,<申岩啊天呐>: 睡了一晚[笑cry]]
