1275402733	微博突然不能评论了？ ​​​	[<鹏鹏鹏鹏丽>: 不是说要早点睡的吗[允悲][允悲][允悲],<邵逸凡_已弃疗>: 回复 @此车非彼车 :你太幸运了！我刚刚删掉,<此车非彼车>: 12点才回到家现在才刚看完你的直播我对你的爱是真的 @邵逸凡_已弃疗,<张熙在不断反思>: 来来来我的微博下面试试能不能评论。,<袁帥MAJ>: 能否评论是由每个用户独立设置的,<邵逸凡_已弃疗>: 回复 @大脸盘子呀y : @未忍斋  人家为啥可以]
1275402733	今天10点播？ ​​​	[<被月哥所倾>: 回复 @长用想 :其实那首by my side是我点的。,<摩羯大磊先生008>: 自己在非诚勿扰看见你以后，就无法自拔了,<被月哥所倾>: 回复 @长用想 :哈哈哈，谁让我试活跃粉呢,<被月哥所倾>: 回复 @长用想 :啊，是吗。还有，问一下怎样在微博上看直播啊？,<长用想>: 回复 @被月哥所倾 :不对，微博上也很活跃,<wsy_sober>: 可以我读书看不了，愿明天直播[挤眼],<王小琲2011>: 回复 @王小琲2011 :或者更早点也ok，照顾一下早睡早起的群众[可爱][可爱],<王小琲2011>: 我们10点见，开个人演唱会吧,<wangh160>: 回复 @邵逸凡_已弃疗 :看来他喜欢听你唱歌[卡拉ok]！,<奔跑向前走>: 好的 终于今天晚上不忙 可以看逸凡姐的直播了[耶][耶],<长用想>: 回复 @被月哥所倾 :直播上很活跃啊,<被月哥所倾>: 可以呀[心][心],<被月哥所倾>: 微博怎么看直播啊？？？？,<被月哥所倾>: 回复 @Mr狮子王 :哈哈哈哈哈，傻,<被月哥所倾>: 回复 @长用想 :我在Yi直播上叫:我女神叫邵逸凡,<元气惠袁GZ>: 嗯。。10点播可以 聊着聊着你就嗨了[二哈]然后1，2点我就还能看见你在活动[二哈][二哈],<长用想>: 回复 @邵逸凡_已弃疗 :晚上可以唱《祝福》吗？你分享的安可送别你那个视频里最后那段太好听了…  还有毛不易的《像我这样的人》也特别想听你唱是什么感觉,<鉲怖奇诺言>: 凡凡姐，就会弹吉他吗？,<joke要加油916>: 是要聊单身税吗[允悲][允悲] @邵逸凡_已弃疗,<ZGM钟立华>: 是的，记得看我直播哦,<柳名城_181_可丁克>: 回复 @国旗杆下的笃定 :估计半小时掉粉5万。。。,<柳名城_181_可丁克>: 你的场子，听你的～,<不平坦的河床>: 你确定？有话题？,<Localsmile_limiter>: 回复 @邵逸凡_已弃疗 :现在播也可以，一小时，八点半[嘻嘻],<Localsmile_limiter>: 可惜没时间看[哈哈],<梦之缘3399>: 聊聊你为什么长的这么美,<无聊逛逛369>: 谢谢凡凡的肚子[good][good][good],<同心6361419462>: 回复 @邵逸凡_已弃疗 :那就边吃边想 @邵逸凡_已弃疗,<邵逸凡_已弃疗>: 回复 @同心6361419462 :没想好,<同心6361419462>: 凡姐，晚上聊什么话题？,<邵逸凡_已弃疗>: 回复 @未忍斋 :不知道,<国旗杆下的笃定>: 来个全英文的体验一下会是什么赶脚[笑而不语],<金叶子20170929>: 回复 @长用想 :困的话可以再早点！,<金叶子20170929>: 太好了，可以早半个小时睡觉了！为你点赞！,<feijianruhong>: 绝对支持，越早越好！,<upsoar>: 等姐姐你[小黄人剪刀手],<长用想>: 回复 @邵逸凡_已弃疗 :这个理由充分，支持,<邵逸凡_已弃疗>: 回复 @Mr狮子王 :。。,<邵逸凡_已弃疗>: 回复 @长用想 :我困,<用户6346269883>: 回复 @邵逸凡_已弃疗 :好 姐姐 一定去看[挤眼],<长用想>: 怎么突然提前了呢,<咱们小吴>: 好，明天六点看回放,<天涯海边人>: 支持晚上10点播,<魔俪懵智>: 给你一百个赞[赞][赞][赞][赞],<回忆却短>: 啊啊啊。我终于等到了你，就自从在非诚上见到你，我就不志念念不忘。,<Mr狮子王>: 好，10：30准时收看,<黑子雄>: 回复 @邵逸凡_已弃疗 :怎么直播啊，我还不知道微博可以直播呢,<邵逸凡_已弃疗>: 回复 @黑子雄 :微博,<邵逸凡_已弃疗>: 回复 @用户6346269883 :就微博]
1275402733	我还没睡着！足球的事情我不懂。但想开贴看大家聊。 ​​​	[<冲动DE包子>: 已不关注国足，看的揪心，我猜你还没睡,<未忍斋>: 炸出一窝夜间动物[喵喵][喵喵][喵喵][喵喵][喵喵],<球球是wuli王凯的小尾巴leo>: 很早很早就关注了你，只是很少玩微博。同意你在节目里的很多观点，有时候又觉得你太单纯，有点傻，当然也有时候，也会有不那么认同的事情。每次看节目都希望可以出一个邵逸凡cut，有些人实在是看不下去呀！！！,<长用想>: 回复 @球球是wuli王凯的小尾巴leo :这个我赞同，从这场比赛过程和结果来看，还是很不错的。所以，就欣赏比赛就好。,<没落ml>: 17-18欧冠决赛 皇马vs曼联,<zzz博翔>: 从这场球赛充分、肯定、体育地表明了，我国对今年"卡塔尔断交事件"的外交态度。,<Jack_Zhu->: 有种过山车的味道，剧情跌宕起伏，依然意犹未尽……,<长用想>: 逸凡，要是没睡就快睡吧，夜已深，晚安[月亮],<丝瓜东南飞>: 我舍友说，如果中国队出线就跟你表白，可惜了～[doge],<球球是wuli王凯的小尾巴leo>: 回复 @长用想 :虽然没能出线，至少我们赢了,<晓斌Troy>: 回复 @长用想 :要是总发生奇迹，对其他发挥全力的国家也不公平,<长用想>: 回复 @热心市民王尼玛 :必须给直播吧打个广告了[馋嘴],<长用想>: 回复 @类脑量子计算 :我理解你这种感受,<长用想>: 回复 @晓斌Troy :对，不是只到了生死关头才卖命追赶，渴望奇迹发生。奇迹之所以叫奇迹，就是因为出现概率太小,<类脑量子计算>: 回复 @长用想 :有点心塞,<热心市民王尼玛>: 回复 @长用想 :当然直播吧,<长用想>: 回复 @类脑量子计算 :说出了心声,<元气惠袁GZ>: 作为一个排球迷对足球确实提不起兴趣[二哈]没事可以看看排球的 能看完一场排球比赛的人心脏承受能力很强[笑cry][笑cry],<晓斌Troy>: 虽然没有晋级，但是在里皮接任以来，国足表现和前几年相比，有的质的改变。只要持续努力，每一场都发挥全力，国足才有机会进入世界杯,<长用想>: 建议你看看《天下足球》，有可能你会爱上这项运动,<长用想>: 大家都用的什么软件看比赛,<鹏鹏鹏鹏丽>: 还是很棒的，虽然没出线,<长用想>: 里皮接手后改变明显，自信心也提升了不止一个档次,<Dai-DavidRoyal>: 国足最后10分钟比较拼命,<snow昶昶>: 中国队已经可以从不会打逆风球到逆转的转变，小相信会越来越好！,<Mr_Yao26>: 国足真的挺可惜的，但看到了努力，只要努力梦想一定会实现，我命由我不由天！[中国],<Black胖胖>: 最起码站着死，不丢人，大家都很拼，下个四年继续加油吧[心],<长用想>: 虽然赢了，但还是没能出线,<snow昶昶>: 终于抢到了第一个[嘻嘻]]
1275402733	今天是国际羡慕日！大家一定要记得给网友们开心秀出的好生活底下留言：“好羡慕呀！” ​​​	[<民工苦力何必文彩飞扬>: 回复 @邵逸凡_已弃疗 :看来观众还是很有眼力，广大人民群众眼睛是雪亮的,<悔顺心流aaa>: 回复 @保罗-亚特兰蒂尼 :你一连几个评论 都没看清字 还说我么 绕来绕去 还是那样 你们不敢给观众一个交代 原因是什么 你自己心里清楚的狠,<保罗-亚特兰蒂尼>: 回复 @悔顺心流aaa :凭你从喷邵逸凡开始表现出的情商、智商、阅读理解能力，我也非常清楚你懂的是什么，也非常清楚你懂不懂其实没什么意义。你就当非诚七八年从未有人牵手结婚好了，反正这也不影响这个节目。,<民工苦力何必文彩飞扬>: 回复 @悔顺心流aaa :认真对自己，世界欺骗不了你，你一定会找到真爱的。,<悔顺心流aaa>: 回复 @保罗-亚特兰蒂尼 :行了既然不说 那我就懂了 相信都知道是什么原因,<保罗-亚特兰蒂尼>: 回复 @悔顺心流aaa :我跟你讲三点，听清楚了：1.非诚勿扰牵手后结婚的有很多。2.就算一个没有，也正常，因为非诚勿扰本来就不是包办婚姻的，结了，是天时地利人和运气好，结不成，也是理所当然的。3.数据，有，但我们并不关心数据，多久提一次，随便。一年提一次？没这打算。,<Localsmile_limiter>: 回复 @邵逸凡_已弃疗 :你的狗是什么梗？,<民工苦力何必文彩飞扬>: 回复 @悔顺心流aaa :非诚勿扰定位就是个生活服务类栏目，没毛病。世界欺骗不了你，只有自己才能欺骗自己，你会找到真爱的。,<民工苦力何必文彩飞扬>: 回复 @悔顺心流aaa :唐晶说，越求什么，越不得什么。爱情更是可遇不可求，短短时间当然不可能了解准确判断，但无论场上场下，都可以思考学习。做秀，骗别人易，骗自己难，如果他自己愿意，当然可以；不管是哪种，就是自黑的，我也羡慕他的勇气，敢于秀自己承担非言非语。,<悔顺心流aaa>: 回复 @保罗-亚特兰蒂尼 :最后在重申一句 你不是为我,<悔顺心流aaa>: 回复 @保罗-亚特兰蒂尼 :我说的是每期 么 你有没有认真看评论啊  我说的是一年 好吧 大哥？,<悔顺心流aaa>: 回复 @保罗-亚特兰蒂尼 :你别就那啥了 真有本事 我等着你们以后统计的结果 我都说的很明白了,<保罗-亚特兰蒂尼>: 回复 @悔顺心流aaa :还有，不要动不动就拿“敢不敢”去跟比你层次高的人或集体说话，比如领导、长辈、政府，人家不是不敢，真的是你不配。,<小太狼-Hao>: 回复 @悔顺心流aaa :兄弟，你是在邵逸凡微博里，唯一一个敢坚持质疑的，给你点个赞，虽然评论没有很出彩，但是面对10万粉，毫无压力。观点好不好，没关系，有勇气值得点赞。什么叫英雄，聪明为之英，胆大为之雄。听过，战国七雄，没有战国七英。嗯，不错，希望你能继续留在这个微博，质疑邵逸凡的观点。[哈哈][哈哈][哈哈],<悔顺心流aaa>: 回复 @保罗-亚特兰蒂尼 :800 1000期？不知道可不能等到那时候了 既然你 承诺了 那我就等着看还有我也送你[弱],<保罗-亚特兰蒂尼>: 回复 @悔顺心流aaa :知道，我们需要这样的观众,<保罗-亚特兰蒂尼>: 回复 @悔顺心流aaa :现在和过去没有区别，等800或者1000期吧，要我每期给你通报？还是那三个字[下],<悔顺心流aaa>: 回复 @保罗-亚特兰蒂尼 :是我不配 还是你们不敢 你不是为我 而是有很多这样的观众 太多了 知道么？,<悔顺心流aaa>: 回复 @保罗-亚特兰蒂尼 :呵呵 500那期我早就看了 不关心过去 只关心现在 好么？,<保罗-亚特兰蒂尼>: 回复 @悔顺心流aaa :我没说你宣传自己，我说邵逸凡，你这档次的有什么必要宣传呢？能宣传什么呢？我让你看500期特辑，里面有统计，还有穿着婚纱礼物排队上台答谢的。你让我调数据，那是工作量，你还不配让我做这个。,<邵逸凡_已弃疗>: 回复 @柳名城_181_可丁克 :保罗导演！,<悔顺心流aaa>: 回复 @保罗-亚特兰蒂尼 :拉倒吧 我用不着宣传我自己 说来说去 还是不敢统计 你也不用再回复我了,<保罗-亚特兰蒂尼>: 回复 @悔顺心流aaa :你的所有问题，我都回答了，只是因为字数限制，一条一条跟你说。你放心，我没有不敢正面回答的问题，因为我自认非诚勿扰没有见不得人的黑点，就像邵逸凡，只要自己无黑点，就算专门买一颗卫星宣传自己也没的黑。,<悔顺心流aaa>: 回复 @保罗-亚特兰蒂尼 :我说的是曹紫么 大哥你不识字啊，话都没好好看 就着急评论 算了吧你,<保罗-亚特兰蒂尼>: 回复 @悔顺心流aaa :按刚才那么算，非诚勿扰成功率是相当高了。你说到曹紫，我再给你灌句鸡汤：不要去等完美的时机，有机会抓一下总不是坏事。有人之后的安排可能会对恋爱造成障碍，但并不影响她此时先去把自己放在相亲的平台上，若有缘，之后的事，一件一件处理。我们是高等动物，我们会应变。,<悔顺心流aaa>: 回复 @保罗-亚特兰蒂尼 :有用的你不说 ，你竟整那些没用的干啥呢 回答我最后一个问题把 ，得不得瑟 观众都看的见 说来说去 不敢说重点 只会绕弯子,<保罗-亚特兰蒂尼>: 回复 @悔顺心流aaa :非诚勿扰不包办婚姻，不是下台就领证的，非诚勿扰提供的是机会。这么多年在台上牵手成功的有很多结婚了，你可以去看500期特辑，也有更多的牵手但最后没在一起，这太正常了，首先异地就是一道坎，然后初见半小时能结婚的放生活中也不太可能。,<小太狼-Hao>: 回复 @悔顺心流aaa :非诚这个节目只是顺应相亲的潮流而兴起的，不必太在意它的真实性，牵手后，节目不能保障两人必定在一起。对于邵逸凡，我不了解，所以，我不敢对她做出批评。或许是好的，或许是坏的，谁能真正知道呢？她在直播时表现出认真思考过，所以，我认可她的直播。你也可以关注下。我想，你的心胸可以宽广些。,<悔顺心流aaa>: 回复 @保罗-亚特兰蒂尼 :可以不绕弯子 么 绕来绕去  有什么用呢 ？,<保罗-亚特兰蒂尼>: 回复 @悔顺心流aaa :经常有人把“动机不纯”这个概念挂嘴边说人，然而我们平时做的事哪件动机是纯的？我饿了，想吃东西，进了个餐馆，点餐挑来挑去，还特意找了个靠窗的好位子，那你说我的动机到底是饿还是馋还是想看风景？所以我觉得，只要于己有利、与人无害，同时有多少动机都可以。,<保罗-亚特兰蒂尼>: 回复 @悔顺心流aaa :我不知道你怎么界定“得瑟”，我们生活中相亲，准备一件漂亮的衣服、让对方知道自己的优点，是不是得瑟？相亲，讲究的是说学逗唱（玩笑），就是说相亲是个范概念，只要有利于让别人关注你，那就有利于相亲。,<柳名城_181_可丁克>: 回复 @邵逸凡_已弃疗 :哈哈哈，问你狗的是找茬的，周毛翩翩那么奇特的名字怎么可能搞错。话说，这哥们就是喜欢作妹子的保罗哥吧。。。,<悔顺心流aaa>: 回复 @保罗-亚特兰蒂尼 :你说的有道理，，我说的都是我真实的看法，台上的女生没有几个是真去相亲的，都是去得瑟的，这是我的感觉，还有那个许子萱,还要在国外读书两年，在工作两年，去相的什么亲呢，你们给不给观众做个统计，一年牵手多少对，在一起的是多少，有几个结婚成家的？,<邵逸凡_已弃疗>: 回复 @保罗-亚特兰蒂尼 :嗯，那个时候别说观众了。在场的男女嘉宾都不认识我。。。现在还总有人问我的狗呢。。[允悲],<保罗-亚特兰蒂尼>: 回复 @悔顺心流aaa :邵逸凡在非诚牵手那期录制是7月份的事情，那时候她的粉丝才一两千，你的时间线有点错乱。关注的人多了，增加交流，是一种积极、友善的态度，另一方面确实提高了她的知名度，那是人家应得的。像你这种看别人得了好处就来喷，喷也找不到点的loser，着实可怜。,<保罗-亚特兰蒂尼>: 回复 @悔顺心流aaa :这句话被你理解成秀前男友，可见你的智商情商皆不及格。友情提醒一下，你以后喜欢哪个女的，想跟她套近乎，他回你一句类似的话，你千万别以为人家想博你好感，那是在奚落你，文盲。,<悔顺心流aaa>: 回复 @王小琲2011 :拉倒吧,<王小琲2011>: 回复 @悔顺心流aaa :那只是间接拒绝男嘉宾,<悔顺心流aaa>: 回复 @微山湖的石头 :我乐意,<悔顺心流aaa>: 回复 @仁者归对忍者龟 :映像最深的是:她问男嘉宾哪的，德国的，还秀什么你可能认识我前男友,<悔顺心流aaa>: 回复 @王小琲2011 :你难道没看见她现在回答别人的问题 挣钱么,<悔顺心流aaa>: 回复 @未忍斋 :怎的？,<悔顺心流aaa>: 回复 @微山湖的石头 :你有药啊？,<民工苦力何必文彩飞扬>: 回复 @邵逸凡_已弃疗 :真的不懂哎，啥意思？,<民工苦力何必文彩飞扬>: 回复 @邵逸凡_已弃疗 :真的不懂哎,<民工苦力何必文彩飞扬>: 回复 @一心宜意ZXY :side by side什么鬼，听不懂哎，我只知道p2p,<仁者归对忍者龟>: 回复 @邵逸凡_已弃疗 :上个状态评论中的所有歌曲 哈哈[开心] 好多  side by side 把他们全放到歌单上,<邵逸凡_已弃疗>: 回复 @仁者归对忍者龟 :sidebyside,<仁者归对忍者龟>: 回复 @邵逸凡_已弃疗 :好吃不过饺子 好玩不过嫂子 过节必备  逸凡baby我们推荐的歌曲可以加入豪华歌单吗？,<邵逸凡_已弃疗>: 回复 @一心宜意ZXY :为啥,<民工苦力何必文彩飞扬>: 所有过节的人，都要给赞！真羡慕你们，不仅羡慕，都嫉妒，恨了！,<请叫我Mr_-Zhang>: 回复 @邵逸凡_已弃疗 :哈哈。厉害了大凡凡[笑cry][笑cry],<民工苦力何必文彩飞扬>: 又多了一个节日，好高兴！好羡慕过节的人,<小太狼-Hao>: 回复 @邵逸凡_已弃疗 :我不太明白你昨天说的话。你昨天晚直播说害怕血腥，包括电影的血腥场面，那么既然连血腥你都害怕，但是难道不应该更害怕神鬼吗？相反，你不太害怕神鬼，却害怕血腥，有点猜不透。[微笑][微笑][微笑],<被月哥所倾>: 回复 @邵逸凡_已弃疗 :额呃呃呃，，一个人在家。。。好害怕啊[泪],<不做帅哥好多年LY>: 回复 @不做帅哥好多年LY :同看同看[哈哈],<微山湖的石头>: 回复 @悔顺心流aaa :你真有病]
