1634431184	好想去特拉维夫上暑期学校[允悲][允悲]虽然暑期刚刚过去[摊手] ​​​	[<方田海未>: 回复 @是河流 :顶你上去[允悲][允悲][允悲],<客归人未回>: 话说你把北北就那样搁下了？,<Spike_EL>: 有可能会出«北北»吗[允悲][允悲][允悲],<新村峰>: 安姐，我想去塞纳河，然后在早晨，读你的文章，塞纳河不结冰。这个idea怎么样，哈哈哈。,<陈清圆Elaine>: 不存在的明年你就忘了,<周胖胖要健康>: 笛安姐，嗯……小四怎么样了你知道吗？他还好吗？,<leisure-time>: 只是想放个暑假？,<Mjieng_>: 回复 @你说的我都不会丶 : @MKristan_,<wuli_yangt>: 刚开学我就开始期待寒假了[摊手],<Pan4Y>: 可以明年去 期待笛老师的分享~[爱心]️,<白驹过隙o3o>: 然后明年就忘记了。[眼泪],<假装在迪拜卖菜>: 反正你那么漂亮去哪都行,<5KONG->: 回复 @你说的我都不会丶 :翻牌新技能,<佘伟靓_>: 特拉维夫还是很美的 艺术氛围很棒  http://t.cn/Rp9ArZx,<笛安>: 回复 @Lenny的啦啦啦 :文化水平比较低[允悲],<我们的爱人笛安>: [微笑][微笑],<Summer叮叮铛>: 入学什么要求，我也想去！,<哇照烧鸡腿>: 回复 @笛安 :哈哈哈哈[允悲],<坐等我牛单打金满贯>: 今年看过那个项目，我们学校一起申的话就要690美元，挺便宜的。而且从那边过去希腊机票最便宜只要60美元。,<是河流>: [小黄人高兴]李老师2018年暑假翻到这条微博时一脸懵逼，“还有这事？”,<毕竟我是涵涵啊>: 啦啦啦，我来抢个位置,<丘迁>: 明年暑假你肯定就忘了这事了[笑cry],<苡安丶>: [笑而不语][笑而不语][笑而不语],<blessGrace>: 回复 @笛安 :哈哈哈哈哈哈哈哈哈 可爱,<Lenny的啦啦啦>: 去当老师啊[doge][doge][doge],<许籽樾阿>: 建议你来南大[微笑]热的一批，保证你的暑期过不去。,<林薇weilin>: 话说最近在干啥呢,<Iris_一只上班喵>: 刚从那里回来，很安全，非常艺术的城市，里面的人美的过分，靠在地中海滩看日落很美！很喜欢的城市，只有两个缺点 ……  1 太贵，比欧洲很多大城市贵好多2  好热啊！！！,<笛安>: 回复 @林怀天 :应该还好的,<笛安>: 回复 @你说的我都不会丶 :我不知道，从没去过。建议去隔壁咨询 @落落430  [允悲],<四莳>: [不好意思][不好意思],<你说的我都不会丶>: 安姐，冰岛好不好玩]
1634431184	不如聊聊我的小说以及人生？ 红豆Live:我是笛安 ​​​	[<红豆Live热心观众>: 等 via Kepler*,<红豆Live热心观众>: 晚安 via 陈落,<-几时拥->: 09年开始喜欢你,<金风玉露未相逢_>: 美笛太适合做主播了hhh,<红豆Live热心观众>: 晚安 via 月亮石在这里！,<红豆Live热心观众>: 晚安 等你 via 姜饼莉安宝,<红豆Live热心观众>: 希望美笛可以好好生活 via 临树,<红豆Live热心观众>: 等 via Kepler*,<红豆Live热心观众>: 好哒好哒 via 豆粉00918812,<oydsygrz>: 哪有人不知道你是谁,<红豆Live热心观众>: OK via 是liuliu啊,<奇Mickey>: 美笛辛苦了！晚安～一直支持你！,<红豆Live热心观众>: 喜欢你 via 拾谙,<rueiopiy>: [爱心]️[爱心]️[爱心]️,<红豆Live热心观众>: 晚安 爱你九年了 via 听见的风景,<红豆Live热心观众>: 谢谢美笛 via 小小小小夏天[星光],<珩予_>: [眼泪]噗哈哈哈,<红豆Live热心观众>: 晚安 via 是liuliu啊,<红豆Live热心观众>: 晚安 via 红烧庸俗 清蒸高贵,<让我看看哪个小孩儿不听话>: 泡泡晚安好梦晚安好梦晚安好梦,<红豆Live热心观众>: 美笛晚安 via 一室,<红豆Live热心观众>: 爱你 via 月亮石在这里！,<红豆Live热心观众>: 晚安。 via 小小小小夏天[星光],<红豆Live热心观众>: 约定一次见面的时间啊 via 越冬,<红豆Live热心观众>: 爱你 via 临树,<你的网友晚山>: 谢谢你的三个小时 晚安啦,<维鸠丶>: 以后能常来吗………,<金风玉露未相逢_>: 爱你～～～～～～,<红豆Live热心观众>: 晚安 via 凌呱,<红豆Live热心观众>: 晚安 via 越冬,<红豆Live热心观众>: 晚安 via Therese[幽灵],<unbroken_light>: 笛安辛苦啦，晚安,<红豆Live热心观众>: 晚安！ via 不想起名称了,<红豆Live热心观众>: 晚安 via Therese[幽灵],<Soulmate96424>: 要是能看到脸就好了,<红豆Live热心观众>: 晚安 via 是liuliu啊,<红豆Live热心观众>: 快睡吧 via realWYJ,<红豆Live热心观众>: 晚安了美笛 via 姜饼莉安宝,<红豆Live热心观众>: 生计吗 via 豆粉36763411,<Mr--1900>: 超级谢谢美笛！！！！！！,<Mr--1900>: 谢谢美笛！！！！！,<潋滟__>: 可能只是因为迦南比陈迦南好听r就像笛安比李笛安又稍好听一点哦,<Emayu>: 我甚至都有些忘了龙城三部曲的内容了 我需要再看一边,<unbroken_light>: 笛安做过的一些访谈节目已经解释今天很多问题了,<红豆Live热心观众>: 果然很简单 via 宇宙之海,<珩予_>: [眼泪]继续新书问题,<珩予_>: [眼泪]继续新书问题,<-几时拥->: 初二看西决，还被老师收走了，只能以随手卖了个安利安慰自己,<Mr--1900>: 我是初二到大三！！！现在大三！！！,<红豆Live热心观众>: 我也大三 via 小小小小夏天[星光],<红豆Live热心观众>: 我也大三 via 豆粉00918812]
1634431184	预告:9月7日21:15, 不如聊聊我的小说以及人生？ 红豆Live:我是笛安 ​​​	[<红豆Live热心观众>: [大笑] via 越冬,<红豆Live热心观众>: [爱心] via 换个pp,<红豆Live热心观众>: 不打算通话么？人多了就排不上队了 via 越冬,<太白子二哥>: 我就看你们聊，听你们说,<红豆Live热心观众>: 你们想说些什么呢 via 越冬,<红豆Live热心观众>: 金镶欲何时出单行本？ via 豆粉67380930,<红豆Live热心观众>: 坐等 via w枫枫子w,<红豆Live热心观众>: 快开始了 via 越冬,<红豆Live热心观众>: 坐等笛安 via 豆粉67380930,<黄金左脸1>: 婚内出轨的是哪个？,<用户5762516167>: 笛安新书什么时候出？,<耳环八元戳我头像>: 买耳环搜我～ 8.9一对敲好看 可选银钩,<飘渺_______>: 回复 @Izzy没肉怎么吃饭 :nei，我在拿袋瓜子,<红豆Live热心观众>: 1 via 打老虎被老虎打了,<红豆Live热心观众>: 1 via 匹马孤征.,<红豆Live热心观众>: 1 via 匹马孤征.,<红豆Live热心观众>: 1 via 匹马孤征.,<红豆Live热心观众>: 1 via 匹马孤征.,<红豆Live热心观众>: 1 via 匹马孤征.,<红豆Live热心观众>: 1 via 匹马孤征.,<红豆Live热心观众>: 1 via 匹马孤征.,<Izzy没肉怎么吃饭>: 回复 @飘渺_______ :你不说我都忘了 我特意马了一下 你等我听完和你说一下心得[二哈],<红豆Live热心观众>: biu via lily啊,<飘渺_______>: 回复 @Izzy没肉怎么吃饭 :一会她开直播了该，你听听吧，是不是也跟深井冰似的,<2013_修行者>: 是不是那个出轨的人,<Izzy没肉怎么吃饭>: 回复 @飘渺_______ :是 还真是 把自己折腾成个小说人物 也不知道是不是有病,<Uptobe>: 出轨女还好意思出来,<飘渺_______>: 这么多年你一直逃不出的坑诶 @Izzy没肉怎么吃饭,<-安纳修->: 美西时间早5点多就爬起来等着的我,<红豆Live热心观众>: [傻笑] via 越冬,<红豆Live热心观众>: 已经好多观众了呢 via 越冬,<红豆Live热心观众>: 啊啊啊啊 美笛！ via 豆粉68146563,<KYUNGSOO演员_>: 回复 @杨枝甘luu :同考研狗！,<袁野7>: @吴栋说跑步    @无香赢哈雷    @Candy囧rz    @Loree-像恋爱一样去跑步,<笛安后援会>: http://t.cn/Rp2GCp7  ~ @笛安吧  ,<风趣与极端>: 我要告诉你我喜欢你！,<我很酷641>: 郭敬明是不是基佬,<红豆Live热心观众>: 期待…… via 豆粉67380930,<陈清扬的罪孽>: 笛安姐，app下好了，等您直播[憧憬][憧憬][憧憬],<王俭Lz>: 上次读故事就错过了,<红豆Live热心观众>: 开心！！！ via 立夏与猫,<红豆Live热心观众>: 哇哇哇！！！ via 立夏与猫,<小妮儿呀>: 定闹钟去  http://t.cn/RXPMoXD,<红豆Live热心观众>: 结果 via 猫鹿,<红豆Live热心观众>: 然后一直等 via 猫鹿,<红豆Live热心观众>: 很尴尬，我以为今天开播 via 猫鹿,<红豆Live热心观众>: 好 via 豆粉43683811,<红豆Live热心观众>: 。。。 via 我是西决,<红豆Live热心观众>: 嗨 via 我是西决,<星辰伤感语录>: 星空缓缓变得暗淡，失去梦幻。往事随风烟消云散。墙院上的藤蔓，叶枯根干。彩虹阳光，全都褪去斑斓。溪水潺潺，流逝多少浪漫。 ​​​,<远镇同学>: 幸亏今天又跑来刷微博[心]没错过,<快哉大王风>: 好啊[小黄人高兴  ],<打爆车轴的抢婚人>: 我觉得不管说什么都半冷半暖]
1634431184	本日最佳：——我回头跟你确认吧。——你什么时候回头？（论如何有效地假装外宾） ​​​	[<-我叫高老兴>: 回复 @唯散 :哈哈哈在刷微博 这个事情现在我也找不到了 以前关注她的时候就知道了[允悲]本来想截图找证据的也没办法,<唯散>: 回复 @-我叫高老兴 :我找了半天，都没有找到她前夫出轨的消息,<唯散>: 回复 @-我叫高老兴 :我天，哥们你还在,<-我叫高老兴>: 回复 @唯散 :[笑cry]笛安是被前夫婚内出轨了然后才找的别人 郭的公关很厉害 人家都离婚几年了还要背锅,<唯散>: 回复 @-我叫高老兴 :what,<gaogaogao帅>: 看到没被他们的破事影响 我也就放心了,<gaogaogao帅>: 回复 @西笛不爱吃香蕉 :说的真对[鼓掌],<戴湄若>: 回复 @lsakdfj :人家出不出轨关你毛事，你还管得多。麻烦把自己管好。我们喜欢的是她的文，你要这么关心人家的私事你最好去你们村居委会,<对我就是那个Zoey>: 看评论看评论，我也是不闲，来笛安这喷出轨，看笛安长大的小可爱们还能在乎她出不出轨哈哈哈哈哈哈肚子笑疼[笑cry][笑cry][笑cry] ,<段子一哥>: 听说你出轨了？亏我曾经谦虚地向你请教写作，而你现在怎么变成这样了？你除了让我们失望以外你还会干什么？！我现在一想到曾经对你说的那些话就感觉恶心！,<李嘉麒250>: 回复 @碗在哪里 :嘿嘿，查了不少小道消息吧？看了不少网友评论吧？搜了不少关于作者的信息吧？[太开心][太开心][太开心]但那些都不定是真的哦。[阴险][阴险][阴险]作为一个小粉丝，感谢你对作者的关注！另外，别撕逼了，太累了，我给你推荐一些作者写的“龙城三部曲”，真的很好看！多说一句，可以不看，但不要买盗版。,<幸福地呼吸着>: 回复 @废柴猪精日常丧谁好看磕谁 :你也说了换做是你，问题是李枫就是李枫，每个人都有自己的想法和性格，不是说了嘛忍了很久了，你不能忍是你的事情，他能忍是他的性格，你想要求人家跟你一样是不可能的，而极限对于不同人来说也不一样，你以为饭碗那么好找啊？,<碗在哪里>: 回复 @李嘉麒250 :你是当事人？[微笑]不是，闭嘴，当事人没有说话你倒急起来，婊，自己的丈夫出面回复此事，更贱，别人说的不对，自己也无法证明，也没有告对方诽谤，你一个小粉丝挺犯贱的，你比我还闲，还贱。,<李嘉麒250>: 回复 @碗在哪里 :那么我请问，你是怎么知道出轨这事是真的？仅仅听到一点风言风语就来骂人，说明你“蠢”！我没有阻止任何人发表评论，可你非要说我阻止他们评论，说明你“闲”！与我没有关系 ，所以我通篇没有说这事，而在说请不要恶意攻击别人，而且态度算好的，可你仍然开口骂脏字，说明你“贱”！另外祝你别累着！,<碗在哪里>: 回复 @李嘉麒250 :出轨就是出轨，不关别人事关你事？八婆？不关别人事，如此对待自己的丈夫还感觉自己很有理，婊！错了不认，婊！错了不认还如此反问别人，更婊！粉丝得知这种情况不站正确哪一边反而攻击别人，婊的不得了！你特么要上天是吗？,<他人事_>: 回复 @空明与流 :每个人都有缺点，我喜欢她很久了，在你那里可能是失望的事，在我这不是。,<空明与流>: 回复 @蹬鼻子上脸p :读了啊，几年前就读过了，别对一个人太相信，他会让你失望。,<他人事_>: 回复 @空明与流 :你读了笛安的书就明白了。,<空明与流>: 回复 @蹬鼻子上脸p :[摊手] 其实文学圈子艺术圈子和娱乐圈一样乱，书上真的看不出什么，我们看的只是他想展示给我们的而已,<李嘉麒250>: 回复 @碗在哪里 :别拐弯抹角，直接回答我的问题：关你屁事，八……算了，我还是好好说话吧。以上种种就是我不想撕逼的理由，太累，又没用，所以我花了一点时间去和一堆人解释，那就拜托您翻翻我之前给别人的评论。她不是明星，不靠爆料这碗饭混，所以你们无权掺合别人的隐私。难道你愿意别人掺合你的私生活吗？祝君好！,<碗在哪里>: 回复 @李嘉麒250 :[草泥马][草泥马]作者出轨，粉丝无知当有趣，相当恶心,<李嘉麒250>: 回复 @碗在哪里 :哦，那回答我的问题：关你屁事呢？八婆。关你屁事！八婆！关你屁事！八婆！关你屁事！八婆！关你屁事！八婆！关你屁事！八婆！关你屁事！八婆！关你屁事！八婆！关你屁事！八婆！关你屁事！八婆！关你屁事！八婆！关你屁事！八婆！关你屁事！八婆！关你屁事！八婆！关你屁事！八婆！回答不出来吧。八婆,<碗在哪里>: 回复 @李嘉麒250 :[弱][草泥马]垃圾    出轨婊,<李嘉麒250>: 回复 @碗在哪里 :我已经很平稳地解释了几十遍，既然你懒得翻评论，而且这么说的话，那我就想问：关你屁事！八婆！关你屁事！八婆！关你屁事！八婆！关你屁事！八婆！关你屁事！八婆！关你屁事！八婆！关你屁事！八婆！关你屁事！八婆！关你屁事！八婆！关你屁事！八婆！关你屁事！八婆！关你屁事！八婆！少装公知了！,<lenlehon>: 回复 @碗在哪里 :好的[作揖][作揖],<碗在哪里>: 出轨就是出轨，说那么多干嘛？安静写书还安静出轨？两码事，写书就不能出轨了？她出轨了你不是当事人也更没资格阻止别人说话。,<碗在哪里>: 回复 @李嘉麒250 :出轨就是出轨，说那么多干嘛？安静写书还安静出轨？两码事，写书就不能出轨了？她出轨了你不是当事人也更没资格阻止别人说话。,<碗在哪里>: 回复 @lenlehon :挺住！,<BIG嚨>: 回复 @南木久 :她伤害她老公就行 出轨滥交啥的作为一个半公众人物 给她老公戴绿帽子……就不算伤害了…真是能够给她洗白的,<BIG嚨>: 回复 @afternoonlater :有问题就一定要出轨吗 离婚干什么用的 这个小妹妹 哈哈你三观好正 看来以后没人敢娶你啊……哈哈哈哈 我听见雨滴轻轻落在草地[doge][摊手],<BIG嚨>: 回复 @腿毛太长会分叉 :笛安花钱删舆论微博呗……[摊手]就像她又花钱买水军 洗白自己,<BIG嚨>: 回复 @丧心病狂小二姨 :没实锤还能被爆出来啊……什么样的人身后就会随什么样的人 看来你…哎…,<BIG嚨>: 跟自己老公过够了 过腻味了 B刺挠了 长的一脸欠艹样 肯定出轨啊……千夫所指,<so1357865319876>: 回复 @是刚刚啊 :哦，关你毛线事情？,<Luckie酱>: 回复 @鹿的耳朵啦 :还一直幻想 龙城三部曲什么时候可以出个电视剧就好了 当时还跟同样读你书的人讨论谁来演郑西决比较合适,<Luckie酱>: 回复 @鹿的耳朵啦 :后来陆陆续续在学校的图书馆找到了好多她的书 告别天堂 芙蓉如面柳如眉 还有后来的东霓 南音 真的是一个字不落看完的,<Luckie酱>: 回复 @鹿的耳朵啦 :是的 那时候觉得《西决》简直是最世的一股清流 打着手电在宿舍的被窝里一个晚上读完了整本书 躺在床上听着宿舍其他人均匀的呼吸声 感觉到有什么东西在发光 暖暖的 热热的 我永远会记得 那个高一的夏天 笛安你带给我们的美好,<似水流星o>: 笛安，希望你一切都好[心][心][心],<如酥kkk>: 回复 @是刚刚啊 :看热闹的话赶紧走吧您,<0w00w0>: 回复 @特欧的袜子 :哈哈哈哈哈哈,<王大大大面条>: 回复 @lsakdfj :傻b，不了解真相就别瞎喷，美笛明明就是受害者，她前夫渣男一个，渣到没朋友你知道吗，智障,<VCE绵羊吃饼干>: 今日关注，珊珊去哪儿了,<lenlehon>: 回复 @要依赖的小仙女lh :滚，脑残,<要依赖的小仙女lh>: 回复 @lenlehon :你看过笛安的作品吗？一个女孩子在网络后面瞎八八的时候考虑过你自己的身份吗？出轨的时候你趴在床下吗？这么笃定的来这里叫嚣 真是让人觉得可耻,<Tibet李昕>: 我眺望  向着你来的方向  直到我变成了稻草人  不会说话也不会歌唱  只有一群麻雀陪伴我  一边吃掉我一边替我守候远方  它们告诉我  你的名字叫夕阳  可是有没有人能够告诉我  为什么  我和你相依为命的家乡  变得如此荒凉。,<是啊我就是池小姐>: 笛安是作家 我们应该关注她的作品 而不是她的个人私事,<是啊我就是池小姐>: 回复 @Just吐个槽 :郭敬明的事结果没出来怎么就说他做龌龊的事了？麻烦说话讲证据好吗,<是啊我就是池小姐>: 大概是人太闲 没事干了 一天天观光 有时间不如多看看书,<梓梓梓梓梓籽浅>: 回复 @是刚刚啊 :你知道她前夫是谁吗？你知道她为什么吗？你知道她经历过什么吗？什么都不知道，却张口闭口一个出轨就是渣？[摊手]哇唔同样 我对于你什么都不了解 说你一句渣 你开心吗？ 保护我方笛安,<阿桐KM>: 晚安   安。安。,<Tibet李昕>: 回复 @刘麦加 :把这些留言删掉好吗？,<喜帖_yanyan>: 回复 @lenlehon : @-免俗-  [拜拜] 用不着你骂我肥 论颜值可能你得叫我爸爸谢谢,<红色丝绒布>: 回复 @她忘记之前 :谁是脑残你以为大家没数么,<丁斯汀>: 回复 @刘麦加 :这层楼好多 #网友小张#,<喜帖_yanyan>: 回复 @-免俗- :果真又见七大姑八大姨～就是在说你,<喜帖_yanyan>: 回复 @北巷南猫izsr :所以你能拿出笛安出轨实锤？？？]
1634431184	今天晚上@笛安 说：“我自己判断喝得有点高的标准是：我开始觉得大多数人都挺不容易的了…” ​​​	[<靠近我感动你>: 大梦初醒是你，酩酊大醉也是你[爱你],<Robert_樊百乐>: 我昨天的总结是：醉与非醉的区别就是共和党和民主党的区别 // @笛安 :原话其实是：我清醒的时候觉得大多数人都不容易，可是这里面有一多半人都跟自身的原因有关；但是我开始醉的时候，就只剩下全身心觉得，大家都不容易，真的，都不容易[笑cry],<手写何安>: 发微博的时候你觉得呢[眼泪],<笛安的迷弟>: 笛安姐 什么时候还有签售会啊,<八音GLASS>: 回复 @多啊多要美美哒 :而且感觉视野变得很亮很开阔,<多啊多要美美哒>: 回复 @八音GLASS :对啊很神奇,<库里娶我>: 我喝多了就会大笑  指着寝室阿姨大喊老子就是喝酒怎么着[二哈][二哈][二哈]被通缉了快要,<董伯方>: 我就进来看看评论都写了什么[微笑],<逗比女神777>: 回复 @只欧颖0510 :不容易。,<Babyn_y93>: 我喝多的标志就是开始叨叨“江俞帆我好喜欢江俞帆啊”,<饿蚁>: 笛安笛安，想问问你码字用的是什么键盘呀？,<只欧颖>: @逗比女神777,<史上最棒溜粒遛>: 记得之前在小赏里笛安姐姐你有说过 醉后看着他说“我那么喜欢你，你就不喜欢我吗” “好吧其实这也没有什么”   然后是“阅读愉快” 还是等着你出新书/把南方有令秧看了n次哎,<Rachal-Jiang宇晴>: 我其实更想知道，文艺风赏 去哪里了[摊手],<瘦到跟酒尔伊一样的体重>: 等新书 迫不及待,<白驹过隙o3o>: 大家都挺不容易的。可是我比较关心的是你喝醉后是怎样的。[眼泪] @笛安,<梦里冰河与铁马>: 这是哪本书里面的吗？想看[可怜],<Tristasasa>: @陈渊渊渊  哈哈哈哈,<指尖划过的优雅>: 我觉得其实可以[二哈],<Amber吴对对>: 我深夜抑郁的时候也会这么觉得,<要努力努力上岸的丸子>: 我喝多的时候就开始大笑,<元乎乎滴>: 我开始醉的时候应该就是觉得自己太不容易[拜拜]// @笛安 :原话其实是：我清醒的时候觉得大多数人都不容易，可是这里面有一多半人都跟自身的原因有关；但是我开始醉的时候，就只剩下全身心觉得，大家都不容易，真的，都不容易[笑cry],<元气少女酥>: 笛少女的日常金句~,<八音GLASS>: 回复 @多啊多要美美哒 :举手！,<慕楠晟>: 女神女神[爱心],<柯南男神快到碗里来>: [笑cry][笑cry],<许明天_>: 哈？不是单纯想亲别人嘛,<涵昭>: 这是酒后吐真言~// @笛安 : 原话其实是：我清醒的时候觉得大多数人都不容易，可是这里面有一多半人都跟自身的原因有关；但是我开始醉的时候，就只剩下全身心觉得，大家都不容易，真的，都不容易[笑cry],<大儿童YH>: 我来催个稿[笑cry],<让我看看哪个小孩儿不听话>: 当我把手插进扎啤杯子里的时候 朋友开始疯狂大笑,<Flylosteverthing>: [心][心][心]哈哈这就是喜欢你的原因啦// @笛安 :原话其实是：我清醒的时候觉得大多数人都不容易，可是这里面有一多半人都跟自身的原因有关；但是我开始醉的时候，就只剩下全身心觉得，大家都不容易，真的，都不容易[笑cry],<GKC与匡>: 嗯嗯// @笛安 :原话其实是：我清醒的时候觉得大多数人都不容易，可是这里面有一多半人都跟自身的原因有关；但是我开始醉的时候，就只剩下全身心觉得，大家都不容易，真的，都不容易[笑cry],<想要拥有董老师>: 喝多后会哭着给一个人发语音，每次听到提示音就想，我还没说几句话怎么就快60秒了。。。,<承荫憨憨>: 要警惕self contribution bias，无论是谁，单纯依靠个人力量是走不到今天这步的。,<闋赤赤赤>: 今晚第一次喝到吐了 然鹅是因为半夜被吵醒胃开始不舒服 还是没有醉[大便],<L李子二>: 大梦初醒是你 酩酊大醉是你,<大星r>: 生而为人，总得学会责任和担当[月亮]// @笛安 :原话其实是：我清醒的时候觉得大多数人都不容易，可是这里面有一多半人都跟自身的原因有关；但是我开始醉的时候，就只剩下全身心觉得，大家都不容易，真的，都不容易[笑cry],<meredith酱>: 赶紧写新书吧 在等你的时间里我已经成了美笛爸爸的粉丝了 [偷笑]已经把他的书都读完了……请赶紧给我提供精神食粮啊[悲伤],<多啊多要美美哒>: 难道没人判断标准跟我一样是“视力变的特别好”嘛？// @笛安 :原话其实是：我清醒的时候觉得大多数人都不容易，可是这里面有一多半人都跟自身的原因有关；但是我开始醉的时候，就只剩下全身心觉得，大家都不容易，真的，都不容易[笑cry],<Misscarelll>: 真喜欢你的逻辑。 @笛安,<Nam-Asocial>: 哈哈哈哈祝你能有个甜美的梦[月亮],<宠着青又>: 睡吧老铁 想那老多干啥呀,<围巾记得叫哦草>: 喝醉的时候可以任性点借着喝醉了这个理由说些平时不想说不好说不肯说的话做些平时想都不允许想的事情 心情绝望的时候是不可以喝酒的 这个理由一点都不正当 像个小偷见不了光芒 只能悄悄的 慢慢的又轻轻的 说的话和做的事是疯又理智果敢心疼的,<乡下大老表>: 我喝多时候，就想要个对象,<索索的索索>: 是呀，醉不醉我都好不容易[哈哈],<pcc的小号>: 555等小赏的我很不容易[泪],<莫然灵性>: 那是你身体醉着的时候直觉醒着了。[挤眼],<抗痘的不二君>: 笛安大大的小说多会拍成影视作品呀,<李裴杨>: 我喝醉的标志是开始说：我们这一辈都是独生子女没有兄弟姐妹，以后老了只能靠朋友......然后我朋友们就会把我扔去厕所吐,<45wda童鞋>: 可以用来判断自己高了没  实用,<一位不愿透露姓名的名字>: 大过年的，都不容易，算了算了，都是亲戚。,<-曾盼>: 醉了的人都会说自己没醉，我懂。[doge][doge][doge],<real吴英俊>: 知道你也不容易，所以什么时候出新书呢[摊手],<EVAngel-AZon>: 其实很羡慕那些还能喝醉的人，没有谁活的容易，只是看谁更不容易。,<Xxxxx_Even>: 今天是我生日🙈跟你和西决一样狮子座哦，求翻牌嘻嘻 @笛安]
