1634431184	每次把头发剪短，就会整个人都不好，就会。。。厌恶我个人[生病] ​​​	[<心香吟>: 同感！所以很多年不剪头发了。今年，年都过完了，回来后剪的头发，还没剪完就哭的不行了。后悔了。[泪],<云开两生花>: 怎样都美！[爱你][挤眼],<得未曾有-H>: 脸大了[doge],<堇渡>: 我也是[泪][泪],<北薏南浔>: 还是美笛哦[羞嗒嗒],<苏格兰的骗子>: 怎么感觉你不是长这样[笑cry],<请叫我狗鲵>: 你长那么好看[喵喵][喵喵]就不能放过短发（短发心里苦T_T）,<SYn_Green>: 不开心就不剪，怎么开心怎么来，反正美笛怎么都美,<turboapple>: 一剪完头发就焦虑,<坚果子君>: [拜拜]你是我的写照,<有籽初成>: 我也不想剪头发 剪了发现还不错哎 护理都方便好多,<送你一颗子弹org>: 希望有一天可以见到你，笛安,<超载飞侠>: 回复 @莜如是 :哈哈哈 所以你是才女嘛,<莜如是>: 回复 @超载飞侠 :哈哈哈  安妮宝贝真名叫历婕。。你看我和这些文学届名媛就是有缘分,<丁一二不是丁三>: 所以剪头发的目的是？,<少吃辣椒多运动早睡觉>: 我笛好美[爱你][爱你][爱你],<guojiaqi_>: 但依然还是很喜欢你啊[飞吻],<小野早上好>: 要不 干脆 再短点 干净利落那种,<QueeningGirl>: 女神我喜欢你个人,<鹿晗的双眼皮儿>: 不会[爱你]一样是美迪,<Mr_t丨>: 咋有点憔悴[傻眼][傻眼],<阿尧崽>: 哈哈哈哈哈哈哈哈哈哈哈先看到你新发的再看这条笑死了,<还是变回小纯洁呀>: 美笛变圆了[大笑][大笑],<_艾欧斯>: 来龙城解决一切烦恼,<埃尘落定>: 我就想知道这种发型如何做到低头的时候脸颊两边的头发不往前垂！！！我每次低头头发就把视线挡完了，导致我只能把头发别在耳朵后面露出大脸，生无可恋。。。,<滨枝夕夏u-na>: 这个不算剪的太短，扎起来可能有点短,<信于笛安>: 笛安  你笑起来要好看一点  你该多笑的,<曹馨月Alice>: 我前天也剪短了头发[可怜][可怜][可怜],<李杏之>: 然而我最讨厌自己头发长得快了[眼泪],<羑佐>: 你最美！笛安SAMA,<万事因意念而立>: 不是说正月里不能剪头发吗？,<悟空Lzz>: [月亮][围脖],<繁荫绿树>: 这张头发是真毛躁[doge][偷笑][偷笑][偷笑][偷笑],<夏牛马>: 也许这是你不经意的一句话，可还是要说：当你厌恶自己时，其实有好多好多人都在喜欢你……,<Flylosteverthing>: 嗯嗯，不过很快就会好的,<不要对她说出一样的话>: 我也厌恶 [doge],<滋磁嘶>: 我今天也是，剪完走在回家的路上，心情复杂[微笑],<Katherine_Cengziaytun>: 每次剪完头发都会感觉自己一个女生又帅又可爱[难过],<白白Baebae>: 一样一样滴，莫名感到失落[喵喵],<Yunkle318>: 为什么要剪呢[疑问],<Rrrrrrach>: 那你为啥要剪[哈哈],<花花不是猫是个姑娘>: 就是炸毛啊 哈哈,<挺枪四顾心茫然>: 笛安的柔情，你们永远不懂。,<西府海棠的小心情>: 还是很漂亮的，多照几天镜子感觉就会回来了，女人永远都能从镜子里找到最美的自己。,<kiki_CHEERNICE>: 连发两张 可爱的很[爱你][爱你]美的很,<SHANECHAN_>: @笛安    感觉精神状态好像不佳[失望],<爱源多多SSVeggie>: 披肩长发最美，头发太长脑袋沉，还吸收营养，容易没有灵感！,<他人事_>: [馋嘴][馋嘴]为啥呢,<惑児>: 要快乐[爱你][爱你],<凌风冰翼>: 同样每次剪完头发都会炸毛特别讨厌自己QAQ我们家美笛还是最美哒[羞嗒嗒][爱你]么么哒！抱抱不难过啦~~~,<晴天丶剪水如初>: 超喜欢你的作品。,<王亦璇holiday>: @HKHM-N  [嘻嘻][嘻嘻][嘻嘻],<汽水和猫咪冷空气>: 瞧这一副生无可恋样~尽管爱人不会回来 但是头发还是会长长的！[心],<远镇同学>: 反正你哪样我都喜欢[偷乐][偷乐],<梦199571>: 我看见美笛新长出来的绒毛了。哈哈。,<苏梓苏橦>: 没事没事 长头发留下来就是为了剪的！,<胡起司cheese>: 像蒋方舟[吃惊]]
1634431184	和落落的拜年微信。（露出头像的是我）[笑cry] ​​​	[<Xi__夏天>: 美笛姐你们新年快乐啊。,<戈壁孤岛>: 啊啊啊  美笛也喜欢eva 啊  哈哈,<DoloresTess>: 你好可爱[微笑],<桎梏each>: 美笛的头像！！！！,<迟暮杉>: 机智的孩纸[悲伤][阴险][笑cry],<Q-Wenr>: 美笛 快点出新书了好吗 好想天杨 她还好吗 也好想你,<荷花怪>: 我们看得出来是你,<Chloe_inMillenium>: 落殿整本有生之年在我心中建立起的女神形象。。。分崩离析（噗哈哈你爱用的词[doge]）,<舟与周周>: 新书新书！美笛不要忘记！[噢耶],<caio_w>: 美腻笛新年快乐！,<白莲猫->: 哈哈哈哈哈，落殿还是一如既往的的的,<盒子里的喵星人>: 真是超级爱EVA啊，头像都是,<blueblue121>: 新年快乐[鲜花],<葳葳呀>: [悲伤][悲伤][悲伤]什么时候出北北,<98小小风>: 回复 @蒋姿呀 :最喜欢的短篇集,<Funny-free>: 睡不着了，怎么办，我们聊天吧,<madameinsahara>: 葛城美里，直戳泪点,<5月的槐花>: 笛安 新年快乐 我读的你的第一本书是西决 祝愿你健康快乐 平安幸福…,<陈碧清->: 好想＋你的微信[笑cry],<折木不归>: 哈哈哈哈哈哈哈哈还好还好我落还活着[doge]画风不要太正诶,<来份草莓牛奶>: 喜欢落落 也喜欢你[可爱],<无同W-T-C>: [笑cry][笑cry][笑cry][笑cry][笑cry][笑cry][笑cry][笑cry][笑cry][笑cry][笑cry][笑cry][笑cry][笑cry],<此时彼时的城>: [许愿]看北京台春晚好像一闪而过看到你了[笑cry]不过你应该在太原吧[傻笑]新年快乐！爱你[爱你][爱你][爱你],<白鲸二三3333>: 啊别说了，让落落发红包是王道,<宅弋>: 虽说最世两后   但是请原谅我开个脑洞：笛安x落落   大气美攻x逗萌美受[doge]  嘤嘤嘤捂脸,<张航_Henry>: 上海等你！太原等你！,<蒋姿呀>: 今天又看了一遍怀念小龙女,<哈卡赛哈卡赛>: @腰不太好的王大哥  我怀疑那不是落落  那是薛琪,<活在梦里的芦荟>: 还活着[笑cry][笑cry][笑cry],<Shine九歌>: 感觉美落就是话题终结者[眼泪] @落落430  ，如果是我我根本不知道要回复什么...,<白驹过隙o3o>: 笛安姐姐新年快乐。,<_Still_Wait_>: 莫非你也像美里一样也是生活随性邋遢做事果断的女人,<丁一二不是丁三>: 落殿不发微博，美笛来。新年快乐。,<渡潼>: 我落还是逗逼依旧啊,<小殿下下>: 美笛[心]新年快乐[抢到啦],<鸡涌入我怀>: 美笛新年快乐[羞嗒嗒][爱你]嘿翻雷哟～越来越美[心]（你知道编辑开头俩字出来的是“美的”两个字吧[doge]）,<酷炫同妻666>: 哈哈落姐的语气真是我爱的聊天风格[good][噢耶][好爱哦],<Lonly_1slanD>: 两个女神    支撑起郭美人公司身高的担当,<王俭Lz>: 美笛过年好，好想你能吭一声啊，这就是最好的新年礼物了。 @笛安,<无敌张小薇>: 两个人我都喜欢…么么哒,<Angein小红>: 头像是美里啊！！！,<森野夜X>: 近乎疯癫的落落[眼泪],<马克图布zz>: 新年快乐  你还好么,<Faye璎珞>: 落落是怎麼呢？！瘋了麼……[偷笑][偷笑][偷笑] @笛安   @落落430  666666,<Aloys周颖仪>: EVA头像瞩目！！！,<泛泛而不知>: 求你和小四的拜年微信[大笑],<Catherines0>: [笑cry][笑cry][笑cry]这沟通。。。,<valued七九>: 我就想知道龙城三部曲为什么不拍成电视剧 简直浪费,<千海lyanna>: 美笛你也看EVA我更爱你了,<卖鱼罐头de猫>: 头像竟然是葛城美里？！,<Alene_Liu>: 我也想要落落的表情包,<Einsof_nothing>: EVA里唯一一枚正常的食色性也的女纸,<苏安筱_>: 落落还在冰岛么🙄🙄,<发粪涂墙好娃娃>: @一手一只鸡小腿_  笑死我了,<Ruur_>: 回复 @于佳奇Ricardo :嗯呐]
1634431184	五岁的我穿越回来给大家拜年[吐舌头][眨眼][微笑] ​​​	[<格林与瘦>: 那眼神一点没变啊,<青城lzx>: 哈哈，这样的你总算能让广大宅男心平气和的享受你的祝福啦[可爱],<miss杨先森>: 萌我一脸[爱你],<萸萝_>: 从小就是美人 长得很文艺,<我爱张国荣都不及爱你的皱眉>: 小时候就是美人坯子～[色],<扮演一棵树>: 看到这张照片 最熟悉的是眼神 [心],<犬猫人2号>: 没整。[嘻嘻] 五岁就这么优雅气质...果然天生的 @笛安,<星辰与草原>: 好可爱[甜馨得瑟],<MZDD丶>: 想泡小时候的你 @笛安,<丹野的房子>: 说，为什么长丑了？,<Yingkki-W>: 小时候太可爱了！,<蜘蛛和泥>: 看 温婉可人的姑娘自小就温婉可人 ,<奇妙张凯力>: 美的美的[害羞],<云开两生花>: 看到这照片为什么会感动到想哭呢？[泪]，对于久远的记忆表示特别没有抵抗力……,<周暗>: [爱你][爱你],<太没有想像力了>: 丸子头，空气刘海。好fashion的五岁[哈哈],<万总的甜心儿c>: 好可爱啊！！！！,<腐野花->: 美[爱你][爱你][爱你][爱你][爱你],<小水晶_jkzt>: 美笛 永远那么美 新的一年多多写书 加油[微笑][互粉],<变迁M>: [哆啦A梦花心][哆啦A梦花心][哆啦A梦花心][哆啦A梦花心][哆啦A梦花心]好可爱嗷,<叫我啊野就行>: Os : oh ！my chest ！,<曹大大你好>: 刚看完芙蓉如面柳如眉！很好看 推荐给朋友了 夏芳然的性格和你像吗 我猜挺符合 傲娇有逼格[爱你] @笛安,<百百66408>: 一眼就能看出这是小迪...,<是花呢>: 哇塞，萌妹纸，难怪颜值是天生的呢[拜拜],<花夕lovely>: 小时候比现在美呢,<兔兔牙呀->: 好美！女神[害羞],<刨你家地盖我家厕所>: 二十几年来一直未进化  还是童年太好我们太挫,<潋滟__>: pk!!!  http://t.cn/RG59OWr,<滚滚不媛>:  [爱心][飞吻]从小时候看就知道长大后颠倒众生[太阳] [飞吻],<抗郁药物>: 新年好！笛安你好可爱[开心],<Dany颠妮蛋>: 果然这样的表情包更受欢迎,<漫天都是小星星l>: 小时候的你更加萌萌哒啊 新年快乐,<老星啊>: 真是一直美到大啊喂,<喃喃畅>: 空气刘海以及红配绿的时尚感[doge]   我喜欢[害羞],<valued七九>: 回复 @长脖子流氓兔 :可是这个真的很有剧本感啊,<Yukihoneys>: 女神你手放哪里了！,<月野兔__usagi>: [心][心][心][心][心][心][心][心][心][心]萌,<苏格兰的骗子>: [笑cry]这么可爱,<野花自己也爱你>: 五岁美笛好可爱[爱你],<K_____没有喵喵>: 这感觉，就是每次欺负完毛毛就装无辜的美美[笑cry],<马小蹦达>: 眼睛里有一汪秋波啊[害羞],<商斓千>: 神情好动人 妩媚又勇敢 又有些畏惧,<穆二萧>: 好萌！！！！！[爱你][爱你],<都市女病人975>: 告别天堂会拍成电视剧吗,<等待阿雅>: 好可爱的笛安[haha],<WhatANewbeeGuy>: 笛安 有对象没 你比我大几岁 可我几年前就认定你是我的完美伴侣了 @笛安,<雯一只蚊>: 回复 @valued独行狗 :看看那些小说被改成什么样子[喵喵]还是别毁了[喵喵]而且电视真的不能体现书我觉得,<白茶折扇折子戏丶>: [眼泪] [眼泪] [眼泪] [眼泪] 很不乐意照相的表情。,<Bonjourling>: 超可爱 小时候也那么漂亮～,<valued七九>: @valued独行狗 : 我就想知道龙城三部曲为什么不拍成电视剧 简直浪费 这么多年了 真是我最想看到的拍成片的小说,<广陵bywf>: 啊啊啊超可爱[爱你][爱你],<雁落孤山_被男神苏得死去活来>: 一直都这么好看呀！新年快乐~]
1634431184	放心去飞 ​​​	[<张勐卐斩断光阴>: 同问～其实这个飞鸟的时代还谈不上华夏或汉民族，那只是东亚一个重山峻岭中神秘的神权酋邦// @笛安 :好美。。。就想问问贵堆有仿制品卖嘛[傻笑],<忆呀么忆蓝阙>: 回复 @笛安 :二把刀也比门外汉强点。。,<抵达伟大渺小>: 某宝上都不长这个样子[doge][喵喵],<2017过skky_--->: 感觉不能再喜欢上你了,<笛安>: 回复 @Zeroperi :不，读了不到三个月，没毕业[笑cry],<忆呀么忆蓝阙>: 我才想起来你是历史系毕业的。。,<星星伞下的梨花少女>: @为了我的女神正在努力的田松昊  审美都跟我一样,<挺枪四顾心茫然>: 这个是不是朱雀，求解。,<young小施>: 来四川，我带你找地摊高仿货,<绿厢>: 逗比[笑cry]贵堆,<Kelzr>: 。。。（考古学旁听生送上评论）,<柒柒是三无产品>: 应该有的吧  我堂姐以前去玩就买了,<Veranessa>: 作为一个广汉人突然觉得好荣幸,<挪威人群>: 估计贵堆看到也是醉了[哈哈]，美笛，上次在华中科技大学看到你，很喜欢你呢，继续加油哦，期待[good] @笛安   @笛安   @笛安,<Sunny-宝剑xi>: 有吧[熊猫][熊猫][熊猫],<Ashley_llw>: 这是广汉滴～来吧来吧我送你 [阴险][阴险]广汉人[耶][耶],<showpunker>: 在此堆可以在实地买到仿制纪念品。看你运气喽。,<FrankwuLeon>: 走，咱们去掘个墓看看有没有[坏笑],<一阕惊厥>: 笛安现在是在四川吗？,<泠漌>: 贵堆[哈哈][哈哈][哈哈],<来自心里的声音>: 应该称呼贵馆吧。,<赖冠霖敲可爱>: 打滚卖萌求拥抱[可爱],<在死神的肩上眺望永远>: 哈哈哈贵堆这个说法好萌,<琪姑娘的二三事>: 美笛，有仿制的纪念品哦[爱你][爱你] // @笛安 :好美。。。就想问问贵堆有仿制品卖嘛[傻笑],<穆渊堂-杜君泽>: 淘宝上有的，只不过要同款三星堆的青铜鸟要找找了，相对来讲，三星堆的青铜器比同期其余文化的青铜器物更具特色,<莫晨MM>: 我去过两次。里面好好玩，不过不知道里面现在成什么样了，听说比以前还好看,<shyrohahahahaha>: 三星堆门口。。。全是小的仿品。。,<WMFan_>: 表示在德阳上学的我，一次都没去看过[doge],<YageHyun>: 哈哈哈哈 可爱[好囧][转发],<阿桐黑凤梨>: 有很多纪念品和有趣的明信片哦！！！！有时间来广汉耍吧！导游我来当啊！！！！[哈哈],<E藏好了>: 怕是要穿越才得得到 // @笛安 :好美。。。就想问问贵堆有仿制品卖嘛[傻笑],<阿桐黑凤梨>: 来我大广汉！天天泡在三星堆都行[赞],<我觉得我还能吃>: 我以为是高跟鞋。。,<Children__>: 淘宝是万能的[doge],<大王喵shirely>: 多适合躺上去做摇摇床[喵喵],<苦矣>: 贵堆……[笑cry],<猪扒半熟>: 要不我帮你问问？,<蹀躞-霙>: 你来。。。我带你看去,<Bvic>: 很多年以前有，我二姨家有四个。现在不知道了。,<-镜上霜->: 复制这条信息，打开[向右]手机淘宝[向左]即可看到【 家居摆件 古玩收藏仿古青铜器 三星堆青铜太阳鸟  洛阳广发青铜器】  http://t.cn/RbubHmO  [钥匙]淘口令 [钥匙]在某宝找到类似的了～,<鱼缸外面的鱼>: 文物衍生品，那边的国有文物店应该有,<北城胡同147号>: 去网上肯定可以找到,<IFIF-U>: 可以在某宝上找找[doge],<Diang帅气>: 笛安学姐我和你一个高中的啊,<dreamland-LiLi>: 记得读书那会儿看你写的“告别天堂” 难过的一塌糊涂,<把我晾起来晒太阳>: 要我帮你艾特他的cp嘛 @故宫淘宝,<向大海借三十三米深蓝>: 贵堆么，应有尽有，只有你想不到的，没有我们不卖的,<lengogo>: 贵堆……也是醉了,<Monoamine>: 贵堆[doge]那叫你是不是该叫贵安[doge]宝宝跪安了[哆啦A梦微笑],<零九二八_>: 贵堆哈哈哈哈哈哈没谁了,<琛子>: 称呼太棒[笑cry],<一只正能量小仙女>: 河南安阳殷墟多的是]
1634431184	邓飞：不惧前路，是因为我们要去做我们必须做的事情 ​​​	[<沙砾柠檬夏>: 希望乡村有尊严，而不是被掏空。// @笛安 :我记得飞哥说过：“我帮助中国乡村每个孩子都能有机会改变命运，而不是因为出身，就没有翻身机会沉下去。我希望乡村有尊严，而不是被掏空。” 我很感动，所以从今年起，愿尽绵薄之力。                                                       ,<XL-Shi>: 有在支付宝捐过午餐 人民吃饱都不能保证 我们的国家真的还需要努力 我自己饿一顿都觉得很难过了 孩子们呢？ 虽然我们平时都挺冷漠 可能电视看看 流点泪 就觉得自己爱心就挺多的 10块就够偏远山区孩子吃个很好的饭了 不用时时刻刻 偶尔想到 就可以温暖孩子们的心了 一起努力[心],<很努力学啊你猜真的假的啊>: [爱心]️[爱心]️[爱心]️,<一朵蘑菇蕾>: 愿乡村被热爱，而不是被遗忘,<Demilingling>: 美笛，祝你今年一切都好[心],<HarPer_Yin>: 2016  愿好运伴随善良的你[心],<小仙女要去乘风破浪啊>: 学姐加油！新年快乐[太开心],<画舫1900>: 愿你心想事成[兔子]美笛，希望你成为你喜欢的自己。,<车我夜游天光墟>:  // @笛安 :我记得飞哥说过：“我帮助中国乡村每个孩子都能有机会改变命运，而不是因为出身，就没有翻身机会沉下去。我希望乡村有尊严，而不是被掏空。” 我很感动，所以从今年起，愿尽绵薄之力。                                                       ,<TODAY8-18>: [爱你][爱你]爱你多年没错// @笛安 :我记得飞哥说过：“我帮助中国乡村每个孩子都能有机会改变命运，而不是因为出身，就没有翻身机会沉下去。我希望乡村有尊严，而不是被掏空。” 我很感动，所以从今年起，愿尽绵薄之力。                                                       ,<蓝图Sea>: 新年快乐 [心],<尹小姐的臆想症>: 美笛  加油  新年快乐  沙发呀  [哈哈],<蓝图Sea>: 正在刷三小只微博  就看到你[挖鼻],<写玄幻的喵>: 笛安老姐棒棒哒，[色][色][色],<小怪兽夏苜>: 新一年继续加油吧！]
1634431184	“那美好的仗我已经打过了。”新年快乐～～ ​​​	[<Lycheeeeeeh>: “我们一起战斗过”,<猪猪本涩>: 北北长大了一岁哦[可爱],<王俭Lz>: [汗][汗][汗],<纸月李子越>: 从此有桂冠为你加冕,<YangFan--帆>: 回复 @笛安 :很开心～上帝很爱你～祝福～,<琳琳琳琳磷脂>: 美笛我是高三狗我常常在作文里面写你！！祝美笛新年快乐！祝“未来定义者”开开心心做好“我”！也祝我高考加油[爱你][爱你][爱你],<九亿少年的小姐姐C>: 新年快乐[爱你][爱你],<吴双ss>: 你也是基督徒吗，愿平安喜乐归给你,<小迷糊有大梦想>: 其实 我想知道 天扬过的好么？南音呢？东霓呢？,<笛安>: 回复 @FANYANG帆 :对啊，不是秘密[微笑],<沉沉呐_>: 美笛love u~,<伊森的小鹿>: 新年快乐 [微笑],<Chua美婷>: 新年快乐～ [眨眼],<我叫莹莹->: 美笛快乐 做自己 爱生活哦[心],<我是路婷>: 那祝福你了 我到春节的时候才能打完呢[馋嘴],<老公舉劉兎花>: 亲爱的笛安，这一年里，我会努力地向你走过去，成为一个我自己能喜欢的写故事的人。新年快乐。,<YangFan--帆>: 你是基督徒～ @笛安,<子柚912>: 新年快乐！期待新书！,<西弦是抹茶味的>: 新年快乐[爱你],<棉花糖是桃子味的>: 新年快乐[兔子],<文铎_>: 新年快乐啊[转发],<飞鸿旧月>: 新年快乐[爱你],<舟与周周>: 新的一年来啦，我还是会默默陪着你安[爱你],<世游人游世>: 笛安，新年快乐啊[微笑],<ESTHER_AR>: 今天早上想到你了   在想朋友的时候,<尼莫more>: 笛大大新年快乐~好期待你再次出书,<白驹过隙o3o>: 笛安姐姐新年快乐 2016继续喜欢你。,<_MsuI>: 新年快乐[爱心发光],<小小滴人儿啊啊啊>: 美笛新年快乐[心],<迷鹿xue>: 新年快乐[爱你],<杞周周周>: 当守的道我已守住了，从今以后，有公义的冠冕为我留存,<快别这么说_>: [乾杯][乾杯][乾杯][心][心][心],<咚咚隆咚锵嘿>: 新年快乐。[爱你][爱你][爱你],<丧宅少女日常>: 我也是[鬼脸二],<kkoozj>: 2016年会更好[爱你],<想吃烧烤的阿車>: 新年快乐[爱心][爱心][爱心],<我的眼睛是月亮>: 不管好的坏的2015过去就是2016，新年快乐~亲爱的笛安[爱你],<唐丫丫不姓唐>: 那我们彼此陪伴再过一年,<普通用户tm123>: 新年快乐呀，笛安,<嘟嘟嘟923>: 今天我早上走在路上居然莫名其妙的想起了你的那篇圆寂，然后吸了吸鼻子，才知道自己感冒了，新年快乐,<学徒代庆禹>: 女朋友笛安新年快乐[可爱],<方文_Pri>: 美笛真开心假装你又陪着我多了一年[心],<空山新雨0620>: 美笛加油加油再加油！,<ayabon>: 去年也是笛安的話讓我主動轉發[太阳],<把我晾起来晒太阳>: 美笛新的一年快快乐乐[心],<借物小人>: 不管怎么样，血染沙场总是件壮丽的事儿，新年快乐。,<野蛮中的内敛>: 新年好，亲爱的笛安,<峥嵘枯骨无所怕>: 新年快乐，笛安。,<莘敔>: 2016陪你陪小赏一起过,<苏upup>: 别人都在看演唱会出去嗨跨年   我昨天买了你的令秧回来连电视都没开直接看过了跨年[拜拜],<Mr黄志坚>: 还在前线，新年快乐！]
