1744188571	门上缺年画不？我这有哇，不谢[坏笑] ​​​	[<寻妖不遇_音频怪物1212生日快乐>: 不缺年画，缺你[爱你],<小小小柔软>: 贴着不孕不育，吓萎了[微笑],<夏侯蚊子>: 哈哈哈哈哈哈哈老公你好可爱[哈哈],<致我心尖的你>: 🙈  http://t.cn/RxSTNhk,<糖五米不甜>: 我去听老妖的歌抢救一下,<44331客户端>: 求软件   求软件   求软件,<忆欣小小只>: 吓死宝宝了( •̥́ ˍ •̀ू )嘤嘤嘤~绝对辟邪呀！,<瑾琛是个好孩子>: 可以的[doge]辟邪神器,<天权说书先生-黍离>: 回复 @哆瑞米Alex :厉害了，违和感已下线[二哈],<江湖一只藕霸>:   hhh小年兽吓哭,<起灵一笑-阎王绕道>: 回复 @饕餮表示肝没了 :哈哈[doge],<十三与-泠央>: 好好说话别发自拍…一定要发的话……好好自拍，别来对眼[摊手][摊手],<梨洛三千>: 百鬼夜行赫赫[舔屏],<柏舟_万花谷的男人从不认输>: 不缺不缺，真不缺,<嗷呜呜汪汪汪>: 最后一个还是毫无违和感的……,<馒头的日记-O>: 妖君该吃药了[眼泪],<6夏天西瓜9>: 大过年的就不怼你了[拜拜],<陵春夏>: 过个年都浪成什么样儿了🙈,<七野九浪>: 我一定要打印出来裱门上，辟邪,<爱豆饱饱太优秀>: 老怪，你这是鬼娃娃啊 @音频怪物  [污],<甘楽le家滴_楠神233>: 最后一张毫无违和感,<雨薇语>: 可以ヾ ^_^♪，很辟邪[偷笑],<网瘾少女微澜澜>: 鬼：辣眼睛[眼泪][眼泪],<音末呀>: 请问有辟邪用的年画吗?来四张!,<荲芫>: 你不可以这样！！！！我会被洗脑的[大哭][大哭][大哭],<花影流觞>: 鱼类终结者。。。,<向DY势力低头>: 说腾讯给你多少钱 我网易给双倍[doge][喵喵][doge],<拒绝全职真人剧>: 我不要谢谢[拜拜],<花萝卜酱->: 回复 @哆瑞米Alex :没毛病,<花萝卜酱->: 辟邪用很好[doge],<呔呔你这个呆子>: 求问。这到底是什么软件搞出来的？？,<在下元芳请多指教>: 绝对辟邪  神都不敢来了…………,<回舟不黛月>: @须菩提于意云何  吓人[笑cry],<许你一身红妆>: 妖叔，我这不缺年画，缺个你，你来贴我家门上，这一年啥也不怕了，你的字怕足矣吓跑一切,<素世凉烟>: 最后一张毫无PS痕迹2333333,<正版流萤>: 这年画是用来辟邪的吧。。。,<苏生会幸福>: 老妖你有毒哈哈哈,<莫困困dz>: 看了这照片才发现我们门上的年画弱爆了,<xueba十一>: 辟邪图集[微笑],<起灵一笑-阎王绕道>: 老大p图的技术无人能敌[doge][doge][doge],<田灏THBee>: [笑cry][笑cry][笑cry],<一一张起灵最爱>: 666666贴床上避孕,<佛理悠悠>: 我知道了，老妖你已经，药石无灵了，什么都救不了你了。谁拿什么来卸掉你手机的软件我的老妖[污][污][二哈][二哈],<在山的这边水的那边有一窝小逗比>: 大家有没有觉得最后一张毫无违和感呐！,<在山的这边水的那边有一窝小逗比>: 点开我才发现了真相[震惊],<安陵妖>: [摊手][摊手]很好，辟邪！  http://t.cn/RxbbY2n,<在山的这边水的那边有一窝小逗比>: 可以考虑把你'照片贴上[doge],<景云13>: 回复 @王木木木兮 :mua~,<秀眉老父->: 日常一瞎[喵喵]啊我有点心疼鬼，心疼鬼一秒，阿不半秒不能再多了[doge],<秀眉老父->: 回复 @SIn-PuniRe :日常一瞎[喵喵],<燕来迟_>: 我    我拒绝,<狐长安>: [微笑][微笑][微笑]不敢要,<一妖七一>: 哇！贴门上会不会被世界孤立,<DTing凉生>: 估计今年压岁钱会泡汤，因为没人敢来了,<闲潭悠影>: 吓自己[doge],<朝夕妄想-不看抄袭>: 辟邪[笑cry][笑cry][笑cry]]
1744188571	想你是哪吒脑海 ​​​	[<本大爷今天也和小鸟一样快乐>: 倾家荡产赌魂路[拜拜] #阴阳师手游#   http://t.cn/Rx4MuJv,<老张YY_TTT>: 我都不想关注这个人了好吗…[挖鼻],<河图-洛书郢>: 您那…保重身体，现在海里得多冷啊？！  http://t.cn/Rx4Ap6q,<尘缘如梦XYC>: 我看到痘痘了[笑cry],<野宿近荒城>: 敲好看啊。[笑cry],<blingbling豆瓣酱i>: 回复 @是Barry呐 :666,<狸措睡仙>: 可以考虑出一本老妖志怪画册绝对畅销[喵喵],<乄Allen丶>: 回复 @爱吃肉的东南子 :哎呀。古风同好,<爱吃肉的东南子>: 回复 @乄Allen丶 :帅的不行,<爱吃肉的东南子>: 回复 @是Barry呐 :抱大腿,<小可可可可爱呀_>: 回复 @是Barry呐 :求带打排位[doge],<莔rz鬼公子>: 回复 @朕是米子-小号 :[偷笑],<lolosign>: 这么一看是美人啊[哈哈][微风],<卓卓卓卓卓一个艹>: 给我表姐看，我表姐一脸嫌弃的说好丑哈哈哈哈哈哈哈哈哈,<圆圆为昵称很纠结>: 喂！妖妖灵吗？我要报警！,<是Barry呐>: 回复 @NINI珍珍珍ZHEN :好啊[doge][喵喵][二哈],<NINI珍珍珍ZHEN>: 回复 @是Barry呐 :大神  带我一起飞,<朕是米子-小号>: 回复 @莔rz鬼少爷 :哟呵，你真强！,<一只讲故事的喵_古人id郭奉孝>: 回复 @叶凰舒 :很攻[喵喵],<叶凰舒>: 回复 @一只讲故事的喵_古人id郭奉孝 :我的李白可能有毒[二哈]  http://t.cn/Rx2j5FY,<桃片儿丶丶>: 毫无违和感……你真是棒棒哒！,<君山祁子戊>: 回复 @-唐明惑- :(･ิϖ･ิ)っ[白眼],<离鸢子毕竟是莱戈拉斯后妈>: 我滴妖你还有粉吗哈哈哈哈哈哈,<明惑不解>: 回复 @君山祁子戊 :可是我站总裁受啊[doge],<莔rz鬼公子>: 回复 @朕是米子-小号 :亲爱的米[爱你]，找到你了,<杏子i卿墨>: 回复 @杨柳岸_残月晓风长亭晚 :再配一个“霸道总裁爱上我”[哈哈][哈哈][哈哈],<青年晚报特产戬杰狗>: 哪吒闹腾[摊手],<啊不然呢又怎样>: 回复 @乄Allen丶 :小哥哥这个好看！,<篱墙sama沉迷老妖无法自拔>: 别说了  我的脑海里已经都是你了,<甜度不够糖来凑>: 只有我一个人想艾特刘全有的吗？？？,<君山祁子戊>: 回复 @-唐明惑- :我靠，他们都说受！你是第一个总裁！[鼓掌],<离幽517>: 厉害了我的妖。。。,<哪吒苏苏>: 可以当头像[doge],<一个奇怪的___>: 我真是你颜粉，别吓人了行吗  http://t.cn/Rx2PwTV,<W兰泽W>: 有点糟心[二哈][二哈][二哈],<此生只爱玉一人>: 毫无违和感[摊手],<北雨兮>: 你赢了-_-||,<白夜迟>: 回复 @风过落叶绣而乱苏 :觉得自己攻气满满[眼泪][眼泪][眼泪],<白夜迟>: 回复 @音频怪牛勿  的赞:天呀我以为老妖给我赞了[眼泪][眼泪][眼泪],<秦淮下弦月w半扇竹门>: 回复 @Z芥末_Muu :[笑cry],<夜衾枕寒>: 回复 @杨柳岸_残月晓风长亭晚 :就服你[二哈],<何辞君安>: 厉害了我的老大[眼泪][眼泪][眼泪],<明惑不解>: 回复 @君山祁子戊 :好一个总裁脸[doge],<明惑不解>: 没有刘备哥哥不科学[二哈]  http://t.cn/RxARP1N,<愛喝多加点峯蜜緑蘇打的金烨英>: 你以为我会说：这世上最美好的就是你在闹我在笑吗。你他妈让我先取关十秒钟，再来爱你。[笑cry],<明惑不解>: 回复 @一只讲故事的喵_古人id郭奉孝 :[二哈]  http://t.cn/RxA8nb3,<倾醉->: 转发这个哪吒在一分钟内你就会被打[doge],<apartless>: 真心魔性了。。。。,<兎孖SAMA>: 要不要个刘邦！这里有！刚买的！陪你千里双飞送人头,<清言大总攻>: 回复 @Z芥末_Muu :没毛病老铁,<是Barry呐>: 回复 @洛二二 :就喜欢你这样的好队友[眼泪] [眼泪] [眼泪],<洛二二>: 回复 @是Barry呐 :那……那我也可以给对面喊666[眼泪],<是Barry呐>: 回复 @洛二二 :啧啧啧，我要打不过怎么办[喵喵][喵喵][喵喵],<一只讲故事的喵_古人id郭奉孝>: 回复 @吾邪V5_但求一睡蓝曦臣 :[二哈]被你这么一说我还真这么觉得了,<洛二二>: 回复 @是Barry呐 :不不不我负责喊666你负责打[doge],<是Barry呐>: 回复 @洛二二 :所以你要带我吗？[doge][doge][doge][doge],<吾邪V5_但求一睡蓝曦臣>: 回复 @一只讲故事的喵_古人id郭奉孝 :李白真白啊[二哈]]
1744188571	特意拍了张喜兴的照片恭祝你小年快乐[坏笑] ​​​	[<keisuaagan>: 回复 @-i佳薇 :估计是千年了,<-i佳薇>: 回复 @keisuaagan :那你千年没看见我了,<keisuaagan>: 回复 @-i佳薇 :贼特别非常很像,<-i佳薇>: 回复 @keisuaagan :你看错了,<Karrimo>: 感觉还挺好看的啊……,<燃初是总攻>: 嗯，这样的妖大有点美。我可能是瞎了,<蒋帆X-Y>: 图片评论  http://t.cn/RxRJHEb,<fullmoonJY>: 回复 @wyf慕篱 :哈哈我也发现了这是为啥啊？,<这个逗比不靠谱>: 张喜兴是谁？[doge][doge][doge],<景玉丞>: 这张意外的很美∠( ᐛ 」∠)_,<一不小心就是一个人>: 图片评论  http://t.cn/Rx8A351,<柴狍田子>: 张喜兴是谁？？[疑问][疑问][疑问][疑问],<DengBohan_73>: 妖儿啊，裂了  http://t.cn/RxHENvo,<姓张名良字子房>: 我不是他的粉路过的诈一看照片“艾玛吓死宝宝了～”困意全无[doge][doge][笑cry],<玲珑文章>: 谁能告诉偶，红包口令是什么,<起灵呵>: 我妖美如画[微笑],<正版浅浅>: 回复 @沙与沫300 :握,<慕小枫填坑至天荒地老>: 哈哈哈哈哈哈哈哈哈老大你哈哈哈哈哈！倾国倾城！不服的来打架！,<梦里断长生>: 我可能关注了徦老妖[doge][doge][doge],<正版沫汐>: 那上面p图时说要有长发至耳朵，所以你的长发从哪来的[喵喵],<沙与沫300>: 回复 @正版浅浅 :有缘人。。。握爪,<短歌微吟难长>: 看了一会好像还挺好看的[doge],<削九科_>: 谁是张喜兴[doge],<斜竹影>: 回复 @长白终 :可能吧，但抄袭总归是不好的，希望能不看，不转发，不宣传，祝你找到下一个名至实归的女神,<长白终>: 回复 @斜竹影 :每个人的感觉不一样吧，喜欢的也不一样，比如三大邪教的魔道祖师（不是喷不引战），我看了也没有感觉,<斜竹影>: 回复 @长白终 :呃。。。。我也看过很多小说，阿兰诺这个人设很普通啊，就是一个传说，然后救了很多人，牺牲了，拥有许多金手指，而且她不是凤九的影子吗？说实话，枕上书架构太乱了，我实在没看懂，写的不行,<长白终>: 回复 @斜竹影 :我去看看再说吧，因为真的太喜欢阿兰若了,<斜竹影>: 回复 @长白终 :可唐七是抄了好几个情节，混成的这一个人啊  http://t.cn/RxcLTjp,<长白终>: 回复 @斜竹影 :因为阿兰若是唐七笔下的,<长白终>: 回复 @斜竹影 :我看过上千本小说，从来没有见过像阿兰若一样的人，是我唯一喜欢的一个女性角色，抄的话，我也想看看原型,<斜竹影>: 回复 @长白终 :而且你既然只喜欢阿兰诺一个人，为毛要买唐七的所有书？,<斜竹影>: 回复 @长白终 :一个人的性格，区分点是根据她的情节剧情来的，而这个阿兰诺的情节就是抄的，而且整本书都是抄的，你还期望阿兰诺清白到哪去呢,<虞拂拂拂>: 怎么可以这么美[二哈][二哈][二哈],<琉璃钟琴>: 回复 @剧毒物质H2O :就像吃了人一样,<起冥>: 回复 @楚清嘉 :这个妖怪也是有大胸[二哈],<张起灵的女人>: 大姐姐你长胡子啦🙃,<沐锦尧>: [微笑][微笑][微笑],<DTing凉生>: 依稀的看见鼻子上那青春洋溢的小痘痘,<长白终>: 回复 @斜竹影 :我因为阿兰若才买的唐七的所有书，如果阿兰若不是抄袭，那么其他的，对我来说没有意义,<冰雪狂舞007>: 初听你歌，认为汝乃古风真男神;后加微博，辣眼桑心脑仁疼;又有此图天天见，一见想吐眼睛痛，二见干呕不想看，三见惊觉还不错，四见差点爱上你！！！我一定是病了，医生！医生！！快救救我。,<斜竹影>: 回复 @长白终 :呃，说实在的，枕上书我只看过一遍，还是高一看的，已经记不太清了，你可以百度调色盘，而且我觉得抄的可能不是一个具体的而是好几个混在一起的,<墨色已褪画未完>: 发现老妖最近爱上了豆沙色唇膏[doge][doge][doge],<正版君悦_清歌越过长宁街>: 你用自拍吓走了多少粉丝。。,<犬白白无证驾驶宝宝车>: 这大概是老妖PS的巅峰之作了，评论纪念一下,<一口一个金厉旭>: 回复 @一口一个刘诗诗 :[doge],<115猫星人>: @音画之空  一个糙汉的粉红少女心,<小女子小懒-晃梦炮家丫头乃蝶妖>: [哈哈][哈哈]🙃🙃,<长白终>: 回复 @斜竹影 :你还是没有说阿兰若抄的谁啊………,<林小祸>: 图片评论  http://t.cn/RxApoxT,<安静的女猴子·嘤>: 我可能粉了一个假妖。,<东方梧桐枝>: 等会，三生三世十里桃花？？,<翊歌霏扬>: 哎，老大重回美图秀秀界[摊手],<陈滢予Sunny>: 风油精进眼[笑cry][笑cry][笑cry],<日安r->: [摊手]我为什么要关注你和高晓松,<正版小满哥>: 我的第一反应:张喜兴是谁?[doge],<斜竹影>: 回复 @没事遛遛企鹅玩儿的西尔 :她就是写的不好，能写出亭亭玉立的茅草屋，稠稠的稀粥这种东西的能有多好。]
1744188571	这位女士是不是很有镜头感[笑cry] ​​​	[<捡到一只谢药药>: 回复 @一只胖妮儿 :同,<wb歪_想喝海水>: 回复 @Zhang_恬熙 :发了,<冷漠市民_恬女士>: 回复 @别和我抢鸡腿_wb歪 :小姐姐求原图,<四月的Apr>: 唔 美女你…有男朋友了吗[doge],<卿非郁>: 回复 @一只胖妮儿 :没错。,<朕要变身了>: 哈哈哈哈哈，，，我不笑,<月淡雨停>: 嗯很美（怎么觉得有点亏心呢[思考][思考][思考]）,<竹君nio>: 我觉得我可能玩了假的微博,<红唔柒柒>: 呃呃 你胡茬没刮干净[开心],<清梦知秋>: 回复 @一只胖妮儿 :曾经的我认为老妖是古代的铁血将军，图大是温润如玉的翩翩少年郎。后来，我发现我错了……,<离幽517>: 美女你谁[眼泪][眼泪][眼泪],<大半晚上撸作业>: 在自黑的路上一去不复返了,<贰壹贰壹贰哟>: 怎么每次看你的微博都会懵逼,<谁顾荒颜>: 你是要跟杨幂抢白浅吗[眼泪],<yyy1814>: 觉得有点儿像闫妮[心],<污恩>: 回复 @一只胖妮儿 :+1QAQ看到微博那一刻心都碎了,<所以我把唱歌当作写情诗>: 美哭[笑cry][笑cry],<錢小妍吶>: 回复 @一只胖妮儿 :我也是[笑cry][笑cry],<微微一笑不倾城哒>: 我还以为被盗号。。。[doge][doge],<洛书梦一场>: 三生三世十里桃花[二哈],<音频红尘>: 看你脸上那个大红痘[思考],<噗哩噗噜咕叽咕唧>: 我竟然觉得有点好看…,<人生荒醉但唱观音>: 我竟然觉得还挺好看,<正版妖妖零>: 最近要转型么大妹子[喵喵],<恣意君临>: 不好意思，看成了美女，我有罪[doge],<请叫我放荡不羁小王子>: 高晓松:我认输[摊手],<南风诉情>: 回复 @简栖棠 :百度 用图片搜索,<夜半叶语>: 是的是的，你最美[可怜],<张六月是几月啊哈哈哈>: 回复 @一溪云哟  的赞:？,<蒂铘小天使>: 我觉得挺好看的呀[笑cry][笑cry][笑cry][笑cry][笑cry],<JK薯愿姬>: 回复 @一只胖妮儿 :同感,<别打扰我吸氮气>: 乍一看像闫妮，，，也挺好看啊，真的,<wb歪_想喝海水>: 回复 @花開渃相兮 :已发,<灼镯Fr>: 这位女士若隐若现的胡茬有点销魂[doge],<花開渃相兮>: 回复 @别和我抢鸡腿_wb歪 :情敌小仙女，求原图[微笑],<哎喲喂被你發現了>: 我就不应该先听你的歌，再关注你微博的…不过那时候你还没这么…嗯…[攤手],<仲大柳洞>: 完了感觉老妖已经能驾驭这种风格了好看（躺）,<i蓝夏>: 这位女士 你可能长了真胡子[摊手],<唯有良人>: 回复 @一只胖妮儿 :感觉和你一样,<唯有良人>: 艾玛，妖怪[污][污][污],<-苏绝>: 我还以为是哪里的美女。。。正想保存发现略眼熟。。。。。我大概是眼睛有猫病,<简栖棠>: 回复 @云河长霄 :哈哈哈这是什么软件,<绿豆杀包>: 我竟然觉得…真挺好看的…,<same泽>: 老大，受小弟一拜,<312无敌小分队>: 卧槽。老妖。你你你这个妖孽。快走开,<执笔洛阳间>: 回复 @一只胖妮儿 :感觉真是如此啊,<烟花三水脱非洲>: 反串毫无压力！就是该减个肚子[偷笑],<瓷骨->: 回复 @瓷柚- :艳冠群芳[doge],<温齐WENQI>: 美图秀秀内部工作人员的内心是崩溃的。。。。,<并不知道我的昵称叫什么>: 我只想听声音[笑cry],<吴忧忧忧忧233>: 第一反应，妩媚。第二反应，那迷离的眼神。第三反应，我要存图。第四反应，哎呀我去，哦买噶，这胡茬是什么鬼？！摔！擦手机擦手机，怎么还有？看完评论区，宝宝抱膝思考。我可能进了假微博。,<吴忧忧忧忧233>: 回复 @y榴莲籽y :飞流直下三千尺，疑是银河落九天。【噗嗤】,<小粒子是蛐蛐的校长-莫待江湖老>: 回复 @一只胖妮儿 :噗哈哈,<小粒子是蛐蛐的校长-莫待江湖老>: 我觉得评论里的都是真爱粉[笑cry][笑cry][笑cry]]
1744188571	我俩脸太大，谁都装不下了[哈哈] ​​​	[<风车带动的风>: 突然间看你感觉瘦了好多[傻笑][傻笑],<老妖家的小番茄>: 叔……[羞嗒嗒],<晨纓菇涼>: 好感动居然有好好拍照噢,<爱星星的小米>: 手短[笑cry][笑cry][笑cry][笑cry],<落花时节又逢咩>: [笑cry][笑cry][笑cry],<一只能吃的泉小墨>: 它比不了你[doge],<熙亚_EC一生推>: 这张老妖蜜汁少女[喵喵],<特曼家的假奶特仑苏苏>: 回复 @_张六月____________ :哈哈哈哈一时没注意[笑cry][笑cry][笑cry],<妞妞perfume>: 老妖，你是不是觉得特安慰，终于有比你脸大的了。。,<冷桐花下清林上>: 不如不要脸[二哈],<离书槿>: 你是我的眼～当我照相是都装不下，你是我的眼～装不下我也依旧爱你【比心】,<听雨听雨yu>: 老妖你脸并不大，嗯。。。。。。。嗯挺瘦的。。。。。。。。。。好吧我承认，这是不可能的,<随风潜入夜雨声烦>: 所以这是啥[笑cry],<喵啦个妖>: 谁家的小媳妇啊？好害羞的样子，来 让姐姐疼疼你,<咸鱼无罪>: 一个正常的自拍？[喵喵],<lucky小妖儿--追风>: 老大，你以为这样我就不知道你胖了么[傻眼],<夏烘>: 没有比较就没有伤害[拜拜]妖你放开它,<愛吃肉的貓2015>: 只有－句＂欲蓋彌彰＂[污]不忍吐槽！,<张六月是几月啊哈哈哈>: 回复 @苏苏不是苏哥哥 :频啊。。。。是步页。。。。。。,<洛若安生>: 有没有觉得很少女！,<正版涉尘>: 生平第一次觉得你脸小[doge],<唔过二级唔改名>: 评论的手短脸大我真的要笑疯了[笑cry][笑cry],<业七K>: 不怕，已在人家黑色曾亮的头上看到你整张脸的倒影了[喵喵],<欧阳路琪>: 也可能是你手短呀,<妖唧>: 别掩饰手短的事实[doge],<猫夜_沉迷学习无法自拔>: 脑中只有一个词。。。。小鸟依人。。。自拍那么正常。。。老大你被调包了吗[笑cry][笑cry][笑cry],<追自己尾巴好困难>: 你看看反光的脸！都变形了！,<枭尼逗比比比比比>: 脸大不假.但是手也短哈哈哈哈哈哈哈哈哈哈哈哈哈哈哈哈哈哈,<妖五公子>: 自拍技术越来越好呀你，可是我就是想看妖艳妖怎么办,<人未如玉世无双>: 你居然到了！等我！,<沐子箫>: 妖妖蜜汁娇小。[摊手][摊手][摊手],<刘文叔0205-卜竹>: [眼泪] [眼泪] [眼泪] [眼泪] [眼泪],<张六月是几月啊哈哈哈>: 回复 @音频木南_妖嘤嘤嘤嘤 :嗯啊！摸摸大[偷乐],<音频木南_妖嘤嘤嘤嘤>: 回复 @_张六月____________ :小可爱我收图啦,<音频木南_妖嘤嘤嘤嘤>: 手到用时方恨短，不然拿远点是不就照上了,<V-易然>: 我不服，最近为什么都是这种不正常的自拍[摊手][摊手][摊手],<千年纪事>: 不照自己，画面宽度刚刚好,<Seventeen-ty>: 主要是你脸大[doge],<Only爱娜娜>: 不是脸太大，是胳膊太短,<一只烤鸭子>: 小图以为右边是你，左边是你找的妹子[二哈],<耽翼要从羽毛开始变强大>: 有个东西。。。它叫自拍杆。需要吗，我给你送去,<无类天使>: 脸大不能太近自拍[拜拜],<从来不用拖鞋拍死小强>: 可以可以很强势[眼泪],<coser零子>: 已经露出了三分之二了,<妖家凌小琬>: 不不不是他脸太大了。,<寻妖不遇_音频怪物1212生日快乐>: 老公最近的自拍真是越发正常了[doge],<正版花花_世界独自成眠>: 你终于小鸟依人一回[doge],<没想好要改什么昵称的苏苏>: 发现最近的自拍都比较正常，请继续保持[爱你][爱你][爱你],<千道歌>: 妖叔，哼哼，敢不敢一张脸霸屏,<楠茶蓝鱼鱼>: 我的妖你个心机抱爱！你拉着它一起拍照就是为了衬托你自己其实脸挺小的还想让我们夸你脸小了是吧！是吧！是吧！我就不夸你！,<辰宿列张cc>: 脸大手还短[笑cry]]
1744188571	心满意足[鼓掌][害羞]感谢达华哥[祈祷]@任达华 ​​​	[<张六月是几月啊哈哈哈>: 回复 @正版苏笠 :hhhhhhhh情敌乳齿可爱,<正版谨言>: 回复 @_张六月____________ :我刚想说抬头纹的问题，结果看到了你这么说……想了想……嗯……不说了……满足了……[笑cry][笑cry],<阿恒追随叶凉凉的荣耀>: 老大 你的脸怎么了老大,<声有萧仙醉在忆情>: [爱你][爱你][爱你],<哑祭大总攻-轻薄家小尾巴>: 老哥你要进军演艺界了？？？狗富贵，汪汪汪[二哈],<活蹦乱跳的星星>: [兔子][兔子][兔子],<菜花君烽烽>: 妖，胖死你了[摊手]减肥啊，你熊的！！,<YYYa军>: 老怪果真老，跟任达华一比较，立马显现出来了，不过就是让人喜欢,<拂晓Melo>: 一看就不是一个频道的╮(╯▽╰)╭,<醉梦梳>: 苟富贵勿相忘！！,<离人的月光->: 不说啥了，苟富贵勿相忘！,<速溶芒果>: 回复 @掉在坑里的甜酒月饼 :可以，但是抱走之前得先抱抱我[污][眼泪],<十臣>: 老大一枝花[樱花],<一入古风深似海从此流行是路人>: 回复 @不发自拍我们还是朋友 :[笑cry][笑cry][笑cry],<一入古风深似海从此流行是路人>: 回复 @半隐阑珊晚风凉 :也许是吧[哈哈],<一入古风深似海从此流行是路人>: 回复 @麋鹿璐璐璐 :哦哦，谢谢！,<黄烦烦-夜雨声烦>: 回复 @芒果切片- :图好看，可以抱走吗？[羞嗒嗒][羞嗒嗒][羞嗒嗒],<慕青音>: 苟富贵！！！我的妖,<广寒宫的小狮子>: 回复 @不发自拍我们还是朋友 :看到老王好亲切盒盒盒，莫相忘[笑cry][笑cry][笑cry][good],<云笑skaya>: 这大胖丫头[doge][doge][doge],<偶尔脸盲路痴的路人丙>: @薛定谔的大脸猫奶奶  [偷笑][偷笑],<李峋笑一个>: 苟富贵，勿相忘。,<清沫mio>: 老大！！！？为什么我觉得你瘦了！！！是我的错觉吗？？？,<禾子_锤基病晚期>: 长的跟我爸好像[哆啦A梦吃惊][哆啦A梦吃惊][哆啦A梦吃惊],<喵了个咪_外物不可必>: 厉害了我的妖！[爱你][爱你][爱你],<张六月是几月啊哈哈哈>: 回复 @妖唧 :对啊对啊！！[偷乐],<琅琊九千勝>: 回复 @QiuYiYiYiYiYi :哈哈哈红红火火恍恍惚惚,<圆圆为昵称很纠结>: 额。。。只有我发现老妖和兔兔的微博粉丝是一样的嘛？[喵喵],<Mr_韩攻子>: 厉害了Word妖,<又一安>: 回复 @是病人啊 :给维克多比心[心]暂时把老妖子扔一边儿[眼泪][眼泪],<sunshine_萏萏>: 厉害了！你咋能这么厉害呢！,<血恋_月邪>: .......不是说减肥吗？说好的减肥呢！？老妖怪你脸上的肉！[惊恐],<墨翎wwz>: 你不是说你瘦了吗[doge][doge],<雨滴lo纪>: 厉害了！我的哥！,<妖唧>: 回复 @_张六月____________ :这张美炸[doge],<无聊renjia>: 回复 @QiuYiYiYiYiYi :哈哈哈哈哈哈🙈🙈,<心剑斩红尘>: 没PS？老妖被盗号了吧？,<音频怪物的喵大哇可俊俏了>: 回复 @_张六月____________ :[喵喵][喵喵][喵喵],<张六月是几月啊哈哈哈>: 回复 @喵大哇3小菊渣 :注定抢不到热门的大哇[鼓掌][鼓掌][鼓掌],<音频怪物的喵大哇可俊俏了>: 老大，你又好看了[拜拜],<正版顾绯衣>: [doge]苟富贵,<音频怪物的喵大哇可俊俏了>: 回复 @_张六月____________ :我几乎每条都错过[拜拜],<张六月是几月啊哈哈哈>: 回复 @喵大哇3小菊渣 :哪有啊。。最近老妖好几条微博我都错过了……,<音频怪物的喵大哇可俊俏了>: 回复 @_张六月____________ :你每次都是前十。。。。我不服。。。,<张六月是几月啊哈哈哈>: 回复 @喵大哇3小菊渣  的赞:这都能找到我……,<再见吧彼得潘>: 莫名的相似啊老妖,<无魇鬼>: 总结一下情敌们的回复，终于发自拍了，厉害了，胖了，苟富贵...,<孤城里的枯骨>: 只有我注意到妖大性感的小眉毛了吗？,<笑点低的小-污-妹>: 腻害了～我的妖～,<灼镯Fr>: 难得的正常自拍[doge],<就是你红大爷>: 窝巢，这张照片居然是正常的？？？,<羽青璃>: 这是你最正常正常的一次自拍[doge] 然而，也是你最不正常的一次自拍[阴险],<久督>: 居然没有p！[doge]]
