1744188571	夭寿啊，老妖又玩cos啦[笑cry] ​​​	[<六神花花花露水>: 回复 @小城是要成为总裁的男人 :卧槽！！！这个嚎看！！！邪魅霸气攻,<薄如蝉淡如水>: 我居然觉得帅？……妈我该去看眼科了[允悲][允悲][允悲][允悲],<迷人到快要炸裂的小可爱>: 终于有几张能看的自拍了[笑cry],<兰兮i-正版清明>: 回复 @正版妖贰 :马屁精，孤立你，毛毛虫，塞包里，上厕所，不带你，铅笔盒，扔楼里，值日生，全让你，放学走，不等你，叫外卖，漏掉你，倒垃圾，全让你。[doge],<Yoyo-优优优>: 难得正常系自拍，正常COS[憧憬],<兰兮i-正版清明>: 回复 @小城是要成为总裁的男人 :有没有人觉得有点像白展堂……？[doge],<妖一你憋跑>: emmmm妖叔这样就挺好看的了,<良家小狐媚>: 妖妖最近是不是脊椎不太舒服啊？,<早茶早春>: emmmmmm帅的,<妖里妖气的秀英>: 这个居然挺好看的[doge][doge]不行我预约一下专家门诊，看一下眼睛,<酒河米>: 看你这头发，你得注意了[并不简单],<長澜澜澜>: 为你疯狂打电话！！！！,<凡臻V>: 回复 @爱吃东西的小透明 :真好看……呕……,<墨葭柟寒>: 老妖可以试百晓生[喵喵],<苏植>: 夭寿啦  话说你cos的是谁,<宿寻君上>: 从上往下拍嘛[并不简单][并不简单][并不简单][并不简单]显脸小,<辰时落>: 好看，老帅了(ಡωಡ),<爱吃东西的小透明>: @凡臻V   emmmmmm…,<缚裡誘獸>: 怎么不去找后期大大,<南风十里不及你眉眼如初>: 啊哈哈哈哈哈哈哈哈哈哈哈哈，大家注意了，这是个假老妖［并不简单］,<肉肉是金佳艺是肉肉>: 回复 @正版妖贰 :我打洗你啊,<合笙之歌->: 好看[允悲]第四次觉得这么帅，假发都不带可以的,<橘虾QAQ>: 我就没见过，脸这么圆的道长！！！！,<一言灵一>: 这怕不是传说中死过一千个情缘的万年老胎[并不简单][并不简单][并不简单],<酒醉剑刺苍天_云离>: 夭寿了，居然有点像？！,<空空-只是一条咸鱼>: 我是你颜粉，看我！,<虫六爻>: 这小眉毛比我画的好[挖鼻],<阿瑜699>: 哈哈哈哈哈哈哈哈哈 莫名觉得不那么辣眼睛,<小城是要成为总裁的男人>: 回复 @朝如_ :[笑而不语]好眼力~,<我没有固定ID>: 盛……盛世美颜[允悲],<朝如_>: 回复 @小城是要成为总裁的男人 :抓住哈哈哈,<小愿Anywhere>: 问题出于妆不够浓23333,<一口鱼丸子-Ken>: @辣个矮子毒    好看[允悲][允悲][允悲],<md有什么你没有占用的>: 你还是不要自拍了，说吧，地址在哪，我来给你拍，保证美美哒,<华开两朵>: 一定是反派，嗯，是的,<云水无隔>: 就是好看就是好看（一把抱住）,<休利耶>: @亚里砂  到你发挥了,<木成舟miyi>: 帅帅帅，你最帅了,<Dy_X>: [允悲][允悲]猝不及防的骚，折了我的腰,<正版妖贰>: 回复 @肉肉是金佳艺是肉肉 :gif.jpg,<满汉教我翻了个车>: 回复 @满汉教我翻了个车 :各位妹子，因为是直接从别人那复制过来的文本。。。。所以打错了。。。手残手残[允悲][允悲][允悲]，没脸说老妖精真爱粉了[允悲][允悲][允悲]，老妖是音乐人，，不是唱见,<正版妖贰>: 回复 @肉肉是金佳艺是肉肉 :哈哈哈哈哈哈哈哈哈哈哈哈我笑了五分钟,<持枪殺人1920>: P得停不下来[doge],<满汉教我翻了个车>: 回复 @音频怪物的喵大哇可俊俏了 :我知道，谢谢提醒[允悲][允悲]因为这是直接从昼夜那复制过来的。。。所以。。。手残。。[允悲][允悲][允悲]对不起[允悲][允悲],<啊啊呀呀咿咿>: 今夜我们都是老妖嘴角的那个痘,<满汉教我翻了个车>: 回复 @咬了你一口然后吐了出来 :我我我知道。。。但是。。。因为是直接从昼夜那儿复制过来的文本。。所以。。。对不起[允悲][允悲],<持枪殺人1920>: 回复 @正版妖贰 :不用孤立了直接火化吧[doge]第二棺半价[doge],<算命的张瞎子>: 我忘了你长什么样了,<buffoon_g>: 回复 @融先生是有梦想的吃货 :捎我一个,<我是慕时啊>: 对不起，我觉得你们p的都没有音频怪物先生本身好看。这两张图片充分体现了音频怪物先生对于自己颜值的肯定和赞赏，这是一种发自内心的执着，烘托出音频怪物先生与世俗不同的性格和眼光！[doge]【老妖真好看！！！！！！！,<竹马竹马笃笃笃>: 我的天，居然觉得好帅,<手闲了就抠脚>: yo 看起来明明很不错,<娘犬犬>: 你开心就好[doge]]
1744188571	大写的虚[允悲] ​​​	[<婧子缩她爱兔兔>: 回复 @ABBEATRICE :23333,<夷陵老祖承上>: 回复 @胖次ID里得有老妖子 :打破惨案,<清远99913>: 帅 绝对睁着眼说的,<旧麋鹿cheery>: 回复 @希望我的姐姐变瘦 :果然容易被老妖的颜值吸引,<拿板砖的猛妹子>: 终于等到老妖上我爱二次元了[爱你][爱你][爱你],<风无痕yll>: 算不算有生之年[笑cry][笑cry],<华筵几宴>: 夭寿了！老妖的自拍变好看了！,<何辞君安>: #音频怪物#  [污][污][污],<落晓声>: 为什么我想起了《倩女幽魂》里的姥姥[笑cry]，别打我,<阿禾禾苗苗呀>: 诶嘿 这次可以期待下我爱二次元了！,<CV艾丫>: 回复 @二莫二妤 :哈哈哈哈我看了第二眼才缓过神来认清事实,<扲兮>: 看起来傻傻的样子[眼泪],<莉莉子Darlin>: 是上《我爱二次元》了吗？因为我仿佛看见了扶苏[思考],<愛吃肉的貓2015>: 好看！終於又正常了。,<七律难谙>: 不虚，难得看你这样正常的照片,<吃葡萄要吐葡萄皮的喂>: 可以的，不虚，很高清[允悲],<晏晏于歌>: 为啥想不开去跟扶苏合照[摊手]老妖你这么想不开,<恋恋鬼丫丫>: 居然出了一张那么正常的自拍，不行，我要缓缓[允悲],<荼靡阿君_106>: 二哥你个心机boy[允悲],<lemon梧桐>: 化化妆还是帅的[doge]眼神非常社会了[doge],<伴我以歌22>: 让我在辣酱不录后又找到了把二次元 看下去的理由,<陌若依旧半壁晴天>: X虚公子。。。。。,<__敛__>: 老大的发质略任性[doge][doge],<想遇到老妖再养只猫叫老妖>: 敢不敢自拍不占最前,<妖嫕知安好>: 妖你这是去录节目了吗[doge],<长白不长白>: @扶苏公子丶   二哥不用躲了，不是站在后面脸就会显短[笑cry],<沈氏水青>: 凌    凌   凌乱的发[羞嗒嗒],<篱墙sama沉迷老妖无法自拔>: 终于有正常的了  真感动[允悲],<沧山浮夜>: 我爱二次元?[小黄人高兴][小黄人高兴][小黄人高兴]今晚就去补这个综艺[小黄人高兴][小黄人高兴][小黄人高兴],<梦卿不梦卿>: 正常自拍！！！！！感动天地！！,<宵晓--晓啸>: 回复 @爱DM的人 :对对对没有错【厉害了我的扶苏[污],<張-麗潔>: 百年难遇的正常自拍[泪][泪]感动到落泪,<MPC八条半>: 我都不敢相信看到了正常的老妖，今天矮大紧不在？,<妖家顾云影>: 啊哈哈哈哈哈哈哈，哪里虚[允悲][允悲][允悲],<佚之貓>: 怎么感觉像女孩子呢,<焓烨将至>: 回复 @爱DM的人 :哇我也觉得是这个,<栖光Gloria>: 你和二哥，一个脸大，一个脸长[doge],<朦88855>: 居然觉得扶苏大大没老妖好看，我是不是没救了[允悲][允悲],<ABBEATRICE>: 回复 @婧子缩她爱兔兔 :这条评论亮了,<翊歌霏扬>: 也就只有你敢站在第一个自拍了[喵喵],<ABBEATRICE>: 咦你们难道没发现扶苏的帽子是神器嘛！老妖你该问剧组要跟额带啊[允悲][允悲][允悲],<一笼小饺子>: 这样一比显扶苏脸长，你脸大，干嘛要互相伤害？不过老妖你还是输了，因为二哥比你帅呀[偷笑][偷笑][偷笑],<雪杳兮>: 虚？老妖你需要河图的声音治愈你。,<我心忧矣可有灵犀>: 后面那个扶苏公子心机boy， @音频怪物  你本来脸就比人家大两圈，还用这个角度  http://t.cn/RKMS5R2,<林妧夜安>: 画风突然正常，有点没反应过来,<一一张起灵最爱>: 回复 @暂且改名叫君扬 : @扶苏公子丶   告诉她你是谁[喵喵],<林妧夜安>: 回复 @我是你离家出走的智商 :妖大这么一拍，我居然没认出扶苏[允悲],<Xback兴宝的酒窝>: 狂拽酷炫的眼影，睥睨天下的眼神。是老妖没错了～,<伊尔咿尔呦>: 容我叫声空虚道长[doge],<空殿_>: 你这么帅还是你么！,<倾心有你的时光>: 我想起了肾虚公子,<蘸着红糖吃>: 终于有张正常的自拍了[允悲],<一朝沉迷一朝醉>: 哎呀！这张帅了[doge],<沐花_企图在床上再躺一会>: 干，我以为看到了迷之角度的那英，或者别的大姐姐［本来想说大妈］博主，当我看清是老妖。。 哦，还挺帅的,<婧子缩她爱兔兔>: 回复 @云以岫小姐姐 :哈哈哈哈你不觉得把兔兔用在这里很应景吗hhhhh(￣∇￣),<未然er_>: 艾玛突然好期待这期,<啪米噜_>: 感人的自拍啊我靠,<潘又鸟有妖气>: 还有点像张惠妹[允悲][允悲]]
1744188571	天气这么热，你们还谁在穿裙子啦？[允悲] ​​​	[<季梓钰>: 回复 @宫小姐的姐姐 :哈哈哈哈哈哈很好很娇俏,<我家住在象牙塔>: 小妖精！！！早上好,<清琅泠语>: @叶锅锅的李发卡,<颜栾SUN>: 啥玩意儿？！裙子？！,<宿寻君上>: 穿裙子就穿裙子嘛，你为什么还要套线裤[摊手][摊手][摊手][摊手][摊手][摊手],<雨鱼唯爱图>: 今天冻的我穿上长裤长袖还是冷[二哈],<比如我姓赵>: 举爪子[太开心],<双叶千帆>: 竟然觉得还可以，我怕是失了志  http://t.cn/RK5hXfO,<古月家的猫咪>: 不行 我得秀一波  http://t.cn/RK5h41r,<古風-紀風>: 回复 @一只很懒很能吃的中华田园猫 :我的天腿毛辣么多你问谁？？？,<LesmillsMJ>: 心中默念，这是我选的老大，跪着也要宠完,<憨厚小诚实>: 辣。。辣眼睛[污],<DreamBelieve_小殿>: 卧槽我要裙子裙子裙子,<_Just丶be灬宸寒>: 如此小巧可爱的脚竟然是你的？,<振我华雄>: 可爱 那蹄子[污],<萧萧闭书窗>: 这是什么操作。。。。,<正版清明_余生还请多指教>: 可耐[眼泪][眼泪][眼泪],<l花未l>: …………你开心就好,<青橙Ww>: 我的天，害怕[允悲],<弘也果然>: 老大，你能不能稍微hold住点儿,<不朽57101>: 为什么我看见了一片黑黑的腿毛[笑cry],<刘措又名张偶及>: 好久没看老妖的微博真是不一样了,<S慕E常A篱N>: 不忍直视……[允悲],<哆啦哆啦大魔王>: 妈耶，你敢不敢穿齐臀小短裙！,<正版罂粟>: 咳咳，如果脸上是一脸娇羞就好玩了,<慕鹤_>: 腿毛哈哈哈哈哈哈哈哈哈哈哈  http://t.cn/RKqM7N0,<伯乐en>: 这是我见过最美的…内八。。。,<尤兰达__yolanda>: 回复 @正版独酌jy :腿毛真旺盛,<慕凉yy>: 不忍直视的腿毛，，[污],<沈美丽不是圆脸>: 我绝对不会说我现在不穿裙子是因为之前穿了裙子被晒黑的！！,<犹梦此生>: 自己也知道不好意思哦 还[允悲],<無殇nf>: 毛裤都没脱，穿裙子有用吗,<子雨酱>: 回复 @或许墙外有男神-经病 :也对喔,<或许墙外有男神-经病>: 回复 @子雨酱 :毕竟是毛裤,比丝袜要厚吧[二哈],<盛夏染尘cc>: 下次可以尝试一下包臀裙[doge],<子雨酱>: 回复 @或许墙外有男神-经病 :厚？厚？厚？。。。我。一脸的甘拜下风,<或许墙外有男神-经病>: 回复 @老妖家的小冬瓜 :万一是床单呢,<或许墙外有男神-经病>: 回复 @子雨酱 :丝袜能有这厚度？,<或许墙外有男神-经病>: 回复 @宫小姐的姐姐 :我说我咋找不到一个合适的词呢,原来是这个词[眼泪],<NJ-Sue94>: 少女的内八[笑cry][笑cry][笑cry][笑cry],<胡歌的枕边书>: 女装大佬  http://t.cn/RKGsA6p,<杯酒醉千年>: 裙子套毛裤，很性感[doge],<咬了你一口然后吐了出来>: 。。。。。。。。。。老妖你。。。。。。。。是要上台尬舞吗。。。。。,<南慕子>: 真是只老妖精[鲜花][鲜花][鲜花],<叶二泱子>: 老大 天这么热就别穿毛裤了[doge],<正版谨言>: 回复 @宫小姐的姐姐 :娇俏哈哈哈哈哈哈,<汐然cc>: 穿裙子的很多，穿毛裤再穿裙子的只有你[并不简单],<一颗屌豆DTX>: 莫名心疼你这个裙子[允悲],<爱河图有101种方式>: 回复 @shirley日晴 :[并不简单]即将去西安玩耍的我茫然无措,<何若未央>: 得得得，妖姐姐，我的小裙子都送你好不好[摊手][摊手][摊手],<白烂的天>: 哥，别这么骚[允悲],<竹家渡子>: 老妖我来找你啦哈哈哈！！！]
1744188571	第一次做蛋羹，还是用鹅蛋做的，不知为啥做出种豆腐脑的感觉[允悲] ​​​	[<Cishiss>: 不说是蛋还真看不出来[二哈],<嵩山新雨后>: 就是水放多了[二哈][二哈][二哈],<季子许>: 老公是料理小能手,<戏楼O俗者>: 黑暗料理[眼泪],<戏楼O俗者>: 你的音乐好别致，让人不忍错过一个鼓点呢[微笑]词好，曲好，声音太棒了[微笑]好喜欢[花痴],<戏楼O俗者>: 从百鬼夜行开始喜欢你[花痴]现在正在听你的相守[飞吻],<老妖丐>: 什么时候发自拍啊，有点想念,<玄玄的叶>: @萧忆情Alex   你的鹅蛋[二哈],<爱河图有101种方式>: 回复 @音频怪物 :[允悲][允悲]。。。。想吃啥。。。,<爱河图有101种方式>: 回复 @达奚三 :[允悲]能吃了。。。。。我这什么想法,<火折子照亮瓶邪>: 现在饿了[馋嘴]，看啥都想吃[二哈],<叶皓宸大大大大大帅比>: [费解][费解][费解]这个是蛋羹？教你一个最简单的，拿两个鸡蛋一个鸭蛋，准备一碗开水，在一个碗里放入生抽两大勺，老抽一勺，鸡精小半勺，冲化成水。在水开的锅里放入打散的鸡蛋，把冲好的水放进去。盖盖大火十分钟。剁一点瘦肉沫，在锅里煎一下，小火放干辣椒，少许盐，少许鸡精。热油淋在鸡蛋羹上,<匿名98682>: 看到那张图，我有种说不出的感触。,<NK二马>: 哪位大神可以帮忙推荐一下，从什么地方可以听最新最全的古风歌曲，谢谢！,<应陌路>: 你对他干了什么。。,<蛮蛮白泽icon>: 酸辣鹅（né）蛋羹，好样的。,<文白疯>: 回复 @涤鹿 :收图了[doge],<佚_陇雁未归>: 不見了好幾天了，想他,<是小仙女儿阿_>: 回复 @勿云江汉有垂纶 :就喜欢你这样眼光很不错的小哥哥[喵喵],<正版松红Jw>: 看了觉得没有一点食欲[眼泪] [眼泪] [眼泪],<布林布林的金灿灿>: 回复 @布林布林的金灿灿 :我第一次对我的厨艺有了蜜汁自信[doge][doge][二哈],<布林布林的金灿灿>: 用做蛋羹的方式做出豆腐脑也是种能力不是吗，毕竟我是不行的。ps：老妖你让我想起了快看的毁灭宇宙[笑cry]你这种上去完全不用审核，可以直接上.[允悲][允悲][允悲],<元生y>: 是要修仙嘛吃自己做的东西[二哈],<心灬清欢>: 也是。。。厉害了[允悲],<曲陌流殤>: 回复 @一瓢弱水抛回江流 :好吧，一下子手快没看清[允悲][允悲][允悲],<勿云江汉有垂纶>: 回复 @是小仙女儿阿_ :就喜欢你这样正经的小姐姐[doge],<LN家的墨卿>: 死鬼又不见了[拜拜],<我是幽灵陛下>: 来一个尴尬又不失礼貌的微笑[可爱]，希望一路走好,<月泊樵>: 妖君啥时候再来长春中医药开演唱会咩，考到这了每次看着四象城舞台都有种上次没见到的怨念…………[doge],<一瓢弱水抛回江流>: 回复 @曲陌流殤 :就想知道你艾特兔兔的原因,<是小仙女儿阿_>: 回复 @言抒殊 :啊！厉害了！骨头汤蒸一定很好吃！,<Ly十一一>: 这蛋羹第一次见[笑cry][笑cry]，老妖你还好么，主要还是鹅蛋,<苏叶不开花>: 回复 @桐悉歌 :[笑cry][笑cry][笑cry]调味好多我的天,<苏叶不开花>: 回复 @达奚三 :[笑cry][笑cry]hhhhhhh像点样子了,<苏叶不开花>: 回复 @音频怪物 :[笑cry][笑cry][笑cry]蒸个蛋………需要这么多东西嘛…叔胃还好吗,<HawxGT>: 鹅蛋不行吧老铁[二哈],<言抒殊>: 回复 @是小仙女儿阿_ :。。。我喜欢用骨头汤蒸，或者茶水[笑cry],<苏念Sunny>: 水……加多了？[笑cry][笑cry],<灬漠漠漠漠漠视>: 忘记盖保鲜膜了吧……,<涤鹿>: 回复 @吃辣酱的Lcc :好嘞,<涤鹿>: 回复 @月逐清风归入雪 :给你发没水印的,<正版妖贰>: 回复 @月逐清风归入雪 :哈哈哈哈哈哈哈哈哈,<煜见轻云攻子>: 回复 @达奚三 :好太多了！[允悲],<月逐清风归入雪>: 回复 @正版妖贰 :你说了我想说的[挤眼],<月逐清风归入雪>: 回复 @涤鹿 :已经默默收藏图了,<月逐清风归入雪>: 妖叔，加油吧，卖相真难看，不过我不嫌弃[馋嘴],<吃辣酱的Lcc>: 回复 @涤鹿 :老板不来两串大腰子吗[doge],<涤鹿>: 回复 @洛非月 :[眼泪],<是苏辛呐>: 宝贝，我们就是太溺爱你了，搞得你现在用总出来作妖[挖鼻][挖鼻][挖鼻],<是苏辛呐>: 绝对黑暗料理。。。原来妖你是这么减肥的啊[馋嘴],<乌丝闲落2>: 这叫豆腐脑。。。涨姿势了,<白叩cookies_>: 嗯？？？// @音频怪物 :不过味道还是很赞的，一口气吃完[笑cry]我加了青柠汁、黑胡椒、鸡粉、少盐，入口有蛋蛋的柠檬酸味跟浅浅的黑胡椒的辣，最主要我还没放油[允悲],<柏大酸想娶老妖砸>: 厉害厉害[二哈],<CesTion废材>: 我们老家一个鹅蛋卖最少8块,<胡茂新>: 我家也养了几只，感觉挺好玩的，一身白毛。我家的鹅中午都是在院子里晒太阳，我撵它它就会绕着车转。有时我要出门，还会跟着我。。。]
1744188571	看到叫兽都瘦啦，我愈发墙裂的坚定了积极个 ​​​	[<一个篱家的假粉mio>: 回复 @排骨教主 :为什么骨妹也来抢热评了[允悲],<我是你们的路人>: 妖君 你知道图大怎么样了嘛……他有没有事啊……问问他好不好……,<庄庄____>: 手指也变得修长了，还有这种操作。,<音频怪物的相公>: 坚定吧永远爱你[太开心]说实话我就是来日常表白来了,<行客谁留我>: [允悲]差点脱粉,<洲六去钓瑜吗>: 叫兽可能用了一键美颜瘦身,<陌路s流苏>: 减肥是硬伤[允悲][允悲][允悲],<一瓢弱水抛回江流>: 回复 @达奚三 :荼靡只对你点赞,<蜗牛san>: [挖鼻]我最开始关注你微博的时候你就说要减肥了,<哼牧歌的彼得潘>: 回复 @夜白狐dog :哈哈哈哈哈哈哈哈[喵喵],<追自己尾巴好困难>: 有本事不吃夜宵[二哈],<排球不翻牌不改名的咸鱼步浅妆>: 回复 @排骨教主 :哈哈哈哈哈哈哈哈哈哈哈哈骨妹儿那你加油啊[doge][doge][doge],<苏苏苏枍安嚯>: 回复 @音频怪物的喵大哇可俊俏了 :哈哈哈，大写的一个服[眼泪],<沈家六爻>: 加油(｢･ω･)｢嘿,<哈哈_44306>: 我的眼睛疼π_π,<努力成为一个小小瘦子>: 喝奶茶瘦了十斤哦,<祈求平安的丫头>: 加油[左上](^ω^)[右上],<阿禾禾苗苗呀>: 那你快瘦下来给我当壁纸吧,<阿黎Lii_河图生快>: 看到的赞我！！！！！,<鲤雩yu>: 回复 @排骨教主 :捕捉！虽然很晚了！,<音频怪物的喵大哇可俊俏了>: 回复 @排骨教主 :嘎嘎嘎嘎嘎会瘦下去的[笑cry],<迷图忘返又见麒麟>: 回复 @排骨教主 :哈哈哈哈哈哈哈哈哈骨妹看看妖叔的小肚叽，是不是觉得自己还能再加一碗饭！,<默默地想当一只云豆>: 嘿嘿，不管你怎么样都好啦！最喜欢你的声音啦~自己开心最重要，没必要为了身材强迫自己了！(【举手】立志每天起来跑步但从未实现过),<富fu俊峰>: 老李，听说你减脂呢？减的咋样了,<520木之瞳>: 加油老怪！你是最棒的,<梦落剡溪>: 醒醒别睡了，饭店打烊了([笑cry][笑cry][笑cry]),<音频怪物的正妻南氤>: 回复 @排骨教主 :哈哈哈 [doge][doge]  http://t.cn/RomZjOc,<死地之兵>: 告诉你哦，光运动不节食（这里的节食是指不吃容易发胖的东西）是没有用的[并不简单],<yep修>: 回复 @排骨教主 :哈哈哈哈哈哈哈哈哈哈哈革命道路还长，同志仍需努力[doge]我猜你是这个表情的  http://t.cn/RomvYAK,<呆呆半袖s画画>: 回复 @排骨教主 :骨妹你加油[允悲],<方圆_袖子>: www男神你要加油哦，我已经想象到你的帅气冲天了[兔子],<布丁鼠蔷薇的铲屎官>: 其实不打马赛克会更好[眼泪],<烟尘风麓归>: 卧槽叫兽居然受出了锁骨和小蛮腰[二哈][二哈],<排骨教主>: [允悲]真是巨大的打击呢,<Nimbus9000>: 然而我只关注你的贴纸[doge],<三百二的小可爱>: 回复 @陈姓将军 :一定是输入法记住了什么[doge],<老妖家的小番茄>: 23333333我就笑笑不说话,<啃芒果的虾米>: 变瘦脸真的会小呀[太开心][太开心][太开心],<念羽非鲶鱼>: 回复 @旧麋鹿cheery :老妖胖的更好看[喵喵],<迷雾说>: 用摩羯刷每天按摩肚子腿胳膊十分钟[微笑]不要瞎吃什么药  两个月110到85安全的瘦 而且没有副作用虽然麻烦但是安全,<王遗风笛子首席大弟子>: 这个码打的，还以为叫兽穿了个bra……,<大漠烟锦>: 好吧，给你半个月[doge][doge][doge],<Jiahui嘉慧0212>: 哈哈哈哈哈哈我以为你剃了光头[眼泪],<梦老道>: 老妖这是p图前p图后,<启鸣夏明>: 嗯好看好看[允悲],<小女子小懒-晃梦炮家丫头乃蝶妖>: [二哈][二哈],<修格-烺>: 坐等老妖打自己脸[笑而不语],<可免免_>: [摊手][摊手],<槃丝小仙>: 回复 @一口蛋挞一口酥 :层主说的没毛病啊，有腹肌的人用力鼓肚子确实能达到左边的效果（虽然只限腹部变化,<西瓜说我是老人与狗>: 哈哈哈哈哈哈哈！但是老妖更爱吃啊[爱你][爱你][爱你],<图攻天下>: 害，害怕.jpg[doge],<四季Jasmine>: 你别做梦了[污][污][污],<正版绾青丝>: 老大你剃了光头[疑问],<正版暮筱_图妖一生推>: 下决心……猛吃一顿？？,<高可欣_39877>: 你。。。开心就好,<少年背后生了朵黑色的花>: 回复 @是妲嫣不是大眼 :你注意下，以后的天然气都免费供应了,<林鹿听海潮>: hhhhhhhh]
