1744188571	抱歉了，说好的20号的惊喜…或许要延期或许就没有或许了…… ​​​	[<爱心爱星爷loveheart>: 坐等老妖粉丝数破百万！！！！ @音频怪物,<南瓜堡的小妖怪>: 回复 @煮酒闲候秦淮客 :几年前我以为音频怪物是个组合，老妖是主唱[笑cry][笑cry][笑cry],<浅如微雨落>: 成都场的官录在哪里[doge],<正版红雨>: 沒關係！老大你發張自拍我就原諒你,<一个废掉的阿景>: 没有什么对不起的，老大小妖永远爱你[悲伤][悲伤][悲伤][爱你][爱你][爱你],<花落怨痴蝶>: 虽然有一点小小的失落，但是没有关系啊，你就是我们最大的惊喜[爱你],<练希衡>: 来张不p的自拍我就原谅你,<煮酒闲候秦淮客>: 回复 @南瓜堡的小妖怪 :一直不知道音频怪物是老妖，有次闺蜜给我安利老妖，我一本正经的说我喜欢河图和音频怪物，不喜欢老妖，然后闺蜜想把我打死。。。,<南瓜堡的小妖怪>: 最大的惊喜，是那年雨天酷狗随机播放到了琴师。,<打的过就打打不过就跑的玩子>: 人生总会有意外嘛～暂时全部按部就班来，那岂不是太无聊了～,<-正版依凌->: 咋惹Σ( ° △ °|||)︴不来，来怀！,<朕与妖君解战袍>: 或许就没有或许了？听得我心肝一颤[生病]发个果照我就原谅你,<阿明要努力留长发->: [爱你][爱你][爱你][爱你],<1个宁朝>: 有就是意外的惊喜，没有也并不会失望遗憾！[爱你][爱你][爱你],<用户5945463376>: 同学不理解我喜欢古风，不过我是不会改变的，异类就异类吧，嘿嘿嘿嘿，自己喜欢就好,<楼百年-此生不悔入盗墓>: 无敌自拍[doge],<-容歆辰->: 可以大喊，‘肉偿肉偿肉偿’吗[doge]严肃脸。      开个玩笑[喵喵],<从无Adolph>: 木关系，男神不要大意的来张自拍吧！,<随机游走的傻瓜>: 不用觉得抱歉，你就是我们最好的惊喜[心]另外粉丝数要破百万了，一想到情敌数又变多了我就有点方[doge]发张自拍给我们压压惊吧(好久没看还有点想念,<念念行休>: 一定要开心！！！！元气满满一切才会越来越好！！,<冬穎穎>: 最近說的我都聽不懂,<闲的煌>: 没事老大，我们爱你[爱心],<张呀弓长张>: 发张自拍弥补一下～,<心如弦上雪>: 来张自拍给我们压压惊就好了～[思考],<三余无梦生卐>: 没事儿 有什么事儿不能发张自拍解决呢你说对吧老妖[doge],<LorenaChang>: 不要緊，老妖要開心啊！我很愛你～,<耽翼要从羽毛开始变强大>: 没事儿，有自拍就是惊喜，你做什么都是惊喜,<若若若若耶>: 宝宝需要九连拍的补偿[doge][doge][doge],<你的缓>: 这个需要抱歉吗！！不需要我们爱你,<_三六_>: 来几张自拍就好啦～东西有没有都不重要,<不求拥有不求同行>: 没事没事，抱抱就好啦,<阿瑞才不蠢只是呆萌>: 我在所有让你发自拍的评论上赞了一发,<白弦ln>: 没事的，不用抱歉，你不管做什么我们都支持你[爱你],<梦一场南柯>: 来呀，上自拍呀~~~~~【哟哟，莎莉哇~~~】,<-景茶>: 惊喜就是你亲我一下,<春风十四>: 没关系老大，好熏疼你,<艾影ivy>: 自拍四连拍，我们就都谅解你啦～,<花舞024>: 过来，我要打死你,<温齐WENQI>: 此处省略一万字安慰......快要放暑假了，然而工作还没找到[泪][泪],<阳光下愿作一只慵懒的猫>: 怕什么 来张自拍啊骚年,<琅王邪邪邪邪邪>: 你开心就好[doge]来张自拍呗,<砚南衣>: 没事，只要你一直在就好,<我请妖君吃豆包>: 妖君，没有自拍的道歉没有诚意[哼][哼][哼],<陌陌默陌>: 来张自拍吧~话说8月杭州啥时候[加油啊],<花哩个花花刘鲜花>: 九宫格自拍就原谅你[右哼哼],<妖家凌小琬>: 摸摸，我们不在乎时间的，只要是你的好事，无论多久对我们都不算晚，陪你等就好了。你何必对我们愧疚～,<诉无常>: 来张自拍[doge][doge],<正版田艹艹>: ？说好的女喷油又谈崩了？,<南瓜堡的小妖怪>: 你就是我生命中的惊喜啊。,<某只领养了皮卡丘的旺财叫阿樵>: 那就来张自拍吧！]
1744188571	一小时平板支持过后，枕头上的汗水是不是挺萌的[阴险] ​​​	[<云禺生>: 我以为这是腰[笑cry],<笙歌漫漫w>: 居然能一个小时！,<--商陆-->: Oh～居然不是口水[笑cry],<允之向麒麟臂发展>: ฅ(♡ơ ₃ơ)ฅ求大神计算身高,<白小光灬>: 啊啊啊啊啊，一小时？？！,<飞过时间的海我要回到你身边>: 他们都说是口水耶，我不信，妖叔辣么可爱，这怎么可能是口水，明明是尿床了[doge][doge][doge],<影JUMP酱>: 我不信！是口水！,<小绿草儿_>: 我只能，一分钟[躁狂症],<十田之心lhs>: 不开空调风扇静静坐着也能有这汗水[挖鼻],<得之天驱>: 原谅我想污了...,<火龙杨>: 我们这的温度，我睡一觉出的汗都比这个多[笑cry][笑cry][笑cry]妖妖,<热山昂>: wuli妖尿床辣？[doge],<二肥瘦到阿迪哭>: 一小时 我三十秒就不行了[泪],<沙莎杀>: 一分钟的平板支撑我整个人都快炸了[惊恐],<随机游走的傻瓜>: 评论里果然都是真爱[笑cry],<墨渝GAG>: 本来不邪恶的[doge]看完评论我就不单纯了[doge],<一只洋_any>: 其实可能是睡觉流下的口水！,<赛罗的小可爱屁股萌-宇宙恶霸>: 天辣天辣天辣，妖叔做春梦啦[doge],<花花很倾城>: [思考]这腰力可以可以啊……[色]肯定有腹肌！,<宫镸日越>: 一个小时不停么[doge],<离火她妈>: 看什么呢流那么多汗～[doge][doge],<未醒-_->: 其实我并不知道要说些什么，强行评论[脸红][脸红],<南瓜堡的小妖怪>: 老大你要炼成彪形大汉吗？！,<云深不知处445>: 谁知道是不是平板支撑的汗水[doge]还是什么别的床上运动,<向柠酸的甜>: 嗯。。汗水嘿嘿[傻笑],<将户川>: @Ya-Bingo,<昔年清欢>: 你萌你说了算[哈哈],<芳菲花开半夏>: 我两分也很了不起,<歌者伤谁伤者哀谁>: 回复 @柏大酸想娶老妖砸 :我都不敢提兔兔了[doge],<琨瑾>: 加油缩小体表面积吧[爱你],<很气地改了一年只能改一次的ID>: 持久[doge],<萌萌0516>: 哇偶我妖叔这么持久呢，没考虑过草粉么[笑cry][笑cry][笑cry][哆啦A梦花心],<溆沅轩>: [哆啦A梦吃惊][哆啦A梦吃惊][哆啦A梦吃惊][哆啦A梦吃惊][哆啦A梦吃惊][哆啦A梦吃惊][哆啦A梦吃惊][哆啦A梦吃惊][哆啦A梦吃惊][哆啦A梦吃惊]撑一个小时[哆啦A梦吃惊][哆啦A梦吃惊],<木易柳兮_>: 平板支撑会把腰侧弄宽的。减脂还好，但是想增肌的话貌似不太推荐。一小时也太牛了，我从两秒到现在十秒。[笑cry][笑cry][笑cry],<玄妖酱>: 一小时……[doge]不过这真的只是汗水吗[doge][doge]大家都在怀疑hhh[doge],<胖次是只喵>: 真是美丽的胸肌  http://t.cn/R5N2mAl,<shunyiV5>: 又尿到满枕头都是[挖鼻][挖鼻][挖鼻],<正版妖奇_mio>: 真厉害，我们寝室的体训生练平板支撑都是以5分众为单位的呢[doge],<喵啦个妖>: 这……确定是汗水？,<三更加半夜>: 诶~ 99万粉丝了哦~,<正版岑心安_么么啾>: 我拒绝[拜拜][拜拜][拜拜][拜拜]好好的老妖说尿床就尿床,<秋月琴声凉>: 一小时！一小时！！我三分钟都撑不住！！！,<正版凌幻霜-高三汪要加油>: 一个小时[惊讶]太拼了,<都城长安>: 这。。。真的是汗水吗？,<翊歌霏扬>: 流口水[doge][doge]美丽的世界地图[喵喵],<簪一朵往事入斜阳>: 我撑不过30s[拜拜][拜拜][拜拜],<潇果果5>: 一小时！？我的妈呀,<唐门的疯子>: 汗水版世界地图O_o，男神你真强大◐▂◐◑▂◐◑▂◑,<清寒小透明>: 难道你要减肥[傻眼],<本王有赏哦>: 男神你手上和脖子上戴的啥东西我也想买梦告诉我那是啥吗,<喵星人89219>: 呵呵呵呵[微笑],<山海经的吃瓜群众>: 啊～原谅我污了[害羞][害羞],<安紫_才不是呆紫>: 一小时？！？！？！我读书少你别骗我！我是几秒跪！,<玹余_山间溪>: 以为你尿床了。。。。。,<正版晓柒_遇见最好的你们>: 嗯嗯 跟你一样 萌萌哒,<Gemini零小柒>: 演唱会泥还说：“我最近。。没有减肥哈哈哈！”[doge]看了这条微博脑海中回荡泥的这句话,<瑗楠Leslie_unicorn>: 萌萌萌 你说的都是对[害羞],<夜澈辰希>: 床单小🐩么[害羞]]
1744188571	外面小雨哗哗下，好想有个么么哒[爱你] ​​​	[<瑗楠Leslie_unicorn>: 给你给你 么么哒[爱你][爱你][爱你][害羞],<初阡>: 别么么哒了，直接托上床[doge],<热山昂>: 不管，就是要啪啪啪你[doge],<桑桑桑w>: 么么啾！就是不给你么么哒！[doge],<画末_图神我要睡你>: 她们都想和你么么哒，我只想和你啪啪啪,<唐苏子co>: [爱你][爱你][爱你][爱你],<kanakgy>: 想到雪中 “雨打芭蕉人打人 院内院外啪啪啪”,<纸巾ibiu>: 么么哒～_(:з」∠)_,<机智的子规>: 送你一个么么哒[爱你],<正版慕雨-河图1031生日快乐>: 给你么么哒[doge],<养了狮子的喵>: 回复 @正版锦鲤 :应该是不同意的[眼泪],<韶光_岛屿>: 么么哒[爱你]么么哒[爱你],<木兮虞兮>: 么么哒[doge],<清寒小透明>: 昨天大雨哗啦啦，好想周末宅在家,<思思思思思哟>: [飞吻][飞吻][飞吻],<绝世貌美小白兔>: 么么哒[爱你][爱你][爱你],<Qui_____>: 男神求草粉啊！你看看别人的男神,<烤羊肉串儿羊肉串儿肉串儿串儿儿>: 么么哒[爱你][爱你],<幻ling衫无>: 给你么么哒，给我啪啪啪[doge],<正版锦鲤>: 回复 @凌兮1001 :凉凉同意吗[笑cry],<浅萘blue竹妖>: 别人既给你么么哒，也给你啪啪啪，可我小气，只给你么么哒~[爱你][眼泪],<正版涉尘>: 那就来找他 @正版河图,<哎呦喂弯弯姐>: 给你一个么么哒[亲亲][亲亲],<怀瑾zwx>: 先来么么哒，然后啪啪啪～,<沈霁荷>: 么么腻么么屌么么菊么么裆么么艹么么叽么么我的大宝宝。[doge][doge][doge],<星空下的阿篱>: [好爱哦][好爱哦][好爱哦],<狐狸是好温和的水啊>: 跳起来给你一个么么哒[偷笑],<南派郴木>: 摸摸鸡..摸摸鸭..晚安,<君自长安来亦安步缓袖>: 怎么这么顺                 冏rz,<-虾球yixi>: 给么么哒  附赠啪啪啪[爱你],<夭夭不言>: 么么哒(^з^),<子己殁>: 先是么么哒然后么么艹,<Cri-彩虹>: 滚去啪啪啪，脸痛么[哼],<lxt醉雨霖觞>: [爱你][爱你][爱你][爱你],<夙夙susan>: 来来来[害羞][亲亲][亲亲][亲亲],<lo肥鱼>: 给你么么哒(｡･ω･｡)ﾉ♡,<A-Lua>: 多大个人儿了还这么不安分[doge],<二简简>: 么么哒么么哒么么哒,<公子无恙否>: 么么哒，妖君~\(≧▽≦)/~,<东临linc>: [爱你][爱你][爱你][爱你][爱你][爱你][爱你][爱你][爱你][爱你][爱你][爱你][爱你][爱你][爱你],<正版陌上_与君隔纸怅相望>: 么么哒[爱你]多少个么么哒都没问题,<深山修炼的车又>: 么么哒！[可爱],<大包子弟弟>: 么么哒[爱你][爱你],<养了狮子的喵>: 河图同意了吗[眼泪],<月音_谦宁_余>: 么么么么么么么么么~~~~,<英语不过125不改名O_o>: 么么哒什么，啪啪啪才是正经的,<小度Ww>: 告诉你个秘密 @正版河图   他他他 私藏了两瓶酒哦，快，找他去。,<醉酒少女要抱抱>: 真想穿越时空给你一个么么哒,<不吃晚饭绝对不死星人>: 么么哒[爱你][爱你][爱你][爱你][爱你][爱你][爱你][爱你][爱你],<爱老妖爱生活-嗨嗨小迷妹>: 么么么么么么哒~啪啪啪~,<绫罗乱>: 老公么么哒么么哒么么哒么么哒么么哒么么哒么么哒么么哒么么哒么么哒么么哒么么哒么么哒么么哒么么哒么么哒么么哒么么哒么么哒么么哒么么哒么么哒么么哒么么哒么么哒么么哒么么哒么么哒么么哒么么哒么么哒么么哒么么哒么么哒么么哒么么哒么么哒么么哒么么哒么么哒么么哒么么哒么么哒么么么么么么哒！！,<临安风骨陆十九>: 不仅给你么么哒还给你么么啪,<貂貂白菜>: 么么哒湿湿哒。。。。此处省略]
1744188571	终于回到了温暖的小窝，做个炒蟹给自己接接轰[馋嘴] ​​​	[<悦HYz>: 出得厅堂  下得厨房[阴险][阴险][阴险]不错哦,<a邱邱>: 看在你那么贤惠的份儿上，我嫁！！！,<洛若安生>: 你真该减肥了！看看你的肚子！,<正版影子_想听无衣>: 你在吃蟹蟹而 @正版河图  却不吃小龙虾，你快教教他，另，美食也要滤镜[挖鼻],<把千年咒怨轻湮>: 全是油。。。啧啧啧。你这质量是减不下来了啊[汗]  http://t.cn/R5SGOCz,<楼百年-此生不悔入盗墓>: 一直觉得老妖有人妻属性[doge],<东风飘兮r>: 喂我一口嘛！！妖妖妖妖妖妖妖，啊――,<付挽烟>: 好贤惠啊，妖叔，我更爱你了,<玄妖酱>: 人妻妖[doge]怎么办我好饿[doge][拜拜]不过盘底好多油[doge]老大这是你对自己放纵的第几顿了[doge][doge],<木兮虞兮>: [doge]接接轰,<笑與a君歌>: 能吃吗，怪渗人的[思考],<大脑洞星原住民>: 再来点辣椒就好了,<大音希声sp>: 螃蟹里面有很多寄生虫,<萝千灯>: 贤惠的老妖[兔子],<番茄加加加乌梅>: 想吃[泪流满面],<huohuoli子焕___>: [馋嘴]看上去就很好吃,<妖女叶子>: 只是你的小窝少了我[笑cry][眼泪][笑cry],<原来就是周涵>: 我爱你啊啊啊啊啊,<业火苍云歌>: 我知道你缺与你共餐之人,<薇薇猫-R>: 想吃[馋嘴][馋嘴][馋嘴][馋嘴][馋嘴],<甘楽le家滴_楠神233>: 你...是在诱惑我,<_屋顶的猫3104>: [鲜花][鲜花][鲜花]大宝宝，说吧。要怎样你才答应我的求婚？恩？,<怀瑾zwx>: 满满的油。。。不胖才没天理。 看宝宝现在的名字，看到这种东西简直不要太煎熬[生病][生病][生病] @音频怪物,<永燃的瞳术師->: 你真的是超级喜欢吃小龙虾小炒蟹，从来没吃过的我眼馋中,<虫叽叽-音频怪物1212生日快乐>: 说好的人鱼线呢[喵喵],<顿笏>: 这么油还吃！！！身材身材身材！！,<妖颜粉>: 你怎么放了这么多油……,<Qui_____>: 没有腹肌也不是没有道理的,<这个懒蛋儿丶>: 是不是太油了？你到底还要撑破多少演出服!!,<愛吃肉的貓2015>: 恨不相逢未嫁時！肯下廚的男人～心慟亦心動！[爱你],<采图人>: 还好我没在半夜看到，要不然小心脏受不了,<礼信爱勤-W>: 广州站什么时候开始售票？？？[干杯],<苏石灿>: 贤良淑德[眼泪][眼泪][眼泪],<正版茼蒿是无凭>: 看着流口水[色],<梦与恶鬼>: 敢不敢透个坐标 我要去堵你家窗户！,<梦与恶鬼>: 啊啊啊  妖叔你住哪！！！,<清寒小透明>: 问为何你这么胖（油真多）晚上吃这个能不胖么,<一去九百里>: 回复 @TanB冰 :[笑cry]我服,<白衣图神千秋万代>: 真的是……一盘油……啊……老妖，会胖的[微笑],<慕青音>: 左上角是外卖单子吧[馋嘴]如果是你做的话，怕中毒！,<榴莲千层y>: 刚吃过饭的我，又饿了[色],<苏槿信执>: 会下厨的老妖最帅气了(ฅ´ω`ฅ),<堇言QAQ>: 老大，油有点重啊,<叶落落一地>: 有手艺的人啊[色][色][色],<重重若梦梦淙淙>: 一直不懂这个要怎么吃，，，，嚼壳补钙吗？,<是个温柔的人呐->: 好好休息[兔子],<明四爷-倦鸟归巢>: 用老干妈炒的么！老大！,<二十四桥明月微雨>: 妖叔这样把有当水用的节奏？[doge],<河兔兔不姓何>: 妖叔你胖不是没道理 你看看你那盘子里边多少油  都够再炒盘菜了！！,<爵禹弦>: 为了吃真是找了各种借口,<苏叶Vicci>: 老大就问你放了几斤油[微笑],<TanB冰>: 回复 @一去二三里的世界 :然而，你扛不动[doge]]
1744188571	撸了一天音，嗓子彻底玩蛋了，真的尽力啦，希望能成啦…被这个大鼻孔盯着心好方[笑cry] ​​​	[<翊歌霏扬>: 我靠有话好好说别抽太多烟喝太多咖啡 累了赶紧去歇着别再录音了 什么时候都可以就是别把身体搞坏了Orz对自己好一点啊Orzzzz,<甘楽le家滴_楠神233>: 大鼻眼子！[doge],<o月白酥o>: 少抽烟啊[兔子]么么,<婫南烟>: 烟头怎么解释？我们又不瞎！[怒][怒][怒]伤害我脑公的嗓子，我跟你急眼哦！,<苦茶笑完>: 保护好嗓子，烟…还是少抽！！,<猫会汪汪叫>: 老大。。。坐等你7月的,<老妖家骨女_吾神李楠>: 照顾好自己！！多吃点润喉的，最好不要抽烟！！！！！保护好嗓子，期待新歌！！！,<-有几个十年->: 大鼻孔[笑cry]我笑出了声[笑cry][笑cry][笑cry],<正版陌上_与君隔纸怅相望>: 哈哈哈哈哈哈哈哈哈[笑cry][笑cry][笑cry][笑cry],<怡家的小梅子>: 哈哈哈哈哈哈哈哈哈哈哈,<果冻吃一口>: 明明是大眼睛[笑cry],<翻滚的肉丸-鸟叔本命>: 大鼻孔好呆萌[色]楠神保重身体,<十里桃花三生繁华>: 真  大鼻孔，哈哈,<蚊哥wg>: 哈哈哈哈哈哈哈哈哈这表情好萌啊,<淋著雨的鼠>: 那麼拼！主意嗓子啊~一時爽，小心喉嚨,<琅王邪邪邪邪邪>: 太尽力了不好...,<相亲相爱一佳莹>: 好好保护[羞嗒嗒],<火鸡是鸡神鸡神是懒人>: 广州可以！但是七月正好老师周啊！我就问你什么时候来南宁！提前吱一声好吗！广东广西两头跑我很累的[眼泪],<大概就是个辣鸡吧>: 保护好嗓子[心][心][心]照顾好自己[心][心][心],<santa-baby-mj>: 哈哈哈，蜜汁笑点…,<用户5954873238>: [眼泪][眼泪]搞笑,<樱花飞舞千叶樱>: 哈哈这个有点萌啊 @音频怪物  ,<鲤犯>: 注意嗓子！少抽点烟！！！,<妖家凌小琬>: 新歌！！注意嗓子啊,<云里-SA>: 什么时候你和尔康这么好了 [眼泪],<正版日青鱼_>: 心疼 好好保护嗓子哦。期待新歌,<hutu--荔荔皆好吃>: 要注意身体哦(´-ω-`)！,<甘楽le家滴_楠神233>: 老大不管怎样 我们都在 加油 我也加油 嘤嘤嘤 明天最后一天中考[泪],<千城之城LD>: 注意身体啊，要知道身体最重要。[偷乐],<摆直一头龟的你>: [挖鼻]鼻孔好评,<涟冬>: 又是咖啡又是烟，真是想无视都难啊，累了就歇会儿吧老大。。。。最后那个“嗓子玩蛋”我实在是不愿意吐槽→_→,<张落abc>: 妖叔少抽点烟，身体最重要。,<乱码Garbled>: 少抽烟，多喝水，少熬夜，安，摸摸。,<驱影天下>: 你可不能废啊，我们等着你出新歌呢[害羞],<最最可爱的大番茄>: 昨晚听了好几个版本的浮生未歇，突然间特想听老妖唱的。听过之后不知道怎么了，就是心里好感动！ @音频怪物,<花脸小厮>: 果然是专辑吗？老大威武,<朝祀_mio>: 咖啡加烟，你嗓子不玩蛋谁的嗓子会玩蛋。妖叔，好好休息，少抽烟多喝水,<Qui_____>: 男神多喝水少抽烟啊！,<老妖一生推>: 我只看到好多烟头,<大漠烟锦>: 我以为有自拍都不敢让别人看[doge][doge][doge],<大漠烟锦>: 咋就不知道心疼自己呢[喵喵],<我请妖君吃豆包>: 妖君，别那么难为自己[爱你][爱你][爱你],<iCorre暖阳>: [悲伤]别太拼命啦照顾好自己,<陈公子_huge>: 少抽烟，对身体不好，困了就早点睡[爱你],<只许周某放火>: 抽烟死的早，大笨蛋,<采河图的小蘑菇>: 憋吸烟啦[怒骂],<雨芒一言不合就>: 好心疼呀⋯⋯妖妖你只要安安静静保养皮肤自拍就好了[悲伤],<H_阿心>: 嗓子坏了你还有颜值啊！,<H_阿心>: 妖叔好好休息注意嗓子,<青灯枯藤>: 那么问题来了 @音频怪物  你敢说你录哪首歌吗？,<木子岂可那么萌>: 辛苦了。保护好嗓子。,<原谅我这一生菊花不洁爱基友>: 哈哈哈哈哈大鼻孔,<宝妈李美熙>: 美好的事物，让人好的心情,<ulili_10131>: 妖大悠着点，忙完了好好休息[飞吻],<良家小狐媚>: 当年程蝶衣为了嗓子，能把大烟膏子都戒了，你就不能学着点。,<落花时节又逢咩>: 还要说一句，求演唱会能来郑州，或者武汉[心]]
1744188571	归家路上遇到双彩虹，很好吃的样子[馋嘴] ​​​	[<小强逵逵娃娃>: 回复 @白日梦少侠 :就让我矫情矫情呗，这不是因为我一个女生还在各地飘来飘去呢嘛。除了家乡还没找到有归属感的地方嘛，等找到了就没这么矫情了吧。,<摇扇大汉>: 回复 @小强逵逵娃娃 :人在哪家就在哪，太矫情的情怀可以不要,<没节操的话题不能说真名>: ……难道那天全国各地都出现的彩虹还是这么巧→_→路过我家乡了,<lxt醉雨霖觞>: 你除了吃还知道啥！[拜拜][拜拜][拜拜],<帅气的阿渺OwO>: 老妖你戳一下看看会不会有彩虹糖,<蚊子小天使-一生只此一河图>: 老司机，不好好开车在干什么，,<蚊子小天使-一生只此一河图>: 从未见过彩虹的宝宝，表示不服,<唐门的疯子>: 吃吃吃，就知道吃，看你长胖了可肿么办◐▂◐◑▂◑◑▂◐O_o,<本土匪-要做了阅读呜啊>: 不要用手指着彩虹哦，听说用手指彩虹会变弯[doge][doge][doge],<塞外-烟雨楼主海伦别拉>: 求回答设想中它应该是什么味儿的~~~,<VG桃枝>: 吃。。彩虹。。。。。糖？……？[喵喵][喵喵][喵喵],<i蓝夏>: 开车不要玩手机，  开车不要玩手机，  开车不要玩手机，行驶中更不要玩手机,<小熊软糖的小熊>: 我这里也是耶！  http://t.cn/R5iDMlk,<老妖家的小冬瓜>: [彩虹][彩虹][彩虹][彩虹][彩虹][彩虹]你和彩虹一样好吃[馋嘴][馋嘴][馋嘴],<橘肉卷>: 这么胖还敢吃？恩？,<作死不作死吗>: 妖君你买车了[doge],<可乐尼洛-Rainy>: 鸡肉味，嘎嘣脆！,<我请妖君吃豆包>: 妖君，我想到了那个广告，“遇上彩虹，吃定彩虹”[馋嘴][馋嘴][馋嘴],<全都是吹牛>: [照相机][拍照][照相机],<刘文叔0205-卜竹>: 我妈也给我发了照片！老大你在吉林吗？！,<翊歌霏扬>: 归，家[doge]有种去唱啊   心疼你的体重君[doge][doge]听到它的哀嚎了么[doge],<汐然cc>: 好吃你就多吃点[偷笑],<yxxxx茜>: 我好想知道下一次演唱会是什么时候啊，这次一定要提前买票去看，所以妖叔快点公布时间地点吧，我都等不及了！！！,<花落怨痴蝶>: 你比较好吃[爱你],<无魇鬼>: 我昨天也见到双彩虹[吃惊],<iwanTosEyou>: 回复 @从头喜爱 :[心],<李楠后院的萌蘖>: 亲爱的楠神，一路顺风~╭(╯3╰)╮,<我是大昕新欣心鑫芯忻>: 为啥我觉得你在副驾？谁带着你？！你要是开车就好好开车~~小心一点点呀~~,<起名废的痛苦>: 昨天晚上梦见我要到了你的签名，说，怎么赔我[拜拜],<云将鹤>: 这是一只在海南读书的小妖，希望老妖能在国庆在广州或者湖南开场演唱会，就算坐硬座火车坐我也要坐过去看你[求关注],<正版张空空了个空>: 彩虹双皮奶更好吃,<傲娇哒狮子>: 妖 开车小心点 看你位置是在驾驶位啊[微笑][微笑],<一只能吃的泉小墨>: 运气非常好我都没有遇见过,<姬君长歌>: 咬一口，会有好事发生！,<-景茶>: 飞上去啃一口尝尝嘛或者男神快跟我回家我家有,<妄琉天翼>: 作为吃货我要说一句～～～,<清灯屿岛主>: 吃！就知道吃！！！[怒骂][怒骂][怒骂],<大妖妖宝宝的夜水子宝宝嗯>: 长颈鹿先森~ @音频怪物   [害羞],<扶苏啊扶苏>: 我在放结界[doge],<水阔江天>: wuli妖叔，乃就是个吃货货,<夜斗的迷妹>: 你最好吃[哆啦A梦花心],<脑白金爱吃兔奶糖>: 你需要一只长颈鹿[喵喵][喵喵][喵喵][喵喵],<灵剑山王舞长老关门大弟子王陆>: [doge]找了半天 怎么没人叫彩虹[彩虹],<邓楚涵的迷妹>: 其实我小名叫彩虹,<朔光的朔_朔光的光>: 快去临姐那里报到！,<罗先生家的猫咪>: 广告看多了的后遗症。[思考],<Gaffe-孤>: 飞上去尝尝[doge],<Cri-彩虹>: 你吃过我[笑cry][笑cry],<未醒-_->: 你倒是吃啊[脸红][脸红],<枕头枕头我是枕头>: 于是你要上天？[思考],<恋之伊始>: 好幸运哦[哈哈][哈哈],<8023的暗号是3811>: 妖君，你这是要吃上天的节奏呀！]
