1744188571	夜游鸟巢，2016年9月16号…这个舞台属于我们……属于我们二次元[泪] ​​​	[<云饮云青青>: 虽然去不了现场，但是……求！直！播！啊！[泪][泪],<请叫我小萌比ovo>: 回复 @陆卿离 :嘤嘤嘤啃着月饼默默哭[泪],<哭不完-索性笑>: 这是，我们的，世界！,<燕宿雕粱-月度银墙>: [泪][泪]我昨天已经哭出来了，不容易，真的太不容易啦，还好我在北京，还好我能见证！,<离七乃皇兮>: @古风音乐会   @音频怪物   @正版河图   @墨明棋妙原创音乐  对…这个舞台属于我们二次元…再过几年等我回国一定会来看你们的[doge][害羞][爱你][悲伤][可怜]祝心时纪音乐会大成功[doge][害羞][爱你][嘻嘻],<离七乃皇兮>: @古风音乐会   @正版河图   @音频怪物   @墨明棋妙原创音乐 @ediq   @丢子Diuz   @千草仙   @HITA @小愛的媽   @Aki阿杰   @绯村柯北   @翩翩猫公子   @清弄   @橙翼   @zhucool   @不纯风流多英俊   @为了狮子头 @灰老板_    @董贞   @Smile_小千   @玄觞   @_CcccEs   @许多葵   @梦璟SAYA   @吾恩_5n_   @安九   @阿杰729   @不才哎哟哟   @云呆的哭  ,<别打扰我吸氮气>: 嗯，有一个时代，是属于你的，我的青春，属于你,<持已CHEE>: 今天晚上才回北京，怨念,<苏墨挽>: 偶去不了，精神与你们同在！！！,<秀眉老父->: 妖叔我知道兔兔肯定在你旁边吧[doge][doge][doge],<墨墨墨墨汐>: 然而我又去不了[拜拜],<候一场千年雨歇>: 老妖我爱你[怒骂][怒骂][怒骂],<萱小小小草嘿>: 你等着，总有一天我会去找你的[悲伤],<老妖家的小番茄>: [悲伤]等我有钱了，一定去看你,<玖霄環珮>: 开学我还能说什么,<老妖家的小番茄>: 回复 @老大老大我是包子 :同病相怜,<老妖家的小番茄>: [泪][泪][泪]不能去看,<老大老大我是包子>: 为什么我要上课啊[泪][泪][泪]心疼自己[伤心],<特-别好看的漫漫河>: 我在北京啊，去鸟巢看过演唱会,<河图的长生>: 去不了的默默心酸,<音频小爱>: [爱你][爱你][威武],<离人的月光->: 你们是最棒的[good][爱你][爱你][爱你][爱你][爱你],<烟家树198605>: 去听音乐会  可以抱抱你吗？,<花雨黯夜>: 这个舞台属于我们二次元,<正版包子-他是温柔本身>: 买了门票！好期待～总算能看到老妖了QvQ,<宋祁凉辰>: 穷逼大学生买99的票，到时候舞台上见。[悲伤],<阿语爱丸子>: 回复 @暮沉西山 :联系了，不能[泪][泪][泪][泪],<暮沉西山>: 回复 @阿语爱丸子 :[思考]不能联系一下补一张吗,<安静的鲨鱼___酱>: 爱你爱你[心][心][心]加油[心][心][心],<南城忆_>: 与你相遇好幸运[爱你],<俺是抹茶它妈>: 啊，这两天一直在北京，今天刚从鸟巢回来[泪]16号就要回去了，好心痛！跟着学校考察，居然不让我们自己活动！,<胖明日常瘦不下去>: 回复 @音频红尘 :噫(*/ω＼*),<堇色慎行>: 遇见真是一件乐上天的事[哈哈][哈哈],<阿语爱丸子>: 我能说我的票丢了吗[泪][泪][泪][泪][泪][泪][泪][泪][泪][泪][泪][泪][泪][泪][泪][泪][泪][泪][泪][泪][泪][泪][泪][泪][泪][泪][泪][泪][泪][泪][泪][泪]一个忧桑的 girl[泪][泪][泪][泪][泪][泪][泪][泪][泪][泪][泪],<夜雨声烦烦不停>: 洗干净等我吧[doge],<by柴叶>: 很幸运遇见你，遇见这首古风。,<正版__>: 入圈5年了，我很幸运遇见古风～,<陆卿离>: 回复 @ymx七罪 :我也去不了了啊没时间没钱，qaq,<正版__>: 爱古风，爱二次元～,<音频红尘>: 回复 @明姑娘的学长大人 :不去了 人家中秋要和你待在一起嘛,<胖明日常瘦不下去>: 回复 @音频红尘 :求带签名回来！！！,<你们的老窝窝被穷死了>: 回复 @缚骨相思诛心入黄泉 :约约约！,<正版梨花殇-一生得此一河图>: [泪][泪][泪][泪][泪]军训来不了[泪][泪][泪][泪][泪],<正版萧婉>: 可惜要在兵营集训，并不能去，很遗憾[泪],<正版_乔家倾君上河图>: 你居然哗草地[doge],<漓漓渊上草>: 妖大，《浮生未歇》开放填词授权啵，我家翻唱想做剧情歌[爱你] @音频怪物,<缚骨相思诛心入黄泉>: 回复 @把大脑丢失了的莴勒个苣 :其实我也只是不路痴……可以约一波呀[偷乐],<芳菲花开半夏>: 趴着的时候有没有想过书包的感受,<五个橙子_512>: 出票，原价699A券a2区8排，ab两券齐，需要的私信，价格可协商，临时有事去不了了，心塞塞,<种花家的励志兔>: 村里的孩子就看看，再一次问问自己为什么上个大学进了村,<卡卡_不能随便改名字了不开心>: 机票酒店都订好啦！！就等着16号晚上了[偷乐][偷乐][偷乐],<你们的老窝窝被穷死了>: 回复 @清商忘-我已经是一条咸鱼了 :啊谢谢！,<你们的老窝窝被穷死了>: 回复 @妖妖大宝宝的夜水儿小蛮妖 :圖片評論  http://t.cn/RcMfH3s,<雨芒一言不合就>: 回复 @把大脑丢失了的莴勒个苣 :妹子不管你坐啥交通工具，到北京以后找到地铁站就找到去鸟巢的路了＼(￣︶￣)／,<大妖妖宝宝的夜水子宝宝嗯>: 回复 @把大脑丢失了的莴勒个苣 :[泪][泪]开始我也买了票~后来出了~ ……[哆啦A梦汗][哆啦A梦汗],<你们的老窝窝被穷死了>: 回复 @妖妖大宝宝的夜水儿小蛮妖 :是啊  http://t.cn/RcMfAaz]
1744188571	我想纹个身，你让不？[doge] ​​​	[<正版涉尘>: 不让，不许，不准[微笑],<叶子-不加V>: 纹吧，纹完了你跪俩月榴莲皮就行[喵喵],<江海涛的小老婆十九>: 妖叔咱还是不闹了啊，乖[喵喵],<相思不自知>: 我们来纹个对戒吧,<闲潭悠影>: 我不让，你听不？,<夜雨声烦烦不停>: 私信给你一张我照片吧，纹个我我就接受[doge],<gxYueyUeyuE是丸只啊>: 慢慢的～时间久了～你更月半了，图都变3d动画了～[doge][doge][doge][doge][doge],<坐抱西瓜等夏天>: 会发现你身上有两个字的纹身：月半,<KYUNGYO君>: 你不适合纹身，别纹[doge],<追自己尾巴好困难>: 不如我去学纹身，学好了给你纹?,<栗玄_Lsay>: 安定待着走你的小清新路线,<闻人棠桃花仙_>: 回复 @halumetal :纹身不迷信，迷信不纹身,<哦吼吼啦啦啦啦啦耶嘿>: 可是变胖的话图会变形吧？还是别了，万一哪天你又胖出来了可咋整，纹身可痛了咱画画就好[笑cry][笑cry],<蜗牛san>: [doge]不说胖了。瘦了也走形啊。还是买贴纸玩玩吧老大,<拾明_>: 不让！以后会走形[笑cry],<南翎夜舞>: 这是，什么fell……,<伊椋>: 不要不要[泪][泪],<张杰的小星星哦>: 不让[doge],<智叟愚否>: 不让，太疼了，如果实在喜欢就玩纹身贴，还可以经常换[喵喵],<14OZ的茶杯>: 画一个吧 没事还能换着玩儿,<妖唧>: 怕变形，不让[doge],<等更的痴汉黎>: 你先纹，纹好了裸拍给老婆们看[doge],<不吃馅的南一柯_>: 不要啊会很疼的qwq,<用户946421873>: 这是贴上去的吧？[顶],<用户946421873>: 像黑社会的[泪],<用户946421873>: 你纹了？[拜拜][拜拜][拜拜]不给。。。,<芳菲花开半夏>: 贴一个算了还能老换图案，纹了万一长胖，图逗撑大了[哈哈],<廖声辉>: 左青龙，右白虎，中间喜羊羊[doge],<浅浅情水>: 你想纹啥就纹啥[爱你][爱你][爱你],<从小帅到大0901>: 不能把你的自拍纹上去，就不准纹,<夏徒的微博>: 可是，会很痛的！,<fssfa>: 广州演唱会贴的就是这个[爱你],<枕头枕头我是枕头>: 不要！万一过个猴年马月的瘦了怎么办！,<唐门的疯子>: 换个图，这个好丑-_-#,<荀墨辰>: 胖了咋办(・o・),<无相相相相相儿>: 社会我妖哥[doge],<real__卿夜>: 自己想好自己喜欢就好了啊,<陈郴chenyy>: 然而看不出这是大腿还是手膀子。。。。[doge][doge][doge][doge][笑cry][笑cry][笑cry][笑cry][笑cry],<-墨迹空白->: 不让！！！！偶心疼！！！！！！,<Aimee阿夏>: 我说不行，那你说有没有用呢,<毛蛋D_小野君的胖次>: 你随意，只要记得脱给我看[害羞][喵喵],<hhhh朕略萌>: 女朋友團表示你要搞事請啊,<苏清淮>: 叔~表！！会疼的,<涯八千>: 这个菩萨有[doge]脸的感觉……,<Y_归期未知>: 让你干啥你就干啥北[doge],<春风的陈鹿安>: 会走型的[眼泪],<柒君01>: 呀~这么痛~~赶紧去吧~~~,<孟婆Lee>: 文一只蝎子，厌倦了这个图案又怕疼不想洗可以选择吃胖[doge]会变成龙虾,<酒忆久兮>: 纹一个，河图[doge],<哑烛不哑很会说话>: 你开心就好[doge],<七水->: 胖了瘦了都会变形，别纹了,<未兮言>: 还是画吧！纹身好疼的,<安王爷家的心影>: 拒绝[微笑]很疼的,<谁会为谁抛却繁华>: 不不不，你已经很帅了！]
1744188571	时间不知不觉，若干年过去了，想知道谁还会想我这如疯的男人[doge] ​​​	[<Aubree打小怪兽>: 你竟然……………长这个样子…………,<wfs王浮生>: 老公，你，额，真美 @yu洛洛洛   @冯荣春Feng  ,<西西_吞吹狂魔二号>: 久违了hhh就爱这样的你www,<我天生便是个纯洁的人类>: [笑cry][笑cry][笑cry]半夜翻微博我真是忍不住了，我好像明白为什么老妖和图图微博下评论画风不同的原因了。你跟那些妖艳贱货不一样[笑cry],<紫奎>: [笑cry][笑cry][笑cry],<赫利卡昂>: 老妖，你最近……好不正常啊-_-||,<云梦泽9527>: 神呐，放过我这颗弱小的心灵吧！！！！,<074司司司>: 眼睛被辣哭了…[眼泪] [眼泪] [眼泪] [眼泪],<绮缯>: 只要歌声还在，一定会有人记得你这个自拍狂魔的。•﹏•,<清漓墨客>: 对，没错，我就是你的颜粉！[眼泪],<秀萝跳起来抢了你的瓜递给了秀太>: 设置了无图模式的我，一刷出来图[悲伤]老妖不要这样我怕我自己来回取关！,<魂归故里-五月>: 画风辣眼睛[眼泪] [眼泪] 我都辣哭了[眼泪] [眼泪] [眼泪],<最初的梅子>: 来啊。互相伤害啊,<活络经>: 人间绝色，看硬了[嘻嘻],<挽翎>: 我待你如初见，你却如此辣我眼镜！妖，你赢了[哆啦A梦吃惊],<Ana_突然笑死>: 好好唱歌，憋自拍[拜拜],<一盏青柠Nina>: 我不敢向别人安利你的微博，怕他们和我绝交[拜拜]  http://t.cn/Rca3EXs,<软宝宝是只小仙女>: 老妖你记住！我是你的颜粉[微笑]嗯,<潘璟瑶>: [微笑]我做错了什么[微笑],<_鬼笔>: 。。。。。不想转,<乌玛丽玛丽轰>: 终于 发出你压箱底的自拍了,<两岸榆花白>: 我我我我我我我！,<玉面小飞狍>: [doge]我女神  http://t.cn/RcXccbS,<双蛊>: 我日 吓死爸爸了,<青空白河>: 看到网易云上的评论，比较手贱的点开了微博，搜索了音频怪物，然后……………为什么声音和形象反差如此之大[笑cry][笑cry][笑cry],<正版妖兔_>: 也就我这种死忠粉能承受住了,<江海涛的小老婆十九>: 唉~也不知道为什么会入了你这个大坑还无法自拔[爱你],<相思不自知>: 你吓着我了[泪][泪][泪][泪],<闲潭悠影>: 我忘了你本来长什么样了[哼],<一相长安>: 如花 好久不见[笑cry][笑cry],<年轻范的土豆>: 颜粉一本满足[微笑],<夜雨声烦烦不停>: 你特么是如花的男人[微笑],<停停复行行>: 不争气的我居然还爱着你。。。哎,<张二狗你给操不给操>: 不发自拍我还爱你……我爱你这么久……,<女王范的冰殿>: 如此的风骚要勾引谁？←_←,<浮生流寂>: 回复 @Ryo吾家凉儿草莓心 :哈哈哈，他是不是寂寞啦,<水沫儿cheryl>: 如花真是倾国倾城,<伴君洛阳>: 你不发自拍我们还是爱你的,<正版七七_不負時光不負圖>: .......................................................................,<黄瓜君和菊花受不得不说的故事>: 放心，你的脸大家一辈子都不会忘记，毕竟很特别,<正版山月>: 这记住的期限明明是一万年,<蜗牛san>: 冲这自拍。我记你一辈子[微笑][微笑][微笑],<吴家糖妙妙>: 我的哥啊！我心脏病都犯了好嘛！你给我配！,<_时维_>: 叔！！算我求你！！不要再碰照相机了！！！[微笑][微笑][微笑],<三张宣纸>: 我是如何坚持没有取关的[喵喵],<小二丶来一打星球杯>: [doge]你开心就好，真的,<____清明1031>: 久违的自拍，你依旧是我心中的如花美人[doge]我依旧是你的忠实颜粉啊喂,<x语然x>: 我啊【麻麻救命有人欺负我】,<顾笙哈哈哈哈哈哈嗝>: omg我的眼怎么瞎了！,<盗墓笔记藏海花>: 妖啊……这久违的.....,<呆圈_>: 辣眼睛o(｀ω´*)o,<抠脚大汉四儿>: 不取关的我是真爱[拜拜][拜拜][拜拜],<妖唧>: 你还是我认识的那个狂放不羁爱自拍的老妖精[doge],<青宇家的薄荷>: 我是你颜饭你懂么？！…！,<用户946421873>: 受不了你了[拜拜][笑cry][笑cry][笑cry]]
1744188571	安[幽灵] ​​​	[<三更加半夜>: 听完你的歌，睡觉，晚安[幽灵],<fssfa>: 妖怪快快现身啦！好想你[可怜],<猫来了喵嗷嗷嗷嗷>: 好几天没更啦死鬼！！是不是把我萌忘了！！,<无魇鬼>: 3天沒更博了[泪][泪][doge],<大妖妖宝宝的夜水子宝宝嗯>: [悲伤][悲伤][悲伤][悲伤][悲伤][悲伤][悲伤][悲伤][悲伤][悲伤][悲伤][悲伤][悲伤][悲伤][悲伤][悲伤],<柒愁>: 男神你好几天没发博了～,<奇迹炒炒丿bling>: 噫 这更博频率多半是有性生活了,<音频红尘>: 回复 @凑不要娃娃脸儿 :亲亲抱抱举高高(ง •̀_•́)ง,<wb歪_想喝海水>: 爸爸你还准备更博吗,<凑不要娃娃脸儿>: 回复 @音频红尘 :可以举高高么 [可怜][可怜],<音频红尘>: 老大快更博～[爱你],<音频红尘>: 回复 @凑不要娃娃脸儿 :我抱抱你可以吗～,<凑不要娃娃脸儿>: 不太开心 老大 你抱抱我吧 [泪流满面][泪流满面],<胖次ID里得有老妖子>: 108万粉丝了[挖鼻][挖鼻],<妖_湖心>: 三天不粗来…老大你这是要搞事情啊[哼]…快更博啦～～,<妖家凌小琬>: 都三天啦干啥去了？,<囿于香扑扑的相见欢>: 叔你干啥呢怎么还不更博[喵喵],<老妖家骨女_吾神李楠>: 这里出一张鸟巢心时纪699的门票，可刀[泪][泪][泪][泪][泪],<头发梳成大人模样戴一副黑边镜框>: 郭璐漪，我知道你在,<三更加半夜>: 啥时候更博[微笑],<袁big欧尼>: 老公，我来跟你道晚安，晚安晚安[爱你],<筱土豆>: [哈哈]妖服收到  http://t.cn/RcUzKk7,<子非吾i>: 嗨～今天魅族Max首发？？？你怎么消失了[笑cry][笑cry][笑cry],<坤宝三岁>: 妖啊，安(ღ˘⌣˘ღ),<狼烟遮城墙>: 买的衣服怎么还没有发货，客服也不回信息,<白滚滚_riinriin>: 你还会来成都吗……,<一善子一>: [爱你][爱你][爱你]  http://t.cn/Rcy4dyJ,<淋著雨的鼠>: 點不開你的頭像。。。怨念,<永燃的瞳术師->: 早安，早起的鸟儿有虫吃,<柳若楓Rae>: 晚安 [幽灵][幽灵][幽灵] 哈哈哈哈哈 [笑cry],<妖_湖心>: 安安[幽灵][幽灵]～～,<安王爷家的心影>: 晚安[羞嗒嗒][羞嗒嗒],<静云就是黑萌的小八>: 换头像了唉！！！,<AOAOAOAOAOAOOAOAOAAA>: [心][心][心],<坤宝三岁>: 看过故人终场戏，淡抹最适宜,<周默_明月楼旁李大人>: 妖叔啊我真是中了你的毒怎么着都没法解[泪][泪][泪]疯狂向四周撒安利不管有没有人吃撒了三年啊[泪][泪][泪]虽然至今才拉了仨人入伙[泪][泪][泪]我好爱你啊妖叔[泪][泪][泪],<坤宝三岁>: 安(ღ˘⌣˘ღ),<魏晨的神之交友圈>: [幽灵][幽灵][幽灵][幽灵]回你四只,<大妖妖宝宝的夜水子宝宝嗯>: 想我宝宝[爱你][爱你]……,<ch食饵>: 为什么安后面要加个幽灵……我会想歪的,<鲸鱼吃洲喵吃鲸鱼>: 每天一个小目标  为你生娃[心],<又一安>: 今晚继续道晚安啊[可爱],<坤宝三岁>: 晚饭呲什么[哈哈][哈哈][哈哈],<甘楽le家滴_楠神233>: 最近烦躁的要炸了[泪]抱抱,<大妖妖宝宝的夜水子宝宝嗯>: [爱你][爱你]宝宝么么哒~[亲亲][亲亲],<y魂墨>: 老大，默默来表白你,<楠茶蓝鱼鱼>: 妖这么早睡是不是有什么羞羞的sei儿要做[害羞][害羞][害羞],<无魇鬼>: 攢錢買衣服[泪][泪][泪][泪],<相思不自知>: 明天要上课了，很不安[泪],<年爱茹>: 现在才想起来  今儿做梦梦到你给签名  还特认真的给画了好多小装饰[笑cry],<大漠烟锦>: 午安[doge],<八米五>: 午好哟老大[爱你]。。。小坏坏，，也学会一个字骗回复了嘛[笑cry][笑cry]你以为你不发自拍我们还会爱你？？！太天真辣[doge][喵喵][doge],<寻妖不遇_音频怪物1212生日快乐>: 么么哒[爱你][爱你][爱你]]
1744188571	今天特别想吃烤土豆，就烤了，男人吧[可爱] ​​​	[<伟光小迷妹>: 妖君我饿了[挖鼻],<梓墨清>: 盐水煮土豆 然后放点藏葱 熟了把皮一剥 沾着干辣椒面吃 美味[赞],<蜗牛san>: 这男人看起来烤的不错[doge],<此间萌物苏时045>: 烤，，，，男人？！哈哈哈哈哈哈哈哈哈哈哈哈,<好大一只污饼饼>: 我是土豆，真男人就正面上我,<三八夏至唯爱卿>: 好恐怖 你竟然烤  男人,<一个爱东爱西一个要死要生>: 土豆。。。。也能烤？[笑cry],<夜三Jw>: 所以这还是把男人剁成小块儿烤了？一言不合就烤男人,<浅夏时凉>: 表示只吃过蒸土豆，煎土豆，炸土豆……,<清笛y>: 咦，看起来真好吃,<艾影ivy>: 男人吧……吃吧吃吧不是罪～[闭眼],<狐狸是好温和的水啊>: 就喜欢你这种雷厉风行的男纸[doge],<蒋蒋不吃鱼_yu>: 好想吃，没吃过烤土豆,<桃李春风一杯酒F>: 烤烤烤，，，，吃吃吃,<-容歆辰->: 土豆控的我[色],<金石湾2016>: 会做饭的男人最帅,<楠茶蓝鱼鱼>: 今天特别想上妖，就上了，男人吧[可爱][可爱][可爱],<中华九番>: 今天想吃土地泥，，，够男人把,<无喜无忧无笑无泪>: 任性啊，其实我就想问下：好吃不,<头裂成两半>: 给我一口，给我一口嘛[doge],<萝千灯>: 妖叔真是生活家～看得我眼馋[馋嘴][馋嘴][馋嘴],<-景茶>: 别的我不求！只求叔y加个好友呗[偷笑],<望尽眼前伤了过去>: 我想吃你，但是吃不到怎么办，急，在线等,<疏小影Justina>: 夭寿啦，男神烤人吃辣[笑cry],<L雒离L>: 想吃。妖叔最帅[爱你],<念念xu>: 烤土豆怎么能切着吃，上手掰啊汉子！,<老妖你缺老婆不>: 莫名的想到了一个人，土豆[偷笑],<一根赫鲁晓夫种的玉米>: 我也想吃你烤的呀 老妖[哈哈],<狐长安>: 我最近都在听我的楼兰新娘，听得好想哭呀，[泪][泪][泪],<饱饱的萧萧>: 几天歌会没听到你诶 等你好苦！,<琴或箫也绝弦>: 胖死你[喵喵][喵喵],<余音shiny>: 我特别想被妖妖翻牌子，妖妖你想么？,<正版河兔兔家的十荼>: 用了滤镜，所以照片很好看,<李峋笑一个>: 哼哼！自拍技术没进步！拍土豆倒是拍得不错[馋嘴],<淋著雨的鼠>: 沒個邏輯性。。。。,<BLBL-干杯>: 烤…烤男人？！[doge],<琨瑾>: 看着很不错，饿了[爱你],<李峋笑一个>: 真的我说妖叔，自从你换了头像之后，每次看你微博，帅了一百倍[嘻嘻],<杳杳酱>: 口水[色][色][色]我想吃老妖考的土豆,<子虫k>: 你真是说一不二，想到就做,<雪印诺华>: 嗯!看起来蛮有食欲的,<多云绿色>: 吃吃吃，小心变成肥妖[挖鼻][挖鼻][嘻嘻][嘻嘻] @音频怪物,<北念南笙>: 好美味的样子[爱你][爱你],<文祎祎祎祎>: 烤了男人哈哈哈哈哈,<lsm大白>: 老大我叫土豆啊啊啊啊啊,<百里烟波>: @音频怪物  大大，我昨晚梦到你了[害羞][害羞]，还梦到你抱我了，好激动[偷笑][偷笑]好想一梦不醒[doge][doge][doge],<我是GM是我>: 特别关注这个小婊砸就一次都没有准过[喵喵],<爵禹弦>: 改吃素了？土豆淀粉多，也容易胖[猪头],<慕泽的杂货铺>: 比较想吃你[doge],<秋若迟>: 为什么你不想吃烤地瓜，地瓜难道不如土豆好吃么？[笑cry],<叫烟火的猫>: 这和是不是男人有什么关系？,<大妖妖宝宝的夜水子宝宝嗯>: [太开心][太开心]看一遍笑一遍，我宝宝可爱尿了[爱你][爱你][亲亲][亲亲],<KNJ秀>: 老妖，胖三斤啊！！,<倾慕之言mio>: 不会烤土豆的老妖，不是好歌手！[哆啦A梦微笑]]
1744188571	最近听说一个词：迷妹？是什么意思？求解，我一定是老了，信息不灵光了[悲伤] ​​​	[<变态时臣的金皮卡>: 你让迷弟怎么办[doge][doge],<卷毛不直>: 我要不要给你嗦嗦迷弟的意思？,<LorenaChang>: 為你著迷的妹子啊～（默默排入行列）,<正版乔家清明>: 我就是您的迷妹[害羞],<我是你的凉人>: 就是粉丝，死忠粉，被你的颜值，歌声等迷住,<音频木南_妖嘤嘤嘤嘤>: 就是我们啊(系统自动将男粉女化),<废话路人>: 就是我！成天沉迷与你无法自拔！你的迷妹！,<just以旿>: 其实我是痴汉[doge],<元宝不圆>: 谜一样的妹子，需要你用心去了解[doge]比如我呀,<谢怜的破烂儿>: 你的迷妹儿和小老婆在这儿～[doge],<机智的吃土少女C>: 这里就是一只迷你,<西瓜丸子也是妖魅纸>: 对，我是你的迷妹,<江海涛的小老婆十九>: 不就是窝嘛[挖鼻],<潋无>: 我就是你的迷妹啦,<安王爷家的心影>: 看我看我，就是我[doge]放下手中作业来看你的我[眼泪],<吴三邪777>: 迷妹啊～  是我啊 [害羞][害羞][害羞],<国旻啊使我疯癫>: 为你着迷的妹纸🙋,<此生只爱玉一人>: 迷妹，就是我这样的[喵喵],<正版采儿>: 盗我们家图宝宝的博[害羞]哈哈荼靡过来水贴,<西苑小六>: 女的粉丝叫迷妹，男的粉丝叫迷弟,<____清明1031>: 老妖我是你的迷妹呀呀呀[爱你][爱你],<川霂>: 就是，我[微笑],<惜晚晚的晚不是碗>: 我就是你的迷妹哇[害羞][害羞][害羞],<Mansfield夙堇>: 就素像我这样沉迷于你的妹子啊[爱你],<节奏12>: 像你这种发自己的鬼畜自拍照片 我们还不嫌弃你的这种就叫迷妹 hhhhhhh,<奔跑的大橙橙橙子>: 我就是你的迷妹呀……咦？我怎么说出来了？,<美女十二宫>: 就是疯了一样的迷恋你,<美丽的阿踢>: 越来越爱哈哈哈[嘻嘻][嘻嘻],<不语不语不>: 我是你的迷妹，六年半的妖领，算起来我差不多十岁就开始喜欢你了。我是四群的不语，请你眼熟我！拜托了  http://t.cn/Rc2oNyg,<大妖妖宝宝的夜水子宝宝嗯>: 回复 @九月2020 :[可爱]么哒哒~,<大妖妖宝宝的夜水子宝宝嗯>: 回复 @九月2020 :[可爱]点了！~,<emmmmnn>: 我是你的小迷妹~就是我很迷你的意思~男生事迷弟[馋嘴][爱你][爱你],<坂田_小叆>: 我才不是你的迷妹呢～～是盐粉[害羞][害羞],<李峋笑一个>: 套路！都是套路！,<苏清淮>: 就素妖君你对我做的事！【星星眼,<绿衣渐隐>: 迷失在老妖套路中的妹子[doge],<-憇初心>: 你是在说我吗[嘘],<君不归吾斟杯>: 爱你的小粉丝（女孩子）,<北念南笙>: 爱上你然后迷了你的路的妹子,<人尔春虫虫hhh>: 就是我们[doge],<风过间>: 是我，我是你的迷妹,<谕子猗>: 就是我呀，看这儿，看这儿ヽ(ﾟ∀ﾟ)ﾉ,<文兜兜发呆>: 我就是你的迷妹啊,<张艺兴啥时候来娶二喵>: 就比如我是你的迷妹,<丹三萌死了>: 简单的说，就是我,<曼曼酱_哇哈哈>: 迷妹，就是粉丝的另外一种称呼。指非常热衷于追星的女生 狭义地来说,迷妹是指比较狂热的粉丝。                  来自百度百科,<浪迹天涯与光同尘>: 后排迷妹来围观～,<正版阿汪>: 那你知不知道还有个词 叫迷弟   比如，我们班学霸。。。,<东兰路的吃货>: 早已成迷妹[眼泪],<安静如二哈>: 知道迷弟吗？虽然我是迷妹]
