2068795981	无我无人观自在，欢迎大家接下联[微笑] ​​​	[<陕西云南111>: 回复 @洛可可翻糖工作室-蛋蛋妈 :今天刚做完腰穿，孩子疼的哭了一天[泪][泪]  http://t.cn/RCS566Z,<如水卍>: 南无观世音菩萨[笑cry],<蟹蟹的快乐幸福生活>: 有为有法如梦幻。,<肥狮王想做睡美人>: 护汝护生常弥乐（勒）,<左右l缝圆>: 有酒有肉谈风生。,<洛可可翻糖工作室-蛋蛋妈>: 回复 @洛可可翻糖工作室-蛋蛋妈 :求大家关注[悲伤],<洛可可翻糖工作室-蛋蛋妈>: 抱歉打扰大家，大家帮帮2岁的罗宝祥 @宝祥吉祥   ，确诊神经母细胞瘤3期，爸爸与怀孕七个月的妈妈离婚，对病重的宝祥不管不问，宝祥每天都疼的发抖，妈妈不离不弃，没有钱和医疗资源，母子两个只能在家里等死，8月7日广西新闻网已报道过，恳请您帮帮可怜的母子三个！谢谢[祈祷],<SamsaraSSSS>: 无欲无求道自然？]
2068795981	年初一【恭迎弥勒佛圣诞】大肚的涵养：好脾气带来好福气[微笑] ​​​	[<美纶G>: 弥勒佛圣诞快乐[祈祷][祈祷][祈祷],<看喜>: [祈祷][祈祷][祈祷],<元宝VICO>: [祈祷][祈祷][祈祷],<君正傲>: [祈祷][祈祷][祈祷] 新年吉祥如意！,<葡葡葡道>: 阿弥陀佛 新年大吉大利[祈祷]🏼,<冰雪心净>: 阿弥陀佛 新年快乐,<_HoneymoonAvenue_>: @维克多VictorVV,<大玉米和小地瓜>: [祈祷][祈祷][祈祷],<Eric_lixiao>: 和弥勒佛同一天生日,<GRACExuuu>: 新年快乐[可爱],<S1m0nzz22>: 出发前去寺庙！！[祈祷][祈祷],<sasa帅帅>: 新年快乐[可爱],<-bao-bao->: [祈祷][祈祷][祈祷],<gt7593>: 阿弥陀佛，新年快乐]
2068795981	和大家玩下，告訴我这个图有多少个字。 ​​​	[<酸酸667>: 立、章、二、音、兄、儿、早、日、十、古、克、口、一、士、干、兀、三、元,<成熟的葡萄>: 立 早 兄 章 音 克 日 十  口 儿  古  干不知道算不算,<翻天倒地脑壳晕>: 眼拙我只看见九个,<Procrastination正在努力治疗中>: 回复 @Procrastination正在努力治疗中 :儿，章，口，兄,<Procrastination正在努力治疗中>: 回复 @Procrastination正在努力治疗中 :章，,<Procrastination正在努力治疗中>: 一，二，立，日，早，十，]
2068795981	和大家玩下，告訴我这个图有多少个字。 ​​​	[<菸煙艷>: 回复 @風水語錄梁伯銓Newman :立日十口儿音章早兄古克兀士干一,<小天之边>: 一、二、六、立、音、早、章、十、口、儿、古、克、亘、旦、兄、草,<不及时光1>: 回复 @Y茜xi :克,<-TammySun阳->: 一、二、六、立、日、十、口、儿、音、草、早、克、章、兄、古，15个！,<雨彤Sammy>: 章，克，立，日，十，古，儿，音，口，兄，早……,<徐银行很行很行很行行-s>: 回复 @Y茜xi :还有克,<Y茜xi>: 回复 @菸煙艷 :厉害[强]，还有人说一，二，兀,<Y茜xi>: 回复 @杏花岭上的种花少年 :我看有人发一，二，我不知道这算吗？,<菸煙艷>: 回复 @Y茜xi :还有 士,<善与知>: 一、六、十、立、音、章、早、克、日、儿、口、兄、古[喵喵][doge],<海上大公二世归来>: 回复 @海上大公二世归来 :再加一个“兀”,<我是神仙的姐姐>: 回复 @杏花岭上的种花少年 :就知道个。。金兀术。。,<琉羽汐>: 不考虑变形和侧看的话：立、二、一、日、十、三、早、音、章、克、兄、古、口、儿、兀、三（16个），变形字还有：亘，侧看的话还有：叶，可分开的话还有：竟之类的。,<杏花岭上的种花少年>: 兀，我只是想给大家补充一个字。。。  http://t.cn/RMON8l1,<菸煙艷>: 立日十口儿音章早兄古克兀士,<杏花岭上的种花少年>: 回复 @Y茜xi :兀，这个字有多少人认识。。。  http://t.cn/RMONX5m,<Summit_Hu>: 回复 @Summit_Hu :還有一個早,<Summit_Hu>: 一 二 三 六 口 日 曰 亘 旦 音 十 兄 克 兒 古 立 章,<沈叱傲>: 立日十口儿六一二三音兄早章克竟兀元亢,<信望爱_流浪的熊大夫>: 立日十口儿早兄章克二一古音,<不瘦回来不改名-哼>: 章克立早兄音十口儿一二六古,<Fish-妮妮妮妮妮妮妮>: 回复 @Fish-妮妮妮妮妮妮妮 :六一,<或许只有妳懂得我>: 立，日，十，口，儿，  音，早，克，古，章，兄，,<海卫一-唯一>: 一，立，日，十，口，儿，音，早，古，兄，章，克，叶。13个,<Ruby肜静>: 六 立 早 音 日 十 章 口 儿 兄 克 古,<剃度為僧再杵兩點>: 立、日、早、十、口、儿、章、兄、古、音、克…,<Meat_D>: 六、一、日、十、口、儿、立、音、竟、早、古、克、兄,<AKA周老师>: 二  六 十 兄  口 儿 克   章  早 古 音  旦  一 日 三 亘 立,<Fish-妮妮妮妮妮妮妮>: 立…早…兄…章…日…十…口…儿…克…古…音…,<夜色太美不温柔>: 一   二   立  日 十 口  儿 音   章   早  古  克   兄  13个,<刘少艳微博>: 立，草，日，十，早，克，兄，口，儿，章，二，只，六,<大华小王子>: 回复 @smart9911 :还有 一和二，齐活了[擠眼],<我是大咸人>: 回复 @阿鹰要戒了拖延症 :草、一,<小草三十>: 立  曰 十 口 儿 章 早 克 兄 古 音 一,<ha570>: 回复 @阿鹰要戒了拖延症 :一 二 六,<smart9911>: 立、日、十、口、儿、音、章、早、古、克、兄,<Y茜xi>: 回复 @Y茜xi :还有克，11个,<阿鹰要戒了拖延症>: 立、日、十、口、音、早、古、兄、章、克～ 还有三个是什么[可憐],<FancyBaby_>: [9]️个，立日十兄音章克早口,<Y茜xi>: 立，日，十，口，儿，音，早，古，兄，章]
2068795981	#风水小知识# 家里的屏封，不宜用这款有太多勾的图案，容易引起争吵，矛盾，家人不和谐。 ​​​	[<米米LiLy>: 如果是斜条状的呢？,<abc双飞燕>: [污]我家书房屏风就是这种，怎么办！大师,<Lily200806>: 看着就乱，纠结，原来风水上还有这学问，受教了。,<夏天带走小秘密>: 那用咋么样的比较合适]
2068795981	明天南无大慈大悲观世音菩萨诞，希望大家勿吃现场刹的海産[祈祷][祈祷][祈祷]。 ​​​	[<陈大花>: [祈祷][祈祷][祈祷][祈祷][祈祷][祈祷],<木子想要加工资>: [祈祷][祈祷][祈祷][祈祷],<接受承受享受>: [祈祷][祈祷][祈祷],<0109的企鹅>: [祈祷][祈祷][祈祷][祈祷][祈祷][祈祷],<痴心茶痴>: [祈祷][祈祷][祈祷],<孙瑞雪Michelle>: [祈祷][祈祷][祈祷][祈祷][祈祷][祈祷][祈祷]]
2068795981	明天南无大慈大悲观世音菩萨诞，希望大家勿吃现场刹的海産[祈祷][祈祷][祈祷]。 ​​​	[<天涯淡客>: [祈祷][祈祷][祈祷],<随缘且行且幸福>: [祈祷][祈祷][祈祷],<妙语连滴>: [祈祷][祈祷][祈祷],<甜甜玥儿>:  // @風水語錄梁伯銓Newman :希望大家转发起来日行一善，积福增运。[祈祷][祈祷][祈祷],<HYS-珊>: [祈祷][祈祷][祈祷] // @風水語錄梁伯銓Newman :希望大家转发起来日行一善，积福增运。[祈祷][祈祷][祈祷],<翁源仙鶴>: 图片评论  http://t.cn/RVXcdUi,<骅众取宠2011>: [祈祷][祈祷][祈祷] // @風水語錄梁伯銓Newman :希望大家转发起来日行一善，积福增运。[祈祷][祈祷][祈祷],<没什么好取名字的xxxxxxxx>: [祈祷][祈祷][祈祷]]
2068795981	明天南无大慈大悲观世音菩萨诞，希望大家勿吃现场刹的海産[祈祷][祈祷][祈祷]。 ​​​	[<-水_滴->: 希望后天去医院看病一切都顺利！不要做支架[泪],<口口ai宝宝>: [祈祷][祈祷][祈祷],<易凯风水>: 明天是观世音菩萨出家日哦，2.19是圣诞,<幽魂爱上朱丽叶>: 希望明天科三考试一把就过[祈祷][祈祷],<_香飘飘想>: [祈祷][祈祷][祈祷][祈祷][祈祷][祈祷][祈祷],<汶汶2920585841>: [祈祷][祈祷][祈祷][祈祷][祈祷][祈祷][祈祷][祈祷],<谢谢和米米宝>: [祈祷][祈祷][祈祷][祈祷][祈祷][祈祷][祈祷][祈祷][祈祷],<三万英尺雨潇潇>: [祈祷][祈祷][祈祷]保佑别让坏人得逞！,<小朋友和大朋友227>: 南无大悲大悲观世音菩萨保佑[祈祷]求保佑我早日怀上健康小宝宝，阿弥陀佛[祈祷],<暗中窥视>: [祈祷][祈祷][祈祷],<arongzai>: [祈祷][祈祷][祈祷][祈祷][祈祷][祈祷][祈祷][祈祷],<奋奋奋奋>: 求菩萨保佑我腹中胎儿是健康男宝儿女双全，顺利足月出生[祈祷][祈祷][祈祷][祈祷][祈祷][祈祷][祈祷][祈祷][祈祷],<狮子小铁>: [祈祷][祈祷][祈祷],<辣佩普_辣>: [祈祷][祈祷][祈祷][祈祷],<莉莉林>: [祈祷][祈祷][祈祷][祈祷][祈祷][祈祷],<君正傲>: [祈祷][祈祷][祈祷],<21樓滴抹茶童鞋>: [祈祷]救苦救难观世音菩萨,<梦里无花A>: [祈祷][祈祷][祈祷],<是陈晨不是沉沉>: [祈祷][祈祷][祈祷],<娘娘腔调了>: [祈祷]🏻[祈祷]🏻[祈祷]🏻[祈祷]🏻,<嚄__lC_mghjklllllllllll>: [祈祷]🏻[祈祷]🏻[祈祷]🏻,<反正老子最酷呢>: [祈祷]🏻[祈祷]🏻[祈祷]🏻,<嘪姑娘的小火柴_lucky>: [祈祷][祈祷][祈祷],<深圳瑞盛电子>: 阿尼陀佛[祈祷][祈祷][祈祷],<Iamshuangshuang>: [祈祷][祈祷][祈祷],<用户5833869024>: [祈祷][祈祷][祈祷],<半个西瓜半个夏天ha>: 普陀山南海观音[祈祷],<悠乖>: [祈祷][祈祷][祈祷],<Jfcc-A>: [祈祷][祈祷][祈祷]保佑家人身体健康,<吃货暖de妈咪>: [祈祷][祈祷][祈祷],<水果的承诺521>: [祈祷][祈祷][祈祷],<妖娆桃>: [祈祷]🏻[祈祷]🏻,<百间草堂茶业>: [祈祷][祈祷][祈祷][祈祷],<对你-只对你>: [祈祷][祈祷][祈祷]保佑我爷爷健康！！！,<逃离的竹子>: [祈祷][祈祷][祈祷],<咔咔honey>: 明天南无大慈大悲观世音菩萨诞，希望大家勿吃现场刹的海産[祈祷][祈祷][祈祷]。,<LeeVidHehe>: 平安健康[祈祷][祈祷][祈祷],<我是彭土豆>: 大师，明天我生日[挤眼],<Mr20Something>: [祈祷][祈祷][祈祷],<瞿瞿瞿瞿瞿->: [祈祷][祈祷][祈祷],<唯爱76>: [祈祷][祈祷][祈祷],<大颖儿__>: [祈祷][祈祷][祈祷],<细敏LM>: [祈祷][祈祷][祈祷][祈祷][祈祷],<提拉米苏小妮子>: 活得很累，生活不易,<耶为够>: [祈祷][祈祷][祈祷],<Slightlyluxurious>: [祈祷][祈祷][祈祷],<乔甜依蜜>: [祈祷]🏼[祈祷]🏼[祈祷]🏼,<DDY_LL>: [祈祷][祈祷][祈祷],<用户6032789513>: [蜡烛][祈祷][祈祷][祈祷],<大坏蛋和小笨蛋的快乐生活>: [祈祷][祈祷][祈祷],<OeO丶QvQ>: 是不是为我而死的肉,<需榮心>: [祈祷][祈祷][祈祷],<南朋友的男朋友>: [祈祷][祈祷],<红黑白deMOM>: [祈祷][祈祷][祈祷]]
2068795981	和大家玩一下，上联：心静自然涼，大家想一下，下联。[害羞] ​​​	[<風水語錄梁伯銓Newman>: 回复 @silencefairytale :真搞笑[偷笑],<就为人民服务了>: 根据评论，转发数量来对，百事要生发,<樵夫_X>: 凉风渐入心 @風水語錄梁伯銓Newman  [偷乐][偷乐][偷乐]上下联首尾呼应,<听鱼儿飞飞>: 空调wifi爽[doge],<枝巷硕硕>: 浮躁多不安[泪][月亮][月亮],<脚不会酸的柠檬>: 吃多肯定胖[耶],<如果能重来我要选三眼神童>: 车到山前必有路。哈哈哈哈,<kunyii>: 心平乐悠游[可爱],<焦虑叶子>: 回复 @焦虑叶子 :晚辈冒昧，拙对下联：志远天地罡。,<聡頭>: 下联:思绪当然清。横批:泰然自若 @風水語錄梁伯銓Newman,<lily253>: @風水語錄梁伯銓Newman  得失勿看重,<龍俊程>: 回复 @風水語錄梁伯銓Newman :哈哈  大师睡太晚对身体不好哦[月亮],<米小妃>: 好运自然来[偷笑],<風水語錄梁伯銓Newman>: 回复 @龍俊程 :你一定之前受傷了[害羞],<adnamazheng>: 瓜熟必定香[西瓜],<试试这道菜>: 恼羞怒火起，心静自然凉。 @風水語錄梁伯銓Newman,<小粉兔是Ta>: 心静自然凉，不如空调房。[哈哈][哈哈][哈哈],<一纸老虎>: 意烦尤有火[生病][哼][怒],<sd丘比特>: 花落不必慌[哈哈],<励志改变现状的小小张>: 吃嘛嘛都香 @風水語錄梁伯銓Newman,<風水語錄梁伯銓Newman>: 回复 @YO春天 :有创意[害羞],<MMMMM_洁儿>: Wi-Fi不可少[太开心],<试试这道菜>: @風水語錄梁伯銓Newman  对联上联一般是去声收尾。心静自然凉的凉是平声，应该在下联。各位网友，是这样吗？也可能是我记错了……,<Andy-小平>: 回复 @風水語錄梁伯銓Newman :我要最佳评论奖[嘻嘻],<風水語錄梁伯銓Newman>: 回复 @Andy-小平 :給你一个奖，积极參予奖[贊],<Luilui方>: 不是仄起？我文盲了？,<Andy-小平>: 无风不起浪[哈哈]]
2068795981	3月20忌动土，宜祭祀 ​​​	[<夜色YS>: 什么情况啊？急啊[可怜],<车载导航Sir>: 大师，要给吾父立碑，请问那条好？,<整容大师>: 目测蛇被批评宜耐心聆听。。。,<整容大师>: [疑问][疑问][疑问]]
2068795981	2月3忌动土宜清理家居。 ​​​	[<LP_Kaylee>: 提前一个月就开始清理了，一周弄一点现在就不累了~[害羞],<整容大师>: 好的。明天收拾房间。,<卜卜波波>: 明天一定不能再懒了…收拾房间[拳头],<Lu-cy-J>: 明天么？哦，那明天收拾好了[嘻嘻],<王w大d雪x>: 明天收拾房间去，去去霉运]
2068795981	新年运势知多少！新年要想“财运”“好运”事事旺 ，磨人的家居死角小妖精千万别放过！ ​​​	[<_小硕士销售部>: 马上就到年底了又到了大扫除的时候。,<独自闯天涯xueju>: [转发]让家里干干净净的，过一个好年,<逝去的青春逝去的梦无聊小妹>: [微笑]那是不是我也应该动起手来了呢。,<五月花开仅次而已>: 年底大扫除真的是很大的一项工程。,<慧眼识英雄灬youxian>: 这样的大扫除，我也很喜欢的呢,<嬣惬>: @風水語錄梁伯銓Newman  师傅，请问我家西南角刚好是床（头在西脚朝东），东北角是洗手间，想催旺事业（创业）和桃花该怎么做？,<丰胸达人tuxiaochou>: 新年运势知多少！新年要想“财运”“好运”事事旺 ，磨人的家居死角小妖精千万别放过！,<TheOne唯一美饰>: 财位在洗手间[泪],<徐有才5515287850>: @風水語錄梁伯銓Newman  大师十六日运势怎么没有呢,<andy-2004506>: 回复 @風水語錄梁伯銓Newman :[祈祷],<爱你的美好时光>: 回复 @風水語錄梁伯銓Newman :大师昨晚没有发运势，,<cyyangle>: @風水語錄梁伯銓Newman ：师傅16日运程怎么没有呢,<爽朗的天华>: 回复 @風水語錄梁伯銓Newman :师傅早上好。前面楼房过高怎化解[握手][作揖],<七秒记忆小鱼>: 16日生肖运程?,<小河ROYEE>: 16号的运程呢，大师,<鱼饵雨儿>: [鼓掌][鼓掌][鼓掌],<全球珍珠我最圆>: 大扫除和整理房子带来财运[鼓掌],<么么Oolily>: @June--王先生  怪不得我们财运不好,<捕梦器>: 请大师发今天的风水[作揖],<王左移>: 大师 明天的运事怎么没发,<Chafy_>: 老师你好，最近有些事情挺烦恼的，男朋友刚买了车是红色的，本来是好事，可是他妈妈说他1989.7.17出生，属火，买红色车不好，可是车颜色短时间也不能改了…就想问问有什么方法可以避免呢？也可以让他妈妈放心…打扰老师，原谅我贸贸然在这里询问问题，很抱歉…,<風水語錄梁伯銓Newman>: 2016年風水分享[害羞],<嬣惬>: 西南刚好是床，东北是厕所喔,<健康生活谈一谈>: #新年除尘好运来# 为了家人的健康好运，小伙伴们动起来，年末大扫除走起！ ,<萌宝童装批发商行>: 听了老师的话，西南角买了盆水仙放着。  http://t.cn/R4lxmbE,<M-potato_M-noodle>: 大师，如果在澳洲方位还是同您说的一致对吗？不需要南北位兑换是不是？,<谨以此微博纪念我彩妆护肤与日常>: 老师，东北角是指客厅还是整个房子的东北角？,<mlle-souris>: @Milou拔拔,<小幸福08>: 老师，东北位刚好是厕所要怎么办,<喜欢北京的秋>: 请问是每间房的东北角还是整体的？谢谢,<風水語錄梁伯銓Newman>: 回复 @果果的风铃 :是好亊。[强],<转眼是明天>: 您实地指点过具体富贵竹放哪里的，是需要换地方还是在西南再增加？,<果果的风铃>: 老师，如果今年的五黄位是屋子的厕所怎么办？,<umecha>: 我妈这样说我以为开玩笑[笑cry]要勤力打扫才行,<風水語錄梁伯銓Newman>: 回复 @雅玉含香 :一般上神像也会过火，吉祥物，點香，也是有过火的力量，增加吉祥物本身的效力。,<李欣欣AA>: 大师，吉祥物佩戴前为什么要焚香 @風水語錄梁伯銓Newman,<Miss静a_a>: 新年运势知多少！新年要想“财运”“好运”事事旺 ，磨人的家居死角小妖精千万别放过！,<宝贝女O_O>: 我家7角甘乱，看来不能再懒了[思考][思考][思考],<沐沐不怕>: [微笑]谢谢分享,<ChOMG_鑫淼森>: 梁老师，16年的生肖视频没有了么，期待,<YOYO爱贝贝>: 打扫[耶][耶],<Elin琳琳琳琳>: @Jim_jerry  你的房间死角你是不是应该清理,<正式升级兔妈>: @小兔的爹地  我要打扫一下了！,<Q_Q俊杰小芳子>: 看看 @winner-明,<風水語錄梁伯銓Newman>: 請大家转发分享[害羞]]
2068795981	10月17厦门结缘一日遊[害羞]除了南普陀、古浪屿，还有什么景点值得走走？ ​​​	[<白莲77>: 回复 @風水語錄梁伯銓Newman :莆田南少林有点远,<瀦_跑跑_瀦>: 南普陀一定记得去后山，可以鸟瞰厦门大学,<白莲77>: 泉州，古称佛国。开元寺，承天寺，崇福寺。古丝绸之路的源头。 漳州：南靖土楼……,<DJ阿杜福气啦>: 慢慢走，处处是风景。,<_Syreal>: 西堤  白鹭洲  五缘湾  观音山,<-斯沐>: 回复 @風水語錄梁伯銓Newman :那个好像不在厦门的！！大师！！,<LamCauWan>: 曾厝垵有个吉尼斯最大的咖啡厅,<風水語錄梁伯銓Newman>: 回复 @想去看看这世界 :是古村吗？,<熙-熙熙>: 环岛路、曾厝垵、,<袁惠隆Billy>: 最好玩的是厦门那些不知名的巷子，去人多的小餐馆吃点地道的厦门菜，比景区好玩的多得多,<風水語錄梁伯銓Newman>: 浦田南少林，不知远不远？,<小羋鷺>: 是鼓浪屿。 如果爱看海，可以去环岛路溜达溜达,<A_Ada>: 厦大，还有个什么公园,<那么喜欢的人>: 没有了[笑cry][笑cry],<ElaineW23>: 五缘湾，陈嘉庚公园]
2068795981	大家好：对联时间：上联「天下一等人忠考」，下联？ ​​​	[<pokemongo游戏训练师>: 考是否指的父亲？古今上位者服君？,<潘依诺冉>: 天下一等人忠孝，人间最忌淫盗贪,<皮特和西茉的家>: 天下一等人忠孝，世间兩件亊耕读,<風水語錄梁伯銓Newman>: 回复 @_小水蜀黍 :对的[贊][贊][贊],<風水語錄梁伯銓Newman>: 回复 @溪流_27611 :好句,<痘小瑶fighting>: 忠考。。。不明白啥意思～但感觉应该是忠孝然后对仁义。。。地上两件事仁义？！ @風水語錄梁伯銓Newman  阳历1988月3月13日下午15点04分上海出生！求点拨[可怜]最近很迷茫,<凡丫凡的一小水>: 古今两件修德才。根据纪晓岚：一等人忠臣孝子,两件事读书耕田，瞎编的。大师见笑了。,<G咁靚>: 大師你好吖，我本人屬羊1979.11.21老公屬雞1980.9.03，在9月30日有親戚結婚請我們在凌晨3點40分幫安床，請問我們有沒有什麼禁忌呢？謝謝指點,<广东狼之一>: 地上二餐饭养人！,<_______米乐>: 【地上屌丝手不停】,<Carbin-CHAN>: 地上两件事读耕。,<幸運快樂的姑娘>: 世上两个人恩爱。,<剑桥英语Elaine>: 回复 @風水語錄梁伯銓Newman :老师老师,<剑桥英语Elaine>: @Elaine2012宝贝  19860701女，姻缘何时到啊，和19860410能在一起吗？问了好几次了，求大师指点！,<溪流_27611>: 世间万般事随缘 [心][心][心],<剑桥英语Elaine>: 19860701女，姻缘何时到啊,<诗祎0>: @風水語錄梁伯銓Newman  大师，你好，1986，农历3月初6女，早上8.9点，求问姻缘，谢谢大师,<禾风晋华>: 上联：天下一等人忠孝（伯铨） 下联：心间百年梦逍遥（晋华）[干杯],<肥嘟嘟嘅叮叮鐺>: 大師，請問92年女，舊曆9月15號今年嘅事業運係點嘎？求解！[可怜],<帅帅是个好小伙>: 人间万般事奈何，说实话，没看懂忠考………,<李其骏999>: 回复 @小熊座的北辰星 :忠考应该也是一个意思,<赤豆小顔>: 忠考试什么意思啊？,<flower青青>: 尊敬的大师，想问92年…十月十七…女…婚姻如何？,<TIMO蒂默>: 人间一众生皆平。,<螃蟹腿儿儿儿>: 大师 点我几句吧 拜托了[作揖]男86年六月十四 女88年十月初四 适合结婚吗,<_-吴奕煌>: 尘世聪明人清闲[羞羞哒甜馨],<财财m>: @風水語錄梁伯銓Newman  大师，我儿子93年11月28日生，9月分有个重要考试能考过吗？,<YyM墨>: 大师，90、9月16。事业，拜托了。,<夏小洛飞>: 地下九流鬼轮回！[哈哈],<shdjckdksbejkdoejebebx>: 回复 @風水語錄梁伯銓Newman :您说的对,<風水語錄梁伯銓Newman>: 回复 @Amy李鑫 :你是否容易招小人[擠眼],<睿智沉香>: 不会对子啊[吃惊]。。不过，想问大师，71年六月初八，求婚姻和事业如何,<财财m>: 人间一群人忙考 @風水語錄梁伯銓Newman  地上一群人忙等,<風水語錄梁伯銓Newman>: 回复 @陶来cheerup :哈哈[微笑],<Juuiicy>: 天上众神哈哈笑[笑cry][偷笑][哈哈],<ADALI-zhu>: 地上一众人对联。[嘻嘻],<grace爱kitty>: 海里万条鱼奔跑 @風水語錄梁伯銓Newman,<弟子佛佑>: 天上众神仙看戏。,<Encore颖儿>: 回复 @風水語錄梁伯銓Newman :那大师帮我看下我的吧 1989年7月29日 16:55分 女 谢谢啦,<我叫宁心宜>: 地上下等人苦耕。,<風水語錄梁伯銓Newman>: 回复 @幸福的李小妹 :很幽默[擠眼],<幸福的李小妹>: 地上一类人照抄！,<南朋友的男朋友>: 地上一伙人烧烤[挖鼻],<春天的黄昏樱花的山下>: 地下。。。。不会啊[鱼],<風水語錄梁伯銓Newman>: 回复 @Encore颖儿 :[强]多谢支持，第一个回应[擠眼],<Encore颖儿>: 地下一家人思考[脸红]我乱编的]
2068795981	互动改明天晚上，今天晚上很累，不好意思，见谅。 ​​​	[<羊咩咩咩羊杨>: 要注意休息[可爱][可爱],<一粒儿汤圆>: 注意身体啊大师[心][心][心],<西瓜皮没有西瓜皮>: 注意身体大师，祝好梦,<monicaTong>: 请好好休息，保重身体,<暖暖_啊_>: 大师辛苦了 注意休息,<-Ajondr>: 好好休息。[太开心],<瑶老师>: 大师，身体重要～早点休息,<Amor爱犯懒>: 大师好好休息[强壮],<zengyuan>: 幸苦了 晚安好梦,<皇城大妞>: 大师您要注意身体啊,<缡黯格睚倪>: 注意身体，早些休息，好梦。,<小绵羊_zeta>: 早点休息[月亮],<Just-PPPPPPandTTTTTT>: 大师，好好休息～,<ItsCcchen>: 大师 早点休息 养足精神,<Annisy王>: [睡觉][睡觉][睡觉][睡觉]]
2068795981	七夕禮盒僅限量結緣至8/16中午12:00[微笑] ​​​	[<我是蛇精病啊蛇精病>: 大师，92年阴历8月25，属猴的，女，想问大师，请什么可以求姻缘啊，谢谢大师！,<梁伯铨吉祥轩>: 回复 @Jovey_chen :不會喔,<梁伯铨吉祥轩>: 回复 @Jovey_chen :鏈接： http://t.cn/RL3Ap7u,<赤豆小顔>: 梁师傅 请问小号玉如意还会上架吗？,<鬼脚吾>: [爱你]想请问大师，男94年5月4日属狗，想带个手链或是挂链，为增加事业，买怎样的合适呢？[祈祷]后天会去玉佛寺不知道能不能遇到老师[害羞]]
