2243807243	你喜欢天空的颜色吗？打开这幅图，全屏，慢慢往下拉，带给你一天美好的心情！ ​​​	[<Miss_Z晨>: 回复 @核桃小瓤 :好美，么么,<丶Lin漓>: 回复 @Aahhi_ :厉害了。高冷慧[doge],<简dx欢颜>: 回复 @向前跑UPUP :想找，但没机会,<向前跑UPUP>: 回复 @简dx欢颜 :你不找暑假工了吗,<简dx欢颜>: 回复 @向前跑UPUP :哈哈哈[嘻嘻][允悲][允悲],<向前跑UPUP>: 回复 @简dx欢颜 :好的，同事咸鱼[doge],<不听不听嗷>: 哦？没有鬼脸和张翰吗？我不信[允悲],<一只很聪明的杨静静>: 回复 @Shakirrr :巧了巧了巧了,<简dx欢颜>: 回复 @向前跑UPUP :无聊，无聊，已经是咸鱼了,<UncleLi-->: 回复 @UncleLi-- :哈哈哈,<浪浪-WOW>: @去趟海边怎么样  🤓,<中了巴卫的毒>: 回复 @UncleLi-- :我手机拿得挺远往下滑，划了五分之一又点出来看评论确实没有什么可怕的东西再点进去划完了[污],<狗蛋如花>: 回复 @Faerie5w :哈哈哈我从下网上看的 好美,<刘振杰啊>: 回复 @木木yamu :真的很美,<王尔山>: 回复 @手机用户68542420 :[笑cry][笑cry][笑cry][笑cry][笑cry],<向前跑UPUP>: 回复 @简dx欢颜 :[可爱]这几天过的怎么样啊,<YAnnic_M>: 回复 @用户5958366801 :对自己失望的感觉想把自己乱枪射死,<用户5958366801>: @YAnnic_M,<法兰西7>: 回复 @唐不苦Anne :哇塞,<liuweida_with_treatment>: 回复 @Crazy齐小静要长高 :美,<莎菲娜只有我才懂得你珍贵>: 回复 @张小璐子乖乖 :希望在你的眼睛里也能看到天空的颜色  http://t.cn/RKM0Gqj,<姑娘加油L>: 回复 @咚咚冬冬DONG :哦,<咚咚冬冬DONG>: 回复 @姑娘加油L :没东西  我让旁边的人看完了 哈哈哈,<灌汤包46686>: 回复 @John4444444 :[心]看[心]黃[心]片+猬信:DGD318～～～～～～～劲爆～～～～～～～～～～～～～～～～～～～～～～～～～～～～～～～～～～～～～～～啦啦啦啦啦啦啦啦啦啦啦啦啦啦啦啦啦啦啦啦啦啦啦啦啦啦啦啦啦啦啦啦啦啦啦啦啦啦啦啦啦啦啦啦啦啦啦啦啦啦啦啦啦啦啦啦啦啦w,<姑娘加油L>: 回复 @咚咚冬冬DONG :不看是对的，千万别看，太可怕了,<咚咚冬冬DONG>: 回复 @姑娘加油L :翻一点点我就没看了。,<姑娘加油L>: 回复 @咚咚冬冬DONG :千万千万别看，我吓死了都！你下次不要给我看这种！！！我是真的真的真的害怕！,<马小茉oct>: 回复 @小健______ :好看,<张小璐子乖乖>: @莎菲娜只有我才懂得你珍贵  觉得你可能看过,<时位之移人也>: 回复 @吾玉清欢 :其实拉到黑色的时候我心里也在犹豫[允悲],<小眼睛win>: 回复 @环游宇舟 :[笑cry][笑cry][笑cry]没找到晓慧,<隔壁家廖叔叔>: 回复 @燕子咿呀哟 :先看嘛,<沉鱼落雁黄美女>: 脑洞大不大？  http://t.cn/RKMbF6x,<9395李莫愁fowl>: 回复 @鄧阿豪Cookie :[心]看[心]黃[心]片+猬信:LML3318～～～～～～～劲爆～～～～～～～～～～～～～～～～～～～～～～～～～～～～～～～～～～～～～～～啦啦啦啦啦啦啦啦啦啦啦啦啦啦啦啦啦啦啦啦啦啦啦啦啦啦啦啦啦啦啦啦啦啦啦啦啦啦啦啦啦啦啦啦啦啦啦啦啦啦啦啦啦啦啦啦啦啦o,<橘冉橙>: 回复 @Tomboy丶J :[可爱],<满级养乐多>: 回复 @Seo_Un_Yong :[允悲][允悲][允悲],<Estrus51185>: 回复 @孤芳自赏200101 :特别美,<Tomboy丶J>: 回复 @橘冉橙 :[太阳],<天天天兰crystal>: 想起昆明的天空了，从清晨到夜幕，喜欢,<爱神皮卡丘999>: 回复 @米兔-依 :我喜欢和你一起看天空的颜色,<用户6208705125>: 回复 @鄧阿豪Cookie :[心]看[心]黃[心]片+猬信:DGD318～～～～～～～劲爆～～～～～～～～～～～～～～～～～～～～～～～～～～～～～～～～～～～～～～～啦啦啦啦啦啦啦啦啦啦啦啦啦啦啦啦啦啦啦啦啦啦啦啦啦啦啦啦啦啦啦啦啦啦啦啦啦啦啦啦啦啦啦啦啦啦啦啦啦啦啦啦啦啦啦啦啦啦v,<innilmf_>: 回复 @llesleyyy :会有人陪你去看滴,<你名字_我心事>: 回复 @不见秋冬 :哈哈哈哈哈哈哈哈哈哈[doge],<吾玉清欢>: 回复 @时位之移人也 :哈哈哈本来挺好的图 底下评论[允悲],<Aahhi_>: 回复 @丶Lin漓 :图片评论  http://t.cn/RKIFf88,<不见秋冬>: 回复 @你名字_我心事 :你大爷，我还没反应过来，你自己 @自己 [doge],<哥哥-brother>: 回复 @GNAIQOAHZ-936 :嘿嘿,<杨诗娴儿>: 回复 @zluangxli :眯着眼睛看到最后结果啥也没有[doge]开始套路我了,<JYGOODONEFOX>: 难道只有我一人直接从头滑倒底,<黄敏杰是傻瓜>: 滑着滑着，想到之前看到的套路，赶紧来看评论，看有没有吓人的东西出现,<智境冥一cri>: 回复 @i七七七七七 :我把手机离得远远的！怕吓着！,<Shakirrr>: 回复 @Yeti喂 :[doge],<Shakirrr>: 回复 @一只很聪明的杨静静 :[doge][doge][doge]emmmmmm,<丶Lin漓>: 回复 @Aahhi_ :斗图啊。[喵喵],<Sue苏晓晓>: 第一次看见这图是初一，现在我高考完了,<石榴味的>: 回复 @_槟榔配烟 :是啊,<_槟榔配烟>: 回复 @石榴味的 :夜班？]
2243807243	你们知道这些神奇的建筑是在哪里吗？[并不简单] ​​​	[<朕就是来找你说说话>: 回复 @TakeApieceOfmyheart :好像是这么个道理[並不簡單],<闫瑜萌萌哒>: 回复 @爆炸头 :你这梗我不太懂啊,<富贵XU>: 第二个是我家这里,<TakeApieceOfmyheart>: 回复 @朕就是来找你说说话 :也亏得早些年修的，要现在造的估计早塌了[小黄人惊讶],<老衲不逃禅了>: 图一安徽小孤山，图二是鄂州龙蟠矶观音阁，图三是福州江心岛，图四是永州香零山，图五是西藏孜珠寺，图六是江西东华山，图七是浙江石门洞，图八是兴义万佛寺洞，图九是河北东五指山。// @这里是美国 : [并不简单],<朕就是来找你说说话>: 这些建筑的亏是早些年修的，不然哪一个不被违章建筑[笑cry],<爆炸头>: 回复 @闫瑜萌萌哒 :你说呢[喵喵],<闫瑜萌萌哒>: 回复 @爆炸头 :？？头文字d,<空名堂>: 不能便宜了开发商！支持钉子户！,<1lllllllllm>: 最后一张莫高窟？[喵喵],<TinaandMM>: 第三张好像是大理小普陀,<南城知微>: 图八贵州兴义万佛寺,<Bingo胡兵>: 图② 我的家乡鄂州 观音阁,<GGGGGGGGGGGGdrgon>: 第八张 贵州省兴义市 万峰林 万佛寺,<豆子哲学dovein>: 神奇的建筑当然要在奇葩的国家，因为奇怪的现象和奇怪的人造就了这一切。,<可是很喜欢啊>: 第五张在西藏我也不知道为什么知道【装傻,<爆炸头>: 昨晚，我在秋名山输给了一辆AE86，他用惯性漂移过弯，他的车很快，而且会利用排水渠加速，我没有看清车牌，只看到有个豆腐店的招牌； 如果你们有认识的话，麻烦跟他家人说一下，他车掉排水渠里了。  http://t.cn/RVTJKgK,<一个掉了21斤肉的小仙女>: 我不管，就是中国]
2243807243	对未来的真正慷慨，是把一切献给现在。 ------加缪 ​​​	[<曦子耶>: 可能是我提醒的吧,<Nana_______________>: 我们总是喜欢拿“顺其自然”来敷衍人生道路上的荆棘坎坷，却很少承认，真正的顺其自然，其实是竭尽所能之后的不强求，而非两手一摊的不作为。 ​,<失踪小星星>: 想现在就把这些水果都吃了。现在！,<影视会员8元无限流量包月30元呢>: 回复 @邓大秀 :🍨[冰淇凌],<刘海不会长>: @小小文文文文文文文文,<疯狂生长的树>: 刚看完加缪的局外人,<静时光的巡礼>: 回复 @NoChiying :这图真好，求无水印版~,<伟大的泰勒>: 对现女友的真正慷慨，是没把一切献给前女友。 ------泰勒,<歐杨Ooy>: 过好当下[握手],<思逸思逸思逸>: 回复 @思逸思逸思逸 :今天所有的努力所有的奋斗，都是为了拥有一个美好的未来！,<思逸思逸思逸>: 回复 @思逸思逸思逸 :今天永远是你此生最年轻的一天！,<思逸思逸思逸>: 珍惜今天，活在当下……,<我是随喜呀>: 看这图片想起天使爱美丽里面的蔬果店,<HDzzzzz>: 那我真的是吝啬了,<NoChiying>: 活在当下[月亮]  http://t.cn/RK5wvXq,<白鸡万岁>: 这是叫我们去透支未来？[doge][doge][doge],<Jia婕西>: 看什么吧。感情于我，过去是那么慷慨，才让现在如此贫瘠。,<村头的布朗师傅>: 回复 @边走边啃腌生姜 :有freestyle么？,<变成树的梦想>: 人无论在何时何地都不属于自己，只有此时此刻此地。,<不敢用拍呢儿>: 第一反应也是，好与坏两小无猜[允悲],<-IAMMI>: 献给现在[月亮],<廓十一子>: 晚安，这里是中国。,<楊可欣__>: 趁着年轻还有力 好好努力争口气 [强壮]🏼[强壮]🏼[强壮]🏼,<美国英国澳洲论文essay代写>: 对未来的真正慷慨，是把一切献给现在。 ------加缪 ​​​​,<我有一箱大麻>: 回复 @边走边啃腌生姜 :哈哈哈哈哈哈哈哈哈哈哈哈哈哈哈哈哈哈哈哈哈,<邓大秀>: 打开图，只有我眼馋那些水果吗,<las_estrellas18>: 回复 @边走边啃腌生姜 :听懂了生命的告白[喵喵],<iBellaaaa>: 莫名地感觉这句话说的很有道理。,<Patriciamlau>: @我是袁安妮  体评论 我第一反应都系谢童哈哈哈,<番茄加两个蛋L>: 我印象里的加缪不像会说这句话的[允悲][允悲][允悲],<陳皮Jaydan>: 我把時間獻給RMB[攤手],<苒苒知春晓>: 做自己最嗨[允悲],<月轮林岫>: 这满目琳琅，正是好时光[哆啦A梦微笑][哆啦A梦美味],<imagine________>: 回复 @边走边啃腌生姜 :不回头走向未来[允悲],<我坐在角落o>: 珍惜所拥有的[心],<clockZPL>: 对现在的真正慷慨，是把一切留给未来[二哈],<华君summer>: 好好把握现在，并全力以赴，做得超出命运的期待，才能拥有更好的明天，即使没有，也无怨无悔。[爱心]️,<善良的片子>: 在厨房发现了一只蚂蚁，我在它面前放了块糖，它碰了碰，跑回家叫同伴了。我迅速的藏起了这块糖，因为我想让它朋友觉得他是骗子。,<边走边啃腌生姜>: 好与坏两小无猜。[笑cry],<BXKLKKLKXB>: 生活不易 珍惜珍惜,<文豪L>: 我们总是喜欢拿“顺其自然”来敷衍人生道路上的荆棘坎坷，却很少承认，真正的顺其自然，其实是竭尽所能之后的不强求，而非两手一摊的不作为。 ​,<随手解救单身汪>: 配图有点……嗯，不太搭配[污]]
2243807243	迪士尼乐园里唐老鸭看到一群鸭子后。。。太可爱了[心] ​​​	[<局限部队>: 米老鼠怎么没看到一群老鼠,<萬幸阿>: @蔡先森的_  Oh~so cute,<-立夏呀>: 回复 @elainehatesyou :我的业务扩张了吗,<Baudelaire_>: 回复 @七海爱丁堡只有三百人 :你看到得太晚了[喵喵],<大大大大君哥>: @MargueriteAndMia,<大琳二>: 看到了失散多年的亲兄弟,<C__H_E_N_>: 回复 @viciituy :好啊,<因为是口口敏啊>: @宇宙无敌可爱口口敏,<Pan_Flute_Syrinx>: 怎么会那么可爱！！[花痴],<陈大宝之友>: 回复 @Pritzer :“我找到家人啦”,<七海爱丁堡只有三百人>: 回复 @Baudelaire_ :今天终于看到了[二哈][二哈][二哈],<猫懒猫懒猫懒猫>: 回复 @垚垚土土土土土土垚垚 :哈哈哈哈哈哈哈,<诸葛赵钧>: 回复 @ShirleyTiann :[鼓掌][鼓掌][爱你],<LIWE1HaN>: @张大愚  是你叫的鸭吗,<sssubida>: 前几张一直还好，最后一张萌的我一脸血,<大仙仙要去海边>: 最后一张太可爱了,<MCALLIN韩玚>: @_Elsa--,<失语者Maker>: @画梦人Dreamer,<不太正经的柿叔_>: 最后一张是在指着井盖说：它们掉下去了 吗？[笑cry],<viciituy>: @C__H_E_N_  去迪士尼吧,<一碗不加蛋的方便面>: 回复 @吴记麻辣油哦 :可爱[抱抱],<JoeHawken>: 回复 @纪盛开1895 :宝贝最可爱😗,<纪盛开1895>: 回复 @JoeHawken :你也好可爱嘻嘻,<JoeHawken>: @纪盛开1895  唐老鸭好可爱嘻嘻,<ShirleyTiann>: @诸葛赵钧  [爱你],<Baudelaire_>: @七海爱丁堡只有三百人,<卷卷lol>: 回复 @跟我回火星Oo :对不起，我很潮，从不用过期老梗,<香喷喷的小薯条>: @香喷喷的小火鸡_,<sweet露孜>: 回复 @猪奸奸 :可爱ớ ₃ờ,<蛋卷不二君>: @桐一天下1314,<隐园溪言>: 演员很给力，可是为什么小鸭子不认识他们家唐老鸭爷爷呢[可怜],<likchin>: 回复 @梨_Lee :点解会有一群🦆🦆🦆[小黄人得意 ][小黄人得意 ],<qwertyuuiopasd>: 不要炒好几次冷饭,<喜滋滋Milkee>: 最后一张嘴巴怎么张开的！,<一摞鸡蛋饼>: 回复 @我叫天然懒 :[兔子][兔子][兔子],<Atherapist>: @葛大大turbo,<心里有死结>: 回复 @糖死结yoyyyyy :你才能去 唉 我去不了,<TML-B>: @这是要去哪里呢,<甲乙丙丁戊己庚辛壬癸丶>: @Penny_啦啦啦啦啦啦,<刘小路oh>: 回复 @青春后期小新 :你什么时候带我看唐老鸭呀,<勤通风多喝水>: 后面的布鲁托在干嘛,<糖死结yoyyyyy>: @心里有死结   好萌,<嗒la>: @名字其实并无所谓,<宜嘉发糖甜出脑洞>: 萌萌哒[小黄人得意][小黄人得意],<乞丐熊FAN>: [哈哈][哈哈][哈哈],<ZSourSandy>: 啊啊啊啊啊啊啊啊最后一张咋嫩可爱？？！！！！！！！！,<可惜他爱吃香芋_>: @捌幺零  哈哈哈哈哈哈哈,<小背带裤鸡>: @中可爱圆圆鸡  我的嘎,<猪奸奸>: @sweet露孜,<成倩影>: 唐老鸭[好喜欢],<小澜不淆寒>: 回复 @一Blacksheep一 :可爱！,<-Piercing>: @王正經經   @童话63239   @野比夏Natsu,<啊喵喵喵喵喵唔>: 回复 @DNA-赵麒 :嘴居然能张这么大[偷笑][偷笑],<大桃子Elina>: @大头鞋哈哈  [笑哈哈][笑哈哈][笑哈哈],<绛珠儿->: 回复 @Benny19981002 :好可爱啊,<DNA-赵麒>: @啊喵喵喵喵喵唔  我的宝宝,<董源D>: 回复 @玛腻- :为什么那天没看到[悲伤]]
2243807243	你不能把这个世界，让给你所鄙视的人。——安·兰德《源泉》 ​​​	[<昌振->: 回复 @大萱萱子 :感激不尽,<ELYar-220>: 回复 @米崽123 :呢种垃圾更废[摊手],<米崽123>: 回复 @ELYar-220 :屎黏在地上 飞不起来,<Hermia_吵吵>: 不好意思我在另一个世界,<Cranberries_Dreams>: 你不能把这个世界，让给你所鄙视的人,<imp_mtd>: @JUDDDDITH,<岳一溪>: 安.兰德的意思是，我们有责任让这世界美好，而不是让那些邪恶、无德之人把这世界搞得乱糟糟。,<兔哥等你来拍拍_>: 一男晚上想去和兄弟们一起喝酒，于是打电话给她媳妇： 男：媳妇儿我今天晚上晚点回去，去喝酒 媳妇：哎呀！不行，老公，我怕黑嘛！ 男：黑，有什么好怕的，它只是一种颜色 媳妇：那你怕绿吗？ 男：好，五分钟后到家 [嘻嘻],<大萱萱子>: 回复 @昌振- :哈伯·李《杀死一只知更鸟》,<乔乔乔乔安>: @LIKE-a-Gsix  嗯,<昌振->: 回复 @大萱萱子 :很想知道这句话出自哪里,<昌振->: 这句话真的很尴尬，典型的鸡汤[摊手],<123456李冠华>: @热心市民李女士__,<夏恩Jane>: 很多时候的退让是因为看不下去，反感是第一要素。,<hailey1008>: 我要成为我鄙视的人，然后把世界抢过来,<SESCC>: 所以要努力……再累也要努力,<剪刀手唐小唐>: 以后这些话都是反话了。小编悠着点儿。,<时间啊走得太快了>: 哪有那么自大，还世界。你看得到世界吗,<ELYar-220>: 回复 @灵机小不点 :没错[月亮][月亮],<用户5538090890>: 回复 @尼克小姐 :联合起来打,<-胖头陀->: 照片明显是意大利,<中惠化纤家纺huiyumengdie1968>: 你把这个世界看成你的，它就是你的，整个世界都在你眼中，你所有的生活就是你整个的世界。[嘻嘻],<鸣鸣鸣QAQ>: 第一眼看成了……你能不能把这个世界，让给你所鄙视的人[允悲][允悲],<奔波儿灞与穿靴子的猫>: 你不能把这个世界，让给。。。等等，我什么时候拥有过这个世界？[doge],<隔着太多太远太长久>: 回复 @鹊鸦 :你 反省,<假善亽>: 阿特拉斯斗地主[二哈],<灵机小不点>: 回复 @ELYar-220 :风口上，猪也能飞起来。[喵喵][喵喵][月亮][月亮],<马周扬律师>: 假设这世界你也挺鄙视，那还是留给那些你鄙视的人吧[允悲],<灵机小不点>: 回复 @鹊鸦 :为什么被卖片的盯上了[喵喵],<張醫生許願要幸福>: 晚安[心]新的一天 继续努力加油吧[太阳][太阳][太阳],<ELYar-220>: 今天学了一句犹太人的名言,风大的时候垃圾飞的最高,<大萱萱子>: 我想让你见识一下什么是真正的勇敢，而不要错误地认为一个人手握枪支就是勇敢 ，勇敢是：当你还未开始就已知道自己会输，可你依然要去做，而且无论如何都要把它坚持到底，你很少能赢，但有时也会。,<尼克小姐>: 可是打不过啊，怎么破,<鹊鸦>: 因为我们活着 有血有肉 就不能假装什么都糊涂 假装什么都瞑目,<唠仔信了你的鞋>: 你不能把你的价值观，强加给世界上所有人——其他人]
2243807243	销售飞盘的广告语是“所有狗狗的最爱！”结果，买回来之后...... ​​​	[<陈听说Rockstar>: 回复 @女孩放开那个禽兽- :哈哈哈哈哈哈笑你去死天天就笑死哦,<女孩放开那个禽兽->: 笑死哦这个狗子 @罗加薪-    @陈听说Rockstar,<恕臣不能宽衣解带>: 别以为你渴望 我们就渴望,<大力_厚天救援>: 此狗不食狗间烟火～,<上海哈密1330>: @Aryamaegi92,<洛小沫QQQQ>: 我家的狗！！！就是这样的[眼泪] 好心累 @阿利斯科肯林,<Kenshinsyrup>: 回复 @煤球哥今天还没更新 :[汗][汗][汗],<人怒狂能无>: @阿_才奇   狗狗:？？？？？,<lokmnvfxd>: @Huanniinthesky,<浮生胡乱记>: @SOBER周周  大傻狗,<ZebulonPong>: 一条傻狗，杀了吧,<雪莉1911>: 回复 @等不到天黑-- :[允悲][允悲][允悲][允悲][允悲],<解个内衣扣>: 每次说什么最爱 结果买回来，，，大部分都没用。应该是店主最爱,<会说话的简度>: 你再丢我上去一口咬死你,<starriver88>: 回复 @陈窘怡 :[摊手][摊手][摊手][摊手],<爸爸的嗲嗲>: @Helen不修图,<Mingchenaaa>: 回复 @一只少女壮士 :哈哈哈哈哈哈哈哈,<一个危险的知识分子>: @赵琪琪有一个流浪梦,<aaalliaYU>: 噗哈哈哈哈哈哈哈哈哈哈哈哈哈哈哈哈哈哈哈哈哈哈哈哈哈哈哈哈哈 @Choccy-池   @雷雷打雷,<wyr呢>: 回复 @等不到天黑-- :第一条评论哈哈哈,<Jessie糖橙>: 回复 @等不到天黑-- :尬死[并不简单],<易斯瑋Carol>: @南半球的帝企鹅,<等不到天黑-->: 哈哈哈？ @雪莉1911   @wyr呢   @Jessie糖橙,<吳艳玲v->: 回复 @魍惘誷 :跟你一样,<魍惘誷>: 回复 @吳艳玲v- :那狗一脸无奈,<STARSHENGIRL>: 回复 @还是很腻害的 :哈哈哈哈 你的表情包太丰富了 笑死,<把书翻到第十页>: 回复 @娃哈哈的漂流之旅 :就知道吃！！,<昱子winnie日本小跑腿>: 回复 @miiiyukiiiii :啊哈哈哈哈哈！空盘子,<娃哈哈的漂流之旅>: 回复 @把书翻到第十页 :还不如买个火腿肠呢,<tangerinetree>: @kaleidoscopeye,<谭彦博>: 胡锡进可能会喜欢,<卓珊爱生活>: @霸气侧漏后空翻,<blueeooooo>: 回复 @Continuewalking :嗯，这就是我的真实写照[笑cry],<爱喝豆奶的小国王>: 回复 @中老年妇女之友嘻嘻 :哈哈哈哈哈哈哈[亲亲][亲亲][亲亲][亲亲],<阿阿阿阿阿嘟>: @張雪琪-   @张小哇呢   @美玉有點_High,<陈窘怡>: @starriver88   吴若兰接!,<东i吾>: 回复 @你好Amber- :对吃的感兴趣,<我叫ltc>: 回复 @Emma是鳗鱼啊 :好玩好玩[污][污],<Continuewalking>: @blueeooooo  狗：愚蠢的人类,<淘气鬼0071263>: 我家狗也是对这些东西没兴趣,<Emma是鳗鱼啊>: 回复 @我叫ltc :哈哈哈哈好玩不,<d_y_Achilles>: 回复 @豌良 :狗子一脸冷漠,<小马过河2411>: 回复 @不系之喌 :[微笑][微笑][微笑]是的,<吳艳玲v->: @魍惘誷   喜欢吗？？？,<大姚子George>: 回复 @FUJIAYING_ :看破红尘,<桃C7>: @WalkingTi,<Frank二世0>: 金毛一般不太喜欢飞盘 边牧试试 大多数会追着你扔,<贱宝片>: 回复 @笑点泪点双低的琪酱 :哈哈哈哈,<柳北陳冠希edc>: 回复 @-Babewang :喜欢球,<Mars_飞飞>: 回复 @CHETCHEN77 :[二哈][二哈][二哈][二哈][二哈][二哈],<你好Amber->: 回复 @东i吾 :你会感兴趣吗🤔🤔,<猫与小河>: @鲨鱼吃小鱼217,<CHETCHEN77>: 回复 @Mars_飞飞 :只要不跟你是个臭臭我就心满意足了,<Mars_飞飞>: 回复 @CHETCHEN77 :儿子肯定和我好，我智商高[酷],<成年以来一直睡不够zzz>: @薄荷色草地像风没有形状]
2243807243	rap演唱会上的手语师…… ​​​​运动量非常大了[允悲] ​​​	[<-Hsiaying>: 回复 @刘嘉婷咯咪 :居然还有手语师....,<拉拉拉姆塞_Ars>: 回复 @prettylittledump :噗嗤,<張爱琳_>: @MENgDuu   @范百功,<JUSTL1KE>: kkkkkkkkkkkkkk[允悲][允悲][允悲],<greensps>: 对老师的业务佩服得五体投地。,<SleepOntheFloor>: @赵onlyBlue,<Shirley懒得换名字>: @蒂伯巴赫村的孩子们,<iluvallison>: 回复 @土屬Phiallip :仲有其他呢,<吉吉GINA>: @这样就很尴尬了Evan  [喵喵],<高阳许少>: 回复 @朱砚卓同学你今天开心吗 :High翻天,<朱砚卓同学你今天开心吗>: @高阳许少   [doge][doge][doge],<Mora瘦瘦瘦>: @ElfIsFabulous,<M_Delphia>: 回复 @HyctmALY :尬舞。。。[眼泪][眼泪],<TonySkkky>: 回复 @claireeednz :感觉手要断 哈哈哈,<刘嘉婷咯咪>: @-Hsiaying,<DinnngYIIh>: 回复 @a悲伤博主 :哈哈哈哈哈哈,<浔渊>: @LJYYYYYYYYi    @舒程一一,<prettylittledump>: @拉拉拉姆塞_Ars  哈哈哈哈,<victorzhang->: 回复 @徐九七 :终极快哈哈哈哈,<仲缇>: @bbbartra,<今天的焚化炉温度适中>: @另一个非常非常好的人,<马启帆-TKD>: 又长又宽又大又圆怎么表示,<褚梓君yo>: 回复 @H_Ty_xin :哈哈哈哈哈哈哈哈哈哈！！！！,<My_Bro>: 回复 @像只仓鼠一样 :[good][good][good],<cococoma_>: @水来水去  啊哈哈哈哈,<囧囧公举>: 回复 @不一定一个人转世界的囧先森 :累够呛,<炒鸡一>: @一朵小野俊  手酸,<路其其>: @zero_嘚瑟   @一段话的段,<路其其>: @我不管反正我我最酷  [允悲][允悲][允悲],<玛丽酱酱酱>: 回复 @KLORIA- :特减肥,<吴建宝宝历险记>: @YyzZllLiu,<雯lwy>: @_Cheesef,<Steph阿弛_>: @Jamie__Liu,<V3V_toria>: 回复 @BunnyClau :我觉得她得拿至少双倍工资[眼泪],<ABCDyrus>: @刘十烨和纪舒婷一起kaizen啊,<Jo_Ji_X>: 演出结束 两只胳膊废了[笑cry],<凌晨三点在下雨>: 回复 @是梦阿Rr :好减肥,<小黄鱼手工坊>: 累死宝宝了哈哈哈,<国华的爸爸->: 回复 @你唔知有个国华姓黄乜- :[污][污],<你唔知有个国华姓黄乜->: 回复 @国华的爸爸- :🙃我没那么骚,<MilkLicoJ>: 来一个freestyle的手语版  @jasbone骨头   @梁琦棉就是梁馨文   @苏半夏sophie   @Lby要好好努力   @刘灏瀚_,<国华的爸爸->: 回复 @你唔知有个国华姓黄乜- :是你的[污],<Allthingsgo>: @Lfcccccc  哈哈哈,<你唔知有个国华姓黄乜->: 回复 @国华的爸爸- :这是你的freestyle？🙊,<鸢小青>: 回复 @今天的焚化炉温度适中 :[眼泪],<TokenHolic>: 回复 @猪蹄老爷 :让唱rap的边唱边打手语岂不是更酷炫,<Phoebe--CHU>: @SunYEE_  [笑cry],<段人和>: @段明峰Shaarswy,<hexa河虾>: 回复 @御手洗洁的狗 :hhhh很Rap了,<夏_Summer_D>: @刘小天儿isMe  哈哈哈哈哈哈哈、刘老师！手语rap来一首,<少帮主的小迷妹>: @正在长胖的瘦子东,<天籁和风>: rapper:我想来段freestyle[doge],<claireeednz>: @TonySkkky,<a悲伤博主>: @DinnngYIIh]
