2243807243	外国一位网友穿上恐龙服逗狗[doge]狗：这别是个傻子吧！[doge] ​​​	[<给我玩去_>: 回复 @luna在哪里 :妈蛋 智障[二哈],<长长的小胡须>: 恐龙：我给你盖被子你感动吗？狗：不敢动不敢动。,<SOONGKI小窝>: 回复 @飞禽I走兽 :哈哈、狗狗的表情太可爱了[嘻嘻],<标配烤冷面>: 回复 @司兆范的丁丁猫 :我还改名了,<河豚烧板栗>: 回复 @hu嗝 :[二哈][二哈][二哈]小心我打你哦,<双南大街>: @小白白的故事i,<加肉不加价>: 狗生怀疑哈哈哈哈哈哈 我要笑死了,<小铭是个好青年>: 回复 @Kalorcy :人都吓死了，还打啥啊！你来吗[馋嘴],<hungdaidai>: 回复 @LSH_lsh :[哈哈][哈哈][哈哈][可憐],<troonax>: 宠物为了讨好主子很用心呢,<_AMillie_>: 回复 @ZZZHEEEE :[允悲][允悲][允悲][允悲]我的神,<ZZZHEEEE>: @_AMillie_,<_Rebecca_nan>: 回复 @美的空气净化器 :哈哈哈哈哈,<Zoey-xjl>: 回复 @你好我是骆胖胖 :哈哈哈哈哈哈哈哈哈。。。狗狗吓懵b了[笑cry][笑cry][笑cry][笑cry],<silent4good>: @-Bliss-,<DL喃喃的嘟嘟>: 回复 @滨是灿滨的滨 :哈哈哈哈哈哈哈哈哈，恐龙看起来好蠢萌哦，[眼泪]狗狗的表情满满的亮点，啊啊啊啊啊啊啊，好可爱啊[噢耶]，最后一张好像表情包[二哈]一大早笑成了傻子[小黄人高兴],<司兆范的丁丁猫>: 回复 @标配烤冷面 :呦呦呦 换手机了,<518512腊肠哈哈>: @DorisL灬  [喵喵][喵喵],<额上似能跑马>: 回复 @张有汉 :哈哈哈哈 图二那个恐龙 还是个喇叭裤[眼泪],<筒子_exozzang>: 吗的笑死我了 @AVivipara-,<有一个猫一个狗>: @FANFAN的小生活-,<__cyAndcy__>: @zzzzz赵欣曈,<Geiyi->: 哈哈哈哈哈哈哈哈哈太可爱了哈哈哈哈哈哈哈,<丶小天才>: 回复 @明-朱元璋 :沃日你屋客吸头儿，骗我[泪],<矿一一>: 我一个人傻笑了好久,<矿一一>: @LIAODAJIN_    @Tee漂泊在外无处安放,<滨是灿滨的滨>: @DL喃喃的嘟嘟,<PetoNg>: 回复 @咸鱼萝卜榨菜干 :居然不怕,<LvanLau>: @王特豆   哈哈哈哈哈图六,<花年年年念>: 回复 @子子木南 :哈哈哈哈哈哈哈哈哈哈哈哈,<张有汉>: @额上似能跑马  怕是爱上恐龙了,<_是垃圾啊>: 回复 @Mt_H- :mua,<由渼>: 这狗知道啊[爱你],<廣韵_>: 回复 @明-朱元璋 :呸！朱元璋废除了丞相！你这个骗子！！,<起酥了>: @我真的真的真的真改名了  哈哈哈哈！笑死啦,<朝朝朝nice>: @不由我也不由你  看到个傻子,<一个蛋黄_>: 回复 @__XUHUILIN :哈哈哈哈哈哈哈哈哈哈这恐龙是咋了[笑cry][笑cry][笑cry]太草率了[笑cry],<小小小小小小小小可爱公主>: 回复 @为什么名字总被人占用 :像你哈哈哈哈,<很多的话要说>: 回复 @一碗子C君 :也看过了,<为什么名字总被人占用>: 回复 @小小小小小小小小可爱公主 :像你[挖鼻],<难再l>: 回复 @小凉子mmmmm :哈哈哈哈哈 笑死了！,<Pseclese>: 很可爱*^o^*那恐龙和狗,<ssjooxy>: @ssjooxy大蒜,<难再l>: @ILJus  看评论笑死了,<太大大阳>: @x许嘉容   好好笑,<Kalorcy>: 我要是穿这个出现在你升学宴你会不会打我[哈哈][哈哈][哈哈] @小铭是个好青年,<Rome_456>: @老孟家的小孟啊,<煎饼果子不加蛋_>: @鸡蛋灌饼只加蛋_  这个恐龙是什么呀最近好像很火的样子 之前在路上也见到过[害羞],<李某某之某某>: 回复 @想变瘦的涵涵 :这是你，大傻子,<Jocus丶>: 第四张笑死我了[允悲][允悲][允悲][允悲][允悲],<朝儿_>: @路人CC_  最后一张。。。,<流浪的瀚瀚>: @uglyyyman,<就叫佐佐木柚好了>: 回复 @唔系甜瓜 :明明我是那个狗恐龙是你[doge]]
2243807243	金刚狼是怎么没滴...... ​​​	[<很惡楠>: @_MercuryLeafer,<Jane-X-U>: 回复 @弗拉基米泽 :[费解][费解][费解],<酒绿-->: 回复 @圈跪大师 :哈哈哈哈哈哈,<圈跪大师>: 回复 @酒绿-- :然后就变成哈士奇,<Gary汨辛>: 回复 @赵大彤彤彤Alan :哈哈哈哈,<善良的小钰>: @小兔几的糖果店的小糖的梦辣磨大,<打嗝鸡>: 回复 @phozyyyy :哈哈哈，金刚狼就是这样死的,<phozyyyy>: 回复 @打嗝鸡 :好冷哦,<F君的小祖宗>: 哈哈哈 @伪矢量,<脑热心干燥>: @这是小号别看了,<byebye_black_bird>: 回复 @陈啊陈啊陈啊陈陈 :哈哈哈哈莫名的喜感,<一土口玉木东>: 回复 @Zzang南方菇凉 :死不了的，可以自愈，你忘了？,<Zzang南方菇凉>: 哈哈哈哈哈哈哈 @一土口玉木东,<靠谱-同学>: 你真的是笑死我  http://t.cn/RK6QnOX,<疾风丶丶丶丶>: 回复 @潮生万里 :这位同学free stely,<UndeFeaTed_Cw>: @迪迪世界第一可爱,<潮生万里>: 回复 @疾风丶丶丶丶 :别打钱了，打碟吧,<疾风丶丶丶丶>: 回复 @fiume尔康 :你郑国的装个几把,<背包去撒野>: @flappy阿福    @馒头饿了啃馒头    @馒头饿了啃馒头,<谢谢谢必敏>: @Richard_Zhang929,<Winnie樊樊>: [二哈][二哈],<背風口>: @Darling··,<wal333333333>: 回复 @你十三姨呀 :醉了,<D丶Huang>: 回复 @哈库呐玛嗒嗒- :看过哟[喵喵],<透心梁i>: @浪子的围脖小窝2016,<ruichuan无我>: 回复 @再当杯酒言欢_ :[允悲][允悲][允悲],<哈库呐玛嗒嗒->: @D丶Huang,<fiume尔康>: 回复 @疾风丶丶丶丶 :我，寤生  你们看着办,<mumuEmily>: 回复 @Migagogo :太坏了,<我又改名了呢呢呢>: 回复 @你chai :哈哈哈搞毛线,<WenzidanLa>: @虚妄之诺丶  ,<ciarra1997>: 回复 @光玥光玥 :ew…………,<董方啊>: 知道什么叫笑里藏刀嘛：哈哈哈哈哈哈哈哈哈哈哈刀哈哈哈哈[doge],<森金村大脚板>: 回复 @vepoy :[喵喵][喵喵][喵喵],<酒绿-->: 回复 @圈跪大师 :恢复之后就失忆了,<小仙侣2333>: @EVOLUTIVE   [笑cry][笑cry][笑cry][笑cry],<软饼干zombie>: @NORI-kYx    哈哈哈哈,<Warframe萌星酱>: 回复 @Maskeman :[允悲],<圈跪大师>: 回复 @酒绿-- :哈哈哈哈哈  反正能回复,<ZCH-OnePiece->: 回复 @岳璞 :我靠，太突然，突然就没了[笑cry][笑cry][笑cry],<岳璞>: @ZCH-OnePiece-,<老莎老莎老莎>: 回复 @小八楊楊 :[白眼][白眼][白眼],<苏墨炽>: 没关系有自愈能力,<_朴子>: 回复 @想到就去做啊J小姐 :[笑cry],<Orez_>: 哈哈哈。[哈哈],<遗灬梦>: 回复 @1991-z :看了一会我都认不出来这是谁了,<Empty忒忒忒忒忒>: @Z-whhhh,<爱吃猪蹄儿的半仙汪>: @脚步所至丶心之所安,<Blueblueee_>: @徐大夫不偏执  [笑cry],<蔡_Jelly>: @Aki妮喃  哈哈哈哈,<Micky_boom>: @journeylu  哈哈哈哈哈,<阿年呀呀>: @阳隼c_   哈哈哈]
2243807243	猫和猫之间是怎么相处的[喵喵][喵喵] ​​​	[<就是万小松>: @bts_all,<-撸猫琴师->: 回复 @清幽醉流景 :这些都是比较机智的哈哈哈哈哈哈,<-轻轻的亲亲>: 哈哈哈哈哈哈哈 @吴牛牛_,<青峰的小天使>: 回复 @Polly阿 :2333第四张莫名的萌,<叫我李志杰>: 回复 @Shero_魏发财 :那我需要多送几个水杯吗[白眼][白眼][白眼],<请喂饱茹茹>: 第二个 @____未闻花名   [笑cry][笑cry][笑cry],<_菇仔>: 回复 @__樂仔 :[兔子],<Shero_魏发财>: 回复 @叫我李志杰 :看来我真的要多养两只了[笑而不语],<yaFFFii>: 回复 @2航同學 :哈哈哈这不是咱俩得日常嘛，看着你作死哈哈哈哈,<二千先生的湖>: @清浅淅   第一个像不像你,<JasperCheung18>: @自然卷Oliviaaaaa  [doge],<Polly阿>: @青峰的小天使   @个烂芭比   @阿miaoMiao   @胡梦婷queen   @李又又m  第二张[笑cry][笑cry],<山田小丸子>: 回复 @倩女手游CC电台主播 :[哈哈],<山田小丸子>: 回复 @JC如我 :对，哈哈哈[偷乐][偷乐],<我是百事我爱你>: 回复 @Jieyer不想毕业了 :最后一个[允悲]智障儿子,<CraZy-songsoso>: 回复 @迈克尔老于 :[兔子][兔子],<CPH__girl>: 回复 @波波我是维奇 :像你[思考],<喵萌萌的向日葵>: 一只猫总是这样想：嘿，小傻子！,<我不会取ID>: 回复 @林家驹Rocky :挺喜欢的,<时光一直都会在>: 回复 @央咩咩咩 :p9我仿佛看到了戏精布莱克,<LY_JZZ>: @胡志远1996,<野心疯子>: 图九，铁头娃，拉都拉不住。,<央咩咩咩>: @时光一直都会在   笑死,<安安安洛克>: @曦曦曦曦曦子丫  [笑cry][笑cry][笑cry],<狗蛋家的萌妹>: 回复 @美的空气净化器 :哈哈哈哈哈你们太坏了[笑cry],<2航同學>: 最后一张我左你右最好的体现 @yaFFFii,<RE_seter>: @萌萌哒的大旭儿   我…以后……想养两只猫[猫咪][憧憬][憧憬][憧憬],<啊史啊哈>: 第八个超暖 想抱抱,<是慢性子不是急性子哼>: 回复 @ONEME_Kin :肥的那几只不像,<我家猫喝醉了>: @木色染了半条街   我要笑死了我们养猫吧，养两只,<枝pikoooo>: 回复 @陈星宇哼哼哈hi :哈哈哈哈明明是说好乖，多吃点多吃点,<千寻尽杨>: 回复 @食古不实 :哈哈哈哈哈哈哈哈哈哈哈哈哈哈哈哈你是想笑死我好继承我的财产,<杨荣羡>: @funfun1117,<ONEME_Kin>: @是慢性子不是急性子哼  像不像你,<啊南酱>: @阿香说她喜欢你,<riyuriyu2>: 回复 @ALLENALLEN4 :天天较劲儿，打死你,<愤怒的dude>: 哈哈 @sophia_MengMeng,<小毁魔>: @Claudia_BJ,<Zz-watermelon-girl>: @我的宠物叫大白丶  再闹像图二一样把你踢下来,<ALLENALLEN4>: 回复 @riyuriyu2 :不是忙么工作去，谁让你扣手机了,<一头叫做本杰明的驴>: 回复 @林漂亮要远行 :宛如智障[喵喵],<riyuriyu2>: 回复 @ALLENALLEN4 :才不是我，你踢我,<我是女一号我不能死啊>: @詹诏祁  好可爱啊,<拿允儿的手指当钥匙>: 最后一张：兄弟，我只能帮你到这份上了，是你自己要跳的，不怪我,<__樂仔>: @_菇仔  [哈哈],<穎賢Cheung>: @第六型的子君仔  哈哈哈哈哈哈,<蝴蝶夫人_S>: 哈哈哈其实两只猫咪也很好玩！ @南瓜大人的铲屎官,<songyi怡>: 回复 @stop_run :相爱相杀的技能满点,<stop_run>: 回复 @MyAir_7 : @songyi怡,<Magowann->: 哈哈哈，飞起一脚]
2243807243	它曾经是个王者，直到后来它有了老婆和孩子...[喵喵] ​​​	[<其实我没那么糟>: @Smile菥蓂,<春风十里不如你大爷我_>: 回复 @IntheArms :不服？,<一只小Sa>: @超级蚂力  哼,<有鱼余空时间以北_>: 233333[笑cry],<抹茶猫抹茶叔>: @哦哈哟Hahaha,<当你走过来时路>: 回复 @细心不鲁莽的新新 :可是我觉得他很man啊。真正的男人 外面威风凛凛 家里温暖宠妻[坏笑][坏笑][坏笑],<Larrydaly>: 回复 @龍一隻 :私信我啊,<Larrydaly>: 回复 @房东的狗子 :嗯，私我,<熊猫大神神经病>: 回复 @风车少女哎我去 :忽略这些细节!,<风车少女哎我去>: 回复 @熊猫大神神经病 :你咋不上班,<IntheArms>: 回复 @春风十里不如你大爷我_ :哦！！！！,<沿路如歌褪变>: @闪闪发光的小祇迹  好好看书啊,<ZhaNG穗穗呀>: 回复 @何寶榮Darling :它曾经也是个王者[允悲],<山水吴神婆儿>: @stoneeeeeeeeeee,<中二的蠢萌叽>: 呵呵哈哈哈 @陆遥Lu呆猫,<cheemingqiv>: 回复 @_黑炭-君君_ :好閪惨...哈哈哈哈,<csu灬Tintin>: 回复 @朝朝朝气的lee婧要UpUp :[哈哈][哈哈]哈哈,<朝朝朝气的lee婧要UpUp>: @csu灬Tintin  [偷笑],<Rainnia_Chan>: @98_0820   [哈哈],<碗里有糖Skye>: 回复 @黑猫警长ZZP :[偷笑][偷笑][偷笑],<wurnblg>: @内马尔达席尔瓦_H   [二哈],<柠檬_aa>: @95森林  [哈哈][哈哈],<伊娜小宅女>: @-卡尔坨皮吖-,<汤皓皓_>: @夏肥夏肥  搞笑,<斑马与幺鸡_>: @_超人UUncle,<黑猫警长ZZP>: 回复 @碗里有糖Skye :哈哈哈[心][亲亲],<春风十里不如你大爷我_>: @IntheArms,<何寶榮Darling>: @ZhaNG穗穗呀    好可怜的说,<怀府飞鱼>: 回复 @HH要有一片天_ :哦,<西奥鹈鹌>: 回复 @西偶乌恩 :哈哈,<前子LIU>: @咿呀咿呀呀呀呀呀呀呦  学学人家,<Jiuj_u>: 回复 @象形海 :[允悲][允悲][允悲],<傻黄的沙皇>: 回复 @senhoman :你预知到了你的未来,<晴天-七裏香>: 回复 @绅度X :有这张图的人必定懂得什么,<火锅--Ye>: 回复 @18岁的鱼鱼鱼鱼鱼 :哦[委屈][害羞][害羞],<18岁的鱼鱼鱼鱼鱼>: 回复 @火锅--Ye :雌狮可不就是长这样,<全全全全小钰>: 回复 @体重不过190不改名 :揉你大长脸,<赵伟伊>: 回复 @王立安ananan :可以哦[酷],<绿豆儿花>: 回复 @黑洋洋 :你吼我一个试试[挖鼻],<大爱坤坤坤>: 回复 @遇见最美的自己- :[偷笑],<青蛙王子的小女仆>: 回复 @很屌的青蛙王子 :人家可舍不得这么对你,<火锅--Ye>: 为什么他的老婆不是狮子？ @18岁的鱼鱼鱼鱼鱼,<洞妖妖>: @ADream葡萄,<QUINNQIAN>: 回复 @用户6150869612 :辣鸡,<ZT其实都没有>: 回复 @璇在吃吃睡睡 :仿佛看见了我的未来,<用户6150869612>: @QUINNQIAN  宝宝心里苦,<照相馆的木林君>: 它有一群老婆孩子、,<烈酒入喉2952>: @PERFUNCTORY201608,<梦宝宝的Superman>: 回复 @夏天哥哥的Matcha :[笑cry][笑cry][笑cry]我是青铜,<王立安ananan>: 回复 @赵伟伊 :那你愿意当个母老虎么[挤眼],<wy351>: 回复 @kooices :哈哈哈哈哈耶嘿]
2243807243	看看这些词的真正含义吧[笑而不語] ​​​	[<李家小颜>: 没毛病[哈哈]// @这里是美国 :没毛病啊[并不简单],<XuanXuan_Huanger>: 回复 @Smile_洁洁洁 :哈哈哈[并不简单][并不简单] never mind,<中学教育研究凌泽广>: 回复 @天天天天打哈欠 :情人节2月份造人，怀胎十月，十一月份很多宝宝出生了,<舞蹈梦94>: 回复 @autumn有时你就像是我的孩子 :[允悲][允悲],<进击的卢家小忙内>: @都怪这撩人的月色太疯狂,<嗨花里巴巴>: 回复 @赵是赵赖的-赖 :哈哈哈，sarcasm的解释才是正解[哈哈][哈哈],<Smile_洁洁洁>: 回复 @复仇女神伊什塔尔 :Never mind,<爱K歌的Mr猫>: @SnowySnowflake,<Bababa-baba-ba-nana>: 我就是十一月生的啊……_(:з」∠)_,<Old铁们>: 扎心了[小黄人无奈][小黄人无奈],<黛黛黛黛黛儿->: @吃肉不像胖  考验你的时候到了,<清明上坟图fff>: 一直把never mind 翻译成别介[doge],<邝骨笨橘>: 我可不是这么说话的，，。,<赵是赵赖的-赖>: @嗨花里巴巴  太好玩了,<豆汁爆肚牛叶闫再加一个傻白甜>: @biubiubiukhalil  轩哥 看懂了吗,<身高170的平胸girl>: 服了🤔这让我怎么独自啃完英语。已经被带歪了,<静流11>: 没毛病！！！！！// @这里是美国 : 没毛病啊[并不简单],<复仇女神伊什塔尔>: 人体翻译机在哪里？🤷🏻‍♀️,<鹿遇孤独>: 所以弄一堆英文让我弄啥[微笑],<_Sunny__L>: 回复 @天天天天打哈欠 :情人节适合造人。,<天天天天打哈欠>: 表示第一句没明白,<Vayne彡>: 教授真的不让用wikipedia…// @这里是美国 :没毛病啊[并不简单],<萧何敬>: never mind[摊手],<大紧的狗>: @螺旋冲击没EX,<Claireccai>: A bit cynical but kinda funny!,<Palllettte>: @Pallettte,<爆炸头>: 看不懂。[允悲],<许在宥>: never mind [摊手]// @这里是美国 :没毛病啊[并不简单]]
2243807243	被领养的第一天，他们一直在笑~[心] ​​​	[<赵伶俐的小跟班儿>: 回复 @Sunny_伶俐 :好，同意。第二只真可爱,<奶茶刘小鱼>: 第一排中间那个,你是笑出了新高度啊,可爱得犯规了[眼泪][眼泪][眼泪],<明长官>: 图五是谁在笑[二哈],<Heres_Mocklos>: 回复 @_柠檬说葡萄你好酸i :啊哈哈哈[doge],<_柠檬说葡萄你好酸i>: 回复 @Heres_Mocklos :[doge]这么笑的？,<Yggggggg丶>: @赵倩ice  地瓜是一直在跳🙂,<front_iri>: 图8不是个抱枕么???[白眼][白眼],<卓妹你爹叫你回家吃饭辣>: 并不知道为什么 国内满大街的流浪狗没人收养 国外的流浪狗都有人兴高采烈的去领养,<Feline_Hunter>: 被乱棍虐打的第一天，他们一直在哭。这里是中国,<贾振锋marco>: 回复 @烨然若神人- :[微笑][微笑][微笑]看起来你没把当人呀。,<Essay代写-留学生英文代写工作室>: [二哈][二哈][二哈] @北美留学生英文essay英语代写  ,<Funny-miu>: 从小就害怕动物，但也曾和奶奶家的小黄狗特别亲近。害怕孤单的这些日子萌生过无数次想养一条狗的冲动，想着它会对我笑、让我抱、一起去公园溜达吓吓害怕动物的人们，最后都会定格在我上班、出差时它一个狗趴下房间角落孤单的样子，和我很像。,<铁打的姑娘陈TINY>: 回复 @super-FmanJ :我像2,<闪闪的红星潘冬子>: @甜甜阿蒜头脑壳丶,<W-eiminlu>: @Dianaorwater   像你么[微笑],<拜拜您了>: 所以中国哪里有领养的？一辈子爱它那种,<还有什么名字没被注册>: 第八只是皮卡丘吧[doge],<胡悠婷Roxanne>: 和主子的第一晚就被侍寝 笑成傻子  http://t.cn/RKI46i0,<吃掉栗子剥开的壳儿>: 回复 @张嘿嘿_ :你也要领养嘛,<Monarch_Lay>: 好想养一只打屁股基哦[微笑],<-是美少女儿啊>: 图片评论  http://t.cn/RKI4PvY,<换盏樱酒>: 我领养的猫猫 哈哈哈  http://t.cn/RKIy4cH,<Whale___>: 回复 @eqvita :傻萌傻萌啊,<eqvita>: @Whale___  第二个好萌,<唱歌的黑烟囱>: 喜欢第二只 @清早一过,<YouShouldSmileMore>: Life is living ,<-Wowop>: @-woWop丶  最后一张[笑哈哈],<谈-APlanet>: 感觉五是养了个主人,<TsongTsong依旧住在二次元啦啦啦>: [心][心][心],<红鲤鱼与绿鲤鱼与驴驴驴-__->: 最后一个你太荡漾了,<小李东栋咚锵>: 回复 @水豚俊 :[doge]没有,<真正淑女>: 捡的大胖，现在是我的大可爱  http://t.cn/RKfFPHj,<小畅不忧伤>: 回复 @楠楠不乖lyn :[二哈],<可爱又迷人的反派美少女->: @SKinny-Hao  图五 哈哈哈哈哈 确实是主人被领养了的既视感,<xxjies>: 回复 @不过CFA不改名的Dan :可爱死了嘤嘤嘤,<楠楠不乖lyn>: 回复 @小畅不忧伤 :男旁友被领养的第一天也是很高兴,<zyc不是BOY>: 世间因这些可爱的小动物而更加有爱！！！[嘻嘻][嘻嘻][嘻嘻][嘻嘻],<juicy章鱼哥>: [笑cry][笑cry][笑cry]可爱！,<最最可爱漂亮美丽温柔的小仙女>: 领养代替购买  http://t.cn/RKfdIvR,<小畅不忧伤>: 领养代替购买 @楠楠不乖lyn,<peggysnows>: @请叫我--阿辉,<一宝妈妈咪>: 真好！ 狗子们真开心啊[开心],<悬崖勒马_>: 哎呀还有这好事，可以通过什么渠道领养，我也想照顾几小只[心],<gakki黛>: 可爱可爱  @圆肉脸   用了她家的珍珠膏 皮肤好了很多,<速速呐>: 有人知道最后一张图是什么品种的吗？,<找不到新名字的越水南>: 回复 @给生命一点意义 :可以去 @糖一生MsK  家看看美衣[羞嗒嗒]都是女孩子喜欢的独特精致的款式[女孩儿][女孩儿][女孩儿],<周晓笔同学>: @完顏夜夜夜  有爱,<赏你一块小饼干>: 不知道为什么想p一个疯狂叫妈的图上去…,<人参米拉ra>: 领养代替购买[心],<妮儿是小学生>: 回复 @给生命一点意义 :我昨晚也刚抱回来一只流浪猫,<我个名叫蘅蘅阿噶>: @我一怒之下发了个微博]
2243807243	听说在夏天，冰箱开久了会长狗[doge] ​​​	[<一个越演越烂的故事伤心>: 回复 @赵行- :跟狗儿子没得差别,<你妹是个好同志>: @怎么落寞表情漫不经心,<奶小糖丶丶>: 回复 @奶糖_ACC :哈哈哈哈,<CHESSOLOGY>: 回复 @rtydiao :我看这些都是你[怒],<茜噜噜杨闹闹>: 回复 @FrankJYF :都是炖肉，没地方,<Liberty_XY>: @iamillusory,<a鱼心>: @我有一只鱼心喵,<Heracles-song>: 回复 @RebeccaPINK :羡慕狗[白眼],<MEI梓苜清>: 回复 @Lnnyozze :[小黄人坏笑][小黄人坏笑][小黄人坏笑]狗生好惬意,<芝麻糊是只猫>: @Hola_wq,<mirrorprin>: 回复 @海獭姑娘她不是一只懒蛋蛋 :估计回三亚就是这个情况了[允悲][允悲][允悲],<贱贱的羊角蜜>: 回复 @Anna乖乖哒 :是的，第三张二哈硬往里面挤。最后一张萌,<Vivi_韦薇>: 回复 @VERTIGOCLUB :哈哈哈，不不不！我不出去！,<狂氪不止>: @Cheng_z_l   注意小花,<iiiou-Sissi>: @李大灿灿EAPe   @Ghlllcc   @Rene_smee,<Anna乖乖哒>: @贱贱的羊角蜜  笑死我了，第一只像不像小熊熊,<barnett_包拉>: 回复 @爱喝碳酸饮料的小李同学- :狗在冰箱里干嘛？狗是用舌头散热的 不是皮肤 一看就是作秀,<赵行->: 回复 @一个越演越烂的故事伤心 :给我一个冰箱。我能过一个夏天,<rtydiao>: 回复 @CHESSOLOGY :第一张是你的朋友 第五张是你[doge],<空气飘啊飘>: @指尖冰凉8579,<爱喝碳酸饮料的小李同学->: 亲死了[小黄人高兴] @barnett_包拉,<LittleMmonster>: 还有冬天被子晒久了会长猫,<YellowSubmarine0301>: 回复 @狂奔的苏苏 :[嘻嘻],<狂奔的苏苏>: @YellowSubmarine0301,<viciituy>: @C__H_E_N_,<文曦lemon>: 回复 @_RAULCHEN :哈哈哈,<阿_Kiddy>: 回复 @煮面少女 :哈哈哈哈小短腿打不开冰箱[哈哈],<头师父>: @strummer_Z,<O708_yokimao>: @老夫蠢蠢欲动的少女心,<彭彭和小宇只是我自己>: @KaylaaaaaaalyaK,<吖陈佳>: @猪腮脸圆圆  夸张,<刘瑶瑶爱吃胡萝卜>: @仓啷啷啷大宝剑,<走在食堂小路上的puppy>: 真不愧是极地小伙伴，可是冰箱还咋呈吃滴?,<臭臭与帅帅的撕逼日常>: 回复 @朱文迪- :我不出 憋拉我,<南柳_Nann>: 所有[狗]都喜欢负温度阿,<palmarwu>: 回复 @Jay_文杰 :粗来[挖鼻],<茜噜噜杨闹闹>: 回复 @FrankJYF :我们家冰箱没地方,<有很多点儿>: 给我切半斤萨摩，八两二哈，一瓶二锅头,<CHESSOLOGY>: @rtydiao  哈哈哈,<_RAULCHEN>: @文曦lemon,<一个危险的知识分子>: @赵琪琪有一个流浪梦,<_Zixin_>: 好想在家养一只哎 萨摩柯基金毛都要(⁎⁍̴̛ᴗ⁍̴̛⁎),<dildar-in>: @__haLmurat  养好不好[泪],<M一生柚你H>: @OctopusLian   有没有很萌,<Verde->: @BrIanSTILLHERE,<和蔼海h>: 回复 @斯文妹兒b :哈哈哈哈毛多不怕冷,<YANG--2>: 回复 @是周露丫 :哪凉快待哪。,<是周露丫>: 回复 @YANG--2 :哈哈哈拖都拖不出来,<YANG--2>: @double好心情  [二哈][二哈] @是周露丫,<BitterLemons>: @甘甘-甘扶提  长[狗],<_瓜皮>: 回复 @Miss_Daydream_ :哈哈哈太乖了]
