2243807243	巴西模特Paola Antonini ，因车祸失去了一条腿，但丝毫没有影响她的美！[心] ​​​	[<大爱酸乳酪洋葱>: 回复 @百读微博 :你在说你自己吧 难道身体有残疾的人就该一个人在家怨天怨地哭泣吗 你内心真黑暗,<忘记密码改半天密码>: 我愿意日你，啊不是，我愿意娶你,<absolution997>: 回复 @百读微博 :你是怎么活到现在的[摊手],<钊ZY>: 回复 @Joogurak :有希望吧....但是，这样假设真的好吗......,<Joogurak>: 回复 @钊ZY :上身瘦呢,<钊ZY>: 回复 @丨七度空间丨 :照样虐到你哭[挖鼻][挖鼻][挖鼻],<钊ZY>: 回复 @Joogurak :嗯........您腿粗可能是因为您上身真的需要这么多的肌肉作为支撑...so....您可能需要再次安上一条相对等的腿[挖鼻][挖鼻][挖鼻],<麻省理工1>: 回复 @百读微博 :美是人类的一种内外表现，漂亮是外在表现，所以内心的强大才是面对生活的一种美。,<月夜独行->: 没人觉得莫名有种很潮很酷的感觉吗[doge],<乐懵了咩>: 回复 @百读微博 :你应该是脸皮厚才会说这样的话[doge],<Strawberry49>: 完全靠心态呀，还有你身边的朋友家人带来的正能量,<oliveHart>: 回复 @百读微博 :你脑子有病？你真是厚颜无耻,<安美丞>: 依旧美的很！[good],<BoyInNYC>: 回复 @百读微博 :呵呵,<万狗之主>: 身材好，义肢做的也好看，主要好用应该就行。将来科学发达了少个胳膊腿儿的都不成问题了。,<名字叫个什么鬼>: 回复 @百读微博 :丑人多作怪，说的是你,<万狗之主>: 回复 @百读微博 :你真他妈恶心。,<周兆举>: 回复 @百读微博 :你妈妈要脸怎么会有你！,<行进中的AK47>: 遭受了磨难，仍旧积极向上[赞],<猫猫猫的猫猫的猫>: 回复 @百读微博 :可惜她一个脚趾头都比你好看[二哈],<Alex魏大大>: 美女就像美味的蛋糕,少了一口当然可以继续吃了[允悲],<lazyzzzzzz>: @麦兜的胖嘟嘟  可惜了，这么飘亮的妹子，缺了一条腿儿。哎哎哎,<lazyzzzzzz>: @麦兜的胖嘟嘟  我曹，牛逼啊。飘亮,<拉茉>: 除了美貌还得有钱，不然只能包个篮球,<dauntlessBIAN>: 回复 @百读微博 :这种人竟然还会有人给他点赞,<linqiaojuanV>: @Luyychen    @lyylyyll,<Baby_爱吃Ivy酱>: 回复 @Am动感超人 :[哈哈][哈哈][哈哈],<莫过于此1920>: 心态决定你的世界,<哔哩吧啦boomm>: 回复 @百读微博 :你在博关注么,<TY洁JJ>: 羡慕她这么勇敢，[心]小时候发生车祸，两个脚都留下很丑的伤疤，所以从小到大都不敢穿短裤和漂亮的凉鞋。。。,<CoooRYY>: 回复 @百读微博 :那你很丑,<OlekJhn>: 回复 @百读微博 :你是我见过心里最黑暗的人，你早就没生命了我猜,<陽鳳LF>: 回复 @百读微博 :她的毅力和心态值得尊重好吧！,<Am动感超人>: 回复 @Baby_爱吃Ivy酱 :你这个理解没毛病。[偷笑],<SHANGXUELIN_>: 确实很美啊[心],<野原大雄娜娜子>: 回复 @隋哥没sei了 :[笑cry][笑cry][笑cry][笑cry]哈哈哈哈过分,<言阿言>: 回复 @百读微博 :哪里来的神经病,<野原大雄娜娜子>: 回复 @百读微博 :看见评论都在骂你我就放心了[二哈],<-Aglio>: 不是所有残疾人都愿意把自己不好的一面展入出来，既然有的人或许不在意这些后天缺陷，你又凭什么又嫌弃的眼光看别人。还有这他酿的不叫脸皮厚，脸皮厚的人是你才对,<MaoMi_Lily>: 好像机械少女一样，特别酷[羞嗒嗒],<星耀互娱>: 回复 @週旭麗 :我凭本事被盯上的，为啥要反思[doge],<週旭麗>: 回复 @星耀互娱 :反思下为什么你会被卖片的盯上。,<-Try-everything_>: 好漂亮[舔屏][舔屏],<手機用戶王老急>: @手机用戶V1p,<Lovehhh9>: 国外拍照的景太好了怎么拍都美主要是,<芝麻分贷tx5720>: 回复 @一朵大浮芸 :你知道吗[摊手][摊手] #借钱的来#,<芝麻分贷tx5720>: 回复 @芝麻分贷tx5720 :[鲜花][鲜花],<嗑弹喵Qvq->: 回复 @百读微博 :脸大到跑来找存在感这不是脸皮厚是什么,<十万个不为甚么>: 回复 @芒果_ManGooo :厉害,<yooobeauty>: 回复 @百读微博 :沙壁]
2243807243	嗯，这番话要背下来！[心] ​​​	[<Laura108>: 回复 @Oe_z :谢谢罩爷今日份的心灵鸡汤，和公务员那个一起看觉得……很微妙,<玛丽莲杰克>: 回复 @吉拉弗 :然而，背下来也并没有什么卵用,<吉拉弗>: @玛丽莲杰克  [熊猫],<-清凉水->: 回复 @一阿斗一 :嗯好，也可能身体状况有关系,<天才少女dear王>: 回复 @L_R_C :快要不相信爱情了,<女巫小的毒有>: 回复 @天才少女dear王 :[抱抱][抱抱][抱抱][抱抱],<Cancel___>: 回复 @夢想家滿滿 :现在才,<夢想家滿滿>: 回复 @Cancel___ :我密码找回来啦,<泥巴种z>: 回复 @黑暗拥有的很多可能 :我在享受生活！,<如果不是爱的太多为何弱点如此多>: 回复 @沉默稀土 :必须是啊，深情不及久伴，比久伴还要难得的是此生不厌。[白眼]人这辈子嘛，自己开心就好。,<我最爱吃蛋糕啦>: @我最爱吃肉肉啦,<沉默稀土>: 回复 @如果不是爱的太多为何弱点如此多 :我一直觉得完全两个独立的个体  靠荷尔蒙吸引 难免会有吸引力减弱的一天 想一生一世是不是太难了[笑cry][笑cry][笑cry][笑cry]  爱太虚幻,<橙子味_gloria>: 回复 @小鳄鱼心情不好不洗澡 :好哒,<小萍会长>: 回复 @逗比在发光o :哈哈哈哈哈哈,<苏汤包>: 回复 @玛丽莲蜜兔 :好。[爱心],<独独不孤单>: 回复 @江湖儿女快意恩仇 :我也想知道，同问,<漂流悟空>: 隆重介绍一下，这位是宋小宝的亲生父亲[并不简单],<慵懒喵喵->: 回复 @呆了个蟹 :感情总是不顺 哎,<红烧云霄>: 回复 @只喝白开水儿 :热评第一,<Te彡Amo>: 回复 @聃领 :我会的,<聃领>: 回复 @Te彡Amo :我会的，我怕你不会,<木嘻嘻土>: 回复 @长颈露露露露 :切,<长颈露露露露>: 回复 @木嘻嘻土 :[好]，我那么快乐,<阿铭小代>: 回复 @浅憶亦思君 :我怎么发给你[费解][费解][费解]百度云还是,<六十哇>: 回复 @L竟贤 :哈哈哈 打卡[doge],<向美太二>: 回复 @L竟贤 :66666,<浩然君7777>: 回复 @范宇想出去玩 :老太太都这样了还享受生活呢 ？！,<SameDan_>: 回复 @桃花妹归来 :[二哈],<吃蟑螂>: 回复 @对着天讲 :[心]看[心]黃[心]片+猬信:DGD318～～～～～～～劲爆～～～～～～～～～～～～～～～～～～～～～～～～～～～～～～～～～～～～～～～啦啦啦啦啦啦啦啦啦啦啦啦啦啦啦啦啦啦啦啦啦啦啦啦啦啦啦啦啦啦啦啦啦啦啦啦啦啦啦啦啦啦啦啦啦啦啦啦啦啦啦啦啦啦啦啦啦啦r,<Qu1nt>: 回复 @宁宁宁平凡 :[心][亲亲],<天才少女dear王>: 回复 @女巫小的毒有 :[抱抱][抱抱][抱抱],<扎心了-老铁>: 回复 @饭fan饭fan饭 :29失恋5年。,<Essay代写-留学生英文代写工作室>: @北美留学生英文essay英语代写  [酷][酷][酷],<魔形女streamline>: 回复 @L竟贤 :[心]看[心]黃[心]片+猬信:DGD318～～～～～～～劲爆～～～～～～～～～～～～～～～～～～～～～～～～～～～～～～～～～～～～～～～啦啦啦啦啦啦啦啦啦啦啦啦啦啦啦啦啦啦啦啦啦啦啦啦啦啦啦啦啦啦啦啦啦啦啦啦啦啦啦啦啦啦啦啦啦啦啦啦啦啦啦啦啦啦啦啦啦啦r,<忆梦忆寢忆时>: 宋小宝？[doge],<migrate失恋5433>: 回复 @对着天讲 :看.黃.片+猬信:DGD318～～～～～～～～～～～～～～～～～～～～～～～～～～啦啦啦啦啦啦啦啦啦啦啦啦啦啦啦啦啦啦啦啦啦啦啦啦啦啦啦啦啦啦啦啦啦啦啦啦啦啦啦啦啦啦啦啦啦啦啦啦啦啦啦啦啦啦啦啦啦啦[围观] ,<用户6210939223>: 回复 @L竟贤 :[心]看[心]黃[心]片+猥信:cc998711～～～～～～～～～～～～～～～～～～～～～～～～～～啦啦啦啦啦啦啦啦啦啦啦啦啦啦啦啦啦啦啦啦啦啦啦啦啦啦啦啦啦啦啦啦啦啦啦啦啦啦啦啦啦啦啦啦啦啦啦啦啦啦啦啦啦啦啦啦啦啦f(1),<大雨飞哪里>: 回复 @L竟贤 :哈哈哈哈 @钟阿鱼,<信阳明声驾校招生>: @Sa1ly_Yur  老婆，这段话好[抱抱][抱抱][抱抱],<麦浩轩_>: 宋小宝的话你也信吗？[汗][汗]  http://t.cn/RKLpYEJ,<_hahahahhh>: @cherry_sylla,<活着的立冬>: @黑眼圈的晴小若,<橙汁恩之>: 要享受生活 @王蜥蜴,<X刘佳钰X>: 我以为我看见了宋小宝[笑cry][笑cry][笑cry],<云云萸>: 回复 @-刘小逗- :我家电视上就有[允悲][允悲][允悲][允悲][允悲][允悲],<小栗子不吃藕>: 回复 @巨大水瓶 :你一定可以,<鑫茹Anaive>: 22岁浑身是病。[悲伤],<我随你意就好啦>: 回复 @YojanChoi :[强][强][强][强][强][强],<楽勒个楽>: 回复 @-刘小逗- :熔炉看了真的压抑死,<被绑架的炸鸡腿>: 回复 @饭fan饭fan饭 :好惨,<被绑架的炸鸡腿>: 回复 @L竟贤 :扎心  http://t.cn/RMJOVqk,<YojanChoi>: @我随你意就好啦,<小思啊>: 回复 @饭fan饭fan饭 :没关系的，两个月前我同时失业又失恋，积蓄也出去散心花光了，当时真的觉得看不到头了。现在我有了新的工作，我相信也会有新的人的，没事的,<热情828>: 你不可以一直这么悲伤，要享受生活，你一定要摆脱它,<饭fan饭fan饭>: 回复 @ZLNHM :眉中痣的人运气好别担心,<饭fan饭fan饭>: 回复 @奖不奖励 :…你加油…………]
2243807243	国外一网友为了防止以后孩子问他是怎么来的，提前拍好了照片。。。[允悲]这就叫瓜娃子吗？ ​​​	[<三景页日義AND王>: 回复 @_兔八妹 :这个可以有，我吃西瓜拉的籽种的[嘻嘻],<老LU圈圈>: 回复 @L括弧笑H :[doge],<Sunshine鹿笙>: 回复 @L括弧笑H :[眼泪][眼泪][眼泪][眼泪],<L括弧笑H>: [笑cry][笑cry][笑cry]瓜娃子 @Sunshine鹿笙   @老LU圈圈,<yahhhhh->: 回复 @李朗俊的微博 :好可爱,<可可可心可心>: @实力秀恩爱的小冯   @Striveleeer,<Kari飞>: 回复 @我是好人请放心 :哦,<我是好人请放心>: 回复 @Kari飞 :动刀了，还是剖腹产,<Vvvvonly>: @WELL-渔鱼予瑜,<Vvvvonly>: @你没救我也没救jxr   @Peggie_Hu   @domhm,<i怪任>: 回复 @biibiij :哈哈哈 咱儿子以后拍一张从垃圾堆里捡来的画面[笑cry],<Kari飞>: @我是好人请放心  瓜娃子,<小鲜女萌萌张>: @倩女幽魂十八掌门人    @旧颜YX    @帅帅帅帅帅帅宁    @本书_    @嗑瓜子的猫儿-    @小王子11281314,<_兔八妹>: @三景页日義AND王  [哈哈][哈哈][哈哈],<不想当咸鱼的小硕不是好电工>: 回复 @布鲁岚 :[允悲][允悲],<我斌棒棒哒>: @羞涩的我灬腼腆的你,<没头脑喜欢bu高兴>: 回复 @氧气lyy :机智[二哈],<咩咩流殇>: 回复 @yolovexin :好细心,<宇HYH>: @钟小雪201602   这个厉害[开心],<刘尧写微博>: @小城守住我的梦,<F晓伏>: 只有我感觉是一对同性夫夫吗。。。,<huangzlllll>: 回复 @黄细菌菌菌Zzz :哈哈哈,<芝士蛋糕我爱>: @绘本墙绘工作室,<天青月影>: 回复 @叫你们经理来 :这叫扎心，谢谢[doge],<Azure得宠的猫>: @读着倒逼傻有总,<Z祝艺柠>: @徐幸福老幸福啦,<c一颗种子>: @晚一点没关系   @时光深巷H   @6yy_731,<宸儿丷>: 回复 @金团团团 :哈哈哈  现在你才知道你是怎么来的[偷笑],<杨菲儿Faye>: @王禄瑜   [眼泪][眼泪][眼泪] @77板儿    @爱申家族-晓,<巴黎不甜>: 这样的西瓜去哪买[爱你]好想要一个,<onhium>: 回复 @华君summer :0评论！！,<onhium>: 回复 @华君summer :尴尬吗！！！！！我问你！！,<onhium>: 回复 @柠檬炒蛋饭 :孩子会因此，在接触性教育前都不敢吃西瓜，爸爸心理高兴坏了因为不用跟他抢西瓜吃[doge],<暮夏简年>: 以后小孩还敢吃西瓜嘛[哈哈][哈哈][哈哈][哈哈] @L愛O筆V壹E笙,<梅路艾姆__>: 回复 @塔矢亮的老婆 :那我们以后也拍一个,<布鲁岚>: @不想当咸鱼的小硕不是好电工,<坂口健太郎的抱枕Kyra>: 重庆人不禁笑出了声[笑而不语],<biibiij>: @i怪任   [笑cry]脑洞真的大,<公纸无瑟>: @我的spring走你,<公纸无瑟>: @一只想吃掉葡萄的提子    @这个头像适合过夏天,<田1020T_T>: @其实这个就是我的名字,<偷月的人->: 哈哈哈瓜娃子 @快走你打不过他,<李洪庆L>: 哈哈哈 我小时候我妈告诉我是从大坑里刨出来的[允悲][允悲][允悲],<小丑不跳舞>: 瓜娃子！ @CARRIE813333,<氧气lyy>: @没头脑喜欢bu高兴,<罗一豆>: 回复 @柠檬炒蛋饭 :说出你的故事,<旺仔爱喝莫斯利安>: @大脸猫yousmile爱丽,<dmintl>: 四川人笑疯了 [允悲][允悲][允悲],<黑白是刻画心的情调>: @Hello摩希,<温柔的蓝三三>: 陕西妹子笑了[污][污],<只是一个考研小号呀>: @ATP_CP供能患者   哈哈哈]
2243807243	据说吃货们看了会莫名爽到飞起的一组图~~~[太开心] ​​​	[<你读书读傻了吧>: 图六是什么？[好喜欢],<叶踢踢>: @超级无敌可爱霹雳美少女_,<小小小小小小可爱哟>: @翟丶仔  66666,<Ayoki的猫>: 棉花糖和棒棒糖好多色素，一点食欲也没有,<WenML_xXx>: @Viicky_,<17只长颈鹿>: 回复 @罗逸文 :我要了,<骚古头>: @WorePaperDress  [费解]旋风土豆,<蒸笼-cry>: @冇得玩意儿   图六和图八,<不懂你的黑色幽默ll>: 回复 @199711- :图六是什么,<vampire_7998>: 回复 @任任任秀宁 :嘻嘻被你发现了,<墩墩_lynn_>: 图七用的是地漏？,<拉考244>: 回复 @iijody :想吃凉皮,<凉了个苑>: 回复 @石野望_ :裸体都没用[doge],<石野望_>: 回复 @凉了个苑 :穿好防弹衣！？[doge],<凉了个苑>: 回复 @石野望_ :可能……要冒着被我爸砍得风险[doge],<石野望_>: 回复 @凉了个苑 :我可以去你家搬张凳子乖巧的坐着吃吗[doge],<凉了个苑>: 回复 @石野望_ :什么时候来找我我提前叫我妈买[二哈],<石野望_>: 回复 @凉了个苑 :[馋嘴]想吃嘻嘻嘻,<汉密尔顿HAMILTON>: 问题是，这是啥啊！！！,<凉了个苑>: 回复 @石野望_ :这 我就不知道了[doge]叫我妈给你买,<安宝宝的智障欧巴i>: 回复 @wuli欧巴的路痴宝宝 :哇，有点想吃,<Sunny---晴晴晴>: 回复 @殷福龙 :看第一个就想吃了[白眼],<wuli欧巴的路痴宝宝>: @安宝宝的智障欧巴i  图[7]️ 凉粉里的捞捞,<-都颜与眼>: 回复 @-都颜与眼 :粉,<-都颜与眼>: 哈哈哈图七 云南叫抓抓分,<冲进人类文明花园的一只野猪>: 图七敢不敢把那个大拇指从凉皮上拿来[挖鼻],<爱睡觉可爱的桃子>: 回复 @我话太多名字不好取 :好神奇，哈哈哈,<毛毛毛毛毛妞>: 想要图6～～～叫什么～～～～～,<-有故事的宫鹊>: 回复 @-柠檬晴 :回来带你去吃[张嘴],<石野望_>: 回复 @凉了个苑 :为什么我一直在想乒乓糕[doge],<nonono-9>: 图九怕是要吃吐啊[允悲],<Sihur>: @余一23    @teampen,<我话太多名字不好取>: 哇塞！厉害了 @爱睡觉可爱的桃子,<从简单爱到我们发如雪>: 我们宝鸡也有凉粉啊,<k为米折腰>: 牛油果？？好难吃的样子！,<吃醋上瘾ii>: 没有吃的欲望但是看的心情澎湃[摊手],<任任任秀宁>: 回复 @vampire_7998 :这位兄台一看就是南充人,<_你个痴线佬>: @-See-No-EviL-,<最后一束童年>: 图六是啥谁可以告诉我,<Ferreyra->: @Subabyy,<Adrienne_2019>: 回复 @斯托克斯倒逆关系 :😕蓝过 你居然还笑我[二哈],<斯托克斯倒逆关系>: 回复 @Adrienne_2019 :哈哈哈哈哈哈哈   看这条我就忍不住想笑  哈哈哈哈  那个emoji表情+这个文案,<斯托克斯倒逆关系>: 图六像洒出来的虫子,<BitterSweetD>: 回复 @Asher-blue :图片评论  http://t.cn/RKzYqmw,<Asher-blue>: 回复 @BitterSweetD :我拉给你吃[兔子],<JenniferQi_>: 吃货尴尬的笑了  http://t.cn/RKzYzNx,<喵小姐的沸反盈天>: @释妙清  送给你,<BitterSweetD>: 回复 @Asher-blue :想吃[羞嗒嗒],<Asher-blue>: 回复 @BitterSweetD :好像之前在路上有看到,<iijody>: @拉考244  原来是这样,<BitterSweetD>: @Asher-blue  棉花糖[馋嘴],<lucky9600>: 回复 @也刚几 :我以为是刀削面,<太白首席弟子>: 图二穿了个里昂球衣,<殷福龙>: @Sunny---晴晴晴,<Youngyoungyoungyoungyoung>: 啊…  现在就去买图7的凉粉!!!!,<云之姬兮w>: 回复 @Sandy爱吃三明治丶 :[doge],<她在时光里-RUANYANG>: @吴小吴同学要奋进了表笑  1,5,8]
2243807243	爸爸第一眼看到宝宝的瞬间，暖哭了！[心]｜来自摄影师Giedrė ​​​	[<珊珊珊要学着深藏不露>: @何威唔知改啥名,<屎味的巧克力>: @赖小刚6  [笑而不语][笑而不语],<-SHADYXV>: 回复 @Itsmzytt :凡事讲道理哇,<-SHADYXV>: 回复 @Itsmzytt :啊我真的好气啊。,<17x19>: 回复 @-SHADYXV :没素质的人越来越多了 可怕,<-SHADYXV>: 回复 @17x19 :你说话好听，有什么怎么怎么，哇，前辈还是怎样这样教导我？谢谢？,<17x19>: 回复 @-SHADYXV :我只是回复你一句 你就这么跳脚 没必要吧 老子老子的多难听,<-SHADYXV>: 回复 @17x19 :关老子求事  我发明的似的说点话,<新疆希冀>: 看我的都想整个纹身了～,<07页>: 回复 @CHENYZee :国外男性更愿意表达出感情吧,<17x19>: 回复 @-SHADYXV :有什么干净不干净的 生子是人世间最伟大的事情了,<跳小跳->: 回复 @选手 :想要女儿,<WANG-Guoqiang>: 回复 @-ZHAOLEI- :你这些天老是给我看宝宝[污][污],<喜欢养狗狗的鱼>: 回复 @Bian小乐 :保护会阴是防止裂伤。。。[羞嗒嗒],<Lew_Official>: @Swagger_Li  暖心,<Sliver-Phantom>: 十忆个孩子就剩你一个了[泪],<Alkarrrrr>: 回复 @yeyeyeo_o :[男孩儿][男孩儿],<yeyeyeo_o>: 回复 @Alkarrrrr :[挤眼][挤眼]么么哒,<Alkarrrrr>: 回复 @yeyeyeo_o :分开以后每个夜晚,<yeyeyeo_o>: 回复 @Alkarrrrr :当然是选择原谅我啊,<Alkarrrrr>: 回复 @yeyeyeo_o :？？？？我感觉有个原谅色的帽子在我头上戴着？？,<yeyeyeo_o>: 回复 @Alkarrrrr :被你发现了[害羞][害羞][害羞],<Alkarrrrr>: 回复 @yeyeyeo_o :哈哈哈哈哈哈哈哈哈哈哈哈哈  咋听的有点怪这句话  难道还有好多个？？？,<yeyeyeo_o>: 回复 @Alkarrrrr :你肯定是哭得最惨的一个,<Alkarrrrr>: 回复 @yeyeyeo_o :图9就是我,<Bian小乐>: 回复 @喜欢养狗狗的鱼 :不是所有人都会撕裂的呀，孩子小+产道弹性不错，就没问题的啊，不过也看具体的医院医生,<野马先生D>: 感同身受！女儿刚出生看到她的第一眼，那一瞬间真的可以做到忘掉全世界，终身难忘！,<Gaaaavin_H>: @暖暖别闹  [嘻嘻],<yeyeyeo_o>: @Alkarrrrr  你会哭吗,<Sanssoucci>: 回复 @如花大姐 :好像是哎,<Sanssoucci>: 回复 @玩具人Frankie :能…………吧[馋嘴],<金克丝的含义是你>: @不再会有谁像我,<okyume>: @大力是我的亲生父亲,<到底起什么傲娇的ID>: 回复 @Itsmzytt :我这边保健院一个产房好几个产妇呢   肯定不给进[衰]  但我觉得有老公在旁边更嘘  难生,<奶字>: 回复 @奶字 :[污],<奶字>: 一年后  http://t.cn/RKzLqsy,<恒三善>: 回复 @恒三善 : @卢夫三泉,<恒三善>: 没见过世面[doge][doge][doge],<MMMessiah>: @车间主任刘  [笑而不语][笑而不语][笑而不语][笑而不语][笑而不语][笑而不语][笑而不语],<张小嘿丶>: @聪聪聪聪聪王  王丑丑,<高大花花花花>: @爱上高令音真是太好啦,<Jojojo_Joey>: @heyhigh,<苏丽珍ic>: @hui_shawn,<美玖美>: 最温馨幸福的时刻[舔屏][舔屏][舔屏],<livingwithmask>: 有的是被丑哭了吧[笑cry],<勇延三点水大王>: 发现图9有问题的点个赞,<Ayuti_xoxo>: @福膳坊月子膳食,<PinkPantherxx>: 回覆 @王王王王王王同學 :可惜了，姨妈来了[doge]下个月怀啊,<-南柯长梦>: 我跟我的大外甥，挺和谐的啊[笑而不语]  http://t.cn/RK73mrK,<于大贱和王小贱>: 是被那股丑吓的吧[嘻嘻],<吖吖吖是越>: @我比伍佰还突然  好暖,<龙阿娇Elsa>: 回复 @Sanssoucci :中国宝宝一生出来就被老人抱在手里不放,<Dawn_潼恩儿>: 回复 @Itsmzytt :好像有的医院不让进，有的多交钱,<寂小寞Laura>: 现实中当了爸爸都没什么感觉的,<你没什么事>: @McKevon]
2243807243	K：接下来我简单说两句啊~[笑而不语]李安的表情亮了！[doge] ​​​	[<CARBON-Y>: 根本停不下来[哈哈],<把书翻到第十页>: 回复 @鬼使黑合法爱妻 :哈哈哈哈哈哈哈,<Peeta____>: Kristen Stewart [耶]// @一个掉了21斤肉的小仙女 ：好像暮光之城的女主啊,<鬼使黑合法爱妻>: 回复 @把书翻到第十页 :拿盘子来，这是普度众生的佛心，这是战胜困难的决心……,<郝好好好好好好好好好>: 想打字挣钱的找我[来],<slaslaby>: 我霉的小男友还挺帅的哦。同意的有多少[doge][喵喵],<把书翻到第十页>: 回复 @兌川 : @鬼使黑合法爱妻   看这个评论，xswl,<kingofmiaooo>: 男主和霉霉在一起了,<蔚湛蓝_Beibei>: 回复 @唐子豪2013 :啊？,<要当厨男>: 回复 @你不要过来哎 :她现在好帅啊,<西瓜切块9264>: 回复 @徐玥玥ss :然后呢,<肠妈咪>: 回复 @seiketu心 :她有说过的自己是bi,<Year_Imfine>: 回复 @PengX :看到这个我也是想到这句话[笑cry],<唐子豪2013>: 回复 @蔚湛蓝_Beibei :你怎么这么单纯 哈哈,<蔚湛蓝_Beibei>: 回复 @唐子豪2013 :大叔好可爱啊啊啊啊啊,<seiketu心>: 回复 @肠妈咪 :我知道之前谈过几个男的 但是最近几年都是女的 所以应该不是bi,<昌振->: 传说中关爱智障的表情[doge](无意冒犯),<美子820逸馨>: 图六的中间男估计是想掏把枪给她崩了[二哈],<高不改>: 回复 @ugopuhsub :可人家就是比你有钱有名气有地位比你颜值高有千万粉丝有人爱可你呢可怜一逼,<Freeland就是我>: 李安导演内心os：我就静静地看着你装逼[doge][doge],<Leo陈美玲>: 暮光女，克里斯汀，以后看暮光之城的时候感觉她好漂亮的[心]现在这样子也挺喜欢的，真实面对自己性取向[赞]支持你,<Natelie77>: @Craftsman工匠精神家居生活  [喵喵][喵喵],<Kera岷江二乔>: 回复 @杦桎Troye_S_Taylor :+1,<李公子小姐>: 一直看着地面说话么,<兌川>: 回复 @油爆金米花 :[眼泪],<-GI_i>: 回复 @駼忞 :她公众讲的特别快  话唠不是这样的[眼泪][眼泪],<油爆金米花>: 回复 @兌川 :你他妈[笑cry][笑cry][笑cry][笑cry],<歇栗>: @神游医生  hhhhhhh,<西瓜居然吃不完>: 回复 @一个掉了21斤肉的小仙女 :现在已经比爱德华帅了[求关注],<WfAnOo>: 最近超级迷k帅哦,<CYJaidyyyy>: @GDYaidjjjj  哈哈哈哈,<李三吨XD>: 回复 @-琬子 :李安坐姿乖巧，以及她到底说了啥,<莫色一他>: 回复 @PengX :哈哈，就是这个[赞][赞],<兔子tiny>: 李安[威武][加油],<小小乔_希尔瑞斯>: 回复 @哎Esther :哈哈哈,<亦菱喵喵>: 难得小K有这么多话  我倒挺喜欢的～,<realzyran>: 回复 @PengX :求原图！！,<酒和一三两事>: 回复 @秋田妹子 :一直fff[doge],<Tsundereonly>: @帅帅的人参酒   哈哈哈,<phibi0502>: 霉霉的新男友感觉不怎么样啊,<駼忞>: @-GI_i  你的话唠,<徐玥玥ss>: 回复 @ugopuhsub :她好像还是同性恋[doge],<徐玥玥ss>: 回复 @一个掉了21斤肉的小仙女 :本来就是她[笑cry]只不过她剪头发了,<gululubiu>: @Yi_yayiyayo   一脸慈祥[摊手],<是净贤啊>: Taylor 男朋友。。。,<唐子豪2013>: @蔚湛蓝_Beibei  [嘻嘻],<M睡不着小姐M>: 一个gif两个jpg[笑cry],<Leeshxx>: 我比较好奇她到底说了啥！,<恶魔Monsterr>: 李安:MD，有完没完  http://t.cn/RKPtuG6,<旺仔小馒头的狗狗>: 这个电影的评价可不高,<希区柯克的喵>: K好美，乔是真帅,<跋扈鬼>: 我K好帅[喵喵],<王太阳CHENXI>: 李安手里的话筒亮了,<大萌的奶酪>: 回复 @林豆斗 :哈哈哈哈 李本山,<KabhiKabhie>: 她为什么一直低着头说话，感觉不敢抬头[二哈][二哈],<_小野君oOo>: 话筒给你，你尽情表演。。[微笑],<YXiangM>: 我的k啊  你好溜啊[憧憬],<点点-咔咔科科>: 李安：编，接着编]
