2756968447	#星星的密室#如果不是看到了全图，我还以为是便秘了…… ​​​	[<蓝子控诎1>: 嘻嘻感觉好好玩的样子,<萱甄桦王道>: 星星的密室，这档节目值得看了。,<小时光wmy>: 我很支持星星的密室，我觉得很好看,<不为什么AI>: 感觉第一个出局的最惨,<魔杰座李>: 大家的努力我们可以感受到～～,<没妹梅美>: 我还是喜欢看星星的密室，对于₪这种密室逃脱类的节目没办法不看啊]
2756968447	话说。。你也大闹天宫了喵！ ​​​	[<simple番茄>: 超给力阿！[激动][抠鼻]// @时尚人美妆 : [哈哈]看你Y翻,<八卦娱乐音乐人>: 愿大家2013年更加给力[奋斗],<衷裹>: 2012没来，我的家产散光，各种悲剧[心碎]// @时尚人美妆 : [哈哈]看你Y翻,<经意往事2>: 请问：微博跟微软是什么关系？？？求解[色]// @时尚人美妆 : [哈哈]看你Y翻,<哀晓杰>: [咖啡][礼物]// @时尚人美妆 : [哈哈]看你Y翻,<句句读>: 经典！我喜欢，就应该这样,<崔玉涛育儿专家>: [哈哈]看你Y翻,<朝霞and彩云>: 猫妖！干冒充猴哥！看我二师弟收了你。// @全球时尚靓女人 : 话说。。你也大闹天宫了喵！,<杜伦兄>: 这熊孩子。。。真会玩- -]
2756968447	2012年度猫咪精彩照片集锦，张张亮点！ ​​​	[<无语症>: 太有才了// @全球时尚靓女人 : 2012年度猫咪精彩照片集锦，张张亮点！,<一直漂浮的树叶>: 一坨坨把人萌出翔的家伙~！// @全球时尚靓女人 : 2012年度猫咪精彩照片集锦，张张亮点！,<华夏茶叶招商网>: 这猫好耸// @全球时尚靓女人 : 2012年度猫咪精彩照片集锦，张张亮点！,<张M小杰>: 皮皮你快回家来吧// @全球时尚靓女人 : 2012年度猫咪精彩照片集锦，张张亮点！]
2756968447	考拉哥，您吃个苹果也要扮忧郁吗？ [偷笑] @时尚人美妆 ​​​	[<精叉>: 虹Camelo07,<紫轩阁明月姬>: 哈哈哈哈~~~~~~~~,<哥叫传说1122>: 仿佛带着一丝忧伤。。。,<海吧基神>: 哈 我也要这样~,<旭beimhoe>: 这性感的眼神 这优雅的动作 这霸气的坐姿 此货萌翻我了 ！！]
2756968447	自制blingbling美鞋~~~，这个得有耐心啊 ​​​	[<耐克李斯>: Less is more,<北京枝叶花坊>: 你是我的眼 让我看到这世界就在我眼前// @全球时尚靓女人 : 自制blingbling美鞋~~~，这个得有耐心啊,<飞边小棉袄>: 我不在，世界还在吗？创业|移动互联网|电子商务|wordpress|经济学|数学|CEO|投资|执行力|web开发|// @全球时尚靓女人 : 自制blingbling美鞋~~~，这个得有耐心啊,<北站大鼓>: 觉晓晓：有情不必终老，暗香浮动恰好，无情未必决绝，只要你记着：初见时彼此的微笑……,<撕冽一袭微凉>: 魔_登_破_坏_念／M_d_P_h_N_ Drummer Mapex Drum Artists  Talking drum Drum Technical Support// @全球时尚靓女人 : 自制blingbling美鞋~~~，这个得有耐心啊,<康丽源中医刮痧>: 甘苦自知// @全球时尚靓女人 : 自制blingbling美鞋~~~，这个得有耐心啊]
2756968447	好美的壁纸，干净的白色，暖暖的阳光，睡到自然醒吧，被阳光照耀着，就是幸福。 ​​​	[<儒释道理论与实践>: 我 孤 陋 寡 闻~！才 来 这 的~~,<马炫汝>: 此生，不负时光。// @全球时尚靓女人 : 好美的壁纸，干净的白色，暖暖的阳光，睡到自然醒吧，被阳光照耀着，就是幸福。,<哎哟涐草内mmma>: 巨蟹A型兔小妞一个！// @全球时尚靓女人 : 好美的壁纸，干净的白色，暖暖的阳光，睡到自然醒吧，被阳光照耀着，就是幸福。,<大漠一只狐>: 典型天秤座，非典型处女座,<淡看人间冷暖>: 岁月中游走一缕炊烟，把乡愁轻飘在蓝天 特别声明：本博言论由个人负责，与所在单位无关！,<年度车奴>: 做秀的。// @全球时尚靓女人 : 好美的壁纸，干净的白色，暖暖的阳光，睡到自然醒吧，被阳光照耀着，就是幸福。,<内乡师岗曹营村>: 淡泊以明志，宁静以致远。// @全球时尚靓女人 : 好美的壁纸，干净的白色，暖暖的阳光，睡到自然醒吧，被阳光照耀着，就是幸福。,<大牛牛123456789>: 真诚是使命，我的责任是履行使命,<窝窝牛牛123>: 在这个世界上总会有一个人在等着你，不管在什么时候，不管在什么地方。O(∩_∩)O~等你爱我！// @全球时尚靓女人 : 好美的壁纸，干净的白色，暖暖的阳光，睡到自然醒吧，被阳光照耀着，就是幸福。,<我的独胆>: 做一个温暖的女子，不是无所不能，不是无坚不摧，却会平复疗伤，然后继续向前铿锵！,<保定名门>: 让我们的创意在“Dreamer·异想家”栖居~ 欢迎来河南洛阳重渡沟做客~,<心说它累勒>: 一隻誤闖地球的兔子……]
2756968447	柠檬黄色蝙蝠衫，打破秋天的单调沉闷，好清新的样纸呢。 ​​​	[<啊凡健>: ▕． 難過ㄋ~ `┌就蹲丅來抱抱臫魢﹏ɑ。,<夜色卐迷离Brooke>: beautiful soul。,<杀比是你_389>: 我是个好孩子 只是喜欢纹身而已,<北方叶>: 努力，就有美好时光！,<花心爱梅玥80>: 乐于学习一切自己不知道的知识。// @全球时尚靓女人 : 柠檬黄色蝙蝠衫，打破秋天的单调沉闷，好清新的样纸呢。,<心碎奥特曼>: 我一辈子都在找自己 我是双鱼！// @全球时尚靓女人 : 柠檬黄色蝙蝠衫，打破秋天的单调沉闷，好清新的样纸呢。,<没有海面的宝>: 闭起双眼你最挂念谁，眼睛睁开身边竟是谁,<samantha学>: 让所有麻木的人们迅速的死亡，让所有的孩子快乐地成长！// @全球时尚靓女人 : 柠檬黄色蝙蝠衫，打破秋天的单调沉闷，好清新的样纸呢。,<艾秀宝宝>: 玉米一粒// @全球时尚靓女人 : 柠檬黄色蝙蝠衫，打破秋天的单调沉闷，好清新的样纸呢。,<Gt_逝>: 这个家伙很懒，她什么都没有留下......,<梦筱爱>: 实名微博；自加V字，非认证；常用昵称有志者。英文名William。,<会珍惜你的>: 喜欢摄影的老顽童。// @全球时尚靓女人 : 柠檬黄色蝙蝠衫，打破秋天的单调沉闷，好清新的样纸呢。,<_羲禾>: 在微博里，看着别人写的文字，寻找着自己的那份被迷惑了的心。// @全球时尚靓女人 : 柠檬黄色蝙蝠衫，打破秋天的单调沉闷，好清新的样纸呢。,<奇怪的电路符号>: 超级无敌温暖牌彩虹色小太阳肉包脸超人。// @全球时尚靓女人 : 柠檬黄色蝙蝠衫，打破秋天的单调沉闷，好清新的样纸呢。,<我是时光穿梭者>: 我不帅_世界二流分析师// @全球时尚靓女人 : 柠檬黄色蝙蝠衫，打破秋天的单调沉闷，好清新的样纸呢。,<龍裎岁月>: 待到秋来九月八，我花开后百花杀// @全球时尚靓女人 : 柠檬黄色蝙蝠衫，打破秋天的单调沉闷，好清新的样纸呢。]
2756968447	男士衬衫下摆的标准长度！往往品味仅是几厘米，感觉就大不同了。 ​​​	[<可爱的soulmate888>: 吾之心阁，汝置于一隅// @全球时尚靓女人 : 男士衬衫下摆的标准长度！往往品味仅是几厘米，感觉就大不同了。,<呵呵uqoghzdz7>: 法律经理人// @全球时尚靓女人 : 男士衬衫下摆的标准长度！往往品味仅是几厘米，感觉就大不同了。,<可惜ebkitq4v9>: 喜欢玩着星际，看着球赛，四处走走停停，体味人生百态,<中国独轮车协会>: 再煎熬一个月吧。// @全球时尚靓女人 : 男士衬衫下摆的标准长度！往往品味仅是几厘米，感觉就大不同了。,<茜茜瓤纫75>: 新媒体创意、传播与营销领域学者，副教授，中国十大IT博主// @全球时尚靓女人 : 男士衬衫下摆的标准长度！往往品味仅是几厘米，感觉就大不同了。,<SOSO阿龙哥>: 痛了，就放下了。,<饭都没吃大>: 运动俱乐部 健身行业 奥运会 亚运会 演艺演出 文化景区。。。继续探索前进中// @全球时尚靓女人 : 男士衬衫下摆的标准长度！往往品味仅是几厘米，感觉就大不同了。,<GOLD_蛋_ROGER>: 喜欢陶瓷不喜欢景德镇的2B青年// @全球时尚靓女人 : 男士衬衫下摆的标准长度！往往品味仅是几厘米，感觉就大不同了。,<了我了我了我了我了呀>: 莫问前生有悔。但求今生无愧。我是海豚我怕谁！咿呀咿呀哟]
2756968447	甜美韩系编发的详解，喜欢的妞们学起来啦~~~准备好了吗？做个吸引眼球的姑娘吧！ ​​​	[<_麦嘎>: 为个人主义进步而奋斗。,<20123浩__Qxl>: 一吃就胖的死胖子~,<紫色的阿爸>: 放下不等于放弃，执着不等于坚持。从奋志中领会生命, 从离妄中回归理性, 从贵真中摈弃浮躁, 从简单中澄明心境。// @全球时尚靓女人 : 甜美韩系编发的详解，喜欢的妞们学起来啦~~~准备好了吗？做个吸引眼球的姑娘吧！,<假面_XiaoHong>: 我的生活总是充满着令人意想不到的事…真不知道这是好是坏…// @全球时尚靓女人 : 甜美韩系编发的详解，喜欢的妞们学起来啦~~~准备好了吗？做个吸引眼球的姑娘吧！,<心在即是在>: 不是在吃就是在吃的路上~总有一天会被吃的拐卖~就是个死胖子~]
2756968447	老婆会告诉男人青菜多少钱一斤，情人会告诉男人夜空有多少颗星星。 ​​​	[<小斓懒懒>: 愈是长大愈是诚实，愈是长大愈是现实。星星像少女的憧憬，青菜是生活的面包，后来我们才发现星星飘然远去，变成泡影，于是，我们懂得了握紧面包~~~,<李毓萌呀>: ,,,,,,,,,,,,,,,,,<JOLIN-NO>: 因为太孤独的原因吗？,<郑源音乐传媒>: 全部| 原创| 图片| 视频| 音乐 搜索 高级搜索 关闭高级搜索 返回“全部”搜索 类 型： 原创 转发 纯文字 含图片 含视频 含音乐 时 间： 至 关键字： 搜索  #光荣绽放2012十大新锐歌手演唱会# 15进14最终晋级名单公布！中奖粉丝名单还在统计与审核当中，请大家耐心等候，我们稍,<文言古茶坊>: 经典中的经典...坑爹中的坑爹,<lancome-jason>: 差别甚大，其实男女都需要幻想。。。。。,<滴箓薇>: O(∩_∩)O~,<木槌变铁锤>: 那很多情人怎么办,<一直都在___xx>: 生活就是那么的平淡又美好,<我是彬哥啦啦>: 不爱老婆的男人不是好情人！,<熊出没大叔>: 我想知道自己存折里还有多少钱,<艺考光明行>: 红玫瑰与白玫瑰……,<神棍好大条>: 老婆在意你们的，情人注意你的钱,<张__骞>: 老婆永远都是好的。。。情人，可有可无，有情人不代表不重家庭，有时候 发泄一下会重新和老婆找到新鲜感。,<夏末Amour冬眠中>: 老婆是用来过日子的,<真实的weewee>: 老婆会给男人买衣服，情人会给自己买衣服,<红我娜>: 呵 可惜。。。。,<Too炫然妈咪>: 老婆是必需品 情人是奢饰品,<Sue小湃>: 情人与老婆的差别- -,<Muaha-UU>: 不禁又想起了小三三这个了不起的人物]
2756968447	在生命里寻觅快乐的方法，就是了解你被赋予生命是为了享受生命。 ​​​	[<奶茶泡锅巴>: [good][good][good],<依然爱吃但挑食>: 不管是快乐还是痛苦。努力地生活,<依然爱吃但挑食>: 享受命运给你带来的一切。,<迷路的洋洋洋>: 就算时光倒流，我们也别无选择，因为那个时候的我们，自己也不明白自己心中那些隐藏的线索，究竟是什么。,<波尔d7>: 有深度的女人，让人沉醉,<深海鳕鱼刨>: .......................,<Sherry-luck>: 对的[good],<一个人的天空不是孤单>: ...................,<夏夏小小米米>: ...................,<freFr爱上>: 快乐方法，享受生命]
