3230715380	今天是国际接吻日，给你们指导一下接吻的含义，赶快拿小本本记下来。 ​​​	[<九九居>: 回复 @-YIJIE- :搞笑吧不行啊哼,<bad_boy_wk>: @小姜姜姜姜姜姜,<Fleurbaby>: 回复 @_ddyslmn_ :那亲我的脚呢,<不思量33333>: @MawE133   艾特男盆友嘻嘻,<小雨的小煜>: 回复 @小小的愿望小小的梦 :亲过,<LOVE__Noralia>: 回复 @自私的小P孩 :[污][污][污],<自私的小P孩>: 回复 @LOVE__Noralia :我全都想吻,<LOVE__Noralia>: 回复 @自私的小P孩 :你想怎么吻？[小黄人高兴][小黄人高兴][小黄人高兴],<轱辘轱辘羞羞>: @Sam_de繁华巷口,<LI圣斌_>: 回复 @刘梦玲Moly :[微笑][微笑][微笑]那你就是我的人了,<___PLAYINGWITHFIRE>: 回复 @___杨YYYYYYY :那下次都来一次[笑而不语],<一道极速的金光>: @pinocchio_oo  亲爱的你看吻鼻子寓意这么好 下次给我多亲亲[doge],<疯人院里唱火锅>: 回复 @快让我亲一口阿你3 :吻哪个地方？？？,<被姜哥忽然文艺吓坏>: 回复 @搬砖小哥虾米仔 :么么么,<雪浪花逐浪>: 回复 @小才也有大智慧 :你那里[阴险],<凯凯-蒋>: 回复 @奥利奥少女楠楠楠 :我还有哪里没亲过的吗？？？,<___杨YYYYYYY>: 回复 @___PLAYINGWITHFIRE :都记下了,<没关系没关系没关系没关系>: 那个……吻屁眼子……算啥？,<iassege>: 仿佛回到了2010年[微笑],<奥利奥少女楠楠楠>: @凯凯-蒋   画重点了,<Valkyrie->: 我干脆把她的头全吻完好咯[二哈][二哈][二哈],<小胸怪萌萌的>: 我喜欢吻脖子 @围棋小肥,<___PLAYINGWITHFIRE>: 回复 @___杨YYYYYYY :好好记下啊,<爱学习的小仙女棒棒哒>: 回复 @雪地葫芦娃 :[呵呵][呵呵]你失去本宝宝了，再见！,<叶东方朔>: @湘圆琴子  [馋嘴][馋嘴][馋嘴],<自私的小P孩>: @LOVE__Noralia   快点来吻我,<陰天小阿油>: 怎么没有吻自己代表的含义？？？,<Sunrise薛_>: 回复 @Approaching-Dawn :么么么,<DEMONPOPI>: 我和男友已经一周没有亲亲，嗯……我们住在一起，现在都懒的说话了……,<入世如风>: @壬轻   我想知道吻还有两个地方是什么意思[笑而不语][笑而不语][笑而不语],<Vera_sy>: 回复 @我真的再玩一会就去睡觉 :你个坏蛋,<沐之羡>: 我也想亲我男朋友[悲伤][悲伤][悲伤][悲伤],<沐之羡>: 回复 @夏鸡鸡是我下属哈 :我以为是小女孩…,<_ddyslmn_>: @Fleurbaby  傻老婆 想你[张嘴],<蜜汁番仙人>: 回复 @LOCKON- :滚犊子,<韩-小邪>: @爱奔跑的草泥马   啊啊啊啊啊啊啊啊啊啊啊啊 亲亲亲亲亲亲亲亲,<Z张大侠i>: 请吻脖子的人注意一点好吗,<-YIJIE->: 回复 @九九居 :所以你为什么要艾特我[二哈],<麻六叶CJ>: 回复 @俆芋诘 :有啊你好好想想[坏笑],<俆芋诘>: 回复 @麻六叶CJ :随便吻,<懒蛋猪一个>: 回复 @LuminMax :哇[笑而不语],<沐烟澄尘>: 回复 @长弓三个林 :[亲亲][亲亲][亲亲][亲亲][亲亲][亲亲][亲亲],<LOCKON->: 回复 @蜜汁番仙人 :不好意思，昨天做梦亲了嘴,<九九居>: 回复 @EIGHT5s : @Karajov   [二哈],<肉泥酱qwq>: 回复 @Demon灬破晓不哭 :记下来,<九九居>: 回复 @EIGHT5s :哈哈哈哈哈 @-YIJIE-,<麻六叶CJ>: 回复 @俆芋诘 :哦我明明都做过,<在的吧>: 回复 @廖慌慌 :小傻瓜,<俆芋诘>: 回复 @麻六叶CJ :忘了 再见,<Lifeisstrugglejk1663>: 回复 @fit妹_ :舌头👅和嘴唇[张嘴],<路漫漫其修远兮-ZM>: 回复 @我素胡胡胡胡 :[眼泪],<spkoO>: 完全是啥也没想啊,<我真的再玩一会就去睡觉>: 回复 @Vera_sy :评论说全吻就是要做爱了[污],<美丽的拖拉机女神>: @淑芬芬_shufen01,<X-IAMENG>: @WynnNababy]
3230715380	截图看看你近期的运势 ​​​	[<胡哞哞i>: 回复 @任君往 :[哈哈][哈哈][哈哈][哈哈],<Allez______>: 什么鬼 一直要截瘦十斤  出来什么邂逅一个有趣的人???,<敏妹最萌>: 我想要截到哪个就可以截到哪个……,<gracecheungO_O>: 回复 @一只开心的小仙女 :被喜欢的爱豆翻牌[汗]但我并不care这个,<做个劫匪抢了你的心硺>: 回复 @略夺 :+1,<偌大一若>: 通过一项重要的考试嗯,<偌大一若>: 回复 @hoooops丶 :厉害了,<蔡涵涵chole>: 截了三次哈哈哈哈[污][污]  http://t.cn/RKbGBpn,<一只暖心的太阳>: @一剑你就笑HER0,<像极仙女>: 被喜欢的爱豆翻牌！！！！！！！喜欢诶！！！！！！！,<一个爱一>: 图片评论  http://t.cn/RK405yj,<拉苏苏苏苏苏梳子>: 再来一次  http://t.cn/RK4p70A,<奶油干酪BCf>: 某个小顽疾不治而愈[太开心][太开心],<吨吨吨吨1>: 图片评论  http://t.cn/RK4cYYO,<噼里啪啦噗噗啪>: 回复 @裴丢丢哈 :发一笔横财,<__可人__>: 回复 @_你是怎样的fan :[哼],<裴丢丢哈>: @李奕xuann   @噼里啪啦噗噗啪,<专吃小胖子的大怪物>: @专被怪物吃的小胖子,<BuSterI>: 图片评论  http://t.cn/RK4hMuN,<白描z>: @bedeadset_,<蓝蓝蓝蓝蓝色不是忧伤>: 图片评论  http://t.cn/RKUlu0j,<倦花与鸟>: 回复 @hoooops丶 :尴尬我也是[允悲],<刘3岁_>: @McLaren_poen   @123456713n   @勤奋糖果925,<远源圆的小汤圆>: 回复 @ohyeah雪雪_唯慈 :我是一段freestyle[允悲],<远源圆的小汤圆>: 回复 @ohyeah雪雪_唯慈 :你是会员呐！！！,<_芸嘟嘟>: 这什么鬼  http://t.cn/RKUXJvH,<萊兮->: 昨天刚决定要减肥！！！  http://t.cn/RKU6Urg,<0-8-0-6>: 回复 @一个人私奔丶 :不论大小至少中一次奖[喵喵],<幸识08>: 回复 @朱茸鑫 :可怕,<_你是怎样的fan>: 回复 @__可人__ :说明不管用[doge],<__可人__>: 回复 @_你是怎样的fan :截了两次都是要我再截一次，第三次截的是 变美[害羞][污],<Yumoon和猫>: 身体健康吧[羞嗒嗒] 一切就都好了  http://t.cn/RKyQjwI,<in梅姑娘>: 图片评论  http://t.cn/RKylO9B,<廉欢呢>: @__小罔__  懒得再截一次  http://t.cn/RKyKHBk,<秋木无言>: 回复 @万晨晨晨晨_ :会的,<秋木无言>: 回复 @略夺 :我也是,<BiBieva>: 很不错啊！  http://t.cn/RKyiFlY,<柚子s-wag>: 回复 @你话怎么那么多啊 :找到对象,<蛋姐姐呦呦呦吼>: 希望找到自己喜欢的事业吧  http://t.cn/RKytkdX,<朱茸鑫>: @幸识08   难道是你要送我[污]  http://t.cn/RKy5zOJ,<在抠脚的老阿姨>: [微笑]好气 我想发财  http://t.cn/RKywCwu,<ChenxIIaoyu>: 老子没有爱豆[微笑],<暗藏禾>: 回复 @略夺 :哦哦[微笑]谢谢谢谢[太开心],<WlW_ww_ww>: 回复 @nautkramA :拥有马甲线[允悲][允悲][允悲][允悲][允悲][允悲],<痴情女孩儿>: 截的第一次就恭喜我再截一次[二哈],<nautkramA>: 截一个 @WlW_ww_ww,<半拉子神话半拉子梦>: 回复 @等等最喜欢你了 :瘦十斤……,<橘rice>: 回复 @花菜姑凉 :嗯嗯 加油！,<橘rice>: 回复 @敏锅up :哇！好棒！,<桔梗啊呵>: 回复 @橘rice :我也是[鼓掌],<等等最喜欢你了>: @半拉子神话半拉子梦,<慢慢醉爱上坚果壳>: 多出一种难言的气质[馋嘴],<刘大冰块>: 我连着好几次都截到找到对象，是在逗我吗连自己都不相信[拜拜]]
3230715380	假如男朋友和12根口红同时掉到河里，你打算先救哪个色号？ ​​​	[<少年7328>: 回复 @藍艺灵 :那你救啥我不会游泳,<藍艺灵>: 回复 @少年7328 :会 但是我怕水,<少年7328>: 回复 @藍艺灵 :你会游泳吗,<藍艺灵>: @少年7328  看评论,<cccrazy_l>: 回复 @杨小妞儿倔了个强 :哈哈,<Zwwwwwen>: 回复 @你冂哥 :[爱你][爱你][爱你],<你冂哥>: 回复 @Zwwwwwen :图片评论  http://t.cn/RK42QoU,<Zwwwwwen>: 回复 @你冂哥 :[笑而不语][笑而不语][笑而不语],<你冂哥>: 回复 @Zwwwwwen :[污],<Zwwwwwen>: 回复 @你冂哥 :[亲亲][亲亲][亲亲],<你冂哥>: 回复 @Zwwwwwen :[大便],<Zwwwwwen>: @你冂哥  麻烦给我全捞上来[doge][doge],<豆芽豆芽叫我干啥>: 回复 @Along_YL :上传到空间,<Along_YL>: 回复 @豆芽豆芽叫我干啥 :相册还能装下吗,<爱吃瘦肉的钟大红>: 我更关心为什口红会掉入河？而且还是12支,<Huuff>: 回复 @ulltoo :男朋友会给你买口红哦,<ulltoo>: 回复 @Huuff :不如口红重要,<Huuff>: 回复 @ulltoo :男朋友不要了？？,<兔兔牙齿很可耐>: 回复 @南柯郡- :哈哈哈哈哈哈一股清流[喵喵],<ulltoo>: 回复 @Huuff :先一根根捞,<豆芽豆芽叫我干啥>: 回复 @Along_YL :截图,<Along_YL>: 回复 @豆芽豆芽叫我干啥 :给你买24支,<豆芽豆芽叫我干啥>: @Along_YL   看评论,<GDGMH>: 救男朋友    他可以给你买更多的口红,<文溪改昵称已被占用>: 回复 @文溪儿 :小能豆,<文溪儿>: 回复 @文溪改昵称已被占用 :男朋友最重要 反正口红男友要买,<宋烨涵-cn>: [微笑]唉 人生总是充满两难的选择 @-余尧,<TFBOYS-王俊凯w>: 回复 @我的女友嘴很贱 :有了男友就等于有了各个色号的口红[眼泪],<那只不会捕鱼的猫>: 回复 @短尾巴的九尾狐 :不，我会救你。不过要是包和你掉水里了，我就得考虑考虑了,<uuxyii>: 回复 @Devil靖喬 :这个问题太难了！,<小君依依>: 让我男朋友把口红救上来啊[挤眼],<南方的十三月下雪啦>: 不把口红给我全数捞上来你也不必上来了,<1只可爱的7妹妹->: 回复 @出肉的吴彦祖 :哈哈哈哈哈哈哈哈哈哈哈哈哈哈哈,<弦弦酱从此只对爱她的人好>: 我应该会问男朋友给我补哪支，然后我把剩下的捞上来[笑cry][笑cry][笑cry],<Yukiseooooo>: 回复 @南柯郡- : @给你辣条,<智障女神啊啊啊啊啊>: @西柚是小仙女  哈哈哈哈哈哈,<我的我的我的啊>: 救男朋友  以后有的是机会买各色口红,<半失语者>: 没男朋友 不做选择 我不会让口红掉河里的,<M-Mango-o>: 答应给你买13+口红的男朋友就救上来,<弱智又在打字找锅>: @Ira-Chernova  哈哈哈哈 你肯定要说 你还愣在水里干嘛 赶紧捞我的口红啊,<三岁书童>: 回复 @挑起战争的意大利面 :救你 然后买口红,<-Galesake>: 选色号之前能不能告诉我是谁家口红[摊手],<__sherilyn>: 想想起来就好特么心疼，我的口红[泪],<余生留给你z>: 回复 @往后全是你s :谢谢你哦[允悲],<小莎zzz>: 回复 @Duuuuuu丶 :口红啊，男朋友丢了还能找，口红丢了又没人给买哦[摊手],<Dedede_de>: 口口口口 男朋友吧 口红还能再买,<ball困困>: 回复 @小宇小仙女 :不存在的，良心不存在的,<良人未归他在明月楼>: 当然救口红啊，我又没有男朋友[摊手],<那就拥抱阿i>: 你认为我会让哪怕一支口红掉水里？呵呵呵呵[doge],<棒棒锤的皮皮兔>: 回复 @皮皮兔的棒棒锤 :你救口红我救你,<Durnkard>: 回复 @小小哆啦A夢i :嗯嗯，我爱你,<小小哆啦A夢i>: 回复 @Durnkard :怎么会 口红我多的是 你只有一个,<Durnkard>: @小小哆啦A夢i   感觉你会捞口红]
3230715380	其实关于副驾驶这个问题，我也挺好奇的 ​​​	[<-患有精神病的小丑>: 回复 @LittleBear一直都 :他和我说的，不过不用纠结了，我们准备离婚了，哈哈,<SunSunshineSs>: 结婚前副驾都是我坐 结婚后我坐 [斜眼]结婚前我老公说 别老跑后面去,<陈么么么么>: 那得看那些朋友是男还是女了,<我妈妈的女儿emma>: 能不能自己会开车 让男人坐后面？！,<小绵洋吖羊吖洋>: 回复 @梦里与她无数次 :[太开心],<大喵喵www>: 人多的话我家副驾给胖人……,<我辣么的萌萌哒>: 回复 @我那么萌我不能死 :[喵喵][喵喵][喵喵],<我那么萌我不能死>: 回复 @我辣么的萌萌哒 :[允悲][允悲],<我辣么的萌萌哒>: 回复 @我那么萌我不能死 :就载你一个[喵喵][喵喵][喵喵]其他人走路,<我那么萌我不能死>: 回复 @我辣么的萌萌哒 :所以你的回答是[费解],<我辣么的萌萌哒>: 回复 @我那么萌我不能死 :[喵喵][喵喵][喵喵],<Siri_lu>: 我觉得只能老婆专属,<装甲猫鹑宋老虱>: 人多的时候当然是最胖的坐副驾驶！！！[衰],<梦里与她无数次>: 回复 @小绵洋吖羊吖洋 :看奶奶都不扶我就服你[笑cry][笑cry][笑cry],<爷们憨憨hanhan>: 回复 @污爷V :[笑cry][笑cry][笑cry][笑cry]挺好！,<污爷V>: 回复 @爷们憨憨hanhan :擦....,<爷们憨憨hanhan>: 回复 @污爷V :有男朋友，差评！,<爷们憨憨hanhan>: 回复 @_____Ken___ :[开心] ，可以！,<健康的松树>: 回复 @盖世小魔王_ :整天看着啥都,<董叶Donny>: 人多的话 副驾驶给胖的人坐[喵喵],<井爸>: 回复 @李多人 :说得好,<LzhiY7>: 回复 @XruiB4 :我要坐车顶!！！！,<雷雯静静静>: 回复 @AD超甜的 : @田十三丶   [喵喵],<XruiB4>: 回复 @LzhiY7 :你坐哪里我都让,<XruiB4>: 回复 @LzhiY7 :吗的 肯定猪仔做啊,<DHV雪雪联盟创始人>: 回复 @范金穗儿 :我也是,<纯白纹样>: 有客人或者长辈的话，副驾驶让出来,<超跑女神_>: 我是女朋友我最酷！就算我让出副驾其他人也不会坐好嘛,<张文翰97021>: 回复 @是鹿晗最爱的坤崽 :当然是你专属的，你在后面躺的都可以。,<清国倾尘丶>: 回复 @最美的_不是下雨天 :这个问题其实很容易想通的。假如是女主人在开车，男主人在车上，还有女主人的闺蜜在。那么男主人坐副驾驶还是后面呢。。。,<布嘤布嘤zy>: 虽然说副驾驶是最主人坐的 但是安全系数没有在后座的高,<ZuxLee>: 回复 @你真好看像我 :你还没结婚吧？甚至可能没有男朋友吧？,<是鹿晗最爱的坤崽>: @张文翰97021,<请叫我大白_喵>: 回复 @蛋蛋_蛋 :你觉得呢？,<真的不胖就是有点重>: 我可以坐后面和闺密朋友聊天。给他的男性朋友坐也没问题，女的除了长辈  ，副驾驶只能是我的专属，别的女人坐过 我会觉得别人穿了我的内裤一样。恶心,<真的不胖就是有点重>: 回复 @ya深拥我 :妥妥的婆婆坐后面 一直是这样,<真的不胖就是有点重>: 虽然副驾没有后座安全。但是那是老婆的专属位置,<米妮唛哩轰>: 卖车吧 要他有毛用 家用车副驾都是正宫专座好吧。,<犬次郎w>: 高档车副驾功能没有后座好 都是秘书做副驾老板做后边,<叫我小姐姐知道吗>: 回复 @李喋喋喵喵喵 :我觉得就是该坐副驾驶啊，哪有那么多安全论，小心开车就是啦，哪有那么多领导论，家里哪来那么多领导,<叫我小姐姐知道吗>: 不要跟我说副驾驶不安全，不要跟我说领导，小心开车，没那么多车祸，我家也没那么多领导，副驾驶就是我坐的！,<叫我小姐姐知道吗>: 回复 @GaMEk1n :私家车，哪有那么多领导,<_____Ken___>: 回复 @爷们憨憨hanhan :并不代表不能观赏啊,<污爷V>: 回复 @爷们憨憨hanhan :靠.... 去看我微博,<爷们憨憨hanhan>: 回复 @污爷V :实力吹自己一波！,<污爷V>: 回复 @爷们憨憨hanhan :因为我瘦[小黄人不屑][小黄人不屑],<爷们憨憨hanhan>: 回复 @污爷V :为何,<爷们憨憨hanhan>: 回复 @李多人 :[开心] ，这个可以,<爷们憨憨hanhan>: 回复 @_____Ken___ :老铁，别人有男朋友了，扎心不,<_Lck丶>: 回复 @我承认我需要你阿 :哈？ 你会开车？你愿意开车？,<小绵洋吖羊吖洋>: 回复 @梅丽是个好姑娘 :是哒[太开心],<糖果味1224>: 我们家副驾都是我专属,<二咩咩咩20>: 可能他朋友才是他老婆,<兔子哦icon>: 副驾驶是给会晕车的人坐的[并不简单],<梅丽是个好姑娘>: 回复 @小绵洋吖羊吖洋 :这位同学就很有灵性,<CLORIS是花花>: 我男友一大堆朋友 经常载着他们来接我 每次副驾都是空的 必需要副驾 不然我也会不高兴 男友和他朋友都知道副驾给我坐]
3230715380	她跟我说俩人在一起是要相互帮助的，你帮我做饭，我再帮你检查下碗洗的干不干净…… ​​​	[<吃肉吃肉要吃肉>: 回复 @生理学导师 :嘿嘿嘿嘿嘿[爱你],<生理学导师>: 回复 @吃肉吃肉要吃肉 :我说了我做，我洗，你非要跟我抢,<张sirhello>: 回复 @不简单不间断 :很贤惠，会替我分担[笑cry],<吃肉吃肉要吃肉>: 回复 @生理学导师 :图片评论  http://t.cn/RKzFTTR,<生理学导师>: 回复 @吃肉吃肉要吃肉 :好吧 你洗 你做[doge],<吃肉吃肉要吃肉>: 回复 @生理学导师 :是你做饭吗！是你洗碗吗！,<是嘉琪呀>: @感情重症患者_,<何大烧>: 回复 @林林林林林琦 :我错了[太开心],<生理学导师>: [二哈] @吃肉吃肉要吃肉,<TTwwCC>: 回复 @小叮0712 :不行，我有洁癖，我来检查[笑而不语],<蛋蛋_蛋>: 回复 @请叫我大白_喵 :[doge][doge][doge][doge]无懈可击,<举世无争女壮汉>: 回复 @港岛妹妹丶丶 :[费解][费解][费解]大爷。。。不是我来检查嘛[并不简单][并不简单]大佬怎么能啥都干。。。不要面子的啊。。。。吼吼[鄙视],<ccandyya酱>: 回复 @成人店的网红 :想做网拍模特的来~[黄心],<小叮0712>: @TTwwCC  [doge]对不对呀对不对呀,<港岛妹妹丶丶>: 回复 @举世无争女壮汉 :真的没毛病，以后就是你做饭，我检查碗洗的干不干净。很棒，很开心。,<祝你脑残>: @你是狗m  哈哈哈哈哈哈哈,<阿树和方糖>: 回复 @方塘和阿树 :这个可以有,<塑料血>: 回复 @Mr_大大大宝宝 :说得好像你哦,<贺荧欢呀>: @咦呦喂-   呵呵哈哈哈,<1pome2se>: 回复 @王木木是lin_ :鸡贼如你啊老婆[喵喵],<遍地相思的小帅哥>: 回复 @帅比娴的巨婴猪宝 :不存在这种事还是我来,<王木木是lin_>: @1pome2se,<Mango宇干儿>: @郝好好好好好好人  很有道理！以后家里刷碗的重担交给你了！,<Turbo_booooo>: 回复 @-WANGYC- :[并不简单],<-WANGYC->: @Turbo_booooo  [哈哈][哈哈][哈哈],<来送你一朵小红花>: @bozaiii,<云散风聚i>: @喵塞塞  [doge][doge][doge],<初心依在的胡萝卜>: 回复 @爱做梦的兔兔兔 :[挖鼻],<绽放的胡胡>: 其实两个人在一起 生活中上要有互动，看书的时候偷偷骚扰一下，做饭的时候背抱一下，有这种互动感情才会一直保鲜,<Candy---DONG浩妮>: @------酱酱酱酱酱酱酱  哈哈哈哈哈哈,<IEJHC>: 回复 @IEAGI :很正确嘛,<En--Katrina>: 回复 @郫县帕克今日退役 :那是不是应该减轻一下我的负担,<郫县帕克今日退役>: 回复 @En--Katrina :那你真是太辛苦了,<En--Katrina>: @郫县帕克今日退役,<Winner潘小婷>: 棺材往左一点，再往左，诶，好好，就这样，来，放,<honey中意你>: 回复 @王雅茹彡 :我看成你洗碗了[允悲],<幻太郎想>: @三公分阳光_UMR,<阿坤生日快乐>: 回复 @我喜欢喝可乐呢 :你应该改个名字，我喜欢喝药呢，喝可乐是会长胖的,<杀气腾腾的小眼睛>: 回复 @JiNaam :。。。,<我不叫阿翔我叫阿Q>: 回复 @ndinwuiskwkvs :[允悲][允悲][允悲],<苏倩蔚>: 回复 @anderson_zhang :打手板,<ndinwuiskwkvs>: @我不叫阿翔我叫阿Q  嘻嘻嘻,<芮婆婆家的羊>: 回复 @李三妹有只羊 :李三妹说什么都是对的。,<不简单不间断>: @张sirhello   这个我也会,<大梦小半9>: 回复 @九月长安是只猫丶 :我帮你吃,<郭丶橡皮>: 回复 @丶丨Cookies :我帮你检查[微笑],<吴影跃要种很多大树>: 回复 @一个人的飞鱼 :？？？！怎么看都是我亏吧,<难道不是我最可爱>: @-Tedddddy,<Johnny-xyl>: 回复 @simple赵雅琼 :🌝,<simple赵雅琼>: 回复 @Johnny-xyl :Heng,<Johnny-xyl>: 回复 @simple赵雅琼 :？？？[白眼][白眼][白眼]几天没挨得打,<Hy白捡一个小仙女>: 回复 @吃可爱多的王小污 :没问题，我会帮你检查的，放心好了~,<巴哥咕咕>: @wuli咕咕巴,<举世无争女壮汉>: @港岛妹妹丶丶   没毛病[并不简单][并不简单]]
3230715380	看完抖音的#逆天化妆术#，以后你们找对象可要擦亮眼睛哦[doge]V佳再也不改名了的秒拍视频 ​​​	[<二冲1>: 回复 @森川均 :谢谢了大兄弟,<大一青林g>: 喜欢第一个小姐姐[心],<凉茶暖光>: 表白所有小姐姐[嘻嘻],<海超HCH>: @-WWY_Wang  最后一个像你,<小E不是非主流>: 回复 @MengzYing :瞎了瞎了,<好大個哦>: 回复 @睡了陈圣俊 :我看了好多遍 五官是同一个人的吧,<橘梗1240>: 人家底子非常好啊,<急性短暂精神症患者>: [馋嘴]想要最后一个小姐姐做我女朋友,<丁麻麻57>: 第二个 被美到了[心],<_关爱牙齿更关心你>: @Susie_ZHANG_79049,<_关爱牙齿更关心你>: @飞飞飞飞小飞鼠,<hata_3d>: 讲道理就不能不用美颜吗...整个色调都变了啊 大兄弟,<蠢得发芽啦>: 回复 @叽里呱啦批话多丶 :收费！？[doge][doge][doge],<我不是zz狗子>: 易容术没有失传[哆啦A梦微笑],<叽里呱啦批话多丶>: 回复 @蠢得发芽啦 :[白眼]我是要收费的,<蠢得发芽啦>: 回复 @叽里呱啦批话多丶 :嚯哟，好厉害[小黄人惊讶],<叽里呱啦批话多丶>: 回复 @蠢得发芽啦 :这种妆我帮你画了，对吴大师来说简单,<森川均>: 回复 @二冲1 : @露露是小仙女m   这个,<FMJ_Oxygen>: 回复 @谁都不许跟我抢洲洲 :有气质，,<17__April>: 回复 @TooObstinate :拒绝,<yiwaa275>: 图片评论  http://t.cn/RKb2MOg,<二-狗--->: 回复 @黄珠玥 :你也是嘛[亲亲],<NAN9丶>: 回复 @LIN-YIZHE :好 玩 你玩,<蠢得发芽啦>: @叽里呱啦批话多丶,<Firri_Gonzo>: 回复 @Hi-cellur :是你没错,<Hi-cellur>: @Firri_Gonzo,<小皮猪和小皮虾>: 回复 @春夏秋冬的许 :不要瞎说大实话,<zaza耳东耳>: 回复 @yaya木子木 :是不是好看[开心],<YiHuang欧>: @喵女子e    @险刺眼,<周童曦_>: @seven趙鑫,<I_llShowU>: 看到第一个感觉我好像恋爱了[doge][污],<Albumneko>: 喜欢第二个！！！,<TooObstinate>: ？？？可以下抖音嘛[二哈] @17__April,<糖不苦wen>: 第三个好好看 @儒思李,<谁都不许跟我抢洲洲>: 我超喜欢第二个  我的妈呀！！！！！ @FMJ_Oxygen,<谭卵卵_>: @冬日韭菜猪肉饺子    @粉红piger    @IfYoureGoingToSpew   很厉害,<俞楠->: 好喜欢第三[哆啦A梦花心],<-独木舟里的星星>: 跪求第一个的id,<超级赛亚人TTIng>: 你们有谁知道这个小姐姐吗  http://t.cn/RK4LExg,<超级赛亚人TTIng>: @Nauoh2  美玲在里面哈哈哈,<糖化李>: 回复 @-颠颠呀- :求告知,<智哥是个大逗比>: 化不化妆没什么变化怎么破,<马瑞l>: 第二个小姐姐好好看啊！！！！！！！,<ENFORCE->: 回复 @Zhzzz- :哈哈哈哈哈哈 黑人不,<走走0998>: 想知道第一个女生化妆品用的是啥[可爱],<通缉shy洁>: 回复 @黑猫抓不到鱼 :人家好看啊[doge],<是刘可呀>: 回复 @就爱八卦和肉肉的智慧萌 :但人家原来长的也好看啊[允悲],<不要黑我大天蝎>: 图片评论  http://t.cn/RKUWD1e,<不要黑我大天蝎>: 我跟最后一个有同款手链[可爱],<黄珠玥>: 回复 @二-狗--- :🌚除了最后一个。。其他几个本来就长得漂亮那种,<就爱八卦和肉肉的智慧萌>: @是刘可呀  结合这个看 看懂了吗[偷笑],<陈独立_>: 回复 @嘉萍子 :想看你的表演[作揖],<Ha1lstone>: 回复 @LUYuooo :我日？,<嘉萍子>: 回复 @陈独立_ :最后一个是真丑,<LUYuooo>: @Ha1lstone  看,<郑能量熹妹妹>: @老仙球要扎死大物和数电   这种,<看见猫还看见你>: 回复 @黑猫抓不到鱼 :可是真的好看啊[允悲][允悲][允悲],<陈独立_>: @嘉萍子  [doge]]
