3230715380	今天和我老婆谈了谈心，谈着谈着她就开始骂我 秒拍视频 . ​​​	[<月亮光华>: 可以挣钱[思考][赞啊] #火山小视频#,<狂风之乱舞>: 喜欢这样的软件 #火山小视频#,<懂乐儿>: 大家一起来支持火山小视频[不好意思][羞嗒嗒][hold住] #火山小视频#,<月亮光华>: 能赚钱的我都想参与呢 #火山小视频#,<Snake6m18>: 做过，不错[好爱哦] #最热短视频#,<嗨呀李>: 喜欢在火山小视频上学做菜 #火山小视频#,<chendhianhua>: 月入万元忒诱惑啦 #最热短视频#,<小伙子正想阿豆>: 我是火山小视频的常客 #火山小视频#,<吴乐乐09>: 下载火山小视频，玩玩就收入过万 #最热短视频#,<Ronan_Keating>: 你俩玩的挺欢呐[doge],<我姐除了老鼠什么都不怕>: 大哥 你是多無聊啊,<阿厉why>: 有个女朋友骂真好,<韦欣利>: 其实我挺心疼贱贱的，为了生活，为了取悦网友[摊手]要不是为了生活，谁会做那么多丢脸的事。[污]你永远的粉丝,<AdorerLe>: 妈的智障[摊手],<七八-1>: 刘文静是只公鸡吗🙃,<坚决不吃胡萝卜呀>: 就想说，这是个公鸡[坏笑],<见字如面嘿>: 刘文静说：我就看就看就看 你想咋地[笑cry],<卖牛肉干的考研狗>: 卧槽...那是一只公鸡[抓狂],<L-Yi小逗>: 贱贱你是猴子请来的逗比吗[笑cry],<ZionWilliamsonCN>: 图片评论  http://t.cn/R6J0hVW,<1LL倩>: 回复 @不说晚安咋开心 :母鸡[doge],<我不是伤心女孩>: @你真的超级帅  笑,<顽皮的指尖>: 公鸡[哈哈][哈哈][哈哈],<Mr-ZhuHP>: 回复 @不说晚安咋开心 :公鸡啊……,<Cute-ghost>: 回复 @wo不是wo啊 :清朝已经过去了老姐,<Cute-ghost>: 回复 @啧啧啧年轻人 :走错片场了老姐,<-YXWEi>: 突然发现关注了一个神经病🙄,<西红柿炒自己z>: 回复 @_我养你啊 :图片评论  http://t.cn/R6fgG5c,<我你深井冰人啊>: 回复 @脾气超好的软妹啊 :是棺啦,<啧啧啧年轻人>: 回复 @-王子阳 :马蓉婊子,<每个梦里都有你_>: 最后那几声是被静静锁喉了吧🙃,<林美荣呀>: 回复 @不瘦10斤不改名儿 :我有六块二毛八[左哼哼][左哼哼][左哼哼],<不瘦10斤不改名儿>: 回复 @wo不是wo啊 :别换了就一块两毛八,<-会飞的眉毛>: 跟鸡较上劲了还[二哈],<XIAO小别离>: 人家明明就是一公鸡[哈哈],<捡来的张美丽>: 瞅你咋滴[眼泪],<几个_果_子>: 你叫的那只是公鸡,<姑娘卖萌不卖汤>: 为什么觉得这应该是个公鸡吧？,<Mameipi>: 回复 @wo不是wo啊 :好嘛[哈哈][哈哈][哈哈],<啊牛牛牛牛牛牛牛2003>: 回复 @wo不是wo啊 :抗战胜利了吗,<做不了公主的女汉子>: 又欠收拾了～皮痒了。,<JasonNash88>: 鸡:神经病吧？SB!,<林美荣呀>: 回复 @Mameipi :行，委屈委屈我就跟你换爱国吧[笑cry][笑cry][笑cry],<Mameipi>: 回复 @wo不是wo啊 :那换爱国好嘛,<幽幽baby6>: 智障[doge],<单细胞鳄鱼>: 仿佛看到一个智障[微笑][微笑],<林美荣呀>: 回复 @fourz3 :对啊,<林美荣呀>: 回复 @刘阴天_ :对，辣鸡,<fourz3>: 回复 @wo不是wo啊 :因为下午了吗,<林美荣呀>: 回复 @今天你发疯了吗 :委屈宝强了,<林美荣呀>: 回复 @张浩瀚- :预测2017中国足球将会战胜韩足,<林美荣呀>: 回复 @fourz3 :我醒来了,<林美荣呀>: 回复 @天山可爱雪猫 :嗯呢，4g网嗷嗷快,<林美荣呀>: 回复 @就谈谈我为什么这么屌 :刚听说马航失联了,<林美荣呀>: 回复 @Mameipi :不换，只要敬业,<Mameipi>: 回复 @wo不是wo啊 :友善换吗,<-懒猴>: 可惜你对着的鸡是只公鸡]
3230715380	怎样能把女朋友宠的不要不要的  #我的女友嘴很贱# ​​​	[<Carroll菜菜>: @有只猫的毛  (ಡωಡ)hiahiahia,<LuffyOupa>: @胖子我剪个短发倍儿清爽,<是麻二妞>: @哇有一宁诶  [摊手],<遇到有趣的灵魂>: @一手店-正品折扣,<俗闺女LYL>: @李昀璐的大宝贝,<sehun_ss>: @奎宇轩a   @奎宇轩a,<Zzzz猪->: @好想重新认识你  应该这样,<小仙女的李智障_>: 回复 @李智障的小仙女_ :熟记于心,<李智障的小仙女_>: @小仙女的李智障_  贴你床头,<小鸡腿sharon>: @一口气应该吃不成胖子吧,<奈良便是鹿>: @想要转圈圈  [思考]爱你呢,<橙子hahaha>: @用户282gtti033,<考拉总是呆呆的>: @呆呆考拉de大树,<liu小兽>: 这样的男朋友给我来一打[doge],<什锦流年年>: 回复 @周静_Crystal :老公背你，你不让啊。老公的工资全给你啦。老公昨晚还吻你啦[泪],<电动马达烫>: 回复 @蜜斯Choi :下辈子我想做女人[挖鼻],<周静_Crystal>: @什锦流年年  一个都没有,<九贝勒呀>: 回复 @橘子妹妹Z :我能做到[可爱][可爱][可爱][心][心][心],<_去吧__皮卡丘_>: 回复 @mengnan吖_ :🙄,<小兔子有猫腻->: 回复 @_去吧__皮卡丘_ :[酷],<_去吧__皮卡丘_>: 回复 @mengnan吖_ :[污],<小兔子有猫腻->: 回复 @_去吧__皮卡丘_ :[摊手],<_去吧__皮卡丘_>: 回复 @mengnan吖_ :卧槽，[傻眼],<萌萌的不萌小艾>: @一生只艾一个人  [二哈],<咕叽叽Cccc>: 贱贱要是这样就不会被砍了[偷笑],<谢谢谢yi_>: @小小小小小九九_,<石Shc_jW>: 回复 @阿爆王_ww :我多好啊[爱你],<阿爆王_ww>: @石Shc_jW,<小兔子有猫腻->: @_去吧__皮卡丘_  [摊手],<玊忞>: @晗疆雪  图1是做早操？[污],<九个太阳TH>: 梦想中的男友啊！,<秋裤要塞到袜子里>: @袜子要套在秋裤上,<Watchman_z>: 回复 @你的小萌点 :[眼泪],<热风相拥>: 回复 @PINKPIGPPP :是呢是呢,<hello小姐姐的宝宝>: @Hello宝宝的小姐姐  我会努力的喔,<H八零一三>: 回复 @几寸欢喜几尺悲 :[坏笑],<iddunk>: 回复 @燁奈子 :get[思考],<hwcaine>: 回复 @等你的好时光 :好的,<周欣170>: @吴俊190  哼,<风言风语林>: @小煜一直很低调  [偷乐],<Hellogany>: @Mr__刘ty,<长腿晨的萨摩耶>: @短腿汪的柯基犬  [微笑],<哥哥雪大>: @Sharon_97  [doge][doge][doge],<zyannn_>: @Pan-Jin  [喵喵]学着点儿,<逆袭的vivian>: @全能Jiang,<我爱雯雯皮肤好好>: 回复 @WANGJW雯 :哦了媳妇儿,<日王木才>: @一只小法医   @一只小法医   @一只小法医  系统自动转发[带着微博去旅行],<请叫我李沂虹>: @WHU冉小石91  好玩儿,<这只兔子有点丑丑的>: 回复 @BYUVBYUVBYU_575 :必须的，记得收能量哦～,<这只兔子有点丑丑的>: 回复 @BYUVBYUVBYU_575 :屁！你是大部分没做到,<BYUVBYUVBYU_575>: 回复 @这只兔子有点丑丑的 :s[喵喵][喵喵][喵喵]我还大部分都做到了,<雯雯小仙女_>: @我爱雯雯皮肤好好  我只喜欢第三个]
3230715380	分享一个人生小经验 ​​​	[<琦乐mayday>: 回复 @马土豆M :睁眼说瞎话呗，嗯，学会了[思考][思考],<马土豆M>: @琦乐mayday  知道了吗,<悟空你在哪里啊>: 回复 @乐伢伢伢伢乐 :抓住关键词。显得,<过往伏笔An>: 首先你要有个女朋友,<白首不分离丶Lx>: @愿得一人心丶Ys  [思考][思考][思考],<乐伢伢伢伢乐>: @悟空你在哪里啊,<cherry哒ing>: @anyThing_1993,<元气少男张大奎>: 图片评论  http://t.cn/R6ao6CN,<月比比_>: 回复 @BHAOCHEN :油嘴滑舌舌[疑问],<BHAOCHEN>: 回复 @月比比_ :这个我最会了,<是斯儿呐>:   @iakeng,<Ss随衍>: 回复 @Puss :？你照相不好看一定是因为化妆品不好,<编辑昵称支持中英文符号>: @Wong-大小君子  它们衬不起你,<周璘君的前女友>: @谭某某  [微笑],<Puss>: @Ss随衍  你瞅瞅你，咋那不会说话,<一自夕王>: @青锋所向_989  [doge],<来吃鱼鱼鱼>: @锦妈锦妈  [微笑][doge],<一只璐璐璐璐璐璐路>: @Cc崔晨  [笑cry],<小江南喵喵喵>: @给你最好756,<ItsRealXueyi>: @ALLforNeige  哈哈哈哈,<孟叔叔是个小可爱>: @用户z969z7rcq2,<赵柔宇>: @一Cheese一,<嘻嘻哈哈65270>: 回复 @阿潇o :额（︶︿︶）=凸,<李四有个烟灰缸>: 回复 @四个一两个火 :[偷乐][偷乐][偷乐][偷乐],<蒲声hui>: 做男朋友的都该关注你[微笑],<四个一两个火>: @李四有个烟灰缸,<请叫我牛仔不是ZENG扬呐>: 回复 @林嗨呀嗨呀停 :[挖鼻],<一梦2Amor>: 回复 @亲亲嘴巴嘛 :好像这个要求不难,<Alene_Vagabond>: @Leo_Khairi,<-罗咏仪咏罗>: 回复 @余业津 :哦,<隔壁小琳>: 难怪这么多人没有女朋友,<一粒沙白c>: @后海浮沉  先说不乱,<赵赵赵雨玥---ZYY>: @Belong玥玥玥玥,<瀝源街野狗>: 回复 @-罗咏仪咏罗 :良心过不去,<PLEASETRYYOURBEST>: 回复 @a_胜楠不是男生 :一点都不真诚[微笑],<a_胜楠不是男生>: @PLEASETRYYOURBEST  快get,<U趴__>: @糍zii  教学博,<朱宏_Zeero>: 回复 @s_Yankee :哈哈哈、got it,<s_Yankee>: @朱宏_Zeero,<阿潇o>: @嘻嘻哈哈65270,<林嗨呀嗨呀停>: 回复 @请叫我牛仔不是ZENG扬呐 :你应该学学,<请叫我牛仔不是ZENG扬呐>: 回复 @林嗨呀嗨呀停 :我找找有没有黑人问号,<林嗨呀嗨呀停>: @请叫我牛仔不是ZENG扬呐,<商高青年>: 回复 @Star丶11 :记住了！,<Star丶11>: @商高青年  记住了吗！,<嘿兔咪>: @唯一Lst  看看,<虾条同学Ron>: @与光相拥  记笔记,<练不出腹肌不改名TAT>: 墙我都不扶，就服你[赞],<一袋chips>: 回复 @3chips :可以的,<3chips>: @一袋chips,<Donvy->: 回复 @OLongJuan :受教了,<OLongJuan>: @Donvy-  ？？？？上哪学的,<hustle1>: 回复 @hustle1y :[挖鼻][挖鼻][挖鼻]]
3230715380	女朋友减肥失败的原因终于被我找到了 #我的女友嘴很贱#  左克朋的秒拍视频 ​​​	[<诗小骚丶>: 大家都喜欢[微笑] #火山小视频#,<4z34-六楼>: 大福利大福利哈哈 #火山小视频#,<捕鱼达人3075453582>: 抓紧下载吧[嘻嘻] #火山小视频#,<吐槽sb6120>: 机会难得哟[心] #最热短视频#,<老男孩之杨仔篇>: 谢谢你火山小视频，是你陪我度过每个无尽的黑夜 #火山小视频#,<boom虾卡la卡>: @boomlakao,<罗敏iiiii>: 回复 @安啦 :这个配音是贪吃蛇大作战,<带不上口罩的一只耳>: @Devilgg,<_小豆仙>: @_千尘可可Cylin,<莫矫晴>: @橙子橘里  哈哈哈哈,<酒驭清风>: 回复 @潇余生 :像极了,<用户5836574408>: 回复 @安啦 :，我想找金星老师智询重庆那位和她跳午张先生的联系方式也就是他的电话吴码。一,<Ranpo_浦蒲>: @Ranpo_麦家乐,<Air--land>: 回复 @-Milko_ :张嘴，要不要喝可乐,<_MinKing_>: @-Juico_,<陈渝欣__>: @Paul黄ZP,<YIFIR>: @CasillasRonaldo  我觉得很有道理啊,<夷陵撩祖_魏无羡>: @落花恋清声  哈哈哈，我也要！,<芒果冰沙i>: @我就叫杨晓伟丶,<hey蒙>: @变成一个blingbling小瘦子,<关尓林夕>: 欢迎来到王者荣耀,<水果味儿的小顽皮>: @奂臣  [摊手][摊手][摊手],<她说丶___________>: 回复 @娇软的风 :来我喂你。,<我是一只粉色豹>: @年紀輕輕只十六半的南海姑娘,<Ranpo_浦蒲>: @Ranpo_麦家乐  搞笑,<最大号东云>: @Passersby-King  哈哈哈,<我是小小小小小小丸子>: @文武双全小男人  [二哈][二哈][二哈],<wuli_Qiong>: 我以为我吃一口不会胖的[doge],<Angela咚>: @Raphael为你发光,<苦乐与共说>: @一人行-者  [白眼],<BlingBling_HM>: 回复 @BlingBling_Lwz :嗯呢,<编辑昵称0000000000>: @我好傻好傻好傻,<Hallopyy>: 回复 @Ann_Cho :[doge][doge][doge],<廖珂peer>: @PPPOPEER,<Ann_Cho>: @PollyPyy  [笑cry][笑cry][笑cry],<Annl-p>: 哈哈哈 @Jay-小神丶,<宇哥吃了我的脑子>: @-坛城设计-  哈哈哈哈哈哈哈哈……哔……,<宠兔儿>: @她说丶___________,<今夕何曦兮丶>: @Click229,<阿亓家那棵桃子树>: @我媳妇儿该不会是个傻子吧  你就是这样的,<帅气的大茄子>: [生病] @巴拉巴啦巴啦,<高冷的冰箱哥哥>: 回复 @阳光灿烂的sb :哈哈哈,<阳光灿烂的sb>: @高冷的冰箱哥哥  我也不知道为什么就是想 @你🙈,<吃饭叫我ahh>: @SsLlMm1,<Holdmyown王振爽>: 回复 @Chen__vV :[黑线],<Chen__vV>: @Holdmyown王振爽,<美丽动人健康>: [心][心][心]我从122斤到90斤[鼓掌][鼓掌]想瘦快快来问我[飞吻][飞吻][飞吻],<i王豪堂>: 回复 @i劉嘉欣 :现在都是二摊走起[眼泪],<小雨wowo>: 回复 @Tiamo_屹 :哈哈哈 siri,<Tiamo_屹>: 回复 @小雨wowo :哈哈哈哈 她一开口我就笑了,<啰哩啰嗦L>: 回复 @舒克爱飞机 :哈哈哈  好2,<小雨wowo>: @TiAmo_屹,<吕佩馨Seven_>: @HT_Wow  快回城啊[馋嘴],<Chan417oo>: 最后的那个音乐叫什么名字？,<孙紫鹤>: @何雅轩是双子座,<叫我Xx丶>: 回复 @i-黑猫 :你会怪我的，怎么不管管你。,<i-三分之一>: 回复 @叫我Xx丶 :可以啊]
3230715380	留住男朋友的心只需要70招，一招是给他做好吃的 ​​​	[<哦咩>: 回复 @张家浩how :你要走吗[拜拜],<就倪一天到晚叭叭叭的>: @我就叭叭叭的  快点留住我,<老胡的小迷妹_>: 回复 @LRuuuu :什么意思啊,<-颜修>: 回复 @UncleYoung不是胖子 :为什么保存不了诶,<_猫作>: 回复 @安啦 :看了评论还是不明白,<正经的苏苏ss_>: 回复 @我不是美人却蛇蝎心肠rui  的赞:已私,<李帅686>: 回复 @mLucky-- :所以，到底是什么图片,<患得患失iiks>: 回复 @安啦 :没看到 但看你这条评论我懂了,<心态不能崩>: @stubborn355,<毛小可爱>: 回复 @Ricardo-_-_- :可以  http://t.cn/R65blAG,<一生着迷qaq>: 回复 @阿懒才不怪 :求原图,<猫车八百万>: 别想的太污，剩下的69招是如何做出吃了之后半身不遂的菜,<祁燕yan>: 回复 @你看他像只狗 :什么东西,<叫我靓仔咯>: 我就不懂有什么好怕的  http://t.cn/R65zklx,<你说要追一辈子的黄五岁吖>: 回复 @拜托叫我傲娇受 :不留不留，快滚,<正经的苏苏ss_>: 回复 @峩是叶薇 :优酷我这里140是充给你自己帐号的,<啊啊阿啊啊啊啊啊啊嚏>: 剩下69式[doge][doge],<好好阿四i>: 回复 @全微博界最帅的人 :图片评论  http://t.cn/R6q1WnC,<mmmmmmhy>: 回复 @正经的苏苏ss_ :想看,<HaHaccp>: 回复 @偶尔还是会难过啦 :什么图啊,<前女友性冷淡所以分手了>: 我跟贱贱一样也想发个？。我看了评论也没看懂求解。[摊手],<峩是叶薇>: 回复 @正经的苏苏ss_ :我的优酷年会马上就到期了，当时是80买的，只可惜今年他没有了[泪][泪],<江颖琪小朋友>: 回复 @偶尔还是会难过啦 :好害怕我都不敢随便看图片了,<我是你楠朋友啊>: 回复 @sssyyyya :我想看，老哥私信发给我好么？,<这个名字很有道理>: 回复 @偶尔还是会难过啦 :卧槽，咋的我把手机丢开了,<hopetoseeyou>: 回复 @偶尔还是会难过啦 :什么图啊…？,<cccc阿东>: 图片评论  http://t.cn/R6qHcsY,<lms李小霜>: 回复 @sssyyyya :什么东西,<许日天_>: 回复 @三岁然 :犹豫了很久点开了你的图片[污],<混子辅助i>: 回复 @正经的苏苏ss_ :啥图，能私发嘛谢谢,<UncleYoung不是胖子>: 回复 @大傻儿子 :图片评论  http://t.cn/R6qjE6g,<给你一把小花>: 回复 @正经的苏苏ss_ :求,<Kill_Me_Heal_Me__>: 回复 @sssyyyya :兄弟我也想看,<Dyvcchbv>: 男朋友在哪[doge]你的女朋友在这,<香蕉味的奶精娜>: 回复 @粖小静 :？,<叫我田大毛>: 回复 @叫我陈大毛 :我看了下边评论才懂！  太污。不过我不用给你做饭了 我会剩下的69就行了[坏笑],<YO_COOKIE>: @钟少宝___  所以光凭一个意大利面留不住你🙃,<似水流年是非终成空>: 图片评论  http://t.cn/R6qI41f,<总算听话了>: @尔康大战容嬷嬷_  [doge][doge][doge][doge],<野性娇软>: 回复 @sssyyyya :现在在沧州[二哈],<野性娇软>: 回复 @sssyyyya :是阿近的很[二哈],<sssyyyya>: 回复 @怂恿GUO :老乡？,<野性娇软>: 回复 @sssyyyya :河北[二哈],<嗨呀好气啊->: 回复 @卖毒鸡汤的小哥哥 :哈哈哈哈哈哈我懂了,<痴情女孩儿>: 回复 @偶尔还是会难过啦 :感谢提醒   我就不看了  顺手举报了🙃,<下自成蹊xi_>: 回复 @偶尔还是会难过啦 :谁能告诉我是什么图片[笑cry]不敢看又想知道,<赵淑女阿>: 回复 @sssyyyya :我想看一看!,<L-Yi小逗>: 回复 @后背给你 :什么意思，完全不懂[疑问],<-思和远方>: 留住女朋友的心也是[心],<可爱活泼>: 回复 @偶尔还是会难过啦 :好想看[二哈],<养只哈士奇好么>: 回复 @sssyyyya :给我看看]
3230715380	这周六下午，成都太古里，有时间吗？ ​​​	[<芒椰西米露->: 回复 @大长腿妍妍 :可以说是相当尴尬了,<坂京一>: IFS熊猫屁股下集合？？？[doge],<弯个哩个弯>: 回复 @大长腿妍妍 :哈哈哈哈哈,<吃药因为你有病_>: 贱贱要来成都了！,<好自为之mj>: 欢迎来成都[嘻嘻],<我真的叫男神>: 回复 @大长腿妍妍 :图片评论  http://t.cn/R6qwRdb,<蟹蟹晴>: 来啊，大熊猫屁股下面集合,<楠楠缦缦>: 没时间，我要约刘文静[二哈],<CHENLIERmomo>: 没有耶，正好出去玩,<迥迥迥迥>: 回复 @大长腿妍妍 :哈哈哈哈哈哈哈,<Xxxzhiiii>: 难受刚刚从成都回来,<徐建于>: 回复 @Faerie是我 :不客气[偷笑][偷笑],<智商为负的天才>: 回复 @徐建于 :好勒，感谢提醒哈哈,<徐建于>: 回复 @Faerie是我 :[阴险][阴险]是吧，所以你们小心了，最好带把伞,<坏坏电话大海与我>: 回复 @我的女友嘴很贱 :我在成都呢,<智商为负的天才>: 回复 @徐建于 :那你很棒棒哟[笑cry],<李雪梅喜欢韩庚啊>: 回复 @雪姐耶luck :看网红[doge],<雪姐耶luck>: 回复 @李雪梅喜欢韩庚啊 :什么呀,<李雪梅喜欢韩庚啊>: @雪姐耶luck  [坏笑]走,<烟雨迷蒙灯初上>: 回复 @大长腿妍妍 :没忍住抱歉,<秋哥要考研>: 来  http://t.cn/R6G4z8g,<蜀都第一采花贼>: 如果是人挤人我就不来了 逛街可以顺便看你一眼,<怎么讨厌我>: 这周刚打算去成都见网恋奔现的女朋友。贱贱 真的是在大熊猫底下嘛。几点,<c7a7i7R>: 回复 @大长腿妍妍 :哈哈哈哈哈哈哈,<徐建于>: 回复 @Faerie是我 :我已经准备好番茄酱蹲守在ifs外面了[阴险][阴险],<徐建于>: [阴险][阴险]来呀！,<左蜜baby>: 回复 @大长腿妍妍 :笑死了哈哈哈哈哈哈哈哈哈根本停不下来,<雯柔妹子呀->: 我在成都的时候你咋不去,<亲亲抱抱举高高fy>: 没有，我要回家[哈欠],<智障咋滴啦>: 来湖南啊[摊手][摊手][摊手],<Jamieeeeee_>: 回复 @大长腿妍妍 :室友在睡觉 忍的有点辛苦,<一碗素剪粉>: 不约 [拜拜]    你去嘛  辣死你,<alone533>: 来啊来啊，我在双流,<有没有比较二的名字>: 熊猫钩子下面求偶遇[摊手],<Vanessa快给kobe生儿砸>: 我…下周才来，你[doge][doge][doge][doge],<1997-03-05>: IFS 大熊猫钩子底下,<特立不独行的小鱼人>: 你来了我就去啊[心],<颜色-型号>: 来吧，可以专门为你买刘文静同款菜刀[doge][doge][doge],<该是怎样的慕夏_>: 刚去了成都[拜拜]没有缘分了贱贱,<永远都是白小棋>: 在熊猫钩子地下？,<冻冻冰棒>: 回复 @大长腿妍妍 :哈哈哈哈,<容生与世>: 有有有！！！！！！,<都叫我包子>: 回复 @大长腿妍妍 :6666。真的没毛病,<露大神up>: 气死了，一到外地去上学你就知道来成都了！,<二只草莓>: 为什么大V都不喜欢来天津 是欺负我们离北京太近吗[摊手],<你胸大你先来丶>: 有的 你要来 我就会去[微笑],<入坑H1Z1的大屌萌妹>: 来吧贱贱、带上静静.喔静静记得带菜刀[喵喵],<只喝露水的刘琳诗>: 熊猫钩子下面等你不见不散,<沐沐沐丶枫cccb>: 回复 @大长腿妍妍 :很皮,<卖面膜的小鲜肉i>: 回复 @小萌叶Hazel :[doge],<leesuperman>: 我就问刘文静来吗,<卖资源的小女孩呐>: 各种影视资源，动漫，电影电视剧永久一些被禁的禁片，耽美剧，更多肉文小说，更有热门综艺。各路资源应有尽有，只有你不知道，没有我找不到的资源！！]
3230715380	来聊天，在线回。（可以问点有技术含量的问题） ​​​	[<橙橙橙橙玲>: [喵喵][喵喵][喵喵],<叻興>: 我喜欢刘文静[可爱],<野野野瓜>: 回复 @不倒翁睡着了 : @刘文静,<琴师没有琴_>: 不知道过了两天，还会回吗,<蛋蛋keke>: 天王盖地虎，贱贱两米五[二哈][二哈],<sedxxxx>: 你并没有回复我[摊手],<-_fighting>: 回复 @名字被占不知所措的宁宝宝 :为什么我化悲伤为食欲了[衰],<贱贱喵小姐>: 反正回了那么多，还没轮到我,<彗cutey_>: 手痒了？所以发这个博,<最爱吃肉最爱你>: 两次都没回我，再信你我就是傻子,<好好看的韩梓菲>: 回复 @林深时见鹿啊11 :有些字看看就行了 憋认真啊哈哈哈,<猫和酸奶1113>: 回复 @好好看的韩梓菲 :那你是不是真的好好看,<猫和酸奶1113>: 回复 @好好看的韩梓菲 :图片评论  http://t.cn/R65avJe,<好好看的韩梓菲>: 回复 @林深时见鹿啊11 :[摊手]然而我就是,<十年20057>: 我看到你去老邢的直播了,<盖世小仙女哇>: 如果忘记渣男？？？[污],<秋盹啊>: 我女朋友不喜欢我我想绿了她,<KK需要一杯牛奶>: 如何找到女朋友？？？？,<一天di世界--亲亲家家>: 今天都23号了，再回就有点不讲道理了，不过问一下吧，一个人，有没有可能同时喜欢两个人？,<Ai大妮儿>: 都说主动会有故事，我这我怕会出事,<到处找窝的hhh>: 你十次有几次超过五分钟？,<到处找窝的hhh>: 可以送我1688元人民币吗,<晚睡美少女>: 哇 贱贱不会一直都在吧！,<大匆佔酱>: 机智的我 按时间看评论，发现你果然没有回复[二哈],<一杯咖啡不加奶加糖>: 我觉得不会回复了，毕竟一万多条呢,<韩韩哥的小迷妹QAQ>: 可以回复我给你发的私信吗,<苏八没有书>: 为什么你那么贱？,<他是阿葰宇宙無敵小英雄吖>: 回复 @我听你的声音 :宝宝找不到[doge],<橙橙橙橙玲>: [喵喵][喵喵][喵喵],<叻興>: 我喜欢刘文静[可爱],<野野野瓜>: 回复 @不倒翁睡着了 : @刘文静,<琴师没有琴_>: 不知道过了两天，还会回吗,<蛋蛋keke>: 天王盖地虎，贱贱两米五[二哈][二哈],<sedxxxx>: 你并没有回复我[摊手],<-_fighting>: 回复 @名字被占不知所措的宁宝宝 :为什么我化悲伤为食欲了[衰],<贱贱喵小姐>: 反正回了那么多，还没轮到我,<彗cutey_>: 手痒了？所以发这个博,<最爱吃肉最爱你>: 两次都没回我，再信你我就是傻子,<好好看的韩梓菲>: 回复 @林深时见鹿啊11 :有些字看看就行了 憋认真啊哈哈哈,<猫和酸奶1113>: 回复 @好好看的韩梓菲 :那你是不是真的好好看,<猫和酸奶1113>: 回复 @好好看的韩梓菲 :图片评论  http://t.cn/R65avJe,<好好看的韩梓菲>: 回复 @林深时见鹿啊11 :[摊手]然而我就是,<十年20057>: 我看到你去老邢的直播了,<盖世小仙女哇>: 如果忘记渣男？？？[污],<秋盹啊>: 我女朋友不喜欢我我想绿了她,<KK需要一杯牛奶>: 如何找到女朋友？？？？,<一天di世界--亲亲家家>: 今天都23号了，再回就有点不讲道理了，不过问一下吧，一个人，有没有可能同时喜欢两个人？,<Ai大妮儿>: 都说主动会有故事，我这我怕会出事,<多血质者>: 最渺小的我 [摊手],<李兆奇>: 现在应该有些晚了吧      贱贱[悲伤],<吹神的樱桃>: 可以看见我吗！！Hey！！回复一下够我开心一整天的！！！[doge],<欢欢凉凉>: [惊恐] [惊恐]来得及吗，贱贱,<FRM1114>: 回复 @我的女友嘴很贱 :一百分通过。哈哈哈,<噢耶噢漏噢买噶i>: 你回复我一下会死吗,<薛定猫的鹅_>: 喜欢一个女生  却不知道该怎么做,<查理布朗与朱莉露西>: 我就不信你今天还在]
