3230715380	女生喜欢吃零食有两个原因：一，这个好吃男朋友不吃；二，哎呀卧槽这个真他妈好吃。 ​​​	[<南子钦>: 回复 @Aug-Apr :好吃你就多吃点 哈哈哈哈,<清蒸团子>: 回复 @朋克左 :哇113[赞],<少女有泥_>: 回复 @朋克左 :你们再点赞不就满足了他长生的愿望了嘛[doge],<周盖伦丶>: 喜欢吃零食需要理由吗[doge],<marshallbluce>: 回复 @某公某主某 :吃吃吃都给你,<Takikun->: 回复 @朋克左 :恭喜恭喜111岁了[doge],<薛智月小姐姐>: 回复 @王琳策大哥哥 :[怒骂],<王琳策大哥哥>: @薛智月小姐姐   你一定是哎呀卧槽这个真他妈好吃,<FINEFINEL>: @为什么要取这个名  是你,<曲师大校花>: 回复 @我和智障蓝朋友的日常 :被我发现[羞嗒嗒],<晶晶杨么么哒2>: 回复 @可乐大叔 :[笑而不语][笑而不语][笑而不语],<一择小铺>: 蜂蜜杏仁  http://t.cn/RorxZ0R,<猫屿少女纪>: 回复 @可乐大叔 :呕！晕车,<三璐三璐你是超人啊>: 回复 @朋克左 :马上百岁了,<奶油味的鱼>: 回复 @可乐大叔 :因为下面可能海鲜味的 [黑线],<少女元气不足>: 回复 @朋克左 :哇，88了,<Jzwww丶>: @妈妈说鼻子长长会漂亮,<某公某主某>: @marshallbluce,<凯哥的小祖宗->: @Forever_Paranoid,<就吃一口嘛>: 回复 @不要在乎名字丶 :我不爱吃！！！！[二哈],<名称不为空_小太阳>: 回复 @朋克左 :噗～80了高寿高寿,<余bb_>: 回复 @不用你来看我了 :我下面给你吃吧,<路途遥远LY>: 回复 @余贵气宽 :还真没吓到[允悲][允悲][允悲],<m泼我香槟>: @奏响天籁i之音,<一个会画本子的少年>: 回复 @朋克左 :61大寿,<哎呀我怎么摔倒了>: 回复 @朋克左 :60大寿呀,<不用你来看我了>: 回复 @可乐大叔 : @余bb_  [微笑],<不用你来看我了>: @余bb_  管你吃不吃 反正我吃了,<夜色的德令哈>: 回复 @你爸 :你叫你爸幹什麼呢,<我的同学说>: 回复 @朋克左 :哇，53了,<淑芬的小哥哥>: @Mau_zing,<chen璇cx>: 回复 @温柔加多宝 :才不被你套路,<温柔加多宝>: 回复 @chen璇cx :我跟你抢过？,<爱笑的女孩最吓人>: @我会是你的小宝贝咩,<噼里啪啦机智蘑菇睿>: @曲师大校花   哈哈哈这个真好吃 哈哈哈这个也好吃不能给男朋友吃藏起来[哈哈][doge][doge][doge],<Chenj-->: 回复 @可乐大叔 :老哥 货车都不如你开的稳妥,<Chenj-->: 回复 @落魄的段子手 :表示同意,<时间过得比时钟还慢>: 还喜欢屯[摊手]  http://t.cn/RoBj8zx,<阿杨cv>: 回复 @出国的男孩 :求原图,<小太阳ooe>: 我喜欢吃的一定要带着男朋友，把不喜欢吃的好扔给男朋友[拜拜],<00335yh>: 饿的不要不要的[并不简单],<Hanliry>: 回复 @cshbchm :男朋友不吃是因为不敢跟女朋友抢零食吃,<我是一面热评墙>: 回复 @-木南子啊 :[doge],<-木南子啊>: 回复 @我是一面热评墙 :确定不关注[微笑],<阿卓玛->: 回复 @陳俩個 :东北大辣片,<_耍耍__>: 回复 @_文文文文文文武 :[并不简单][并不简单][并不简单],<招子放亮点->: 回复 @五月天少女 :没看懂呢,<刺猬也爱啃榴莲>: 哈哈哈哈哈哈哈 @笑渐不闻l,<wygsiji>: 回复 @朋克左 :恭喜你 三十岁了,<龙王喷汽水>: 回复 @仙女冒气泡 :那就是好吃,<五月天少女>: 哦？ @招子放亮点-,<roundwanzi>: 回复 @沥爹 :[二哈]么么么一起吃嘛,<钱二百>: 回复 @可乐大叔 :你为什么不体贴一下灯光师[摊手][摊手][摊手][摊手],<章梓卉>: @保护我方章梓卉]
3230715380	当今社会的几大错觉：有人敲门，手机震动，我能反杀，Ta喜欢我，欢迎补充_________ ​​​	[<晓仙女的咸鱼跟班>: 手机震动一下都觉得是她的信息。,<我的店叫南方>: 洗完澡跟美人鱼上岸了一样[摊手][摊手][摊手],<萌萌的村花亓>: 少吃了一定会瘦[允悲],<喵喵喵喵198212>: 我觉得他喜欢我不是幻觉啊[doge],<万周鑫鑫鑫鑫鑫鑫>: 回复 @o甜诱o :张文静说不能操她,<文人墨客ww>: 那个美女一直在注意我[doge],<猴子干>: 我能悄悄地放一个无声屁,<郁离子0905>: 手机快没电了 都82%了!,<ANITTA-H>: 总觉得自己打小被抱错了，其实自己是有钱人的子女，如果亲生父母来找我，我要回去吗[笑cry][笑cry][笑cry][笑cry],<IUUIZzz>: 有人叫我[嘻嘻],<美美美美美金>: 后期能发育好[挖鼻],<美美美美美金>: 敷张面膜就能变美了[挖鼻],<请你喝酒y>: 回复 @蛋蛋-688 :打破224赞 0回复[doge],<我想做个怪人啊>: 我现在都变好看了，前男友见着我肯定得后悔死了[喵喵],<Dear懒懒酱丿>: 洗完澡之后 最美[doge][doge],<NE-CO君>: 他跟我闺蜜之间没什么,<大饼总攻>: 回复 @相差十七 :啊，真巧啊  http://t.cn/RoedLiz,<隔壁的温同学>: 洗完澡感觉自己是仙子（可能脑子进了水）,<RainbowcandyWw>: 我瘦下来真的好看  毕竟有五官在  现在只是放大的美而已[瑜伽一],<1见你就笑的微博>: 说不定他也喜欢我呢,<1见你就笑的微博>: 他会来找我[doge],<1见你就笑的微博>: 没事先胖着 福放假就瘦了,<相差十七>: 回复 @大饼总攻 :哥？我微信QQ头像也是这个，名字是咸鱼老攻[挖鼻],<ZackXuzy>: 左克朋长得帅[二哈],<哈伦poppin>: 浴室能变选秀舞台,<男朋友89998>: 怀疑自己怀孕了……,<学不会喜新厌旧>: 买彩票会中五百万,<多啦a梦要减肥了_>: 我这次放假回家一定会好好写作业,<白兔子和井胖子>: 回复 @迷人的小怪兽- :洗了头会变漂亮,<曐曐吶>: 我最美，我腿长1米8，我可以称霸天下,<西顾1987>: 我不丑只是不爱打扮,<方方梅方方>: 我就蹭蹭不进去[喵喵],<Shanyu919>: 百分之一的电感觉还能再撑一会,<泽终>: 我不爱他[喵喵],<特特特特特蕾西>: 考的都会[doge],<wuli菜菜嘿>: 我就出去逛逛不会花钱,<顾若婷阿>: 还能和好[伤心],<張高高哦>: 我是被上帝选中的孩子,<位小雨天王>: 回复 @陈九斤_ :老感觉她在看我[眼泪],<位小雨天王>: 回复 @crossoverJie :每年都带书，每年都不看的举个手[doge],<位小雨天王>: 回复 @大饼总攻 :认真学，真的能及格,<痴情女孩儿>: 少吃点就会瘦一点,<王茜__wangXI>: 身后有奇怪的东西,<璇子啊你呦>: 下午数学会考好 [眼泪],<-加贝i>: 会变有钱[傻眼],<李欣欢欢欢啊>: 压线就能上重点[拜拜],<易个迷候韬>: 这个赛季肯定能上黄金[喵喵],<时光里的兔子>: 怀疑自己没锁门[doge],<祈祷少女心mia>: 我还有钱。。。。。。,<云中城堡_916>: 她不喜欢我 为什么主动来亲我[doge]]
3230715380	可以说是相当曲折离奇又黯然神伤的故事了 #闲着会惹事# @闲鱼 ​​​	[<胖成肉球球呐>: 是不是这个点评论你都会被回复🌚,<Mario吃到毒蘑菇>: 脊梁骨一丝丝凉意,<安然19941019>: 后悔买新手机时没卖，用不上还担惊受怕[哈哈],<zp灬yuan>: 大家有没有人关心一下湖南宁乡啊，我妹早上从娄底坐车回家，几个小时前途径宁乡现在失联了[伤心]很着急……不好意思，占下楼…… #湖南暴雨#,<_静静家冷吃>: 遂不及防来个广告  那我也打个广告   四川冷吃自煮小火锅酸辣粉想吃的找静静[二哈][二哈][二哈]  http://t.cn/RouWXmL,<宁妮l>: 回复 @我的女友嘴很贱 :？？？？？我这是第一次评论你的微博！！而且你就回复了？！！我是不是很幸运？,<__瑶阿瑶>: 我一条裤子挂在闲鱼很久了都没人买[doge],<我的女友嘴很贱>: 回复 @A宁妮儿 :不能说很酷，要说中等酷,<我的女友嘴很贱>: 回复 @一只猎奇的狗 :我数了一共65个6,<污污污嘿咻火车>: 上车[爱心]️开车了[爱心]️[爱心]️,<慈善部份亮眼I3>: 简单点，说话的方式简单点,<卷芯modify菜>: [doge][doge][doge][doge],<黄杨转子聚脂t>: [抱抱][抱抱][抱抱],<至正爱玛善心B>: [doge][doge][doge],<药店小王子>: 图片评论  http://t.cn/RouCnwR,<旁观盛产顶灯v>: 哈哈哈哈哈笑死我了,<kqtian_787>: 贱贱你太可怜了[doge],<勾践三帝干吧5W>: [拜拜][拜拜],<废材合集>: 回复 @勿忆 :翻身了还是咸鱼,<嫖61>: 一点都看不出来是在打广告[二哈],<尹政Skylar>: 回复 @我的女友嘴很贱 :我已经晕了,<我的女友嘴很贱>: 回复 @尹政Skylar :你应该反思一下，为什么我让你反思,<我的女友嘴很贱>: 回复 @丨梦在深巷 :不是,<我浪我不怕你>: 回复 @勿忆 :安利一个 灵异 玄学 恐怖 漫画 的博主 @猛鬼猛料  。吓不到你找他领钱。,<青青酪酪>: 然后陌生人就知道了。。。,<超级善良可爱的小仙女耶->: 呵呵[微笑][微笑][微笑],<厦门大可爱>: 假装看不见这是个广告[喵喵],<优质男女来战>: 男人为什么喜欢少妇？ 因为你一拍屁股 她就知道换个姿势 你一躺下来 她就知道坐上来 你一站起来 她就知道跪下来 你一跪下来 她就知道撅起来 而小姑娘你一拍屁股她只会回头问打我屁股干什么。喜欢污的戳我[污] 点进去更精彩[爱心]️[爱心]️ @男女互撩平台,<MASIYU9>: 既然知道是广告就不看了  http://t.cn/RouK2em,<你不知道的kkkx>: 这广告比我几把都硬,<不要再夸我帅气啦>: 贱贱快说！给了你多少钱让你这样打广告！,<o0淡如烟尘0o>: 这波广告打的很溜。,<丨梦在深巷>: 第一吗。[二哈][二哈],<寻寻觅觅的南方姑娘>: 你现在广告是越来越多了啊，果然是在养家了,<欧冶刀剑>: 回复 @脸颊羞红 :我也看不出来[doge][doge][doge]  http://t.cn/RouoRZs,<一只猎奇的狗>: ⁶⁶⁶⁶⁶⁶    666 ⁶⁶⁶⁶⁶⁶    ⁶⁶⁶⁶⁶⁶     ⁶⁶66⁶⁶⁶⁶     ⁶⁶⁶⁶⁶⁶   ⁶⁶666⁶⁶⁶⁶⁶⁶⁶⁶⁶   ⁶⁶⁶⁶⁶⁶    ⁶⁶66⁶⁶⁶⁶     ⁶⁶⁶⁶⁶⁶        ⁶⁶666⁶⁶⁶⁶⁶⁶⁶⁶   ⁶⁶⁶⁶⁶⁶    ⁶⁶,<勿忆>: 咸鱼想翻身了[doge],<不要再夸我帅气啦>: 不得不说这个广告还是很有趣的！,<没到夏天就想穿裙子>: 我看不出这是个广告啊，一点都不明显啊,<一个带污污污的小姐姐>: 上车[爱心]️[爱心]️开车了,<脸颊羞红>: 假装看不出来是广告[doge],<无印原图>: 一点都看不出来是个广告[doge],<撑野>: 不看 臭广告 滚开,<何人与我同行>: 这广告比银教授的针还硬]
3230715380	女朋友突然这样说，作为老司机的我也会吃不消。 左克朋的秒拍视频 ​​​	[<-盛楚岚>: @zhAOweIzHezzz,<三厘米的蔚蓝天不及你>: 回复 @乐小乐的交友平台客服coco :在这刷微博,<卡机酱jiang>: // @我的女友嘴很贱 :明天从转发这条微博的粉丝里抽一位送本期赞助，老婆店铺内卸妆皇后卸妆水一瓶  http://t.cn/RouaU4v,<叫我__官人>: 现在的配音不好听啊，还是以前的好,<痴迷风>: 不懂情趣[摊手],<情话暖心耳愿听>: 回复 @安博斯与提尼- :哈哈哈[doge][doge],<酒可婶儿>: 我已经不相信会抽中我了[微笑]// @我的女友嘴很贱 :明天从转发这条微博的粉丝里抽一位送本期赞助，老婆店铺内卸妆皇后卸妆水一瓶  http://t.cn/RouaU4v,<古楼的小仙女阿>: // @我的女友嘴很贱 :明天从转发这条微博的粉丝里抽一位送本期赞助，老婆店铺内卸妆皇后卸妆水一瓶  http://t.cn/RouaU4v,<安博斯与提尼->: 回复 @情话暖心耳愿听 :扎,<爱画画的仙女画师>: 回复 @葳蕤自生 :说了啊，被白敬亭睡了嘛,<情话暖心耳愿听>: 回复 @乐小乐的交友平台客服coco :百分之九十没有高潮,<玛德志杖m>: 回复 @乐小乐的交友平台客服coco :这个套路[doge],<宝宝遇见你是幸运>: 每一次都没有我[失望]// @我的女友嘴很贱 :明天从转发这条微博的粉丝里抽一位送本期赞助，老婆店铺内卸妆皇后卸妆水一瓶  http://t.cn/RouaU4v,<麋鹿在森林会迷路>: 一看就不是老司机[挖鼻]// @我的女友嘴很贱 :明天从转发这条微博的粉丝里抽一位送本期赞助，老婆店铺内卸妆皇后卸妆水一瓶  http://t.cn/RouaU4v,<魏晨家的阿Yan呐>: 哦，真的吗？// @我的女友嘴很贱 :明天从转发这条微博的粉丝里抽一位送本期赞助，老婆店铺内卸妆皇后卸妆水一瓶  http://t.cn/RouaU4v,<陈莹你在这_>: 回复 @乐小乐的交友平台客服coco :吃药[doge],<魏红晓_>: 不抱希望的转发[允悲]// @我的女友嘴很贱 :明天从转发这条微博的粉丝里抽一位送本期赞助，老婆店铺内卸妆皇后卸妆水一瓶  http://t.cn/RouaU4v,<视沫>: 你们没系安全带。,<北冥金枝>: 回复 @被白敬亭睡了 :天天说这句话蹭热度有啥意思,<冇寧>: 转发// @我的女友嘴很贱 :明天从转发这条微博的粉丝里抽一位送本期赞助，老婆店铺内卸妆皇后卸妆水一瓶  http://t.cn/RouaU4v,<狩野hii>: 回复 @寧為狂狷 :哈哈 想～[害羞],<酒字>: 我也想说，天天拿老婆东西送人，有本事送我啊[doge][doge][doge][doge][摊手][摊手][摊手],<寧為狂狷>: 回复 @狩野hii :我还以为你要给我转发抽奖卸妆水[眼泪],<魏优秀vivian>: 今天没用配音。是原音吧,<无所事事看月亮>: 急刹车不好[允悲]// @我的女友嘴很贱 :明天从转发这条微博的粉丝里抽一位送本期赞助，老婆店铺内卸妆皇后卸妆水一瓶  http://t.cn/RouaU4v,<Achanaa>: 回复 @头上被放了好几个仓鼠的金尼玛 :揍你,<小哥哥都好难撩>: 好的// @我的女友嘴很贱 :明天从转发这条微博的粉丝里抽一位送本期赞助，老婆店铺内卸妆皇后卸妆水一瓶  http://t.cn/RouaU4v,<豆子乖乖的>: // @我的女友嘴很贱 :明天从转发这条微博的粉丝里抽一位送本期赞助，老婆店铺内卸妆皇后卸妆水一瓶  http://t.cn/RouaU4v,<狩野hii>: @寧為狂狷  [笑而不语],<彤啊彤啊彤姐姐>: 回复 @搁sei俩呢 :我知道我厉害[思考],<搁sei俩呢>: 回复 @彤啊彤啊彤姐姐 :你厉害,<阿阿阿阿雅a>: 暑假就是穷到卸妆水都买不起了[拜拜]// @我的女友嘴很贱 :明天从转发这条微博的粉丝里抽一位送本期赞助，老婆店铺内卸妆皇后卸妆水一瓶  http://t.cn/RouaU4v,<彤啊彤啊彤姐姐>: 回复 @搁sei俩呢 :比你拿本早两年 哎 不说啥了[微笑],<搁sei俩呢>: 回复 @彤啊彤啊彤姐姐 :比划比划啊,<_王潇洒啊>: @小刚的本来生活   [哈哈],<zp灬yuan>: 大家有没有人关心一下湖南宁乡啊，我妹早上从娄底坐车回家，几个小时前途径宁乡现在失联了[伤心]很着急……不好意思，占下楼…… #湖南暴雨#,<Sss_chickling>: 然后我转了 因为你的转发量不高 你没有刘文静火 所以我的中奖几率更高,<打个呼继续睡>: 回复 @乐小乐的交友平台客服coco :拿纸巾。或者先弄掉套套。,<冉美琪BIGBANG>: 你们的爱情[爱心发光] 真好,<Lost89nrd666>: 厉害了贱贱，水土都不服就服你。,<青城山下修炼千年的萝卜精丿>: 回复 @乐小乐的交友平台客服coco :把小视频关了,<我的女友嘴很贱>: 回复 @余生无虞 :要知道可都是送给婆家人的啊,<小兔纸Bunny冰凌凌>: 这个卸妆水辣眼睛,<锁骨1下方>: 红配绿[doge][doge],<心累却还要死命复习的鬼>: // @我的女友嘴很贱 :明天从转发这条微博的粉丝里抽一位送本期赞助，老婆店铺内卸妆皇后卸妆水一瓶  http://t.cn/RouaU4v,<yc392288>: 为什么帽子老是那么绿呢,<假装我是一个很可爱的小仙女>: 虽然不是我的[黑线]// @我的女友嘴很贱 :明天从转发这条微博的粉丝里抽一位送本期赞助，老婆店铺内卸妆皇后卸妆水一瓶  http://t.cn/RouaU4v,<_你比从前快乐1>: 回复 @乐小乐的交友平台客服coco :玩手机,<起初友人如今爱人>: 回复 @乐小乐的交友平台客服coco :穿衣服，，，,<十万个哈哈哈哈哈哈>: 一泡尿浇灭欲望[笑cry][笑cry][笑cry],<彤啊彤啊彤姐姐>: 回复 @搁sei俩呢 :哎 不是我说 我觉得我开车比你辣害多了,<鹿老板L>: 对就是你了// @我的女友嘴很贱 :明天从转发这条微博的粉丝里抽一位送本期赞助，老婆店铺内卸妆皇后卸妆水一瓶  http://t.cn/RouaU4v,<李雪是个大明星>: [污]// @我的女友嘴很贱 :明天从转发这条微博的粉丝里抽一位送本期赞助，老婆店铺内卸妆皇后卸妆水一瓶  http://t.cn/RouaU4v,<Monchhichi97>: 声音怎么换了感觉还是以前的搞笑,<莫诗莫忘-曦>: 哈哈// @我的女友嘴很贱 :明天从转发这条微博的粉丝里抽一位送本期赞助，老婆店铺内卸妆皇后卸妆水一瓶  http://t.cn/RouaU4v,<听说名字很长就不会重复>: 挺刺激的// @我的女友嘴很贱 :明天从转发这条微博的粉丝里抽一位送本期赞助，老婆店铺内卸妆皇后卸妆水一瓶  http://t.cn/RouaU4v]
3230715380	女朋友突然这样说，作为老司机的我也会吃不消。 左克朋的秒拍视频 ​​​	[<ChuanGeViva>: @LassZapWowxxxx,<HULUWUYU>: [笑cry][笑cry][笑cry],<_终于眼红>: @_始于脸红   要不要来点刺激的,<目小姐>: @徐徐徐爱太太  哈哈哈哈你懂么,<-Pomace>: 回复 @Tanyhhhhhh :不慌不慌,<Tanyhhhhhh>: 回复 @-Pomace :哈哈哈，我都害怕,<-Pomace>: @Tanyhhhhhh   刺激的,<小婊砸ci花>: 贱贱 为什么你的帽子是绿色的？[doge],<念恋不忘s>: 回复 @执着炸酱面的少女 :图片评论  http://t.cn/Rokhq9T,<罗毓言>: @Pang_YiuMi,<熊孩子_X>: 回复 @安静的香菇呀 :要来点刺激的？,<游走的灵魂9>: @周冬雨的圈外男友,<小糖婳>: 还是喜欢贱贱视频之前的声音,<啰嗦的老小>: @JellyPhoebe   [污],<19980207_>: @persist田径,<TULIPGIFT>: 回复 @OHANA卜 :厉害了,<张某人陪你浪迹天涯>: @你好我叫赵静    看到那个静字没,<小彬_SUT>: 回复 @三千公里外的悲伤 :啊呀，说得对呀！,<大坏一点都不坏>: 回复 @我的前任是贱人 :说你是不是贴过膜[doge][doge],<草履虫和草履虫虫>: 回复 @草履虫虫和草履虫 :[挖鼻]要不要来点刺激的？,<草履虫虫和草履虫>: @草履虫和草履虫虫   [并不简单],<沈Miu>: 回复 @Arrival____ :我晚上也不开,<Arrival____>: @沈Miu   [坏笑][坏笑][坏笑],<ZHO_Jojo->: @ZHU_Hoho-,<带你爬坑带你飞>: 回复 @回到最初1009 :老司机，稳,<天生啊啊啊>: @----LCY----   要不要来点刺激的,<痴情女孩儿>: 贱贱个笨蛋 就你这样还老司机[doge],<揪彬婆婆>: 回复 @延南洞的小可爱 :我们来点刺激的[鼓掌][鼓掌],<OHANA卜>: @TULIPGIFT   [哈哈][哈哈][哈哈][哈哈][哈哈],<春眠不觉晓嫁了赵大宝>: @处处闻啼鸟娶了小叽闹,<正在输入YY请稍等>: @弹弹弹你小JJ,<汤小白_0929>: @王大白_0816,<带傻眼镜的小啊喵>: @Daniel刘叔叔,<寄情信>: 回复 @你是我的梦像温柔的晚风 :哈哈哈哈哈哈哈哈哈,<_耿嘻嘻>: @__阿司匹林___,<我的女友嘴很贱>: 恭喜 @老夫尽是少女心  1名用户获得【卸妆水】。微博官方唯一抽奖工具 @微博抽奖平台  对本次抽奖进行监督，结果公正有效。公证链接： http://t.cn/RoBCq7q,<我有一个小陈子>: [挖鼻]所以活该贱贱被文静整,<萌萌哒的朱少>: 回复 @烂段王 :命好[doge][doge][doge]遇到了个眼瞎的,<爱因斯楚>: @Darling-君  下次咱们来点刺激的,<泰迪狗屁>: 回复 @哪里凉快哪待去 :你会说“能做了啵”,<焦灼如我>: 回复 @_糯米丸子___ :没毛病,<咕咕唧唧啦啦啦>: @换个自己想要的名字怎么这么难,<小白的酷热与严寒>: 回复 @泰迪狗屁 :哈哈，我也要这样说,<洗海澡的柠檬>: @一朵蓄势待发的蘑菇  套路,<千里寻良妓>: @Nrid  咱下次试试刺激的？,<一喵一汪一辈子>: @带你逛津城  [微笑],<多肉王子李文俊>: [心][心][心][心],<哈丿皮皮>: 昨晚梦到你们俩口子了，刘文静唉贱贱高很多,<南墙都要撞倒了>: 回复 @LQ1217- :听不懂的样子,<loudly->: @咩老板的保镖  哈哈,<多啦a梦的小月月>: [偷乐][偷乐][偷乐][偷乐],<大仙女_sunny>: 蛋蛋配的刘文静？？,<BUBBLEJIAN>: @我是你的小太阳嘞   @李晓琳linnn  哈哈哈哈,<睡不着的月亮>: [并不简单][并不简单],<还在发芽呢>: 回复 @二宫和琎 :后期的锅,<monster丶丶丶丶>: 回复 @巨树巨树巨树景_ :[眼泪][眼泪][眼泪][眼泪][眼泪]来,<我不是蓝绿色盲>: 忘记画安全带了贱贱[doge]]
3230715380	认真看完这些小故事的人心里一定藏着一个人，这种傻傻而有趣的行为应该叫做暗恋吧。 ​​​	[<萌蒙酱>: 我也曾经这么喜欢过一个人，他的一举一动会关系到你一天的心情[doge],<欧念念_>: 我就是怂  什么也不敢说,<Peekabooo__>: 回复 @沉迷于金秀贤的美色 :sure[污],<Winterslatte>: 羡慕这种还会给你点赞的,<沉迷于金秀贤的美色>: 回复 @Peekabooo__ :你也是吗？[笑而不语][笑而不语][笑而不语],<Peekabooo__>: 回复 @沉迷于金秀贤的美色 :你的微博名我喜欢哈哈哈,<东海宋慧乔>: @小温暖14576   是你,<从前有个店小二>: 回复 @一颗凉白菜 :好甜[心]我们的也很甜,<GYJ1999>: 回复 @云懒懒的你暖暖的 :就是这样啊   所以不要心疼了 会好的,<GYJ1999>: 这是所有心酸的开始,<穿山跃海哼我的歌>: 回复 @云懒懒的你暖暖的 :对 现在就是这种境况 很郁闷[失望],<全宇宙最温婉mia>: 回复 @-不愿意透露姓名的zy :哈哈哈哈哈哈可爱,<懿笙灬>: 虽然还没在一起   但这个时候却是最美好的,<懿笙灬>: 你最后的图是认真的吗[doge],<燕妮妹Apr>: 回复 @武先森你好啊 :鼓起勇气表白……被拒绝了然后就说是玩儿游戏输了大冒险,<燕妮妹Apr>: 喜欢一个人难道一定要先去了解了才叫喜欢吗，不了解就不算喜欢吗:(,<-不愿意透露姓名的zy>: @全宇宙最温婉mia,<一颗凉白菜>:   @从前有个店小二  我应该给你暗恋我以及我暗恋你的机会,<HoUSang->: 以前喜欢一个人从初三开始到大一，高二高三写了两年的这种日常 厚厚的好几本  最后还是被拒绝啦[哆啦A梦汗][哆啦A梦汗][哆啦A梦汗],<大概我糟透了吧>: 回复 @一只猎奇的狗 :没懂[傻眼],<夏以风风风>: 我终于骨气勇气向我的大学女神告白，现在，她成了我后妈,<橙halo>: 之前的我这样持续了一年多 现在就只有笑笑而已,<素炒红烧牛肉味冰淇淋>: 回复 @咖哩gaygay- :没有结局啊，这种故事没有结局不是更好嘛，甜甜的~,<香蕉奶牛w>: 回复 @Peekabooo__ :谢谢你[好喜欢],<咖哩gaygay->: 回复 @素炒红烧牛肉味冰淇淋 :好想知道这个小男孩和小女孩现在怎么样了,<弓长思美>: 回复 @武先森你好啊 :我朋友都这么说，但是总是一会冷一会热的[笑cry],<武先森你好啊>: 回复 @弓长思美 :我当初也是，说明他对你也有感觉，加油[加油],<Peekabooo__>: 回复 @香蕉奶牛w :哈哈哈我是这样觉得呢[爱心][爱心],<蘑古力呀魔力菇>: 这种傻傻而有趣的行为叫青春[微风],<秦祥学>: 回复 @武先森你好啊 :哈哈。。。我鼓起勇气向她表白了5次，都得到一个同样的回复，我们是朋友呀！[good]，然而我并不想跟你做朋友，再见！[doge][doge][doge],<盐咸咸咸>: 回复 @糯米糍饭团_ :[爱你]是了！我会的！！,<赵旭啦>: 回复 @轨迹poi :我操 是我,<我可能是一只假猪>: 感觉就是我本人啊...,<辣鸡灬灬>: 只要你长得漂亮，根本没有暗恋,<是只言啊>: 这个叫暗恋吗？？？已经是暧昧关系了诶 像我们这种远远看着不敢勾搭的才叫暗恋吧[doge][doge][doge],<小不点儿Ada>: 鼓起勇气，都不能见面,<子薇刘_>: @Pop波  啧,<SullivanW>: 回复 @国服第一凤囚凰 :贱贱的( •̅_•̅ ) 摸你小狗头,<香蕉奶牛w>: 回复 @_李困困 :谢谢你！,<Ky1in_Zhang>: 回复 @一只猎奇的狗 :这不是云村的段子么,<ZyjacyaInLove_>: 回复 @_倚轩听风 :撒皮乖乖   [爱你][爱你],<_李困困>: 回复 @香蕉奶牛w :加油，不要害怕他嫌你烦，你有你可爱的地方，有你的魅力[心],<_倚轩听风>: @ZyjacyaInLove_   我的喜欢，一直都没藏起来,<糯米糍饭团_>: @盐咸咸咸  加油baby,<西瓜西瓜西瓜我是夏天啊>: 写文的人一定很年轻,<蠢萌蠢萌的闫春萌>: 回复 @老老老老心 :诶 追的人不是他 也并不开心呀 [摊手],<香蕉奶牛w>: @些里   @穿着帆布鞋去踩雨  有评论说他有可能喜欢我哎!,<香蕉奶牛w>: 回复 @Peekabooo__ :啊啊啊啊真的吗！翻评论翻到这里超开心！,<香蕉奶牛w>: 回复 @_李困困 :[doge]大部分还是我主动,<香蕉奶牛w>: 哈哈哈哈虽然很矫情但是每次自己看都觉得甜的不行[兔子],<Hazel_徐海柔>: 回复 @AndrewBaag :“要一起吃饭吗？”]
