3230715380	因为我特别喜欢文静的女生，所以我的女朋友叫刘文静。 ​​​	[<一只胖烤鸭_>: 回复 @六六六牛牛牛 :只是想告诉你  是这个博主[兔子],<六六六牛牛牛>: 回复 @一只胖烤鸭_ :这句话有什么特别的梗吗,<帆儿io>: 回复 @心苑yy :他们已经结婚了,<王令尔尔>: 回复 @我的女友嘴很贱 :原来，我们可能是兄弟,<白柳屿鹿>: 生活可以随心所欲 但不能随波逐流,<Shardomia>: @ZzdD258,<温温温温温温温啊>: 有点心塞，我可能要单身了[允悲]感受不到他爱我了，也没有力气去努力了,<MMyolanda>: 很难过，他想我改掉我的脾气，我大概改不掉吧。,<Janice莎>: 所以为什么要姓刘,<景德镇蠕>: 支持！私信您了亲[微笑],<梦影爱>: 有的吃就不错了[挖鼻],<lovewant--->: 回复 @头上哪儿有犄角 :对的,<肉饥>: 为什么要卖假货？,<让他莹>: 回复 @空空空空空落落 :两年过去了，现在怎么样,<爱睡觉的露娜>: 我身高161，体重90，胸围小B，乖巧懂事，不做作，很听话，不喜欢花男生钱，关键是我还会画画绘画[画画]， @爱睡觉的露娜 ，可是为什么我没有男朋友呢？[doge],<撩走诸葛亮>: 我能说我真名就叫郝文静吗[允悲],<cat抑郁症>: 因为我喜欢钱，所以我老公叫钱眼,<过来抱抱_>: 学p图戳她吖 @p图教程的少女心   （＾し＾）,<橙子在超市22>: 失恋了，心情很不好！但是 不知道为啥！看恁俩的视频！莫名的觉得很开心！好幸福！希望恁俩永远，这辈子下辈子都幸福快乐！[甜馨得瑟],<约啪匠>: 贱哥，我其实是看着你火起来的,<背着小吉他的大孩子>: @7aric  你看看人家 再看看你[微笑]我要找贱贱当老公[doge],<麦兜兜和乔巴>: 贱贱的粉丝比他媳妇多好多[哈哈],<大概是颗白菜>: [二哈]秒删的微博 还说不怕老婆,<花羽毛大公鸡>: 但其实好像不太。。文静啊？,<QiongQiong995>: 会不会是你意淫出的女朋友啊！！！,<1995年12月17号>: 然而她并不文静[允悲],<acixi_917>: 事实一点都不文静哈哈哈哈哈哈哈哈哈,<幂哥嗨起来>: 回复 @一白百 :来啊,<乔乔and朵朵>: 我身边就有一个叫刘文静的   介绍给你如何[doge][doge][doge],<Destiny曾钰>: 可是你的女朋友看起来一点都不文静[笑cry][笑cry],<styles情>: 一进来就看到这，好霸气,<荆夕冉>: 回复 @抹茶凉一夏 :请开始你的卖药,<Zhao_丽穎>: 叫文静的人实际上一点也不文静因为我有两个同学就叫文静的[允悲],<Sumicho>: 三年了你们还不结婚？,<丶PUQIULEI>: 以前看你的视频会笑，现在看会哭,<丶PUQIULEI>: 我好羡慕你，好幸福，我几天前也这么幸福，可是全毁了，我父母不同意我们在一起,<呲喇>: 回复 @程纡诺 :还行 哈哈[嘻嘻][嘻嘻],<Hei_兔子先生>: 这个该改了，毕竟升级为你老婆，装备满级,<新雨门>: @独孤轱辘噜咕who,<哈湫xl>: 我们班有个叫朱文静,<LnelY74879>: 回复 @七月的小茵 :我要,<河北张国荣啊>:   @COCOWND  怎么说[偷笑],<我头上有犄角嘛>: 滴，打卡[摊手],<猪仙33>: 回复 @2ouWeiZhen :这就巧了 你也喜欢小三 同志啊[憧憬],<2ouWeiZhen>: 回复 @猪仙33 :我女朋友也叫刘晓珊...,<猪仙33>: 因为我特别喜欢小三 所有我的女朋友叫刘晓珊哈哈哈哈,<cc怎么那么可爱>: 图片评论  http://t.cn/RoXRnuG,<赃爸爸>: 网拍模特私我 只需要拍拍买家秀,<羊鸡鸭>: 回复 @你媳妇儿掉了 :[doge]名字！,<瘦宅刘>: 回复 @羊鸡鸭 :怎么让你这么惊讶,<羊鸡鸭>: @你媳妇儿掉了  [允悲]挖槽挖槽……,<偶吧颖竟然被占用>: 回复 @抹茶凉一夏 :太过自信了]
3230715380	北京好晒啊今天 ​​​	[<撷辰>: 回复 @裵裵裵裴Pz :rua,<張众zZzZ>: 回复 @向北的鹿 : @生龙活虎大扬哥  6,<i烙印i>: @saprina77   @海猫躺躺,<小新是Superman_L>: 图盗走，哈哈哈哈,<-五花肉呀>: @快乐不起来的日子789  哈哈哈哈哈哈哈哈哈哈哈哈哈哈哈哈哈哈,<小仙女儿嗝>: 回复 @Noxlox :美少女战士,<DillPickle->: 回复 @可爱天真小正太 :射的准吗[doge],<DillPickle->: 回复 @弥勒佛哈哈哈 :单纯不做作,<DillPickle->: 回复 @黄少天的正房 :我就是想笑死你继承你的辣条,<DillPickle->: 回复 @朋朋的男粉 :呦呦呦 老铁你好,<可爱天真小正太>: 回复 @DillPickle- :我是后羿，我快热死了，给我转5块钱我去买支箭，帮你们把太阳射下来[doge][doge],<两米一a>: @一米二二二二二,<不愿透露姓名的王铁猪先生>: 回复 @机智小彭友 :哈哈我也是第一反应是刘全有这戏精,<黄少天的正房>: 回复 @DillPickle- :哈哈哈哈哈哈哈哈哈这个好笑,<CaMus999>: Rua！Rua！,<Lu红欣>: @小目憨憨  哈哈哈哈哈哈哈有趣,<痴人少女>: 回复 @KangarooDai_ :了不起哦,<Vicky_含>: @Anthony婕,<小恐龙有眼镜和钢牙>: @Gasoline_Heart  哈哈哈哈哈哈 @小柯向前冲_mumu,<奠桂酒兮椒浆>: 回复 @不出腹肌不罢休 :人家姓波多野[眼泪][眼泪][眼泪],<Katherina--静>: @Lytivia   @Ye_HC,<skuaryvvvv>: 已经预测到贱贱回家后的生活了[doge][doge][doge],<itangxx>: @ZHENGJQing,<诺颜阿_>: 回复 @向北的鹿 :[心]卖[心]片[心]的[心]去[心]哪[心]了[心]？,<疏影女神mmmmmm>: 回复 @裵裵裵裴Pz :Rua,<王你个军啊>: 回复 @Phban_ :长尾巴啦,<fortune94>: @712nr   @A榴莲妹A  看这仨图,<君丿笙>: 回复 @加糖的橙子口味 :嗯哼,<加糖的橙子口味>: 回复 @君丿笙 :美少女战士？,<良人她说>: 回复 @Phban_ :果然是个戏精[二哈],<dear司小雨>: 回复 @全蛋27738 :哈哈哈,<君丿笙>: @加糖的橙子口味  哈哈哈,<少女与猫丶丶丶>: 回复 @Phban_ :卧槽,<少女与猫丶丶丶>: 回复 @DillPickle- :我是牛蛙,<躲在里面不出声>: @藏起尾巴的橘猫   @腹黑小灰猫   @小九不羡仙,<别睡太晚l没人和你说晚安>: [拜拜][拜拜][拜拜]  http://t.cn/RKGYCOF,<Hh花菜->: 回复 @Phban_ :都没人发现最大的亮点？！！！,<z_my0521>: @我是兔哥哥哥哥,<奕小彤_>: 回复 @米缸婷子_ :这不是我的影子,<z_my0521>: 回复 @向北的鹿 : @imbella__   @我是兔哥哥哥哥,<小方家的一天>: 回复 @宾克斯的美酒万岁 :因为他就是卖片的的鼻祖,<弥勒佛哈哈哈>: 回复 @DillPickle- :我，秦始皇，打钱,<你是我的梦像温柔的晚风>: 回复 @寄情信 :厉害阿,<全蛋27738>: 回复 @向北的鹿 :我是她指腹为婚的未婚夫？你讲的当真？,<莹妹儿吖_>: 回复 @向北的鹿 :我真的有这个网站,<常威你不是说你不会武功>: @我的女友嘴很贱  你心真大，你就这样让静静穿齐x小短裙出门溜达？,<江海涛正妻->: 图片评论  http://t.cn/RKGO8ux,<你亲爱的大爷就是我>: 大小姐驾到！[二哈],<寄情信>: @你是我的梦像温柔的晚风,<肥宅吔屎啊>: 回复 @裵裵裵裴Pz :rua,<Z蜜Honey>: 回复 @DillPickle- :我是人王伏羲。你怎么又在骗钱了[喵喵],<Fai樂樂>: 裤裆下有异样。。。,<唱民谣的吴彦祖>: @欠我一碗牛肉面]
3230715380	或许你不知道，其实幸福一直都在 ​​​	[<西西弗斯可以不死>: 回复 @全家桶qaq :那是 里面的运动裤，亲爱的。,<西西弗斯可以不死>: 回复 @_ingonyama_ :因为想约小姐姐，宝贝。,<西西弗斯可以不死>: 回复 @邢pino :不卖，是小姐姐免费约，长得漂亮可以倒贴钱,<_ingonyama_>: 回复 @西西弗斯可以不死 :我真的不明白 健身就健身 到处发是为什么[黑线],<Ariel-Joe>: 很感动是真的，现实中其实有很多人都做不到像从前一样爱他，不是说他变丑了不爱他，人会老，也一样不好看了，可是样貌让自己感到害怕了，也很难每天面对，自己压力也会很多，各有各的苦衷,<NE-CO君>: @小溪流tony  可怜人,<穆沐木木m>: 或许你不知道，其实我一直都在,<斯莱特林最帅的马尔福>: 回复 @樱桃太好吃了吧yE :后来我就不穿了，直接漏出来胳膊，省的问问问[允悲],<斯莱特林最帅的马尔福>: 回复 @樱桃太好吃了吧yE :对对对！我穿短袖都会再穿个那种防晒袖套，就一直有人问问问[允悲],<_飒泼>: 回复 @璐_lu__ :这才是这种事情正常的结局,<樱桃太好吃了吧yE>: 回复 @斯莱特林最帅的马尔福 :[抱抱][抱抱]不过现在淘宝上也有很多好看的长袖啦 就是每年都会被问热不热 很烦[摊手][摊手],<斯莱特林最帅的马尔福>: 回复 @樱桃太好吃了吧yE :因为穿了长袖，我们都一样。,<樱桃太好吃了吧yE>: 回复 @斯莱特林最帅的马尔福 :我一直不喜欢夏天 喜欢秋冬,<斯莱特林最帅的马尔福>: 回复 @樱桃太好吃了吧yE :对，就特别害怕别人盯着你看。我以前特别喜欢夏天，但是现在特别希望夏天赶快过去,<樱桃太好吃了吧yE>: 回复 @斯莱特林最帅的马尔福 :[抱抱][抱抱][抱抱]我被火烧伤 在外面没穿过短袖短裤  不敢。,<像被喜欢>: 回复 @四川省德阳市市草 :我们没有这些事情所以不用放手,<四川省德阳市市草>: @像被喜欢  舍不得你,<猫娇a>: 不会让你走 @ChzZo0,<Marvelouss_>: 回复 @m麦兜r :之前看到过 这男的挺帅气的,<没有酒也不想听故事>: 回复 @偏论 :图片评论  http://t.cn/RKbKRi9,<别刷博了快滚去睡觉>: 回复 @一只猎奇的狗 :我想了想，我没有喜欢的人[允悲],<阿舟亢ZH>: 回复 @树儒儒呀 :这不一直爱着嘛....[并不简单],<泽影姐姐>: 回复 @-Vanky :可能都是gay🙃,<小語_Bella_要努力赚钱>: 我想到了Selina和她老公…,<斯莱特林最帅的马尔福>: 回复 @斯莱特林最帅的马尔福 :出院后总想着怎么戴手套挡住，怎么不让别人看见，因为真的害怕别人把你当成异类对待。但是现在我想通了，我出门也不带袖套什么的，我才不在乎别人怎么看我了，就像纹身一样，我已经不觉得有什么丢人的了[摊手],<斯莱特林最帅的马尔福>: 我在三年前因为一次意外，被烫伤，当时挺严重的，送到医院抢救的时候医生下了病危。但是我最后还是挺过来了，烫伤面积挺大的，不过万幸没有烫到脸。整个治疗过程你们都难以想象有多疼，多痛苦。我们活的都不容易，要面对无数人异样的眼光，真的，很难过[泪]  http://t.cn/RKbMrHr,<我是李白吖>: 回复 @m麦兜r :嗯。很帅的。之前看过。,<OYohey>: 回复 @OYohey :今天夜班累死了[微笑],<m麦兜r>: 回复 @范金穗儿 :我想看看这个男人毁容前的容貌，一定很帅吧，心疼～～～,<我敬你是条秋裤>: 如果有天他那样了，我依旧爱他，会跟他在一起。只是心里别扭是真的会有,<邢pino>: 回复 @西西弗斯可以不死 :真的不要脸啊 看到好多次了 你在卖yin吗,<Joy_鱼鱼鱼>: 回复 @情话馆主 :手,<污污污嘿咻火车>: 回复 @污污污嘿咻火车 :上车了[爱心]️[爱心]️,<污污污嘿咻火车>: 上车[爱心]️开车了[爱心]️[爱心]️么么哒[爱心]️[爱心]️,<Joey_biubiubiu>: 既然不顾家人反对义无反顾的嫁给他，又为什么一直过不去心里的坎呢？这样打肿脸充胖子的勉强自己为了什么呢[汗],<super网拍小圈>: 回复 @你以为你头大就能当我儿子么 :招网拍模特   [小黄人高兴],<全家桶qaq>: 回复 @西西弗斯可以不死 :好好穿裤子行不,<我是梦梦梦梦梦梦啊>: 虽然我不是颜控，但是这个样子的心理真的有阴影，真心接受不了，别说以前很相爱了，对着这样的脸，再美好的爱情都抵不住,<Painting_悸>: @Liocre  在中国估计，可能，也许。。。不知道,<别跟我矫性>: 回复 @甜老头儿 :爱情这东西是存在的，只是不相信你能遇见它,<生如夏花huihui>: 感动之余，吓了一跳，,<烧着>: 回复 @愫悸阿 :觉得面对这样子微笑反而怕让他觉得是嘲笑吧，顾及一个人的心情，表情都不敢多做，怕引发他的自卑心,<CheeseChoi->: 回复 @偏论 :马屁精，孤立你，上厕所，不带你，铅笔盒，丢桶里，值日生，全让你[doge][doge],<酒醉方微醺醺醺醺丶>: 是啊，他活着，我活着,<Julie黑茱莉>: @Chanchihou_,<邵诗行>: 有一种爱叫做放手,<乔乔乔乔乔琪纱>: 回复 @西西弗斯可以不死 :多大的小姐姐才是小姐姐[偷笑],<TourneSolyi>: 这个男的已经去世了。酗酒之后摔死的。他俩之前就订婚了。离婚的说辞是他俩结婚太匆忙了 没有考虑清楚。以上来自维基百科 [二哈] 中文编的这故事简直了……………,<无曾用名>: 回复 @偏论 :马屁精，孤立你，上厕所，不带你，铅笔盒，丢桶里，值日生，全让你[doge][doge],<douruaimifasoulaxidou>: 我和你之间依然有爱 可是再也不能重来,<彷观er>: 回复 @西西弗斯可以不死 :为什么必须是小姐姐,<暖秋秋秋>: 回复 @情话馆主 :🙋,<五条君Ms>: 回复 @寂静冬日的烟火 :嘿嘿，一样滴,<小聪老湿>: 我一直都在啊[喵喵]  http://t.cn/RKbw0U1]
3230715380	同样是上报纸，为什么把我的名字画了个[叉] ​​​	[<唐晚阁>: 回复 @钟迎归 :哈哈哈哈哈哈,<钟迎归>: @唐晚阁   哈哈哈哈哈你帮我做饭，我帮你检查碗洗的干不干净,<Essie阿>: 我也看过啊  好几次都有你啊贱贱,<电气小可爱>: 回复 @以后喊我孤独吧 : @建电大帅比  [笑cry],<Nami兔叽酱>: 我怀疑是青岛的地铁报[允悲][允悲][允悲],<吧唧吧唧吃了你_>: 回复 @于朦胧的小跟班 :谢谢,<neylla>: @AlvaroMorata-  我帮你检查,<金金金添凤啊>: 回复 @闲看天云际 :我有两个手机。,<Niko-ni>: 贱贱，你可以改名叫 我的女友嘴很左克朋[允悲] @我的女友嘴很贱,<于朦胧的小跟班>: 回复 @-SHENQIQI :柠檬干了[泪],<于朦胧的小跟班>: 回复 @吧唧吧唧吃了你_ :已私,<于朦胧的小跟班>: 回复 @公衍安 :私了,<于朦胧的小跟班>: 回复 @杨靠谱是村长吖 :已私～,<瑶瑶瑶哥ab>: 可能是系统不能识别[摊手],<虚若玄风>: 回复 @噗尺 :你 盯 思,<虚若玄风>: 回复 @以后喊我孤独吧 :你 马 孤,<噜啦啦哔哔>: 因为你x啊哈哈哈哈哈哈,<今天老胡更博了吗->: 回复 @可樂的榮國張啊 :我好怕,<可樂的榮國張啊>: 回复 @今天老胡更博了吗- :能蛋 孤立你！[doge],<梅三少->: 回复 @唯爱梅三少- :[笑cry][笑cry][笑cry],<彤彤你可长点心吧>: 哔哔哔 我的女友嘴很哔 [污][污],<wuliyuanyuany>: 之前就上火杭州的城报，关于高考作文题的,<X_Please>: 可能是你比较贱吧，,<_APaNYa>: 回复 @噗尺 :反省,<土酷本人>: 回复 @以后喊我孤独吧 :你 马 孤,<善断花火啊>: 回复 @ChristyLee0922 :厚？,<当当当黑猫警长>: 回复 @以后喊我孤独吧 :马屁精，孤立你，毛毛虫，塞包里，上厕所，不带你，铅笔盒，扔楼里，值日生，全让你，放学走，不等你，叫外卖，漏掉你，倒垃圾，全让你，去食堂，抢你特么的大鸡腿,<拆水_>: 哈哈哈 @折水-,<-Mudoo->: 因为贱？哈哈哈哈哈哈哈哈[允悲][doge],<韩璐HLHLhl>: 回复 @以后喊我孤独吧 :[心],<小媛er同学嘿>: 回复 @大牛子篮球 :赠送撒哈拉海景房一套,<翁毅楠楠TC>: 应该就是等同于消音BI[doge][doge][doge],<不护>: @小羊爱吃酱肘子,<_陈梦雅>: 杭州地铁发的报纸,<稳健的隔壁老康>: @_Crazy珍,<我爱吃菠萝do>: 回复 @-话说爱不 :所以不叫jianjian了，叫…bibi？[污],<关键我要一一一直奔跑>: @陈承一  你帮我做饭，我在帮你检查一下碗洗的干不干净,<请叫我Mrskevin>: 因为打不出来啊，没看见上面那个niubi都是xx么[白眼][白眼][白眼],<蠢雷雷家的小媳妇>: @球球你难道不爱璨璨了吗,<唯爱梅三少->: @梅三少-  因为你很x[笑cry][笑cry][笑cry],<小树懒懒123>: 回复 @-话说爱不 :[污]  http://t.cn/RKUxNAF,<你超有味98>: 因为刘文静说得有道理啊,<我是窦爷的小公主>: 哇[憧憬] 第一张图片那个宝宝和我同名同姓还是一样的字哦,<那便知足常乐>: 同城的我从来不看地铁日报[摊手],<Mlle_forget>: 怎么的，你还想写出来污染和谐社会？[doge],<以后喊我孤独吧>: 回复 @韩璐HLHLhl :图片评论  http://t.cn/RKUc954,<美丽013>: 你被标记了，赶紧逃命吧🙃,<一条口渴的鱼er>: 好吧，那我下次找找看[doge],<不睡懒觉爱睡你>: 回复 @闲看天云际 :我男票lol排位挂机来找我，很感动了,<Willkilling->: @二般人_  哈哈哈哈哈哈]
3230715380	据说优秀的女孩子连罩杯都是A，有个平胸的女朋友是什么样的体验？ ​​​	[<Hana家的喵>: @我想要两颗西柚OAQ   [doge]总是忍不住艾特你,<UncleLi-->: @中了巴卫的毒   我决定艾特你,<高智障是我>: 回复 @婕坚强 :哈哈哈哈哈哈哈哈哈哈哈哈哈哈哈哈哈哈以后不用买眼罩了,<光的龚先生>: 回复 @光子团 :那就让我来刺激一下生长吧！,<小二子88832>: 回复 @AIKAI圈圈 :正红,<帅的人就是大>: 回复 @左里啊 :哈哈哈[喵喵],<左里啊>: 回复 @帅的人就是大 :啊嘘嘘嘘[二哈],<帅的人就是大>: 回复 @左里啊 :哎 摸我都没摸过 凭什么说刚刚好这种话,<樱桃小丸子爱爷爷>: 瘦的只剩胸的人飘过。。。,<朱宸皓123>: 回复 @卡拉耶橙 :我只看到了你比平常人漂亮[猪头][猪头],<Seattle_okdk>: 要颜还是要胸 @Llecwt,<hwn0427>: 回复 @玛丽莲梦RU :[笑而不语][笑而不语],<过晴lily>: 哈哈哈是我，很平很平的那种[笑cry],<月光下的路灯->: 回复 @_____Sober丶清醒 :老子是B[拜拜],<谁说哈士奇不帅>: @Herria12138,<卡拉耶橙>: @朱宸皓123  [haha],<左里啊>: 回复 @帅的人就是大 :嘘嘘嘘,<帅的人就是大>: 回复 @左里啊 :我就是不喜欢太大的啊怎样 你就刚刚好,<玛丽莲梦RU>: 回复 @hwn0427 :干嘛告诉你,<左里啊>: 回复 @帅的人就是大 :不......,<MsgH7>: 回复 @略夺 :[亲亲],<hwn0427>: 回复 @颜容a :那你省了没[阴险],<帅的人就是大>: 回复 @左里啊 :哪有 我女朋友不平,<hwn0427>: 回复 @玛丽莲梦RU :报上你的杯[小黄人坏笑],<hwn0427>: 回复 @tomato呐 :c杯挺大了,<hwn0427>: 回复 @Grace33_ :多大[小黄人坏笑],<小扬咩咩咩咩>: 回复 @叫我伟哥吧 :小心点，别怼漏气了,<永远有几_远>: @阿童木007号,<难飞小霸王>: 回复 @小姐姐喜欢哈哈吗biu :特别好，多了好多种不重样的眼罩,<纠结猫碎碎念>: @一天萌博   [嘻嘻],<大白老师->: 回复 @风行Rhythm丶 :不厚！！！！！！,<脑袋没有脑袋>: @鱼丸爱吃鱼丸子,<静灬若宇>: 回复 @兔几几w高三狗要炸裂 :你最好看了[哈哈],<风行Rhythm丶>: 回复 @大白老师- :哈哈哈哈哈哈 这个厚,<大白老师->: @风行Rhythm丶,<我不希望有人知道我的微博>: 回复 @砚青钦墨 :浙江女孩什么梗啊？,<左里啊>: @帅的人就是大  哈哈哈哈哈哈哈,<LYJ_LY>: 回复 @Mmezily :哼比常人漂亮[哈哈][笑而不语],<_張大卫>: @KoiiiLi  就喜欢这种青梅竹马的感觉[爱你],<MG-QI>: 回复 @zlLeung :你有眼光,<十七呀丶>: @灯塔行_  哈哈哈哈哈我不是一个人在战斗！,<zlLeung>: 回复 @MG-QI :我的福气[羞嗒嗒],<吃饭睡觉打广广>: @上班工作养老婆,<两条咸鱼的家长>: 回复 @两条咸鱼的家长_ :那你的呢[费解][费解][费解],<MG-QI>: @zlLeung,<鄧w倩>: @_BoYoung  是你的福气,<夏云微凉>: @左岸24  [二哈],<卡带婷>: 回复 @三百多十三 :可是我是36D呀,<天辰安>: 回复 @阿啾啾啾i :那又不是不长了,<叫我伟哥吧>: 回复 @小扬咩咩咩咩 :我也不知道啥体验，我女朋友D罩杯，天天用胸怼我[并不简单],<一九九七生于北方>: 回复 @疯兔子vko :[拜拜],<兔几小姐的超人先森>: 回复 @超人先森的兔几小姐 :呸[二哈][二哈][二哈],<仲er>: 回复 @AIKAI圈圈 :正红,<疯兔子vko>: @一九九七生于北方   [doge]]
3230715380	如果有一天女朋友让你客观评价一下她这个人，意思就是你需要不遗余力地赞美她漂亮温柔聪明可爱了。 ​​​	[<Almapiadosa>: 回复 @_Aaron-_ :艾特我干啥？？？,<_Aaron-_>: @Almapiadosa,<sky0o0飞翔>: 回复 @嘀哩嘟嘟 :胸真大[喵喵],<馨馨星星还是猩猩>: @我觉得我可以是个艺术家,<醒醒阿皮卡丘>: 回复 @懵鸭鸭 :知道了[喵喵],<呆呆的陈小宝>: 回复 @小狮子lxt :已经无法用语言来形容你的好了。。,<苏白石>: 回复 @两顶帽子的小鹿 :不好意思，让我说实话很难,<全村入的希望->: 回复 @-yuan粥 :这大概就是所谓的永别了吧[喵喵],<妮儿响叮当呀>: 男朋友夸我只有一个点可以说：轻[微笑],<马克大叔M>: 回复 @马克大叔的Zoe :小仙女没有缺点，除了美，就是温柔贤惠可爱大方,<清新灵动小仙女>: @XheartYeaRn,<Passiongirl>: @笑而不语的状态结束了,<RuRu的小跟班>: 回复 @好名字都让猪起了QAQ :天使下凡,<StupidJPP>: @SlothfulPBB  哈哈哈哈哈好像是这么回事,<Hey_我不累>: @_IIPInk,<___杨YYYYYYY>: 回复 @___PLAYINGWITHFIRE :[笑而不语][笑而不语][笑而不语][心],<___PLAYINGWITHFIRE>: 回复 @___杨YYYYYYY :说的很对啊,<什么什么你不吃香菜>: 回复 @我就不吃香菜了 :夯～,<半面寒冰兼烈火>: 评价本来是512！看我变513[允悲][允悲][允悲],<雨来佳景>: 回复 @没有故事的男同学w :[害羞][害羞][害羞],<夜丶小郁>: 回复 @抹小软丶 :[二哈][二哈][二哈],<-yuan粥>: @全村入的希望-,<小李佳的世界一片晶莹>: @MJGGGGG,<小李佳的世界一片晶莹>: @MJGGGGG,<嘀哩嘟嘟>: 来。夸我 @sky0o0飞翔,<你算什么航子>: 回复 @Sungkyung-swag :狗贼？,<为你酿一壶桃花酒>: @Dream-Rainsanity  对对对望周知,<___杨YYYYYYY>: @___PLAYINGWITHFIRE,<ShiBobobobo>: 看来刘文静试过了。[微笑],<男友力maxQAQ>: 意思真的不是叫你不留余地的吐槽她的腰大胯粗体壮膘肥…,<范林Lam>: 回复 @呆萌小冉君 :记笔记记笔记,<Sugar丿L>: 回复 @中二小法师 :屁    到终点站了一样赶[眼泪],<痴情女孩儿>: 对啊 现在不夸更待何时？？？？,<Bubble_ops>: @Bubble_booms,<没有故事的男同学w>: 回复 @雨来佳景 :宝贝漂亮聪明善良温柔可爱[爱你],<fit妹_>: 回复 @Lifeisstrugglejk1663 :这么晚！,<拎砍刀的小仙女>: @他说喜欢坐夜车,<抹小软丶>: 回复 @夜丶小郁 :夸我[doge][doge][doge],<掌线曲折>: 回复 @成都接发小涵 : @丶奶茶茶茶茶茶茶茶茶茶茶茶  哈哈哈哈哈哈哈,<SARAHYABI>: @傻了吧唧的机智祥,<Sungkyung-swag>: @你算什么航子  [嘘],<兔几几w高三狗要炸裂>: @静灬若宇   懂[doge],<爱娜娜彡>: 回复 @爱波波彡 :[doge]又想找我麻烦,<Chuxiner->: 就算你说她漂亮温柔聪明可爱 在最后也要加上一句 “是我喜欢的样子”[喵喵],<爱妻狂魔1995>: 回复 @dhkdbxkejhd :老婆，说真的，我从来没夸过你，一直以来我都是在陈述客观事实而已,<4円家小仙女>: 回复 @捉鱿鱼 :到年龄了去民政局排队领,<MorningYangs>: @孙裕峰   哇哦,<老妖怪ill>: 回复 @n好久不见 :[笑而不语][笑而不语][笑而不语][笑而不语][心][心][心]老公么么哒,<你好初心_18>: 回复 @2376km啊 :你本来就很漂亮，还用说假话？！[可爱],<雨来佳景>: @没有故事的男同学w  [害羞],<Wen_ggg>: 回复 @LittleeeeFairy :可以说是很漂亮了,<Xxxxtanto>: @遥远Reus  麻烦看下谢谢,<懵鸭鸭>: @醒醒阿皮卡丘   [doge]没有错,<咕咚妹子>: 回复 @胖的非常非常不明显 :请客观的评价我一下,<拖延症不想动>: 那如果是让你夸她呢[允悲],<光岑素_62669>: 温柔善良美丽可爱又大方,<浅草风见>: 是的是的，每次我都想让别人夸夸我长得好看，温柔之类的。结果。。。很厉害啊，很汉子啊！简直不需要男朋友就能自己搞定一切。。。我？？？那是什么鬼！！！好吧好吧，是夸，也是夸。]
