3240435521	我发表了头条文章:《感谢这个夏天与你们相遇》 感谢这个夏天与你们相遇 ​​​	[<用户5839128739>: 相信你会有更好的舞台发展，加油[左上](^ω^)[右上],<对你的坏的都觉得呢>: 感谢这个夏天让我们认识你们,<用户6339745554>: [大哭][大哭][大哭][大哭][大哭]唉！,<不是吉祥>: 请正面回应 不要再躲避   别为你们的偶像招黑 @钟易轩全球后援会   @DoubleSweet_钟易轩资源博   #徐海俏南下#   #保护原创，抵制抄袭#   #钟意抄袭南下#,<萌妹不萌柠檬不檬>: 你是最棒的，加油[左上](^ω^)[右上]我们会永远支持你的,<董温柔的小红帽>: 嗯，这个舞台配不上你们,<-_bororo>: 看着你就好了，加点油吧[耶],<酷琦_>: 隔着屏幕，流着泪说再见，笔芯[心],<biubiubiu李子>: 你的最后一场我看哭了，你自己做自己最好了，你唱I will  miss you 把全场人都带动起来了挺好这已经证明了你自己！！我希望下次还能再看见你在别的舞台继续努力争取进步，在把好听的歌曲唱给所以人听。 加油 你是最棒了[心][心][心],<小生131>: 回复 @萌的cp怎么还不结婚 :全是脑残娃儿。。。，,<wuli胜利V>: 第一次看综艺节目哭了，[悲伤]荷兹不就一个二次元吗？它不用去练歌编曲却把一个个人才挤走[怒骂]为什么这个综艺要拿人的前途去和一个完全没有感情.没有思想的假人开玩笑呢？[怒骂],<w香芋味的奶茶>: 回复 @此人有桃花运 :不清楚有没有黑幕,<孟子坤的不二臣>: 在场的所有人都在大喊黑幕。都听到了，轩轩加油,<流浪猫星尘>: 🌚🌚罪恶的人终究多。你很好了。很喜欢哦。笔芯啦，要好好的 @Leo_钟易轩,<琦琦琦安yu>: 花花哥，您!!!（我儿子是有多老啊）[允悲][允悲][允悲],<我是我知道的粉>: 我想你了，轩轩[允悲],<腿哥啊啊>: 感谢这个夏天遇见了你,<用户6166965946>: 我们。会一直等你，等到你比任何人都火的时候！ 我是你的意“钟”人， 钟易轩加油！,<小伍腿长一米八>: 刚刚看了明日之子的视频，直接路转粉，钟易轩加油。你很棒，我第一次看一个节目是看到观众大喊黑幕的，还敢直接，打脸了。,<萌的cp怎么还不结婚>: 回复 @小生131 :？？？？阿姨您在说什么？我为什么要改名字？我们00后碍着你了？,<等到烟火清凉Vvae>: 回复 @小生131 :你厉害你厉害死了，你博士行了吧，谁有你牛啊，在这叨逼叨的，以为自己多牛[喵喵][喵喵],<蓝色十八号>: 小小少年，未来可期！,<剩下的盛夏_听说>: 钟易轩你永远都会回来[心][心][心],<小生131>: 回复 @等到烟火清凉Vvae :什么学历，从你回复其他人的评语中就看出你的学历要不是个专科，就是个普通本科。唉,<十年之后我要嫁给薛之谦>: 以后每一个星期六我都不用担心没时间看你的直播了，再也不用狼吞虎咽的吃完饭守在手机前，再也不用因为晚上看电视被妈妈凶了，可是我真的好难过，这个舞台配不上你,<有糖吃麼>: 知道你有这么一个过程就很满足了，希望你以后能多多听到你的歌,<徐小坏真的好乖>: 我就记得毛不易的无话可说 我就记得底下观众大叫黑幕 我就记得谦谦红了眼摔了麦 我就记得杨幂看四周摇了头 我就记得花花无奈不敢直视 我就记得钟易轩他走了 走的时候还在安慰别人没关系 我就记得一家三口 只剩一人 ​  记得多回来看看毛毛,<林若楠_>: 希望九月善待轩轩，but能不能善待下我们，你不睡我们也不能睡啊 @Leo_钟易轩,<用户6023585254>: 感谢这个夏天有你们的陪伴，挥挥手，不会说再见，支持你[星光][星光][星光],<SuetKay->: 我看明日之子以來，今天是我第一次哭。一家三口，有你真好！,<-孟爷最霸气->: 孟子坤不是耍小脾气，你这个人有病吧！钟易轩看走眼了你了！,<浅巷19418>: 还会有更好的舞台等着你你很棒爱你哦加油,<等到烟火清凉Vvae>: 回复 @小生131 :大哥，认真看我的评论再来回复我好吧，首先我作为路人来吐槽这个二次元参加比赛的，其次，我大学已毕业，没有追任何这个节目的星。最后，管好你自己就行，别整天对90后00后说教！,<只是如此_66733>: 好想看你和毛毛搞基，哈哈哈哈哈哈,<小生131>: 回复 @萌的cp怎么还不结婚 :你这么追他可以给你自己带来收入，可以给你的生活带来没好，做一个有能力的人，而不是做一个吹捧他人的人，麻烦把你的名字改了谢谢,<小生131>: 回复 @森碟举纲三石mmc-Light :就是只有你们这些盲目追星的90 00后才看的脑残节目，去问问比你大一点稍微考了个好大学的姐姐哥哥看些什么内形的节目。,<小生131>: 回复 @一只高仿 :请不要盲目追星，多的时间好好读书，这些脑残粉真是够了,<小生131>: 回复 @等到烟火清凉Vvae :现在这一代追星为什么如此严重，吹捧他能给你带来收入还是什么，好好考上一个211 985的大学才是真的,<小生131>: 回复 @槱森WYT :什么二次元嘛，那个东西我们能接触到吗，现在这种90后 00后越来越多把感情寄托在这种虚拟空间上，说白了这种人全都是对现实世界混的不好的人，看这种节目的哪个混的好，自己看看身边混的好的有文化内涵的在看着啥子的节目你在看什么。,<清瞪古酒>: 我会一直支持你的  棒棒哒  加油,<致爱吊儿郎当>: 包子被淘汰的时候，开心，也伤心。离开了，就可以好好休息一下了，这段时间来自各方面的压力都太多了，是该放松一下。难得看到你和廖俊涛一起同台合作，在这个舞台上，是第一次，也是最后一次了，以后还要等多久…… 老薛说，才华皆一切，希望你们以后都可以更好,<天T猫M优惠券>: 我一直觉得我弟弟就应该是钟易轩这个样子的小可爱[心],<X14248198007>: 黑幕！黑幕！黑幕！重要的事情说三遍！,<别怼站着跟他怂>: 黑幕黑幕黑幕黑幕黑幕黑幕黑幕黑幕黑幕黑幕黑幕黑幕黑幕黑幕黑幕黑幕黑幕黑幕黑幕黑幕黑幕黑幕黑幕黑幕黑幕黑幕黑幕黑幕黑幕黑幕黑幕黑幕黑幕黑幕黑幕黑幕黑幕黑幕黑幕黑幕黑幕黑幕黑幕黑幕黑幕黑幕黑幕黑幕黑幕黑幕黑幕黑幕黑幕黑幕黑幕黑幕黑幕黑幕黑幕黑幕黑幕黑幕黑幕黑幕黑幕黑幕黑幕黑幕黑幕黑幕,<丶Sum念-范贰青春>: @张同学不是来搞笑的 : 我就记得毛不易的无话可说 我就记得底下观众大叫黑幕 我就记得谦谦红了眼摔了麦 我就记得杨幂看四周摇了头 我就记得花花无奈不敢直视 我就记得钟易轩他走了 走的时候还在安慰别人没关系 我就记得一家三口 只剩一人 ​  记得多回来看看毛毛,<丶Sum念-范贰青春>: 回复 @张同学不是来搞笑的 :说的太对了！,<Goddess十七>: 我们的直播在哪里[笑cry][笑cry][笑cry],<林初很酷>: 希望所有邪恶的人不再掌握话语权 比起黑幕之子  你还会有更大更好的舞台 你再也不用偷偷的直播了 你可以去吃你想吃的火锅 你可以出去好好的玩几天了 再也不用被关在那个小监狱里 你说你想家了可是还没见到赵雷 我们没有输给赫兹我们比不过黑幕,<悠悠Cococt>: 孩子，，，，高三了呦。。。[笑cry]   时间紧张，还会微博发唱歌不？[笑cry][笑cry][笑cry],<兮颜榕magic>: 轩轩加油，你是最棒的我们会一直支持你。]
3240435521	某位今天给我寄了一个包过来[摊手]不知道是想表达什么？？？没关系，不用接我[拜拜]@毛不易 ​​​	[<_薛之谦的二砸>: 回复 @刘云龙loong :沉了沉了[doge]捞你,<肖潇潇xiao>: 回复 @片桐夏莲 :感觉是建设路口的步步高,<唯颖偏偏是希旭歌紫>: 不易要包养你啊啊啊,<红瓦蓝瓦>: 一直想知道你用的滤镜,<我向往安逸>: 回复 @奈之鹿 :垃圾，[doge],<二货我遭不住>: 回复 @刘云龙loong :捉！,<曾白很白>: 看了昨晚的直播就想总结一句三位的家庭地位：轩轩就是家里调皮大王，一个劲的淘气毛妈妈，毛妈妈宠孩子无法无天，全家唯一妥协制住所有人的就是廖爸爸。[哈欠],<落花241>: 这是步步高·梅溪新天地,<-小仙女的鹿角->: 毛不易：叫爸爸[doge][doge][doge] @毛不易,<戾气很重的微博>: 带上涛涛一起玩啊 想涛涛了[哈哈],<钟yi轩>: 轩轩要去哪里，不要毛毛接啊,<程陌渊>: 酸意// @以薛之名谦胖轩的手 ：毛不易不用来接我~真的不用~他一个人很开心~真的很开心~没有我他很开心~我回北京住宾馆才不会跟他住~又丑又胖~还不洗头不洗澡就爬上我的床~然后我就被臭醒了~有没有毛不易的粉丝告诉毛不易熬夜不好~建议他通宵~猝死~猝死~去死~”以上是某人半夜十二点醋味十足说的话 @毛不易,<惊鸿啊>: 回复 @奈之鹿 :在这位博主的回复里发现了一群老实人。[doge][doge][喵喵][喵喵][喵喵]快来欺负他们！！,<毛不易的203>: 回复 @刘云龙loong :你一定是个高坊[doge][doge],<莫大小姐太懒了>: 回复 @吃羊的桔子 :爱他就给他买包包[笑cry],<那年盛夏我们的Heart>: 回复 @阿呆瓜呀 :手动艾特 @廖俊涛是铁头   [doge],<凛绘绘>: 回复 @思爷W :可以发一份给我看吗。[太开心][太开心][太开心],<窝是鹿晗的胖猫>: 哈哈哈哈哈哈是我的错觉吗 我觉得我们公司旁边百度的小哥哥背的都是这种包 还有logo哈哈哈哈哈,<顾顾顾顾顾顾涵>: 回复 @汤青芬 :轩轩在快手直播的时候说的?,<茉莉飘香122>: 回复 @紫伊Zyyy :轩轩还是个孩子~,<Leo-薛紫涵>: 说实话还是那个小黄人的适合胖轩哈哈哈,<丹江88潮牌发廊>: 回复 @灿妮家的多芬儿的主人的真_女友 :90后们顶起来让我们看看你们是喜欢毛毛的(消愁)多一点还是他的(借)多一点哪？ @毛不易,<久别情牵冰释前嫌>: 回复 @奈之鹿 :请不要给我家(划掉)毛毛家轩轩招黑，谢谢，三个都喜欢的我好尴尬，(但喜欢巨胖多一点[笑cry][笑cry]),<无话可说立场独秀302>: 回复 @L佳琪 :ID多少,<豆豆豆丁的姐姐>: [鼓掌][嘻嘻][嘻嘻],<想当科学课代表的数学课代表>: 回复 @刘云龙loong :捞捞捞捞捞捞捞捞~,<铁头娃a·>: 回复 @高贵狠毒的黑屏 :[喵喵]捞,<lh-wyf-exo>: 回复 @边手控 :嫉妒使我丑陋。,<怀蠢阿荒>: 坤哥不是笑起来像钟易轩吗？那毛毛？？你。。。。[doge],<清风彬蔚>: 回复 @__shell__ :好帅,<两杯奶茶->: 回复 @Toon_ :超级刺激了,<Toon_>: 回复 @两杯奶茶- :肯定很刺激，[噢耶],<忘記ways->: 当然是送包给你吃啊,<萌妹子没电量>: 回复 @以薛之名谦胖轩的手 :轩轩的快手名字叫什么,<冷色系少女_>: 轩啊……憋再吃了,<江丁浣>: 回复 @薛之葱 :对头,<易夏忆然>: 回复 @阿呆瓜呀 :廖俊涛：我恨！[doge],<薛之葱>: 回复 @江丁浣 :两受相遇，必有一攻,<用户6098663420>: 回复 @你胖到我了诶 :你好 能发我一份文字图吗[眼泪],<我想我会好好的201708>: 回复 @一碗咖喱鸡半盘小龙虾 :好想看原微博,<Dear-liusizhe>: 回复 @你胖到我了诶 :我想要，私信我嘛[可怜],<我想我会好好的201708>: 希望下一期看到巨星做词，涛哥做曲一起演唱，一家三口,<我想我会好好的201708>: 回复 @刘阳阳的迷妹儿 :在哪,<跑跑家的小萌萌>: 回复 @刘云龙loong :上去上去[doge][doge][doge],<l卟噜噜l>: 回复 @一碗咖喱鸡半盘小龙虾 :他是如何做到158  手却好看的要死的，他妈的，这个手,<薛先森的火锅小妹>: 没办法那天巨星在陪我睡觉[摊手][摊手][摊手],<用户6311038870>: 回复 @QIAN谦5 :视频在哪里看的啊？[悲伤][悲伤][悲伤],<一杯清酒q>: 难过的时候就会来看看你的微博，好有爱，没有什么过不去的，加油,<汤青芬>: 回复 @Cmd荏苒 :搜索廖俊涛铁头娃,<葡萄味的汽水7>: 回复 @-哒哒哒哒哒927 :没事儿[太开心],<李婷婷婷婷婷t>: 正解是，装满零食回来见爸爸[doge],<冯w佳j妮k>: 轩轩吃醋了，哈哈哈]
3240435521	论在三个不同的城市该怎么办[摊手]丑陋@毛不易 @廖俊涛是铁头 ​​​	[<软胸>: 回复 @真丑-了 :神经病吧，我不要面子的啊[doge],<毓Lang>: 一家三口  谁也不丑,<_奈溪>: 回复 @Leo_钟易轩 :可是这张图wuli涛涛最高贵诶[doge],<张狒狒狒狒>: 啊啊啊，毛毛头发好丑，哈哈哈哈哈哈哈哈，但是还是好喜欢，哈哈,<萌谦的大长腿>: 回复 @钟易轩的板蓝根 :马老师是亮点[允悲],<可米露黎薇>: 回复 @丸子大人丶cy :哈哈哈哈哈,<张丽雯丽雯雯>: 回复 @又是易年秋峰起 :哈哈哈哈，笑出猪叫声,<张丽雯丽雯雯>: 回复 @蓝莓味的薛之轩 :哇，这是哪期看的？,<张丽雯丽雯雯>: 回复 @Ahuttzshiqiiii :毕竟他最高贵[允悲],<仙女嘉-JIA>: 截之前问问他俩摆好姿势了没,<活宝贝烊烊2023>: 那就去到一个城市啊！[挖鼻][挖鼻],<HUHANG->: 回复 @真丑-了 :大黑粉 孤立你!!![允悲][允悲][允悲],<提着刀的小可爱>: 回复 @Leo_钟易轩 :哈哈哈哈哈哈哈哈,<花生-半月>: 回复 @memory顾懵 :哈哈哈哈哈哈哈哈哈,<无知狂人>: 回复 @真丑-了 :你可能会被打死,<张若曦_XINZ>: 回复 @真丑-了 :净化一下[doge]  http://t.cn/RNig2td,<memory顾懵>: 回复 @花生-半月 :放心，一定会的[允悲],<Lc北宸>: 回复 @钟易轩的板蓝根 :恍恍惚惚 马老师,<染言若>: 回复 @真丑-了 :爱到深处自然黑[允悲][允悲],<我是你的意钟人Leo钟易轩>: 回复 @宗宗诶 :666666,<Lily要做百分之十一里的一欸>: 毛毛的美颜 是嘛 笑死了 灯光打得真好 哈哈哈哈,<小小小葫芦侠i>: 超级喜欢你 你的背后永远有我🙈,<雯yaw>: 回复 @Leo_钟易轩 :哈哈哈哈哈哈,<sweet王王王>: 回复 @Leo_钟易轩 :你最美丽,<薛三岁的小甜豆>: 回复 @真丑-了 :哈哈哈哈，你薛不要面子的啊,<冯媛媛_v>: 回复 @又是易年秋峰起 :哈哈哈哈哈哈哈哈哈,<毛不易的借>: 回复 @Leo_钟易轩 :你好，我就叫有多少人[并不简单][并不简单],<鳁鲸o>: 回复 @Leo_钟易轩 :666,<毕业季学森>: 一家三口在不同地方了[泪],<Daring910>: 回复 @真丑-了 :哈哈哈神经病我不要面子啊,<新垣璃奈>: 回复 @真丑-了 :翻评论的表情包真是太吃鸡了[笑而不语],<地主家的傻南南>: 回复 @真丑-了 :薛之谦:我不要面子的啊[二哈][二哈],<青柠薄荷夜87413>: 回复 @气炸毛的智障苏 :快删掉！删掉！！,<大山上都是熊>: 就这样丑在了三个城市,<韩振东的小祖宗>: 一家三口 谁都不丑 要高贵🤔,<莫莫莫莫丶非>: 回复 @Leo_钟易轩 :看你你不知道你的表情包已经疯了 @Leo_钟易轩   http://t.cn/RNMQR1C,<沉迷于Harry的兔子>: 哈哈哈哈坏人就是我，我要打破7000这个美好的数字,<抠脚女神徐瑶瑶>: 回复 @Leo_钟易轩 :我想和你睡觉,<抠脚女神徐瑶瑶>: 回复 @Leo_钟易轩 :毛毛的发型亮了,<思柳思无涯>: 你最高贵[摊手],<坏情绪Ling>: 回复 @钟易轩的板蓝根 :易廖之钟,<谦珊万水之为你>: 回复 @真丑-了 :黑粉谦友23333[笑cry][笑cry][笑cry],<Ms小可耐>: 回复 @Leo_钟易轩 :高贵高贵,<席安bf>: 回复 @毛七七Sue :这马赛克打得，我给满分,<席安bf>: 回复 @周大锅是什么锅 :水土不服就服你，哈哈哈[开心],<孟子坤小迷妹珂珂>: 回复 @宗宗诶 :哈哈哈哈哈哈,<秀秀丫头的女孩1991>: 满屏的甜都溢出来了，你们要好好的相亲相爱哦[太开心][太开心][太开心],<10萌萌哒虎牙>: 回复 @钟易轩的板蓝根 :马老师你成功吸引了我的注意力[允悲][允悲],<blue看不见自己>: 依稀看到了毛毛的脑门儿[偷笑],<可以疯可以静的馨雨小窝>: 你是不是给自己美颜了[笑cry],<患失21>: 这个节目绝对黑幕 没有家世没有才华 直接淘汰 才华是观众认同的 家世是节目组内定的 有同意的吗,<时光亦舒>: 一家四口[心][心]  http://t.cn/RNIfTlW,<薛让我儿砸>: 回复 @真丑-了 :再丑你们也想上不是吗[doge],<没有必要233>: 回复 @梦梦梦幂方 :哈哈哈哈哈,<又是易年秋峰起>: 回复 @怀春少女5 :毛毛帮胖轩戴耳返[doge],<妄想上了孟子坤>: 回复 @Leo_钟易轩 :很多人想和你睡觉？对不起我也想[允悲],<用户6244244223>:  [嘻嘻]看微博里的视频，有惊喜！！！！！！！！！！！！！！[鼓掌]]
3240435521	“都知欢聚最难得，难耐别离多。” ​​​	[<用户6318225376>: 为啥评论发不了图片啊！,<skt必胜>: g，ac  http://t.cn/RNV1kzz,<skt必胜>: 嗯啊rte #宋茜上古情歌#  ah发现  http://t.cn/RNV1gVh,<丽颖家的丽妹妹>: 没事的，加油！会一直陪你,<____Dlyan>: 我刚刚看了直播，感觉毛毛状态不佳诶。然后翻到之前涛涛的采访说他自己回来第一是帮轩轩，第二就是给毛不易安抚情绪了。现在大家都很忙，轩轩也回不来，怎么办，之后的比赛越来越不容易,<彼岸花开旧人不在>: 愿你想要的都拥有,<彼岸花开旧人不在>: 没事来轰炸你的评论,<杨家将and谦友>: 一家三口就剩毛毛了,<史小倩呜拉拉>: 回复 @一毛不拔伦 :我是艺术家,<一毛不拔伦>: 回复 @史小倩呜拉拉 :哇，您这么厉害，连这都知道。,<孙天棋LYF>: 离别意是相聚，相聚意是重逢，重逢意是等待，等待意是永远，永远是一辈子的事，路还长，我们都在。[心][心][心][心][心][鲜花][鲜花][鲜花][鲜花][鲜花],<史小倩呜拉拉>: @一毛不拔伦  歌词是不是gala的骊歌,<季末烟花妄想寂寞2364>: 钟易轩你咱那么帅呢？,<我是你的意钟人7777>: 回复 @钟龙龙的老婆小睿睿 :捞群主,<爆发的巨星>: 回复 @玺宝宝--like--you :我觉得毛不易唱好听,<Jokerlin8398>: [心][心][心][心][心],<Jokerlin8398>: [心][心][心][心],<Jokerlin8398>: [心][心][心],<木子喵34567>: 这句话不会是巨星的歌词吧,<Jokerlin8398>: “都知欢聚最难得，难耐别离多。” ​​​,<恒河上的一粒砂>: 回复 @C小喵子 :辛苦了[心],<兔子不吃三文鱼>: 听说你粉丝团应援歌抄袭了徐海俏的南下[并不简单],<多眼皮怪兽>: emm别难过了。都是这样。加油。,<恒河上的一粒砂>: 回复 @C小喵子 :哈哈哈，戏精学校毕业的我们[心],<恒河上的一粒砂>: 回复 @C小喵子 :哈哈，感谢[心][心][心],<恒河上的一粒砂>: 回复 @毛先生最好看的小迷妹 :醒醒[顶],<C小喵子>: 回复 @恒河上的一粒砂 :不累不累[doge],<C小喵子>: 回复 @恒河上的一粒砂 :为石少服务[doge],<南极星天使>: 回复 @砂糖桔XD :粉丝嘉年华,<南极星天使>: 回复 @奈之鹿 :这是粉丝嘉年华的那次吗,<最喜欢的毛先生>: 回复 @恒河上的一粒砂 :噢不他已经是我老公了,<恒河上的一粒砂>: 回复 @毛先生最好看的小迷妹 :[哼]以后的男朋友就是毛毛的标准,<最喜欢的毛先生>: 回复 @恒河上的一粒砂 :傻子,<最喜欢的毛先生>: 回复 @恒河上的一粒砂 :捞你吧还是,<恒河上的一粒砂>: 回复 @恒河上的一粒砂 : @毛先生最好看的小迷妹  呐，就是这里啦[心],<memory顾懵>: 回复 @青柠是lime :诶，我要转学转学，但是我刚刚初中欸[允悲][允悲],<memory顾懵>: 回复 @哈哈哈哈哈哈昕 :我不要回去念书啊，多留我几集不好吗[允悲],<memory顾懵>: 回复 @玺宝宝--like--you :会有的，一定会，不管等多久我都会等,<恒河上的一粒砂>: 回复 @C小喵子  的赞:还有穿山甲，爪爪累不累，么么[心],<恒河上的一粒砂>: 回复 @毛不易时有时无的屁股  的赞:谢谢屁股，贴你[心],<秦子墨_Mo>: 我是你的意钟人！给钟易轩打call！,<恒河上的一粒砂>: 才知道这是一首歌的歌词。刚在唱吧里听毛毛唱了，想到你的微博心里一惊。人生是一场错过，愿你别蹉跎,<2017我们易起峰吧>: 钟易轩  加油！你是很棒的！ 这个节目只是铺垫，他会让你以后要走的路更好！你也会更好，更好，更好的！ @Leo_钟易轩   [爱你][爱你][爱你],<酸奶姐姐er>: 回复 @北海情话_ :就是穿衣服他的衣服吖[微笑],<酸奶姐姐er>: 回复 @北海情话_ :对的[太开心][太开心][太开心],<鹿雨清>: 青山不改绿水长流 来日方长 后会有期,<洪俊毅>: 回复 @松鼠家的迷迭香 :甜腻,<你是一夜一夜排成的酒>: 回复 @CYY是個神經病兒 :好的谢谢你哦，我已经找到啦[太开心][太开心][太开心],<CYY是個神經病兒>: 回复 @你是一夜一夜排成的酒 :你打 廖俊涛 猪一样 就能搜到了微博,<畫中旳伱還在>: 钟易轩同款渔夫帽走起了[doge][喵喵][二哈][笑而不语],<O吴攻不受鹿M>: 回复 @Monster冗余 :现在只能毛毛唱,<单纯的猫猫>: 难奈吧，字错了？[哈哈][哈哈][哈哈]]
