5581682776	习近平主席，向您致以生日祝福，祝您长命百岁、身体健康。 ​​​	[<程儿kimi>: 习主席生日快乐[心][心],<我叫刘刘刘恋>: 习大大，生日快乐……[草莓蛋糕],<linan楠楠楠楠楠>: 习大大，生日快乐,<雪糕GO>: 生日快乐！带领中国更加强大吧！,<向泥玛开炮>: 习大大，生日快乐，也祝 @莫迪总理身体健康,<超级无敌巨帅的我>: [握手][握手][握手]谢谢莫迪总理的祝福～同祝习大大生日快乐[蛋糕][蛋糕][蛋糕][蛋糕][蛋糕][羞嗒嗒][心][好爱哦][鼓掌][礼物][爱你][爱你][爱你][爱你],<踏雪有痕踏石无印>: 祝中印人民携手共进，开创未来美好生活！,<happy羊羊羊妞>: 习大大安康长寿[蛋糕][蛋糕],<力贝立>: [吃惊]生日幸福。,<入云高峰>: 祝习大大生日快乐[蛋糕][蛋糕][蛋糕],<邱旭瑜律师>: 哈，印度总理也来了！,<JuSirr>: 谢谢印度总统莫迪！[赞啊],<JuSirr>: 谢谢印度总统莫迪！,<庞紫建>: 谢谢莫迪总理 也祝您身体健康 长命百岁 中印友谊长存[中国]🇮🇳[握手],<YZ一蓑烟雨任平生>: BEST WISHES TO YOU.,<素描1891880717>: 习主席，今天生日？,<美丽三门湾>: 祝习大大生日快乐，长寿安康！[蛋糕],<FeNenNe>: 习大大长寿[鲜花],<稀饭的旅行>: 生日快乐，习大大！,<及花时还许我以烂漫>: 习近平同志，生日快乐！,<小平在花果山>: 习近平同志生日快乐,<小平在花果山>: 习近平同志，生日快乐！,<蜗蜗洗护经销商阿霞>: 习大大，生日快乐,<天轩云泽>: 谢谢您对习大大的祝福，同样祝您身体健康，万寿无疆。,<手创世家>: 习主席生日快乐！,<苍南陈警官>: 伟大的总理，中国人民的好朋友！[赞],<晓莉Haley>: [蛋糕][蛋糕],<易呼通刘骏>: [蛋糕][蛋糕][蛋糕] @学习粉丝团  ,<精彩投行>: 我替习主席谢谢莫迪总理，祝中印两国人民友谊长存[嘻嘻],<ziwen-L>: 中印两国山水相连，希望世代友好。 祝愿莫迪总理身体健康，带领印度人民不断前行发展。,<T爷微博>: 莫迪又不乖了哦哈哈,<叮咚吉祥撞如意>: 习大大生日快乐！身体健康！,<weili出世>: 祝中印友谊长存！,<公益人张青>: 中[中国]印🇮🇳两国友谊长存！,<侠家军-是诸暨球迷>: 也祝莫总理长命百岁,中印友谊长存.,<宽宽而来>: 大大生日快乐[蛋糕],<徐研玲>: #习大大615生日快乐# [蛋糕],<西安三人行民宿>: 习大大生日快乐！,<冰琳王者>: 祝我们的习大大健康快乐！生日快乐！,<大唐摄影室>: 生日快乐！[蛋糕][蛋糕][蛋糕],<公民钟长春>: 谢谢您的祝福，我代表习主席对您的祝福表示衷心的感谢！同时也祝您身体健康，工作顺利！,<道德仁义理智信>: 习大大生日快乐[蛋糕][蛋糕][蛋糕],<朝阳大爷之一西游记的世界>: 我也是今天生日！,<太阳喜花>: 习主席生日快乐，身体健康![皇冠][蛋糕],<云浮动人>: [礼物][蜡烛][蛋糕],<云浮动人>: 生日快乐[礼物][蜡烛][蛋糕],<兰惠风清>: Good Morning!......[心][心][心],<云浮动人>: 生快[礼物][蜡烛][蛋糕],<安溪观音哥>: 习大大！生日快乐！[蛋糕][鲜花][鼓掌],<i小鸭老师>: 谢谢你！[作揖]]
5581682776	祝大家圣诞节快乐！ ​​​	[<chunhui3643>: 莫爷爷  我想问你的中文怎么这么好啊？,<阿森1993_91064>: 回复 @Vera懿 :hello indain three, goodby indain three[拜拜],<兰惠风清>: [good][心][哈哈],<Vera懿>: 回复 @熊猫阿森 :your English is terrible， you are fool[拜拜],<铁马秋风912>: 中国人过年不过圣诞[害羞],<橙纸hahaha>: 总理圣诞快乐！[赞][赞][礼物],<天地贵仁>: 圣诞节已过，即将迎来２０１６年元旦节。祝元旦快乐！顺便给总理阁下提个建议：印度是个人口众多的世界大国，又是金砖国家，在国际上有着特殊的作用，最近，看到总理突访巴基斯坦，实现政治对话，政治和解，化解印巴之前的分岐。所以，建议总理对全球各国提出把２０１６年成为全球各国政治和解的一年。,<漂泊金城>: 你们国家为什么强奸幼女的案子那么多，你作为总理做了神马？,<dubinku>: Merry Christmas to you too. We thank you so much for all your efforts in improving the Indo-China relationship. Take care of your health, Mr. Premier.[给力],<滥温心>: 为什么你们印度喜欢拿中国比[doge]差距太大居然还比的有劲[doge][doge],<还记得吃水不忘挖井人>: 【外交部：对印度总理突访巴基斯坦表示欢迎】外交部发言人陆慷12月26日就印度总理突访巴基斯坦答记者问，对巴印关系这一最新进展表示欢迎。“作为巴印共同的邻居和朋友，中方乐见并将一如既往地支持巴印两国继续通过对话增进互信，实现共同发展。” 真棒,<古赵苍声>: 老莫，您好！中国永远是您的好邻居！,<cgm0919>: 建议总理整一个转发抽奖活动，奖品是印度妞儿。,<YUNLAOCHAN-2016>: 多少中国人佛教徒连佛的生日都记不得，搞得跟真的一样去给耶稣过生日。,<马晓明律师>: Merry Christmas,<Jeffaparis>: 我喜欢你 圣诞节快乐,<l牛岭>: 这条微博是你自己发的吗？你懂中文？迟来的圣诞节你好圣诞节快乐,<张书虎>: 总理好！今天我生日[害羞],<姚斌248636>: 总理好咯[doge],<给你一双明亮的眼睛>: 总理、圣诞快乐[鲜花][心][蛋糕][蜡烛][蜡烛][蜡烛][太阳],<Smart蚊>: 和我们的李总理一样，挺亲民的，顶,<伯十牙君>: 谢谢阁下。应该向印度人民问候。印度四百年来被殖民的历史，似乎忘记了印度古代文字、语言、习俗。而中国没有。当然，对印度的神秘充满向往。,<叁六零零>: 圣诞节什么时候成了东方人的假日了？[吃惊],<海夜子courage>: 莫总理圣诞快乐！,<hermg>: 老莫信的不是印度教？,<用户128988>: 虽然我不是基督徒，有这个节日就该祝福，圣诞快乐！,<同庆UP>: 怎么说呢！！！我一点都不快乐！印度高铁都给日本了！叫我怎样快乐？！ @莫迪总理,<用户5124673119>: 总理阁下：祝您和印度人民圣诞快乐！祝福中印友谊延绵久远！,<襄阳老大>: 我们早豆过完了～,<屌顶天>: 老莫，中国欢迎你！,<Survival你呀>: 圣诞节管我们中国屁事,<怎么也睡不着的石头>: 老莫圣诞[圣诞老人]快乐！,<清寻烟>: 圣诞节快乐莫迪总理,<IAMLIAOXIANGHUA>: 总理，圣诞快乐。,<心海莲花>: 期待你们圣诞快乐，我们快乐不快乐没有人管，你们不快乐，邹邹眉头立马有人送钱送温暖！我们的快乐和生命不如草芥！,<羽化的背影_5654>: 商业化的圣诞仍然干不过春节[眼泪]大年三十街上空无一人那才叫过节～欢迎过来玩哟～,<迪凯拜丝>: 圣诞节快乐，总理先生，祝：中印经济更好发展,,<杨柳-河边>: [鲜花][礼物],<胖胖是肥肥>: 圣诞快乐[害羞],<Hv红红>: 天天过节，天天开心，旡关乎宗教，大家图一乐么，对不？圣诞快乐，莫迪总理吉祥哈哈哈哈，耶[心][礼物][耶],<音乐泥123456789>: rice gali。[许愿],<武汉後街老男孩>: 既然送我们祝福了，那我们就乐呵乐呵吧！,<一点儿也不懂>: 这个时候应该有歌舞[doge],<阿娜妹子>: Merry Christmas,<孙嘉遇吖>: 你也是哦，圣诞快乐,<WOAINI牛洋>: 莫迪总理好辛苦！,<花开成了云云也开成了花的模样>: 谢谢莫迪总理，中印都是文明古国，希望中印友谊长存，互相取长补短，共同发展，不要受别国的干涉，而破坏两国关系。希望中印两国在不久的将来都成为世界强国！,<v刘铭>: 总理的贺卡，Marry Christmas!,<天津保税区平行进口车专卖>: 总理应该是佛教徒,<邪恶的一切>: 圣诞快乐总理先生[礼物][礼物][礼物] [开心] [开心] [开心],<老董0826>: 我们明天过毛诞节[大笑]]
5581682776	朋友们你们好。在冬至节气祝福你们，祝愿节气给大家带来幸福繁荣。 ​​​	[<梁山掌门人>: 总理你好;你觉得中国出问题了吧,<一只小小橙->: 总理好[哈哈][哈哈],<管仲战商鞅>: 给印度来十场文革，这样你们印度才有12亿人口不然还是只有2亿人的国家，因为其他的都是牲口啊。你们这些贱民跟低种姓不知道什么是往后将相宁有种乎吗,<乔来乔往hq>: 总理请关注下你们国家的女孩子，她们太可怜了。,<嬴璃>: Congratulations to you on the releasing of your book ‘Convenient Action - Continuity for Change’, sir.,<DimitrovAlexandrvich>: 谢谢，太客气了！[嘻嘻],<北寒先生>: 谢谢总理，祝中印两国友谊长存,<耕耘岔河陈永军>: 莫总理好，中国通啊！,<我的名子叫王世祥>: 你们在哪，我看不见！！,<丹增让卓>: 莫迪总理，我做為一个藏族人愿您身体健康长寿幸福，愿您国民健康长寿幸福，扎西德勒,<关中箭侠>: 政治是政治，友谊是友谊。谢谢莫迪总理还惦记着中国的节气和中国的人民。中印不能对抗，要合作。,<行走之间的围脖>: 莫迪总理够有人情味儿，还知道中国的节气哦，印度是个很有特色的国家，希望以后到印度旅游更加方便，你也别受安倍的蛊惑，这人不靠谱，中国人实在多了，可以做印度的朋友👬[开心],<Chn老菜鸟>: 总理先生，您好！难得在中国的冬至节令收到您的祝贺！中印两国都是几千年悠久历史的古国，当前都在朝现代文明及繁荣的道路上奋进。希望彼此捉携！,<稀饭的旅行>: 也祝您节日快乐，有时间可以吃一下中国的饺子。同时祝您两天后的圣诞快乐！七天后的元旦快乐！祝您阖家幸福！祖国和平发展！,<唐僧的白龙马>: 希望两国加强双边交流，加深两国人民友谊，共同致力于维护地区和平。,<中原DI>: 听说最近你和安倍走的很近？,<天边的这朵云>: 别废话，把藏南还给我们,<五星红旗风中飘>: 中印佛家文化博大精深,<我是卖女孩儿的小火柴儿>: 呵呵，好可爱的总理。,<蜗心相随>: 风在吼，马在叫， 阿三在尖叫，飞机往下掉， 巨人花车万丈高， 摩托开挂不得了， 公交车里痴汉狂魔真不少， 贫民窟里强奸犯在逞英豪， 阿琼在公路抛锚， 潜艇在码头自爆， 保卫孟买，保卫恒河， 保卫印度教！,<法音法慧>: 喜欢印度古文化，佛陀教育。真诚祝福莫迪总理圣诞快乐。[鲜花][鲜花][鲜花],<隆歧>: 祝印度人民早日实现小康~~~走向富裕。中印友好不打仗哈~~~,<诗语2011>: 总理您好[握手],<chenyanru88>: 总理，以后高铁采购项目多多关照中国啊。毕竟咱们是邻居，远亲不如近邻嘛。,<天地贵仁>: 印度也有冬至节吗？中国冬至即进入数九寒冬，三九，四九最寒冷！在电视看到您为印度发展太阳能，利用太阳能。这个决策正确，祝成功，造福印度人民，也有利全人类整体利益，培养，树立全人类整体利益的新的意识形态，迎接全人类新时代的到来！,<HB杨彬>: [握手][握手][握手],<蓄兴>: @英国首相  你的祝福呢，首相大人[江南style],<retouch-mq>: 谢谢总理，好温暖得总理,<DX_斌仔>: 小莫同志，有空来潮汕喝工夫茶,<东南时空>: [鼓掌][鼓掌][握手][握手],<这个应该没人了吧>: 先生好！谢谢您的关心[心],<什么是胡>: 先生好！谢谢您的关心[心],<张鹏他哥>: 日本高铁好呵呵哒祝你好运[鼓掌][鼓掌][鼓掌],<缘千>: 总理记得吃momo,<iwastheonly>: 代表习主席祝您身体健康，别老想着跟俺们干仗就行,<老麦克518>: 祝愿印度人民与中国人民世代友好！莫迪总理，中国的古代名言：日久见人心！,<马仔君君sir>: 侵略中国领土和侵略别国的侵略者垃圾 made in india=made in evil,<流光电神>: 您的中文翻译不咋地,<柳树用粉>: 莫迪总理萌萌的[心][鲜花][微风][haha]欢迎您2016再来我的国家。爱您[haha][haha][haha],<浅陌悠悠>: 早上好总理[笑cry],<水清汀淋>: 我就问问，瑜伽怎么不发了？,<陇上纤夫>: 祝福莫总理健康！,<山花烂漫不是梦>: 总理阁下：昨天是冬至啊！,<守望龙魂>: 谢谢总理祝福！同样的祝福送给您！古城西安欢迎您再次到来！,<周星星28岁>: 愿中印永世交好。友谊长存。,<给你一双明亮的眼睛>: 祝福总理圣诞节快乐[鲜花][心][蛋糕][蛋糕][蛋糕][太阳],<江南皮革厂荣誉董事长>: 摩托车没机油的话 我可以给你们寄过去的,<ximinguiling>: 希望印度在您带领下，人人、男女能更平等，人人都活得有尊严。,<设计观察员>: 总理你咋不买我们高铁呢？,<竹林幽幽在路上>: 一直觉得印度是个很神秘的国家。为什么每个国家邻居关系都搞的不好呢？这是为什么?_?,<竹林幽幽在路上>: 一直觉得印度是个很神秘的国家。为什么每个国家邻居关系都搞的不好呢？这是为什么?_?,<我小民工>: [good][good],<小孩孩ID>: 大家的祝福说的好]
5581682776	在中国国庆日，我向中国人民表示祝贺！ ​​​	[<蚂蚁金服客户中心>: 回复 @手机用户2908338505_441 :亲，是他人给您转账，您未收款款项，是么？方便的话，请把您的支付宝账户、转账日期私信给到我们，以便我们为您进一步核实。（为了您的信息安全，账户记得私信给我们，不要贴在评论中哦）,<手机用户2908338505_441>: 亲爱的莫迪总理我什么新浪微博写了两个多月的文章在9月初有人打了一笔万5万以上的款给我在支付宝我的客服里面我到现在连一分钱都没收到是不是该维权打110处理,<来一个人头饭>: 看完百度百科-莫迪 之后，我真的只想说，还我藏南！,<不讲前面>: 我很想知道，这是您亲自发的？您会汉语？ps:没有别的意思，只是有点好奇，，，我很喜欢您的，我觉得您和我们李总理一样亲切，受人尊敬,<少爷weitao>: 为什么宁夏安全生产监督局就是不出具事故责任认定书了？？？？？ http://t.cn/RUMW6Fo 就因为是农民工……………难道是包庇,<猎豹锄奸>: 回复 @马雲霆 :擦屁股也是用手哦,<龙角山人1935>: 谢谢总理！[拜拜],<渐冻症肌萎缩肌无力的患者>: 求关注扩散帮帮渐冻症肌萎缩肌无力病的我，一次转发是你的一份爱心，也是你给我生存的一线希望，谢谢,<屌撕终有逆袭日>: 回复 @马雲霆 :擦，莫迪哭晕在厕所,<那年79467>: 莫迪大叔，麻烦你告诉日本和美国叫他们快点离开南海，要不然他们会有报应的，还有叫他们去看下心理医生,<那年79467>: 回复 @雪的寒 :我觉得你更垃圾，你要是觉得垃圾就不要在这里,<向日葵哥哥i>: 回复 @深圳ISO9001认证 :支持你妹,<Jaremi>: are you ok[哈哈],<朱洪平在三一>: 积极响应莫迪总理的号召，让中印两个人口大国加强合作：＂我们可以共同努力，使世界更加美好＂。三一梁稳根董事长最近带中国考察团拜会了莫迪总理，是中印加强合作的具体行动。,<朱洪平在三一>: 积极响应莫迪总理的号召，让中印两个人口大国加强合作：＂我们可以共同努力，使世界更加美好＂,<山口弓長君>: Zangnan is China.,<风雨无存1>: 我想说，写作文要注意格式。。。,<找一个不重复的名字>: 回复 @不潮不用花钱35973 :需要这种价值，才保护生命。,<不潮不用花钱35973>: 回复 @找一个不重复的名字 :只是幻想而已？,<找一个不重复的名字>: 回复 @不潮不用花钱35973 :不是，现在是开拓丛林和建立价值的时期，人是会选择的。确实未来的预测是不可能的，但维护一种价值才能越过丛林。,<不潮不用花钱35973>: 回复 @找一个不重复的名字 :不是丛林？你太幼稚！从来都是，这丛林很深，你还看不懂吗？,<找一个不重复的名字>: 回复 @不潮不用花钱35973 :事实是世界不是丛林，你要指控印度什么？尊重秩序和谨守秩序的国家，不要恐吓。,<不潮不用花钱35973>: 回复 @找一个不重复的名字 :我说的是事实，一个国家要量力而行,<龙角山人1935>: 五律: 展望 中美俄欧印，筹描一画图。 文明优互补，博爱竞风流。 仁徳齐天下，和谐满地球。 万邦成一体，绮梦共谋猷。,<找一个不重复的名字>: 在可能的未来，也许我们真正需要印度的帮助，希望印度的发展更佳。,<找一个不重复的名字>: 回复 @不潮不用花钱35973 :恐吓其他国家和人是错误的，你需要道歉，尊重每个族群的发展，尊重人的基本权利。,<不潮不用花钱35973>: 我们中国人要是真的在做扩张战略，你们印度己经很惨很惨了，我们可以毁了你们，你们却不能做什么，你们要珍惜，明白几斤几两,<国家剧院nationaltheater>: 加中国网友为自己粉丝才是君子。 @莫迪总理,<伯灵>: 莫迪总理不会用的是诺基亚手机吧，来上海我送你一台中国生产的锤子手机，顺便请你吃个火锅，听说你们吃饭是用手抓的[哈哈][哈哈][哈哈][哈哈][哈哈][哈哈][哈哈],<用户5734333572>: China is a great nation, with a great culture,<生物圈2>: [微笑] [嘻嘻] [抱抱] [不好意思] [群体围观] [月儿圆] [lt冰封],<未曾懂015>: 行动更有说服力   不要说一套做一套,<牛奶侠i>: 回复 @工资低的够擦屁股 :。。。。。,<Kaixin0002>: 回复 @LOVE穩妥小青年 :给你子弹[哈哈],<牛奶侠i>: 回复 @工资低的够擦屁股 :你给我枪吗[微笑],<swarup>: 今天是印度西孟加拉邦的秋节的第一日、愿大家很开心。Best wishes to all on the occasion of Durga puja & Navratri !!! বাঙালীর দূর্গাপূজোর ষষ্ঠীর সকালে সকলকে জানাই প্রীতি ও শুভেচ্ছা[祈祷][玫瑰][微风],<Kaixin0002>: 回复 @LOVE穩妥小青年 :去保卫钓鱼岛吧,<牛奶侠i>: 回复 @工资低的够擦屁股 :我说我的，该你什么事[微笑],<Kaixin0002>: 回复 @LOVE穩妥小青年 :烦不烦,<南山氺忆>: 滚出南海和藏南，肮脏的印度阿三。,<二伟灬思密达>: 藏南是我们的！[围观],<清水无痕水>: 没想到您竟和日本那麽好，讽刺中国，告诉您日本是仇人。您和日本关系再好，也是比不上巴铁十分之一的。,<清水无痕水>: 总理您好，边界问题要解决把藏南给我们吧。看我们国家的历史尤其是汉族，是不会侵略邻国的。。。。。,<求保护的孩子>: 感谢莫迪总理对我国的真挚祝福！希望我们两国的友谊源远流长！[哈哈],<孤独求败74>: 莫迪总统你好[嘻嘻],<森林中的小飛俠>: Arunachal Pradesh is Chinese！,<12306和谐号>: 分享图片  http://t.cn/Ry1i7XC,<Falaicc>: 感谢莫迪总理在中国国庆节发来的诚挚问候！希望在您执政期间中印友好和互信得到提升，共同繁荣！,<施兵->: 中国军方重建了吗？他们拆，我们再建。// @何光伟 : 贵国军队前些日子拆了中国军队的房子，你们那都是城管吗？咋也不提提赔偿问题啊[挖鼻],<青色的_光>: 我没发现，总理君,<那年79467>: 莫迪大叔你们周边国家天天说中国威胁，我看你们才威胁呢!天天拿中国来说事，中国能有今天不是去威胁你们得来，等你们被日本抢光，杀光，烧光就知道中国能有今天是怎么来的。,<富兰克林冀宇超>: 贵国公关做得不错！,<有个性的昵称真难起>: 为中国人民带来了印度神油吗？,<魏尧舜禹>: @雷军  : I'm very happy to , to be a indian![笑cry]]
5581682776	感谢习近平主席对我的生日祝福。我热情地回忆与他的会见，期待跟他共同努力进一步加强印中关系。 ​​​	[<林都心海>: 我也祝福莫迪总理生日快乐！[蛋糕]福寿安康！希望中印两国和平共处，做真正的好朋友，好邻居。[鼓掌],<年年余鱼鱼>: [doge]生快,<INCU好天气>: 莫总理生日快乐！,<达摩流浪者er>: [蛋糕][蛋糕][蛋糕],<安艺安逸安忆>: 生日快乐[蛋糕],<Moelane>: 回复 @中条山伯爵 :人家从年纪尚毕竟是个老人，尊敬一点嘛,<稚冰Y>: @莫迪总理  生日快乐[蛋糕],<秦艾德o>: 中国一直坚持，人不犯我，我不犯人，人若犯我，我必犯人！你若真心待我，我必全心对你！[心][心][心][心][蛋糕][蛋糕][蛋糕][蛋糕][蛋糕],<一路是蓝狂想曲>: 生日快乐[蛋糕][蛋糕],<凭栏秋思数年华>: 莫总理生日快乐！,<思想者88888>: 遥祝您生日快乐！[音乐盒][礼物][蛋糕][礼物][音乐盒],<宋小喵80>: 希望中印两国可以做交心的好朋友。,<姚凯强要知行合一>: 量过要是能团结，能量将会是无限的。,<稀饭的旅行>: 生日快乐！中国永远欢迎您！,<虫虫月印>: 总理先生，我支持印度成为第六个安理会常任理事国。祝生日快乐。,<--行缘识-->: 欢迎来成都吃火锅[微笑],<戴剑菲阳雨晴>: 生日快乐[蛋糕][蛋糕][蛋糕]中国欢迎你[给力][给力][给力][赞][赞][赞][哈哈],<薷今岁月>: 总理好久不见，生日快乐！[蛋糕][蛋糕][蛋糕],<石门小瑜>: 这语法，确定准确吗？换个翻译吧,<丹增娜噶微博>: 生日快乐！[蛋糕],<思维帮帮>: [doge]// @谢润良 : 有没有拆我们的哨所啊？ // @魏城WEICHENG :[蛋糕]生日快乐,<东平笑傲生>: [蛋糕]生日快乐！,<史维微博>: 生日快乐，我们两个国家一直友好下去！,<闵博安>: 莫叔生日快乐！[蛋糕][蛋糕],<大船小厨>: 总理先生  生日快乐。,<南方暴风雨>: 老实说，有没有拆我们的哨所？,<记忆枫桥>: 莫总理生日快乐！希望中印一直友好,<风起柳边>: 生日快乐，印度会越来越好的[哈哈],<骑猪上班_>: 我想问莫迪总理，你这汉字谁给你写的，把ta揪出来，介绍我认识，认识……哈哈哈……[笑cry][笑cry][笑cry],<大国崛起2022>: 希望你能带领印度，走向复兴,<创世纪201307>: Happy.birthday,<岱强-踏浪>: 莫总理 生日快乐，你们的高铁还是交给我们修建吧，中国值得信任，不要信小日本，安倍很坏的 啊,<呫嗫->: 生日快乐！莫迪老仙[蛋糕],<----M豆小同学>: 总理也是萌萌哒，我也热情的祝你生日快乐[蛋糕][蛋糕][蛋糕],<深蓝茶杯>: 生快，中印世代友好！,<看串串儿儿>: 生日快乐[蛋糕]人民福祉[祈祷],<薇若妮卡virornique>: 老莫这些年也不容易。生日快乐，中印友好。,<ST邻苯二甲酸类酯>: 生日快乐[蛋糕],<我是大蘑菇的小号小小蘑菇>: 热情的回忆[doge],<悠悠哊>: 生快！加强中印关系首先要从贸易开始[嘻嘻],<半梦半醒的旅人>: 老总，来中国宣传瑜伽吧,<马天天1111>: 生日快乐[鲜花]希望我们永远友好和平!,<颜已开-说客英语075586>: 贵国边境士兵要守规矩,<豆子9876>: 中印友好，生日快乐[蛋糕],<法名隆海>: 中印友好相处，利益两国人民。,<互联网创客周靖力>: 给了你多大红包？中国流行生日送红包[哈哈],<又见飞枪>: 哈哈  @印度驻广州总领事馆  也代我向莫总理说声“生日快乐”[微笑],<Solitairel>: 老莫、生日快乐！,<周治国Weibe>: 我也祝你生日快乐，希望边境无事，印中两国和平共处，做真正的好朋友好兄弟。,<勤劳的飞豆>: Happy birthday[蛋糕][蛋糕][蛋糕][蛋糕][蛋糕],<户部一品>: 莫迪总理 生日快乐~,<蓝色降温>: 管好的小阿三 别乱闹 这边忙得很 解决不了任何问题的,<张英三>: 生日happy!,<岱强-踏浪>: 有空来中国玩，对了，来故宫和李总理一起去欣赏清明上河图吧 再来个自拍 哈哈]
