5732776759	女生总是买一些她们根本不会穿出门的衣服[允悲]🙈[笑cry][思考][doge] ​​​	[<余丶声>: $CLORIS的小短裙$,<CLORIS的小短裙>: $Dissimilar玄$,<CLORIS的小短裙>: $彩条三明治$,<CLORIS的小短裙>: $010520玉$,<CLORIS的小短裙>: $搞事boy_少先队员$,<CLORIS的小短裙>: $skate_干饭$,<CLORIS的小短裙>: $余丶声$,<桺冬实>: $CLORIS的小短裙$,<CLORIS的小短裙>: $怠惰少女_$,<CLORIS的小短裙>: $污李楚阳$,<CLORIS的小短裙>: $雪音君z$,<CLORIS的小短裙>: $雪音君z$,<CLORIS的小短裙>: $桺冬实$,<CLORIS的小短裙>: $AoDong_goodman$,<沈依灵啦啦啦>: 嗷嗷 这么好看怎么可能不穿出去呢,<AoDong_goodman>: 图三为毛戴个眼镜,<桺冬实>: 喜欢图二的请赞我[二哈],<Dissimilar玄>: 图一有个蓝色的裤子,<ARONMo>: 怎样才可以做你男朋友，,<彩条三明治>: 可以穿给蓝朋友看[笑而不语],<雪音君z>: 这个女朋友是我认识那个爱吃减肥餐的吗[并不简单][并不简单][并不简单],<远程君>: $CLORIS的小短裙$,<ymxazy>: 这不是按住了哔哔吗,<污李楚阳>: 默默保存,<怠惰少女_>: 我也想买这种，，，可惜肚子上有肉,<010520玉>: 好看呀 为啥不穿出去 我要是瘦，天天穿[悲伤],<余丶声>: 第一套的裤子很赞啊～,<他说你任何为人称道的美丽>: $CLORIS的小短裙$,<社区送温暖的陈蜀黍>: 大大大大大，喷蓝火的加特林[二哈],<搞事boy_少先队员>: 依稀看到了马甲线，是错觉么？？,<波尔多拉图>: 身材很重要[太开心],<CLORIS的小短裙>: $-CHARMING-L$,<-CHARMING-L>: 真的是这样 买的时候只觉得好看 然后在衣柜静静呆着,<看穿一切的吃瓜少年>: $CLORIS的小短裙$,<CLORIS的小短裙>: $看穿一切的吃瓜少年$,<CLORIS的小短裙>: $他说你任何为人称道的美丽$,<看穿一切的吃瓜少年>: $CLORIS的小短裙$,<CLORIS的小短裙>: $看穿一切的吃瓜少年$,<CLORIS的小短裙>: $Holger郑浩佳$,<CLORIS的小短裙>: $看穿一切的吃瓜少年$,<啦啦啦啦啦啦啦8887777>: 那就请本帅去你家欣赏啊[喵喵],<独居老人与猫>: 这些完全可以出门呀,<他说你任何为人称道的美丽>: $CLORIS的小短裙$,<看穿一切的吃瓜少年>: $CLORIS的小短裙$,<Holger郑浩佳>: 原来你不胖,<看穿一切的吃瓜少年>: $CLORIS的小短裙$,<skate_干饭>: [doge][doge]夜店走起,<量产型暖男>: $CLORIS的小短裙$,<CLORIS的小短裙>: $看穿一切的吃瓜少年$,<CLORIS的小短裙>: $量产型暖男$]
5732776759	感觉今天的自己像个伙夫[二哈] ​​​	[<雪音君z>: 厨娘[允悲][允悲],<梁-瀚澜昇阳>: 进城务工女青年…,<o此号危险o>: $CLORIS的小短裙$,<CLORIS的小短裙>: $白羊座属羊的洛羊$,<CLORIS的小短裙>: $skate_干饭$,<白羊座属羊的洛羊>: $CLORIS的小短裙$,<CLORIS的小短裙>: $大丁丁丁丁大$,<CLORIS的小短裙>: $东北大圣$,<CLORIS的小短裙>: $o此号危险o$,<CLORIS的小短裙>: $010520玉$]
5732776759	师傅...你是要游过来接我么[允悲] ​​​	[<CLORIS的小短裙>: $DoctorMars$,<桺冬实>: $CLORIS的小短裙$,<DoctorMars>: 根据我多年的火眼金睛，这个司机的经纬度应该是 0,0 这个时候应该是没拿到经纬度，所以程序反馈的值为0，结论是，这个手机的定位程序员是新手～,<CLORIS的小短裙>: $狮子座的槑爱人$,<CLORIS的小短裙>: $桺冬实$,<CLORIS的小短裙>: $喻喻喻喻喻喻喻鱼$,<CLORIS的小短裙>: $彩条三明治$,<CLORIS的小短裙>: $竹子竹子我是熊猫$,<CLORIS的小短裙>: $油油油油油猫饼$,<CLORIS的小短裙>: $日常迷恋子房大人$,<CLORIS的小短裙>: $安安爱呲鱼$,<CLORIS的小短裙>: $猫主子叫我来巡山$,<CLORIS的小短裙>: $前後不覚_$,<桺冬实>: 冲吧 旋风冲锋龙卷风,<狮子座的槑爱人>: 定位错误，或者系统分配错误[二哈]滴滴很坑，老是系统问题,<喻喻喻喻喻喻喻鱼>: 上次在春熙路打车，司机接单，tmd车在龙泉哪面。,<沧沧沧沧桑叔>: 你是你是按住了哔哔嘛？,<彩条三明治>: 到了吗？,<前後不覚_>: 一带一路啊[二哈],<icai蔡i>: 鲁班路[喵喵][喵喵]]
5732776759	又到了摸着良心给自己打分的时候[二哈] ​​​	[<CLORIS的小短裙>: $Baker_小林$,<CLORIS的小短裙>: $高高卢$,<CLORIS的小短裙>: $企鹅大户王英俊$,<ooo君君俊>: 应该六分吧[喵喵][喵喵][喵喵],<深圳声控吸音材料有限公司>: $Fox-William-Mulder$,<深圳声控吸音材料有限公司>: 请翻回上一页，谢谢[悲伤],<陈弱_>: $KAmaH$,<企鹅大户王英俊>: 10分是张国荣吗,<高高卢>: 有牙套就一定是一分？？？牙套不是要取的吗？]
5732776759	天天回到解放前[摊手]你们累不累啊😴晚安 ​​​	[<哼哼唧唧大元宵3399>: $CLORIS的小短裙$,<藤原菟>: $CLORIS的小短裙$,<藤原菟>: $CLORIS的小短裙$,<CLORIS的小短裙>: $藤原菟$,<CLORIS的小短裙>: $藤原菟$,<藤原菟>: $CLORIS的小短裙$,<CLORIS的小短裙>: $哼哼唧唧大元宵3399$,<CLORIS的小短裙>: $稳稳的幸福是执念的窝窝$,<CLORIS的小短裙>: $藤原菟$,<三秒三秒三秒三秒熊三秒>: 洗白老字号,<竹子竹子我是熊猫>: $柏毛毛丶$,<柏毛毛丶>: $竹子竹子我是熊猫$,<竹子竹子我是熊猫>: $柏毛毛丶$,<柏毛毛丶>: $竹子竹子我是熊猫$,<竹子竹子我是熊猫>: $柏毛毛丶$,<稳稳的幸福是执念的窝窝>: 不太理解，这不是版权的问题吗？证件原来就有的不过就是原来不严查现在开始严了而已吧，视频又不是全网禁播。,<柏毛毛丶>: $竹子竹子我是熊猫$,<Dreamer_Walker>: 反对肿菊是政治正确，以前天天高呼要提高国民版权意识的现在没有一个出来说话[doge]忧国忧民的那些大v也不知道跑哪里去了。,<竹子竹子我是熊猫>: 唉，自从b站上看不到哔哔的身影，我是日思夜想呀[衰],<藤原菟>: $CLORIS的小短裙$]
5732776759	吃吃饭100块钱挑战抓娃娃（来自一直播:CLORIS的小短裙正在直播）APP下载地址：http://t.cn/R5rm8tt ​​​	[<哎呦喂的可乐桃>: 反正我的网速卡，老断。,<哎呦喂的可乐桃>: 你去抓娃娃么要,<南昌土鸡18720077513>: 如果媒体都把关心明星的时间关心到政府官员身上，我相信，明星不再那么令人追捧，官员也不敢那么腐败，其实媒体更应该做的是国家哪个县长，市长……今天干了哪些好事，哪个干了坏事，那些部门不作为，哪个学校老师为人师表，哪个部门主管部门为民服务……同意顶起,<氷華玖咲>: $哎呦喂的可乐桃$,<段木木木木木>: 哔哔你眼光好 推荐一下戴眼镜可以留的刘海呀,<抠脚菜菜蔡zk>: 直播是左撇子还是手机自拍的成像？,<鬼邪高校自行车部>: 吉列不是剃须刀吗,<哎呦喂的可乐桃>: 我咋进不去直播呢,<鬼邪高校自行车部>: 原来是看不到我,<段木木木木木>: 他打篮球去了 微笑脸,<段木木木木木>: 他也很喜欢你,<鬼邪高校自行车部>: 只欢迎女生的哔哔,<段木木木木木>: 我男友也喜欢看你,<段木木木木木>: 我男朋友是男生,<段木木木木木>: 皮肤好好啊,<鬼邪高校自行车部>: 只有我说话我也好尴尬,<鬼邪高校自行车部>: 鸭皮够脆的话还是可以的,<DavyKobe>: 哔哔我要看曰不曰]
5732776759	突然发现，如果我此时离家出走，竟然没有一个可去的地方，没有一个可收留自己的朋友。 ​​​	[<icai蔡i>: 靠自己 为什么要别人收留[摊手],<食梦貘三>: 来我家睡沙发,<桺冬实>: 有钱 哪里都可以[二哈],<Lucyshire>: 我也是啊！,<咸蛋黄焗鸡腿>: 好巧，我也是,<FreedomStabber>: 这么巧  不如作伴吧[喵喵],<Fox-William-Mulder>: 我可以单独收留你的腿[污][污][污][污][污],<Saiyan_Le>: 地位床，天为被[摊手][摊手][摊手],<自祭文>: 四海为家]
5732776759	绿树阴浓夏日长，脱去成熟甜腻的撩人香调；水晶帘动微风起，伴随着慵懒又或是雨后的微凉，轻盈纯粹的味道吹散心中的烦恼。「这些适合夏日的少女香，如同夏热特调一般，传递着最适合这个季节的嗅觉之美~」 ​​​	[<嗯就酱阙>: 铃兰好闻,<ooo君君俊>: ysl这瓶好少女心呀,<ooo君君俊>: 万一呢？？？[喵喵][喵喵][喵喵],<很想很想见你neo>: [憧憬][憧憬]好好看]
5732776759	现在人的感情真的都太脆弱了，微信一删电话一拉黑立马就陌路🤷🏻‍♀️也不管你几年几月的感情 就这么两个步骤说没就没🙃 ​​​	[<竹子竹子我是熊猫>: $CLORIS的小短裙$,<遁形xx>: 感情都是一点一点变淡的，这两个步骤只相当于盖棺下葬。死了还是早点入土为安的好。,<余丶声>: 好像变美了,<-豆豆明天要吃西瓜->: 有时候什么都还在 感情就是没了[摊手],<冰空的三色堇>: $CLORIS的小短裙$,<吖-神>: $CLORIS的小短裙$,<CLORIS的小短裙>: $闫大吴村花呀$,<CLORIS的小短裙>: $小闹钟的瞌睡宝015$,<CLORIS的小短裙>: $竹子竹子我是熊猫$,<CLORIS的小短裙>: $专注非洲代购阿里托尼茜$,<CLORIS的小短裙>: $吖-神$,<狡诈的Joker>: 时间就是个贱人,<专注非洲代购阿里托尼茜>: $CLORIS的小短裙$,<竹子竹子我是熊猫>: 无情者伤人，有情者自伤啊，哔哔不哭[爱你],<闫大吴村花呀>: 这是个浮躁的社会，变脸比变天都快，有时候都要怀疑当初到底有没有感情存在,<_水母先生>: $CLORIS的小短裙$,<CLORIS的小短裙>: $_水母先生$,<_水母先生>: $CLORIS的小短裙$,<小闹钟的瞌睡宝015>: 和我一样样的，，，,<吖-神>: $CLORIS的小短裙$,<CLORIS的小短裙>: $抠脚菜菜蔡zk$,<CLORIS的小短裙>: $专注非洲代购阿里托尼茜$,<CLORIS的小短裙>: $安安爱呲鱼$,<CLORIS的小短裙>: $冰空的三色堇$,<CLORIS的小短裙>: $_水母先生$,<CLORIS的小短裙>: $一克番薯$,<CLORIS的小短裙>: $o此号危险o$,<CLORIS的小短裙>: $王小石爱温柔$,<CLORIS的小短裙>: $远程君$,<CLORIS的小短裙>: $桺冬实$,<CLORIS的小短裙>: $吖-神$,<CLORIS的小短裙>: $朱韦衡$,<朱韦衡>: 原谅色雪糕,<吖-神>: 是的～说没就没了,<桺冬实>: 脸皮薄要面子 不好意思加回来 坚持装酷,<王小石爱温柔>: 回头太难,<远程君>: 这个步骤我家那位重复了无数次[doge],<o此号危险o>: 因为现在大部分人根本没时间去好好经营一段感情，都是利益关系速成，来的快去的也快，即使是多年的感情，说淡就淡，因为对方在你身上看不到好处。,<一克番薯>: 冰淇淋好吃吗]
5732776759	只想安安静静地滴淘宝，什么都不想干[打脸] ​​​	[<CLORIS的小短裙>: $奇迹如梦$,<用户5231667041>: $东方宇音$,<东方宇音>: $用户5231667041$,<东方宇音>: $CLORIS的小短裙$,<奇迹如梦>: $CLORIS的小短裙$,<用户5231667041>: $东方宇音$,<波尔多拉图>: $波尔多拉图$,<我有一张离不开我的床>: $CLORIS的小短裙$,<CLORIS的小短裙>: $010520玉$,<CLORIS的小短裙>: $雪音君z$,<CLORIS的小短裙>: $哎呦喂的可乐桃$,<CLORIS的小短裙>: $我有一张离不开我的床$,<CLORIS的小短裙>: $奇迹如梦$,<CLORIS的小短裙>: $波尔多拉图$,<CLORIS的小短裙>: $文彬同学$,<CLORIS的小短裙>: $原酱本命格雷夫斯$,<CLORIS的小短裙>: $Naomiabby$,<CLORIS的小短裙>: $东方宇音$,<雪音君z>: 成为偶像吧,<010520玉>: 只想暴富]
5732776759	夏天最喜欢...打网球？NoNoNo用电蚊拍打蚊子才是最爽的[挖鼻] ​​​	[<锅帅923>: 补光灯什么牌子的啊？,<掌门请随意>: 厉害了我的姐，我还以为是网球拍,<嘉大黄宗泽>: 国际惯例，我哔又瘦了,<天边有一座城堡1314>: 绝对是的！每次打到蚊子就好像有一股成就感。,<量产型暖男>: 原来你喜欢啪啪啪………………的声音啊[doge][doge][doge],<自祭文>: 注意安全啊,<抓狂的火锅君>: 我还是觉得摸电蚊拍比较爽,<skate_干饭>: [doge][doge]电的时候手放上面，电按摩贼爽，别问我怎么知道的,<CLORIS的小短裙>: $雪音君z$,<CLORIS的小短裙>: $乌教教主$]
5732776759	吃吃吃吃吃饭饭，苏州星光天地——大食堂 秒拍视频 ​​​	[<阿木木木木木瓜>: 哔哔小姐姐加油,<心静智囧>: 能偶遇吗,<沈依灵啦啦啦>: 总感觉脸胖了,<至你想成为的那个人>: 从你的眼睛里 我看到了星空,<CLORIS的小短裙>: $马梦奇么么七$,<马梦奇么么七>: 做直播吧~,<CLORIS的小短裙>: $雪音君z$,<雪音君z>: 回去去无线看,<CLORIS的小短裙>: $周攻瑾$]
5732776759	第一次和大白一起出镜，期待下周的@汽车视界 [羞嗒嗒]不过以后再也不想去他们节目了，想打死摄像...[doge][doge][doge][doge][doge][doge][doge][doge][doge] ​​​	[<抓狂的火锅君>: 腿，好久不见[笑cry][笑cry][笑cry][笑cry],<嘉大黄宗泽>: 就这还不给摄像师加鸡腿？不然就是p图师[馋嘴],<鲁尔区最帅>: 脑补了你的声音,<zhaiyuancheng>: 美美美[爱你],<AliWMaymurgh>: 还是bb时代腿最好,<我不帅姑娘你要相信我>: [二哈]腿！,<CLORIS的小短裙>: $ui超超$,<CLORIS的小短裙>: $眉浅情薄$,<ui超超>: 小短裙，妇女。,<CLORIS的小短裙>: $雪音君z$,<jamesbang7>: 人美车更好,<眉浅情薄>: 摄像很给力啊，2米的腿硬是拍成5米的腿,<棒童苏州>: 支持你打死摄像，最好连主持一起打，要帮忙吱一声,<雪音君z>: 拍瘦了吧，摄像你为什么这样鸡腿免了,<Breat1n333>: 很久不见 腿腿,<zhuyuchaobob>: 摄像痴汉视角？,<NavyZhzM>: 这腿真的是好久不舔，呸，见,<TC大官人>: 看来要推车了····[doge],<量产型暖男>: 车模←_←?,<阿司匹林诺>: [二哈]这是要转战车评？]
5732776759	没忍住...还是下了一个[打脸] ​​​	[<桺冬实>: $CLORIS的小短裙$,<CLORIS的小短裙>: $桺冬实$,<CLORIS的小短裙>: $我好惨啊啊啊啊啊啊啊啊$,<CLORIS的小短裙>: $阿司匹林诺$,<CLORIS的小短裙>: $釉云青竹$,<CLORIS的小短裙>: $反差萌晶$,<死肥宅o>: $http://t.cn/RoUY6Qy$,<反差萌晶>: $http://t.cn/RoUJ4Z5$,<桺冬实>: 赵小姐 我可以和你一起玩吗 我会喊666]
5732776759	我今天打开电脑整理文件的时候发现...居然还有一篇13款防晒的评测没发！！！还有人需要看么？有的话麻烦给我留个言[允悲] ​​​	[<CLORIS的小短裙>: $你好遇上再见$,<---PPPPPPP彭J>: 有啊[污]最近用的碧柔蓝瓶户外的和新品黄色室内的,<CLORIS的小短裙>: $蒋大珏$,<CLORIS的小短裙>: $十亿少年的梦$,<十亿少年的梦>: 需要，快发[二哈],<蒋大珏>: 看的呀，你快发,<奇怪而有趣的人>: 可以发啦,<狗贼丶Zz>: $CLORIS的小短裙$,<以后如果我变成回忆>: 看看你就行]
