575223374	不知道为什么就是想安利这个给你们看， 不自觉的跟着MV歌曲用我最销魂姿势跳起来了哈哈哈哈。 听说链接里还有更魔性的4天3夜免费亲子游等着你：http://t.cn/RSEbN6F #潮童成长联萌#唯品会官方的秒拍视频 ​​​	[<lwee绪飞_95730>:  [吃惊]好厉害的样子！,<因之而无往沙>: [抱抱][抱抱]好棒～,<莫西莫西55_1066>: [moc顶][moc顶],<王侠虾米洒>: (⊙＿⊙),<黄聪-Mzoi>: [xkl顶]我支持你！,<江睛蔀言蔀语>: 哈哈 分享了[哈哈],<竿一天一里路>: 正能量！,<傲娇怪怪莹归>: 好想法[赞][赞],<我33没有敌人_59522>: 挤挤更健康~我是来帮转的,<小写的人儿暗>: 不错啊这个[嘻嘻],<桔_添福宝>: [lxhx咻4][lxhx咻4][lxhx咻4][lxhx咻4],<段留肚段>: 扩散一下,<三浦五月棋>: [加油啊][加油啊],<YS沭子>: 你赢了！,<夜游神回来啦怒>: [偷乐]点赞！,<抛_姜糖_>: 妈妈说这个要顶起[偷乐],<伴花千骨邻居>: [爱你],<fxl6982>: [偷笑]嘎嘎嘎嘎,<查裙哈查>: 这躺枪。。,<碰一只大帅比>: gcgcgc支持,<暮圆圆的王某某>: 你赢了！,<哆啦-KO-萌_21152>: 惊呆了....,<MPU婉仪M>: 稀饭[爱你] ,<此人此人消失蛮>: 原来如此~[good],<缪筝环缪>: 支持！！！[嘻嘻],<三炎亞綸休閒站>: 妈妈说这个要顶起[偷乐],<-迷你阿丽>: 我快乐！[good],<橘子味的鱼蚓>: 这让我充实了很多~！,<查塑句查>: 我被逗了[太开心],<莫鸟英莫>: 懂啦[赞啊],<熄叶梁琴>: 咦...呀！,<小年年小806_54028>: [威武],<驾着梦想去飞辨_29841>: 必须转的呢，超级震撼到我了,<蚂-朵气质花>: mark,<短脖鹿dmg>: 恩！好，555,<U过客小小天使>: 哈哈，一切都是浮云，,<猫趙诗爷>: 我好HIGH吖[太开心],<Cxkyyx63995>: 嗷嗷嗷[威武],<益炕棉益>: [挖鼻屎]？,<神游worry少校>: 赫[酷],<叫力姐堡>: 看到这个节奏，除了赞，我都不知道说啥好了，哈哈~,<王莉娇231_44878>: ！！！！,<南奥特屎屎>: 弱弱的我收到了惊喜[good],<暮-嗜桃>: 也是蛮拼的！,<喵喵琉璃白_梦>: 幸福就像花儿一样，看到这些我开心呐。,<北廖婷婷儿>: [赞][赞][赞],<209yuka>: 也是如传说中的一样牛啊,<湖劈叉的骨头>: 哈哈，人生赢家再现吧！[给力],<闫小瘦73>: 一个一个的。！~？,<妮妲_葉描>: 如果你看到一条不错的评论，能不能艾特下我？,<武茵的名单>: 好赞—— ,<偏爱街拍的惜梦>: [good]]
575223374	难道烤玉米不是这么串的吗？？？？？？？？？？？？ ​​​	[<略略略略略嗝1>: $自带蜡烛的男孩$,<自带蜡烛的男孩>: $略略略略略嗝1$,<略略略略略嗝1>: $自带蜡烛的男孩$,<笔墨轻点一缕香>: $壁虎山$,<可爱又不腻的黄油>: 我们这边是一整个诶。。啃着吃超幸福,<嗯还要躺几个月吗>: $皇上他偏是不听呢$,<小癖好>: 立起来串更丧尽天良[doge],<你亮妈咪哟>: 哈尔滨有一家很出名的老太太烧烤，他家玉米就酱串的[微笑],<刘诗琦77>: $索高雅Sophia$,<vp尧>: 一整个玉米才3元！你这个三毛？,<Seve7Seve>: 这样串着不累吗？,<-_-_Vera>: $战地记者OB视角$,<Freakbaby_>: $BigggggFly$,<战地记者OB视角>: $-_-_Vera$,<挽鹿宝>: 还有这种操作？？？？,<掉色的阿凡达>: $好好你胸大你先说$,<叶亲飞>: 爆米花?,<i_free_l>: $宇酱呀$,<菠萝大大Viva>: $Chick田$,<长耳朵的猫_東盛装饰>: 好吃吗[二哈][二哈][二哈],<Chick田>: $菠萝大大Viva$,<冯喜喜leo>: 成都的玉米都这样串的呀,<幸运网友就是我啊啊啊啊啊啊啊啊>: $Dm蜜桃$,<于小路丶>: 这个是不是比我们这边一整个玉米还贵啊？,<Stupid_Pan>: $柚子多肉$,<有你的小幸运__>: 成都烧烤都是这也串的啊[舔屏],<大碗都是你的>: $杨烨杨烨$,<柚子多肉>: $Stupid_Pan$,<林炆尧>: $你是吴彦祖嘛$,<庄coco>: 都有啊[挖鼻]有啥奇怪的，小串有点贵不过,<诣初>: $S-阿姗真可爱$,<撒浪嘿呦Feng太阳>: $丰光明VAT$,<晴宝宝的小尾巴___>: $___浪味仙Sunny$,<周一Vespers>: $正在种蘑菇的提莫$,<衿九>: $一只上好佳哦$,<正在种蘑菇的提莫>: $周一Vespers$,<FirstDayofMay->: $正义召唤我$,<邱一米八>: 我们这边的烤玉米 是一整只玉米[二哈][二哈][二哈],<二米耶>: [求关注]va 看起来 好好呲诶！,<楼上他刘姐>: 这他妈喝酒吃一晚上玉米，不得把老板累死,<Stupid_Pan>: $柚子多肉$,<迪迪今天正能量了吗>: $柚子多肉$,<___浪味仙Sunny>: $晴宝宝的小尾巴___$,<pc今晚月光那么好>: $Gary楊-$,<飞天_哈士奇>: $大碗都是你的$,<二二2B小娅>: 你可以点一整个玉米也可以点玉米串啊，我觉得玉米串比较好吃，入味一点吃着也方便一些,<谁还不是大宝贝儿咋的>: $赵洲洲洲洲洲洲洲洲洲$,<谁还不是大宝贝儿咋的>: $赵洲洲洲洲洲洲洲洲洲$,<谁还不是大宝贝儿咋的>: $嗨呀$,<西瓜还是我的甜>: 贵在手工费,<Gary楊->: $Gary楊-$]
575223374	不错不错，这个好玩，变着嗓子试了几次，还是这个结果最满意，要不你们也来荔枝FM上玩一下？ ​​​	[<高冷的性格逗比的灵魂>: 我根本打不开这个网页，下了n遍了还是打不开[微笑],<大长腿吴彦祖>: 这啥软件？,<一个任性的仙女>: 如果还没脱单 那就试着脱贫吧 空闲时跟我做一个小副业 你会越来越酷 不试试你怎么知道不能呢,<我还没犹豫就随你去天堂>: [二哈][二哈][二哈],<面包为什么要放糖>: $http://t.cn/RSQUVXC$,<贰飠柒>: 求互粉[嘻嘻],<CV萌喵喵>: FM251284求收听求关注哦,<表情包集中营>: $表情包集中营$,<大长腿妍妍>: 看成了：壮壮来一发吗？,<名爵艺人文化传媒>: [心][心][心][心],<咿呀嗨呀哎呀>: 博主是男的？？？不……不是萌妹吗？[二哈],<Dz政->: $国产as片点我$,<尤物俗子>: Fm 1363183 骚萝莉有感兴趣的嘛,<雨花灬石>: 受？？？？？,<我像不像狮子啊>: 给我打钱,<心有山河>: 壮壮，你真的是受？？？我怎么觉着应该是个霸气攻呢？[doge],<2017年北京高考文科状元>: 我说听了我的声音会怀孕你们信吗]
575223374	每年都会有因为作息生活不规律而抵抗力差猝死的案例，每年都会有很多人转发“啊啊啊我一定要吃早饭一定要锻炼”。然而大抵是没过几天就忘了，继续熬夜游戏一觉睡到中午零食吃到肚圆…健身锻炼？不存在的。然后又陷入了了每年发生猝死案例大家继续转发我要早起早睡锻炼的死循环。所以啊，我真的希望 ​​​ 全文	[<Peanut666666>: $FirefuckingWong$,<FirefuckingWong>: $Peanut666666$,<edu陳冠希>: $LIJiAruNa$,<陪小石头度过漫长岁月>: $大大的木锁$,<有什么鱼儿>: $奥妮克希亚的悲催小红枣$,<陈酒才有味儿>: $kanghui_asd$,<Isnowday>: $再也不修仙$,<覆春洲>: 上了班就好多了，一日三餐正常吃，下班走回家。身体很健壮,<佐帮主>: 年龄大了 就不爱熬夜了 身体真的吃不消,<再也不修仙>: $Isnowday$,<-zoetic->: $瞧321$,<-安亦贲丶>: $ciciAaa-$,<过完这个夏天再改名>: $夜色多温柔F$,<老猪的微波炉>: 还是个女生啊。大学四年未睡过懒觉的飘过~,<乡村小肥肥>: 叫我这种上夜班的怎么办,<听风煮鱼>: $LYF爱贤$,<浅找找>: $蔷莱柏琼$,<夜色多温柔F>: $吃西瓜的柚子君$,<姜子牙不爱吃鱼>: $CPA再不看你要死了$,<秋始zz>: 和男票的作息，每天10:30睡，早上6:30起，他7:30，中午午睡，晚上6：30到9点在健身房，老年人一般的生活啊。。。,<Lemonade-u>: $沅鑫是stan$,<吴添举-JemmyPhok>: $鲨鱼SHARKS$,<鲨鱼SHARKS>: $吴添举-JemmyPhok$,<吴添举-JemmyPhok>: $鲨鱼SHARKS$,<鲨鱼SHARKS>: $吴添举-JemmyPhok$,<大壮不想晒太阳>: $哒不溜姐姐$,<翦筝>: $barto$,<奶油蛋糕味的蒜头>: 零食那个其实可以多吃点的…我是怎么感觉…应为我戒不掉、我每天九点睡觉五点起床、一天跑步一个半小时、我觉得我生活态度还蛮好的…除了爱吃零食,<月半笑花儿->: $fzdhbf$,<_Daming>: $康Sir射射$,<What12980>: $ChiangYiu_Ho$,<平ZZCC>: [拜拜]真的要锻炼了,<廢青蒂姆>: 我經常在想一件事，美國人跟我們有時差，等於他們是不是天天在熬夜[二哈][二哈][二哈],<hhahju>: 所以说我不是睡过去，可能是晕过去了。。。[并不简单],<弈道欢>: $童颜巨腿Tui$,<沅鑫是stan>: $Lemonade-u$,<景宇有个小梦想>: $风吟时光$,<付昱东>: $好变慢慢会亚新周$,<SurpriseLe>: $这姑娘酸到掉牙了$,<kyle揩油>: $少女老王的原野$,<一颗小美豆>: 可是现阶段生活工作压力真的很大 每天11点就躺着想睡觉 往往三四点了才能累到不行睡着 对任何食物都提不起兴趣 体重一直跌在70斤上不去 [失望],<郭凉凉_>: $VV让时间来证明我有多爱你$,<旧時光筆記>: 从大一熬夜到研三毕业，现在工作五年了也经常熬夜，没啥啊，老得快点而已,<叫什么名字无所谓>: $哎呀娃娃_Cathy$,<孟德尔写完遗传学一拍大腿说>: $愿你行止由心$,<乱发老哥>: 熬夜啊每晚一两点睡觉几年了，每天白天昏沉，还好吃的多也运动，要不估计早都猝死了,<大脸脸猫丶>: [失望][失望][失望]要改了！！真呢要改了！！ 我是人妻了，不是一个人了！！ 上有老中有夫！！！ ,<喜忧>: $DK-NIGGE$,<一座小小小耳朵>: $大脸猫cakecake$,<喵个夏>: $Restarted煌-$,<何大伟灬灬灬>: 运动或许真的有点难以坚持，但是你只要偷点懒，你就发现，很舒服了,<-Dizzo>: $wwwadv$,<热心市民赵师傅>: 早上7点15起，上班，中午1点睡到2点，晚上7点健身到9点.12点睡觉]
575223374	富强、民主、文明、和谐、自由、平等、公正、法制、爱国、敬业、诚信、友善。 ​​​	[<一克拉的曙光>: $-不胖10斤不改ID$,<董翼然>: 我游戏名字就叫法治你这些错了看着贼尴尬,<薄荷加冰不及你心凉i>: $会拉二胡的扬州人$,<七杂菲FF>: 大奶怕被封号不遗余力,<不翻身的咸鱼也是咸鱼R>: 奶子[doge],<AxG丶>: 这是进入了圣人模式？,<老梗王>: 瑟瑟发抖。。,<假装是网黄>: 奶子奶子奶子,<翩翩瀚公子>: $-不胖10斤不改ID$,<翩翩瀚公子>: $陌上S夜未央$,<陌上S夜未央>: $翩翩瀚公子$,<国民偶像枫叶红了12>: 做到这，我大中国更加富强[good][good],<求约小妹>: 今天上班在茶水间，听见一女同事问另一男同事：“昨天干嘛了”男同事说：“跟人合作开发两座山峰一条峡谷，投资额大约两亿”女同事瞬间脸红了...[doge] ,<独爱夜来香>: $会拉二胡的扬州人$,<一只小奶奶奶奶猫>: $http://t.cn/RSTWR4k$,<-不胖10斤不改ID>: $翩翩瀚公子$,<-不胖10斤不改ID>: $海因洛Herosin$,<-不胖10斤不改ID>: $一克拉的曙光$,<道友请留步t>: 想想这可能是你最后一条微博了[doge][doge][doge],<裸粒粉>: $你好我是破喉咙$,<王维尼是诺坎普最闪亮的星>: 谁有敬业福？,<hey你有糖吗>: 忠诚于党 服务人民 公正执法 纪律严明,<樱汜>: 爱国敬业靓仔,<蛋O爱O蛋>: 葫芦娃 黑猫警长 七龙珠，唐老鸭米老鼠，海绵宝宝，大头儿子小头爸爸，喜洋洋与灰太狼，小猪佩琪，花园宝宝，熊出没……………,<娘口三三030喵>: $http://t.cn/RSTCfBV$,<天秤座的墨墨公主>: $http://t.cn/RST9ruB$,<无言的Fan>: $宝宝宝宝宝微_w$,<本来想好叫什么改的时候又忘了>: 法治写错了,<你好我是破喉咙>: $裸粒粉$,<_葉蕭_>: “别再滥用文字 别再讨论政治 别再标榜正义 别再高举旗帜 娱乐至死变成往事 请记住从今天开始 听话才能幸存一时 叛逆只会接受惩治 所有人都变成红色的宠儿 这盛世就是他想要的样子”,<裸粒粉>: $炫酷的阿帕奇$,<思优君>: 呵呵……,<头像就是本人不必多问>: 没有用的，下一个就是你,<爱贴的大表哥>: $徐火火$,<dirty大太阳>: 是法治  v快改     小心封号,<菅永胜>: 法制错了，应该是法治，依法治国[笑而不语],<卢声的回登>: 爱国，敬业，诚信，奶子,<坐标北十三>: 天呐，我竟然差点就信你了[阴险],<大尾巴羊_>: 看来是有性生活了,<世纪凹凸曼>: 缺什么喊什么。,<AlbertFc>: 24字真言,<炫酷的阿帕奇>: $裸粒粉$,<丁珊的微博>: 有错字[笑cry]法治,<prinzessin-->: 中国梦内涵：国家富强，民族复兴，人民幸福,<不需要关怀的平胸妹>: 早安么么哒,<请滚出我的半壁江山>: 我有敬业福你们有吗[右哼哼],<Mandy-木易林夕>: $会拉二胡的扬州人$,<酒窝筒orz>: 法治[拜拜][拜拜][拜拜][拜拜],<Childish4ever>: 哈哈哈哈哈哈哈哈哈哈哈哈哈哈哈哈哈哈哈哈对不起我笑了,<楼上张大爷>: 法治，谢谢,<名字好难想哦cc>: $http://t.cn/RSTXKvr$,<起什么个性名儿>: 你是小央视台吗,<i7yedr>: 社会主义核心价值观,<三三二二二二三三>: 法治，而非法制]
575223374	突然想到王家卫说过：我昨天遇到一个人，感觉他非常有意思，印象深刻。但后来就再也碰不上了，人生就是这样。 ​​​	[<胡泊泊泊泊泊>: 我怕被操，拒绝有趣陌生人[doge],<紫恪>: 你已经见过很多人的最后一面了。[允悲][允悲][允悲][允悲],<唐糖溏塘堂>: $壮士来一发嘛$,<我跳预言家->: $壮士来一发嘛$,<过气非主流网黑>: 也会多看几眼,<林俊杰的大老婆L>: 大晚上 这么走心么[二哈],<懵萌猛的花花>: 一期一会,<喜呵呵呀>: 有的人能遇见就是莫大的幸运了,<那天我开始想信任的样子>: 差点以为自己被盗号了[傻眼],<芝麻酱不好吃_>: 你以为还会像偶像剧一样，也许会在某个拐角，也许会在某个时间，其实也许就没有也许了。这就是生活，这就是现实。[二哈],<我曾一步杀十人L>: 是是是  我今天遇到一个人 但我知道我再也不会见到他了]
575223374	讲一件最近发生的事吧，我处理的公司性骚扰擦边球事件。公司有一个项目，主要由是三个部门合作完成，我部门是其中之一。C很年轻，但工作非常认真负责，是我部门的得力干将，性别女。S是另外一个部门的头儿，四十多岁，性别男，妻女在老家。因为合作项目，C需要S所在的部门提供一些数据文件资料， ​​​ 全文	[<mmy6601>: 为你点赞！,<谨鸦>: $谨鸦$,<谨鸦>: 大学时小课的钢琴老师喜欢骚扰女学生，因为我比较女汉子加上男朋友是体科院的所以老师不骚扰我[拜拜]骚扰手段包括弹琴时摸女生手，突然去摸女生挂在胸前的毛衣链，言语调戏女学生。燃鹅有次在我兼职的饭店看见了老师抱着一捧玫瑰花和一个年轻的女人吃饭，在系里耳闻过他的风流韵事，所以默默,<很帅很帅的Asuka>: C妹子很幸运有个好的上司，而我被其他部门经理语言骚扰说什么“你调我们部门来吧，工资除了公司发的我单给你开1W，上班时间一整晚，宝马车接送。”然而发火别人说我开不起玩笑。,<天下无敌鞠豆豆>: $壮士来一发嘛$]
575223374	这波操作太6了，这是一个要上王者的超级兵啊！讲真，现在连超级兵都知道推塔了，而猪队友却不知道！#秒拍#http://t.cn/RSO6Njv ​​​	[<免费看相2>: 看面相不？姻缘，事业，现在做知名度，不收费，二十四小时在线，看我微博，v我，,<MYL偌偌>: $杨帆_YangFanFan$,<婷婷小秧苗98>: $壮士来一发嘛$,<FCbARCAL>: $Minoz---$,<山沟沟里的菇凉>: $高大小宝$,<夜狗子不是猫>: $不可Mia$,<SuaLucifer>: $二嘎子是只猫$,<困倦兽兽兽>: $诉北1997$,<失乐的oizys>: $-顛雞欣-$,<十一月初四晴>: $七月十四日阴$,<七月十四日阴>: $十一月初四晴$,<七月十四日阴>: 等下我去小卖铺吃个烤肠，回来时希望有五个赞，你们有没有要带什么的?,<海绵二师兄>: $GR锐享征程$,<背锅楠神经常迷路>: 我就想问有没有人要代练,<是肉更好吃>: $ING_FYP$,<来一碗酸酸>: $ssr长什么样子$,<小晗子萌萌哒>: $家有一只羊咩咩$,<琴子的向日葵>: $琴子的小弟i$,<勾腿>: $原来只是个青铜渣渣$,<哇哦好大只>: $Chen1jiNg$,<想养一只猫还有你>: $壮士来一发嘛$,<我已经蒙圈了啦>: $今天我吃了一根冰棍$,<还是叫我鸡丁吧>: $上帝服务中心专员$,<饭撒撒>: $厕所马桶任你选$,<HasGone吕雅菲o3o>: $宝诶啊$,<野山椒大頭妹>: $壮士来一发嘛$,<你是我的温暖如初>: 我的队友只知道收人头，最后水晶被推了，人头多有什么意义呢,<支支的美好未来>: $颜东仔$,<王二赤_>: $魏然历险记1995$,<因为我似小可爱吖>: 与其带那四条会喊666的咸鱼，我宁愿带会偷塔的超级兵。[微笑],<damascone_>: $龚不缺$,<诺贝尔圆脸奖>: $Mrs---gege$,<Johnny阮>: $长角的胡萝卜$,<Hitmeupp>: $MADBOX_$,<一坨可爱的小蛋挞>: 笑死[哈哈][哈哈],<原谅我一生腿短追不上你哟>: $壮士来一发嘛$,<没得爱那又怎样丶>: 烦死了，推完下班。[doge],<辜小妹>: $装疯迷翘-$,<草莓奶盖Yoki>: $壮士来一发嘛$,<超级无敌鲁鲁仔vip高速通道专享>: $-木木雨木木-$,<草莓奶盖Yoki>: $CharliesEvan$,<zzzzzz瑶瑶瑶>: $以唯物辩证法为指导的小彩$,<Hard-涂涂>: $吃兔子的萝比$,<娑娜和她的琴弦>: $用户6028897260$,<邹大敏同学>: 小兵都知道推塔，打水晶。我的队友只知道打野，团战也去打野[摊手],<summer-宅宅>: $沉酒li$,<西瓜太小->: $好好说话别BB$,<正品liunan>: $意中的圆球$,<ZHang辣拉>: $貳十伍_$]
575223374	初中的时候我有一个同学，就是那种中学时代的小混混，你懂的，父母是卖卤菜的，觉得儿子大不了以后继承卤菜摊档，或者死在一次街头斗殴中。他自己也接受这个人生设定，所以在学校也就那样了。但是老天非要给他一个天赋点，就是地理。其他科目一败涂地，地理随便考都是满分。他也不知道为什么。那个时候 ​​​ 全文	[<一个相对普通的帅哥>: 我想起初二教我地理的老太太了，她好喜欢我，每次上课都让我起来回答问题，然后称赞我。。。在这之后我再也没遇到那么称赞我的人了,<游明磊50>: 当年我初中的时候可以修正历史老师的错误，当然，英语和政治都不及格。,<悦玥Xxxxu>: $原子CaoYuan$,<荔枝mmmm>: $丶GracefulBearing$,<樱桃少女加丸子>: $http://t.cn/RSjQLEn$,<爱吃双皮奶得小芋头>: 好老师很多，我大姑小时候初三下学期快中考就不想念了（要知道她成绩是全校第一啊），因为她感觉念书没有挑战性，无聊，随意学学就会了。她的班主任一天一次跑到家里来劝她回去念书考高中考大学，我奶奶也劝，但她就是不念。去年大姑逛街碰到她老师，老师还在念叨当初让她考学的事,<热心市民孟先生丶>: $董润年$,<从小重口味>: “希望我的课上再也不要看到长奶”——支持你去学美术的数学老师如是说道,<胖宫娘娘>: 还以为真的会有奇迹的转折人生,<宋立阳子>: 还好你没考美术,<没得爱那又怎样丶>: 在中国你不迈过高考这个坎什么天赋都没用[微笑],<Super__suger>: 不然你现在就可以尽情的画人体素描了[喵喵],<我热球痴>: 奶你头像画的不错[偷乐],<无码表情包>: 之前没有主见挺后悔的。,<林__潼>: 看看现在国内的艺术圈，你就知道你家人很有智慧,<一米八五的承凌公子>: 很多时候，后面想想很多事其实自己可以做主的，为什么当时就放弃了，听天由命了呢？,<全国憋尿比赛总冠军>: $全国憋尿比赛总冠军$,<我是你最爱的小米米啊>: 我壮士这么美  永远不会过气,<丶Xts>: 现在社会需要的是全面发展的人才，拿地理来说，肯定要会数学，我是个兽医，不光要回看病，还要懂化学，药学，现在很难做啊,<全国憋尿比赛总冠军>: 我小学就数学不及格，初中各种混跟老实打架，我妈抱着好歹高中毕业的心花了好多钱让我进了私立，结果高一爱上画画，我妈本来是觉得我逃课也是逃课所以才让我去画的，结果真的过了统考，校考也过了清华美院，下半年突击了文化课，我本来就是偏科虽然数学还是考了17分但是正好及格线]
575223374	高考卷阅读理解现代文让原作者很绝望…… ​​​	[<CarrotChair>: $Lemmooo$,<小玄子_Yee>: $仙儿Yy-$,<Roanoke__>: 阅读理解不就是把有的没的都要解释出是有的有的吗,<Mr_沉笳>: 鲁迅先生明明是个很有意思的人 然鹅语文阅读让我们对他误会大发了[笑cry],<-_-譚傑濠>: $梁C君$,<少女荷包蛋o>: 哈哈哈哈哈哈浙江,<赛文赛文依赖文>: $跳楼粉红少女$,<假装是网黄>: $建艺高晓松$,<丶楊CUTi>: $登等登等灯灯$,<箐栀x>: $Iurgnok$,<读左往右从得你>: $小呀小燕灵$,<Schnappi-o3o>: $Dczho$,<袁桑五行缺76啊>: $薛小包包包$,<座敷童子的宅腐基地>: 鲁迅的内心:[费解]好吧，都是我说的，我当个屁都是在讽刺世界,<建艺高晓松>: $用户vx6muqvu7i$,<GIF你懂的>: [允悲][允悲][允悲]伟人也很绝望啊,<Iurgnok>: $箐栀x$]
575223374	谁说颜色用完了？小金车上路了，刺瞎你的狗眼… ​​​	[<YMAOMENU>: $大怪兽怪怪的$,<MRGL->: $大力是99$,<哇喔草草哒>: 还有这种操作？？？,<诗和田野还有苟且>: $壮士来一发嘛$,<一个坏蛋儿>: $壮士来一发嘛$,<颜东仔>: $支支的美好未来$,<丁啊a>: $又沉沦$,<你不能再吃啦>: $-菜菜蔡啊$,<___周二丫家杨大狗>: $___杨大狗家周二丫$,<可耐滴豆沙包>: $八月未央auto$,<支支的美好未来>: $颜东仔$,<SunLiom->: $BodyNSoulAlwaysOnTheRoad$,<阿轲的少年辅助>: $我是UU爱吃肉$,<伏特瑜伽>: $壮士来一发嘛$,<内心住着个小公举>: $侵日华军man$,<一首邓三石>: 过不了多久漆就没了,<杨萌萌不萌>: 这在三伏天的太阳下是多晃眼,<嗯哼030>: 还有30秒到达战场[喵喵]这个车子绝对是丢的最多的,<水果采购员>: $灯等等等灯等灯灯$,<不吃肉真的好嘛丶>: $JENI_iii$,<梦莹别这样Y>: $快和我回家Zmm$,<UniquenessX>: $阿欣你$]
575223374	老妹带自己弟弟骑三轮翻车了……懵逼弟弟:我是谁？我在哪？http://t.cn/RSjzYox ​​​	[<_淮山_>: $IRIS鸿$,<Phyllis商商>: $大白找白菜$,<Phyllis商商>: $你是吴彦祖嘛$,<小七77258>: 这事我干过，小时候从院子里冲出来，带两人，冲门口池塘里去了，机智的我提前跳下来了。大冬天的。,<IRIS鸿>: $_淮山_$,<沉迷学习无法自拔嘿>: 笑出声哈哈哈哈哈哈,<芝麻开门芳妮豆丁亮亮>: $______夏橙$,<凉皮店的CEO>: $http://t.cn/RSYJgAF$,<再熬夜就去吃屎>: $颜小白的小耳朵$,<雨诗英雄>: $BruceZp$,<Junkmanner>: $别撑$,<小草小包小草包>: $我的Cola丢了$,<灰熊叔Su呀>: $吃不到西瓜说柠檬酸531$,<蠢猫警长白菜分享>: $SYSU_工藤有神经病$,<南扬有鹿LKS>: $南糜北鹿$,<别撑>: $Junkmanner$,<BruceZp>: $雨诗英雄$,<相忘于江湖ding>: $郭三渣$,<郭三渣>: $相忘于江湖ding$,<小尧Vigny>: [笑cry],<柯_晓晓>: $酱油铺e$,<颜小白的小耳朵>: $再熬夜就去吃屎$,<Twinkle丶小小小胖纸>: $ChenYAA$,<y大魔神>: $可乐不加冰333$,<JANEJANE_X>: $-谢奕坡$,<请问肉饺子今天谈恋爱了吗w>: $大大大大大_伟$,<Ps爷爷泡的茶>: $飞花清雾-$,<很爱一颗子弹c>: $一颗子弹c$,<SYSU_工藤有神经病>: $蠢猫警长白菜分享$,<你是我的万幸>: $大坏一点都不坏$,<June_ZT>: $BatWayne$,<咦咦咦咦咦Jely>: $witnessthegood$,<不需要关怀的平胸妹>: 弟弟:我有一句mmp不知道要不要讲[doge][doge][doge],<skph>: $巴巴查克3$,<yijum>: $Mr_多一事不如少一事$,<郑冰子>: $无心丶弋$,<西瓜你个球>: $杰西酷克$]
575223374	#易拉罐创意# 烤鱿鱼有要的吗 200元一串 秒拍视频 ​​​	[<心塞你懂伐>: $芝麻酱不好吃_$,<芝麻酱不好吃_>: $心塞你懂伐$,<心塞你懂伐>: $芝麻酱不好吃_$,<死了好多脑细胞啊>: 原作者没有微博，这也是从快手搬运的,<看京>: $妈个巴只$]
