5774333382	男生穿的简约干净就好了[并不简单] ​​​	[<多吃丶多吃一点呀>: @1amagay  嘻嘻,<会发光的洲洲啊_>: 还有长得高点[允悲],<M鹿阿鹿_>: 不能脱单 就让自己脱贫吧 你总不能身边没人 卡里还没钱吧 点我 带你赚哦[爱心]️,<大脸猫tt>: @有生之年34572,<大脸大脸我就是那个大脸>: 男友范10分满分的10,<SoulMateright>: @SOULMATEQIAO]
5774333382	小众的睡衣品牌推荐，好看又舒适[微笑] ​​​​	[<小乔nini>: 回复 @不喜欢就不要关注 :他们穿起来好看,<巧克力夹心的你>: @李siting2  嗯哼,<崔小姐的不冷静先生>: @Mr张的小迷妹,<下辈子当考拉_>: @不想走出那个圈   我要买各种款式，以后放我们自己家里穿,<Yo-7-Yo>: 真好看[哆啦A梦花心],<_Deadrace>: @ZLPrincess]
5774333382	想跟你吃遍各式各样的冰淇淋[害羞] ​​​	[<Lock柴小轩>: @WalkEr_E  欲罢不能[舔屏][舔屏]还有小熊饼干是什么鬼[doge][doge],<辛木若>: @阿蕊Sherise,<我爱波塞冬>: 回复 @橘子酱喵喵君 :美妙[馋嘴],<柳正禹>: @喜欢一个人狂欢,<王帅不烦恼啦>: @linewyr,<huanshunvya>: @YIYO0   [馋嘴][馋嘴][馋嘴]]
5774333382	Dior 2017.难道只有平胸才是仙女[doge] ​​​​	[<长湖子老爷爷>: 回复 @爱找事的小骨头 :Comment with pics  http://t.cn/RosE33E,<爱找事的小骨头>: @长湖子老爷爷  [微笑]对 我也是小仙女,<爱找事的小骨头>: @茁壮成长的法律汪  [微笑]服不服！,<Maggiehalo>: @癫痫系呆   @你会喜欢钟一源吗,<30jyxyjwb>: 是滴，不平胸，何以平天下,<绝世佳人王祖贤>: 长的好看怎样都是仙[doge],<屈秋秋秋>: 回复 @Dear小情绪- :你还差一级就可以修炼成像我这样的仙女了[加油]加油！等你[允悲],<南橘小蜜疯>: 回复 @Daisy-Annabel :好的[好],<牛肉Y酱酱>: 回复 @南橘小蜜疯 :好的呀，等你考完了我就来怎么样，正好我不想在家待着，我妈天天让我在家背英语[允悲][允悲][允悲][允悲],<南橘小蜜疯>: 回复 @Daisy-Annabel :是的,<牛肉Y酱酱>: 回复 @南橘小蜜疯 :[笑而不语][笑而不语][笑而不语][笑而不语]你这是在邀请我来你家么,<南橘小蜜疯>: 回复 @Daisy-Annabel :诶，我今天要回来了，明天要考试,<牛肉Y酱酱>: 回复 @南橘小蜜疯 :[笑cry][笑cry][笑cry][笑cry][笑cry],<玻璃心的狮子座汉子>: 是呀，多希望自己瘦成小平胸,<孤单又灿烂的张大本事>: 第七有些莫文蔚唉~,<栗子喜峰>: 大胸就是小妖孽[喵喵][doge],<狼耳朵DDDddd>: 只有瘦的才是仙女[喵喵],<南橘小蜜疯>: 回复 @Daisy-Annabel :哈哈，我是小仙女,<JoJobyby耿耿耿>: @Jet鱼头  哈哈哈[并不简单],<白鹭m>: 给个安慰自己的理由 是挺美的 然而还得看颜值啊[允悲][允悲],<Z_秀媚>: 突然感觉自己美炸了,<韩HHHHHHH->: 啊 那我岂不是仙女中的仙女啦,<阿尔维娅>: 没胸的才是仙女，有胸的是欲女,<ding-有人在家吗>: 回复 @ding-有人在家吗 :甩肉套路 @分手吧肉肉君,<ding-有人在家吗>: 瘦子平胸都是小仙女 胖子穿啥都烦[二哈]没了三十斤才知道还是瘦下来穿衣服好看[喵喵],<沙小漏aa>: @喔不叫晨晨   @linlin吖-  [坏笑][坏笑]]
5774333382	愣着干嘛 快许愿啊[喵喵][喵喵] ​​​	[<快乐的小暴君>: 希望能和他好好的过一生,<sousou哒meimei哒张姓菇凉>: 所有的考试过过过,<胖子张薄荷>: 找工作顺利[祈祷][祈祷][喵喵],<Smile小巧>: 我希望 一辈子对我好的人 在最后  爱事业  爱家庭 爱父母 爱我   爱兄弟姐妹  。,<heartbeat_cookie>: 回复 @KLKRAD :爷爷奶奶可高兴了，给我爱吃的喜之郎果冻[doge][doge][doge],<不醉不归sugar>: 希望快点出现那个他,<快点把名改了->: 和你在一起[心],<无敌抠鼻王XXX>: 希望找到爱我的人,<Roll-lwf>: 我希望自己越来越瘦 能够变白 妈妈的身体很好 家里和睦 处朋友不要遇到演的 还有就是希望明年我能够考上厦大,<Roll-lwf>: 我希望爸爸赶快好起来,<Moooollyy>: 考试顺利 成绩棒棒,<雨敏-妖娆终究自伴>: 我想过自己想要的生活？？,<小青鲤zxt>: 我希望他也能喜欢我！,<MaryLua>: 祝愿自己在这个夏天脱单,<二月莫奈y>: 学业有成 事业有成  我喜欢的人最喜欢我,<Cha瓜瓜nel>: 数分高代期末考一定要过啊！,<舒窈不是落樱>: 我能和我爱豆说话🤔,<大果粒1111>: 我能说我真的对着这个动图许愿了么[微笑][微笑],<不要让我对你抛白眼>: 我希望遇到非常爱我愿意包容我一切的人。我也爱的人。,<姚末末末>: 希望我和他能天长地久，希望我的人生新篇章能一切顺利,<燚楚周_>: 回复 @KLKRAD :喜之郎多点关心多点爱。,<我的提拉米苏呢>: 愿我这次不找他，他会主动找我聊天,<dara-la>: 愿我遇到美好的爱情，有更加幸福的家庭!事业更上一层楼！,<豆豆很失忆->: 希望能找到一份好工作]
5774333382	夏天怎样穿内衣，才能清新脱俗不难受？ ​​​​	[<屋外太复杂09>: 回复 @八卜卜卜卜卜卜卜卜 :[允悲][允悲][允悲],<吴wlei>: @西昤发誓要瘦下来,<JinQYA>: @FTHONG   赶紧码起来 特别是你这种胸大的,<文若wr>: @饮湖上初晴后雨七月  看不懂，但还是想艾特你一下,<Mars川>: @皮皮小姐要对你说no,<八卜卜卜卜卜卜卜卜>: @屋外太复杂09,<Mj嘿嘿啊>: 超级好看的衣服，平价衣服 @Mango___小铺_,<冯诗皓>: 回复 @冯诗皓跳皮筋 :买啊！,<年糕妖怪mxx>: 第四页第二张图好看[心],<冯诗皓跳皮筋>: @冯诗皓  好看,<男高留级中的前辈吉竹>: @迷离的香水  [笑而不语],<刘俊哲_>: @云屿在远方阿  不谢]
5774333382	数不尽的透视风情，恰似一帘幽梦~ ​ ​​​​	[<JOYCE人呢>: 回复 @余小盒you :我咋一看也觉得,<我想养一只刘煤球>: 回复 @刘煤球 :啧啧啧    你看看你,<刘煤球>: 回复 @我想养一只刘煤球 :我觉得都不错[笑而不语][笑而不语],<胖妞喜欢JAM>: 回复 @我系黎叔叔叔叔叔 :哎呀，羞羞啦,<SUMMERWong_>: 回复 @ZKColorful :[允悲][允悲],<ZKColorful>: 回复 @SUMMERWong_ :好的  图片已保存，回头打印出来给你,<mhy海洋影视>: 回复 @ayyjxnl :去年买了一个表,<洋妞同学>: 回复 @希希哈哈i :好看[色][色]你穿肯定好看,<希希哈哈i>: 回复 @洋妞同学 :给谁穿[摊手],<头像是猫的咸鱼少女>: 回复 @Chic-a-boo :哎呀[污]好害羞！等伦家瘦了再买,<Chic-a-boo>: 回复 @头像是猫的咸鱼少女 :好哒 找到链接就买给你,<就是不爱吃大蒜和生姜>: 回复 @那就不放大蒜和生姜 :来呀！,<米胖子m>: 回复 @性感老头儿CY :穿给我看的，都性感,<Panther___>: 回复 @-Simona :[污],<头像是猫的咸鱼少女>: 回复 @Chic-a-boo :买给我[可怜],<余小盒you>: 回复 @哔哔桑 :不像，很美,<那就不放大蒜和生姜>: 回复 @就是不爱吃大蒜和生姜 :那我会感到很性福的！来吧！,<那就不放大蒜和生姜>: 那我会感到很性福的！[色],<陷入文学的世界无法自拔>: 回复 @徐冲动次打次 :买了你穿吗,<Monster_Guy>: 回复 @三点出逃 :134好看。,<徐冲动次打次>: 回复 @陷入文学的世界无法自拔 :你买吧,<贰溪>: @梧桐树下有个我-,<吃不胖就好了_>: 然而没有胸并没有什么卵用[摊手],<烟花巷里的安善良民>: @-EmbraceMe,<田园蔬菜的浪味儿仙>: 回复 @HanjingleiH :看起来就很激动[思考],<_-DESIRE>: @用户6078537737  这个总给我买吧,<Chic-a-boo>: @头像是猫的咸鱼少女,<性感老头儿CY>: @米胖子m   你说  穿啥最性感呢[污][污],<孝与笑_>: @再说一遍是昌不是张   拿去,<三点出逃>: @Talon_ch  喜欢内,<HanjingleiH>: 回复 @田园蔬菜的浪味儿仙 :太喜欢了！！！,<田园蔬菜的浪味儿仙>: 回复 @HanjingleiH :我是不是应该先减个肥？,<你好我叫胡琪怡>: 真好看。可我胖。,<陈幽怨>: 回复 @Evansvon :骚的一批[舔屏],<黑尾巴的咸鱼>: 回复 @把你当做凳子骑v :不穿？   那就由不得你啊,<R小姐有点儿二>: @Zhang_Bailun,<菇凉_晶晶erer>: 回复 @十一点睡小jie :要送我？,<只是眼熟>: @Y_zhangM,<蔡海妮Wrasse>: @洋壹森LeadVoice,<猫你一脸>: 回复 @怪咖纹身刺青-珍妮 :有胸有屁股更好看[摊手],<你的眼睛很好看吖>: 好性感呦～但是首先你得有身材,<你的眼睛很好看吖>: 好性感，首先要有那个身材[大哭],<SUMMERWong_>: @ZKColorful  想要,<Wyqqqqqu>: @江天cccccc   全部想要,<许伊共度流年>: 回复 @呷呷呷我只想要安安静静_zikzin :[doge][doge][doge]不错,<鸢尾_鸢>: @没有人能阻止风,<Zuuuuutter>: 回复 @沈大咖咖 :那我怕夜夜笙歌[挤眼],<LIUHUI耶>: 回复 @LIUHUI耶 :我喜欢图二的那个长裙,<呷呷呷我只想要安安静静_zikzin>: @许伊共度流年   好看[doge],<为何夜这么难熬i>: @幺儿ii  [害羞]给你买一套,<LIUHUI耶>: 回复 @酒红得耀眼 :[微笑],<酒红得耀眼>: 回复 @LIUHUI耶 :[舔屏]]
5774333382	烟管裤是什么，居然比阔腿裤还要火？[思考] ​​​	[<getyourcrayonnnn>: 回复 @ILVAAAA :穿过吗,<金庭楷>: 大象腿表示拒绝…[悲伤][悲伤][悲伤],<Paprika大魔王>: 这不是我初中时候流行的裤子嘛？[微笑],<ILVAAAA>: @getyourcrayonnnn  我居然有,<chocolatesad>: 我微博里有好看衣服[爱心]️,<chocolatesad>: 回复 @Shaoyan_ :我微博里有好看衣服,<我是灵灵灵>: 这几年都是穿这种裤子。不显胖啊[允悲][允悲],<沙漠之鱼129>: 前几年买的裤子不扔好了，现在又流行回来了,<hyingjrjjmgw>: @不吃香菜的大魔王酱,<Shaoyan_>: 烟管裤确实好看，修饰腿型好配衣服]
5774333382	这些专辑封面到了中东就变成了[doge] ​​​	[<猪猪猪猪肉西>: ps没毛病[喵喵],<临霜201701>: 回复 @踟蹰与粒 :各地文化，宗教，历史使然，你这话真有意思，第一，中国凭什么不像中东就要像欧美？第二，究竟什么是正确的价值取向，这个问题谁也不能给出固定的答案，但最起码，在中国当代，清爽而得体总是没错的。第三，中东人民究竟是什么样的想法我们无权干涉，即使不认同，也不应该横加指责，欧美也是。,<SAMYEE-LI>: @i_Blair_Lee,<临霜201701>: 回复 @踟蹰与粒 :所以你希望像中东一样只是为了避免两性关系带来的麻烦？？因噎废食,<Y-傻白甜>: @張藝超-  哈哈哈,<满小井>: 这 @低调人生无需解释,<精分气质大仙女>: 扑哧  哈哈[开心][开心][开心],<米立的小心心>: 回复 @临霜201701 :那你的意思的中国不要像中东一样捂的严严实实 而是想欧美一样暴露的完完全全？,<米立的小心心>: 回复 @临霜201701 :女性地位低？终生捂的严严实实？你去过中东吗？亲身感受过中东吗？如果我说是中国媒体 不 是欧美媒体估计染黑你信吗？就拿沙特打比方 人家的学校是男女分校 避免多少不必要的麻烦 人家女校里只要没有男生 她们进入学校就脱去面纱大袍 把最美的一面显露出来 你以为她们大袍下穿的什么 全是耀眼的华服,<一枝柳__>: 认真的吗[笑cry][笑cry],<临霜201701>: 回复 @踟蹰与粒 :你没有看到思想控制的恶果，中东地区这样压抑下去的后果，已经显露出来了，女性地位低微，终生捂得严严实实，禁忌很多自由受限，况且，他们那样是受宗教影响，你能想象中国这样人口巨大的国家变成那样会多可怕吗,<深海rz>: 回复 @Ruby就是棒棒哒 :[并不简单]我仿佛看到了未来,<宇宙飞天无敌爆炸犀鬼利>: [作揖][作揖],<稣爺兒>: P图的人是领导么？,<Tailup2010>: 没遮脸啊？审查制度还是很手下留情嘛！,<叫我打妖怪>: 不得不说，遮着也好看,<李小丫呀呀呀呀呀>: 回复 @榴莲很好吃哦 :自己好好反思一下，为什么卖片的会盯上你,<brainless1>: 五十步笑百步而已。中东不仅是我们的过去，也是我们的未来。,<Howyage靖禾>: @_v王雨霏    @银耳银耳莲子羹    @JanaGeng    @哑声Ruhe,<kjgkg>: 得了吧，中国也就是五十步笑百步。罐子说茶壶黑。我看这个有多好笑，别人看我们就有多好笑,<如此丹阳>: 文明的倒退[摊手],<温柔又暴躁的二呆>: 真的p得一手好图,<每天回家都看到小哥在装死>: 回复 @Pendrell居浮沉 :这图p的，最多五分不能更多了…,<Pendrell居浮沉>: @每天回家都看到小哥在装死,<柔软号>: @MU_Dragon  你很幸福,<就不说多少小姑娘叫我聪明老公了>: 哈哈哈哈这技术得多好啊,<顾明惜>: 咱们中国也是这样啊！,<弹的米_SWAG>: 天朝现在也是啊，图7[允悲][允悲][允悲]新一代孩子心好累,<榴莲很好吃哦>: 回复 @李小丫呀呀呀呀呀 :我为什么会被卖片的盯上…[笑cry],<大玉很开心_>: 回复 @猪小姐S :哈哈可以说非常棒棒了[偷笑][偷笑][偷笑],<米立的小心心>: 回复 @粪青终结者 :哥们 我哪句话代表了？你真抬举我。如果你说的算 你带我飞？,<猪小姐S>: [允悲]笑死老子 @大玉很开心_,<秋名山下藤原豆腐店>: 回复 @Royalique :哈哈，中东的人好会ps哟[眼泪][眼泪],<存我心者将心比心甡>: 回复 @兰俊辉--那仁朝克图 :[向左]想看啪啪的戳,<Royalique>: @秋名山下藤原豆腐店,<粪青终结者>: 回复 @踟蹰与粒 :请你直接去中东生活，不要代表中国人民,<一暖暖的happy>: 楼主，你忘了p头巾,<十防形>: 红秋裤好有喜感啊[眼泪],<青拾手作>: 以为图[6]️和图[9]️还要下拉...,<一朵绽放的白莲花>: 这跟清真[doge][二哈],<凉风得娇羞>: 回复 @倔强的小红军ry :小粉红可以无视[微笑],<米立的小心心>: 还说什么思想都控制 让你坦胸漏背 不穿衣服你做到到吗 你爸妈怎么想 我觉得人家挺好的 至少让社会没有那么淫乱 中国会变成中东那样才万事大吉 可惜不会 看看街上的妹子 就差脱光了[思考],<Wxia_吴瑕>: 心疼我A妹[笑cry],<要瘦我>: @对没错老子最酷,<拣猫>: 图6笑死我了， 大头娃娃,<倔强的小红军ry>: 回复 @凉风得娇羞 :这过度解读得，厉害了,<siiiignGIA>: 秒变中国大妈的装扮啊……,<八十年代的我>: 回复 @喂萌萌- :0回复 ？,<酒龙仓美美>: 青春不是用来恋爱的，是用来脱贫的，跟我一起做个小副业吧，卡里有money比什么都重要[心][心][心][憧憬][憧憬][憧憬][憧憬],<辊燮>: 红红火火恍恍惚惚,<滢滢滢滢滢滢姐>: 图8:一个裙子有啥好拍的[眼泪] [眼泪],<是旭乖乖呀a>: 其实，改了之后，也挺好看的呀。]
5774333382	某宝有什么创意十足的生日礼物适合送朋友？ ​​​	[<陳-叄歲>: 回复 @能晚上睡觉白天醒着么 :[doge],<能晚上睡觉白天醒着么>: 回复 @陳-叄歲 :咿呀，我的屁屁包入镜啦[太开心],<陳-叄歲>: @能晚上睡觉白天醒着么,<纪云凡菊青芬妍>: 在她家买了好多美衣， @小骨头麦伊  真的想剁手啊！可是还想买[泪][泪][泪][泪][泪][泪],<杰伦病重度患者_kkw>: @当家阿伟  嘻嘻嘻,<娴鱼日记>: 柯基屁股包：【激萌可爱的小柯基】￥334FZzT99jk￥,<辣妈不剁手>: 辣妈冷知识：小婴儿的指纹在怀孕的前三个月就已经长好了。,<粒粒读你__俪>: 第5张图 @小狮砸丶]
5774333382	一份拯救男友衣品的穿搭指南[并不简单] ​​​	[<裴裴会更好>: @依然待她如初恋,<浮彧>: @PourAndPractice,<Z晨曦chenxi>: @风雨人生yzh  要不要烫卷发,<za汁>: @柿子zzz   哎呀你快看看,<糖糖糖糖糖维拉>: @张Ds   你自救吧,<我是阿灿>: 长得帅是第一好吗,<麻栎Mayoo>: 回复 @Lee彡岁 :你穿的衣服自己不会反应啊,<嘚嘚杨>: @跌落进深海里的月,<祀艮>: 回复 @麻栎Mayoo :你得跟阿姨说[摊手],<那些年我追过的718>: @我喜欢从后视镜里看世界,<麻栎Mayoo>: @Lee彡岁  就像你上衣别买太长,<Stellacatcher>: @不讲究的凉小生,<Shimmr车车>: @MiO_CheN]
5774333382	160+闺蜜搭配参考。 ​​​	[<不安分老少年>: @RenYuii  咋都适合你,<小黑妞v>: 首先两个都要肤白貌美大长腿不然都白搭,<Cinderella_m4>: @囧囧菇的小黄靴   我们可以不,<团猪儿>: 回复 @卷风尘 :晚饭不吃了[允悲],<卷风尘>: @团猪儿  人家的160 我们胖成猪,<aaaaashun>: 回复 @圆滚滚葱头 :[二哈][二哈][二哈][二哈],<屌丝-_-专属>: 好喜欢图五，有链接吗,<圆滚滚葱头>: @aaaaashun  就想这样跟你逛下街,<Doctor_怡>: @Ber阿尔法狗,<李钟娜娜>: 学学拍照 毕竟我们是要出去玩的 @阿想95_  [微笑],<夏目夏小>: 只要你长得美，穿抹布都是一种时尚。[摊手],<小碧菇凉>: @念乔2012   匀点身高给我,<这是安安安啊>: 哈哈哈哈哈。第九张的镜子里是些什么,<海带精小雪酱>: 回复 @烁酱_ :首先我先瘦点,<P-ppppp>: 回复 @吃不胖才是仙女 :买,<吃不胖才是仙女>: 回复 @P-ppppp :好看 我在减肥,<韩風小铺>: 回复 @BLANKGRID-DARE :宝贝可以来我家看看呦,<元气少女sunny呀>: 回复 @元气少女sunny呀 :买过，推荐给你们,<梁鞋童>: @大坏蛋九七七  [嘻嘻],<吴贰捌>: 回复 @喷嚏女王-阿七 :[喵喵][喵喵][喵喵],<喷嚏女王-阿七>: 回复 @吴贰捌 :忘记我们的街拍了吗？,<烁酱_>: @夜空里四处游荡的猫头鹰,<廿八粥>: 最后一张图看到了一堆警察叔叔在围观？,<吴贰捌>: @喷嚏女王-阿七,<唉一古V喂>: 安利她家美衣[向右]  @韩流美搭   [心]有你需要的,<辣妈不剁手>: 辣妈冷知识：除了子宫之外，女性怀孕期间双脚和心脏的大小也会增加，双脚因水肿而变大，心脏变大则能够输送更多血液到全身。,<七涵儿>: P完长腿的160cm。。,<不是卡卡欧巴是胥卡卡>: @熊西西耶哎嘿  存下来先看看,<P-ppppp>: @吃不胖才是仙女,<怪咖boy->: 首先你们两个都得好看 [doge] 要是。。。 算了 辣眼睛哈哈哈,<鹿晗是个娘炮>: 好想跟她们两睡觉[doge],<离相楠>: 我想说这能是160？,<BLANKGRID-DARE>: 我想说这些衣服有链接吗[二哈]]
