5937001324	有人这么下楼，你还坐电梯么？ http://t.cn/RSxZGVB ​​​	[<星星月亮说>: @吴大俊同学  晕奶[二哈],<Super竹笙>: 回复 @顾盼依稀如昨l :拒绝[笑cry],<青梅佐以酒l>: 回复 @Super竹笙 :留个微信[笑而不语],<Super竹笙>: 回复 @顾盼依稀如昨l :你想怎样[允悲],<青梅佐以酒l>: 回复 @Super竹笙 :没有没有，毕竟眼见为实[doge],<Super竹笙>: 回复 @顾盼依稀如昨l :你现在知道了[允悲],<青梅佐以酒l>: 回复 @Super竹笙 :不不不，其实我就是想知道一下,<Super竹笙>: 回复 @顾盼依稀如昨l :鄙视你[笑cry],<青梅佐以酒l>: 回复 @Super竹笙 :恩…有什么不好的嘛[笑而不语],<Super竹笙>: 回复 @顾盼依稀如昨l :嗯....你这么问真的好吗,<青梅佐以酒l>: 回复 @Super竹笙 :你确定在说你自己嘛？,<Super竹笙>: 回复 @顾盼依稀如昨l :其实跳起来是真的会痛,<青梅佐以酒l>: 回复 @Super竹笙 :就知道你瞎编的[允悲],<Super竹笙>: 回复 @顾盼依稀如昨l :我什么都不知道[doge],<青梅佐以酒l>: 回复 @Super竹笙 :你是说你？[笑而不语],<Super竹笙>: 回复 @顾盼依稀如昨l :不仅累还疼[允悲],<__HaRuuu>: @啊啊啊起个名字太难了   晕奶日常,<纣王-君邪>: 卖麻批，本来想关掉的，下到第二层的时候快出来了，我就看完了，结果还是没出来，差评！,<ThereEmily>: [允悲]    有几秒感觉都要甩出来了,<侥幸bz>: 无感[微笑][微笑],<Ken晋小倩>: 不会打到自己的脸吗？？？？,<素衣清颜淡若风>: [笑cry]晃着不痛吗？,<酸甜口小LL>: @追逐太阳的Damon,<啊啊T_T嘎崩>: 回复 @理-白 :应该是生理盐水,<biubiu千偌很仙啊q>: 回复 @顾盼依稀如昨l :累[喵喵],<微沫季>: 好担心会颠出来[鬼脸二],<人生风景在游走01616>: 回复 @我就不信这个昵称还有人用- :我们是男的,<铁板卤面烧>: 上楼梯伤膝盖，还是下楼梯伤膝盖,<李俊想>: 回复 @理-白 :据知情人透露，硅胶的不晃荡。,<九月LIUYUE->: @六月_LIUYUEJIUYUE,<like杨广权>: 回复 @like梁蔚 :我觉得好恶心啊。。。,<Thhhee>: @嗨小豆芽   我的天,<一只姝->: 回复 @Wilhelmima :我小多了,<绮雨初腾腾>: 我想说 怎么还没有蹦出来,<兆鹰小可爱>: @我才不是兆鹰   喜欢吗,<神王的悲伤>: 我作为男生，正常的男生，性取向正常的男人，性取向正常喜欢胸的男生，郑重的告诫各位女性同胞：这种有点晕，适当就好，过了就恶心[摊手][摊手],<like梁蔚>: @like杨广权,<Liuili瑾>: 对不起我错了我想到了灌汤包,<花痴汐>: 回复 @立誓今生尊你为王-- :[笑cry][笑cry][笑cry],<异世界的奈奈酱-->: 回复 @花痴汐 :担心跳出来,<花痴汐>: @立誓今生尊你为王--   看着就觉得疼,<Bella-sdx>: 难道不是屁股么？,<小鹿鹿鹿鹿鹿7>: @走丢了1996   喜欢不[二哈],<镪镪镪镪镪镪小阿磊>: 回复 @哈哈哈哈小阿芙 :没有 阿[污][污],<像温泉似的--刘杏子>: @Hello-欢先生,<哈哈哈哈小阿芙>: 回复 @镪镪镪镪镪镪小阿磊 :你木有看见？,<镪镪镪镪镪镪小阿磊>: 回复 @哈哈哈哈小阿芙 :你抖我瞅瞅[小黄人得意][小黄人得意],<直男癌已病入膏肓>: 回复 @我就不信这个昵称还有人用- :[doge]我也进去找大胸，没找到,<讨好把戏>: 回复 @钢铁男子丶 :看过了，我当时都想法就是，胸为什么还没有被甩出来，内衣挺好[笑cry],<钢铁男子丶>: @讨好把戏  这甩得眼睛都花了,<哈哈哈哈小阿芙>: 回复 @镪镪镪镪镪镪小阿磊 :抖起来像屁屁[污]]
5937001324	据说男生都喜欢这样的姑娘，简单好看的低马尾。 http://t.cn/RtRneDs ​​​	[<南成__>: 我有一个大胆的想法,<埭隶>: 这个奶子不如胖子滴[坏笑]，应该是满脑子只有奶水才是他[坏笑]娘滴,<19ESTA>: 回复 @吖彬哥哩besta :哈哈哈哈喜欢哦？只能看[doge],<吖彬哥哩besta>: 回复 @19ESTA :[憧憬][憧憬][憧憬]我很诚实...我喜欢那个奶子,<Fleur97>: @临歧  我…我也喜欢这样的低马尾,<雯雯啾上臉>: 真的是因为马尾吗？[挖鼻][挖鼻][挖鼻],<舰队海军陆战总指挥>: 为什么这胸衣质量这么好[允悲],<小吕子都是我小号>: 老夫营养快跟不上了[doge][doge],<萨比潘da>: 跟苍老师没可比性,<何宝w荣>: 回复 @张饥渴的迷妹 :发型一般,<别再将就了>: @不希望在遇见了,<心属猪贤>: 回复 @小仙女阿X :唔想理你了，你觉得搞笑就笑饱距先啦，我训了[微笑],<小仙女阿X>: 回复 @心属猪贤 :搞笑,<初中生2018>: 这波...啊不，这球投的真准[doge],<葩豌豆>: 回复 @小铃铛的尾巴 :看了你的微博我有很多想法,<立立快跑>: 这样子的脾气再差都没事了。。。,<林爱玥>: 我喜欢马尾辫的女孩[doge],<大凡caroline>: @破一度  你应该很喜欢吧[摊手],<心属猪贤>: 回复 @小仙女阿X :报啦报啦，最多比关几年再出来追你[拜拜],<小仙女阿X>: 回复 @心属猪贤 :报警,<喵oO大人>: @Ourdream0607  哇。。。,<_T丶ender>: 回复 @呆毛球yoooo :我喜欢你的,<红领巾的大刀>: 别让我看，好晕啊,<心属猪贤>: 回复 @小仙女阿X :理鬼你哇，你系我，唔搞都要搞,<小仙女阿X>: 回复 @心属猪贤 :我唔同你搞,<心属猪贤>: 回复 @小仙女阿X :一样甘中意，最多同你搞基系啦[二哈],<小仙女阿X>: 回复 @心属猪贤 :我又没胸[二哈],<心属猪贤>: 回复 @小仙女阿X :中意你个多D🙈,<小仙女阿X>: 回复 @心属猪贤 :你中意人地个胸阿,<ps-刘兆勇>: 回复 @张文聪 :不喜欢,<呆毛球yoooo>: 回复 @_T丶ender :哈哈哈哈哈,<心属猪贤>: 回复 @小仙女阿X :打波？可以可以[doge],<LEEzP_>: @-ZHANGwenYi-,<立信s>: 回复 @开水宝宝420 :支持,<BetrayalF>: 能不能好好穿衣服,<BetrayalF>: 呵呵  看到这么故意露的女的 我就恶心。,<小铃铛的尾巴>: 回复 @怕冷却喜欢你 :[允悲][允悲][允悲],<怕冷却喜欢你>: 回复 @小铃铛的尾巴 :[哈哈][哈哈]没事,<_T丶ender>: 回复 @呆毛球yoooo :好球,<_疯之美少年>: 回复 @WE__李淳 :最后那句话是电影《熔炉》里边儿的？,<小铃铛的尾巴>: 回复 @怕冷却喜欢你 :什么？,<怕冷却喜欢你>: 回复 @小铃铛的尾巴 :我能有别的想法吗？[馋嘴],<呆毛球yoooo>: @_T丶ender  嘿嘿,<北海鲸屿>: 就算你留长发我依然爱你[爱心],<_MOON_blingling->: 为什么不好好穿衣糊[二哈],<IQaij_AIzh>: @eeiV_iIExX  [doge],<想和你吹吹轰>: 回复 @小铃铛的尾巴 :抱走,<温彩虹achieve>: 尴尬症犯了，好想帮她把衣服拉下来，好怕衣服突然就往上弹[污],<ThirStMinG>: 嘿嘿嘿[笑而不语],<Johnn-y-->: 就这样把我骗进来 哪有低马尾,<郑梦思->: 回复 @大蠢财- :扑街吧你,<大蠢财->: 对的对的没错没错 @郑梦思-,<尹毓恪的老婆>: 哎哟卧槽，晕奶了,<伪摇教父>: 回复 @-王可爱yy :对不起我不喜欢胸太大的,<-王可爱yy>: @伪摇教父  福利]
5937001324	巴西的一场业余足球比赛，这场比赛据说没有进球，两队一直在发边线球[嘻嘻] ​​​	[<睡过头幸福感>: 微博涉黄指日可待[眼泪],<20岁小叔>: 我眼中只有一人[doge],<能蛋大叔>: 旁边的妹子是什么心情呢。。,<李婉玉家的小跟班>: @朱晓飞家的小媳妇,<努力奋斗的成爸爸>: [哼][哼][哼]，这对比，另一个边裁好尴尬,<瞧你咋地咬我么>: wc @有种无聊叫磨皮擦痒  卧槽,<张锐喂喂喂>: @BOATENG_   @天天10号,<拿人生不当回事>: 难怪球迷那么多[喵喵],<武汉无痕接发MyStyle阿德>: 都是看别的球去了,<一只考拉犬犬树>: @一颗犬犬树袋熊  [二哈],<徐小啾儿>: @祖力有只粘人喵  看球,<郭先生的情书>: 说出来你可能不信，我就知道绝对会有一张偷瞄的镜头[二哈],<古手灵花>: 我热爱足球，里面有个踢球的叫乔丹，我认识他，他特别厉害(ง •̀_•́)ง,<不吃蔬菜仇>: @一个特立独行的帅哥   @舒克舒克开飞机的舒克QAQ,<被掐住的猫>: @你丫丫丫丫丫丫,<Aeschines>: 很强势 @才才打了个饱嗝   @发际线不见,<流氓不可怕就怕流氓不是人>: @Simple-Ding,<旺仔小丸支>: @AB男孩子   @完颜若安,<我是魏博不是微博>: 这样的边裁真没法让人踢球啊. [汗],<用户wnvmodw688>: 果然都是去看球的[喵喵],<JAN-才志>: @大力布丁  [色],<CORRINE-PARIS>: @GilgameshLi,<流浪的的岛>: @6rainbow_,<lllllyyyyy-lynn>: 回复 @林嘉進是也 :哎，色即是空,<__刘丶Gang>: 是。。露点了么？[doge],<王碩s_>: 发球才是体验技术的时候[doge],<林嘉進是也>: @lllllyyyyy-lynn  哈哈哈哈哈,<纸鸢大人>: @月明与海  这球没法看了！呃呃，不对，这球没法踢了,<aptitude985>: 为什么不穿胸罩都那么挺,<雨生醉青柳沐白>: 回复 @用户5864749780 :突然暴露[二哈][二哈][二哈],<指头按一下>: 踢球的不如看球的[偷笑],<厄煮满地妞>: @牧马人Vincent,<宫小光在嘚瑟>: 翼位鸡血全攻全守,<老大的天空>: 思想不集中，还是太集中？？[大笑] [大笑],<仓鼠小哥>: 我也就礼貌性的硬了一下。,<天上的仙女宝宝最可爱>: 妹妹好寂寞，哥哥来陪，给看哦,<用户5864749780>: 回复 @今天吹什么风 :注意左下角黑衣[挖鼻],<An--Ai>: @infinitytoforever  笑死,<Bray>: 不是已经两个球了吗,<文铁c>: 最后一张，两位篮球专注,<宝蓝家老妖>: [二哈][二哈][二哈][二哈],<Linbrother_>: @谭鹏飞F   @cinderella--cc   @cicely木木和兔兔,<星星也是发光体>: 这些小伙子们笑的可真开心啊[喵喵],<Melody丶月下>: 迷之凸起[doge][doge][doge],<Amy_凌柒伍伍>: 边裁流行不穿奶罩了嘛[doge],<懒狗不是蓝枸也不是蓝狗>: 回复 @游满城 :真•看球,<洒脱61816>: 旁边这两个人看什么看,<这他妈该死的丶足球>: 要是我我一直贴着边线跑，还踢毛！,<方涤生>: 这还能安心踢球？三条腿顶住了两条腿的路线，,<孙延文7>: @YYY______SSS,<苟延残喘的懦夫>: @Pursuing涛,<游满城>: @懒狗不是蓝枸也不是蓝狗,<laozihenmang>: @welley000,<诺梵>: 穿罩罩了吗···,<网黄陈二狗子>: 为什么不能发图片？[笑cry]]
5937001324	中国女排主将惠若琪最新写真，大长腿有木有，颜值逆天有木有，女排加油。 ​​​	[<星星_在奔跑着>: 这不是我的盖世英雄么…惠若琪[太开心][太开心][太开心]  http://t.cn/R6jiZIK,<森有迷鹿CHN-H>: 大长腿[羞嗒嗒]  http://t.cn/R6jfJJf,<风一样的Rock>: #惠若琪#  我女神[亲亲][亲亲][亲亲],<三亚的雪人高>: #惠若琪#  我的榜样,<ling檬的柠>: 有有有有[太开心],<劉萬璧>: #惠若琪#   #惠若琪来吧冠军第二季# ，惠若琪也太帅了吧[色][色][色]  http://t.cn/R6jUBcW,<王_Hui赢>: 有！  http://t.cn/R6jUHAF,<云且留住525>: 瑞瑞[亲亲][亲亲][亲亲],<囧卡晶>: 我的情人  http://t.cn/R6jyxkA,<哎哟喂哦喔>: #惠若琪#   有，必须有，这是我女神[心]  http://t.cn/R6jy7wH,<我惠等你forever>: 颜值逆天啊，人品也是杠杠滴[good],<迪di12HrqYxy>: 惠若琪[可怜][可怜][可怜]  http://t.cn/R6jLgO1,<元气少女-欣欣>: #惠若琪#  惠惠好帅哦  http://t.cn/R6jLY3V,<惠美丽要元气满满>: 惠若琪[心][心]  http://t.cn/R6jL5NM,<Miracle探头>: #惠若琪#  她是我的盖世大英雄[爱你][爱你][爱你]  http://t.cn/R6j2BnX,<我是专注->: 当然有，而且还很有范哦[兔子]  http://t.cn/R6jAj0i,<排排粉>: 长腿美少女惠若琪[太开心][太开心]  http://t.cn/R6jA9uE,<我爱的人都那么美>: 小姐姐真好看[色],<H谁不是个小仙女>: 这腿长都快赶上我了[挖鼻][挖鼻],<青柠味的_木木>: 嗯，她是我的惠若琪[羞嗒嗒]别来抢  http://t.cn/R6jwKAx,<灰雨星光>: #惠若琪# #惠若琪来吧冠军第二季#  我们的hero琪[爱你],<Rachel_Joe>: 表白我惠[偷乐]  #惠若琪#   http://t.cn/R6jzQvq,<走失中的喵小贰>: #惠若琪#  图二，我的12号盖世英雄[爱你][爱你][爱你]  http://t.cn/R6j7km9,<章肩黑>: 惠女神[心][心][心]  http://t.cn/R6j70Ms,<怡然快乐>: 惠若琪[爱你]  http://t.cn/R6j7KUz,<永远的huan哥>: 我瑞瑞 #惠若琪# [羞嗒嗒][羞嗒嗒][羞嗒嗒]  http://t.cn/R6j7UBb,<励志-HRQ>: 有，我的女神  http://t.cn/R6j7zxl,<哈皮妞也儿>: [心]  http://t.cn/R6jh3me,<Hero_MyRachel>: 我女神惠若琪[酷],<shadow我的追随>: 什么都能hold住的 #惠若琪#   http://t.cn/R6jhLZn,<爱晴的君儿>: 哇塞[羞嗒嗒][羞嗒嗒][羞嗒嗒][羞嗒嗒]好看，太酷]
5937001324	这就是女孩爱化妆的原因，这个简直比照骗还厉害[污] http://t.cn/R6Sfp0A ​​​	[<稣愉>: 回复 @鱼鱼章大大 :[摊手]爱美之心人人皆有,<西瓜西瓜真好吃13>: 回复 @西瓜西瓜吃不到 :有这种人吗[哈哈],<ll璐小猫>: 哈哈哈，会不会中毒啊[二哈][二哈][二哈],<毕玉欣y>: @碎碎念的美女冉,<国民懵智>: @同尘  胸都画出来了,<暖光nice>: @小背心的feel,<HEY1Katrina>: @西瓜西瓜真好吃13,<daisyzy9>: 回复 @Lyyyyyy天黑就回家 :我不需要！！！[哼],<小白兔_G_>: 这种最好是没有男朋友的情况下画才行，不然……什么味道？[doge],<小杜的小航>: @起什么名字啊丶丶,<陈先生地盘1992>: 回复 @Purple绘影 :我去，这都可以啊，快来把我画瘦一点,<峰峰李L>: @Danae--M,<牧遥my>: @梦在前方丶路在脚下,<无敌金克斯>: [微笑] 以前135斤不化妆不能出门  现在98斤 出门涂个防晒霜披个长发就足以斩男,<熙雅replace>: 回复 @Iiifx :正规，正规，一単一结，O会费  http://t.cn/R6Ncncx,<Iiifx>: 回复 @Iiifx :晚上宠幸你[酷],<Qurivia>: 回复 @Iiifx :死狗,<九亿少女的梦的胖三斤>: 恐怖……我以为化妆只是涂涂脸而已……[doge][doge][doge],<Purple绘影>: @陈先生地盘1992  MD累不累,<我是你的李文龙啊>: @如果没有看透wjm  来啊来啊,<熊梦真MZ>: 回复 @六六六六柳梦旭 :。。。无语,<Iiifx>: 回复 @Qurivia :明明是小胸,<徐腾腾Tina>: @三分刚好  [思考],<六六六六柳梦旭>: 回复 @熊梦真MZ :牛逼，你试试画胸,<Qurivia>: 回复 @Iiifx :你背着我看大胸,<-刘昊然的小心肝->: @zmokii-   @樊哥ii   @别吃玲哥-   @美少女战士崔-   @荣啊荣啊Cui,<Iiifx>: @Qurivia  怪不得[喵喵][doge],<咻咻pudding>: @翘翘WEN   @ACE_dear向上吴氏范儿,<这个博主有点可爱哟>: @无语丶无殇  哈哈,<熊梦真MZ>: @六六六六柳梦旭,<你温柔如走在风中SiReSoin>: @少点胡辣多点汤   @角落里灿烂   @唯一高的是发迹线  [眼泪][眼泪][眼泪],<m1ra-小米花>: @Givexann,<Sssmz_>: 回复 @Axxxuan_ :[二哈],<深墨笙默petals诗>: 谁。。。闲的没事画屁股啊,<捏捏你的小肚子唷>: @Evelyn董董  你可能需要[太开心],<LAMWAIHOM>: @微波炉的香肠  简直了[眼泪],<_Axxxuan_>: @Sssmz_  以后可以在腿上画下[感冒],<安南都护>: ؏؏[no]ᖗ乛◡乛ᖘ[no]؏؏完美]
5937001324	#世预赛十二强# 国足战伊朗比赛结束，0比1失利，你觉得中国队发挥怎样？ #国足赢下去# ​​​	[<ZHANGHERO-ROU>: 自信心至少变强了,<于晋16>: 伊朗也不过如此，假摔太多了，我们身体素质比他们差太多，速度跟不上，头球抢不到，说实话好好打配合不一定输,<长桉未央>: 不放弃，不灰心，我们在2022年期待你的到来！,<时光瘦减成落寞>: 也不能一口吃个大胖子，赢了韩国就要求国足赢了伊朗，要是真的进了世界岂不是还要求夺冠呀[摊手]不能根据结果来看表现，只要有进步就是有希望。,<Diiiiva>: 很棒了  结果不重要  重要的是你们在很快的进步[good] 最后看到里皮的背影有点心疼[失望] @诚挚zzz  在六月等你们！[心],<蟹老板的珍珍77>: 战斗到了最后一刻！,<保护我方初晨>: 第一次看球  我觉得还可以阿[good]伊朗确实蛮强的,<Minos-F>: 我觉得虽然输了，我觉得踢的真的尽力了，反正不丢人，一步步来。,<肉肉哒兰宝宝>: 没关系 应该很棒了 加油,<smile羽兮>: 非常棒了，感觉守门员最牛,<Q家姑娘>: 非常棒[心]  已经很努力了 支持支持 一点点进步[haha][haha][haha],<房卒名>: 如果我不能再失败时说爱你 那我怎么在你成功时说爱你,<请叫我聪叶儿>: 整场下来确实技不如人，没什么可说的，总之加油吧！,<zzzxxxr>: 我觉得挺好的[开心]继续加油[加油],<KPforever>: 下半场343很不错，这一个丢球实话实说有点亏[泪][泪][泪],<星空下的徒步者>: 挺好的。比以前有很大的改善了,<岩岩岩岩家>: 已经很棒了，加油啊,<单纯想改个名字啦>: 挺好的毕竟伊朗那么强,<糕大仙555>: 支持他们，加油[赞][赞][赞],<是于琪琪呀>: 曾诚今天依旧很帅,<该yc>: 挺好的，伊朗本身就是亚洲顶尖，,<小小小静style>: 发挥的不错，点赞,<Lukyswagbaby>: 不管怎么样，中国在我心中永远最棒[中国],<东女95>: 挺棒啦，进步蛮大,<H婵H>: 虽然输了，但我觉得很棒！,<洪家三少--黄泉>: 加油！国足很棒！,<胖紙徐_>: 我觉得还是很棒了 挺心疼的其实,<·彦·>: 国足继续加油！目前踢伊朗胜算确实有些低,<-然而-然而->: 刚看到的，泪目。。  http://t.cn/R6SmtUB]
5937001324	中韩大战，韩国队踢人，输球又输人！ http://t.cn/R6t0Tdd ​​​	[<53公斤>: 连国足都干不动还想和解放军较量呵呵🙄 @火了演艺  约偶像上火了演艺，你与明星就一个平台的距离。还不赶紧上火了演艺APP看看！,<CCTV-RW瑞文国际频道>: 啊啊啊啊啊啊啊啊啊啊啊啊啊啊啊啊啊啊啊啊啊啊啊啊啊啊啊啊啊啊啊啊啊啊啊啊啊啊啊啊啊啊啊啊啊啊啊啊啊啊啊啊啊啊啊啊啊啊啊啊这是历史性的一刻！2017.03.23晚20:11我第一次看到国足进球信息！等了多久终于等到今天，梦了好久终于把梦实现！学校韩国留学生都尴尬了[好爱哦][好爱哦][好爱哦][好爱哦],<我是爱国的吃货>: 韩国，颠覆了我对三观，不能气，我不是他,<style00Rose>: 韩国棒子，mmp,<velvetvomg>: 回复 @哒不溜_哒不溜_嗯 :😤😤😤😤,<我们的少年time>: #中韩大战# 韩国都把中国逼赢了hhh 不管中国就是厉害 我就是爱国[doge][doge],<无锡雨衣弦子>: 不要脸，给你脸了是吧,<哒不溜_哒不溜_嗯>: @velvetvomg  真的气,<Eason-Messi>: 回复 @-PiKaPi皮卡丘- :我也觉得,<-PiKaPi皮卡丘->: 回复 @BARCA-HYL :666666,<足彩大V>: 回复 @BARCA-HYL :评论的漂亮,<Eason-Messi>: 微博有一句评论说“问一句:你们棒子的萨德没探测到于大宝的跑位么[眼泪]”]
5937001324	#中韩大战# 中韩大战，于大宝进球，韩国球员的素质！！！输球输人！！！！ ​​​	[<M莎麗M>: 输球还输人[打脸][打脸][打脸],<是阿鹿的努力七七>: 妈的韩国人真辣鸡[怒][怒][怒] 最讨厌这种欺负人还不要脸的人了[微笑][微笑][微笑],<让男人和孩子先走>: @Poikilother_M   @z咿呀咿呀哟z   @派人去刺杀你   @淡定小玉DJY,<薛之>: 回复 @漫淇7 :顺着中国说吧，没办法,<鹿特苏_>: 小国气度，韩国体育界一直很脏，小动作信手拈来。,<我是小鹿斑比啊>: 回复 @Wookieggoma :[偷笑][偷笑],<今天瘦没>: 暴露素质了，韩国呕粑,<Wookieggoma>: 回复 @我是小鹿斑比啊 :送他一句cnm,<力拔山兮气盖世的伏地魔不会死>: 死垃圾垃圾韩国棒子素质还能再低点吗妈的妈的,<我是小鹿斑比啊>: @Wookieggoma  [斜眼][斜眼][斜眼],<摄影小透明Danger>: 这不仅仅是素质问题了，只是伤害,<狍狍儿>: 骨子里的劣根性 只配做奴才 黄喜灿 [吐][吐][吐],<想磕糖>: 只想给他一大耳巴子[拜拜]// @祖传鹿中医专治疯子 : 辣鸡[吐][吐][吐][打脸],<7_darling_m>: 不知道腿对球员多重要吗,<ai鹿不羁的小尾巴>: 韩国人素质真是低下，垃圾真多🙃,<7_darling_m>: tm是不是有病啊？！[怒],<认为越努力越幸运的铁板>: 真恶心啊，输球又输人[拜拜][拜拜][拜拜],<胡萝卜肉团子>: 韩国的体育秉性一直就不干净,<起个草率的昵称>: 输不起球就别踢[摊手]，现在好了，所有人都知道你没素质了，开心吧[微笑],<EAse7>: 回复 @_DFo :丢人玩意,<闫一北>: 我有一句mmp现在就要讲  什么玩意  你爸爸也敢踢 快点去投胎还来得及  韩国棒子还有更不要脸的吗  来来来 记住这一天  记住这个垃圾  黄喜善是吧  良心被南韩狗吃了  废物一个 ,<撸了个傻狍子>: 我日 踢腿[微笑][微笑]祝您早日死全家🙃,<Barbie笑嘻嘻>: 心疼大宝，棒子真可恶[衰],<Catch_Deer>: 输球丢人，输素质，中国是你爸爸!,<子凡best>: @再多爱你几公里,<娘口彡>: 看的时候气死我了，裁判还没有判！！！！,<李达康先生笑了>: 韩国本身不是一个国家，美国大兵可以随意驻扎，用大棒去欺负他们的女人,<阿柚_H>: 脏[拜拜]// @跟着红尘跟随我浪迹一生--JAY :今天韩国队输球又输人,<刘巷子的土豆泥>: 辣鸡，输球输人[炸弹][炸弹],<今天dlrb糊了吗>: #中韩大战#  不要脸[微笑],<Alllllluh>: 辣鸡 比不过我们 连人都丢了,<任珂502>: 这什么人啊[怒],<珊SHAN--->: @SW__C   @吧啦吧啦Ann   @FJinL-   @帅丹丹-   @y雅a喃柟戁,<花果山孙大圣会计>: 棒子国总是各种恶心。赛场上最爱搞这种下三滥小动作。,<梦见你在第七个路口吃辣条>: 真是恶心[鄙视][鄙视][鄙视]    输了就输了  还想打架不成。[打脸][打脸][打脸],<鸡柳同学>: 回复 @二水z :他其实只想把球踢出边界,<EvAk_yyy>: 回复 @谢洁蕾 :无耻。。,<我只爱可口可乐>: 叫脏国吧。中国爸爸同意你改名[微笑],<二水z>: @夢想家张家柳  [摊手]真疼,<EvAk_yyy>: 回复 @谢洁蕾 :赢了啊,<你是不可遗忘的少年和梦想>: 臭不要脸[怒骂][怒骂][怒骂],<煜妖与夏木>: 真是贱呐，哪位大神人肉他吧[愤怒][愤怒],<傅关耳>: 回复 @喵大仙要努力- :拉扯球衣在足球比赛中属于正常，只要没有很明显的妨碍比赛进程基本不吹犯规。韩国球员明显的对人不对球，属于恶意犯规。,<滑噌鱼老婆>: 回复 @Luu劉_ :靠,<最爱橘生淮南>: 把19号套麻袋揍一顿[怒][怒][怒]，死棒子[吐],<ALSKIN>: 可能是要骂死这群龟孙了 @滑噌鱼老婆,<叫你不要吃这么多>: 球场上哪来的垃圾？,<罗裙>: 垃圾  http://t.cn/R6tRu5j,<-M小阿鹿的小阿铁M->: #为中国足球加油！#      md……    虽然我不是特别懂足球，但是看到这的时候真的气的跳脚……   ,<执念至深至老>: @ATyp生活依然继续,<余生予_鹿_>: 丢人丢出岛了[打脸],<精神洁癖yoli>: 以前不是一个节目拳击比赛 中国对韩国  韩国选手比不过就打人  妈蛋看的我好气]
