5969479877	Froyo in Time Square [好]🏼[美国] ​​​	[<很凶的做饭阿姨>: 炸毛[doge][doge],<luckymetmu>: rainbow man, interesting,<大灰狼的小白兔酱>: 脱衣服！脱衣服！脱衣服！,<JeremyTse_>: Have you been giving eletric shocks? Judging by your hair,<-Z_XY->: RainBow man！,<阿力力要上进>: 总是那么潇洒[哈哈],<-钟嫣然->: 我想吃你手里那个,<-Z_XY->: AAAAAAAAAA      Logan I LoveYOU！！！！！！！！！！[心][心][心][心][心][心][心][心][心],<何处烟雨不江南HI>: cute。。。[害羞],<ChiliChiliWangWang>: Big fan of yours,<ChocoNoLateShan>: what are you eating [大笑],<壯士先幹為敬>: hhhhhhave a good time[哈哈] @LoganPaul,<11丶7貝>: 你干嘛要用英文 美国人也玩微博吗？,<一米八的霉超疯>: 这肌肉666666,<学西语的Ramiro>: Call me maybe?,<飞翔之亦>: 我要看你拉你女朋友的丁字裤,<Marsttin>: 这发型很Logan！,<嘣噔你个嘣噔吖>: [偷乐]劈叉～[赞啊],<马可号的小菠萝>: 一个字☞是无碍  帅！,<Arvin_R17>: BUY PERFECT ILLUSION ON iTUNES PLEASE!!!  http://t.cn/Rct75y3,<Joan_xm_>: Omg you are  not so cool[doge],<Faijohin>: This gesture means 溜溜溜溜溜6 [doge],<三十岁前要养猫>: muscle man,<DespacitoRHN>: Where is the splits?,<I-am-Sherl-locked>: 可以理一下你的头发么[挖鼻],<小熊猫toto>: [爱你][爱你][爱你][爱你][爱你],<超级Yuhao>: 啦啦啦[笑cry],<铍氧钠>: ur hair is amazing lol .Have fun]
5969479877	迎接新的挑战 ​​​	[<拥抱星星的月牙>: 回复 @拥抱星星的月牙 :这不是我吗,<拥抱星星的月芽>: @我爱李博文都有人用,<WQ爱吃鱼的猫>: maybe you can try a short cut on your hair~,<奈何钟>: 每块肌肉都练出来了,<邢邢X丿>: 额滴娘啊 你适合不穿内裤哪[色],<一颗少年栗>: OMGOMGOMGOMGOMG！！！,<月亮是软的奉>: hhh too hot to be straight🌚,<章鱼小饺子>: 小伙子你这是要上天呀,<Hy赫英旭>: 然后睡着了[doge],<川味蒲式蛋挞>: How can i be stronger like you？,<2次方Z>: 回复 @再美好的回忆也只会是曾经 :这比喻，厉害[喵喵],<礽祎>: 回复 @V587小刚哥 :这身材[doge],<布朗布朗我爱你v>: [喵喵][喵喵],<布拉索斯>: 回复 @礽祎 :我美拍看过他，超有趣的,<礽祎>: @V587小刚哥,<再美好的回忆也只会是曾经>: 回复 @2次方Z :就像哈士奇只有在睡觉的时候才是挺乖的一样,<2次方Z>: 其实你正经的时候挺帅的……只在你正经的时候[拜拜],<Devil灬小壞>: Are you getting thinner? or just my eyes have problem?,<叉烧包纸>: 这个身材可以有！,<玉面小抗美>: 可以[doge][doge][doge][doge],<AMEhotaru>: 帅啊！！我的哥！,<苏袂凉>: 漂亮[doge],<睡迟了对娃儿不好>: 虽然我是男生。我还是想说，搞基吗？,<Kasixiozzz>: @耶鲁小黄哥_無-牙齒  厉害,<娜样的小九九>: 突然感觉你也挺帅的,<浅草真琴>: you are so fucking awesome,<BeloVed0SJY>: 给你们安利一个超好玩的，有毒的游戏，贪吃蛇大作战，哈哈哈哈哈！[吐舌头][吐舌头][吐舌头] http://t.cn/RcLYGau,<南一社>: 你也健身，一起吧,<亜特蘭斯>: Could you tell me that, close the door seeing ghosts, and then come and are you playing the video, have a website? Can be sent to me? Too much video I can't find  请问那个，关门看见鬼，然后闪过来被你们打的那个视频，有网址吗？可以发给我吗？视频太多我找不到,<her_lips>: [good][good],<岂不出清风>: 啊啊啊啊啊啊啊啊舔腹肌[哆啦A梦吃惊],<不腻肥肉>: 十块吗？哇。。。让我们肥肉怎么办呀,<小猫儿Bayan>: [喵喵][喵喵][喵喵][喵喵][喵喵][喵喵][喵喵][喵喵][喵喵][喵喵][喵喵][喵喵][喵喵][喵喵][喵喵][喵喵][喵喵][喵喵][喵喵],<你好大马猴>: 正经还是帅的[脸红],<好奇地看世界>: remind me of GV,<招摇过市ss>: 卧槽瘦了(¬‿¬ ),<开飞机的左哥>: Wow ~so good,<黑大舒>: update!!,<heiyoheiyo拔萝卜>: 啊啊啊啊啊鼻血[哆啦A梦花心][哆啦A梦花心]SOOOOOO SEXY！！！！[爱你][爱你][爱你][爱你],<who璐哇>: 回复 @马小小小跑儿 :你猜[喵喵],<who璐哇>: 回复 @SKBDspirit :一硬就硬法,<转角遇到鱼这个名字不错>: 回复 @腐壞的世界丶不朽的你 :sure[doge],<傈玉傑>: excuse  me.身材这么好[喵喵],<-钟嫣然->: 哎呀好性感呀[兔子],<一朵匚菌>: So sexy[心],<我是金泫雅>: 出于礼貌湿了一下,<马小小小跑儿>: 回复 @who璐哇 :哪里硬了[doge],<阿卢卢卢卢lu>: 这腹肌[好爱哦][好爱哦][好爱哦],<可可仔GP>: 你让我想起大卫雕塑！,<丘晓芬>: 这身肌肉我给满分！,<礽祎>: 回复 @Three-543 :嘻嘻嘻]
5969479877	爆米花池🍿️[吐舌头][好]🏼 ​​​	[<Josswel在世界的Ink>: 摔进去疼不疼？？？,<I-am-Sherl-locked>: 你就说这张照片是第几次[眼泪],<从此隐姓埋名_深居山中>: 这泳池我能游一天[doge],<废矣>: 太浪费了你 太讨厌,<莫非的意思>: 浪费粮食！浪费粮食！浪费粮食！,<zheng绿绿>: why don't you send us a gif?,<尬liao>: 可以可以，这很LP,<紫菡繁星>: 你是不要当美国的陈美嘉[笑cry],<LamblIY>: where is your best friends？,<j嬌大仙>: you new  yorkers,<三刀姑娘>: 土豪啊[喵喵][喵喵][喵喵][喵喵],<八神太一与金木>: Add some water will be better[doge][doge][doge],<-瑪啦啦-Mayira-pouya->: So you are rich[doge][喵喵][doge],<九八的二黄>: 放点水，会是怎么样的呢[doge],<夏未央xxx>: I want it,<FLYBOY_KUN>: 土豪  交个朋友吧[爱你][爱你],<我不会告诉你我姓徐的>: 后面小哥满满的纹身 可以,<小卷子和假发子->: 吃完给你一万个赞,<夏颜颜颜颜>: 有钱[doge],<向阳黍>: real rich[笑cry],<无糖战歌>: 骚呢兄弟[doge],<阿狸猫S>: 哈哈  都吃光吧[doge],<JIN_JIN_JINZR>: Nice！！[哈哈],<娇癌iii>: 有钱任性[微笑],<彩恩呐>: 为什么说浪费呢，吃光就行啦[doge],<换个名字好难->: 有钱任性[嘻嘻][嘻嘻][嘻嘻],<Meou->: 你是有多少钱[钱],<waooooo->: 你躺下去的都是 可爱的 粮食啊!,<妙妙妙妙张>: Oh my god this is awesome!,<Playforrespect>: dude u re rich[晕],<抹茶味的安东尼>: 又调皮了[眼泪],<手机用户小水>: 你每天过的都好开心呀,<layyyyyy么么哒>: 有钱[doge],<骑猪少女昂>: 哇塞！好想吃！浪费[拜拜][拜拜][拜拜],<鸿儒么么么>: 好浪费，不要给哦啊~,<今天的帅是痛哭流涕>: 最近的微博背后都弥漫着美刀的味道[doge],<zzzzcjj>: 我只看到裆中飞鸟,<无情老麻雀>: 智障 是花生好么,<是叫绿鞋子啊>: 妈的你怎么呢么有钱,<-Yan-AM>: 厲害[强]🏻太牛逼了,<李雪莹儿>: You really have lots of money.[拜拜],<傲就是这么霸气>: 笑话！明明就是沙子。,<赵时时时时时浩>: 国外人口少，是有原因的,<星辰的喃呢>: 在中国就要被骂浪费粮食了！,<AIJIASWORLD>: maybe you can eat them all[doge][doge][doge][doge][doge][doge][doge][doge],<煞比王头头>: 你的 百思特福乱德呢？,<腿毛比diao粗>: 别糟蹋，给我吃吧！,<立盐>: 大家快想想跳進去後快要窒息的感覺 還有爆米花黏黏糊糊的糖漿 天啊！讚！,<sheldon--PhD>: OMG[傻眼][傻眼][傻眼], it looks so delicious.,<EddY就是Edward呀>: Why not challenge the hot sauce bath[doge],<阿Aaaa璐>: 洗干净了再跳进回去,<HE1ZE1>: cool[鼓掌],<猫不喜欢吃狗肉>: [doge]边游边吃,<BeStrongMEIKO>: 你的好基友呢[哈哈],<嘉儿baby0328>: 不错 很棒[喵喵],<生气的八思>: 出于礼貌 盯一下裆,<SallyElsaLyla>: 我也想要[笑cry],<QUEEN小雯>: se精病啊~哈哈哈]
5969479877	是你让我更完美... [眼泪] ​​​	[<Tina是独角兽女神>: 激情四射……同意的赞我[doge][doge][doge][doge][doge],<FFFFFLLora>: so u want to come out?[喵喵],<aeoliana>: @Marcus_chu  点进去看,<柠檬汁儿_75439>: I think so, it's a real friendship.,<ToyCRane___>: [嘻嘻][嘻嘻][嘻嘻],<灿若星辰XYL>: best friends！,<中心幼儿园扛把子>: Come out?[doge],<Nymphs__>: God bless you,<酒窝痣->: happiness～,<倾心v伊人>: Best friends,<南一社>: 有你，有我，有他！这个世界真的美好！完美！,<抠脚大汉流火火>: 这是要出柜啊[喵喵]喜闻乐见,<leeleker>: get a room you two！,<伊啦啦-CZ权>: 好基友  一辈子 【感动cry】  http://t.cn/RczBnfb,<只想发财>: 原谅我 腐眼看人基[doge],<国美和我一样有大眼睛>: [doge][doge]are your gay,<爱笑就傻笑hhh>: You two so cute @LoganPaul,<xzqaaaaaaaaa>: 这是要搞事情啊[喵喵],<动筷儿>: 回复 @太上老君派来的葫芦 :对啊我也怎么认为,<你知不知道你很可爱>: 回复 @动筷儿 :长得不像啊[笑cry][笑cry],<你知不知道你很可爱>: Why not be a gay[doge],<SEXYKAMO>: I'm just wondering is that guy a sneaker?,<RymLuo>: father and son,<Daya-Bieber>: Best Friends！,<凉拌猪耳酱>: 友谊万岁！！friendship,<城城Hayes>: 好基友一起走[doge],<挽南烟>: you are gay?,<米拉miuo>: 好基友一辈子[嘻嘻][嘻嘻][嘻嘻],<BambooQueen1>: [飞吻][飞吻],<Zoe丶欧>: You are gay, right? Joking, ha ha! I really admire your friendship.,<Marsttin>: 这很Logan!,<你没穿内裤啊>: 在一起在一起在一起,<马可号的小菠萝>: 正能量boy 想着要给你改名号了[doge],<墨音儒>: Best friend [心],<段独白Roban>: 一生一世一双人，一高一矮好基友[doge],<BeStrongMEIKO>: best friend[心],<WangJingzz>: 求衣服链接[doge],<CEN是岑参的岑>: 你们在一起我是支持的[微笑],<动筷儿>: is he your brother from another mother?,<半脸世界>: i have seen many things about you,i very like you.,<MrtBad>: 有我更完美 [doge][眼泪],<瓦尔登湖桃桃桃桃乐丝>: 好有爱，羡慕你们,<波多野结肿>: 回复 @panda女帝 :哈哈我也一脸懵逼 没事,<夏雨軒XD_>: best wish[心],<Reddy9666>: 你倆出櫃吧[喵喵],<panda女帝>: love you baby！[爱你],<panda女帝>: 回复 @電車痴女高肿肿 :一下回复错了，不好意思[悲伤],<子陌水衡>: [微笑][微笑][微笑][微笑],<panda女帝>: 回复 @panda女帝 :一下按错了…回复到你…不好意思[悲伤],<circle夹心脆>: Hohohohohohohoho,<panda女帝>: 回复 @電車痴女高肿肿 :love you baby：[爱你],<Ririko莉莉斯>: Ur bbf哈哈哈哈哈哈哈哈,<fried_fish>: bromance]
5969479877	这是一张我七年级的照片。你会看到两点。 （1.）我是一个禽兽 （2.）我是一个禽兽 ​​​	[<kapiii->: 哈哈哈我还以为女孩是你,<是瑞瑞吗_>: 哈哈哈哈哈哈哈哈哈哈哈哈,<米娅Mia_T>: Aha. Hell yes,<薛定谔不喜欢的喵喵>: @我觉得我适合当段子手,<大灰狼的小白兔酱>: 当时你还是小顺毛,<小姑娘美图头像铺>: 妹子：你狗眼往哪看？[doge],<咸鱼狙击手>: 脸美少年果然是不妨碍你性格禽兽[doge][doge],<阿斯卡ks90>: nice ass,<呂佬頭子>: 第一个禽兽 你盯着她屁股  第二个禽兽 你双手伪装在口袋靠近档的位置,<上帝的绿苹果>: 你一直是，我要跟你分手！break up,<Lay七宫>: 你暴露了[doge][doge],<Aqarey_blue>: Yep you are [眼泪],<西瓜君618>: [眼泪][眼泪][眼泪][眼泪]哈哈哈哈哈 你这个禽兽,<摩羯座的Gyeol>: [doge]真是个禽兽,<小卑鄙-->: so cute!,<我是一个正义的黑粉>: 没想到你是这样的人,<ColleenneelloC>: 回复 @yeamJunn :哈哈哈哈哈哈哈你也是,<yeamJunn>: 回复 @COLLEENKEROAEN :哈哈哈哈哈哈哈爷爷也是禽兽,<吓哭我这个小学生了>: 骚到不行，so Bad,<聪儿ii>: 回复 @_奥利_ :禽兽哈哈哈哈,<uhTOM>: daaaaaaaaaamn,<Shoes仔控>: [doge]怼她,<杀死罗曼蒂克>: 哈哈哈混蛋[doge][doge],<喜歡阿然>: 哈哈哈哈哈哈哈哈哈哈哈,<aaaaaaa妹>: 1、你犹如一个禽兽。2、你就是一个禽兽[doge],<Wanderer_C>: 回复 @you-niversity :哈哈哈哈,<李婷虽小压千斤->: 我什么都没说，这是你自己说的啊[思考],<爱情魔发师陶德>: 教练我要学这个[喵喵],<傅一涵呢>: [爱你][爱你][爱你][爱你],<章鱼小饺子>: 原来你7年级的时候头发就辣么长啦~[doge],<musaliya_>: 禽兽[doge],<行走的胃呀>: [嘻嘻][嘻嘻][嘻嘻],<Chen陳三岁__>: 回复 @zheng绿绿巨人 :noooo😅,<Minnieeeee>: 正常 我懂你小伙子[doge],<大美妞博主>: You know yourself well when you are only a little tee,<梦媛嘻>: 笑死我了，你7年级就这么高。让不让人活,<333xd>: [哈哈][哈哈][眼泪][眼泪][眼泪]lol,<真真王大鸟>: Can c that well 🙃,<Maxicin>: why? you may just happen to stand there.,<脑残怪兽>: 你禽兽不如[doge],<YANGESD>: @女爱希子  啊哈哈哈哈,<阿狸猫S>: [doge][doge],<ShootingRobin>: 回复 @Monster_Tocy :九成用了谷歌翻译[拜拜],<ShootingRobin>: Ok ok u monster [doge],<lilymoonmoon>: 那时还是一个正太,<Jonbenet>: 咦。。。。。。。。。。。,<小腰女要吃肉>: 确定不是禽兽不如？,<姑娘你就是個灣仔碼頭啊>: 哈哈哈哈哈哈禽兽,<我发现我的微博名字很正常>: 照片中的女主可看到过？,<袁际权>: zhongwen bucuo,<Cesarine>: 回复 @zura小受 :[哈哈][哈哈][哈哈][哈哈],<怪蜀黍吃汉堡>: [冰川时代希拉][冰川时代迪亚哥][冰川时代希德奶奶][喵喵][兔子][猪头][熊猫]]
5969479877	A Sunrise Jog！ ​​​	[<珍妮酱baby>: 哇，这肌肉[色][色],<Hoo_Lee>: I like ur brother,<孙拜拜_慢半拍>: ohoh.. I  love your muscles  and  flying  hairs[好囧][好囧][好囧]     goodnight, Hulk[好爱哦] @Logan_Paul,<陳艾登>: logan在Instagram和snapchat上说他今天会去丛林里找一头熊打架 小担心🙃🙃,<陳艾登>: are you really gonna find a bear to fight omg,<歌者的回旋木马>: muscle man~[doge][doge][doge],<bruce大师>: nice man！,<聊人生聊梦想>: 你不觉得你的上下半身不协调吗,<丶I罒3罒I丿>: hi big man[坏笑],<LH_LIU99>: 设计个好发型吧…浑身上下就发型不给力,<小二我要点个火锅>: you got my attention [微笑],<QtaylorY>: 秀身材[doge],<般葆>: cool[喵喵][喵喵][喵喵],<老鳋羊>: 你的三个（·）（·）（·）呢,<Lion是会说话的大猫>: Nice haircut Logan[傻眼],<没病装病的>: 每天精神饱满洋溢青春活力的年轻人[馋嘴][馋嘴]真好,<5201314Bieber>: 一个杀马特的头发[doge][doge][doge],<叙利亚妹妹>: The only thing that can make me crazy about u is your body, come on baby!!!!! I love u[心][心][爱你][爱你],<不想正>: HEY Muscle Dogg what s UP,<beautifulrivers>: so hot[偷笑],<SeeUInTheHell>: Where are triple nipples going?,<iamthecutestpie>: A sunrise dog[喵喵][喵喵][喵喵],<安琪拉齊格勒>: Skip leg day, everyday. [doge],<Johanna_where>: muscle[爱你],<树先森的爱人>: 讲真，p了没[挖鼻],<GIARYi>: mo ci da[偷笑][doge][doge],<郭同学的微博呀>: wow..nice  body,<原味鱼九>: naughty boy,<Team10Squad>: cool abs,<三角铁亚西吉>: Took it as a sunrise dog at first sight. [汗],<不怕提图的里是>: 你也说几句中文？,<Darwin-->: Logan！！！！！你的腹肌太棒啦！！！！[爱你][爱你][爱你][爱你][爱你],<拔插插插插>: 能不能不穿长袜子，好挫啊,<小奶Catcat>: good 9[拜拜][拜拜][拜拜],<Bian--qixuan>: 喜欢这种有点神经的你[doge],<小包纸aaa>: Six pack! @LoganPaul,<KuroLight>: nice body[doge] i love it,<hhhh哈哈哈哈嗝>: Good morning![心],<大黄大黄我有大黄>: 胸肌在哪里啊胸肌在哪里,<希小野>: Now I think you are..........hansome..........Oh my god!,<Chen陳三岁__>: So hot[doge][doge][doge],<-LynnZhou>: Leave me alone!   我要 放！屁！啦！ [doge],<EMINEM--MANG>: Oh nice body[馋嘴],<谢了谁Shemin>: A night comment！,<只是为了随心所欲的说诉>: Please come to China to 干me!,<學不會_寂寞>: 身材好棒！[色],<莎-莎-皮>: 撇开脸，真是个直帅直帅的,<Yingzi0907>: Fake [笑cry],<DespacitoRHN>: We wanna see splits!!,<何时耳>: Where are your three nipples[doge][doge][doge][doge][doge][doge],<正义的阿呆>: 你的发型是按大理石大卫整的嘛？[思考]]
5969479877	我和我的宝贝。 ​​​	[<意中人呐->: @吴jsks  you  need,<浮世莫遇>: 你的胸和大腿上拉链了？,<就是安之兮_>: No,you are mine,<伊卜卜>: 图片评论  http://t.cn/RcvLUDi,<笑丫蕊妮>: girlfriend？,<阿杜hj>: 健身不练腿，迟早要后悔,<Zoe丶欧>: 后面的美女都笑了,,<紫嫣有头大蠢羊>: 哈哈哈哈此处 @山下智博,<_帅最涵宇司>: 你宝贝是充气的！[喵喵],<DAMNSins>: @Excel3oc,<Belladrops>: @一切都会过去只是时间问题   雪辰姐，这就是传说中的大臂和头一样粗吗[笑cry][笑cry][笑cry],<老多比x>: 你腿上的是纹身吗[doge]还是作死时被打了,<来买你啊咯啊>: everybody wants to steel my girl,<曹先生CNX>: Ur baby's got a hole,<小姐姐姓王>: 这不是以前的照片嘛[害羞],<弟弟毒蝎>: 回复 @哥哥毒蛇 :你怎么一直冷漠！,<Behereever>: 那个是按照我的模型刻出来的 老公我也爱你,<Mayuyu的豆乳>: hahah[doge][doge][doge][doge],<哥哥毒蛇>: 回复 @弟弟毒蝎 :哦。,<--啊偉->: 其实亮点是后面那个瘦飞机场,<风继续吹_s>: [doge]这宝贝哪里有我好呢,<sadago0218>: 我去，你的宝贝怎么骨折了,<辣辣啦啦拉辣啦>: 太美了[赞][赞][赞],<北北不是画家>: does it work?,<腿毛比diao粗>: 你为什么不给她穿泳衣[doge],<寿司的菠萝比马大>: 神他妈宝贝哈哈哈哈哈哈哈哈哈,<敏敏莉莉张>: perfect[拜拜],<弟弟毒蝎>: 回复 @哥哥毒蛇 :sjb阿 水世界三十块钱一小时,<隔壁那个安阳>: 你居然喜欢女的[doge],<迪玛希Dimash粉丝后援团>: [眼泪]你的宝贝怎么变成这样了。,<CaptainHugoo>: 哈哈哈哈哈哈哈哈,<艾伦小天使家的兵长xxx>: logan腿上是不是有个伤疤？还是看错了？,<佳佳大大大大人>: charming[哈哈],<从小高冷面瘫招风耳leader李狗蛋>: @HinataRice  哈哈哈are you serious,<LWWDK>: 我想知道你的伤疤怎么回事,<怎么个情况060>: 哈哈哈哈哈哈哈哈哈哈哈哈,<还不如要一个西瓜>: The inflatable doll is really ugly[doge],<我爱小鹿鹿国际范>: 回复 @GYF_2333 :我也看见了,<嘻嘻123527264747>: 回复 @烟雨江湖杀 :可以这很强势[眼泪],<我爱的人叫苏果>: 适当的休息休息   别忘了你不拍也会有人支持你,<梅河岸上>: You are  crazy man [怒][怒],<鲤社>: My eyes.........[脸红],<五好青年1023>: 为啥不给她穿上泳衣，都让别人看光了[doge],<鱼人家的人鱼>: 好像是没有洞 你往哪里捅？,<ohh斯莱特林>: 质量真的很差[微笑],<MsLambs>: have a good time with ur little beauty. It will be a wonderful day.[飞吻],<你的蔻蔻宝>: 哈哈哈哈哈哈哈哈哈哈哈哈哈哈哈哈哈哈哈哈哈哈哈哈哈哈哈哈哈哈哈哈哈哈哈哈哈哈哈哈哈哈哈哈,<Hyacinth-贺>: 又在还火车了    呜呜呜呜,<Nanayok>: Oh ur girlfriend looks cute,<大唐老哥>: 居然跟笑傲江湖里面的一个乌克兰妹子很像！[惊恐],<Marley__GD>: 此图一出谁与争锋[眼泪][眼泪],<爱的漩涡916>: You're very 污[惊恐][惊恐][惊恐],<Jia_Kerr>: 原来不仅是中国的充气娃娃长这个样子 那我就放心了[ok],<antidise>: ha..h...a]
5969479877	我爱你巴西！TE AMO BRAZIL! ​​​	[<谦暧>: [哈哈][哈哈][抓狂],<Amanda柳木琴子>: 有的人也是矫情的可爱，自己不爱没必要在评论里瞎bb，别隔着屏幕就忘了素养，who are you[微笑],<零乳糖软妹0>: 为什么跟雕像这么像？[偷笑],<来自于tan90>: 交代下到底被警察追着跑多少次,<SugarNaomii>: 我们不爱[微笑][微笑][微笑],<JK小狼>: Logan se fosse português será Brasil com S,<生无可恋的笛笛-XD>: NO, WE THINK BRAZIL SUCKS. CUZ THEY MAKE OLYMPIC UNFAIR.[拜拜][拜拜][拜拜],<用户nyj815ugyl>: 你不是爱中国吗[挖鼻],<TwoThs>: jake果然也去了，美拍一堆抢嫂子的[doge],<庭落幻橙>: love you[爱你][爱你],<南方瞎子nfxz>: 你谁都爱[拜拜][拜拜][拜拜][拜拜],<佳韵李>: 看起来傻萌傻萌的[笑cry],<抓住一只大大的Rachel>: 回复 @阿南的小小小情人 :Jake Paul,<抓住一只大大的Rachel>: I'm so freaking out now_(:з」∠)_My vacation is quickly dying(っ╥╯﹏╰╥c),<吃土吃到死的少女>: 巴西有毒，快回家吧[哆啦A梦吃惊],<喝雪碧我怕透心凉>: we hate Brazil,<少女回旋踢owo>: P图效果一流[doge],<張藝Felicity->: 爱哪不好,偏偏爱巴西那个地方[doge],<茫野SKY>: 这雕塑好像你。[doge],<用户5985165150>: 中国讨厌巴西，所以请不要传播你喜爱的这个东西，尤其是在中国,<X繁花落尽终是伤>: 你弟弟的微博是哪个啊？ @LoganPaul,<X繁花落尽终是伤>: 劈叉兄你在百度火了[偷笑],<Bieber迷妹>: 你这样会失去本宝宝的[拜拜],<I晗宝>: Stop babe. Tym 2 home. Dinner already. [爱你],<I晗宝>: 老公。别闹了，快回家吃饭。,<layyyyyy么么哒>: 你在说什么 巴西是什么[doge],<HH小小太阳>: 你们美国人当然爱啊，因为巴西是你们的儿子。赛制你们美国想怎么改就怎么改，想重新比赛也可以。,<HH小小太阳>: 讨厌巴西[拜拜][拜拜],<薛家媳妇儿M>: 依然喜欢你[心],<没财没色的小傻瓜>: so that is why u lost your fans on Weibo?,<大君Kalika>: 可是是因为巴西让你们反复跑了一次四乘一百？或者帆船赛的时候听了你们的话？不知道,<大君Kalika>: 好吧，那我取关了[微笑],<Em0tions>: 那些点赞的都是怎么想的[微笑][微笑][微笑],<5201314Bieber>: 我看见了你弟[doge][doge]为什么他半张脸都比你帅[群体围观][群体围观][doge][doge]（当我没说[偷乐][偷乐]）,<迪玛希Dimash粉丝后援团>: 我似乎看到了你弟[眼泪],<Em0tions>: brazil is to bad ,like a shit[微笑][微笑][微笑],<zmt敏>: 帅比[哆啦A梦微笑],<Chen陳三岁__>: 洛根对他去过的国家都会表达自己的热爱,中国也是一样的.你可以不喜欢巴西,但请尊重别人的喜欢.:),<无甯无甯>: 你不应该在这说你爱巴西[微笑],<特洛伊希文女朋友>: 巴西是什么 能吃吗[doge],<耶嘿_辛巴>: 我翻了个白眼🙄️,<HelloaWind>: But we always like you.[心],<HelloaWind>: But we don't like there.Because the Olympic Games make us feel it's unfair[伤心].,<NeilbaeX在路上>: But we Chinese don't [微笑]Cuz the Olympic Games hold byBrzail is unfair [拜拜],<高高高高Sher>: 我爱中国和你orz,<UAazs>: 感觉你在开新闻发布会,<Mrs-Beaman>: 你需要聽一下“里約歡迎你”[微笑],<______幵>: 我爱你logan!!!,<TheRealStan_>: 下面的应该不是他弟弟吧 jake没去巴西,<我叫金戋青争>: 我一直看你弟发视频然后以为他没去[喵喵][喵喵],<青岛市的热心网友>: 你这样会失去本宝宝[拜拜],<Miss莉莉莉莉>: 你一本正经的样子应该更像 后面的雕像,<我不是山口百惠>: 他弟弟的微博传送门 @JakePaul  [doge]，不谢]
