5969479877	我可能是一个吸血鬼 [馋嘴] ​​​	[<一张好可怕的露脸>: Well, cool but why?,<可爱12-38>: i like vampire and i like u！,<纠结症重患者>: woo.so cool  l like  you  so  much[爱你][爱你],<嘿我素JJ>: Edward? Hey, I'm you're Bella🙈,<A陳真A>: There is no one told you that you look like ROBERTPATTINSON[可爱] @LoganPaul   @LoganPaul   @LoganPaul,<Bonsoir陈启闫>: [哆啦A梦花心],<一条猴仔哎>: 你不是rainbowman吗[鼓掌],<杨酷酷qwq>: 爱德华[爱心发光],<A9N17>: Comment with pics  http://t.cn/RcgtM4f,<A9N17>: 回复 @年狗带 :哈哈哈厉害了会劈叉的吸血鬼,<hhhh哈哈哈哈嗝>: Bella & Edward,<xhfov>: you should be！,<YourDearKuhn>: 回复 @腐壞的世界丶不朽的你 :66666很强势,<英语老师的小丫头>: The bug of vampire,<Reservoir_Dog>: 好帅٩(♡㉨♡ )۶ ,<海贼TOP_罗宾>: 想太多[笑cry][笑cry][笑cry][笑cry][笑cry],<The_M丶Joker>: NO,you like The Joker.,<阿兰有猫>: [二哈][二哈][二哈],<讨厌糖醋里脊->: 嗯[飞吻]可以的，好像,<我的女朋友是厂长>: 长得像古罗马的人,<西瓜君618>: 乱说，哪有你这么神经病的吸血鬼啊[微笑],<睡迟了对娃儿不好>: 无所谓。我只在乎你的肉体,<-雅雅雅小喵儿>: 厉害了我的哥[白眼][白眼]吸血鬼大概是比较注重仪容仪表的,<xxxfonduod>: Explain, I can read English, would you please respect for people图源看水印  http://t.cn/Rc1j6gC,<徐鸭鸭mj>: Haha vampire Paul,<DatsunN>: 感觉你快秃了[笑cry],<玉面小飞尤>: 为啥不换个发型，这个发型真的丑爆了,<GALAXYFW>: keep your dreaming[doge],<菲娅chen>: 因为你比较白吗？[笑cry][doge],<壮士来瓶儿红茶吧>: 一般的吸血鬼瘦嘎嘎的,<全体立正丶>: 回复 @年狗带 :哈哈哈哈哈哈哈，自动脑补画面。,<嗡嗡叫w>: 可能只是丑了一点的外国人,<WANGEHAHA>: #22个俯卧撑挑战#,<不穿秋裤的兔兔>: 吸脂肪吧…别吸血了…,<寿司的菠萝比马大>: You look like the grandpa in Hotel Translyvania.,<Helen奥斯特洛夫斯基>: vampire [爱你][爱你],<天天熬夜的人>: but you look older than what you really are[二哈],<Yuzi_锅包鱼肉>: 因为你跟爱德华一样嫩牛五方吗？,<木叶村野生长尾鼬>: [二哈][二哈]  http://t.cn/Rc1IXcO,<鹿衍然>: well，maybe [二哈],<相不瞬>: 图片评论  http://t.cn/Rc1fyfT,<夏小晴SunMi>: 像！！电视剧里最多活2集的吸血鬼,<迷失一座城>: 呵、呵.....,<爱熊猫的杨先森>: EXO me？  http://t.cn/Rc1tMoC,<鑫齐Shark>: um…like my shit,<塔普的乖乖圆>: looks a little bit like Stafen,<我是Dawn啊>: 还是会劈叉的吸血鬼,<bboyfuse>: 首先你的qs出来一对翅膀[眼泪],<LSSAAAAPRIL>: Gorgeous,<LiamGilbert>: 别说，造型有点像Stefan 哦,<被掐住的猫>: 真像那个雕塑……,<樵九九>: But you stand in the sunlight!man!]
5969479877	Selfie With Beautiful Girl @喵大仙带你停药带你菲 ​​​	[<-西丁>: @一个报告  你喜欢的巫婆紫红,<_小澄_>: 我以为菲的胸变尖了……,<CY杉>: 看这图片以为你是个女的[doge],<BertonBowen11357>: LOg.........喵大仙。。。。。,<waterrrmelon>: 这个人还是矿大的[衰][衰][衰] @枫疯疯疯小朋友   @洗洗洗淋浴,<rael____pcyyyyy>: 我的天哪logan你居然没和我偶遇！,<污重白芒>: 回复 @未棺 :……[doge],<未棺>: @污重白芒  世界网红一家亲[打脸][打脸][打脸][打脸],<Sky天乙>: 回复 @Cerise樱汁 :天下网红是一家…,<不甜的豆乳兔>: Beau个毛线[微笑],<请问你今天要来杯奶茶吗>: 回复 @sjkjk2131uusau01u03 :年轻人你能不能三观正一点？？？,<图图的夏天gj>: 菲菲……[爱你],<Jean-wmsha>: @喵大仙带你停药带你菲  好羡慕啊,<Jean-wmsha>: oh my god,<卖柠檬的WQQ>: 回复 @SK8_Zz :→_→,<SK8_Zz>: 回复 @Jike王青晴 :[doge]你在盯我的胸么...,<卖柠檬的WQQ>: 回复 @SK8_Zz :←_←,<君大宝i>: [傻眼]还真是天下网红是一家,<节操满满的me>: 原来天下网红真的都是一家啊[笑cry][笑cry][笑cry],<WwwHDdd>: 图片评论  http://t.cn/RcdrWRX,<本查>: 有没有偷看胸hhhhhhhhhhh,<裸夏的松子>: @Logan_Paul,<烊毛白又卷>: 每次都是哇他和她认识，哇，她和他也认识。[笑cry],<Pang_za>: 回复 @喵咪小姐和狒狒先生 :欸呀？哪个矿大毕业的啊？,<权夫人SHALA>: logan180身高，大仙178身高,<陳貞慧Charis>: 好喜欢看他Paul美拍，两个网红一起[爱你][鼓掌]，好激动,<QQQQQdf_>: of course our 喵大仙,<呱瓜子5940186260>: 一样高[脸红][脸红][脸红][脸红],<柠檬_wuli鼠宝>: 看到图片的第一反应就是 大哥大姐，你们用美颜了,<Flyoutman>: 是不是很多人都在盯着一个重要部位呢？ 有一样的吧？,<已换微博为爱吃夏威夷果儿>: 怎么都没见阿曼达,<Numskull乂>: 我想起了蜡笔小新里面的那个外国人,<翘姐和佳佳>: sssssssso cute！I mean  you！,<Yonggi-yo>: 世界网红是一家呀厉害厉害,<Emmaleeli>: 天下网红是一家[doge],<-王翘楚>: 你肯定又盯着人家的胸看[doge],<HZT-ao的Mr_凡先生>: 都喜欢的网红……果然 天下网红一家亲[微笑],<Lee噗噗噗噗噗>: 这就是那个很火的[笑cry][笑cry][笑cry],<北投少女_>: 两个最喜欢的视频博主！,<时谣_Nyx_>: @一光年的距离i  666 中外网红会晤,<leklekg_>: @slim_tomato  天下网红是一家,<赐你青珂酒>: 哈哈哈哈哈真的是一家亲,<穆昃夏隋柯名>: 这样也可以碰到！,<猫的病>: and you are very handsome.[哆啦A梦微笑],<幸福的花单飞>: 哈哈，看到大仙啦！,<菲宝宝cerny>: Logan和喵大仙合影了耶！,<若你喜欢怪仁>: Logan I love your teeth so much!!,<氨基酸脱水缩合形成肽链>: 世界的网红都是一家人[拜拜][泪][拜拜],<Jessieeeee秋叶>: 回复 @向日葵的一瓣 :厉害了[doge][doge][doge],<向日葵的一瓣>: 回复 @秋叶Jessieeeee :178]
5969479877	谁最可爱呢[害羞] ​​​	[<楊楊楊最可爱>: 日本好样的[笑cry],<战忽局局长>: 反正不是你  http://t.cn/RcmtntC,<Larvinz_R>: [doge]who are you …,<仙女lalaland>: your so cute,<咦鼻孔又变大了>: 这还什么app呀[二哈][二哈],<偷吃糖的喵酱>: 为什么只有一个蛋,<Swagy_Sonyuke>: word 妈[笑cry],<消消肖肖>: @Yinteresting  哈哈哈哈哈哈哈哈哈哈,<ceci兮>: 回复 @ZicoCandice :[doge]我应该知道的吗,<你家的迷妹掉了快捡起来>: Definitely it's you [笑cry][笑cry],<VAUSEE>: 对，就你最可爱[doge],<Reservoir_Dog>: what fuck？,<宇宙最凶啊>: 图片评论  http://t.cn/RcnZrC3,<OOHLSYing>: [爱你][爱你][爱你],<Yaphets-l>: 我最可爱[害羞][害羞],<sheldon--PhD>: Of course you are[心][心][心],<PirscusVerus>: You're always[doge],<YourDearKuhn>: 煎蛋最可爱~！！,<JayParkCandice>: 回复 @ceci兮 :[doge]你竟然不知道 一个国外很火很贱很帅的网红,<迷失一座城>: 你最吓人[惊恐],<Gb维嘉->: i want to go die,<ceci兮>: 回复 @ZicoCandice :[doge]他是谁,<JayParkCandice>: @Tiffany小嫻   @ceci兮   卧槽！！这个男的有微博,<HEREISANGIE>: Of course me,<Ririko莉莉斯>: 你去照了pika……[脸红],<Dxyan_Oo>: 为什么要把那块贴店,<敌辣Adila>: 我最可爱哈哈哈🙈🙈🙈,<_MioMio_>: egg[笑cry],<Shionce_>: 刘梓晨[doge],<张文文文秀>: 我只承认我最可爱[哈哈][哈哈],<徐鸭鸭mj>: Hahahah the egg,<lllllIlllllIIll>: 穿上衣服我还认不出来了[二哈],<kiyoqi->: 我只能说你最吓人[微笑],<比比迪芭比迪布_>: 把自己p这么美干嘛[doge],<HaoSe小丸子>: 你最可爱你最可爱你最可爱[doge]重要的事说三遍～,<小小小啸月>: [doge]原来你只长了一个蛋。,<胖肚子不要爱吃煎炸>: egg is cute,<第一眼的意中人·>: 图片评论  http://t.cn/RcESloE,<GrantGulovsen高伟明>: 噢，亲爱的！怎么挑选呢？[舔屏][舔屏][舔屏],<TaeMoner>: 你呀～[馋嘴][馋嘴][馋嘴],<Sugarpop小圆脸>: 天哪这美颜功能[吃惊],<我是一枚乡下人>: Definitely your balls [噢耶][噢耶],<反航母肥皂>: 只有一个蛋的你最可爱,<雨幕之殇>: 是你是你都是你。。。。。。。。。。。。。。。。。。。。。才怪！[doge][doge][doge][doge],<ForeverJoanna>: 你最可爱[亲亲],<冷大菠萝-天宇>: not you[doge],<8vbn>: uuuuuuuuuuuu,<爱笑滴小茄子>: 傻。。。[doge][doge],<芬兰的冰>: 我觉得那个蛋最可爱[推荐],<Winona吉吉>: 你的牙缺了一块儿,<胡歌我的哥321>: me！it`s me！[作揖][作揖]]
5969479877	今天不要忘记欢笑! [开心] ​​​	[<荷风惠畅JENNY>: 哎呀妈呀，帅死我了，血槽已空[心][心][心][心][心],<QAQeitta->: 你是不是发现了美图秀秀,<Heathhh>: 哈哈 logan 上热搜了 恭喜啊 一直支持你[doge],<耳尔U>: 难得这么正常，handsome！！！[哆啦A梦吃惊],<青青菠萝>: I LOVE YOU,<Rachel-Ines-GZH-FCB>: 正经的时候这么好看,<Yangyxy_>: 怎么变帅了[眼泪],<vlris_>: got it[嘻嘻],<heiyoheiyo拔萝卜>: 好看好看[哆啦A梦花心][好爱哦],<M-74Guns>: [哈哈][嘻嘻],<苏xian森森干嘛>: [哈哈][哈哈],<清撩>: 你认真的样子很帅,<__Dora__X>: cuuuute boy[好爱哦],<啊逗比biubiubiu>: 青春阳光笑起来自带光环的boy[太开心][太开心]，两个字，帅！,<EasonChan的病人>: [拜拜]没劈腿 差评！,<Johanna_where>: a warm smile[爱你][爱你][爱你][爱你],<知微cherry>: 咋突然变成阳光的画风了,<SuGAerrr>: 好喜欢你[爱你],<阿平才不是零>: [羞嗒嗒][羞嗒嗒],<伊啦啦-CZ权>: 你那么美 那么美么美美[哈哈],<阿卢卢卢卢lu>: 你这么正常起来我竟然有点不习惯[笑cry],<我叫狗蛋呢>: wow~~~~~~~~~~,<YNKUYT>: 中文八级[嘻嘻],<柳上无鱼>: Cute sweater. And it really makes your look hot. @LoganPaul,<JOEYCHANBiu>: 看到你就想笑hhhhhhhaaaaaaaa：）,<Miss莉莉莉莉>: 哎哟喂，然后过几天又来点黄段子[丘比特][丘比特][丘比特][丘比特],<NeilbaeX在路上>: 这衣服🙈JByeyou,<芬兰的冰>: 不是风一般的刘海了？帅多了，逗逼,<我那只养了两年的猫丢了>: 为什么土豪还没换7,<大神他本人>: 罗根宝什么时候来中国做节目？,<六亻乙少女的梦>: This picture is a bit like Justin Bibb[doge],<小野不爱布妮拉>: 依然帅气[doge],<萧帮冰糖葫芦>: 虽然我知道你很帅⋯但是罗根⋯你知道⋯西游记里有一个人物叫霸波尔奔吗⋯,<BigRae>: and do the splits,<iamfine314->: 看视频知道你帅没想到还会拍这种照片,<明大珠mz>: 今天也请不要忘记微笑[微笑],<哇哦你看起来很好吃>: 天哪 好帥[哆啦A梦花心],<锦行_静下心来>: 原来你是有颜值的[眼泪],<-不然你猜->: i think i love you,<AntipodalTalent美中人才>: We look forward to seeing you this Sunday at the IMS China-USA Internet Celebrity Summit in San Francisco!  这个星期天，我们期待见到你在《IMS中美国际红人峰会》在美国旧金山！,<liekkas__Clw>: handsome,<金晓晓倩>: 那明天呢？[doge],<S苏哥>: bad boy[doge],<老铁有毛病没啊>: 可以，可以，我们这很白天,<徐鸭鸭mj>: Sooooooo handsome,<婉铃儿>: big white teeth,<Wendys_seCrets>: You made my day almost every day [爱你],<HelloaWind>: smile~~:),<一身戏服几点浓妆i>: 你的头发毁了你的脸,<贼可爱的z>: You are like the angels in heaven, it's so beautiful！[笑cry][笑cry][笑cry][笑cry][笑cry][笑cry][笑cry][笑cry],<区分大小写吖>: 卧槽，被撩到了[doge],<半颗赤子心>: handsome]
5969479877	Turn around and bite the dick off lol ​​​	[<NeilbaeX在路上>: U a wanker[微笑],<山乡山老师>: lovely[doge],<SYJESKRYJUNG>: 充气娃娃[哆啦A梦吃惊],<玩具1220>: 我知道 你在说 你有一只小小鸟,<小牙牙>: 你想的好像个芭比娃娃或者充气娃娃[兔子],<heiyoheiyo拔萝卜>: dick那么可爱 为什么要这样对它[doge],<哥哥毒蛇>: 什么 @弟弟毒蝎,<虛了為>: There should be a cock [doge],<Miss莉莉莉莉>: 你变了 黄段子多起来了[傻眼][傻眼],<Eachan汪奕辰>: 为什么要用这个角度...,<巴西不仅有足球>: 我知道外国的鸟大，也不用拍这么近阿。,<中分得女神>: 好污[笑cry][笑cry],<orang--->: 今天为啥是英文[doge],<Coco-猪猪猪>: Is your dick that small, a little bird can bite it off at once?  I'm disappointed, really.🙈🙈🙈,<闹肚子的海豚君>: 为什么这个鸟这么大,<万梨阿>: Yep, this is what I want see about your picture which you posted yesterday [嘻嘻],<sugar_corn_Lky>: I like you[哈哈][爱你],<KING-IS-LBJ>: NICEEE bird![强][眼泪][大笑],<王冰洁_>: parrot[小鸟],<小徐的夏天>: 鹦鹉回头把大鸟叼走了，厉害。是不是这个意思啊？,<就甘咯拜拜>: Dirty[doge],<有嗜睡症的猪>: [挖鼻][挖鼻],<李吼啦>: 我就是那只鸟[doge],<TroyeSivansHusband>: 你真色情[doge],<不穿秋裤的兔兔>: 鸟的位置恰到好处～[doge],<WinHamburger_W>: the cutest dick ever seen,<自-由的很荒谬>: 回头要掉他的大diao[doge],<李吼啦>: 我感觉我的英语不够用了[拜拜],<star茜茜>: [doge][doge][doge][doge],<吃葡萄不吐葡萄皮才怪的小仙女>: so dirty[doge],<WhAtAdam>: U dirty bitch,<Hic_Pic_>: oh  shit[doge]]
5969479877	可惜我不是模特 ​​​	[<GodAbraxas>: You are so amazing！！！,<羞羞胖宝>: 你是麻豆…这个麻豆可不是妈妈脸上的豆…而是，模特[眼泪][眼泪][眼泪][眼泪],<岂不出清风>: 可能是被你的胸肌耽误了吧,<爱怎么称呼怎么称呼>: You look good.,<蓬莱的小仙女>: 可惜我也不是演员[喵喵],<_Felix99>: Come on ,you r almost,<鄧公孖>: 劈叉劈叉劈叉劈叉劈叉[doge][doge][doge],<无事大神仙儿>: 被你的劈叉事业耽误了,<_玛尔扎哈哈哈>: 竟然被帅到了[哈哈],<段子界的一股清流x>: 三奶呢[眼泪][眼泪][眼泪],<c1sson>: [赞][赞][赞][赞][赞][赞][爱你][爱你][爱你][爱你][爱你],<你在几弦几品>: 可惜胸太大   再教练啊,<_xxxiyeah>: but u hotter than model,<周天青Azure>: 不是模特却胜过模特[萌],<曹千妍叫曹千万>: 可你明明比模特还帅[爱你],<复原6078>: 你是模特就太浪费人才了 哈哈,<Honey的Honey不行吗>: 大哥，安分做自己吧！,<MelodySmith7>: you are more than a model[眼泪],<Mia丶mmmm>: 好想摸一摸[偷笑][偷笑],<阿廖沙几好>: But I can be one[哆啦A梦汗],<Y呀七Y>: You're way too hot!!!,<有毒的cherry>: you  are mh super model[doge],<Zyuxxxxin->: You are [心],<-Yodikidior>: 突然觉得你有点帅了,<----------zhou---------->: if you are a model ，there should be a sex girl beside you,<junejunejunejunejunejune>: Love u Logan [哈哈],<少年十四岁>: 又撩妹了[doge][doge][doge],<乱七SIngIng八糟>: But you can splits,<全有的大屁股>: But you are better,<一点也不田_>: 厉害了word哥,<生无可恋的笛笛-XD>: 不然模特都得失业[爱你],<Marionette宋>: 不是gay就好[哈哈],<Bkaaks>: nice view,<昌妩>: 你的朋友在给你拍照吗[哈哈],<Chen陳三岁__>: 又故意秀身材呢[doge],<小路s晨星>: [鼓掌][鼓掌][鼓掌][鼓掌][鼓掌],<-深白色儿->: 后半句是：不然模特们都要失业了[酷],<ChenChen基基蛋>: you can！！！！,<nanami娜娜米酱>: But you are funnier than the models,<Christine殿下>: 希腊神话里的美男子,<很凶的做饭阿姨>: 发型[doge][doge],<KatyperryXFenty>: 可是你好朋友Max Emerson是模特呀  http://t.cn/RcSxn3y,<star茜茜>: 看到俩大奶[doge],<Hhhhhian>: you willl beeee[不好意思],<Leonardo-Piero-da-Vinci>: 为什么你中文这么好[doge],<扬小帆可233了>: 那就努力成为一个模特,<落水无声亦有梦>: you are a model in my heart[doge][doge][doge],<天晴大悠>: With that body, I don't care if you are model[doge][doge],<老铁有毛病没啊>: 不是模特但是照出了模特范儿[眼泪],<Angelina-Smileee>: Yes you are !,<5Mx5mm>: You could be one,<_帅最涵宇司>: 我是怎么了  突然觉得有点帅[爱你],<我是一个心酸的小号呀>: 凑表脸[doge],<Babyandmystery>: better than them[眼泪],<LastDKS>: because you are my darling[闭眼][闭眼]]
5969479877	Mario二人组🍄 ​​​	[<帅气一个仙>: cute[微笑],<孤島-xy>: 回复 @Buerbear :敲黑板[doge],<陆的盛>: Heard of you coming to China,<Lifecoach0>: 好喜欢这个小家伙,<马可号的小菠萝>: so lovely！[爱你][爱你][爱你],<MrtBad>: 图片评论  http://t.cn/RciruFP,<Kersting-lala>: 回复 @Buerbear :举一个超经典的例子，暮光之城里边女主在食堂见到男主时就和身边朋友说：“He is cute.”这是很正常的形容词。你的黑板别乱敲。,<猫猫不会跳火圈>: 还以为他镶嵌在你衣服上了[doge][doge],<Mr_黄->: love you,<偏执的小指>: 你朋友比较适合[doge][doge][doge],<崔不理>: 图片评论  http://t.cn/Rci1dRh,<1a哦->: Where is @JakePaul  [doge][喵喵][doge][喵喵][doge],<错觉是老博士生>: 回复 @Buerbear :并不是，说一个男的cute是表示觉得他看得很顺眼--虽然不是可爱的意思,<好吧我叫周小丁>: 说男生帅也可以用cute啊,<基基大怪我了咯>: 为什么不是马里奥和路易基[doge][doge],<CaitVanderleen>: 喜欢Alissa和team10的宝宝可以看这里哦 发布team10咨询和北美红人推荐哦[眨眼][眨眼][眨眼],<榴莲妹妹121>: 喜欢你们[good][good],<1h_Kevin>: 回复 @Buerbear :别闹了 cute可以说人的好么 觉得人好看什么的都可以用cute 你这个黑板敲的我给零分,<炮灰陆>: 回复 @Lolahhhhh :cute可以形容人，用于男性少些，但也不是不可以的。,<很凶的做饭阿姨>: 最佳搭档[doge][doge],<阿瑶的少女心会发光>: adorable！,<郭喵喵才是我好吗>: 不会说英语都不好意思评论了[熊猫],<Polyyyyy>: 我还以为穿的一件衣服！,<火火火-Rubyyyyy>: 我不管我不管 就是很cute[doge][doge],<EveYoung_>: best friends,<CEN是岑参的岑>: 你们真配，中秋也是可以吃狗粮的[doge],<ShejaneTang>: 总感觉你是骑在他肩膀上,<hhhh哈哈哈哈嗝>: two best friends[心],<i三斤饼_向大家安利PokemonSM>: 哈哈哈 吃蘑菇的效果,<陈_姑_娘>: [doge][doge][doge],<Lolahhhhh>: 回复 @Buerbear :我看好多美剧都说别人很cute啊…,<_香肠蚊帐机关枪>: 回复 @Buerbear :拜托 cute怎么不可以形容人[困] 夸女生可爱漂亮就可以用cute好伐,<ShesAnastasia>: Wow Cool,<向泰兰德的记忆>: 谁有那个小松鼠吃香蕉的图[doge],<边城寒子>: fuck me , quickly,<珊妮玛兽_>: 另外一只为什么不是绿的。。。,<huhuhu粒粒>: why you are the taller one,<Jinlee_7>: 6666guy。fuck me[doge],<鸡血拉面>: You are so cute.,<和steam同名>: So funny,<晨悦季>: cuuuuuuute,<who璐哇>: 想问下前面的小哥后背咯得慌不?[喵喵],<匪派诗人>: 有点小帅[doge],<邱三胖>: cute[doge][doge][doge],<jecelyne>: soooo cute[偷笑],<草莓味的小辣鸡>: Have a nice day！[心][兔子]]
5969479877	我每天早上的仪式... 谁想要鸡蛋吗？ [打蛋] (TAG 2 FRIENDS) [鬼脸二] ​​​	[<艾迪希萌子茵呀>: 裤裆藏雷[doge],<X萱哥哥1997>: 回复 @yeraen :什么呀[眼泪],<豆儿敦>: Hhhhhhhhhh,<浪矢岛>: 大家都是盯裆猫[污],<nice刘先森>: 腿真是有够长的[微笑],<Z大曾Z>: 图片评论  http://t.cn/RcmTvPh,<最长的围脖>: oh my god！the egg is so big！,<JayParkCandice>: @Tiffany小嫻   @ceci兮,<鸡涌猎手_>: [doge][doge],<郑宇航mar>: 回复 @yeraen :好贪心哦[doge],<0李0大0呆0>: 你家的厨房不是在你上次做巧克力蛋糕的时候给枪毙烂掉了吗 复原那么快啊[doge][doge][doge],<Flora_Hannah_zZ>: @赵小鑫太受欢迎了,<陈子瓯>: Thought you still got those triple nipples[doge],<_Yuki和萌德>: 中国女人自从走出裹小脚的时代后，先是地位解放成了中国真正的大爷，后来思想的开发度也是没有哪个国家的女人能匹敌了..........,<已换微博为爱吃夏威夷果儿>: 看来Amanda很性福啊[doge],<刘博众>: 我觉得这是CK的广告[偷笑],<符宇同志>: 不是我一个人放大了图[doge],<叫我西门吹水大师>: BIG  COCK,<岛VVVVV>: my son's English name is rogan too.would you mind call me father？,<paotner>: so……………big,<Jackson0920>: I just want to your balls.,<gjkkfdbb>: 你好污哦……不过我喜欢哈哈哈哈哈,<非元气中二少女>: 你穿CK[哆啦A梦吃惊],<你回家了ll>: @roohaw摔盘子供应商,<蠢萌呆的Penana>: I wanna lick your eggs[害羞]Kidding,<洋葱给你吃噢>: @Lex_Lin_,<TTTTTOP_KKKKKJY>: 偶买噶的   叮当猫 🙈🙈🙈,<Giraffe666666>: [色][色][色][色],<致命狙击7>: [哆啦A梦吃惊][哆啦A梦吃惊][哆啦A梦吃惊][哆啦A梦汗][哆啦A梦汗][哆啦A梦汗],<猴塞雷猴赛雷>: 不自觉的那看🙈 你懂得。,<周阿又又>: 晨勃不是一般严重,<詹个妮儿>: What happen to your hair ?[偷笑][偷笑][偷笑],<病况>: Little Logan,<Li_Funny>: 咳咳[doge],<Johnn98>: so funny,<M米恒辉M>: 回复 @Skm阿阿阿yu姐姐阿 :透视眼🌚🌚🌚,<四目相欠>: 老图！差评[doge][doge][doge],<CaitVanderleen>: 喜欢Alissa和team10的宝宝可以看这里哦 发布team10咨询和北美红人推荐哦[眨眼][眨眼][眨眼],<王美涵你咋这么酷>: 666666669,<何止赢>: witch ball?,<Lancelot__Tt>: 塞了多少个蛋在下面[doge],<Miss莉莉莉莉>: 鸡蛋不吃，你的蛋看着不错[偷乐],<HENRY-空城>: Oh man,you are so strong!,<博我以文约我以礼欲罢不能>: 头发都飞了[偷笑],<修因改果>: AND BIG GUN[笑cry],<陳艾登>: you said you are coming to china tmr on instagram stories ... FOR REAL?!!,<-Mua的一口>: 图片评论就是想评论一下  http://t.cn/RciY216,<笨小瓜0519>: 大哥你头发炸了（奇怪的梗[doge]）,<你叫谁钮扣>: 内裤太大了[笑cry],<名字短点才好>: Two eggs and one sausage pls.,<Rorschachaggression>: 回复 @我是Luna_ :[doge]你,<听说昵称不能用>: 哥们你真牛[good],<Amnoar>: 又是一个会中文的佬外,<WQ爱吃鱼的猫>: you means...the eggs in your pants?.......,<雨令6>: 小心，别炒错了蛋]
5969479877	从小就迷人 ​​​	[<吉利登>: 这个好像eminem,太像了,<RT-叶惠钊>: 是啊..我2002-2004戴牙套居然没拍照... @REDABull ：突然在想 我戴牙套的时候怎么就没拍几张照片呢…,<无趣是天敌啊>: amazing[爱你],<YesiLoo>: 小时候你可以去拍恐怖电影[doge][笑cry],<容叟叟>: 这个红眼睛宿醉妆是怎么回事[doge],<ONEDEAN>: 从小就那么不要脸！！,<老铁有毛病没啊>: 你这个像素有点骗人[眼泪],<城-倾>: 吓人……[喵喵],<japjapjap牛奶公司>: 特别像小恶魔[妖怪] 可爱,<ai___________>: beautiful eyes and nice hair,<你回家了ll>: @roohaw摔盘子供应商,<蠢萌呆的Penana>: Turn it off...I mean the towel...,<Oor7>: 告诉我虹膜变色的秘密[眼泪],<雎紅瞳子>: 好像米开朗基罗的小版大卫,<咸鱼狙击手>: 从小就是这个头型[猴子],<西瓜君618>: 哈哈哈哈哈哈哈哈哈哈哈哈红红火火恍恍惚惚,<希奇郑在希奇>: 小时候，怎么那么……瘦？,<不甜的豆乳兔>: 原来你有戴牙套[doge]可是我还是发现了你有一颗牙齿不齐[doge]我可是研究过你有没有戴的[喵喵][doge][doge][doge],<GoldenBye>: @夏美人意大利记得迷路别回家,<yolaho>: 眼睛太大了吧[哆啦A梦吃惊],<CaitVanderleen>: 喜欢Alissa和team10的宝宝可以看这里哦 发布team10咨询和北美红人推荐哦[眨眼][眨眼][眨眼],<闵硕妍xi>: your eyes are red Beautiful！,<Lancelot__Tt>: ...like a zombie[doge][doge],<修因改果>: OH SHIT .WHAT'S  THE MATTER WITH YOU.[doge],<Wendy小刀是小昭>: 从小就揽不住的样子,<ThinkTwice3>: 咦 你的咪咪怎么这么淡,<ClausStranberg>: 腰粗，肾好[doge][doge],<粉红海水>: 你为啥不吃肥点儿，这样就是欧美相扑第一人了,<newBerry->: 裤衩什么鬼[幽灵][doge][doge][doge],<阿南的故事1998>: 哈哈哈哈哈哈哈哈哈,<橙色小背包>: 够够哒！[微笑],<吴允晗niconico>: 回复 @爸爸王就是我 :我刚刚更新了你喜欢的图片，你来不来看看？,<手冢日日>: You never change you haircut...em..that's really amazing,<Liu_ysl>: 从小乳头就如此粉嫩[喵喵],<Jasheya>: 啊啊啊啊啊啊啊啊啊啊啊啊啊啊啊啊啊啊啊我是楼扑的小迷妹啊,<老巫婆的猫>: red eyes,<漢森GARY>: Buy Prefect Illusion On ITunes,<chocolate_813>: 瞎了我的眼睛[伤心][伤心],<耶嘿_辛巴>: 我怎么觉得你现在也戴着牙套[转发][转发],<Hy赫英旭>: 瞬间爆炸完成单杀！,<Matthewcome>: American horror story ..,<DomoWAn>: 从小就看起来疯狂 You seemed a naughty and crazy guy when u r young,<Ly-蓝佛>: 从小就很屌[doge],<恃清>: 眼睛有杀气[doge],<Jekol_Y>: 回复 @Ss744cc :可能是戴了美瞳[doge],<_不负骤雨>: …你这万圣节一定不用化妆了[哆啦A梦汗],<好不容易想了个名字居然被人抢了>: 这兜裆布辣眼睛[拜拜],<入江直树樣>: 哈哈哈哈哈这个翻译真迷人,<陈叔叔怒拍桌子说>: I think u can cos 狂鼠 from overwatch,<聪明的安琪琪儿>: [笑cry][笑cry][笑cry][笑cry],<骑着长颈鹿逛马路>: your eyes.....wow!,<徐鸭鸭mj>: Hahaha why your cheeks are so red,<66666云巅>: 你从小的头发就这样？,<一个绝缘体罢了>: really weird]
