5969479877	Always Plug. Best life advice ever [眼泪] ​​​	[<Jessie-xF>: blue blue,<迈克尔默罕默德>: 你好好想想为什么连卖片的都看不上你,<Dr辣鸡>: OMG You guys was so cult  !   ！！！,<BADkid-babY>: 回复 @朱咁 :博美啊,<直立行走的小黑喵酱>: so cute[心][心][心],<小哥哥eeee>: 回复 @朱咁 :博美，，，吧,<我叫王大月0516>: cute！！！！！but........where   is    you    bird？？？,<Willeeona>: kong is so cuuuuuuuuute!,<芷韫724>: That was amazing![笑cry][笑cry],<猪是的看右往左从>: 狗：我就骑在你脖梗子上拉屎！咋滴？想吃我？,<朱咁>: 想知道这是什么品种的狗，有人可以作答下吗[哆啦A梦微笑],<王诗琪I>: cute dog！ your new pet？ where is ur bird hhha,<小仙女喵喵喵酱>: 回复 @喵喵喵萌的小童话 :[微笑][微笑][微笑][微笑],<白痴痴心心病>: 总觉得小狗狗很抢镜[羞嗒嗒],<Evelyn-i>: [喵喵]cute,<笨羊仔_>: 哎呦诶太可爱了啦[太开心],<冥界艺术家>: Ahhhhhhhhhhhhh i 'm in love with little boy blue ,am i called right?,<时久媚santa>: @摘樱桃的车厘子,<哎哟我真是个妹子>: so cute！！！,<悦悦jerry>: cool[爱你],<Shine_喜欢蓝胖子>: cuteeeee,<momodawu>: [飞吻][飞吻],<喵烤芙家的場花喵>: 萌蠢萌蠢的[允悲]]
5969479877	New pup. New Merch. Both savage. [皇冠] ​​​	[<ZFR媚生>: 回复 @钱不够hua花 :[傻笑]你真幽默,<REGINAMINA>: 敲可爱！ @-叶夏阳,<璐氏集团营业中>: so cute！,<无所谓惧BBH>: 回复 @钱不够hua花 :一日破是嘛,<林嗨嗨v>: sooooo cute!!,<我訫切慕Y>: messy hair,hahaha[哈哈] Tough life does not need to explain.[阴险][haha],<RainbowVacallo>: Nice 噢[干杯]  http://t.cn/RaKSz4A,<上六楼的快活-S>: 回复 @钱不够hua花 :哈哈哈哈哈哈哈哈哈一日破,<钱不够hua花>: 砍 油 撕逼克 掐妮子[微笑]蚂蚁 赢个例西 一日 破,<Chris12137>: Love you bro,<缪Mousika>: 图片评论  http://t.cn/RaKMFHY,<凌晨的四点>: 回复 @我是你流浪过的一个地方i :这样不显的特别吗？何况我是小姐姐不是老哥[微笑],<朗涩悠伤WY>: So cute![心],<我是你流浪过的一个地方i>: 回复 @格格我去学习啦 :我知道啊 主要我强迫症啊,<灿白CHANBAEK91694>: 抱着你弟弟干嘛[并不简单],<ZOE山海>: 回复 @我是你流浪过的一个地方i :在中国人的地盘就用中文，又不是在外网看他的主页[摊手]而且博主在学中文能看懂,<妹妹啊啊啊>: [喵喵][二哈][喵喵][二哈],<我是你流浪过的一个地方i>: 回复 @黑白色少女与猫 :老哥 大家都评论英文你不是我看着很别扭啊,<-鑫鑫鑫_>: 这个手势在中国很受欢迎哟~[喵喵][喵喵][喵喵],<Fallen-X>: ooooooooooooh my god![太开心][太开心][太开心][太开心][太开心],<KNGT新一>: lovely dog[偷乐][偷乐][偷乐][偷乐],<Mr帕德里克>: So great!! Budyyyy!,<Marionette宋>: same hair color bro,<Mardy_Bum>: cuties lol,<Bobby源源>: oooo so cute ！！！ i say the dog [哈哈][哈哈][哈哈][哈哈],<hhhh哈哈哈哈嗝>: lovely puppy[心],<凌晨的四点>: 可爱！哈哈，我说的是狗[doge],<love鹿鹿18>: so quite]
5969479877	你喜欢哪一款？ ​​​	[<他每天上班下班加班>: i like u,<啊逗比biubiubiu>: 这发型不错[笑cry][笑cry][笑cry],<我叫鲁少女>: 说实话，第二款啦,<爽晴式恩爱>: 回复 @徐鸭鸭mj :看了你的微博，受他的影响不小啊[污],<酒窝痣->: look face,<毛洁Betty>: 11111111111111,<darkmiss678>: Absolutely picture No. 3,<超可爱的安瑾然_>: 主要看脸[思考],<Nicole的遇见>: The first one rock,<雷-EstherHeesch1D>: why don't we,<VioletMalik>: [doge]第二个小哥,<我不改名字了真的不改了>: the first one,<LucianBrainDamaged>: Seriously, you need a new haircut bro,<徐鸭鸭mj>: 你短头发时候挺好看的[摊手],<徐鸭鸭mj>: 回复 @Jason爽 :哈哈哈哈，我也都看完了，真的需要勇气,<小哭吧精凡凡>: just like you,<Shade91>: 所以能不能剪个光头,<----Liliana>: 能吃的那款[doge],<霉霉是我大表姐>: 3，看起来好像方便面，有食欲,<美_错>: 哈哈哈 @吐司就酱_,<为什么你要辣么好看>: Logan款[心],<仲仲小星>: Logan[阴险],<猫咪和狗粮>: 第一款  第一款🙈,<Kikiki兰坨>: 你是不是大卫那个雕像活过来了？,<ran嘎>: 3    真是比1好看多了,<Sunnanjuuuuuun>: 四款都一样嘛明明[摊手],<爽晴式恩爱>: 这么久以来，你的每个视频都看完了。我自己都不知道是怎么坚持下来的[笑cry],<爽晴式恩爱>: 说了你就会弄么？[微笑],<你咆哮的月光让我overdose>: 第一款啊哈哈哈哈]
5969479877	和这群美女帅哥一起玩音乐[听歌]😎 ​​​	[<飞尼玛6>: handsome,<Yecaysw>: You are the hottest,<dybi嫁我>: where is the cutest one！i mean jake,<Tziangelo>: 真的好帅啊啊啊啊啊,<Ww的小丫>: 前十[太开心][太开心],<mhrmhrvip>: 里面的美女有点像美少女的谎言里的,<小圭琪>: 玩音乐的人都喜欢黑色？[思考],<9_Doom>: Lololololololo]
5969479877	not a dad but you can call me daddy ​​​	[<Ye-yilan>: maybe you are my son.[doge][奥特曼],<凡凡的煎蛋宝>: interesting[doge],<SallyElsaLyla>: the left baby is almost crying[哈哈],<发了个呆啊>: 这位爸爸终于知道给两个小家伙擦鼻涕了  http://t.cn/R6tCok1,<ITEELA>: 这肌肉  http://t.cn/R6tK8ez,<所以还没想好换什么名字>: 爸爸好，爸爸辛苦了。,<忘记微博名字了>: Sugar daddy?🙄🙄,<Aurora-北>: that baby so cute[喵喵][喵喵],<林格颖-summer>: 害怕你下一秒玩宝宝[拜拜],<鹿迪的日记>: OK，Logan daddy,<夏天的念想>: [羞嗒嗒][羞嗒嗒],<大师兄他请神了>: I say f...............uck you!,<wwwww王豪>: 回复 @一只柴汪 :老铁我也想,<一只柴汪>: 可爱 想日！[doge],<是你呼唤我吗>: really 。,<手稿君>: 点赞里 选几个 我画你 照片留在我置顶,<梧小昂>: that is sooooo cute,<无涯Ruly>: 宝石骑士[二哈],<秋裤二十>: 图片评论  http://t.cn/R6ti7AI,<归风酿勋>: No way[挖鼻]]
5969479877	THIS. IS. INCREDIBLE. ​​​	[<Wr凯睿>: 回复 @I_am_yokilea :啊哈哈哈哈哈哈哈哈哈哈嗝~求原图.小姐姐.,<卧蚕大魔王>: 回复 @I_am_yokilea : @原图妈  求原图,<Ace雪乱了年华>: cool[doge],<Messedupkids>: Ahahah can't stop laughing .  cute tho [眼泪],<olaaaayo>: 回复 @I_am_yokilea :求原图,<牛肉丸子粗面>: so 逗[doge][doge],<这有一朵鲜花>: 回复 @I_am_yokilea :求原图[耶][嘻嘻],<这有一朵鲜花>: 啊哈哈哈[嘻嘻]  http://t.cn/Ri8ktx8,<Chef_Curry>: 我知道不是你画的[二哈],<zhangfacai>: 回复 @I_am_yokilea :原图小姐姐,<鬼火斑>: 回复 @I_am_yokilea :求原图[doge],<I_am_yokilea>: 回复 @阿凡紫猪 :私了,<Dndms>: Pretty Good[加油],<凡凡的煎蛋宝>: you are interesting[二哈][眼泪],<DavidWayne>: When did you become a parrot dude[笑cry],<ItsJeremyWang>: LoganParrot,<Rosin_韩月巴>: It's creepy!,<TheLilPenguin>: This is AWESOME,<桉安46956>: 头发不能再形象[眼泪],<阿凡紫猪>: 回复 @I_am_yokilea :求原图,<DopeBuddy>: insane!dude!,<一口气上五楼->: Maverick是不是这样拼哈哈,<Delia_kazakh>: [哆啦A梦微笑],<I_am_yokilea>: yoyoyo  http://t.cn/Ri8ePf0]
5969479877	LOGAN ​​​	[<爱吃土豆啊哈>: [爱心]️  http://t.cn/RiWFRjh,<ivyorchloe>: Wow, do you secretly have superpower [嘻嘻][嘻嘻][嘻嘻],<Vingyep>: 图片评论  http://t.cn/RiWBHxb,<啊毛阿_>: Interesting,<unprecedented_me>: hhhhh u r so cute[太开心],<Syl_via__>: love you[红心],<高客官>: vlog dude,<Oops_Cruly>: 图片评论  http://t.cn/RiWmlSa,<卷毛儿卷卷的>: 图片评论  http://t.cn/RiWmW2w,<Jasheya>: i love you,<非要用皮皮虾皮皮猪皮皮狗吗>: [爱你][爱你][爱你]  http://t.cn/RiWm9tO]
5969479877	I love this little parrot way too much ​​​	[<葡麻爸>: 回复 @青猫崽 :[doge][doge][doge],<企鹅九月九>: It looks like a toy to me somehow,<青猫崽>: 回复 @葡麻爸 :顶你上去🙈,<葡麻爸>: I like parrot too！  http://t.cn/RiC1WxA,<刘亚萌大帅比>: 我很羡慕你。 I envy you very much.,<张震震张>: 你的小鸟是彩色的[doge],<吴邪即无邪>: I LIKE YOU SO MUCH,<炸裂的鸡儿>: [耶][doge][耶],<Beauty_con>: [太开心][太开心][太开心]]
5969479877	这是一棵世界上最大的树，如果你仔细看，你会发现还有一个世上最大的傻子[眼泪] ​​​	[<浅歌天堂_55480>: [眼泪]专业自黑,<Nonstop机械哥>: 回复 @gt恭听 :也是哦,<RYTLSDMS>: 回复 @剑圣的移动棒子 :没见识，这东西我小学的时候在书上就看过了[doge],<ciacon>: 回复 @剑圣的移动棒子 :树是真的，但此博主绝对是假的，不是本人,<卧槽起个网名怎么这么麻烦>: 是你？为什么说傻子啊？感觉你挺好玩的。,<阿阿阿阿坤啊>: 回复 @剑圣的移动棒子 :不知道就别在前面加个“绝对”,<z伪善>: 回复 @-HpauhkyiMaying :招网拍模特哦 拍拍照片就有佣金拿^o^,<KAXIUDA___>: 看到了一个最大的傻子,<中法混血宝宝Alexi>: 呀这里我也去过！,<猫桑呐>: 嗯？点赞这个？  http://t.cn/RJRjAWs,<just_aguy>: Where is that, Logan?  @LoganPaul,<哦哟举个小栗旬>: 可能这条文是花了钱的[思考][思考]我写不出这样的句子,<M_Muradill>: 相信这是一棵大树的也只有你这个傻子,<小情霖QL>: It's so cool Logan,<用户nabvdnswbdndhd>: 哈哈哈哈哈可以说是很好笑了,<秦晓月月>: 我去过哈哈哈哈！谢尔曼将军树！,<剑圣的移动棒子>: 回复 @森林中的小飞虎 :打[污],<森林中的小飞虎>: 回复 @剑圣的移动棒子 :我就不想打你脸了  http://t.cn/RJRNQC8,<剑圣的移动棒子>: 绝对假的  这么大的树应该枝繁叶茂都能遮住半边天了后面阳光还那么强，不会是你把自己p小了吧？最大的树也应该长在什么亚马逊雨林那种地方吧。,<就这么傲娇你咬我啊>: You may be a fake Logan  http://t.cn/RJR9ysm,<fuXk啊啊啊>: 老道我观此树已成精即将向着妖仙发展,<Luc1a_>: Where is it ?,<菲娅chen>: 傻的可爱[微笑][笑cry][笑cry][笑cry],<柳树君呀>: hhhhh 傻子🙊,<gt恭听>: 回复 @_斯图尔特_ :肯定有中国朋友，给他翻译了的呗[二哈],<念恋的青春>: 回复 @臀肌碎大石 :怎么了？？,<臀肌碎大石>: @念恋的青春   ？？？这句话是真的吗,<虎哥改了个名>: 这种怎么可能是本人啊 有人打理的,<懒滚滚猫好好好>: ur right,<一直想家的孩子>: 这样一看你好迷你哦You look like so mini[doge][doge][doge],<夏颜颜颜颜>: 嗯……要是你不提醒，我还真不知道树下有个傻子[二哈],<我没是李庄>: This is a savage tree!!!!!!!!,<四月骊山>: so......where？？？？ @LoganPaul,<田间匪猫>: ？我恍惚间以为我英语瞬间变好了呢[二哈],<-Irene-Waterhouse>: 你的中文令我感到恐惧x啥气候语法能搞对了[二哈],<还有点小荔枝>: You don't say I didn't find you!,<song鸡鸭>: 红杉树国家公园？,<F-H-A-O>: 图片评论  http://t.cn/RJRtKhv,<我弟丶>: 他有中国朋友啊……[喵喵],<杨爽-->: 这树真的好大啊[哆啦A梦吃惊],<震惊某博主居然起这种名字>: Is Mark helping you micro-blog?,<嘿嘿嘿茹啊茹>: 我也看见一个傻子了[二哈],<l还是孩子呢>: 只想知道是本人吗[笑cry][笑cry][笑cry],<璐透社噜噜>: 所以这是哪儿哪儿哪儿哪儿,<暗夜zero>: 你确定这是世界上最大的树？ Are you sure this is the biggest tree in the world?,<H-arD-erHU>: [吃惊][吃惊][吃惊]wow！,<yezi_wang>: 这图p的毫无痕迹，嗯,<瓊瓊瓊瓊桑>: 傻的可爱[嘻嘻],<Jessica_H_Jiang>: 天呐，huge ！！！！,<EmmaSheep_>: 中文越来越溜了[喵喵]谁发的,<mypaperheart>: i see you,<HUANSIYING_>: 汉语不错  http://t.cn/RJRbAnL,<安心8866888>: 你发中文让我不知所措,<yezt--i>: 这他妈是熊大熊二住的吧]
5969479877	cash me outside [强壮]🏼 ​​​	[<Jameiact>: 回复 @CJY呐 :这是表情包的进化吗？,<姚韶君__>: 图片评论  http://t.cn/RJMW3jv,<Fakeml>: Your hairstyle so cool,ahhhhh,<不辣的喜鹊>: 只能说白人不适合这发型,<不似春光胜似春光>: how bow dah,<黄紫瑜>: CATCH ME OUTSIDE ! HOW ABOUT THAT![加油][加油][加油],<VanKate>: 这发型……不太适合你啊，兄弟,<linoii1>: 哈哈哈哈哈finger,<黑猪biu>: 哥，你头发呢[喵喵],<coco没头脑>: 头发少不适合这个发型[二哈],<湖园我最萌>: 回复 @浪礼人 :好吧，我不会发[doge],<-阿暉->: 圖片評論  http://t.cn/RJIxqfe,<Dr_Sophia>: 无情的光头[笑cry][笑cry][笑cry],<hhhh哈哈哈哈嗝>: How about that?[二哈],<璐瑶吃芝麻粒>: 你好啊 大拇指[微笑],<Tommy陈666>: how bow dat,<Byourlilmama>: lol youve heard bout dat?[doge][二哈],<倔强鲜橙>: I have seen your performence on stitches and u had done a rally good job on playing that asshole brother character perfectly！[强],<驍野駒>: 你最后还是发了这个发型的照片[二哈],<小可乃>: 这头发咋编的！跪求,<LUNASEAthesecond>: 非黑人还是不要地沟了，不合适,<是yuki不是yoki>: It's charming,<大沢瞳->: 图片评论  http://t.cn/RJIv9CN,<SelenaEvansss>: howbow bah！,<饭拍秀>: 不知道你看懂中文不,<CJY呐>: 回复 @友子i :哈哈哈求原图,<友子i>: 回复 @CJY呐 :有个同种类型的  http://t.cn/RJfe3YG,<CJY呐>: 回复 @Sniiry_ :我是好人_(¦3」∠)_,<Rniiiys_>: 回复 @CJY呐 :谢谢,<镇尼S>: i couldn't believe[拜拜][拜拜][拜拜],<镇尼S>: that's u??????????!!!!!!,<镇尼S>: the hair scared me first  http://t.cn/RJfBRt5,<sssubida>: howboutdah,<祁放ZAlex>: really cool， but R U CRAZY?,<於渔鱼>: you become order。。bro,<CJY呐>: 回复 @Sniiry_ :cool  http://t.cn/RJf1SuZ,<Rniiiys_>: 回复 @CJY呐 :这张图是什么意思啊,<就说你麻不麻>: Hair[奥特曼][奥特曼],<Sad汪大毛smile>: 有点儿杰森斯坦森?,<penyy>: its a Monster,<Shih_yuL>: How bow dah?,<蒋雪蕊的微博>: hhhhhhhhhh,<D--H--C>: 回复 @CJY呐 :好的，谢谢,<朵宝宝的双下巴>: [good][good][good][笑cry],<培根PIC>: @Karainy-  。。。怪物。,<CJY呐>: 回复 @田阿阿阿阿阿阿来 :已发[作揖],<CJY呐>: 回复 @D--H--C :私发你噢,<fssdaaas>: 一直想知道这种毛怎么弄,<浪礼人>: 回复 @大懒使小懒O_o :哈哈求原图,<谀阿阿Bin>: Your hairstyle really scared me[笑cry][笑cry][笑cry]]
5969479877	The NBA Finals are dope this year ​​​	[<kahfitz>: 回复 @小pan孖ever :？？？,<HUJIAQQQ>: Perhaps...... Do you like Messi?[doge],<小pan孖ever>: p得有点失真[偷笑],<Justinzheng>: 回复 @TheMisfits :别在着丢人兄弟！,<陳艾登>: so are you,<AnTon-QD>: so cool！ I want to join your team,<TG_FOREVER_>: NBA？？？帮我给刘翔加油！！！,<无题无得>: 真尴尬.我说我怎么读起来舌头不利索[二哈],<安森AnSenn>: NBA?b seriously?!,<二十一位飞行员>: 你要去恶搞nba？,<一碗小米粥不要小米>: 勇士打骑士，被3-1逆转，伤心事，别提了[大哭],<Stephen_Chen233>: [笑cry][笑cry],<白杨树216>: this is CBA!!!,<xapkat-G>: 那不是ricegum 么,<破晓虎鸫啼>: 这个失误我好像没get到笑点,<程子豪1121>: 回复 @TheMisfits :大姚加油[doge],<Outlier213>: 回复 @TheMisfits :人家很明显是故意的啊[白眼],<在九月八日秋>: 不造什么意思先评论[摊手][摊手],<TheMisfits>: NBA 你是不是瞎？]
5969479877	but first... ​​​	[<Catherine_OU>: Let me take a selfie.,<蒙牛爱玩玩>: 什么意思啊我英语不好,<Fay彳>: 这一身混搭风，T恤+毛线帽○,<Aaron-Mok>: 我怎么发现有个山寨的logan 粉丝数都不一样,<FuckWithHarryStyles>: let me take a selfie[doge],<Kikiv_>: Selfie the chainsmoker,<陈麦大人>: look like Ivan Rakitić huh,<WEIPEIRU>: so cute[污],<我忘了我要改啥名了>: Happy chinese new year!娄根！,<甜不甜的瓜melon>: happy new year 🤓  http://t.cn/RxxLLNq,<iphuck->: lemme take a selfie,<孙钊涵>: let me take a selfie...,<哎呀我晓得>: Let  me  take  a  selfie,<胡胡胡胡某某>: 大年三十了，祝你过年好,<HorsemanZ>: Let me take a selfie!,<blingbling的钟钟啊>: let me take a selfie,<Ricky-F>: let me take a selfie[doge],<卖萌德的小女孩>: let me take a selfie,<Hate_Liar>: 哈哈哈大家都是接歌词[哈哈],<Hate_Liar>: let me take a selfie［BGM］,<xxx4s>: let me take a selfie,<李大虾虾L>: happy new year,<成都热心市民郑先生>: China No.1,<Ttweatherman>: let me take a selfie [二哈][二哈],<-OMELAS->: let me take a selfie[哈哈][哈哈],<Bokyeen>: gay li gay qi,<是个好鱼>: let me take a selfie,<柳上无鱼>: Let me turn the flash on~[爱你][爱你][爱你],<姜姜姜姜姜姜丝>: Let me take a selfie,<Shirley_Stan>: Let me take a selfie [二哈],<琳琳琳琳clz>: 房间好有个性[doge]，地上还可以当衣柜,<齐克木>: [兔子][兔子][兔子],<ChillYoung>: let me take a selfie 登登登 登登 登登登等 登登~,<EvenDSong>: let me take a selfie* 不由自主的唱出声[二哈],<菊谅百秋>: [好喜欢][好喜欢],<M咖喱鱼蛋M>: let me take a selfie [二哈][doge],<-Vvictoria->: 看到了内内[doge],<Princess_Bubblegum>: happy new year[鼓掌] [鼓掌] [鼓掌] [鼓掌],<不够酸咩>: Let me take a selfie,<小明哥哥要快乐>: yeah right,<麦粒重症患者>: let me take a selfie[污],<Euarka>: Handsome boy,<九十九线女歌星>: 我还以为只有我一个人想起了那首歌[摊手],<抑郁的老薛>: 帅啊啊啊啊啊啊！🤗  http://t.cn/RxMajHC,<滑稽的大表哥>: IPhone7 4 LED  is very bright[doge],<BrooklynGrace>: let me take a selfie[笑cry],<小青椒_->: 你说你是不是去看澳网了,<丁壹一1>: 假装能看懂的样子仔细的看着评论[污][污][污],<_evilqueen>: 不知不觉唱出来了[摊手],<风情李斯>: happy Chinese year]
5969479877	Sexy is a lifestyle [火焰] ​​​	[<MRbls>: 酷啊~(≧▽≦)/~,<柯基二弟>: Are you okay???,<陳维忆呀_>: 回复 @恚佃 :哈哈哈好棒  http://t.cn/RxUtmjJ,<性冷淡少女->: 我以为吊扇还是吊灯上面那黄色的东西是你的头,<生气的八思>: 回复 @陳维忆呀_ :对呀  http://t.cn/RxUtGo3,<深海泡泡于>: You are so rich，So beautiful house.,<请漂亮小姐姐提醒我去学习>: Good luck bro,<炮炮的迷弟糕>: 没摞上去就是另一个故事了。,<友纪天降使者>: you still alive??,<陳维忆呀_>: 回复 @恚佃 :天呀咱俩头像,<生气的八思>: 回复 @陳维忆呀_ :2,<edswags>: You fucking awesome [鼓掌],<用拉昕编辑昵称>: 你好会玩  [鼓掌][鼓掌][鼓掌],<MelodySmith7>: Your brave bro[眼泪]]
5969479877	变态儿子 变态老爸 变态侏儒朋友 ​​​	[<Sagcu->: 回复 @熊烧 :若不在意称呼便不为标签，别去在意称呼my friend,<矗尛皛靐龘>: 回复 @Heruke_ :说的好像各大当红明星也全都是本人在发没有团队打理一样[眼泪],<橙橙橙橙橙橙橙h>: 微博肯定是别人代发的,<熊烧>: 希望笔者不要再加侏儒两个字了，大家都是人类，何必要带这么多标签。,<歌歌歌歌歌歌i>: 不要老喊他侏儒 ok？,<一鸣_Max>: Ok.that sounds really abnormal[好],<Tsui_Fxq>: 回复 @你不必当真 :哈哈哈哈哈哈哈笑的无法自拔,<小小的快乐哼>: 图片评论  http://t.cn/RxwS6Ru,<ChaSinSun>: 回复 @你不必当真 :那也是love you guys？,<苏玉琛>: 回复 @Hbtta :哎。。。。。。我特么玩的假微博啊,<大琛子_Z>: 皮卡丘的衬衫很可爱[鼓掌],<提米曦>: but i love you[喵喵],<Heruke_>: 回复 @Hbtta :那你说的也有道理…,<Hbtta>: 回复 @Heruke_ :是不是本人有啥区别……本人难道会回复留言？那么多明星微博也没一个是本人啊，不是一群脑残在下面像真的一样对话留言嘛,<xxxsuperbaefromLA>: 回复 @你不必当真 :哈哈哈哈哈哈哈哈哈哈哈我也老是吧guys打成gays哈哈哈哈哈哈哈哈哈哈哈,<Heruke_>: 回复 @小渣渣nn :这是由别人打理的 只是经过本人同意,<小渣渣nn>: 回复 @Heruke_ :因为他以前发过小视频说 嗨微博的盆友们,<白鸿鹄小清新>: 图片评论  http://t.cn/RxwzQO3,<LIN_duang>: logan   logan   logan,<韩若即>: 回复 @你不必当真 :虽然很有道理的样子，但是罗根只能看懂那三个单词[坏笑],<你不必当真>: 回复 @寒峻c :哈哈哈哈哈哪有，我是切换了英文输入法打字的，然后我输guys它自己会跳成gay啊 我没看就点确定了[笑cry][笑cry]蠢哭,<韩若即>: 回复 @你不必当真 :上次的稻草烟花把罗根烧成gay了是吧[doge],<XuuYYBear>: 我想知道谁给你发的微博[笑cry][笑cry][笑cry],<天上的星星不说话嘿>: 爸爸像杰森碍[阴险],<你不必当真>: 回复 @你不必当真 :是guys 不是gays…… 我好像一个智障啊… 打错了… sorry  http://t.cn/RMJ0uZb,<Gillian_77777>: 哈哈哈，老爸好帅,<Heruke_>: 回复 @JChERry季 :不是,<晨悦季>: 回复 @Heruke_ :不是 本人吗…,<泰勒女士男友>: 回复 @你不必当真 :忍住笑死,<油猫_>: 为什么一定要给那朋友叩上“侏儒”的帽子，自认为那有些不尊重人家[失望],<杨全全->: Peace [微笑],<Heruke_>: 为什么你们都觉得这是他本人……,<蓝翔铲屎机技术学院校花>: 图片评论  http://t.cn/RxZmGCc,<xi-Yaaa>: 回复 @你不必当真 :gay?[笑cry][笑cry],<Taylor会飞的小猪>: 哈哈...很可爱呀！,<-阿暉->: 回复 @你不必当真 :gay？！[doge],<好运宝宝1612>: 多好啊[哈哈][哈哈],<KIR----->: [赞]  http://t.cn/RxZRl75,<Mir咧Y>: 回复 @你不必当真 :gay[doge][doge][doge],<贼鸡叭萌>: 回复 @你不必当真 :guy，not gay,<不愿做自己的自己>: 回复 @你不必当真 :gay?你在黑他?,<Leon木子没有雪>: [加油][加油][加油][加油][加油],<痴人说的那个梦>: Logan以后会不会有和老爸一样的发型🤓,<kevintsai_caijunjie_jacob>: 请问一下你是翻译的吗,<xoxoladygaga>: Guys you are so cute I [爱心]️,<NeilbaeX在路上>: I know u can't read Chinese ,but [摊手][摊手][摊手],<你不必当真>: 干嘛黑自己 love your gays ~[心]  http://t.cn/RMJ0xhp,<William威廉等等>: 怎么我看罗根的老爸像杰森斯坦森啊。。  http://t.cn/RxZ8alK,<RoyXouyangKim>: Funny guy[馋嘴]]
5969479877	Look at me. ​​​	[<王點雲>: 好的，你最帅[摊手]  http://t.cn/RMrafSS,<西瓜的隔壁_z宇>: 图片评论  http://t.cn/RMrfGsu,<踏青斯埃文斯>: 回复 @你那是馋她的身子 :笑死我了哈哈哈哈哈哈哈哈哈哈哈哈,<泊弦__Viola>: OK come  kiss [亲亲],<古力古力古力有点萌>: 回复 @你那是馋她的身子 :我水土不服就服你[打脸],<吴烈佳>: so cool[心],<忠爱曺圭贤>: 回复 @单齿山羊 :[笑cry][笑cry][笑cry][笑cry][笑cry],<lkxzyx>: We use the same type of mobile phone[酷],<我男票是锦衣卫love>: what's matter with you ?[眼泪],<Roline>: 图片评论  http://t.cn/RMB21Gl,<Layla小姐姐>: what's wrong with your fringe?[眼泪],<睡不醒的吳先生>: 图片评论  http://t.cn/RMBZ12G,<Yuki-S武u琉G>: I'm looking at you [喵喵],<七禾页聰哥>: 回复 @你那是馋她的身子 :哈哈哈哈哈哈哈哈哈哈哈哈哈哈哈哈哈哈哈哈哈哈哈哈哈哈哈哈哈哈哈哈哈哈哈哈哈哈哈哈,<千赏大人>: then,what?[摊手],<Justin眼眸>: handsome，is it  what  you  want to hear?,<摇滚刘宇恒>: 回复 @事与愿违终将成为救赎 :taiwan倒数No.1,<FUNHD>: so 帅[开心],<Simpleton这个大笨蛋家的小天才>: handsome,<一勺鸡涌酱>: 回复 @你那是馋她的身子 :[笑cry][笑cry][笑cry][笑cry][笑cry],<fooxmay_>: I'm staring at u  http://t.cn/RM1RchM,<Nihat510->: Chill ,bro,<AN-donny>: OK～～  http://t.cn/RM1HMoq,<越长大越孤单是真的>: 回复 @你那是馋她的身子 :图片评论  http://t.cn/RM1HyVp,<陈同學啊_>: we want to see you brother. @JakePaul,<红尘22487>: 回复 @你那是馋她的身子 :哈哈哈哈,<布拉德---皮蛋>: 回复 @Melody李天天 :[惊恐],<刘霸气Sherry>: I know you are handsome , so what?,<奶子渴望者>: 回复 @你那是馋她的身子 :哈哈哈哈哈哈哈哈,<王梓帅哥伊个>: 回复 @在梦里行走的萝卜 :666,<xhfov>: [闭嘴]looking at you,<oTlATlo>: [doge][doge][doge],<纪纪纪鋆>: wow cool,<Fork_Knife>: Good night.,<夯格瑞>: 圖片評論  http://t.cn/RM1IdUA,<Shionce_>: 回复 @杨没钱吃饭 :没有啊，我就是用他的这张照片合的呀[眼泪],<-MMMMMiko-->: OMG，You are so handsome ah[愛你]like you[心][心],<JiRSmins>: i love you so much,<赵苓汐_Neckcy>: [看看] [看看] [看看] [看看] [看看],<Dr-Future>: 😎No thanks,<美少女战士sophiahaha>: Handsome[污],<橙小嗨Alive>: So what？,<Babeee-Alice>: then what,<宋霏凡>: Your hair so cool,<二狗的AKM>: 图片评论  http://t.cn/RM1beNi,<沈8块>: 回复 @事与愿违终将成为救赎 :saonima！友军,<YukoWoo>: [心][心][心][心],<Nayima_Belieber>: May i love your face.[doge],<AZyoU_>: 图片评论  http://t.cn/RM1UgJg,<i_am_sasha>: What's up babe]
