cmzyk	每人推荐一款小众却非常好用的东西吧，最好是相见恨晚的那种。 ​​​	[<ASO工具师>: 回复 @老麦煮机 :您也来了？哈哈，少数派是要关注的，cuto wallpaper也是要下载的,<望瑾娘>: 朗易思听    英语听力口语必备！,<苦逼_天注定>: Clover是一款免费实用的增强小软件，它能为你的 Windows Explorer 资源管理器（或者通俗点说是“我的电脑”）增加多标签页的功能，就像谷歌 Chrome 浏览器那样方便好用。,<老麦煮机>: 关注 @少数派sspai  就够了,<禾西moon>: 回复 @月照西崋 :哈哈我就会用滤镜，我试过用用那些功能然后发现好像并没有什么变化后，我觉得我可能是一个直男[微笑],<cheungariel>: 回复 @持之以恒_伟鹏 :巧克力,<ASO工具师>: 回复 @南风奔走 :恩恩， @龙轩导航  很牛的一个网站！,<ASO工具师>: Taguage，将文章、资料、信息等保存在软件里，通过标签自动生成思维地图，既可以达到稍后阅读的目的，又可以梳理自身的思维模式，还可以借用他人的外脑提高能力。  http://t.cn/RVbhWK5,<长丝青眉>: 若没笔记本 用台式机也想发WiFi的话，买个随身WiFi[摊手],<-_爱如少年>: 回复 @cheungariel :什么酱？,<思忖_咩>: setuna这个软件真的是相见恨晚[二哈],<Alcoholicgirl>: 理线器！宝宝再也不用担心充电时线缠在一起了,<月照西崋>: 回复 @禾西moon :就是闲着的时候，用一张照片去试每一个功能，了解下大概的效果~ 我觉得哈，修图最重要的就是滤镜了，用的好，照片看起来瞬间就不一样了~,<禾西moon>: 回复 @月照西崋 :你这些除了简拼我都有，然而无知的我不知道怎么用[笑cry],<銀叭三三>: 推个超简洁备忘录 占内存又小 minimalist 很好用,<蛋挞泡芙well>: 无印良品柔滑粉底,<月照西崋>: picsart(修图)，snapseed(修图)，潮自拍(自拍+修图)，简拼(拼图),<呦呦子衿兮>: 当然是keep啦  http://t.cn/RV43iLG,<花栗鼠要去非洲流浪>: 新浪博客，不解释,<cheungariel>: muji收纳  http://t.cn/RV4uZyY,<跳跳小猴子>: 小刺猬。。  http://t.cn/RV4m1VU,<cheungariel>: 涂面包最爱[面包]  http://t.cn/RV4muoz,<cheungariel>: instapaper 看新闻的软件 白天没空 可以把各种app的关注的某条新闻新闻存进去 晚上的时候 就可以打开instapaper看看,<郑莹佳>: 2厘米左右宽的透明胶，加上小把美工刀加小把十字螺丝刀。上高中到现在只要出远门都带着,<知世Mercury>: 回复 @柠檬其实好甜 :喔… 我还以为你讲这是类似青菜的东西…  怪不得只长叶子不开花呢，那是店主骗人咯,<cheungariel>: muji的发泡瓶 好方便 发泡泡  http://t.cn/RV4nKBL,<建木的微博>: 有一个叫 “jot" 的小部件超好用哩，可以在桌面显示它的记事录，点亮手机屏就能看到，很小很方便，百度即知，啊我手机安卓的。,<lw清昕>: touch retouch 安卓去水印,<柠檬其实好甜>: 回复 @小月伴我鸟 :菜藕的种子，并非碗莲，种荷塘里才能开花。。。确定是菜藕，无疑。。。可去碗莲贴吧找花友鉴定。。。,<heeYo_阅尽如画羡风流>: 回复 @轰一般的滤子 :是的 不过买了一定要看 不然就是藏书家了[眼泪],<一只懒瓜呀呀呀>: 网易云音乐，一个人的时候带上耳机很享受，很多人的时候带上耳机很安静。,<旅人凡先森>: 落网，一款小众音乐APP,<我就是呆V>: 修图软件toolwiz photos，目前只有安卓版，还有个奇怪的中文名字叫理理相册，可能有人看到相册不会想到是修图软件，或者不会想到他的功能如此强大。我虽然不是什么专业人士，无法去评判软件做的怎么样，无法去评判修图的那些参数什么的到底对不对好不好，我只是从一个普通用户的角度觉得他真的挺不错。,<知世Mercury>: 回复 @柠檬其实好甜 :什么菜藕苗？？这是我的碗莲[蜡烛][蜡烛],<城晓鱼语>: 静读天下，小说阅读器，支持语音，即指即译，蓝光过滤，联动深蓝词典，承包了从小说到外文期刊我所有的阅读需求,<日月忽其不淹兮>: 回复 @苏某人的黑眼圈 :只有译文需要买,<柠檬其实好甜>: 回复 @小月伴我鸟 :简单星人表示同意，小鱼养到现在可以摸头了。bzw:小红鱼旁边是菜藕的苗。。。,<苏某人的黑眼圈>: 回复 @日月忽其不淹兮 :是需要购买的app吗,<天不老--情难绝>: Enounce MySpeed（在线视频加速软件） 从此看视频不再有烦恼[doge],<恋战VS厌战>: cool editor,<WUFENGXIAO----->: everything 本地搜索软件 小巧却又强大,<马甲线小霸王>: ①一套有格调和质感的餐具，包括筷子，勺，叉子，瞬间提升生活品味。 ②两个枕头，单身狗一个枕一个抱，超舒服。,<sunboximeng>: 《Linear algebra and its application》by Gilbert Strang 线性代数比高数更加重要,<轰一般的滤子>: 回复 @heeYo_阅尽如画羡风流 :超便宜,<思念里的小乌龟>: BADLAND2一款闯关游戏，里边的毛球很可爱。ps游戏很好玩,<马甲线小霸王>: ①薄荷，搜索和记录食物的热量； ②美柚，女生的好帮手； ③网易云音乐，边听音乐边看评论，有的有版权限制的歌也能听； ④哔哩哔哩弹幕网，除了二次元各种各样的视频都有，最爱看舞蹈室； ⑤全民k歌，想唱歌又没法去ktv就可以用来消遣啊，觉得比唱吧简洁； （以上是app）,<Jason咖啡不加糖>: snapseed，玩修图的都推荐。我顺便也推荐 传媒老跟班微博[馋嘴][馋嘴],<日月忽其不淹兮>: 回复 @彭博M10 :好像一年一百多，终身的也就不到200。,<JETVIAU>: 电脑：Listary、f.lux   IOS：Pin,<goodgllllll>: Cleen，iphone的图片分类功能一般，有些图用过一次就可以丢了，直接打开cleen就可以了，单纯的欣赏某些照片可以点我喜欢，有时候我会用照片当备忘录，向右滑就可以稍后在评，翻未评照片就可以想起这件事〈比如说这样提醒我要减肥，然后减肥之后可以发微博说我很像汤唯。〉以上  http://t.cn/RV4CYBQ,<知世Mercury>: 字帖，每日一练，平心静气。  http://t.cn/RV4Cpnm,<Vk_y>: 美丽修行，可以查询护肤品化妆品里的成分，科学爱美[doge],<heeYo_阅尽如画羡风流>: 大家说具体点啊不然不知道去哪个平台搜啊。我推荐个买书的网站  中国图书网  超级良心便宜啊QAQ,<XIUMIN的蝴蝶少女>: 用礼品袋装书，小盒子装小东西。 这样书桌可以很干净整洁[爱你][爱你][赞] PS 我和我爱豆一样喜欢整理[眼泪] [飞吻]  http://t.cn/RV49jwj,<知世Mercury>: 灯串，9块钱10米，提升幸福感！  http://t.cn/RV49SiB,<传媒老跟班>: 有好东西的 赶快共享出来[二哈],<Tong啊tong>: 百词斩，学英文单词好帮手吖，而且，里面的注释很有意思的，[二哈][二哈]]
cmzyk	电影术语大普及，初学者看这一篇就够了！ 电影术语大普及，初学者看这一篇就够了！ ​​​	[<Innkeeper>: @vineyardlord,<lemon酱酱__>: @保存到为知笔记,<Shankusu-_->: 嗯，同学们要重点理解“3D IMAX 4K 120fps”这几个参数的内涵，因为安叔的《半场无战事》国内已经定档双十一了[哆啦A梦微笑],<传媒老跟班>: @猫叔Mack   @纪录片之家   @名曰老饕     @电影书生    @电影行人      @电影Mark   @咖电影     @学术大观察,<五羊突突摩托>: @某某某某__----  科普一下]
cmzyk	87版《红楼梦》定妆照，怎一个美字了得！ ​​​	[<梫木>: 但真心不喜欢她们的指甲，尖尖长长的好可怕。,<清风明月柔枝涟漪>: 喜欢薛宝钗的长相，看着优雅，乖巧，有灵气。,<问君应有语>: @橙子的狗狗  是很美,<虚静若水1992>: 好多人喜欢林黛玉，我更喜欢薛宝钗,<哼哼哈嘻嘿>: 小时候觉得不好看 正在重温 看到第七集啦 很有味道 特别好,<一個臣民>: 回复 @刘朚菟 :[哈哈]怎么能少王熙凤,<男中音李源>: 回复 @Herbert__Sun :真美！！！,<Herbert__Sun>: @BaritoneLeonard,<bettercsj>: 最爱黛玉[微笑],<阿境姑娘>: 回复 @天真同学好无邪 :原来如此[眼泪],<活得像太阳温暖>: 我喜欢黛玉那套白色睡衣,<我硕的盛世美颜>: 那时候的眉毛也美啊。。现在大多都是一字眉。。哎。。韵味不再。。,<涧秋君>: 其实惜春也是美得很,<_君临凡尘_>: @活得像太阳温暖,<安娜西米露>: 回复 @一個臣民 :哦哦～[笑cry]没看过这版的,<日月忽其不淹兮>: 图一是不是多姑娘？,<日月忽其不淹兮>: 图一是谁啊？图二是秋桐吧？图五看着就像平儿啊，难道不是？,<一個臣民>: 回复 @安娜西米露 :不不 晴雯是四,<安娜西米露>: 图五难道不是晴雯吗……看见拿个扇子[眼泪],<阿境姑娘>: 回复 @shadyguo1963 :不是平儿,<_胖头陀_>: 回复 @阿境姑娘 :查了一下是史湘云第一人选,<一個臣民>: 回复 @shadyguo1963 :不太像 平儿比画像要瘦,<shadyguo1963>: 回复 @阿境姑娘 :目测平儿,<捍东>: The characteristics of the times.]
cmzyk	厉害了我的哥！ ​​​	[<陈小灰是豚豚>: 回复 @张委员长是个女侠 :[拜拜][拜拜][拜拜],<铮铮铁骨的铮竟然被占用>: 图片评论  http://t.cn/Rc8Yuwe,<Angelus_>: @2016不矫情的小太阳  hhhhhhhhhhhhhhh你不是想看嘛,<Hooligans->: 回复 @七猫喜 :不好意思 我看的是釜山行[微笑],<大P也子>: @Hooligans-   关注好友里唯一的胡建人,<桃子roye>: 回复 @Older_s :哈哈哈哈哈哈哈哈[笑cry][笑cry][笑cry][笑cry],<或许可能是你闲哥>: @Royeeeeeeee  厉害了,<没飞机打得舒克>: @jkerjike,<outsider大过天>: @噜啦啦噜啦啦邱天天天,<马小妞Marni>: @Natsu_Vibe  笑尿[笑cry][笑cry][笑cry],<尉小心>: 回复 @郭Gee :[偷笑],<birdaway_>: 哈哈哈哈哈哈摸摸我可爱的胡建盆友[笑cry],<路过蜻蜓_zZ>: 釜山行要是拍了第二部看四十集还是没丧尸  http://t.cn/Rc8pmFQ,<石榴妹妹teresa>: 回复 @带碗去迪拜 :哈哈哈哈哈哈哈哈哈,<花香满衣0330>: 丧尸，是什么意思，没明白你们笑什么的,<希望只有春秋两季>: 回复 @Endless_Summer___ :哈哈哈哈哈哈哈哈哈哈哈哈哈哈哈哈哈哈,<PC663爱食厨师沙律>: 回复 @张畦川 :神经病啊哈哈哈哈,<有事请留言我一定不回复>: @PC663爱食厨师沙律  哈哈哈哈哈哈哈哈哈哈哈哈哈哈！,<夕下之海>: 回复 @曾慕多情g :哈哈哈哈哈哈哈哈哈,<三十年的纺织娘>: 回复 @佐内正史 :讨厌，被你看穿了[偷笑]  http://t.cn/Rc8xPNg,<私曳子>: 回复 @大桃半个也无 :盲井哟,<前置鏡頭儿>: 回复 @River-Hydra :噗，哈哈哈哈哈哈哈，看了虎山行哈哈哈哈哈，是說，你幹甚麼不來找我聊天在看這些[打脸],<River-Hydra>: @許魏洲的前置鏡頭  [笑cry],<夏末阡安>: @mmm作业微膊,<曼曼粥>: 啊哈哈哈尽情嘲笑胡建人吧,<久似->: 回复 @草莓贤饼 :哈哈哈哈哈哈哈哈,<Blanca_nini>:   @__杨杨杨兔子子子子  [微笑],<闲云野夏>: @花枝招__love   @芳娣  哈哈哈哈哈哈哈哈哈,<天生行动派--鸣杨>: 回复 @沐凡_Nan :不得不点赞   哈哈哈,<鸡柳小丸子>: @不知兮的太阳君  好久没艾特过容酱了,<明天出太阳吧>: @琦毛驴去下棋   @政怡宝宝,<nauynait_7>: @nadnehc_4,<酸奶少女都小雨>: 哈哈哈哈哈哈哈哈哈哈哈哈,<曾慕多情g>: …这个…是真的  http://t.cn/Rc8V277,<宇彬爱鱼饼_>: @都小雨是小鳗鱼   @玉米烧白菜  hhhhhh,<RomeCook>: 回复 @海飞蟹第一琴女 :啊哈哈哈哈哈哈,<沐小楠_>: @饭墩儿   @WANG王王理智  明知山有釜，偏向釜山行…啊哈哈哈…大圣说我说话口音变了…我不觉得啊…我叫张兰[微笑],<风雨时行总归晴>: 李够了 不要酱紫欺户我胡建棱,<你脸上的那坨肉肉抖了抖>: exm？[微笑],<哪吒大哥哥>: @RomeCook,<三十年的纺织娘>: 图片评论  http://t.cn/Rc8t1pL,<吧唧吧嗒咚>: 在第31集僵尸才出现，加油看下去[doge],<廖小葱garlic>: @欧哥哥噜  哈哈哈哈哈哈,<资源掌柜>: [哆啦A梦吃惊],<我没病诶>: 可能是福建人la[doge],<皱皱巴巴的粥粥>: @_我的儿子韩启明,<pktofDora>: 福建人在此 普通话90分飘过[斜眼],<带碗去迪拜>: @石榴妹妹teresa,<光头赵先生>: @慕容-赤兔   http://t.cn/Rc8tLWn,<易生楠忘_Nicole>: 哈哈哈哈～可爱～,<就是喜欢婉>: [笑cry] @红小豆的过期不续,<乘以二还是平方根>: 厉害了我的哥[笑cry],<郭一宅>: 胡建的旁友hin可爱内～]
cmzyk	[doge][doge] ​​​	[<贤贤向钱冲>: 福建商学院？？？,<神奇的兴贝壳>: 回复 @樱桃甜烈 :这不是你吗[喵喵],<海月小筑fss>: 我就喜欢这样的学弟学妹，傻的可爱，很好下手,<pudopu>: @-Hoodie-  看评论,<檸蜜Emily>: 那要看你是MM还是GG,<于涵你好>: 太萌了 希望四年之后还能这么天真  http://t.cn/RcPqE7u,<Super梁珈翊>: @梵高的左耳ONie,<我画在你手掌上的蝴蝶儿飞走了吗>: 请问一下学长学姐，对象是自己找还是学校统一发啊？,<hey未来很长一切难讲>: 我就静静地看着你们一本正经[微笑][微笑][微笑],<咸鱼潘机智>: [doge][doge][doge]还是自己带吧，学校发的容易走火,<做一个吃喵_粮的女子>: 妈蛋，现在军训都有枪啦，难道是水枪，怕你们热死～,<HaomeeWang>: 回复 @R8ina :什么鬼[笑cry][笑cry][笑cry]  男的自己带  女的借男的[笑cry],<有色金属研究所_YF>: 回复 @ShenYzX :哈哈哈[哈哈],<YzShenn>: 回复 @鱼汤拌饭yufan :厉害,<这微博又来了>: 大哥以为自己在美国[doge],<Air了吧>: 我觉得还是自己带吧 自己的用着顺手 学校发的不知道质量怎么样,<ByonMy-邮差先生>: 不但要带，还要求是纯手工制作,<一只啾啾小企鹅>: 就我一个人想知道是哪个学校嘛？[doge],<灬夨->: 画一下重点啊各位新生来来来，枪学校是不发的，但是大家可以到学校各个小卖部去买啊，自己带过去太累了过安检还得被按[哆啦A夢汗],<番茄土豆鸡肉>: 原po在这里 @你尖牙,<有色金属研究所_YF>: 水枪可以自己带一只，其他的学校会发的~,<杜杜里>: 自己带好吧，学校发的56半都能叫爷爷了，不过现在国内管得严了，市面上能买到的无非是那三家，千万别买化隆造，跟他们拉面一样不靠谱，而且学校里奸商批发的也是这种，跟外面价格也差不多；松桃造市面上比较难找，我寝室一云南哥们就带了一把，搂起来特别爽，推荐；合浦造也还可以，南边来的都带这种,<光子度量时间>: [doge][doge][doge],<R8ina>: 看评论[笑cry] @B612的小小玫瑰   @HaomeeWang,<蓑笠一孤翁>: 楼上都是一本正经的胡[笑cry][笑cry][笑cry][笑cry][笑cry][笑cry],<大兵99521>: 当然自己带啊。。哪有学校发的。。四不四傻。。。。,<李伟洲你的猪脚饭到啦>: 当然是自己带啦，什么都想靠学校！学校发的都破枪，不响还容易走火…那年大一刚军训，原来带了老爸用过的八一扛，不行，太重，家里就新买了把ak47，虽然二手的，但是膛线还完好，打起来特带感…还有不要带重机枪，负担太大，另外尽量开武装直升机去军训不要开战斗机，学校没跑道！,<卢克LooKer>: 当然自己带，统一配发的都是老式的，经常卡壳，准星也是歪的，除了子弹管够以外没别的好处。,<哼唧咿呀>: @Fruits水果妹儿,<高大胖親母>: [哈哈]// @陈怡Barnett :当然是自己带啦，什么都想靠学校！学校发的都破枪，不响还容易走火…那年大一军训，原来带了老爸用过的八一扛，不行，太重，家里就新买了把ak47，虽然二手的，但是膛线还完好，打起来特带感…还有不要带重机枪，负担太大，另外尽量开武装直升机去军训不要开战斗机，学校没跑道！,<国企40年>: 我是来看回复的。,<陈家胖胖初长成>: 我没有笑[doge],<啊汪探店>: 回复 @陈怡Barnett :[眼泪][眼泪][眼泪][眼泪]6666,<黎奥黎奥>: 我有火麒麟可以借你,<唐废鱼>: 一定得带枪！？我脚下能飞的桃木剑可不可以，而且带枪也不一定好啊，上次突然走了火吓坏了,<紫奕枫宇>: 当然是自己造的了，一根铁管，两个弹簧，一把扳手，剩下的就靠你的手工能力了,<UncleVez>: 男的自己带，女的找男生借,<YLeven>: @SherryLeslie  中东留学生么，哈哈哈,<一颗柳丁橙>: 这是一道送命题啊,<思林_Wang>: 学校会统一安排直升飞机发放枪支。另外附带黑衣人,<纯纯小王郎>: 评论更搞[doge],<孤城放逐>: 还是自己带吧，我高中军训那会儿，学校发的M4A1差点走火打死人，自己带保险绡好些，祝你军训顺利！,<整天就皂搞师酱>: 自己带，有多少带多少，不然容易出意外[doge],<Yoo_yeona>: 回复 @sueehaha :军训有枪？什么时候的事情 我想污了[喵喵],<SheilaRuffalo>: 當然自己帶，學校統一買的太貴了啦！,<GioiaSU>: @蕉岭阿哥9527,<sueehaha>: 热评超搞笑[哈哈] @Yoo_yeona,<Turing2017>: 同学，你这么猖狂，你父母造吗？[偷笑],<谢耀义>: 带一把黑麒麟就好，子弹能带多少是多少，军训嘛，不就是枪一扫全都倒嘛，没什么的，记得把好看的妹子留活口就对[doge],<Pmeqdyihycedx>: 自己带吧，学校的真心不咋滴，容易走火不说，用着忒tm不带劲，一震一震的，手疼得厉害，还是自己带的好，学校不特别要求，自己尽量带轻点的比如95式或者mp7之类的就比较合适,<如是我闻本来无一物>: [衰]// @陈怡Barnett :当然是自己带啦，什么都想靠学校！学校发的都破枪，不响还容易走火…那年大一刚军训，原来带了老爸用过的八一扛，不行，太重，家里就新买了把ak47，虽然二手的，但是膛线还完好，打起来特带感…还有不要带重机枪，负担太大，另外尽量开武装直升机去军训不要开战斗机，学校没跑道！,<世界一点也不和平>: @谈-APlanet  你军训时候是自己带的还是学校发的？我当初是充q币买的,<放开手机滚去学习>: 看完评论还是觉得自己带好哇[doge]]
cmzyk	发现个帖子，超多剧本：http://t.cn/R5AibJo，需要的童鞋自取~ ​​​	[<胡笳笳YY>: 回复 @仒只想安静地圆心中的念想 :收[爱你],<汀js>: 回复 @别加盐 :你说得算,<MQso>: 回复 @蓦夏初灯 :[亲亲],<火此柴木>: 回复 @汀js :老大 今晚找我吗？,<ciao苍皇>:   @-荠菜肉斗馄饨-,<蓦夏初灯>: 回复 @MQso :可以多看看[可爱]️,<--似此星辰非昨夜>: @Anonaseyo,<森白il>: 回复 @manvin :可以哦,<Cilin_Deng>: 回复 @周2兔 :么么哒,<耕田太太>: 回复 @陈年老芝麻 :谢谢～,<神明护佑>: 博主可有《铁齿铜牙纪晓岚》的剧本？,<D-A-I-S-Y->: 回复 @喵喵二彤 :哈哈 谢谢室长[心],<喵喵二彤>: @Daisy_可沁  可以看看[眼泪],<周2兔>: @Cilin_Deng,<abusyguy_>: @咕噜蘑菇汤  ？？？,<MQso>: 回复 @蓦夏初灯 :你真好！！,<幽梦潮>: @燕儿在云间穿梭,<一块老橙皮>: @Alicesayhi,<黑椒牛柳饭团>: 回复 @软球- :谢谢艾特,<刀郎911>: 好// @纪录片之家 : 转需~,<XH陈huggsy>: 转[good]腻害,<ume-O_o>: // @绘画笔记 : // @电影Mark :转发微博,<未夕>: 这个好。再转。// @电影戏 : 转需,<传媒老跟班>: http://t.cn/Rtd3P0t,<月斜方寸>: 这个更需要[心][心],<一锅粥粥粥粥>:   @Arrivederci_______,<资源掌柜>: 转需~~// @猫叔Mack : 转发微博,<金粉蛋蛋>: [good][good][good][good],<DENCOKI>: 请问有原版吗？[爱你],<miracle伪猫>: 回复 @LZU于天姿 :[爱你][爱你][爱你],<LZU于天姿>: @miracle伪猫,<不二在炉火旁打盹>: @刘艺术--Art   @洋葱味的烤红薯]
cmzyk	新闻摄影师必修课：http://t.cn/RtLAZgx，全100集。 ​​​	[<Chance--Lee>: @紅袍女Chiara,<作者赤诚>: M  @寻鹿与森_,<小谁啊谁啊谁啊是谁啊>: @Slow_wm,<资源掌柜>: 新闻摄影师必修课]
cmzyk	转给你们。[喵喵][喵喵] ​​​	[<醬鴉犬>: 我妈也是这种,常说谁娶了我谁倒了八辈子霉[微笑][微笑],<-Autumn-小夕>: @zhouyinghahaha,<夕下之海>: 好吃懒做不要紧，好看胸大就行,<拿了橘子就跑>: 回复 @晓宣er :正好，毕业的时候扯双证,<何大净>: @卖蓝孩的小理财,<故事里的事DD>: 大家的处境都一样，怎么办呢[鄙视],<MU暮愚>: 结果那男的更好吃懒做[大笑],<晓宣er>: [doge]上大三就给我介绍对象是怎么回事]
cmzyk	听说有人在我的微博评论里找到了对象。[喵喵] ​​​	[<今天的我也是这样可爱>: 回复 @学隐 :[眼泪]我想问 你找到对象了吗,<Vulgar_Dancer>: 回复 @__喜悦出于巧合 :就你话多[微笑],<棵er树>: 哈哈哈评论难得好多[笑cry],<努力奋斗的姑父>: 回复 @传媒老跟班 :好[笑cry][笑cry],<学隐>: 回复 @骆妍说好姑娘会永垂不朽 :恭喜你抽中我了。,<学隐>: 回复 @夕汐張 :我心理年龄大行不,<喜悦出于巧合__>: 回复 @Vulgar_Dancer :那....需要男朋友?,<LY荼蘼尽处>: 回复 @搞笑有趣视频帮 :哈哈,<最爱艾斯>: 回复 @学隐 :你这是每个人都问了一遍？？？[笑cry][笑cry][笑cry]哈哈哈哈哈哈哈哈要不要发个女朋友淘宝链接给你啊？？？  http://t.cn/RtX9vYK,<阿莫西林mmm>: [吃惊]肿么可能！,<传媒老跟班>: 回复 @_有天好想你 :[拜拜],<史国晓辉>: 暗恋对象还没关注你,<_出气球>: 博主肯定是来骗评论的[嘘],<赤砂_祝您身体健康>: 哦？[doge],<王二二二晓>: 吓得我赶紧来留言,<学隐>: 回复 @入淮清洛漫清欢 :[爱你][爱你][爱你],<tobearucer>: 回复 @LY荼蘼尽处  的赞:你也在找吗,<夕下之海>: 想多了，他只是find an object而已。,<_Sarahbabe>: 那你嘞[害羞][害羞],<Vulgar_Dancer>: 不需要女朋友[拜拜],<桂小杏喵>: 我就来试试看天上会不会掉下个蓝盆友～[doge][doge],<有只鸡崽>: 做媒老跟班[doge],<yaogeger>: 到处都在搞对象 七夕真的来了[doge],<唯爱郑源zy>: 我只是来看评论的[偷笑],<希言简禾>: 这条微博比博主的其他微博更能引起我的关注,<Pix深时>: 我这有对象！可以让个车,<传媒老跟班>: 回复 @秦时明月路长久 :在一起了 记得通知,<疯子的乱语>: 看了下评论，这里变成相亲俱乐部了。,<二零零柒2007>: [眼泪][祈祷]真的？,<Jew-z>: 就是来骗单身狗的留言的,<苇桃>: 这是评论最多的一条吧……,<酒小宝6v6>: 就仨字：找对象[doge],<权贺>: 哼，我不信，不信有人来勾搭我。[doge],<努力奋斗的姑父>: 回复 @-AllesGute :这不就来了,<你好哇李闪电>: [挖鼻][挖鼻][挖鼻],<人壬一米>: 说吧[喵喵]对象在哪里,<豫章小民工>: 我也来中个奖[哈哈],<袖戏>: 一脚踢翻狗粮[doge],<两棵葡萄树>: 图片评论  http://t.cn/RtXymW7,<筱眤茈>: 本人女，爱好男，欢迎勾搭~,<传媒老跟班>: 回复 @瞎鼓掌的观众 :[喵喵],<DY控雅痞>: 哦？！[doge],<夸我温柔的是温柔的小红>: 对象！你是谁？你快粗来~~,<Mr_逗尔猫>: 那来一评[doge],<YoursShallotBrother>: 本人性别女爱好男[doge],<劉嚮前>: 是时候告别单身了[doge],<一个小叮当i>: 回复 @静意 :[笑cry]～,<SWAGGY--ZQ>: 喜欢篮球的一起玩呀~[鼓掌][鼓掌],<静意>: 回复 @阿萌萌丁 :这！,<瞎鼓掌的观众>: 你居然是这样的博君[哈哈][哈哈],<Lora_Sofia>: 喜欢看书健身的小伙伴来交个盆友,<_SameEmotion>: 我没男朋友，求勾搭[眼泪],<蜜汁炸毛鸟>: [喵喵]单身汪过来看看,<帝国丞相>: 本人男，异性恋，求勾搭！]
