cmzyk	你手机里有哪些堪称神器的app？都来讲讲，方便我做个汇总。 ​​​	[<桉树yooo>: 猫耳fm[大叔]‍[大叔]‍[女孩]‍[男孩]挺好玩的,<梁游仙子>: 回复 @我还在读幼儿园呢 :建筑学院app,<闲来无事的Zoe>: 有没有什么连英语听力的好APP 跪谢,<王大阳不是小肥羊>: 我只想知道看动漫的软件,<半个柠檬啊>: 那么，我就毫不客气的收藏了！！！（坐等大内存瘦鸡）,<兔子不啃骨头的呀>: 回复 @板顶洞人若月理真 :学霸你好,<bywwsbyw>: 想置顶[鼓掌][鼓掌][鼓掌],<Sunny_SuperGirl_>: 有什么转换知网论文格式的APP吗？有没有看论文很方便的软件呢,<晓丹正在拼搏阿>: 请问有什么安卓版手机App，划词就能翻译的呀？,<r3DH3AV3n>: @J3anzz  香饽饽,<晓丹正在拼搏阿>: 请问有没有那种看完一篇英语文章，后面可以检测做题的英语阅读APP？？！[摊手][摊手]，想提高英语阅读理解能力,<晓丹正在拼搏阿>: 回复 @爽爽1030 :哈哈哈啊哈，，整天逛A/B站，我都忘了还有其他的视频网站[笑cry][笑cry],<传媒老跟班>: 回复 @Sunny_SuperGirl_ :电脑录屏软件：Apowersoft录屏王，Bandicam，EV录屏，Screen To Gif，LICEcap；手机录屏软件：Apowersoft手机录屏王，Fooview，QuickTime（iOS），AZ Screen Recorder（安卓），部分手机自带录屏。,<Sunny_SuperGirl_>: 求推荐 能录制手机屏幕成视频的APP，下过几款都不太满意，小可爱们帮忙推荐一下,<這裡有只狗>: 回復 @林深之-- :你要先下载好的啊，然后再用WPS打开  http://t.cn/RKODmvW,<戲歡->: 回复 @辣鸡程序员鹿柴 :干嘛用的,<林深之-->: 回复 @夯格瑞 :老铁[doge][doge]我知道这个时间回复评论有点诡异 但我还是想问问你现在这个版本的wps怎么看小说啊 找了一晚上愣是找不到 想哭[二哈][二哈],<PeniLIn>: 回复 @汽水吗 :enlight&picsart: 修图神器，可蒙版可曲线相当于小型ps，360相机：个人认为最自然的自拍软件，facetune：人像修容加美化，ultrapop：酷酷的滤镜，repix：各种马赛克，fonta：添加文字专用，catpaint：吸猫人士专用贴图,<汽水吗>: 回复 @PeniLIn :这都是啥 可以介绍下吗[允悲],<薄荷绿的龙猫>: 求学德语的APP[哆啦A梦笑][哆啦A梦笑],<迷上老烟棍>: 回复 @夅砇傢 :心、zz. #秒拍#  一1湿…的,<迷上老烟棍>: 回复 @吴江小鱼当 :。,<古月_LHY>: MIX 修图神器！！！,<三体-白山黑水西北高楼>: 回复 @仁轻 :壁纸不错,<三体-白山黑水西北高楼>: 回复 @爽爽1030 :有b站,<狍狍030>: 回复 @Ex脑洞放出 :medibang超喜欢！！从中发现颜色搭配也是蛮难的[允悲],<露从今夜白xs>: 回复 @一个坏芒果- :我知道呀！hhh,<一个坏芒果->: 回复 @露从今夜白xs :待我慢慢看 最喜欢这种[二哈],<矢车菊的生活美学>: 回复 @爽爽1030 :B站如今荒凉了，A站已亡，只剩C台,<嗑谁_谁好看>: 发你视频！！！复制链接下载视频！速度挺快的！,<五十俉>: 回复 @嗑谁_谁好看 :谢谢 就是这个[爱你],<嗑谁_谁好看>: 回复 @五十俉 :offtime,<梦想演僵尸->: 回复 @DWin :妈的 舒服！,<赵yang台超贵气>: 回复 @爽爽1030 :17年7月13日来考古表示b站很多日泰美剧资源都没了[拜拜][拜拜],<无味开水_>: 回复 @Twinkle_mmmm :所以我现在换了128gde,<kiss瑾兮>: 回复 @Xanguxw :时光相册，下了就没卸载过,<喵蹲在屋顶上>: 回复 @巧筱蒨兮 :不用啊！0.0，是“扫描全能王”，我上面打反了……图标是CS两个字母，有免费版的，我就是用的免费版，一样好用,<预备役的预备役--八一>: 回复 @DWin :求原图啊！！！,<预备役的预备役--八一>: 回复 @老什么来着 :艾玛大哥呀啊！我可算找着组织了！[泪]内存小的痛……受不了啊！,<troshine>: 有没有那种在手机上用的，打开之后可以在后台自己运行，可以在看外文的时候长按或者类似什么动作可以出现这个词的翻译的软件,<巧筱蒨兮>: 回复 @喵蹲在屋顶上 :请问全能扫描仪这个app要钱？我被扣了6元钱……,<巧筱蒨兮>: 回复 @喵蹲在屋顶上 :请问这个app要钱？我被扣了6元钱……,<呱瓜呱瓜呱呱>: 修图：photofox,<狮说欣语>: 有没有做公众号比较便利的app安利呢？,<南城0615>: 回复 @Taiwan-Cherry :百度云/微盘,<方块的孩子都很棒啊>: 没有安卓系列[失望],<遇見Better_Myself>: 回复 @古城月1 :my et 也算吧,<阿意纪>: @又想减肥的小鱼儿,<scorpioyulia>: 回复 @SHERO-LYR :好的谢谢啦,<秀儿2004>: 求安卓版的翻墙app,<SHERO-LYR>: 回复 @scorpioyulia :Airbnb超级好 世界各地各个价位随你挑[鼓掌],<我的心都是黄景瑜的>: 回复 @骚先队一道杠 :国新发布,<短身Ha>: 新买了个内存大的手机   才敢打开这评论,<子默Any>: 回复 @来一颗芒果呀 :有道,<吃肉肉好幸福>: @不知名用户5184349168576,<pink小麻豆>: B12[doge]]
cmzyk	互助帖：高中生来问一个问题，大学生来回答。 ​​​	[<Grace_Pls>: 回复 @karenhoooooo :做外贸吧，选对行业很赚的，我就是英语不好在一家比较差的外贸公司上班，工资比我大部分毕业的同学都高，生活的也还不错，之所以说公司差是因为环境与公司操作的不近人情，大公司与正规公司不会这样的。,<喜欢段奕宏>: 回复 @以郁着色 :谢谢[微风],<西瓜不打了>: 回复 @学隐 :都来我大土木吧,<以郁着色>: 回复 @喜欢段奕宏 :很容易，真的。一年之后你就知道了。,<以郁着色>: 回复 @ID很顺眼QAQ :你会受得了的。我当初也以为自己受不了。而且，现在很多大学公共浴室都有单人间。,<lintingting啊>: 回复 @琦玉fans :[笑cry][笑cry],<喜欢段奕宏>: 回复 @自由的枷锁 :哈哈,<成年少女邦邦jour>: 回复 @ID很顺眼QAQ :南方同学大一刚开始拿帘子挡住洗澡 而且不和认识的同学一起洗 虽然我也不知道是怎么个档法毕竟没和她一起洗过 但是大二她就适应了,<成年少女邦邦jour>: 回复 @风一样的乔恩 :看你能不能遇到合得来的人 以及城市好不好,<成年少女邦邦jour>: 回复 @小烊羔子 :但是大一一年一般都要上早操吧 六点多就要起床,<妙龄阿姨->: 回复 @学隐 :教师……没有异性！没有异性，等于没有恋爱[微笑],<你的蛋卷妹妹>: 回复 @琰黎 :你应该问会不会累死,<随便得叫一个>: 回复 @karenhoooooo :我当时也是不想重读 于是一条路走到现在，加油[加油] 努力提升自己的专业素质英专也是不错的，这个不是零起点的专业 刚入大学就有差距 类似于我这种基础不好的小渣渣 大一就经历各种挫败感[doge],<三月不知肉味_->: 回复 @冰淇淋_小彭友_清婉 :喜欢就学 饿死拉倒[太开心],<洋洋洋洋木子>: 回复 @小烊羔子 :只要胆子大 天天寒暑假[doge],<腰佩名刀秋水>: 回复 @赵忽明 :不客气。人大了，保持善良就好。,<薛定谔的西瓜皮>: 回复 @间桐肝二 :微博有毒 但已上瘾,<薛定谔的西瓜皮>: 回复 @浮图叔叔 :我大学吃了吃 就是睡觉,<薛定谔的西瓜皮>: 回复 @苦茶丶蓉儿 :两者都没做到,<薛定谔的西瓜皮>: 回复 @最後一次親吻时代 :后悔没耍男朋友[笑cry]一个也没有,<呦呦鹿鸣邪>: 回复 @朗达 :有的专业课作业还是比较多的，比如法律逻辑学，不过大部分课作业不多,<薛定谔的西瓜皮>: 回复 @xxxnyongtory111 :喜欢的。基本没坚持多久[笑cry],<薛定谔的西瓜皮>: 回复 @榛果奶绿不去冰 :对的。不存在的[笑cry],<呦呦鹿鸣邪>: 回复 @小烊羔子 :不违法违纪，没人管你的，想进步还是想堕落，是由自己选的,<薛定谔的西瓜皮>: 回复 @陆不争 :有时候 不知道喜欢什么[衰],<薛定谔的西瓜皮>: 回复 @小牛不拉車了 :玩也没玩好 学也没学好 我失败的大学,<薛定谔的西瓜皮>: 回复 @颖勋的微博 :是的 悠哉的日子过的久了 就怕改变了,<薛定谔的西瓜皮>: 回复 @楠莱北 :我确实不玩王者荣耀[摊手],<薛定谔的西瓜皮>: 回复 @琦玉fans :哈哈  我可是很认真的提问题,<薛定谔的西瓜皮>: 回复 @蓝汪叽叽 :哈哈哈哈  话是这么说但是四年大学已经结束了,<karenhoooooo>: 回复 @随便得叫一个 :哎我不想重读[泪]那就一条路走到黑吧[作揖],<karenhoooooo>: 回复 @番茄酱了个橙子 :[眼泪]谢谢你,<自由的枷锁>: 回复 @喜欢段奕宏 :想颓废还不容易？,<自由的枷锁>: 回复 @翎升 :学好一点是一方面，活泼点和老师打好关系是一方面,<自由的枷锁>: 回复 @朗达 :你听过大学生还留暑假作业的吗,<自由的枷锁>: 回复 @小烊羔子 :想太多，就问你一句听说过大学生还有假期作业的吗,<随便得叫一个>: 回复 @karenhoooooo :要是报错志愿 有重读的想法，抓紧去做千万别犹豫！！！来自一个即将大三的英专老学姐[拜拜][拜拜],<豫见陈员外>: 回复 @Huily-zZ :是的,<陋巴蒂>: 回复 @朗达 :读的英语专业 作业比高中少了一点而已 很忙的,<相与__>: 回复 @ZiNoeee :朋友啊[允悲],<huhuhddd>: 回复 @不能辜负的那份尊重 :收到请回复,<左懶雀>: 回复 @1223ceekay :多看書 選自己喜歡的課 從大一起就好好對待成績,<Best_YoMi>: 回复 @karenhoooooo :当老师挺不错的，大学的[doge],<Best_YoMi>: 回复 @翎升 :[doge][doge][doge][doge]挂科不存在的,<Y1T0ng是三次元的Sophia>: 回复 @朗达 :专业选的好，天天过的胜高考,<lieudemonia>: 回复 @乐善好施的王大官人 :装什么高中生,<番茄酱了个橙子>: 回复 @karenhoooooo :老师 外贸 翻译 编辑 跨镜电商 [费解],<番茄酱了个橙子>: 回复 @1223ceekay :多学技能 多锻炼自己,<karenhoooooo>: 回复 @芍橘 :谢谢师姐 初心不变真好[爱你],<黍球>: 回复 @学隐 :自己不喜欢学不进最坑人,<黍球>: 回复 @不能辜负的那份尊重 :啥？？？！！！！,<喜欢段奕宏>: 回复 @羊篙子 :好的[微风],<黍球>: 回复 @小烊羔子 :可以，你胆大的话可以睡一整天[笑cry],<臭-脾-酱>: 回复 @学隐 :金融,<芍橘>: 回复 @karenhoooooo :我也是英专毕业，最终职业和英语无关，考公务员或事业单位招英专的很少，但是内心还是最喜欢这个专业[心],<臭-脾-酱>: 回复 @乐善好施的王大官人 :你真的这么强的吗]
cmzyk	一个人说话声音好听，是不是超级加分？ ​​​	[<Twilight-尼尼>: 哈哈哈，是在说我吗[doge],<与风清沐>: 声控的我[二哈],<生活费儿>: 还好吧，女生说话都差不多～,<哈哈哈哈jiang>: 见面发现声音与颜值不匹配会噌噌地掉分,<Jason咖啡不加糖>: 回复 @李组忠 :扎铁了,<XD南坊>: 对于我来说，是的,<阿碎沾枕不想起>: ……然并卵依然团狗啊,<三体-白山黑水西北高楼>: 看不到脸的情况下是的,<叫爽爽>: 声音+颜值=完美,<梨樹_K>: 是的，但主要还是看脸[允悲],<是苦茶啊丶>: 别人说我电话里的声音超温柔，但现实生活里就是个母夜叉，什么鬼。我明明就很温柔的[害羞],<还想听你的故事-->: 是，可以忽略其他的那种！,<鹿小嘚瑟>: 是的，和他聊的语音都要收藏起来,<半屿疯兽>: 加。。。100分，满分10分hhhhh,<腐声腐色>: 声音好听，说什么都对[笑cry],<skyeeruan>: 看到脸的那一刻会不会减到负分[偷笑],<懒懒喃喃>: 说话不好听的严重减分,<C_rayon_兜兜飞>: 是是是  但是也看脸[脸红],<你们说气不气嘛>: 回复 @你们说气不气嘛 :哎呀，不小心答得走心了,<你们说气不气嘛>: 不是，还是看人品 颜值 才气 最重要的是感觉[机智],<折射率椭球v>: 为什么老有人说我声音好听[嘻嘻][嘻嘻],<indexfinger上的W>: 嗯。。。我主要还是看脸[允悲],<青芜堤上柳>: 对啊，超级喜欢说话好听的，还有手好看的,<Becky是大侠>: 没看见脸的时候 是的,<窗漏>: …我已经被声音苏得觉得伦桑超可爱了,<WANG_DAJI大幾>: 长的℃“#％”  那就直接倒扣了吧…,<-当--归->: emmmm如果颜实在非常不行。。声音再好也不行[允悲],<廊庑下的茹卿>: 是了，要不，我为啥沉迷网配圈[允悲][允悲][允悲],<陈翔老婆果啊果啊果>: 对对对没错没错没错没错我这种声控真的是,<传媒老跟班>: 回复 @SpongeSun :[笑而不语],<六加一小甲乙>: 加分，长得丑都可以忍一忍了,<卿不见如来>: 似的，比如班叔你,<Monshine-kkw>: 是，比如他 @王凯kkw,<cc是最棒的>: 取决于你先看到的是脸还是先听到的声音,<南柯非梦_Momo>: 可以参详满汉[坏笑],<李组忠>: 回复 @日语自学 :[并不简单]洞悉一切的眼神,<吃和睡hu>: 哈哈哈哈哈哈哈哈哈哈哈哈哈哈哈哈,<Geo-Young>: 长得好看是不是更加分,<无所不能的馨妹儿>: 超级超级，最好脸也好看,<爆炸头兄弟Horan>: 对对对对！！！！！！,<lannie亦轶>: 比如鞠婧祎，声音很脆，唱歌声线也很独特，还有吴亦凡，颜好声音棒,<软糖少女->: 怎样就是声音好听呢,<DecOdile>: 超级超级超级加分  哪怕长得不好看也没关系 只要声音好听,<日语自学>: 回复 @李组忠 :真相了...,<我的天完犊子了>: 我是声控！！！声音是唯一的加分项！！,<奔跑地布袋猫>: 所谓不能看的脸，指的是猥琐油腻相[喵喵]// @奔跑地布袋猫 ：声控表示，在脸不是完全不能看的情况下，近似电台主播的迷人嗓音可以➕101分,<-野生海豚>: 声控表示，声音比脸重要[doge] 长得再帅声音娘也很难接受[doge][doge],<SpongeSun>: 感觉说的是我[并不简单][并不简单][并不简单],<奔跑地布袋猫>: 声控表示，在脸不是完全不能看的情况下，近似电台主播的迷人嗓音可以➕101分,<动次大次胖次大次>: 声控简直难以抑制！！！[doge],<腻与酥>: 长得不好看直接减为负,<小鬼爱义达811->: 是的，我这儿快递小哥声音都很好听，所以我选择放商店自己去拿，不愿意见到人。,<一生俯首拜文儒>: 超级加分！但是据我了解声音好听的与颜值不成正比[二哈],<人就是要瘦啊>: 对，没见到脸的时候声音好听绝对的吸引]
cmzyk	互助帖：学生党来问一个问题，上班族来回答。 ​​​	[<大阳呀黑黑>: 回复 @cccharr :没有,<想吃西瓜的冬瓜>: 东北人，毕业三年，国企工作，有什么想问的可以交流下。,<部长不会玩>: 回复 @樱蓝 :经济自由,<温泉怪物>: 回复 @爱看动漫的猫咪 : 一心脱贫[二哈],<专抢肥包冰淇淋>: 回复 @娟娟白成反光板 :[失望],<浅海余风>: 冷门专业的研究生真的很不好就业吗？,<大王和超人叫我>: 回复 @梨落loli :想工作了[二哈],<大王和超人叫我>: 回复 @小球要早睡早起 :想工作[二哈],<罐头咩>: 回复 @不休的故事 :据我观察身边妈妈，家里人支持基本没有，正常公司不会拿这个为难你，当然前提是法定假➕灵活上下班工作量。也不能什么都不干总不来，但是对晋升有影响,<Schrodinger尨>: 回复 @春秋缘浅 :因为工作关系现在研究生更吃香,<半夜写东西的小编丶>: 哈尔滨人，普通二本学校的中文系男生，毕业两年，坐标杭州，你问我答，来吧。,<布衣大人是文娜>: 事业单位的朝九晚五适合年轻人吗？,<罐头咩>: 回复 @cccharr :没有了发胖速度惊人,<蒲公英_len>: 回复 @官上進 :问明白公司的员工守则和薪资,<莫挽韶光-Cynthia>: 有没有广告的大佬，能讲一讲这个专业或者这个职业吗？,<汪奕晨>: 世界财富去了哪儿？,<Krosmaster>: 工作后 个人自由会受限吗？？？,<罐头咩>: 回复 @樱蓝 :没有,<热爱工作的王老师>: 回复 @予我一粒梦 :研究生毕业，对现状满意并认为考研是非常正确的决定,<罐头咩>: 回复 @有钱人GAOM :有，我感觉男性比较多。每句话都很表气，透着抬高自己贬低别人的用心，哪怕不同部门没有竞争关系。还总装傻。该回击就怼回去。重要的事情留个证据。如果是竞争少工作量大的工作这类事少很多，大家都忙着工作，专注自己。,<王者农药吐槽专用号>: 回复 @夏夏夏小姐姐 :很好啊,<娟娟白成反光板>: 回复 @官上進 :关系，美貌，有钱等等,<娟娟白成反光板>: 回复 @专抢肥包冰淇淋 :没有,<娟娟白成反光板>: 回复 @RealFourier :会发现，上学和上班的对象一样难找,<风火狼烟山林>: 非美术专业的想考研到美术专业是不是特别难，该不该继续？,<爱泰勒的小猪>: 没有梦想怎么办...感觉自己像条咸鱼，看到那些有梦想又为之努力奋斗的人真的好羡慕,<小菜小蔡-You>: 工作是找自己感兴趣喜欢的比较重要还是找比较稳定赚钱的比较重要……,<专抢肥包冰淇淋>: 上班有上学好请假吗,<絮扬yexuyang>: 回复 @王者农药吐槽专用号 :因为花钱了[doge],<鬼魅如烟>: @想吃西瓜的冬瓜,<陈孝馨语>: 回复 @想喝巧克力牛奶 :在一个个社交中察言观色学会,<中岛嘉树>: 回复 @酷酷的大小王一起抽寂寞 :谢谢[爱你],<鬼魅如烟>: 回复 @Bolshevist :不容易，提升自己的各方面素质能力就容易找到优质的对象,<Sang桑->: 二本旅游管理专业三线城市 考研。,<夏夏夏小姐姐>: 回复 @小小是老幺啊 :在职教师在此，刚毕业就当老师[喵喵],<陈孝馨语>: 回复 @王者农药吐槽专用号 :只要你想，总能找到方法，不管是去健身房还是马路边还是家里,<鬼魅如烟>: 回复 @李一嘎的猴可西 :就是给了你假期你会闲的发慌，不如上班，充实,<夏夏夏小姐姐>: 回复 @王者农药吐槽专用号 :同事交心少，朋友很忙，所以大把时间来健身啊[污],<鬼魅如烟>: 回复 @手机用户993001155 :深圳的想说，有能力就来，没点硬技能和脑子就不要来深圳，深圳是个创业的城市。在深圳有个好处就是，社会节奏会把你推着进步，即使你不想看书，社会也会逼着你进步。,<仰光少女>: 上了社会 喜欢的男朋友是不是更难找了[眼泪],<SY99->: 回复 @鬼魅如烟 :[抱抱][抱抱],<拆了天策府来娶大庄主>: 回复 @苦茶丶蓉儿 :今天恰好遇到[污],<鬼魅如烟>: 回复 @天台溜号委员长 :一年四季都在上班,<小雨今天卖萌了吗>: 回复 @思美人的蠢汪 :找不到的，放弃吧,<奋斗的baby>: 回复 @廊庑下的茹卿 :很无聊，不能看书，不能拿手机，不能只坐着不动，而且还要提前半小时到[晕]，而且收完试卷还得再按要求整理试卷什么的，如果学校有绩效的话会给监考费，一般高中有，越重要的考试要求越多，比如高考，学业水平考试，公务员考试什么的。,<不觉暮山碧>: 回复 @王者农药吐槽专用号 :我说是双休 一个月最多修两天 大部分时间全国各地出差 你说什么时间健身 平时还都这么累,<杨花如雪雪如烟0>: 有没有文博类的研究生 毕业后就业怎么样,<原来-可以改名字>: 新闻学如何在学校的时候接触更多的工作机会,<郝千茜>: 大学学戏文的小哥哥姐姐现在在做什么工作,<张洪玮微博>: 回复 @有钱人GAOM :找个好公司很重要,<喜禾君>: 回复 @不休的故事 :基本没有，但是偶遇单位用人慌也比较麻烦,<杨花如雪雪如烟0>: 回复 @我女朋友是仙女 :匹配了也不会让你完全干本行,<喜禾君>: 回复 @阿蒙神的Tony任 :好找，如意的工作不好找,<喜禾君>: 回复 @予我一粒梦 :读书，别犹豫]
cmzyk	你所期望的另一半是什么样的？用三个词形容。 ​​​	[<冯莉85471>: 喜欢我   正能量    距离近 （好奢侈的三个要求）,<松尾芭蕉个芭拉>: 爱生活，善良，爱我,<Daisybears>: 责任感，体贴，上进心,<常晓娥c>: 有趣/活泼/稳重,<泥娃娃不爱哭->: 给我做饭，陪我说话，半夜起来陪我上厕所,<柠小萌Gyea哒O_o>: 温柔 不拖泥带水 独立,<Bobbie_Cheung>: 善良，有趣，聪明,<荔枝输了>: 理性 担当 倾听,<采姑娘的小仙女>: @我不愿再想   陈宇佳,<一八六的一六九>: 高大 幽默 踏实,<tian泪水>: 高圆圆、贾静雯、邱淑贞。,<刚七了八球嘣莎卡拉卡>: 善良，上进，责任感,<宫三熊>: 好看 好看 好看,<小心哒哒哒哒>: 彭于晏[doge],<红磡近黄铺>: 独立，阳光，正直,<酸瓜M>: 干净，干净，干净（从内到外，希望能看懂啊哈哈哈哈）,<胖葱z_z>: 温暖  洁癖 责任感,<Lucky_Angle_0>: 有钱 爱我 人品,<一片冰心在玉壶CXL>: 爱我 品质好 上进,<晚上当白天过>: 温柔，善良，聪慧,<Sophinan>: 王源，王俊凯，易烊千玺。,<Jason咖啡不加糖>: 等等...前几天不是都希望另一半高的..现在都注重内涵了[doge],<你笑起来很迷人XD>: 低调，奢华，有内涵[二哈],<有人叫我陈芝麻>: 不抽烟，不喝酒，不存在[猪头],<理想三旬挑了一个人的超级英雄>: 爱我，爱我，爱我,<绘瑬>: @斗鱼化粪池   关成，队长，二傻子,<一只分针在迷路的手表>: 安全感、懂我、不离不弃,<小兔子看月亮>: 宽容，开朗，有担当,<月球的糖包是咸的>: 人品 担当 上进心,<cheroooe>: 责任，善良，孝顺，果断的执行力,<阿卜逻>: 很有钱，很好看，很爱我,<JUICEJEN>: 思想兴趣在同一道上,<费利克斯葛朗台>: 孝顺 > 三观相似,<泡菜炖乜鱼>: 话不用太多 性格不用太急 尊老爱幼,<追水良木>: 太[允悲]难[允悲]了[允悲],<-manin->: 风趣  善良  我喜爱,<想要月亮也想要六便士的sliver>: @Sonkar_  是你就行了呗,<一只安肥猫>: 踏实，上进，孩子气,<我好-莉莉忒>: 回复 @我只是一只蓝胖子 :扶你,<bingo_hero2011>: 独立，独立，还是TMD独立,<yousaynothing>: 爱我 爱我 爱我,<嘀哩哩哩嘀哩哩哩嘀哩>: 智慧、责任、够man,<二月的肉妹cello>: 会笑，有安全感，会夸我,<年纪轻轻就一把壶子>: 是他的名字  但我不敢说,<OrangeLau身不在此>: 长泽雅美，新垣结衣，西尔莎·罗楠,<九十五坛酒>: 像她一样、像她一样、像她一样。,<赵忽明>: 勇敢，尊重别人，还有就是有才华喽,<钱小八OTZ>: 早点来，等太久，我很累,<三体-白山黑水西北高楼>: 幽默，睿智，上进？——不过，应该是不必设想了，应该会一个人过此生了。不曾有过男朋友以及女朋友，也很适应一个人的。,<墨迹法力无边>: 爱我 爱自己 温柔,<VolcanoMW>: 年上，博识，独立,<Hrvii>: 喜欢我，个儿高，倍儿有钱]
cmzyk	人物画：怎么在一个月内从零基础到入门？ 人物画：怎么在一个月内从零基础到入门 ​​​	[<南北-东西>: 用自动铅笔…线条好不了啊[允悲][允悲]…去买只铅笔吧……,<远山游Zzz>: @living_smiling,<二路旦>: 博主的线稿在我这个小白眼里都想学过的，太难了,<Hakunamatata-HeGe>: @cherry-p小p  觉得你有天赋，可以进一步陶冶情操,<一觉醒来瘦五斤>: 这时候，专业的人可能又会出来说教，素描才是基础。人家明明是兴趣，怎么喜欢怎么来,<不是柴猪>: 马住 上大学一定学🤞🏻  ,<隔墙问白头人->: @我爱吃鱼丽萨姐姐  [喵喵][喵喵]有空可以学啊,<婪亓>: @icecccccccccc,<整个大脑都是花园>: @你是什么病  是时候艾特你了,<逆鹬>: 这前面的理论都是 @颜澈  在知乎上答的吧,<ronalisa>: 这个好，存，以前爱在本上用签字笔随便画画，一直想学，但总没迈出这一步，现在先试试,<善见城_老杨>: @戳不破的o圈圈o,<永远都瘦不下来的我>: @Autobikeboi,<国产豚鼠>: 抱歉，我真的觉得素描是基础的基础，我一直是持这个观点的。基本的形都画不好，还谈什么（作者还觉得自己的线稿形是准的，我也无话可说）。我觉得这篇文的作者有严重误导的嫌疑，实在看不过眼，我多说了两句。我只是路过，觉得我说得不对的，你们无视我就好，别找我辩论，没空，谢谢。[拜拜],<燕大七>: 回复 @三文鱼我们走 :厉害了……其实我都学过,<賏賙>: 马一下。不知道什么时候才能看[允悲][允悲],<菲飞雨珠>: @有道云笔记收藏,<江北很遥远>: @Kimsyu1990,<xback金鳞岂昰池中物>: @杀手兴家的霸王龙  [嘻嘻],<传媒老跟班>: @影视行人   @独立鱼    @电影Mark    @咖电影   @纪录片之家,<菜小鱼呀>: @MrRhino123   每次都想起你的画[二哈],<传媒老跟班>: @电影的力量   @没有我找不到的电子书   @猫叔Mack]
