cmzyk	武汉有什么好吃的？有哪些值得一去的地方？ ​​​	[<zuicaide_>: 回复 @啊丢啊丢啊丢啊丢 :财大欢迎你～,<金碧辉煌金>: 回复 @视觉动物稀饭 :嗯嗯，还行吧[挖鼻],<视觉动物稀饭>: 回复 @摩根师傅 :热干面就是好吃啊[摊手],<啊丢啊丢啊丢啊丢>: 回复 @阿阿阿阿阿阿焦 :好呀好呀，就让我馋一馋，让我尽情的想念。,<假装我是一个西瓜>: 回复 @姿江阿噗 :猴哇猴哇[挤眼],<-盲音>: 回复 @乏水Joey :想吃炒酸奶了！,<乏水Joey>: 回复 @南湖一棵草_ :华农人的心酸哈哈哈哈,<MadC小蜉蝣>: 面面面哈哈哈。还有板栗很棒啊,<姿江阿噗>: 回复 @假装我是一个西瓜 :对阿 户部巷好像被diss了 咱们去万松园呀[坏笑][坏笑],<福福福福福福福祉>: @QS-XY   @小郭郭吾  哈哈哈哈哈,<假装我是一个西瓜>: 回复 @姿江阿噗 :他们说万松园好吃的多哇,<baylee0>: 马一个  大学四年慢慢看,<就算没有名字也要吃掉呀>: 回复 @摩根师傅 :对啊  最好吃的是热干面[笑cry],<来三只蟹黄汤包吧>: 正好在琢磨这个问题。好及时啊。[污],<史芥芥sky>: 武汉有一处奇葩私以为不容错过：古德寺。real good 寺[爱你][爱你][爱你][爱你] 大成丛林配上西式教堂建筑，人少好看有特色,<巴斯lier>: 每个大学几乎都有一条美食后街，全部美味又价廉,<LadyMadonna_>: 热干面和豆皮是真的好吃，晚上的长江大桥真的很美，这个月中旬去武大看的樱花，遇到的人都很好，对武汉充满好感[心],<碳烤腰花>: 粮道街街头吃到街尾还顺带去户部巷,<叮當了個和諧>: 回复 @齐濛 :感同身受,<西澨>: 不要去户部巷不要去户部巷不要去户部巷！,<齐濛>: 回复 @叮當了個和諧 :炒鸡难吃，还贵的要死,<豆一可>: 有机会可以看一场汉秀！！！,<豆一可>: 现在小龙虾上市了！！！,<易只花卷玨>: 豆皮！！！！！！！！热干面我觉得不咋地，但是可以尝试一下，武汉人别打我[大哭]其他没啥了……毕竟我就去了光谷，户部巷，黄鹤楼，还有那个大桥……,<阿阿阿阿阿阿焦>: 回复 @啊丢啊丢啊丢啊丢 :来财大第一年，有时候真不知道西苑有什么好吃的。到时候吃过给你反馈啊[二哈],<欢喜hby>: 感觉没有什么[摊手],<好贵的肉肉>: 去汉街，武汉天地，户部巷就别去了难吃还脏。,<啊丢啊丢啊丢啊丢>: 回复 @阿阿阿阿阿阿焦 :嘻嘻，你也能喜欢最好啦[嘻嘻][嘻嘻][嘻嘻],<阿阿阿阿阿阿焦>: 回复 @啊丢啊丢啊丢啊丢 :这几天都去尝尝[二哈],<阿阿阿阿阿阿焦>: 回复 @啊丢啊丢啊丢啊丢 :这么详细的回答[鼓掌],<闲人慢三>: @爱笑的丫丫68,<啊丢啊丢啊丢啊丢>: 回复 @乏水Joey :[耶][耶][耶][耶][耶],<啊丢啊丢啊丢啊丢>: 回复 @阿阿阿阿阿阿焦 :作为毕业1年的老人，有点跟不上西苑外面的变化。个人觉得每一家存在即合理，那么多挑剔的舌头会帮你筛选出留下来的。个人口味，回财大一定会去吃的是：西苑美食城最里面的襄阳牛肉面管的凉皮凉面、出门就能见到的热干面、热干面旁边的豆皮（只有早上有）、卤面（就是那个拐角那里），另外食堂都可以。,<妡七>: 哎呀，我就是武汉人呀，看看评论里还有什么好次的[喵喵],<南山秦剑>: 吉庆街拆迁了，怎么木有人介绍？,<也许明天就不酱油了>: 东湖，武大，江汉路或者汉街,<阿阿阿阿阿阿焦>: 回复 @里不知理 :在哪在哪,<叮當了個和諧>: 回复 @Jason咖啡不加糖 :楼上正解,<里不知理>: 别去光谷！！！尤其是周末！！简直釜山行,<里不知理>: 博物馆出来去东湖骑个车,<里不知理>: 回复 @阿阿阿阿阿阿焦 :校内的有家东北涮肉贼好吃！,<球少君>: 喜欢建筑的话，可以去古德寺逛一逛,<南湖一棵草_>: 回复 @乏水Joey :这两周星期二下午我都和同学骑单车去财大吃晚饭，吃点好的[doge]  http://t.cn/R6NIX99,<金碧辉煌金>: 千万别试热干面[挖鼻]真要吃了也要说还行，你说好吃他们还要继续带你吃，你说不好吃，他们还会带你去多几家尝试，反正他们觉得天下面条最好吃的是热干面[挖鼻],<金碧辉煌金>: 武汉除了虾子就是虾子[挖鼻]最高礼遇就是请你吃虾子[嘻嘻],<福馄球儿>: 汉街不错，户部巷不要去不要去不要去，汉口江滩也很可以的，光谷太堵太挤了不建议来，但光谷风情街的房子都挺好看的。这个时间去东湖磨山景区不会后悔！,<masijacoke161116>: 回复 @masijacoke161116 :昙华林…也别去 真的之前大一每次外地同学要我带去我都…去了之后她们都…,<masijacoke161116>: 值得去的东湖风景区吧 ，骑个车风景还是很好的 。从武大那边进顺便可以骑东湖绿道去汉街省博逛一下都是一条道。吃的 别去户部巷之流的骗外地人的，地道武汉人 万松园 蟹脚热干面 麻小，还有江汉路差不多够了。还有千万别去光谷，不好玩也堵成狗。,<真是个宝崽>: 回复 @乏水Joey :哈哈哈哈哈哈哈哈！很骄傲了！,<乏水Joey>: 回复 @啊丢啊丢啊丢啊丢 :啊呀！ @真是个宝崽   @-盲音   @南湖一棵草_  大家！,<Doublecj>: 路线一 黄鹤楼-户部巷-长江大桥-晴川阁-龟山-古琴台 户部巷的吃的 实在嘴馋 就吃一点 反正正宗的都不在里面 路线二 武昌江滩-轮渡-江汉路武汉关 步行街-沿着天津路-进黄陂路 老租界-汉口江滩-长江二桥-古德寺 路线三 武大-楚河汉街-东湖-植物园-磨山-樱园-东湖绿道骑车-落雁岛 路线四 你打算待几天？,<橙墨-sht>: 先来两盒周黑鸭 [馋嘴],<与在可>: @WiNnie-ZJn,<略略咧>: 光谷美食城有一家猪蹄 然后意大利风情街那边的臭豆腐 周黑鸭 热干面 昙花林感受感受有糖[笑cry],<Esther_Yukie>: @Cigarshalashala  [馋嘴],<阿阿阿阿阿阿焦>: 回复 @啊丢啊丢啊丢啊丢 :你跟我说说哪家好吃,<Jason咖啡不加糖>: 回复 @你说你484洒 :噢噢，谢谢....前两天还想去武汉来着，结果没票了。]
cmzyk	法律之内，应有天理人情在。（安提戈捏） ​​​	[<故事里的事DD>: 回复 @懒癌深度患者8146号 :别理他神经病，被捅死的那个人还撞死了一个14岁女孩，不知道楼上那货怎么看的新闻,<小熊维尼和钢铁侠>: 早先一说到舆论审判，就因为干预司法而饱受诟病，现在众口悠悠，却成了挽留正义的希望所在。 这些社会意识就像个生物链，主要强调的不是适者生存，而是相互存在。,<桐人君vip>: 说得好，法律本来就是为社会稳定大众利益服务的,<多重功能>: 法律如果不能做到惩恶扬善，而是走到伦理道德的对立面，那么法律还有什么威严可言。,<雙木人2014>: 回复 @懒癌深度患者8146号 :那你这就是没看过完整报道咯,<小时了了8146>: 回复 @雙木人2014 :你是骂谁啊，他被判无期了好吧[笑cry],<天外飞来六眼鱼>: 应该让天理人情包涵在法律中,<雙木人2014>: 回复 @懒癌深度患者8146号 :看完整新闻你就知道意思了,<小时了了8146>: 回复 @雙木人2014 :你这是？？？,<雙木人2014>: 此人不死天理不容。身犯命案，如今依旧逍遥法外，胡作非为。无法无天，此人必死！坏蛋不死，天理不容！！！ ​​​,<摇椅上躺着喝月光的超人>: @差不多是个废点了,<我和成都都不跑>: [微笑][微笑][微笑]想起原案我就无话可说[微笑][微笑][微笑][微笑][微笑][微笑][微笑][微笑][微笑][微笑]]
cmzyk	安利20个神器。 ​​​	[<--DIMOND-->: 回复 @无呆毛不成活 :马上试试！,<懒癌患者阿唯>: @飞在糖矿的小竹苏,<LOL队友坑>: 回复 @无呆毛不成活 :小米5的悬浮球感觉很好了,<秦易声>: 就喜欢这么简洁明了的介绍[爱你],<葛劣绅>: @元气小奈音丶  图好快,<四分之二的欢喜>: potplayer简直是神器，最好用，没有之一。,<磨牙大王>: 回复 @可爱英俊帅气的灯泡 :[哆啦A梦吃惊],<向全世界安利馬天宇>: 回复 @懒懒是你啊 :这是啥，我网络不好一直打不开[笑cry][笑cry][笑cry],<MyiiiiiiC>: @有道云笔记收藏,<可爱英俊帅气的灯泡>: @磨牙大王   @Gigi今天進度是9032,<手机用户18xyyyyzzzz>: 马，另外安利一个安卓快捷键app，fooView。根据手势快速返回，回到主页，下拉菜单，主要是可以减少home键使用频率。另外可以选定内容进行截图，并自动分析图片上的文字，可进行拷贝，还可以直接选定文本内容通过内置浏览器进行搜索，并且还有文件管理功能（虽然我不常用就是了）。功能十分强大，安利～,<KarryMewww>: OCR那个安卓版不好用  PDF那个确实便携 不过因为喜欢做笔记，还是喜欢adobe吧,<Turing2017>: 别怪我没提醒你 @秘密革命命个名真难  ,<罗志刚同学>: workflow呢,<御清喝可乐>: 值得马，有几个在用，超好用！！,<乔麦NING--->: @有道云笔记收藏,<大叔的擎天柱>: @有道云笔记收藏,<carry生活的诺诺酱>: 确实小巧精致// @猫叔Mack : 转发微博,<Stella颂>: @小怪兽版奥特曼,<东尼菌的想法>: @有道云笔记收藏,<夜游侠客车>:   @有道云笔记收藏,<WastonHsu>: @有道云笔记收藏,<我啊_我_>: 记得之前推荐过一个可以下载任何在线视频的软件[可怜]但是找不到了,<套指>: 一个没听过，求用过的介绍介绍，,<懒懒是你啊>: @向全世界安利馬天宇  来,<传媒老跟班>: @猫叔Mack   @学术大观察   @阑夕    @英国院校那些事,<传媒老跟班>: @电影行人   @电影书生    @纪录片之家   @名曰老饕    @马克影记    @电影Mark   @咖电影]
cmzyk	日语学习网站整理 日语学习网站整理 ​​​	[<不见归处>: @有道云笔记收藏,<Zerrian>: 回复 @土耳其狮王 :哇感人,<李宫羽>: @BouKUji,<妒过m>: @一杯青柠气泡水,<戴高乐_>: 回复 @努力努力更努力alo :[耶][耶],<等待撒冷王>: 回复 @戴高乐_ :嘿嘿，谢谢圈我[太开心][太开心][太开心],<戴高乐_>: @努力努力更努力alo,<妖怪通通闪一边-别阻挡老衲取经>: @萌_Simone,<HXP2017>: @有道云笔记收藏,<土耳其狮王>: @Zerrian  hhh,<AMLIpeachy>: @啊波呲的额佛哥,<野孩子猪小薰>: 回复 @quentinlou :一看网站更不想学了,<姜敷>: @施主看过来   @囧冏冋冂__   @杀死少女心_biu  马了不看系列,<一方是学霸>: 回复 @望夏- :不用 @我了 ，谢谢,<Hypnoticherb>: @HighwayPony,<宗宗宗宗林>: @黑夜不嗜睡白天睡的香,<NewOab>: @punk1bunny,<夏日百忧解>: 回复 @Sin客 :爱你[爱心],<八戒日语>: 强迫症表示好像帮忙补充[偷笑],<时六二二>: 回复 @邓超人附体克里斯 :爱你,<独静加->: 回复 @znmiye :[喵喵]坐好的了！,<亦所唯一>: 练英语口语的有吗,<清蒸小幺鸡>: @间歇性热血青年,<传媒老跟班>: @日语自学   @学术大观察   @英国院校那些事,<传媒老跟班>: 回复 @诗人的浪猫_XLS :搜一下  发过了,<黄先森-yellow>: @yr_blueblue,<邓超人附体克里斯>: @许珂Esther,<Debbieran>: 回复 @黄恩菲的sinB :马稳了 谢宝贝[doge],<黄恩菲的sinB>: @Debbieran]
cmzyk	这真的是好东西！ ​​​	[<一步一步飞向天空>: 现在还是win7[笑cry][笑cry][笑cry],<ADSafe净网大师>: 回复 @pp她说我是阳光宅男 :目前支持PC和安卓,<pp她说我是阳光宅男>: 回复 @ADSafe净网大师 :是手机软件还是电脑的？,<五羊五个样儿>: 回复 @ADSafe净网大师 :m一个,<ADSafe净网大师>: 好像看到了我的名字[doge] 无广告看视频   @ADSafe净网大师  来报道,<-不足为外人道也>: 回复 @DJQ_djq :不是啊 不是这些软件  就是更新系统啊 他老提醒 我还不敢弄 电脑还可慢,<DJQ_djq>: 回复 @南山不南北海不北- :你要虚拟程序没用吧,<艺想天开天不开>: @ADSafe净网大师  ADSafe是个好东西，看视频没广告的[二哈],<兔子不是姑娘>: 回复 @白色晃晃悠悠 :应该是不需要那么麻烦的再去找应用了吧 直接互换就行 目前我是没用过,<Cyou柚>: surface里可以用吗？,<袋鼠之灵>: 强推sublime！,<Cyou柚>: 正愁微软商店里没好app，收！,<白色晃晃悠悠>: 回复 @兔子不是姑娘 :我的意思是——这是必要的吗？,<兔子不是姑娘>: 回复 @白色晃晃悠悠 :就是有点像手机的多屏互动 可以同时开好几个桌面,<白色晃晃悠悠>: 敲代码跟放音乐需要开两个桌面吗 谁给我科普一下 确实不懂,<既醉阿刀>: workflowy  有网页版也有谷歌扩展插件，也有颜色标签插件。 中文有替代网页  幕布  可以变为思维导图。,<轮子主席>: 我用的是思维导图,<伊人再无>: 回复 @传媒老跟班 :谢谢了。[羞嗒嗒],<说改名就改名宇宙无敌炒鸡美少女>: 呃 虽然我是win10 but上面这个图看不懂啊[笑cry],<传媒老跟班>: 回复 @伊人再无 :参考： http://t.cn/RiBZoPt,<Jason咖啡不加糖>: 回复 @传媒老跟班 :好的谢谢叔,<传媒老跟班>: 回复 @Jason咖啡不加糖 :应用都可以,<末日焚书>: 回复 @传媒老跟班 :好东西，谢谢,<伊人再无>: 有mac的吗[二哈],<Jason咖啡不加糖>: 我是win7的...,<我叫阿阿阿阿怪>: @有道云笔记收藏,<传媒老跟班>: 回复 @末日焚书 :WorkFlowy,<川也不言>: 马克收藏[亲亲]下次再汇总个mac的,<末日焚书>: 这是什么APP做的树形结构？]
cmzyk	最全整理 │ 国内外建筑类公开课 最全整理 │ 国内外建筑类公开课 ​​​	[<坏坏的希>: 建筑类公开课【感觉可以看一年[笑cry]..,<不愿意透露姓名的热心网友>: 回复 @情动于中而言不能形 :[心],<西决ANX>: @Shuang耿,<拖延症也是一种病啊>: 回复 @权先森的向日葵 :抱抱(｡･ω･｡)ﾉ♡,<满可爱的双城记>: @喜欢王筱婕的人会发光  [doge][doge][doge],<圆圆方_y>: 回复 @考神附体刘树树 :么么,<戴斯麦头>: 谢谢分享  @我的印象笔记,<权先森的向日葵>: @拖延症也是一种病啊,<榴莲糖菠萝包>: 默默圈一下雨心[污] @雷雨心AdoKenTorothy,<情动于中而言不能形>: @不愿意透露姓名的热心网友,<Evelyn_RR>: @CHEWSSY_失控疯犬,<青海玉树格桑花开>: // @名曰老饕 : 转需~,<IiiioLoiiiI>: @这里是力气琳-w-,<发现自己做不了Diva>: 回复 @霸气噢亲爱的提奥 :哈哈哈哈哈,<JulyAprilJanurary>: @黑夜白天不分君  这配图是你做的吗？,<dreaming-mydreams>: 好想看法律的[污],<燕尚寒_煞染轻眉>: @有道云笔记收藏,<张玄八>: 回复 @左耳东三旬 :get！,<---Hssyy0>: @Ronnie33333,<英国院校那些事>: 国内外建筑类公开课整理大全[给力] #英国留学早知道#  ,<马克影视记>: 国内外建筑类公开课,<传媒老跟班>: @猫叔Mack     @电影书生    @纪录片之家   @名曰老饕    @马克影记    @电影Mark   @咖电影  适转,<传媒老跟班>: @学术大观察   @英国院校那些事   @电影怪客   @万事风过耳  适转,<霸气与亲爱的提奥>: @发现自己做不了Diva]
cmzyk	万万没想到。[喵喵] ​​​	[<俏爷Ciao>: 回复 @妙妙妙不可言hm :我决定明天开始去蹭课,<妙妙妙不可言hm>: 回复 @小睡星期九 :你足不出户，少女心没用,<俏爷Ciao>: @妙妙妙不可言hm  戳中了我的少女心,<粉红的二狗叽>: @神奇的咕噜噜  [喵喵],<奶酪山药>: 回复 @AutumnLeo- :青椒你好[太开心],<花田花花先生>: 回复 @传媒老跟班 :食堂阿姨吗[眼泪][眼泪],<只想换个昵称的Double文>: 说好的一段故事呢[笑cry],<吃够了再减肥>: 按照言情小说的套路，接下来有段故事要发生啊，这就断了不科学。,<森田君快到怀里来>: 回复 @hvfsksgsffsu :哈哈哈哈哈哈哈哈哈万万没想到,<胖熊就是我>: 回复 @-阿宝-阿宝- :隔着屏幕都能感觉到尴尬,<-西瓜红豆>: 我们金融老师长的就特嫩！三十六七的人长的跟研究生似的，关键还帅！就是穿的衣服暴露了他真正年龄，不过我们都认为是师母故意这么打扮他的，毕竟这样穿都能每年收获一批迷妹🙄,<疯子的乱语>: 还不赶紧开始一段荡气回肠的师生恋？,<青绿黄橙>: @小沉沉Erichen,<捻尘画良薄>: 我还以为最后两人在一起呢[二哈],<新故纸堆>: 告诉我们，不要轻易和陌生人说话,<传媒老跟班>: 回复 @AutumnLeo- :同学  五食堂怎么走[嘻嘻],<方野书>: 哈哈哈哈哈哈哈哈嗝,<你好沒趣阿>: @ZinsserFFFFFFF-,<嘘__秘_密>: 你我本无缘，全靠我来替别人上课而你是老师[大笑],<大连万哥>: [doge][doge][doge],<AutumnLeo->: 对啊  我一个32的老师长得非常年轻  经常被问同学  某某教室怎么走,<阿如-SUMMER>: [喵喵]图片评论  http://t.cn/Ri0GQix,<数学教师高望祖>: [哈哈][哈哈][哈哈],<___未知的世界>: @樂稵稵  哈哈哈哈哈,<Forty-fivePercent>: 回复 @格子Sayid :我们31岁已婚已育的老师，长得刚毕业的样子,<吾名甚干卿何事>: 我就遇见过长得超嫩的老师，我们同学超爱逗他。,<前尘梦影交迭1113Vae>: 然后。。。在一起了？？,<阿波罗不在天上>: [笑cry]思いもしなかった,<小老道道老小>: 这应该是老年大学之日常[二哈][二哈][二哈],<这是你呀>: [二哈] @_小綠野中鹿,<亦所唯一>: 回复 @格子Sayid :研究生留校任教的很多啊,<木鱼敲的第七秒>: @杰伴的小鹿   看评论,<我姓管不性感>: @没有谜底的谜语  [二哈]老师得有多年轻啊，你遇到过没[微笑],<hvfsksgsffsu>: @森田君快到怀里来,<小鑫要变强>: 为啥我脑补出了一篇小说[眼泪],<SuXuan素宣>: 这个设定好带感啊,<筝心有梦在朝阳>: 回复 @提灯执伞与君酌 :哈哈哈 老师好年轻,<一拙夫子>: [哈哈][哈哈][哈哈][哈哈][哈哈][哈哈][哈哈],<一顿早饭八个奶黄包>: @筝心有梦在朝阳,<瞰川er>: @平生相见即眉开__  哈哈哈哈,<青年晚報2046>: 为啥我看到开头就猜到结局了？,<-阿宝-阿宝->: @emerpuS92   @江湖小骆驼,<希茜J>: @JJQ_Peter  ………,<陈宗鹤先生>: 别走啊！说好一起撸串的呢？,<格子eric>: 这老师长得多嫩呀,<树妖右木>: 话不能太多啊哈哈哈[哈哈],<一只柠檬凡>: 图片评论  http://t.cn/Ri04PA8]
cmzyk	如何做出高质量的毕业答辩PPT 如何做出高质量的毕业答辩PPT ​​​	[<mobiwosi>: @有道云笔记收藏,<杭州高福英女士>: @吃完晚饭吃夜宵,<mmmmymay>: 回复 @zzzzz_y1 :需要！收啦啦啦[羞嗒嗒][羞嗒嗒],<好狗123>: @保存到为知笔记,<喵了个喵喵喵喵喵咪>: @有道云笔记收藏,<zzzzz_y1>: @mmmmymay  需要吗,<某只果达_只喜欢金泰妍>: @孤单又灿烂的婷-考研狗,<请叫我炫迈刷屏帝>: 回复 @阿珊珊珊s :[好爱哦],<窝心NN>: 简直了，正好是我需要的,<阿珊珊珊s>: 回复 @请叫我炫迈刷屏帝 :遵命[太开心][太开心],<不折言>: @保存到为知笔记,<娱乐圈扒阿哥>: 同学们:该写论文了[哈哈],<Mister长颈鹿>: @Adagio的嘻嘻酱,<_毋小黟_>: @JesseFantasticWannaDorisBaby,<Mr-Chopin>: @有道云笔记收藏,<请叫我炫迈刷屏帝>: @阿珊珊珊s  收好，以备不时之需[心],<FinnRan>: @有道云笔记收藏,<沓莓拟>: @闽院13级资环1班,<瘫痪老威o_O>: @有道云笔记收藏,<哥被猪亲过>: @Loveonlybyme,<红尘一捧>: @Jenningf  [馋嘴][馋嘴][馋嘴],<布瓜小天真>: @bu-bu-gua]
cmzyk	这是一条关于Photoshop资源汇总的微博。 ​​​	[<一个废渣渣>: @小怪兽没有照相机,<初心不变的爱恋>: @亲爱的人是你啊,<就叫khilaf>: @全微博最美的博主,<希尔今>: 回复 @传媒老跟班 :转,<一热心网友呀>: @独得试卷恩宠呢   @马云云_理想青年  mark ,<云城Darwin>: @西北偏北与此间少年,<abigale--zm>: @waldeinsamkeit-lf,<小胡同狗>: @棉花棉花你不开花,<天下第一可爱美少女>: @行动上的巨人夜华,<盐汽水Stiens>: @EZAILBIE,<染初如故>: @康培是个怪阿姨,<青shu柠檬>: @有道云笔记收藏  ,<善于等候CX>: @扶桑树下的两只鱼,<vampares>: @管管不不不不不不吭,<DolphinSonya>: @有道云笔记收藏,<相思树下赋相思>: 一个学了这么多年还没学会的软件[笑cry][摊手],<亦峯-l>: @Pantyeit,<DolphinSonya>: @有道云笔记收藏,<Khun曹阿蛮>: 这次必须得马住！！！,<为Jay翘课的那一天>: @名字都被占用了我不开心,<哎呦妹妹->: @Allen许文峰,<快来削我_cry>: @newgreenz,<伍一零二>: 回复 @传媒老跟班 :这个已失效,<希崽呀>: @情商低的吴天宇,<_Sonniggg>: 回复 @eliscdev :你觉得我会不会看[二哈],<Eliscdev>: 回复 @w哼唧兽w :我有本书你要不要。给你寄来[二哈],<_Sonniggg>: 回复 @eliscdev :嗯哼…反正…瞎jb搞哈哈哈哈哈,<Eliscdev>: 回复 @w哼唧兽w :嘻嘻。你也可以看下哟,<盐小姐_>: 回复 @我也要鱼丸粗面啊 :已收藏,<戻渊_>: @KnightKMo,<TsingWing>: @Godfreyus,<小萝卜的大叔>: 回复 @xlwhite- :超有用 我收藏了 谢谢[心],<小肉爪-->: @-头上长犄角-,<_Kt_KiraLight_Est>: @_SingtoYou_Milk_Est  [眼泪][眼泪][眼泪],<桃子的路上一道辙>: @sweeeeetlight,<绛曳>: 回复 @Auxie丶 :么么哒～爱你*＾3＾）/～☆,<DreamyAshlammm>: @Lamchung,<KillmeorKissme>: @CCYYHHHK,<cjwdxdp>: 回复 @我还要一个人走很长很长的路_ :咦，很可以[good][good],<张Ronnng>: @K-fall_,<薛定谔的猫是我养的>: @茄子煲烧  看这个～,<小墩儿Zz>: @小墩家的胖仙女,<muvinging>: 回复 @王胖肥fei :快回我微信！,<王胖胖肥>: 回复 @muvinging :回的真快！,<muvinging>: 回复 @王胖肥fei :么么哒,<传媒老跟班>: 18招Photoshop小技巧： http://weibo.com/5198011111/CAf7Yatst,<传媒老跟班>: 颜色配色大全 http://weibo.com/1872762823/Cr7hy1NmS,<传媒老跟班>: CS3—CC各版本集合 http://weibo.com/1872762823/D4jFmrOYK,<传媒老跟班>: 1500款photoshop#背景填充图案设计素材集合 http://weibo.com/1872762823/De88awF1D,<传媒老跟班>: 设计排版格式参考集合 http://weibo.com/1872762823/Ee94VDD8w,<传媒老跟班>: ps字体大全： http://weibo.com/5888006271/E4iDZ3KeO]
cmzyk	如何在短时间内做出一份高质量的PPT 如何在短时间内做出一份高质量的PPT ​​​	[<屾渐叁>: 30%的那个图是不是有点问题。。一行的话是33.3% ，，。你30%却一行还多一个人,<英国院校那些事>: 如何在短时间内做出一份高质量的PPT[给力],<-栖迟汉子y>: 看完这个文章的时间我就把PPT做完啦[二哈],<光光光光光biu>: @有道云笔记收藏,<Crystalllllll>: 这种高大上又简洁的模板哪里找啊,<Jadelin9>: @鄭CookieBaby,<Unsung团队>: // @电影书生 : 转发微博,<l_i__>: @有道云笔记收藏,<清透的蓝天白云>: 有用哦，看完做PPT有点灵感喽,<传媒老跟班>: @学术大观察   @英国院校那些事   @电影怪客   @万事风过耳,<传媒老跟班>: @猫叔Mack     @电影书生    @纪录片之家   @名曰老饕    @马克影记    @电影Mark   @咖电影]
cmzyk	六大类常用的专业搜索工具！ 六大类常用的专业搜索工具 ​​​	[<北大新媒体>: 工欲善其事，必先掌握工具。转需。,<做个好好少年>: 回复 @永远大胆 :呦呦呦 这个可以！,<小白性>: @named_Y,<啸陀螺>: 收藏癖又犯了[笑cry],<seeu桔梗>: @有道云笔记收藏,<风中多转蓬>: @保存到为知笔记,<Jeno-Larzzi-Ernie>: 互联网生存指南初级版,<阿宁姑娘呀>: @DdddddreamItpossible,<陳冬OK>: @我的有道云笔记,<兔皮皮>: 第一个鸠摩就很扯淡！——经常上不去不说，实际上搜索的东西太有限了！,<造尬者的否楼儿>: @有道云笔记收藏,<郁郁葱葱的小草>: // @同声翻译樱桃羊 : // @黎斌swjtu :[good] // @师建胜 :六大类常用的专业搜索工具。// @PKUCATer : 转发微博,<WwwwYX__>: 回复 @西西morning-glory :好[爱你][爱你],<陈殳丶>: @有道云笔记收藏,<303跳转404>: 能做成浏览器书签的格式就好了,<我的猪跑哪了>: @Arms  mark,<西西morning-glory>: @WwwwYX__  看第五个职位搜索,<深蓝中的涌动>: [赞][赞][赞],<远行客_沧海>: @保存到为知笔记,<红豆粥不加冰>: 还是有好多网页挂了。。。[摊手][摊手][摊手],<Bio2versity>: @保存到为知笔记,<清林川木>: @有道云笔记收藏,<大长颈->: @厄齐尔前世女友,<英国院校那些事>: [话筒]六大类常用的专业搜索工具！  #英国留学早知道#,<赵五道>: @保存到为知笔记,<坐在后排的牙牙>: [doge][doge][doge],<路橃>: @我的印象笔记  ,<衍顾酱>: [舔屏][舔屏][舔屏],<三花玳瑁猫>: 如果BOOKZZ和Library Genesis上都没有你要的英文教材，要么此书没有电子版，要么作者还没有写。就是这么大写的牛逼！,<双龙会会>: 即使你把引擎清单整理成这样，终究他们还是会嫌麻烦。相比之下，太多去贴吧发个跪求就是终极大招。现在已经很少网民懂得自己大海捞针的乐趣。从小就不被鼓励甚至不允许思考的社会，注定如此。]
cmzyk	手机不用来这样学英语，太浪费了！ 手机不用来这样学英语，太浪费了 ​​​	[<asdvyyfdwxcbjiincserhvseth>: @保存到为知笔记,<落子歌>: @如是采薇Cool  看起来还挺有道理的，赶紧试试,<心心星星鑫鑫丶>: @颂颂颂颂颂颂颂,<传媒老跟班>: @北大新媒体   @英国院校那些事   @日语自学   @翻译硕士   @学术大观察]
