cmzyk	留下一个你最想去的城市，在这个城市或去过这个城市的朋友们可以介绍下！ ​​​	[<闲来闲往_>: 黑河 今天冬天就去,<爱看红楼梦的工藤柯南>: 上海  （因为张爱玲,<暮雪await晴雨>: 上海，最想去[抱抱],<lichacha->: 回复 @直男之光李晓阳阳仔 :是的，上个周回去了一趟硬是舍不得走[可怜],<lichacha->: 回复 @奋金龟大战犬次郎 :毕业了来到杭州[允悲]现在好想回去呀,<咚咚学习网>: 回复 @ZHANG-XO :好 谢谢谢谢,<咚咚学习网>: 回复 @不知是痴 :好[鼓掌][鼓掌],<咚咚学习网>: 回复 @YANGRX1 :好的 谢谢啦,<洁克船长黑>: 回复 @徐公子本人 :新疆建议夏天有长假期的时候来 玩的景点可以更多，第一次来必去喀纳斯 那拉提大草原 吐鲁番火焰山（这几个玩下来差不多十天半个月）；第一次来必吃 大盘鸡 正宗烤肉 手抓饭 椒麻鸡 瓜果（ps：夏天来瓜果倍儿甜 价钱倍儿便宜）[哆啦A梦花心],<SJ是朵盛世奇葩>: 成都 上海 重庆 大理,<小唐半仙>: 回复 @舒克恒 :磁器口，解放碑应该是必去了，晚上可以去江边逛一逛，吹吹风[doge],<BiuBiu要去Manhatta_Bridge>: 回复 @pamperr :去赤岗,<BiuBiu要去Manhatta_Bridge>: 回复 @CCCC_YaLan :去兵马俑坐公交车 不要坐私家车！去兵马俑坐公交车 不要坐私家车！去兵马俑坐公交车 不要坐私家车！,<Emily要很努力>: 我想去凤凰古城。。,<Emily要很努力>: 回复 @Meyeriiii :雨后的空气特别好。,<大口ci飯的米_Tuan>: 回复 @猫侣v :鼓浪屿就是个商业化的岛,<茨宝宝>: 回复 @舒克恒 :重庆的路太奇葩了，高架桥左右转3条道,<花妃朕要晋你做皇后yu>: 回复 @小絮聒 :昌里路美食一条街，可以的话晚上去夜市很热闹哦，虽然大多是路边摊，但是有时偏偏越是苍蝇小馆的东西越好吃啊[允悲],<Niko_NPC>: 成都，七月底就去了,<skjtmaje>: 我就看看有没有人想来洛阳,<Devil_綺麗>: 厦门，澳门，香港,<奶昔鸡尾酒>: 回复 @舒克恒 :钵钵鸡好呲~~,<____when>: 回复 @Danny_Zhong_ :因为最近刚刚看过电影《托斯卡纳艳阳下》，觉得很美丽，希望自己也有女主那番勇敢，自由随性，去到一个陌生的国家，城市，生活下去,<一个新闻小学生>: 回复 @就请别送我 :多谢,<荔枝输了>: 回复 @琼壶旧梦 :太谢谢你啦[太开心][太开心][太开心]暑假结束的一定要去[微风],<头顶的蓝天>: 回复 @哭包准备放弃她的老本行 :[哈哈][哈哈][哈哈][贊][贊][贊],<芜凛RE>: 回复 @pamperr :真的没什么特别好玩儿的 但是贼好吃,<琼壶旧梦>: 回复 @荔枝输了 :然后是四校门齐东路那边有一家羊肉馆，可惜以前的老青岛关门了，现在大家撸串差不多都会去那，你还可以去附近的菜市场挑点活海鲜去让老板加工～这些比较隐秘，其他的吃的就可以大众点评啦,<琼壶旧梦>: 回复 @荔枝输了 :推荐点吃的给你嘻嘻，海大鱼山校区一校门附近华春饭店，铁板蛋豆腐土豆烧牛腩每次必点，但是很火喔我们每次都会提前去等位。其实想逛老城区就可以在这附近逛，二校门那边是大学路各种的咖啡店，有一家松果甜品挺好吃的，还有老舍故居往里走有小皮酒店，岭南排骨也超棒,<就请别送我>: 回复 @一个新闻小学生 :选个好天气，空气质量好的那种，去爬紫金山，走主道上去非常方便，山顶可以俯瞰南京，蛮不错的。中山陵反正暑假肯定全是人热的要死，排队两小时参观两分钟，推荐去美龄宫，还有颐和路公馆，都是历史建筑，风格不错。南京大学鼓楼校区以及附近推荐去，上海路，珠江路全是好吃的。,<荔枝输了>: 回复 @七厂崂啤 :谢谢你哟，🤗🤗🤗,<荔枝输了>: 回复 @AHnTInG :好[心],<荔枝输了>: 回复 @LYdia-Li- :嗯嗯[羞嗒嗒],<荔枝输了>: 回复 @你这个没有理想的笨蛋 :谢谢了[doge],<就请别送我>: 回复 @一个新闻小学生 :一定要去南京博物院！是院不是馆。刷身份证就可以进不用门票，但是真的很不错，民国馆特展馆还有历史馆，对我来说待一整天都行。就是里面吃的东西一般般还挺贵的。民国馆还可以喝茶听戏，这个不错。,<Jason咖啡不加糖>: 回复 @芜凛RE :八月还是比较热的...,<deersouth>: 回复 @Mr_Fribble :我没有啊…但是真的蛮想去的 另外两个地方也是,<Mr_Fribble>: 回复 @deersouth :你去过吗,<deersouth>: 回复 @Mr_Fribble :对的 没错 就是一个童话小镇 真的太美了,<哭包准备放弃她的老本行>: 回复 @头顶的蓝天 :就是敲喜欢看多久都看不够的意思～,<哭包准备放弃她的老本行>: 回复 @橙子一颗大 :谢谢！广州也很好吃喔嘻嘻嘻[太开心],<你这个没有理想的笨蛋>: 回复 @荔枝输了 :一个正在青岛毕业旅行的毕业狗，强推。看三天海也是值得的[doge],<深青里绘>: 回复 @芜凛RE :杭州欢迎你[鼓掌],<巴蜀小妖2017>: 南京，北京，纽约,<马茹blingbling>: 每个地方都很不错 同志们7.8月适合去哪~求[可怜],<甜瘾少女_>: 回复 @半屿疯兽 :好的,<入淮清洛漫清欢>: 西安有啥好玩的？,<-陈欣宇>: 回复 @蓝蓝蓝笙__blue :哈哈哈哈旅游攻略,<金州勇士国度>: 回复 @Meyeriiii :在大连呆了两年了。没啥感觉,<TOUMARU>: 回复 @我早就不想要昵称了 :[嘿哈]一定一定,<__亦素>: 回复 @Lyriccccccc :这一一个特别幸福适合生活的城市 旅游的话故宫帅府值得一看冬天可以来滑雪吃东北菜]
cmzyk	还记得你玩微博的原因吗？ ​​​	[<大悦UPUPUP>: 回复 @传媒老跟班 :没，找到就卸载了[允悲],<Adising_kariya>: 因为想存龙族的一张图片，只有作者微博有高清图,<撩靜過完餘生>: 回复 @--纯洁白开水 :那你追到了么[微笑],<7hGXS>: 回复 @传媒老跟班 :看各种饮料,<传媒老跟班>: 回复 @抹茶糕儿 :[并不简单][并不简单],<抹茶糕儿>: 回复 @传媒老跟班 :[作揖]回复我了哈哈哈,<传媒老跟班>: 回复 @InnocentBananas :[偷笑][偷笑],<传媒老跟班>: 回复 @7hGXS :饮料？,<传媒老跟班>: 回复 @Ahenna :好久没玩贴吧了。。,<传媒老跟班>: 回复 @阿超今天喝营养快线了吗 :[心][心],<传媒老跟班>: 回复 @95斤馨 :一股清流,<传媒老跟班>: 回复 @纵行君 :厉害了,<InnocentBananas>: 回复 @传媒老跟班 :[二哈][二哈][二哈],<传媒老跟班>: 回复 @日语自学 :“大家都”一定是个人。。,<传媒老跟班>: 回复 @大悦UPUPUP :找着了没[doge],<传媒老跟班>: 回复 @叁横壹竖_ :不如关注我[二哈],<传媒老跟班>: 回复 @Juventus23 :喜欢你的诚恳！[哆啦A梦笑],<传媒老跟班>: 回复 @天上有一朵荷 :快加我为特别关注[笑而不语],<传媒老跟班>: 回复 @Geo-Young :后来呢,<传媒老跟班>: 回复 @抹茶糕儿 :[doge],<传媒老跟班>: 回复 @半个宝宝爱菠萝 :[心][心],<传媒老跟班>: 回复 @赤缇 :我不信了[哆啦A梦无奈],<传媒老跟班>: 回复 @饮雪 :摸摸头,<传媒老跟班>: 回复 @汌汌君 :这大概也是很多人的心声,<传媒老跟班>: 回复 @InnocentBananas :哈哈 微博这么好玩 别要女票啦[并不简单],<95斤馨>: 只有我是为了考研吗[笑cry],<sha都背不住>: because of u,<沐浴在阳光普照中>: 回复 @InnocentBananas :哈哈[闭嘴],<梁yu_>: 那时候同学都在玩腾讯微博，我说我在新浪！！！！,<yokayokalabalaka>: 被朋友推荐，主要当新闻客户端,<StardeerLee>: 回复 @传媒老跟班 :张杰and鹿晗,<瓜瓜powerful>: 回复 @传媒老跟班 :李宇春,<瓜瓜powerful>: 09年因李宇春。（不过这个号是10年的）,<奤Cutie>: 回复 @荆轲又又又刺秦王 :但是她们会看 然后四处八卦  所以我还有一个隐秘的小号[哈哈],<荆轲又又又刺秦王>: 回复 @我是我的赵君怡 :我都不告诉别人我玩微博，除非那些故意要的，也无所谓啦，反正也没人评论点赞，和我自己玩差不多[二哈],<船长EUNICE>: ……做作业。老师要求在微博上干个什么，所以我逼不得已注册了一个[允悲][允悲][允悲]而后一发不可收拾[允悲][允悲][允悲],<在地球远足的折耳猫>: 回复 @传媒老跟班 :薛之谦and王俊凯[污][污][污],<奤Cutie>: 回复 @荆轲又又又刺秦王 :是，一开始就是这么想的呐 不过现在微博上朋友也越来越多了…,<serendipity婧>: 那时不是说难过的都写在微博,<荆轲又又又刺秦王>: 回复 @我是我的赵君怡 :对啊微博都是随时发的，想说啥说啥,<莫不是酸君>: 想多一个了解渠道，对当时喜欢和以后可能会喜欢的人,<疯狂的蛋蛋77>: 回复 @暖肉肉 :是滴 没错！,<秋儿的闹闹>: 因为想看看微博啥样,<InnocentBananas>: 回复 @SweetSorrow- :[哼][哼],<Geo-Young>: 一个南方姑娘说，从微博上，可以找到她,<一个坛子x>: 回复 @传媒老跟班 :张艺兴 [憧憬]但不是这个号追,<暖肉肉>: 从人人网跟过来看小小孙滴，哈哈哈，现在弟弟哒哒都这么大了 @疯狂的蛋蛋77,<撒娇都好吃>: 和同学比赛谁粉丝多[doge][doge],<Zxox>: 回复 @传媒老跟班 :陈翔,<饮雪>: 4.5年前喜欢的姑娘一喜欢玩微博 有一天闲聊时说你也注册一起玩啊 然后就变成关注她，关注她的关注，互动，被她拉黑，到定期去她微博偷看两眼,<这就是韩培>: 09年跟着偶像玩微博，然而万万没想到偶像发了几条微博就弃号消失了。[二哈][二哈][二哈],<自寻苏Meng不青>: 因为 @许嵩  开始玩的微博]
cmzyk	Photoshop全套详细入门笔记，堪称史上最全！ Photoshop全套详细入门笔记 ​​​	[<子露仔>: @Photoshop技术联盟,<米子DOOD>: 回复 @KTR_钊 :谢谢哥！[太开心],<小慧冉>: 大神求安装包1498197441@qq.com,<圆润的怪蜀黍>: @我的印象笔记   cc,<巾是浴巾的巾>: 回复 @蓝是深蓝的蓝 :get！！,<遥步遥步总武线>: @5unny5ummer,<人鱼庭不停>: jxbg3h2@qq.com  求安装包,<CH1N-Ta0>: 回复 @井鱼_WHAIL :但是我看一个教程她那里面将图片转换为智能对象后还是可以液化啊[疑问],<井鱼_WHAIL>: 回复 @CH1N-Ta0 :智能对象是不能液化的,<超甜的妹妹>: @瓶子里的仙女八,<海滩风尚>: 太厉害了[good][good][good][鲜花][鲜花][鲜花][鲜花],<听说我一年只能改一次名>: 强行[并不简单],<远山游Zzz>: @living_smiling,<前进向前进嘿>: 回复 @斑马豆豆君 :可以说非常优秀了,<Jakee-Dst>: @有道云笔记收藏,<applebearcat>: @有道云笔记收藏,<一只Patrick捡到两毛五坐小海马>: 回复 @等下我要变瘦了 :你要控制你自己,<枕云_RDJ>: @有道云笔记收藏,<环球设计联盟>: 超全Photoshop基础知识点汇总,<赖豪鸣Lyman>: @有道云笔记收藏,<z778856>: @我爱躲懵鸡我是WANGLIFEI噢,<KTR_钊>: @米子DOOD   帮你马,<努力努力再努力XQ>: @有道云笔记收藏  [作揖],<MrrrrrrS>: @Wong小虾米  兴许你用得上,<Demi崎>: [喵喵][喵喵][喵喵][喵喵],<等下我要变瘦了>: 回复 @一只Patrick捡到两毛五坐小海马 :！！！爱你！,<独孤蚕-R>: @保存到为知笔记,<WopsYella>: 回复 @Giiiraffe :看了 我都收藏了宝宝,<一只Patrick捡到两毛五坐小海马>: @等下我要变瘦了    @等下我要变瘦了    @等下我要变瘦了,<Giiiraffe>: @WopsYella,<Verschlossenheit>: 回复 @Sheldor_N :[爱心],<Sheldor_N>: @Verschlossenheit,<_我是你宇哥哥啊>: photoshop眼,<叫我青蛙陛下_>: @丶丶丶零丶丶丶,<我只是笑了下>: @有道云笔记收藏,<第四人称楊先生>: @臭臭臭臭臭瓶子,<罗里吧嗦哇咔咔>: @风中一朵小墨花    @罗里吧嗦哇咔咔,<清风不过轻舟>: @有道云笔记收藏,<hey你爱吃青椒吗>: @容我_想想   不由自主at你,<ArleneLee>: 求安装包[允悲] 完全小白但是假期想学，如果有哪个小哥哥小姐姐可以来教我就更好了[污],<种蘑菇的种花兔>: @敏敏33337,<靜見真如性1979>: PS？ILL？。。。平面设计我都玩腻了。有没有AE或3D的？求。,<CH1N-Ta0>: CS6图片转换智能对象后不能液化，是不是得升级版本了[允悲][允悲][允悲],<十点钟先生lee>: @有道云笔记收藏,<传媒小哥>: 总结到位，够全！,<村口理发师>: @没想好名字的羊羊,<superPassion>: @Judy-Tan]
cmzyk	现在微博点赞中间会出现一个大大的赞，特别酷炫，不信你们试试！！ ​​​	[<比爾贰>: 这个功能是怕有人手滑点赞了不该点赞的微博的一个提醒，（提醒人明星艺人）[doge],<咚咚学习网>: 图片评论  http://t.cn/RoaO8ZZ,<LilyDonaldson_Fanpage>: 点击取消关注会赠红包。,<moliyyyyyyyy>: 好好，给你赞还不行吗[并不简单],<乱码大虾>: 终于出了 前段来去之前还说不会再有人轻易手滑了,<咚咚学习网>: 双击两下更酷！[doge],<i昊云起>: 果然如此，我点了四次。]
cmzyk	在评论里说一个困扰你的问题，有经验的朋友帮忙出主意解决吧。 ​​​	[<一个喜欢独处的姑娘>: 回复 @添福宝家的lbb :过的太松闲,<一个喜欢独处的姑娘>: 回复 @汲南 :适当放松自己 不要想太多,<卡伦佐C>: 回复 @一个喜欢独处的姑娘 :这个嘛还真的不会啊,<一个喜欢独处的姑娘>: 回复 @卡伦佐C :有钱有房会撩妹就行,<腰佩名刀秋水>: 回复 @MayJ_lee_Aziz :[摊手],<思忖_咩>: 一個喜歡的工作，每天加班還沒有假，工資還低但學的到東西，但所有人都讓我走，我應該走嗎[摊手],<刘蓝蓝是你小姨阿丶>: 回复 @愤怒的小鸡畕 :蟹蟹[爱你],<趣多多芝士青年>: 回复 @十元一把小香菜 :谢谢,<On_The_Ways>: 回复 @用户5622239667 :25，是不是很大[思考],<趣多多芝士青年>: 回复 @鲸鱼不叫Alice :你有病吧？,<趣多多芝士青年>: 回复 @古丽叶R :会扛过去的,<趣多多芝士青年>: 回复 @Gracephy :谢谢你~,<用户5622239667>: 回复 @On_The_Ways :你几岁啊？,<沈阳土特产代购000>: 昨天看了全职高手 特别好看也很喜欢这部动漫 就是我有一点不能理解但绝没有讽刺的意思 我想知道游戏发烧友到底能从游戏中获得什么感受？为什么有些人愿意熬通宵打游戏？游戏对那些狂热者意味着什么？,<想喝巧克力牛奶>: 回复 @沈阳土特产代购000 :这也是老师跟我们说的 看到你的问题就想传达给你[噢耶] 一起加油吧,<沈阳土特产代购000>: 回复 @想喝巧克力牛奶 :谢谢小友的建议[心],<妈的都被占用还让不让人起昵称>: 回复 @食梦貘的呢喃 :ae安装失败一起围观[doge],<jiuburangnizhaodao>: 回复 @请叫我小小F :我,<On_The_Ways>: 回复 @用户5622239667 :就你呀，不去试试怎么知道对错,<简韬Jane>: 男友身高165 还比我低一些 一点点 家里人强烈反对 说什么也不行 该怎么办啊 恳求建议[悲伤],<用户5622239667>: 回复 @路过的青春刚刚好 :[啤酒][啤酒][啤酒]来来来、灯光师准备，摄影师准备[喵喵],<金毛大侠他妈>: 什么问题，说出来我们帮你看看！[嘻嘻],<愤怒的小鸡畕>: 回复 @刘蓝蓝是你小姨阿丶 :只要两个时间不冲突就可以啊,<happy木槿棉花>: 喜欢的工作在不喜欢的城市怎么办,<路过的青春刚刚好>: 回复 @用户5622239667 :没有酒，我不说[doge][doge],<用户5622239667>: 回复 @路过的青春刚刚好 :说出你的故事[doge][doge][doge],<躲在樱花树上的蓝精灵>: 南方人，想考研去一个沿海的北方城市，希望自己能独立一点，但又经历了租房子之类的事后，有点虚，而且据说北方全是大澡堂子，接受无能[眼泪][眼泪]而且很恋家，超矛盾,<路过的青春刚刚好>: 回复 @用户5622239667 :这是一个问题，有了只会会有很多问题[doge][doge]还是单身好了,<静待花开114>: 回复 @tyousiyou :我还觉得自己好年轻[允悲][允悲],<用户5622239667>: 回复 @On_The_Ways :你咋谁都试试呢[挖鼻][挖鼻][挖鼻],<河梁买茶去>: 脖子扭到了，一低头转头就疼,<守夜人的粽子>: 怎么可以见到松本润！！！岚朋友！！！🌚,<仰光少女>: 黑眼圈跟随多年怎么办[看看],<米森雷欧>: 想追我们老师，比我大八岁，女追男，我96的，怎么操作啊？,<少女老悦>: 回复 @娃娃脸阮绵绵 :那你是小三,<Currie陌>: 因为领导让我改文天天跟领导互怼，怼的我是身心俱疲又不想妥协,<韩小兔g>: 专科毕业，以后的路应该怎么走,<MayJ_lee_Aziz>: 回复 @所有的光芒向我涌来 :一起加油[抱抱][抱抱][抱抱],<WANGJINGHUAii>: 毕业不知道干嘛，迷茫,<syumeka>: 之前考了一个中西部计划考试进入了面试，特岗考试时间也出来了，结果两个时间刚好同一天，该怎么取舍[伤心][伤心],<陈扒皮的小小二>: 正在准备雅思考试。可去年考研失败还梗在心里,<上了发条的柚子>: 公司在郊区，没空自炊，外卖难吃贵,<麻麻说名字长了可以泡到好菇凉>: 喜欢我曾经的同桌她却拿我当哥们儿我表白的时候她却说最近忙着考试考完再说有希望吗,<所有的光芒向我涌来>: 回复 @MayJ_lee_Aziz :同样的烦恼，[二哈],<所有的光芒向我涌来>: 分不清周围人说的话是真是假，每天都是无间道，怎么办,<重度怕热症患者>: 回复 @十七碗瘦肉粥 :东北财经吧，仅建议,<何伞>: 报志愿啊！！！！！！,<喜橙橙橙橙橙橙红蓝_qiaoyi>: 被父母逼婚逼相亲[允悲],<lealio小碧>: 论文选题还没确定.....,<今天的自己要成为明天的骄傲>: 安徽理科考生，高考成绩477分，离一本线差十分，请问有哪些学校可以填报呢？,<玩路遥>: 很喜欢很喜欢一个人,<张嘿嘿Sir>: 法律硕士（非法学） 过了司考  现在却在银行 犹豫中～]
cmzyk	用一部电视剧或电视节目暴露你的年龄吧！ ​​​	[<坏很坏非常坏>: 回复 @孑彧_DoubleFat :菠菜,<坏很坏非常坏>: 回复 @糖超腻 :成是非,<言迷田心耳東>: 贝克舒坦[二哈],<早上起床一脸油>: 超！级！大！赢！家！！！winner！！！[允悲][允悲][允悲]妈的智障啊,<陆点叁拾>: 小神龙俱乐部[doge],<小蚊蚓哎->: 机灵小不懂[坏笑],<Tsoyag>: 回复 @传媒老跟班 :[笑cry][笑cry][笑cry]原来还有人知道,<棢生>: 超级变变变[拜拜],<每天都要打瞌睡的七童鞋>: 绝对计划(小学轮了三四遍[允悲]),<CCHIHWA>: 小魔女DOREMI,<传媒老跟班>: 回复 @Tsoyag :曹颖,<吴佳彦儿>: 回复 @嘿嘿你好哈哈 :最最可怕的是评论里的我全看过[二哈],<吴佳彦儿>: 回复 @嘿嘿你好哈哈 :葫芦娃。。。,<骈马并>: 回复 @骈马并 :首播的时候我上初中,<骈马并>: 图片评论  http://t.cn/RocJFjT,<红红很火>: 小虎还乡[嘻嘻],<好像是个圈噢>: 正大综艺。曲苑杂坛！我赢了！,<恋恋tulip>: 看了又看[挖鼻][挖鼻],<旧月亮在唱歌>: 开心100[摊手],<一大杯西瓜汁12>: 周二下午电视台放假[微笑][微笑][微笑][微笑],<一只酥酥的花yona>: 小...邋遢 哈哈哈哈哈,<左耳东三旬>: 回复 @待字闺阁 :就知道必须有这个[doge],<安小下同学>: 仙剑1[笑而不语]摇铃铛,<_____kent>: 评论里的都看过[笑cry],<小陈陈的话梅糖>: 小学一年级还是二年级看的《马丁的早晨》,<阿六买王不留行>: 好的吧，武林外史    萧十一郎,<我就是呆V>: 回复 @喜欢趣多多的奥利奥 :我要圈他 @大冰,<陪伴是最长情的告白9698>: 排球女将。但我是九零后。,<徐新兵>: 水月洞天，灵镜传奇。萧十一郎,<些咔叭>: 回复 @喜欢趣多多的奥利奥 :这些都太晚了吧，路剑狂花，金剑雕翎，白眉大侠，小丈夫秋月，九阴正经。。。。。,<喵喵不洗脸>: 重庆卫视，生活麻辣烫,<深深深水鱼>: 购物街[doge]超市大赢家[doge] 原来我小的时候就这么喜欢购物了呀[doge]难怪长大要剁手[doge] @SA非特优生,<這裡有只狗>: 回復 @喜欢趣多多的奥利奥 :《大家》安徽卫视的[doge],<如意忆风铃>: 少年杨家将。最近又在重温。,<些咔叭>: 金剑雕翎，路剑狂花，白眉大侠,<来自那里的兔兔>: 双枪老太婆，血蜘蛛，虽然已经忘了讲了什么了,<行走的柚子君>: 飞天小女警[doge],<-kikiiii>: 超级大赢家[耶],<肖延康>: 叮当法术变变变，看我的厉害,<爱的颂扬诗>: 大草原上的小老鼠,<Orz猴猴的鸭梨有压力>: 大风车（金龟子与毛毛虫）,<HyukYoHae>: 风云。   谈判专家,<hxhxwoo>: 闪电传真机[喵喵],<Sy__汐夏>: 小时候记得的第一部电视剧皇嫂田桂花。还有一个差不多是同一时期的无头东宫,<正宗霸波儿奔>: 敌营十八年[害羞],<喜欢趣多多的奥利奥>: 回复 @喜欢趣多多的奥利奥 :[笑cry]没毛病,<梁志锋Heming>: 回复 @喜欢趣多多的奥利奥 :阳光快车道，欢迎您来到。意尔康[二哈],<高大胖親母>: 大西洋底来的人[嘻嘻],<苑家小迟迟>: 哇，一双绣花鞋，当年可吓死我了,<nice的兔子>: 回复 @渣浪是真浪 :哈哈哈，那会可爱看服务到家了，记忆中好像还有一档新闻节目，我还记得那个女主持，头发拉直，脸蛮大的，反正不是锥子脸，]
cmzyk	PS小技巧教你快速更换证件照底色！ PS小技巧教你快速更换证件照底色 ​​​	[<小迪迪姐姐love>: 我只想说快捷键不是Ctrl+Del吗[二哈][二哈],<明说炫谈>: @KamenPyper,<ha百米冲刺>: 有photoshop的app么 @传媒老跟班,<都说你像谜_>: 回复 @都说你像风_ :好弄的,<我的姐姐是宝拉>: 回复 @樱桃陵 :太难了,<杨颖倾国倾城倾我心LOVE>: 这个人不是李莎旻子吗,<gogli>: 嘿嘿,这PS还是有用啊,掌握了能还原真实有型的"大头"啊..毕竟这社会有时只能是自已懂自已,或亲密的人懂,才让有真实啊..哈哈哈,俺曾见过有气质的女生照得让人心里倒胃的,那是拍的人心里有东施在..俺也曾被照的英俊少年显现头发掉光,老气横秋的..改都不能改,也不好提啊,毕竟是人家水货的地盘嘛..哈哈,<八次元二愣子>: 回复 @Catmocker :Lookae.com 有下载,<StarVVVIP>: 这不是主持人李莎旻子吗[微笑],<祡茗紫>: @琳大宝的小确幸  很实用啊，我把我自己的集齐了三颜色[舔屏],<樱桃陵>: @我的姐姐是宝拉  自学成才,<非宏->: 试过，头发边缘会泛红，怎么都弄不掉,<Catmocker>: 前提我得有一个破解版的ps[笑cry],<传媒老跟班>: @纪录片之家   @独立鱼   @电影的力量   @名曰老饕   @电影书生   适转,<小陈陈的话梅糖>: @goddess宅]
