KevinOC	走66号公路会很寂寞，一个四脚小伙伴能够缓解孤独感。🙃 ​​​	[<不改名字有人说我是水军>: 回复 @看这是架灰机zZ :小时候家里是警犬（黑背），然后养过一只藏猎犬，青海那边带回来的，现在家里的狗狗养了九年了，是老婆散步的时候跟回来的小奶狗（还没长牙），是串串。,<TEESE日系轻珠宝>: 天气真好，大自然的恩赐。想想我们这冬天因为雾霾疯狂限行，哎。。。,<看这是架灰机zZ>: 回复 @用户0582754119 :我也养狗了 你养的什么品种,<rushingtiger>: 这火烧云，好看。,<ChrisHong119>: 好漂亮，看着天气应该很暖和啊；纽约的大雪估计得一周才能化玩～,<孙欣慰>: 大律师好！美国的Jeep牧马人贵吗？大概多少钱？国内要50万,<手持U型锁的默罕默德>: 能遇到闪电麦昆吗？,<林荫道-wcjusa>: 美帝的环境太美了！,<刨花工场>: 摇明：没有对比就没有伤害[二哈],<不知道自己是谁谁谁>: 感觉挺幸福的呢！,<Keira_-->: 太美了吧！我也想去[太开心]，我签证通过了，开心死了[耶],<love大白-900>: 啊哈！！！劳动人民家的[狗] 只要得到一个吃剩的面包盒就乐的不得了……[嘻嘻][鲜花][猪头]  http://t.cn/R6PH9Lv,<山云男孩>: 这就是吃披萨那个狗吧,<Flying_Delphinidae>: 回复 @用户0582754119 :狗也是坐车啊，有不是带狗跑步,<仙女姐姐6161>: 美国经济不行了，人民水深火热，环境恶化，嗯嗯,<所罗门_20083>: 回复 @OnlyLexus :具体内容说说话,<Alice王美人>: 做你的狗狗真幸福，你去哪里都会想它,<Alice王美人>: [抱抱][抱抱][抱抱],<猫生十年8866>: 一会在北京一会在美国，厉害了,<四月遠浪>: 美！[爱你][爱你][爱你],<hjdahsjd91hascbnao>: PM2.5呛死了吧赶紧缓缓吧,<思绪飘渺2015>: 狗的表情好落寞哦,<Shee-mu>: A&F[嘻嘻][嘻嘻][嘻嘻][嘻嘻][嘻嘻][嘻嘻],<克罗诺斯2011>: 回复 @道者而无为 :金屋银屋不如咱们的狗窝。,<李涛BY>: 我人生的梦想之一就是骑着哈雷在66号公路上好好放纵一把,<消消7025>: 回复 @蛋疼君v5 :雾霾源自心灵的阴霾，天上不会掉自由，需要奋斗啊,<不改名字有人说我是水军>: 回复 @看这是架灰机zZ :哦，我是懒得改，反正就是一个符号。另外，我确实挺喜欢狗狗的，看到这么棒的斗牛，误以为带着徒步，有点心疼。没打开看全文是我的错。,<看这是架灰机zZ>: 回复 @用户0582754119 :看你没有ID以为 是专门挑刺儿的僵尸粉。律师身份特殊 专说实话 深受小红粉们的厌恶[笑cry],<人民屁民驴民>: 有难么多没条件偷渡美国的华人，就是看了你们发的这样的照片。,<十六间房儿>: 太美了吧[笑cry],<红膏炝蟹ABC>: 带二脚的更好[阿姨],<不改名字有人说我是水军>: 回复 @看这是架灰机zZ :哦，我和别人在聊天，看微博的时候正好看到徒步那张照片，所以才会有这个评论，现在打开一看，是开车的，那就没事。英国斗牛犬本身是不适合剧烈的运动，长距离的徒步，对狗狗不好，我家也养狗狗。,<人民屁民驴民>: 一直想换个环境生活，就是喜欢美国的这样的大土疙瘩[眼泪],<不改名字有人说我是水军>: 回复 @看这是架灰机zZ :什么意思？难道我说错了？,<看这是架灰机zZ>: 回复 @用户0582754119 :什么微博下面都有僵尸,<OnlyLexus>: 回复 @所罗门_20083 :3月8号那期，3个小时，第一期50多分钟。第三期他Twitter上只有个通告，没说多久！,<闰三月生>: 我就喜欢一个人走孤独的路  http://t.cn/R6PJTrX,<神勇_DG>: 移民广告[doge][doge],<消消7025>: 回复 @历史菌博主 :把窗户打开，不就有自由的空气,<所罗门_20083>: 回复 @OnlyLexus :最新一期吗？,<海陆仔>: 大律回美国了？[嘻嘻],<喜悦的小鹿>: 圣多娜，美丽的一咪一咪,<不改名字有人说我是水军>: 英国斗牛犬是格斗犬，不适合远距离的运动，不适合剧烈运动，这样对狗狗不负责任。,<来自古希腊的沉思>: 请问公知（黄左）们：现在是希拉里还是川普靠谱、牛逼？再支持希拉里、奥巴马，反川普，不是蠢就是坏！ ​​​,<好味哥>: 很帅噢kevin！,<脏嘻嘻>: 哈哈，我家也有一只白色英国斗牛犬，不过你家的斗牛犬更好看[哈哈],<啊毛阿_>: 斗牛犬吗…[doge],<谈笑风生华莱氏>: 比你的头像胖了好多[哈哈],<Amigo少年>: 问题是第三张照片谁拍的？,<白熊洗衣社>: 可爱的英🐂。喜欢]
KevinOC	长按手电筒图标，还隐藏有强、中、弱光三个菜单选择，原来不知道的来报个到。🙃 ​​​	[<MR亮亮猴>: 但是调过之后就一直是你的选择强度了  http://t.cn/R6PCjya,<nima临死之前>: 图片评论  http://t.cn/R6PKCZM,<yfuyfvu45264>: 安卓表示很淡定[二哈],<青草浅溪>: iPhone有手电筒功能吗[黑线][黑线][黑线][黑线][黑线]我怎么不知道,<广大干部群众>: [开心]，真的  http://t.cn/R6PJkhI,<现在能改昵称了ba>: 回复 @叶茂的微博YM :和中国一样呀,<吃馒头拉花卷我赚了>: 卧槽还真是！刚知道！  http://t.cn/R6PfT9U,<美国最新一项研究表明>: 每个图标重压都有菜单的，没事用力按两下，经常有惊喜  http://t.cn/R6PqSZb,<PhilosophyAsJustice>: 苹果手机有手电筒功能吗？,<梦想茄子>: 古董4s表示不行[笑cry],<天佑俊>: @长岛律师Kevin  谢谢啦，我弄好了[耶],<hcgsdcn>: @罗永浩  咋看？[可爱],<窦锦东>: 我的6p没有这功能，媳妇的7可以。,<綩憶>: 5s没有[挖鼻],<MYue_RM>: 回复 @一个小医僧 :没事，你的6s还可以再战三年[笑cry],<FYL本人的微博>: 回复 @和小扎做邻居 :对对，刚试了一下，的确是按重了立马能跳出来[兔子],<Jacky志识恒>: 6s及以后机型才有此功能3D Touch,<武汉小向>: 你骗人[笑cry],<斜阳照古道>: 6，最新版本，差点摁破屏幕，嘛都没有,<Leo_再不背单词就跑不了了>: 我也是昨天才发现，还给我舍友显摆了一下[二哈],<开心就好150606->: 回复 @云南精茂律所 :你个安卓机凑什么热闹[哈哈][哈哈],<和小扎做邻居>: 回复 @FYL本人的微博 :是按的稍微重一些，一按马上就出来,<和小扎做邻居>: 回复 @游戏打折情报 :汗，竟然不知道,<柚子妮儿_y1g>: 刚知道了[嘻嘻],<正中梓豪>: [羞嗒嗒][羞嗒嗒],<一个小医僧>: 回复 @Yuan-仔l :是6s，不过玩的不溜[嘻嘻]，辜负了这个机器,<Yuan-仔l>: 回复 @一个小医僧 :6S以上支持3Dtouch的机型才行,<FYL本人的微博>: 受教了[作揖]真的可以选择调节，但是要长按手电筒图标5秒才会显示，菜单弹出比较慢,<一个小医僧>: 回复 @长岛律师Kevin :不是很懂了，空了我再捣腾捣腾  http://t.cn/R6vuzcL,<云南精茂律所>: 安卓手机表示没有这个功能[哼],<在雪地上撒点野的小花猫>: 长摁后，实际并没有的报到一下🤔,<安薇儿66>: 不是长按，是强按[眼泪][眼泪][眼泪],<沉默的羔羊mak>: 3d touch的。早就知道啦。[doge],<lindaj2012>: 才知道[笑cry],<看这是架灰机zZ>: 纠正一下 不是长按 是强按。  触屏力度感应 感觉有点逆天啊[笑cry][笑cry],<家乡水故乡云>: 这是个测试贴？[思考],<音乐漫步ing>: 要用力按[笑cry],<何处觅天使>: 6s可以用力按压屏幕，无需长按[笑cry],<葉茂也弘羊>: 回复 @习梦囡 :手电筒和卡扎菲有什么关系？[傻眼],<律师小咖>: 回复 @长岛律师Kevin :不是版本的问题，最新的咋不行,<律师小咖>: 我怎么使不出来呢[白眼][白眼][白眼][白眼],<律师小咖>: 我也才知道，[good][good],<希尔瓦娜斯信徒>: 回复 @一个小医僧 :我就不试了。因为不想升级。,<坏蛋Rory>: 这个以前真知道，就是没大用过,<ID我吃了>: 需要打开3Dtouch,<千里草上飞呀飞>: 有按压模块的才行啦,<ID我吃了>: 回复 @一个小医僧 :3Dtouch打开没有？,<长岛律师Kevin>: 回复 @想去佛罗伦萨看庙的二爷 : 还真有可能是这个原因,<想去佛罗伦萨看庙的二爷>: 回复 @一个小医僧 :要3dtouch,<精彩大结局5>: 回复 @长岛律师Kevin :6s以上才可以]
KevinOC	又发公告了，邪性富豪扬言爆大料。。。这种偷拍录音坏蛋，美帝也不好好管管。[挖鼻] ​​​	[<巧克力甜甜圈洞>: 回复 @裹落里的裹落 :谢谢,<飘落在南半球>: 看来国安局还真成了这些人的家丁了，上届够昏庸无能了,<keviny11>: 回复 @家伟00001 :YouTube也被TG收编了吗？,<克罗诺斯2011>: 回复 @BattleRobot :举报你。当地公安会请你聊一聊。,<铁朗普金>: K律下一个号是什么？ @长岛律师Kevin,<看见快乐对我笑耶>: 怪不得前几天来个小视频，有内幕消息私信给我呀.[挖鼻]不会翻墙的大妈严重鄙视设墙的混蛋。,<裹落里的裹落>: 回复 @高三DoDo :[坏笑][赞],<高三DoDo>: 回复 @裹落里的裹落 :好了  http://t.cn/RisE8Dn,<高三DoDo>: 回复 @闻轩艾鱼鱼 :你用的 哪个一年一百？我用的贵一点,<芯碎了hhw>: 什么事？不明白。,<高三DoDo>: 回复 @家伟00001 :图片评论  http://t.cn/RisR4Jj,<高三DoDo>: 回复 @家伟00001 :？？,<高三DoDo>: 回复 @山里有雅人 :这点钱都不出或者出不起，还是算了吧,<八宿街头的驴子>: 回复 @裹落里的裹落 :谢谢,<裹落里的裹落>: 回复 @八宿街头的驴子 :第三集我也没有。为安全考虑这个软件没有搜索密匙功能，密匙只能通过其他途径获得。,<八宿街头的驴子>: 回复 @裹落里的裹落 :这位雷锋童鞋，第三季没有吗？还想请教如何通过你你推荐的软件找到资源？,<乾坤大挪移之凌波微步>: 这就是我们不解放美国的根本原因！,<D涵气来袭>: 锅闻贵[doge],<理想埋在土里_COLIN>: 大律你这个号很快会消失的,<东一>: 我公安部打四黑除四恶公号表示不服，并向其扔了一个邪性富豪肮脏往事的小视频。。[doge],<Kabarvi_水杉>: [污][污]第三季猛料,<大仙阿门二蛋的>: 都是一些小料，其实没什么意思。,<铁帽子大王>: 偷拍录音 美国总统都在干啊,<澜菲溪岸缱绻流水>: 回复 @闻轩艾鱼鱼 :还是在Google上搜的[可怜],<澜菲溪岸缱绻流水>: 回复 @闻轩艾鱼鱼 :我用的是华为荣耀，国产机应用市场里面也可搜到吗？还是有专门的“APP store”的软件,<高建烜>: wiretap[吃惊],<人民屁民驴民>: 彻底撕破脸，不讲任何情面，鱼死网破，十九大之前不动他，拼了，不是你死就是我亡,<歲月的童话_Nov>: 回复 @做自实的我 :付费ss账号,<闻轩艾鱼鱼>: 回复 @澜菲溪岸缱绻流水 :你真土豪、去App搜啊免费的大把,<做自实的我>: VPN都封了，怎么翻墙啊，谁有软件发一个呗,<澜菲溪岸缱绻流水>: 回复 @闻轩艾鱼鱼 :可以私信是哪个VPN吗？我用的这个收费有点贵，1G要五元,<黑白电视白开水>: 回复 @闻轩艾鱼鱼 :谢谢[作揖],<从未如此相信过>: 突然想起有个电视，小生夜晚爬上财主家后花园围墙上…偷看财主发功练武，看着就睡了起来，后发现抓了个现成，绑在花园里，众人回去睡了。后财主千金于心不忍松了邦，因花园门锁死，千金唯有把小生送自已睡房床上躲避，后两个磨蹭下着了火……,<裹落里的裹落>: 下载Resilio，然后：BQZ7TJASOYOETXHOGUGSDECOLFKPOAEYV。请叫我雷锋,<风吹花香两>: 回复 @亚特兰蔕斯的猫 :七星摩根,<人民屁民驴民>: 回复 @裹落里的裹落 :已恢复,<北京退伍老兵>: [哈哈][哈哈][哈哈],<找石头摸>: 回复 @裹落里的裹落 :独裁的力量真顽固,<裹落里的裹落>: 诡异的是youtobe把明镜视频下架了,<闻轩艾鱼鱼>: 回复 @不说不写 :下个youtobe、吧跟腾讯视频客户端一样、,<黑白电视白开水>: 回复 @seolsong京畿 :非常感谢[作揖],<不说不写>: 回复 @闻轩艾鱼鱼 :第一次用，连上VPN后，请问怎么进入下载推特啊,<笑哈哈chen>: 这个郭没有一句实话,<潔曉T>: 回复 @黑白电视白开水 :明镜    YouTube上,<aaron_xia>: 就是，再不管管，他爆出更多贪官来，得吓死多少老百姓啊[挖鼻][挖鼻],<morphcn>: 哎呦，侵犯人权了，人权不是邪路的东西吗,<闻轩艾鱼鱼>: 回复 @山丘之熊 :兄弟自己搜索关键词VPN、不是我不说软件名、说了怕相关部门把这个软件给禁了、16年老子的付费软件就被苹果给下架了,<hgtehyy>: 构不成什么威胁，添点谈资罢了,<黑白电视白开水>: 回复 @seolsong京畿 :哪个推特账号阿？谢谢,<坐船去墨脱>: [鼓掌][太开心],<闻轩艾鱼鱼>: 回复 @慢慢变瘦的小冰 :手机啊、以前的一年才68、电脑手机通用、后来被苹果给禁止更新了,<吴承欣>: 回复 @闻轩艾鱼鱼 :老铁，扎心啦。,<山丘之熊>: 回复 @闻轩艾鱼鱼 :推荐个靠谱的，100块现在贬值的还叫钱吗？谢谢]
KevinOC	几乎可以决定谁当美国总统，民调没毛病。[眼泪] ​​​	[<一个小医僧>: 剩下14%的人会安全吗？会不会和普丁的反对者一样被咔咔了？,<曾经有个书包>: 天朝和朝鲜的民调表示不服,<coyotewei>: 100%的朝鲜人认为自己的祖国在世界上影响巨大，连美帝都怕！[挖鼻],<独角独角它妈卖逼>: 一颗老鼠屎、坏了……,<凤疯疯癫癫>: 回复 @平壤那些事儿 :是不是美颜了,<斯普特尼克恋情>: 俄罗斯也就比中国好一点[坏笑],<思绪万千不如怀念>: 回复 @平壤那些事儿 :看着还有点帅[偷笑][偷笑],<漂泊的行船人>: 与2830票赞成，69弃权，1票反对，如出一辙。,<北京退伍老兵>: 现在属于二流甲强国。,<简单阿鲁>: Gdp和广东一样的国家，,<Dechinalized>: 本人对此条中文信息的真实性表示严重怀疑,<闲仁哈利>: 站在克里姆林宫门前广场，时刻需要钞票准备贿赂，这个国家没有未来,<我有一颗尚进心>: 其实中国也可以搞一次[doge],<黄金时代的洛克菲勒>: 意淫强国，毛子真搞笑,<中二病丶不要談戀愛>: 2333333[二哈],<毛君>: 朝鲜现在影响力也很大[哈哈]]
KevinOC	“邪性富豪”郭文贵的一些往事，你会感兴趣[挤眼]http://t.cn/Ri1R9ng ​​​	[<走大大在大富区>: 回复 @村口老牛 :啥大戏？不明,<走大大在大富区>: 回复 @dust-_- :什么传言？,<梦想与财富同行>: 害死亲弟弟，这人品估计没得说了,<走大大在大富区>: 回复 @zHuKuNhUi :什么传言啊？,<581407ya>: 是不是伤到什么人了？,<代表着淡定与威严>: 回复 @代表着淡定与威严 :就算你这视频是“帝国的反击”吧，你再看第六集帝国就被打输了吖,<蔷薇1337250664>: 那头像怎么没了，大律师,<yeti2005>: 不明真相？没有一个人能说说吗？// @长岛律师Kevin :这种时候，公安部官微敢提这个人，真厉害啊。。。,<橡叶骑士LL>: 此人不是移民加拿大了吗？难道说要给抓回来吗？一回来多少高官又要倒霉了！[二哈][二哈],<cbzcbz>: 黑吃黑而已[大便],<雪茄菌>: 公安部媒体搞这个无聊不无聊？,<包子漂亮就在褶上>: 155亿的身家，拭目以待后面的事,<贫贱移不动>: 副部长坐不住了。毕竟年三十以来，睡不好觉啊。（没一个好东西，就喜欢看狗咬狗）,<曹县曹阿瞒>: 回复 @大国小明 :感觉用河南话黑山东，官微也是醉了,<蜀黍123>: 大律这点肯定就不懂了，这个人可怕的是开了一个示范，这是第一次有人真正的玩鱼死网破，王使馆事件，令兄弟投美，其实都没有明面的撕破脸皮。而郭真正的撕破了脸皮，这是资本对权力的一次赤裸裸的玩弄和冲击，会对其他人有示范作用，他不是赖昌星，会让很多商人看到掌控和摧毁权力的机会，某些人会怕,<郑丽军律师>: 权力掮客。 // @长岛律师Kevin :这种时候，公安部官微敢提这个人，真厉害啊。。。,<众神之友>: 到底牵涉到什么瓜葛了？之前没听过这人。,<外號菜頭>: [笑cry][笑cry][笑cry],<武哥03>: 先扣帽子造舆论，郭可以代表中国普遍性的政商关系，强烈谴责不守帮规。[二哈],<喀斯特之风>: 拭目以待// @长岛律师Kevin :这种时候，公安部官微敢提这个人，真厉害啊。。。,<乾坤大挪移之凌波微步>: 这说明这一窝挖的差不多了。,<你能不能听话点啊>: 那个视频意思就是官商应该搞好关系一起发财 给对方下套就是不仁不义   哈哈哈哈哈,<神羽的意念>: 要不要帮官微截个屏啊，万一变卦了呢,<小蜜熊lychee>: 回复 @不说不写 :百度一下 你就知道,<你能不能听话点啊>: 原来是这样 被揭短了撒泼了,<不说不写>: 回复 @Honey-Bear :不会用,<dust-_->: 反向证明了传言。,<东岭菊花开正好>: 傅政华部长可安在？,<闭嘴政治>: 傅急了，也该完蛋了~！,<芯碎了hhw>: 说明击中G点了。,<Alice王美人>: 重点是他怎么让官员这么相信他的？,<李学丰>: 感觉象是在化解他在境外的那些言论，有点象是在拆招。有没有用先放在一边。这种“曝光”，反倒会招人疑问：政府官员究竟已经烂到了哪一级？ 还有没有好的？,<东北大瀚>: 仅就手段而言，一如既往的low,<空水中明>: 这人怎么了[脸红] // @长岛律师Kevin :这种时候，公安部官微敢提这个人，真厉害啊。。。,<梦中的瓦尔登>: 堂堂最高衙门用这种腔调，做贼心虚欲盖弥彰？,<笑York>: 新闻要前后一起看,<齐律说法>: @白斌的公法梦   @丶疚遇久橙词   @Mr-YangMeng,<代表着淡定与威严>: 背景音乐是“帝国反击”吖！,<小蜜熊lychee>: 回复 @不说不写 :vpn去看吧,<YounPan-帆>: 你们看那些来反驳的人的那些微博，有几个是正常人[二哈][二哈][二哈]不是被洗脑就是水军,<湘西辣椒哥>: 回复 @大国小明 :是，郭从河南郑州发迹,<小学徒00>: 怕他的二次曝料无人知？,<心犹寒21>: 猎物，猎手之间，一字之差，却天壤之别。公安部出牌了，看看马仔郭如何接招吧[思考][思考][思考],<老爷们阿润>: [汗]// @长岛律师Kevin :这种时候，公安部官微敢提这个人，真厉害啊。。。,<不说不写>: 回复 @Honey-Bear :说说看,<来看新闻的微博>: 没有投鼠忌器？// @长岛律师Kevin :这种时候，公安部官微敢提这个人，真厉害啊。。。,<尼古拉斯·清流>: 这声音笑死我了，这是我们河南的普通话吗？[笑cry][笑cry],<内蒙古Free德曼>:  // @长岛律师Kevin :这种时候，公安部官微敢提这个人，真厉害啊。。。,<小牧鱼儿2015>: 呵呵 // @长岛律师Kevin :这种时候，公安部官微敢提这个人，真厉害啊。。。,<马大夫的阿Sir>: 擦、这个人是 谁啊？这么牛叉 各种高管关系！  // @长岛律师Kevin :这种时候，公安部官微敢提这个人，真厉害啊。。。,<朱钰可>: 回复 @Honey-Bear :这集我看过 精彩,<行健小屋_3>: 稍后再看// @长岛律师Kevin :这种时候，公安部官微敢提这个人，真厉害啊。。。,<南阳和尚>: [药丸]，大清国越来越low,<EIIa__Ieo>: 续集应该快开始了，郭只是马仔一个 // @长岛律师Kevin :这种时候，公安部官微敢提这个人，真厉害啊。。。,<热评小哥>: 看来传言是真的，喉舌已经开始舆论造势了[二哈]]
KevinOC	与时俱进的同一家店 [哈哈] ​​​	[<美时美客-时间竞拍>: 第二家店，谁敢闹事[二哈],<木匣-x>: 总觉得过不了多久还得换。。。[笑cry],<流河成群>: 能维持几日？[阴险],<上海嗨森>: 就我看出来这是一个段子，本不是同一家店吗[大哭],<08县长66>: 回复 @长岛律师Kevin :只要不是老年代步都得砸，全有外国零件。,<长岛律师Kevin>: 也不知道店主买的什么车 lol,<长相守是考验>: 三胖子要搞核爆，万一下一步号召抵制朝鲜，店主怎么办？[疑问][疑问][疑问],<08县长66>: 我觉得叫"蘑菇云烤肉“更响亮。,<二分之五百零一>: 对照了好久，确实是同一家店。,<悠悠独行>: 这下爱国小粉红们满意了。[笑cry][good],<御剑凌云封旧尘>: 回复 @Amigo少年 :你说的很对 小粉红基本都是家里英雄，出门狗熊的一群人。,<Amigo少年>: 回复 @御剑凌云封旧尘 :小粉红如果管那些就不是小粉红啦,<蓝莓芝士ll>: 回复 @西西悟空166 :这个问得有水平[good],<梅上雪SHS>: 嚴重贊同右邊觀點。只有中國人最了解中國人，並且防範之～[偷乐]// @咸鱼曹 :有种防火防盗防同胞的感觉,<航海王9527>: 中国人是最聪明的,<zzz洋仔>: @CharmingSun喵,<御剑凌云封旧尘>: 吃个烤肉而已，阿里郎烤肉我们这里也有，该吃的不还是去吃，有什么，阿里郎烤肉一定是韩国品牌么，国人的思维不敢恭维。美的空调就是美国的么？,<凉水河-_-鸟巢>: 换了马甲也认识你是棒子[哈哈],<医学信徒>: [二哈][二哈][二哈],<爱死JAZZ>: 中国人不砸了换美国人炸弹砸了[摊手][二哈],<SeraphJo>: 哈哈哈哈哈哈哈哈哈哈,<用户17471895>: 图片评论  http://t.cn/RidtuDy,<callofwild>: 下一次变脸啥时候？斩首行动之后？,<hjk4321-1>: [哈哈][哈哈],<老吉他08860>: 还是看着三胖照片，想到的是肉多肥美，吃着安全看着也放心，老板精明。,<氏制斤良>: 回复 @温斯顿的花园 :党和金家穿一条裤子，不知道你说的中国灭朝鲜具体是指什么灭朝鲜？,<搓古>: 没毛病，中国某些奴性老百姓历来有见风使舵的传统。,<Destinyho>: [笑cry][笑cry][笑cry][笑cry][笑cry],<近代史>: 不然没生意了[眼泪],<pmali>: 过几天是不是得川普烤肉了。,<越长越糟>: 只是年底又要换招牌了[摊手],<深圳小摊贩贩贩贩贩贩贩贩贩贩>: 还是合作保险[哈哈],<慕容复的绝招>: 闻说去这里吃饭，可以贡献外汇给朝鲜，让他们发展核武，然后拿来炸中国！我觉得这样很有意义，我们一起去吃吧！[哈哈][哈哈],<琴木工坊>: 想当年中韩建交时，我们那边朝鲜一条街上原先以朝鲜命名的各种商店饭馆，一夜之间都变成了韩国商店韩国饭馆,<木子漠唯语>: 😆😆😆😆😆😆😆😆,<希尔德布兰德>: 马上朝鲜核试验后不知道会不会反朝哦[挖鼻],<温斯顿的花园>: 过一段时间，中国灭了朝鲜之后，还得改。。。,<陆军海战队晕船领航员>: 图片评论  http://t.cn/RidqPh2,<神勇_DG>: 爱国生意[笑cry][笑cry],<乾坤大挪移之凌波微步>: 平壤人民发来电报：啥是肉？,<ZhixianSX>: 笑死我了[笑cry],<民农老徐>: 应为烤金将军肉火锅,<仙仙系大王>: 北京林业大学食堂韩国风味改成朝鲜风味,<summer_hater>: 。。。。。。。。。。。。,<梅小厨私房烘焙>: 紧跟当局的步伐，没毛病[哈哈],<咸鱼曹>: 有种防火防盗防同胞的感觉]
KevinOC	@王志安 ，好喜欢你的文章《我有一个梦》，忍不住打赏10.00元！#微博打赏#我有一个梦 ​​​	[<SeraphJo>: 讲真，美国现在媒体的一边倒现象真是少有。,<胖墩与小胖>: 如果有了你这个自由共产党岂不是没了自由？,<Jackson要过CPA_>: 回复 @小周119 :媒体就不能够互相监督吗？靠教育，精致利己主义教育么？芮成钢在哪里[污][二哈][二哈][二哈],<ZM953>: 媒体是有监督国家的权力，但有时候也会出现成也萧何，败也萧何，这次民间的抵制对国家经济有没伤害呢？其实大家都有目共睹的。,<深圳小摊贩贩贩贩贩贩贩贩贩贩>: 没见过 @王志安  ，觉得是个良心媒体人，// @长岛律师Kevin :好文，没有正常媒体监督的国家，就没有文明。也打赏10元 lol,<廖荆轲>: // @长岛律师Kevin :好文，没有正常媒体监督的国家，就没有文明。也打赏10元 lol,<小周119>: 各行各业都有坏人，媒体也是。言论自由和媒体监督是两回事，社会进步靠媒体监督迟早完蛋。社会进步靠教育：1、培养独立人格、正确价值观的人；2、科技进步加快信息传递。,<小周119>: 媒体中有很多垃圾，怎么处理？,<昭和元祿>: 在我所接触的大学教育中，以镣铐下的舞蹈为荣，而且只有带镣铐才能跳的更好，哈哈哈,<RandomSeed>: 很多美国人民不知道自己有多幸运能有媒体自由。]
