KevinOC	《人民的名义》里丁义珍副市长逃跑的时候用的是美国护照啊，这美国护照哪里搞来的？ ​​​	[<Pick-upArtist>: 回复 @zzzuz :666,<乌鸦上太空>: 回复 @The姜戈 :没那么简单,<abyss_joke>: 回复 @漫步在这人生里v :你大概是疯了吧，不然怎么可以对完全陌生的人说出这么下流无耻的话。卑鄙小人的想法总是龌龊的。,<苍悳>: 回复 @长岛律师Kevin :这样不是影响照片了嘛～,<漫步在这人生里v>: 回复 @abyss_joke :衣冠禽兽想操你,<依小然->: 卧槽 问题换不到,<liangmingfang>: 要认真攒钱了// @长岛律师Kevin :我细看了，护照照片是PS上去的，没有美国护照那种细条防伪波浪横网。美国护照真不难，我57万美元就能包绿卡（贪官不做）[哈哈],<雁牛仔>: 真的受不了美帝象怨妇一样不停抱怨，象祥林嫂一样见人就说有人不配合，直接扫平北半岛行吗[允悲],<正宗闷油瓶>: 回复 @用户5893843257 :我要抱大腿,<八云家的墨小哥>: 回复 @耶儿_提伯斯 :毕竟傻子多，白给的钱不要白不要啊,<天秤座熊大>: 贫贱不能移，没钱移个毛线,<光着膀子跳探戈008>: 看来还是第二职业→_→[阴险]不知是不是真有能耐→_→[阴险],<冻冰欲碎32614>: 祝你早日全家团聚[哈哈],<南蛮犟驴>: 可以分期付款吗？,<我就问你溜_不_溜>: 回复 @zzzuz :层主说的确实是大实话，上海领先全国真的不是一点点，记得去年有一次去上海培训时被震撼到了，92年的上海地标比13年的国标要求还要高。出发点就不一样，追求也不一样，结果更不一样。可笑的是直到现在还一群人无视差距，夜郎自大。,<我就问你溜_不_溜>: 回复 @复活的豌豆射手 :四等少，五等汉[doge][doge],<我就问你溜_不_溜>: 回复 @长岛律师Kevin :边检要是看你脸上没波浪线~~~怎么办？[二哈][二哈],<太阳监狱团支书>: 回复 @伊丽莎白鼠28748 :别给白鼠丢人谢谢,<顺兴达厨卫不锈钢>: 回复 @北京厨子新肝 :57块，那可以到北大，毕竟公交车费用还是很亲民的。,<人海狼狼>: 回复 @伊丽莎白鼠28748 :你好小白鼠,<复活的豌豆射手>: 回复 @专杀阴阳怪气比 :来来来跟我一起说:一等洋人二等港，三等绿绿四等汉～～～这是哪国啊[挖鼻],<内科老专家>: 留存[嘻嘻]// @长岛律师Kevin :我细看了，护照照片是PS上去的，没有美国护照那种细条防伪波浪横网。美国护照真不难，我57万美元就能包绿卡（贪官不做）[哈哈],<护士撒腿>: 春阴里墓流自稱張春華！ 全家打手琛错别！麻褂子矮子怪胎，打手琛作呕涎水红，气味作呕，呕！,<聂树斌案郑成月>: // @长岛律师Kevin : 我细看了，护照照片是PS上去的，没有美国护照那种细条防伪波浪横网。美国护照真不难，我57万美元就能包绿卡（贪官不做）[哈哈],<一哥王阳明>: 回复 @Yifancn :David boies,<zzzuz>: 回复 @丽宗平郡 :像你这种社会最底层的出不了国的屌丝跟你谈什么德国生活都是浪费时间[允悲],<zzzuz>: 回复 @丽宗平郡 :屌丝你出不了国就不要装逼。好吧[允悲],<Bbktdjgp56068>: 回复 @一鼓作气再而羞三而急 :渣渣你们这些渣渣,<丽宗平郡>: 回复 @zzzuz :这给是多白痴，傻叉才能说出这种可笑的话，自己意淫的吧,<大闸蟹没有没有翅膀>: 律师是美国人啊[哈哈],<LilBearTMZ>: 刚刚发的,邓小平的, 被删了?,<最差7号就是我>: 回复 @Fisher-SZ :评论舅服你[笑cry][笑cry][笑cry],<还是恢复成Carol>: 特地拿朋友的对比了，少了条码,<古诗云蓉>: 回复 @长岛律师Kevin :投资移民除了钱，还需什么条件，成功率有多大？,<耐力控>: 哎~贫贱不能移[泪],<用户6044590817>: 回复 @千秋家国梦8 :保鲜,<人人争当大V>: 从国际法的角度评价下“中英联合声明”的时效性，还有没有现实意义[作揖],<任i大大>: 原来移民是个大生意,<hao1262011666>: // @长岛律师Kevin :我细看了，护照照片是PS上去的，没有美国护照那种细条防伪波浪横网。美国护照真不难，我57万美元就能包绿卡（贪官不做）[哈哈],<杨小华的悲惨2015>: 希望我们的血泪控诉能唤醒全国同胞的危机意识，我们都是守法公民，身体长期无辜遭受到电磁波的迫害，大脑每天二十四小时不间断的声波干扰，此恐怖犯罪行为远比日本731残忍血腥。希望国家能重视这起惨绝人寰的恐怖案件，阻止灾难的延续，请大家帮忙呼吁、转发！￼网页链接  ￼网页链接,<海上肛秦师>: 回复 @刘首驿_2017 : @专杀阴阳怪气比  这个逼就是生活不如意 家里没钱 成绩也不好去不了国外读书 怒成小粉红 整体看一些环球时报共青团中央意淫 再到网上喷喷人 美滋滋,<十伍空降>: 回复 @hmyilyiny :你倒是挺有自知之明[笑而不语],<hmyilyiny>: 回复 @十伍空降 :哈哈哈哈嗝[馋嘴]～～装傻一流,<十伍空降>: 回复 @hmyilyiny :你倒是挺有自知之明[笑而不语],<hmyilyiny>: 回复 @十伍空降 :是呀[doge]没脑子的都这样[思考]让我想起了小泰迪[笑而不语][笑而不语],<十伍空降>: 回复 @hmyilyiny :[污]想怼在哪都能怼[污],<hmyilyiny>: 回复 @十伍空降 :你得结论好快呀[鼓掌],<十伍空降>: 回复 @hmyilyiny :不不不，都是怼，在你国和在美国只是用刀棒怼和用枪怼的区别[笑而不语]  结论就是在哪你都不敢怼[阴险],<hmyilyiny>: 回复 @十伍空降 :没事我跟他怼 搞事呢啊 遇到不公平才会拿枪跟他干 可是在清朝 想干也干不起来啊[悲伤],<十伍空降>: 回复 @hmyilyiny :拉倒吧，你干干警察试试，动一下都崩了你[悲伤],<十伍空降>: 回复 @牢记历史是为了悲剧不再重演 :你这豚畜倒是挺有自知之明的[允悲]。]
KevinOC	谁会是下一个乐视？ ​​​	[<Wanderin_>: 回复 @进净退尘 :按計劃辦。,<两千金88>: K律被禁言了吗？,<叫我大王就好啊>: 回复 @YC菠菜 :阿里除了假货比较多（电商通病），其他没有啥 挑不出啥毛病,<优惠券淘精品>: 敢不敢评价时下大清的文字狱(),<维维豆奶不好喝201201>: 回复 @瓏藏堂 :审查,<狗腿子jojo>: 被禁言了？干嘛不粗线[可怜],<ss2222010>: K律去无人岛度假三天，那里没信号[doge][doge][doge],<一斤酒两斤肉>: 每天上来看一眼，K律没更新就退出微博睡觉了……,<蜜思自然卷>: 这么长时间没有发博，K律被关进小黑房了[疑问],<湾区大佬>: 关注本大佬，今晚发布外围重大爆料消息！！！！,<汤继舜>: 回复 @清流sky :禁言三天，看我微博即可,<清流sky>: 请问K律去哪了？怎么没文了呢？,<蹭能量>: k律咋回事，怎么不说话啦,<赫伯特-周>: 推上有消息了，今天下午...,<冬瓜南瓜丝瓜汤>: 大哥 忙啥了 一天没见你了,<小布丁20160301>: 回复 @野有蔓草宛清扬 :一个个的坏透心儿了 [喵喵],<Be_Informed>: 回复 @杨小林zerror :里面外国剧多啊所以要删,<东华西路>: 回复 @湖边的杨柳青 :自己百度就知道[哈哈],<皓月高考2017>: K律：说几句，让我知道您还安好,<湖边的杨柳青>: 回复 @东华西路 :A站是……，B站是……？,<船长的烦恼201202>: 怎么一天没动静了,<玩偶的主宰>: k律有所指吧？[阴险],<通信女超人>: 开会了开会了，将电视关了，那边不要讲话，现在我们谈一谈坐庄！// @东华西路 : A站B站都被封了…,<东华西路>: A站B站都被封了…,<一二6699>: K律 还玩微博吗？[失望],<钰满堂2013>: 为什么微博的榜单都被娱乐明星霸占了，关乎民生时政的微博都沉下去了。推特和脸谱的榜单是不是也被明星霸占了。,<Unulie>: 回复 @联邦的白色MS :gd到底要干什么？,<佑在啊>: 回复 @abyss_joke :融创负债＞200%,<辣味奶酪e多啦>: 回复 @孤单北极狼919 :[眼泪]7.17断网会否[笑而不語],<freedomof駿>: 回复 @联邦的白色MS :a站b站收藏的电影已经全部不能观看[汗],<cxsggg450>: 那个 @忧国忧民王全杰  这次也见识了跟你上次一样的遭遇。,<大脑营养姜汤_诚>: 跟房地产有关的，债务很高，房子有很多[笑哈哈],<Flying_Delphinidae>: 回复 @成都_大伟哥 :最近这么多情况？那问题大了啊,<成都_大伟哥>: 回复 @Flying_Delphinidae :据说潘石屹也在美国。,<林子大什么树都有>: 万达，我大清朝廷已经放弃他了,<白夹竹桃shealjoan>: 回复 @联邦的白色MS :我收藏的一百多部欧美电影几乎全线覆没[摊手],<fancy麻麻>: 博主关注领域广泛，受益良多。目前国内泛清真话严重，绿教势头猛烈，奈何绝大多数国人无长远危机意识，伤害没到自己头上都不关心。如果博主有兴趣，关注一下这个领域。,<从未如此相信过>: 教人壹亿小碎步！如何理解一个人均收入倒数之国？这句能解释吗：朱门酒肉臭…路有冻死骨。,<深空之灵>: 最有风险的是万达系，现在吃相太难看；再往后，都跑不掉,<花心的射手男>: 回复 @进净退尘 :会是微博吗？[笑cry],<裕子拼布手作小屋>: 回复 @moses2613 :你懂的[二哈],<沙比大头_金>: 回复 @瓏藏堂 :我知道，当时我正在下载孤国春秋，然后突然就没了，几分钟的事,<Leo申澈熙>: 政商经济，无耻无奈,<yfuyfvu45264>: 回复 @联邦的白色MS :[馋嘴]要人字梯的可以私信我。,<红尘漫步-->: 回复 @楊泰羽 :关网留辫子回大清当皇民呀,<jingding_91923>: 回复 @kk智多星 :你说得是古代史还是现代史还之史前,<软臂阿疼木>: 回复 @杨小林zerror :黑泽明的黑白电影全部被下架(ಡωಡ)还有各种哥斯拉也是,<马可波罗爱好者>: 律师被禁了吗？[失望],<lishen丶>: 回复 @wqroger :我说菊花，关翔米用户毛事？,<穿刺公当克>: 回复 @没事遛儿 :腾讯举报快播，把锅甩给乐视,<姐芙是金巴镎马奖影帝>: 那得看北戴河怎么斗，屎九大怎么争，钟南海里面什么战况]
KevinOC	女朋友爸爸说，下午7点就要按时回家。(^ ^) ​​​	[<姐芙是金巴镎马奖影帝>: 跟德国有关的都被秒删啊，哈哈哈哈，怕什么呢,<大致天晴>: 大律，关于川普儿子爆料，想听听你从专业角度去看看，现在是对川普非常不利吗？,<abyss_joke>: 回复 @阿雪knighting加拿大 :千错万错，都是墙的错。。。,<Raphae_devill>: 110,这里有人虐狗,<软臂阿疼木>: [喵喵]取过一波？,<从未如此相信过>: 是否透露…封墙的最后一面？,<水粉钧>: 回复 @噢允橘 :对啊你就要按时回家,<小萌萌曾轶可>: 美国治安不好，他们说在美国晚上6点天没黑就必须回家了，女生不能在外面晃悠，不然有生命危险,<dasheng1788>: 回复 @好多好多小鱼儿在游 :[哈哈][哈哈][哈哈],<gzgsxyj>: 回复 @Amigo少年 :美金应该在高位,<abyss_joke>: 没有墙的阻挡，该有多好[傻笑],<遗丶失的沙丶漏>: 回复 @再再再再再再再再再再再再再再再 :保安？,<夏天的来了>: 回复 @长岛律师Kevin :[二哈]混血聪明？那你要说跟谁混？,<好多好多小鱼儿在游>: 墙似乎太高了，缺少一个洞洞。,<KDS-LSH>: 回复 @匯彣 :問題是何時推牆，給他們自由！,<耶律邪>: 回复 @匯彣 :这也能看得出来？？？,<绣球花盛开的山岗>: 回复 @胡一刀不胡也是一刀 :笑死了[允悲][good],<匯彣>: 墙外是母，墙內是公。,<山间怡然>: 好像刚刚年满18。,<脫皮怪獸2010>: [笑cry][笑cry][笑cry],<獨眼金木yan>: 回复 @长岛律师Kevin :女友是白人?,<獨眼金木yan>: 回复 @长岛律师Kevin :k律没结婚?,<胡一刀不胡也是一刀>: 这是映射上一条的征婚[傻眼]那些舔嗨自己的大兄弟[费解]…,<maxiaolivein2017>: 回复 @梁小D帝弟蒂娣努力向前冲 :抱抱！[抱抱],<Kalpis>: 老司机开起车来不服不行。。。,<绣球花盛开的山岗>: 卒不及防啊，这狗粮撒的[二哈],<一只好源源>: 我可以举报吗[斜眼],<梁小D帝弟蒂娣努力向前冲>: 回复 @maxiaolivein2017 :抱抱[爱你],<古典鎮_keni>: 回覆 @长岛律师Kevin : 要做爸爸了？,<maxiaolivein2017>: @梁小D帝弟蒂娣努力向前冲  [委屈],<长岛律师Kevin>: "放心吧，他们都说混血聪明”，   “哦知道了”。,<王语妍001>: 这个爸爸负责任[嘻嘻][嘻嘻][嘻嘻],<古典鎮_keni>: 这狗粮 洒得 猝不及防 ！！！,<吃完就发飙的混沌化身>: [笑而不语]请加上双引号,<黔驴9527>: 该死的墙！[哈哈][笑cry][允悲],<沐虎>: 连狗狗都开始秀恩爱了，还让单着的人情何以堪？,<下午茶everyday>: 有分寸的[嘻嘻],<阿雪knighting加拿大>: 唸错台词啦。该是：“ 为何世间良缘每多波折？爹妈不准我娶小黄说皮毛颜色不同～～～ 唉，苍天不许白头，情缘两相缺…… ” 阿雪江郎才尽了，你们继续上。[嘻嘻][嘻嘻][嘻嘻],<傅谋克>: 看不懂，求解。[微笑],<江山易改卐>: 连K律都撒狗粮了[泪]微博真的没法呆了,<原始部落之>: [哈哈][笑cry][赞][心][鲜花],<AaronWesley>: 关注你这么久，第一次想举报你[doge],<特殊观察员>: 呵呵，真是一对狗“男女”,<sjshfucjdje>: 还有一分钟，感觉可以做好多事情[doge],<Amigo少年>: 大律请说说我们到底要不要尽快兑换美金？,<我掩护你舍身炸碉堡>: 怕啥，先答应慢慢时间就越来越晚了,<OnlyLexus>: 美帝还要耍朋友啊？,<九斤-八两>: 移民美国需要取英文名字吗,<Emily8855>: 大律大半夜不睡觉在这里虐狗，举报你[小黄人坏笑][小黄人得意][小黄人不屑],<耶律邪>: 没事，7点前可以抽空偷偷来一发[喵喵],<RockyTheRookie>: 大律师有女友了[二哈]]
KevinOC	美国那些大法官是真牛逼，比起来，美国总统都是渣渣。 ​​​	[<孤山独不降>: 回复 @无边丝雨20 :怎么没有现实？这地球上又不是只有一个国家。这是根据因果和其他国家现实假设，华盛顿建立了第一个没有国王的国家。因果清晰。不过你对唯心判断、客观论证看着完全不同，就不聊了[拜拜],<香港理财规划师-海外资产配置>: 法官只管理法律问题，总统面对的太多问题，不能相提并论[微笑],<Hillaryhillaryhillary>: 一个就像经理，一个是思想家，president has to be practical,<无边丝雨20>: 回复 @孤山独不降 :额，你这话更唯心，现实是压根就没你说的也许。[思考],<A李锐Aa>: 追根溯源是美国的制度牛逼！,<One-Dey_275>: 前天有人盗你图了。我说水印怎么看着这么熟悉[并不简单],<芮营丶>: 诚信点配 股票期货配资 股票线上配资：提供1-10倍杠杆 1千元起配 手续费前两天一共：49元/万第三天起递延费18元/万 股票线下月配资：1.4％-1.5％月息提供1-8倍杠杆 每介绍一个客户可减免0.1%月息（4次封顶） 国内商品期货无息配资： 180元起做，7-30倍杠杆,<遍地小小草>: 你确定不是卖花赞花香?[笑而不语]// @长岛律师Kevin :在美国很少人会拿总统和大法官比，这些政客的智慧，重来都不能和大法官相提并论。[开心],<潘乃义>: 回复 @却已- :哦,<却已->: 回复 @潘乃义 :一是水平足够高，二是和政界有着联系,<却已->: 不是有种说法，一流的法学院毕业生很多都进入联邦司法系统，从Law clerk到地区法院法官再到上诉法院法官最后是最高法院大法官,<却已->: 回复 @散户中的大股东 :那你可想多了，沃伦法院做的那些事绝不是一个总统能做出的，总统需要平衡各方利益，而大法官更是从Justice出发去判断问题,<却已->: 回复 @天地无限2008 :也不是没有过，William O Douglas曾经在任上参加过党内的初选,<潘乃义>: 成为大法官有何必要条件，K律有戏吗？,<cbc圈圈>: 这是鄙视链中一段么？[黑线]总统干得好有青史留名的机会也算平衡了,<Janelle1900>: 回复 @条筒万字 :川普不就骂了吗[挖鼻],<歪嘴先圣>: 怎么总统又是渣渣了！[哈哈][哈哈][哈哈]不是说人人平等吗！// @长岛律师Kevin :在美国很少人会拿总统和大法官比，这些政客的智慧，重来都不能和大法官相提并论。[开心],<New黄>: // @长岛律师Kevin :在美国很少人会拿总统和大法官比，这些政客的智慧，重来都不能和大法官相提并论。[开心],<Nine_Road>: 一个法治社会，法律的执行者是精英，才能保障，不管你政府的执行者或是精明或者愚蠢，它都可能带领一个国家走向天堂或者遁入地狱，因为法律在那里，不左不右，你见或者不见，它就在那里。,<走哪说哪>: 都是渣渣的总统通过非民主的方式选择了真牛逼的大法官。// @长岛律师Kevin :在美国很少人会拿总统和大法官比，这些政客的智慧，重来都不能和大法官相提并论。[开心],<Zeratu_的责任>: 回复 @散户中的大股东 :总统提名，国会任命！,<昵称好难-想好又被抢>: 在美国很多人都能骂总统，但是从没有人骂大法官。,<古典鎮_keni>: 回覆 @楊泰羽 :能不能细细说一说？孙中山先生的,<ch天下草民>: 回复 @江河衛 :周大法官语出惊人。但我认为那是一种无奈的反抗，只是道出真相而已。,<古典鎮_keni>: K律，希望有一天你坐大法官其中一个位置喔！[小黄人高兴 ],<蒙克儿在装睡>: 大法官恰恰是非民主产生的// @长岛律师Kevin :在美国很少人会拿总统和大法官比，这些政客的智慧，重来都不能和大法官相提并论。[开心],<路人费2017>: 这实在是扯过头了。开国时期的杰斐逊不能比马歇尔？20世纪两罗斯福不能比布兰代斯？克林顿当年离任时因为年纪还不大，很多人提议任命他进最高法院。希拉里也被认为是最高法院大法官的理想人选，只不过她自己不愿放弃白宫追求而已。美帝政法从来同出一源。,<安助的大西洋>: 大海航行靠舵手、火车跑得快全靠车头带！你们这么看扁总统，所以老走邪路！[二哈],<啸歌一曲>: 回复 @散户中的大股东 :总统四年走人，大法官可以到老死。,<李昌隆>: 起码不姓党。// @长岛律师Kevin :在美国很少人会拿总统和大法官比，这些政客的智慧，重来都不能和大法官相提并论。[开心],<叫啥都叫人给占鸟>: 法治社会，法律高于一切，法官当然会绝对受到尊重。人治社会，领导大于一切。法律怎么可能会受到尊重。,<晓月清风空间>: @孤山独不降  所以呢，你在看看你写的玩意，是不是左右不分,<1975往事随风>: 能做大法官的，一定是很了不起的人,<心却依旧>: 对美国文化不了解，为什么政客的智慧不能跟法官相提并论？,<农夫与蛇现实版>: 政客的智慧，从来都不能和大法官相提并论的。林肯、丘吉尔、]默克尔 [二哈]  // @长岛律师Kevin : 在美国很少人会拿总统和大法官比，这些政客的智慧，重来都不能和大法官相提并论。,<孤山独不降>: 回复 @晓月清风空间 :你把国内分法当成美帝了吧，基础太低，就不和你聊了[拜拜],<morphcn>: 回复 @天地无限2008 :法官参与知识竞争，维护天道。总统参与民主竞争，追求人情。,<散户中的大股东>: 回复 @csl寻找无双 :你觉得我国的红色精英法官如何,<晓月清风空间>: 这玩意也有客观标准了？,<晓月清风空间>: 回复 @孤山独不降 :你左右都分不清。,<Iwatching>: // @长岛律师Kevin :在美国很少人会拿总统和大法官比，这些政客的智慧，重来都不能和大法官相提并论。[开心],<心然XR_>: 请问：美是判例法国家，三权分立是哪三权？,<csl寻找无双>: 回复 @散户中的大股东 :没有一种不偏不倚完全客观中立的机制，用选票选出大法官就不会出偏差？有资格被总统提名的大法官水平都很高了，否则怎么有公信力呢，这是从精英里面挑精英，不适合用民选的方法,<ZYOUNGOR>: K律早啊[哆啦A梦微笑],<井井Nick>: 从来 @长岛律师Kevin,<還諟莪--友友>: 这可是赤裸裸的乳滑哦，小粉红们在哪？[哈哈][哈哈][哈哈],<旧时月色213>: 是个人都能做美帝的大统领，可不是什么人都能做大法官[二哈],<孤山独不降>: 回复 @孤山独不降 :点开一看 @肖星司  原来是个水军[挖鼻],<孤山独不降>: 回复 @肖星司 :你装逼之前先提高阅读能力，看清楚原帖。一、原帖是总统和政治家，回帖这里的总统显然是个代表政客集团。二、写的清清楚楚，没有大法官和科学家，表明表达的是对比。富兰克林以政治家为主、汉密尔顿更是职业政治家，有什么问题？,<散户中的大股东>: 回复 @长岛律师Kevin :始终认为没人能比几千万张选票选出来的总统相提并论。,<肖星司>: 回复 @孤山独不降 :10美元的头像不是总统，100美元的头像不是总统。你装逼前能不能先查查？,<散户中的大股东>: 回复 @长岛律师Kevin :又不是打官司，我故意不说清楚的。但总统能影响大法官人选，但大法官不能影响总统人选。跟律师说话好累[哈哈],<楊泰羽>: 其实孙中山先生早就搞过五权分立了，比美国三权分立更为先进,<裕子拼布手作小屋>: 回复 @ocnn2011 :没有谁高谁低哪个更难、对法官的要求是公平正义、对总统的要求是为人民服务！,<溪涧花朵>: 如果希拉利当选就不一样了！！]
