kikikang725	一张自拍哦。[嘻嘻] ​​​	[<kikikang康倩雯>: 回复 @KikikangForFun :必须出,<碧君啊>: 美美美   感觉很清爽   夏天的感觉[微风][微风][微风],<Fppppyki>: 一张不够吧[嘻嘻],<辛道夫>: 美就一个字 我要说很多次,<KikikangForFun>: 就问一句！ 这么美的衣服，出不出！[色],<Vipkitty小龙妮>: 好美的嘞[好爱哦][好爱哦][好爱哦][好爱哦][好爱哦][好爱哦][好爱哦],<善卿不酷>: kiki啊[兔子],<二痣美少女>: 这样的自拍请多发一些[干杯]]
kikikang725	给自己放了一天假。🛏️ ​​​	[<Baebae_张>: 猴看[舔屏] 小图把你看成了kiko [允悲]  ,<请叫我兔子小姐-->: 美kiki～[鲜花],<火乐wu>: 胸，挤一挤还是会有的[哈哈],<啦啦啦啦啦啦我是一个小画家>: 右边的袋子拧巴了，话说穿起来应该很麻烦吧，不过超美啊,<shanchow33>: 我靠，美炸了[色],<麻仓CC>: 卧槽，我ki太美,<-------pure>: 图已拿走[偷笑],<蜡笔小莉爱吃辣>: 锁骨可以说是美的不得了了,<mandy森的日常>: 美呆[二哈][二哈],<王二小-王静>: 我也要这个内衣！,<宋逗逗a>: 美ki[馋嘴][馋嘴][馋嘴],<别逗了呃>: 哎呀呀啧啧[憧憬],<花溢是爱五月天会的第一大会员>: 啊啊啊啊啊美死我啦！,<于傲兰>: 魔鬼[抓狂][抓狂][憧憬][舔屏],<Vipkitty小龙妮>: 好美啊 就喜欢这种有独特美的,<-青山已碎燕子空回->: 羡慕你们平胸的小仙女，这么穿都不会显得色情[允悲][允悲][允悲][允悲],<ZOEWAN->: KIKI QUEEN[心],<77SSeevveenn77>: 有种美炸的感觉。,<2姐louder>: 芒了注意身体……女神,<小懒_Satoko>: 我的kiki啊 ！！盛世美颜,<2姐louder>: (⊙o⊙)哇[色][色][色][色],<前世泼猴ccc>: 身体是革命的本钱[doge][doge][doge]]
kikikang725	遇到Line就忍不住卖个萌[兔子][青蛙][熊] ​​​	[<晨lemon曦>: 图二的kiki和cony都好可爱,<-Fragile->: [鲜花][鲜花][鲜花],<Fppppyki>: 何止遇到lien才卖萌，啥时候不卖萌啦[坏笑][坏笑],<Vipkitty小龙妮>: 好高级的萌啊 可爱中带着酷酷的,<水果味软糖12>: 本来是第八个   。。第十个[脸红][脸红]但是kiki好看到爆啊,<大长腿脑残粉哈哈哈>: 啊啊啊啊啊是在湖滨银泰嘛,<二痣美少女>: 是我喜欢的kiki,<榆木苑痴>: 啊啊啊啊啊啊可爱死了,<Mmhare呆萌萌>: 回复 @LinRyBaby_ :嘤嘤嘤,<LinRyBaby_>: 可爱吖[憧憬][憧憬]]
kikikang725	本宝宝要把食堂规模扩大到杭州，有好吃的餐厅请发。[作揖][馋嘴] ​​​	[<食草丫头>: 我能说我超爱杭州的便利店吗[眼泪][眼泪]全家的便当，罗森的冰皮，简直不要太好吃😋,<土豆你个偷馒头>: 捞王啊！牛焱啊.！,<Fppppyki>: 回复 @kikikang康倩雯 :[抱抱][抱抱]我也是[太开心]   但是我真的吃不出鱼腥味[摊手],<kikikang康倩雯>: 一大波吃货来袭了，说得我都饿了[允悲],<kikikang康倩雯>: 回复 @Fppppyki :宝宝我是吃折耳根长大的[耶],<Fppppyki>: 回复 @Vernkle :[开心] [开心] 都好吃都好吃[馋嘴],<Vernkle>: 回复 @Fppppyki :有点像韩餐里的老式拌饭[doge],<HZ冰淇淋>: in77、嘉里中心，好多好吃的😋,<王木皛>: 你来合肥啊~ [害羞],<Fppppyki>: 荷包蛋煎到两面金黄后倒醋和酱油量根据自己口味，可以多放点醋酸酸的！（不是白醋）真的不是黑暗料理，我们这边都这么吃的，剩下的汁拌饭超级棒！,<Grieved郑成蓉>: 哼，竟然不是我们的大成都，宝宝不开森了,<她很妩媚吖>: 带上我家皓月少年你家闺女[嘻嘻]保证啥都好吃哈哈哈哈,<草莓酱将>: 杭州下沙全是美食 还有网红欢牛[坏笑]带你吃！,<Fppppyki>: 要不要试试折耳根（鱼腥草）用老干妈 醋 香菜拌匀超级好吃，吃剩的留到第二天更好吃！！不过好像大多数人接受不了[允悲][允悲],<Fppppyki>: 吃。。工作。。吃。。工作。。睡觉。。吃,<KumiDing丁凝>: 要做美食kol，借着工作满足私欲[思考][偷笑][偷笑][偷笑],<TimWu_0318>: 还有安缦法云的蒸菜馆和兰轩,<葡萄味SylviA>: 还有还有，新开的国大广场的sayang真蓝 娘惹餐厅、来福士的真豚猪扒专门店,<葡萄味SylviA>: 双牛大厦对面的康儿面馆 猪肝拌川超好吃[憧憬],<TimWu_0318>: 桂语山房的素食，鹈鹕野餐的意大利土菜，mamala的西餐，良心推荐,<嚣张的狗王>: 弄堂里 杭帮菜[doge],<我叫王什么->: 重庆火锅 重庆的随便什么都好吃,<会流泪的红烧肉>: 点都德，陈添记，南信甜品。算小吃类吧[笑cry],<i优米>: 羊肉米线不爱了吗]
kikikang725	彩色的半丸子头，配这个夏天正正好。[憧憬][憧憬][憧憬]@HeadCouture ​​​	[<mh孟晗>: 我也前几天染了这个 我给他取名动物世界,<A1nro>: 我ki不管啥颜色啥发型都美,<嗨萝卜卜>: 还是看人[允悲]这么多色简直太难hold住了,<嗨萝卜卜>: [允悲][允悲][允悲]漂不动的染起来，第二张满满的叛逆少女感,<ki二宝>: 回复 @kikikang康倩雯 :好美的Kiki[哆啦A梦微笑][哆啦A梦微笑],<HeadCouture>: 康超模 的新发色 By HEAD COUTURE [心],<RoSy2333>: 回复 @玛卡瑞纳llyy :你是认真的？,<留胡子中>: 这。。真的看人。。。换成我那整个就是乡村非主流啊[允悲],<kikikang康倩雯>: 回复 @麻仓CC :没忍住啊[憧憬],<kikikang康倩雯>: 回复 @ki二宝 :Dior气垫,<shefang950823>: 啊！而我又想染发了！,<窦伱丸>: @LinoMino_,<麻仓CC>: 我ki又去染头发了[二哈][二哈],<M_Justlikeyou>: 刚把长发剪短 和你一样的发型哈哈哈 @kikikang康倩雯   [挤眼],<初众cz>: 昨天刚剪了差不多的头型 开心[太开心],<辛道夫>: 除了好看我都不知道说啥,<玛卡瑞纳llyy>: 不好意思，我第一个想到鸡毛掸子,<西葫呓>: 啊啊啊啊啊啊啊 爱你[爱心]]
kikikang725	做你说过的，说你能做的。 ​​​	[<最爱满脸笑容的姝2啊>: 腿是怎么做到这么细的 [笑cry],<麻仓CC>: 我们最简单，爱你就行[胜利]️,<_李嗯嗯>: 容易說 但是做到很難,<张闫敏敏>: 那就睡觉 晚安[飞吻],<想嘎>: kiki今天肯定看了网易有道词典[笑cry],<张衡SVIP>: KiKi 好美 [爱你],<kikikang康倩雯>: 回复 @_杨子贤_ :哟～大柳子～[可爱],<嗨萝卜卜>: 回复 @_杨子贤_ :活的柳哥(ಡωಡ),<aoyici嫱>: 这腿，能锯一半给我么[憧憬],<lyricsla>: 好久没看全身照 都忘了你这么高了[允悲],<kira瑾>: [思考][思考][思考][思考],<于小六小姐>: 怎么穿怎么美，爱你kiki,<榢樖>: 喜欢你的裙子咋办,<迷失沫忘>: kiki在哪里？成都欢迎你,<超凡钢铁猫>: 会理人的小骄傲[good][心],<我是熙熙妹妹啊>: Kiki最美，天气太热，一起撸串喝啤酒，约不？[阴险]]
kikikang725	端午安康#端午怎么过# ​​​	[<桃花树上卧只猫_>: 去给我我外婆过了个生日。去蓝莓园摘了蓝莓[笑而不语]还挺丰富的,<www菌厄>: 嗯嗯嗯，安康安康,<竜児Ryuji>: 终于看到一个说安康不说快乐的了！！kiki！,<芭扬>: 爱我kiki[心],<麤的鹿的鹿的鹿的鹿>: 我是第一个！！！！！最近才把爱上超模第一季看完]
kikikang725	“自己说自己是美厨娘” ​​​	[<麻仓CC>: 前一秒还捧着花，后一秒就戴上厨师手套了,<__Azura6994>: 胳膊怎么了？？？保护好自己啊~,<囧大高个三岁>: 确实也是[喵喵],<就欧元方法>: 回复 @一个可以绕地球三圈的香飘飘 :我也想问,<2姐louder>: 哈哈哈、最美最美的、,<张璪婍>: 美美美。[飞吻][飞吻][飞吻],<肥雷的大哥大>: 人美又贤惠[心],<舞吟llina>: Kiki，我今天也在吃燒烤哦，你要不要嚐嚐[馋嘴],<一个可以绕地球三圈的香飘飘>: 美美哒小姐姐是怎么保持体重的啊……宝宝对于身材很苦恼啊……,<烦人的小乐乐w>: 想吃肉和那个大玉米,<包包包小俊>: 本来就很美丫[爱你],<丢某的铲屎官>: 是的是的是的，对对对,<VG辅助一姐>: 你就是最美嘛！[心][心][爱你],<曹晓菲菲>: 你本来就很美[爱你][爱你]]
kikikang725	想念两年前和你们一起上学的那段日子，今天终于陪你们毕业了，青春正好！#我去上学啦# ​​​	[<许夏児>: 他们都毕业了，以前追的……喜欢kiki，真的很喜欢,<Dvlan->: 姐姐真美[憧憬],<Desse_文文需要小太阳>: 回复 @猫懋- :我去上学啦 爱奇艺播放,<Fppppyki>: 两年前我还在初三，看到超模超级喜欢ki妈，开始追超模，追上学了。现在高二了，超模已经三季了，上学了第一季的学生们都毕业了。两年好快。,<Fppppyki>: 当时看节目的时候ki妈镜头超少，于是我就又跑去看超模了。,<Fppppyki>: 暖心ki和谁拍都蹲[爱你],<猫懋->: 回复 @Desse_文文需要小太阳 :什么节目？,<每天只要上晋就好>: 好羡慕他们啊。。可以跟我的名模拍毕业照,<燕燕_豆子>: 回复 @海洋饼干Sophie :是的，我是忠粉，一眼就看出来了,<那就叫李能能呀>: [哈哈][哈哈][哈哈][哈哈][哈哈][哈哈]让年级主任头疼死了。戴假发的kiki[憧憬],<一半现实一半假文艺>: 原来你一直关注他们，而且还和他们拍毕业照，好幸福,<Peacefulgirl>: kiki原来你一直都在。[心][心][心],<没干嘛-发呆呢>: ki看起来也是高中毕业，吼吼,<犹疑xx>: 很好的，。小姐姐美,<请叫我天神大人>: 好看又善良的小姐姐呀，原来你一直跟他们有联系呀[心],<Ray锐锐锐>: 也是从那个节目知道你  一个好温暖的姑娘  祝好~,<Ray锐锐锐>: 也是从那个节目知道你  一个好温暖的姑娘  祝好,<麻仓CC>: 我ki太贴心[泪][泪],<陈熙蕾910>: 看见你的笑容，就能感觉到满满的正能量。[强][强][强],<嗨萝卜卜>: 第一张好暖嘤嘤嘤[羞嗒嗒][羞嗒嗒][羞嗒嗒],<果糖点心_>: 哇时间过得好快……他们都毕业了,<扯淡的小雪>: 那是姚舜禹吗？他怎么变那么瘦啊。感觉selina也认不出来他了[哈哈][哈哈][哈哈][哈哈],<EEEchoecho>: 对啊，我也是看到了～,<-许许许你欢颜>: 怎么怎么就是这么喜欢你呀,<-许许许你欢颜>: 小姐姐你好暖心哟,<就欧元方法>: 哇，虽然我不是这里的学生，但也觉得很感动,<大姜啊->: @EEEchoecho    觉得有点暖,<影子会褪色吗>: 大概你是唯一一个吧 KIKI,<kikikang康倩雯全球粉丝后援会>: 一直记在[爱心]️里,<ChuengZ>: 暖心姐姐~KIKI[心],<一只人格精神皆分裂的元气猪>: 建平狗看了表示好感动 节目拍的时候早就毕业了 sad,<呼叫黄大侠>: 是同学吗？不会吧。。。。。,<杨姜先生>: 真好[心][心][心],<桃花树上卧只猫_>: 两年啦，好暖，还回去了[悲伤][悲伤][悲伤],<炸雞拔>: 好感人[悲伤]节目完了之后还回去一起拍毕业照,<悦诗风Sun>: 真是一段美好的回忆,<張纸虫虫>: kiki你好有爱啊啊啊,<2姐louder>: 甜甜的、两年了……好快.,<Desse_文文需要小太阳>: 就是因为KIKI上了那个节目才一直关注的[爱你]我ki好暖呀,<我是一只美美的娜娜>: 你真的好暖啊⭐️,<峰驼驼驼驼提>: 原来一直都在关注他们 好暖[心],<肥雷的大哥大>: 好美啊啊啊啊啊啊,<Ruby-IL>: 又是一年毕业季  原来你一直都心系着他们呐 好幸运[兔子][心],<bhuudhbsnj>: kk好暖啊啊[心],<张闫敏敏>: 个个都是大长腿[摊手],<向下个目标冲刺>: [鲜花][鲜花][鲜花][鲜花],<嗯一个万万>: kiki好美哈哈哈哈,<屁歪乐>: [爱你][爱你][爱你][爱你][爱你][爱你]]
kikikang725	爱是藏不住的，闭上嘴巴，眼睛也会说出来。#520表白日# ​​​	[<楼兰姑娘Y>: 女神520快乐 爱你[爱心]️,<我是熙熙妹妹啊>: 夸你漂亮不许骄傲啊[笑而不语],<Lllhoneyheart>: 好好看[喵喵][憧憬],<爱在金大川>: 有一句话，就算我闭上嘴巴，也会从眼睛里流出来,<不是玲妹妹>: sexy的kiki]
kikikang725	Love Off-white [心]@offwhite官博 @韩火火 @Fil小白 ​​​	[<烤肉不加葱>: 确定这是官博？？经常发一些卖假货的复刻。。,<没人疼没人爱的大妍子>: 美美哒！喜欢你身上的那种态度[鲜花],<伍珈汝>: Ki妈好美啊啊[心],<橘子汽水橘子汽水>: 超级喜欢你[亲亲][亲亲][亲亲]很美啊，未来的超模[亲亲][亲亲][亲亲]]
kikikang725	手牵手，好朋友。 ​​​	[<鱼可爱耶>: 超级喜欢裙子[心],<WLJ爆了>: 两个衣架子，超美,<WLJ爆了>: 好可爱啊，嘿嘿嘿,<赤脚大仙-yu>: 好感觉，慎人[笑而不语],<Vernkle>: 精致得像个假人[心],<小懒_Satoko>: 是不是很贵 根本买不起的那种呢,<IIIIII_RIS>: 这一套好好看啊 Kiki求同款,<陈弗来Frank>: 都是模特[偷笑],<对不起您的电话已暂停服务>: 学士服[笑cry],<www菌厄>: 求同款，想成为好朋友,<By_kristal>: 行走的衣架[羞嗒嗒][羞嗒嗒],<这是一个辨识度不高的名字>: [鲜花][鲜花][鲜花][鲜花]美美美么么哒]
kikikang725	生活就是这样，让你伤心也会给你甜。 ​​​	[<吕婷婷say>: KIKI你就说你是不是胖了 感觉手臂有点粗咯,<Charlotte自画像>: 无条件点赞 想经常看到你,<西伯利亚小魔女>: 怎么保持身材啊 kiki,<苍井文>: 女神，你瘦了吗，,<JunkoChan>: 看到滚叔拍的你 高级美,<Unzu_C>: 回复 @就欧元方法 :超级好看  http://t.cn/RaYxQqi,<小张杜帅>: 我酷酷的女神好美呀[鲜花],<就欧元方法>: 回复 @Unzu_C :因为你这句话，我去他街拍里翻了好久,<阿小狸___>: 常以为人是一种容器，盛着快乐，盛着悲哀。但人不是容器，人是导管，快乐流过，悲哀也流过。,<Blissyi_>: 街拍对不[喵喵]哈哈哈,<炉小姐>: 伤心是有，哪儿甜呢,<-简单点儿->: 你给的全是甜[污],<乙温专家>: 最美Kiki 滚叔那里看到你的 路转粉,<盏AA>: 这句话忽然给了我勇气,<Wendy_yyyyy>: 区别在于先苦后甜还是先甜后苦，能不能挺过苦,<叫我年纪大阿姨>: 昨天在滚叔这里看到你了！,<MJ-小可>: 森活就是这样，各种起起落落落落落落落落落落落落落落落落落落落落落落落落落落落…[二哈],<一只白官微>: 没有人问[裙子]链接么 @kikikang康倩雯,<吃了这只芒果妹>: 看到滚叔拍你就是这身,<五月色的浅安>: 多吃甜点心情好到爆,<superiiiiiivy>: 你回复我生活就甜了女神哈哈哈,<虎牙晓女侠>: 杭州欢迎美ki[污][污],<檾倬>: 一张很高级很高级的脸～[爱你],<带刺儿的仙人掌015>: 好漂亮，加油，照顾好自己,<在下一个路口相会98353>: 我家kiki美成这样 ，别人怎么活。瘦虽美，但不要过了哦（好像把身材和kiki换一下，嘻嘻嘻[偷乐]) @kikikang康倩雯,<嗨萝卜卜>: 希望ki麻忧伤也有人替你分担[抱抱],<啊黑布隆咚>: 黑凤梨[太开心],<Unzu_C>: 看到你出现在了滚叔街拍 多多参加一些活动吧 这样就能经常看到你了 [鲜花],<笨清笨果笨子>: 长好了一点我的kiki,<壳壳久点零>: 杭州欢迎你～美丽Ki,<是milkmilk啊>: kiki在滚叔的微博上看见你了，就是这套呢[害羞],<今天你运动了>: 但你终究就是美[爱你],<ANTIHANNA-R>: 是不是要奔三了呀？,<戴着围巾也不温暖>: [鲜花][鲜花],<喜从天降gg>: 这女的是谁好熟悉的感觉,<高老师的小丫头>: 给你一个大熊抱[抱抱],<我不是网红我是网管-NewVision>: 无论你是什么模样，都爱你,<高老师的小丫头>: 实话就是这样有开心也有伤心[可爱][可爱]不过你要开心哦[抱抱][抱抱],<离散不连续>: 兜兜转转 皆是轮回,<二痣美少女>: kiki就是我的小甜甜[抱抱]]
kikikang725	最近睡得少，口红真是一秒变好气色[耶] ​​​	[<小阳HERO>: 身上的体恤好好看,<杭州泰勒>: 坐标杭州来偶遇[费解],<我是熙熙妹妹啊>: 今天第一次涂口红[口红]，都夸我好看,<小肚子和小兔子>: 是我ki涂才好看！！！[心][羞嗒嗒][好喜欢],<thatjoy>: ki宝耳环好好看喔[兔子],<刘小可asl>: 这个颜色真的好难驾驭啊,<嗨萝卜卜>: 喔喔喔喔好看好看！！！！[羞嗒嗒][羞嗒嗒][羞嗒嗒][羞嗒嗒][羞嗒嗒],<www菌厄>: 可是属于手残党的我，涂不好口红，女神求教,<Grayssss>: 要多发微博呀么么哒,<cc倩比>: 是呀！还是要涂点口红,<小花Tin厅>: 回复 @kikikang康倩雯 :康康，我好喜欢你,<Fppppyki>: 多睡会儿吧，身体要紧[挖鼻],<北城么么哒>: 哈哈哈哈，竟然是第二个赞的,<御姐控的nini>: 回复 @小花Tin厅 :就喜欢天天发自拍的[爱你],<kikikang康倩雯>: 回复 @小花Tin厅 :我经常发呀,<御姐控的nini>: 回复 @御姐控的nini :前排,<小花Tin厅>: 你好久不发微博了,<miss沐春风>: 性感小嘴唇！颜色好看！,<碧君啊>: 美美美[二哈][二哈][二哈]]
kikikang725	换了一顶白色棒球帽。[酷]#A day with Kiki# ​​​	[<卫Mia>: 哇！这个锁骨我给满分！！！[鼓掌][鼓掌],<跳舞的鹿晗最帅>: 微信头像更换速度 就看你更图速度了[摊手],<嗨萝卜卜>: 萝：[羞嗒嗒][羞嗒嗒][羞嗒嗒]哎呀好好看我也要去买ki麻同款戴！,<怼怼和怂怂>: @提灯看刺刀之薄凉,<王WANGShUAI丿>: 美的一团糟[花痴][花痴]好喜欢你呢。,<R--Lieekun>: 裙子好好看！想知道哪里买[憧憬][憧憬][憧憬][憧憬][憧憬][憧憬][憧憬][憧憬][憧憬][憧憬][憧憬][憧憬][憧憬],<神探阿远远>: 哈哈哈这个帽子的颜色组合感觉和Stan Smit绝配～]
kikikang725	吸了那么多颜色的粉er，满意了[可爱]️[走路]‍♀️🏅#TheColorRun杭州# ​​​	[<Ly_咩咩洋>: 彩虹跑哎KIKI,<一颗绝望的胖子>: 今天也看到你了！！不敢靠近你！小粉丝一枚！,<杨浪浪020>: [摊手]我以为最后一张嘴里吃的巧克力,<X--nine>: 我朋友去的公司说要她取个英文名字。。。这个臭表脸的，看见我每天说我女神KIKI怎么了怎么了。。然后，她现在叫KIKI了，好气啊,<嗨萝卜卜>: 回复 @嗨萝卜卜 :(ಡωಡ) ki麻有舌钉好酷哒，想知道ki麻又没有纹身,<嗨萝卜卜>: 回复 @少女有只狼 :(ಡωಡ) 对呀好酷,<嗨萝卜卜>: 第一张自拍嗷嗷嗷超级活力好看！！！ki麻麻多发这样的呦[噢耶][噢耶][噢耶][噢耶][噢耶][噢耶],<一只陈傲天>: 我今天看到这个袜子就觉得很炫酷,<二二殷>: 看朋友圈刷屏这场活动原来你也在,<_LIquorrrrrr>: 我错过了一场与女神的邂逅……[泪]真的难受[大哭],<Nat-w>: 好看到爆🙈[眼泪],<SOYUEJIANG>: 今天我也去跑了[haha]全身洒满粉回来,<aiyanna_嘉熠>: 看着就燃爆了！好想去！,<不必B>: @过儿--Yuki   这个 想去,<-TAMMYMMAT->: kiki舌钉好疼的样子,<花小花yk>: 去染蓝色头发吧 美,<二青鱼>: 第五张好美，如少女般的kk，之前看过《我爱超模》喜欢你的故事美。[好喜欢][赞],<白羊你爱谁>: 大长腿大长腿[污][污][污],<Ring小宝>: 好久不见，你更美了[喵喵],<Masmasone>: 回复 @Summer_熊猫大侠 :哇KIKI好好[爱你],<主持人雪莲>: 你真的超级好看啊～好喜欢你,<赵杰ACzar>: 好巧，今天我也在[二哈],<曹二狗丶>: 哈哈哈  吸粉狂🙄,<kangkanglove>: 大长腿  啥时候来成都啊,<干大饼>: 哈哈，今天有看到你啊，大长腿很醒目,<今天你运动了>: Kiki你有舌钉？？？,<Fppppyki>: 回复 @kikikang康倩雯 :[污][ok][ok][来],<kikikang康倩雯>: 回复 @Fppppyki :来来来[可爱],<过来寻>: 还在杭州吗求偶遇合照[偷笑],<Fppppyki>: 明年高考完，来场偶遇把,<眉眼如初Leslie>: 是不是要翻一下我[可怜][可怜][可怜],<眉眼如初Leslie>: 哇  翻牌那么多,<water新微博>: 看到舌环耶[嘻嘻],<野生小黑兔_Lina>: 好美呀呀呀呀呀v，很想偶遇[二哈],<SUNCHENGLING>: kiki来重庆就好了[可怜][可怜],<kikikang康倩雯>: 回复 @ErLiu3 :[飞吻],<ErLiu3>: 遇到并且合了照[doge]好高好瘦美美美,<张二愣啊>: 哇塞！kiki！！！我也去了,<Doreen小姐爱世界>: 要是能有机会见到 @kikikang康倩雯  合影一张该多幸福，不过绝对不能拍半身照，那样我没法出现在画面里[笑cry],<kikikang康倩雯>: 回复 @Summer_熊猫大侠 :嗯嗯，最好穿丁字裤吧,<小Yu吖>: 回复 @kikikang康倩雯 :自己偷着乐呢吧,<刘可欣318>: 美得美得，翻牌子吧，妈妈，第一季最喜欢你[挤眼],<Summer_熊猫大侠>: 我想问，穿这种裤子是不是该穿丁字裤？,<汤圆是圆>: 果然  我kiki多发发动态还是有很多真爱粉的  [摊手],<汤圆是圆>: 最喜欢你这种颜好  身材好 腿长的[微笑]  最主要的是不要气质好  短发我就更爱[心],<韩弋yang->: 回复 @kikikang康倩雯 :我们这种一米七多的男生真的会自卑的[摊手],<Qiqi周>: 又重温了一遍爱上超模 还是最喜欢Ki,<有泥__>: @-故梦  想去,<露露大香泡儿_>: 回复 @kikikang康倩雯 :哈哈美就行了啊,<FannyUyin>: 第六个腿摆的也太好看了。现在还记得你在爱上超模的时候每一期硬照都好看的不得了！,<ESTER-C>: 彩虹跑感觉很棒耶,<素锦流年1117>: 不愧是超模 身材好棒呀[太开心][太开心],<kikikang康倩雯>: 回复 @露露大香泡儿_ :[笑cry]长那么高我也不想啊,<Vicky-Z_>: @Rox_tiger]
kikikang725	绿色是希望的颜色，夏天是马上要到来的晴天。#A day with Kiki##立夏# ​​​	[<向迪玉清老师恶势力低头>: KIKI我敲喜欢你的啊,<-此時心轉迷->: 你的身高都没掩盖了[悲伤],<小肚子和小兔子>: k你不准备告诉我们帽子的来历嘛[眼泪],<邓噔噔噔Xenia>: 立夏[太阳][太阳][太阳][太阳],<汤圆是圆>: 感觉kiki就和水原希子一样是那种越看越好看 越看越耐看的女孩儿  [心][心],<slqyWAUOO>: 我ki真是美得不行,<Xuuuuuu徐小贤>: [羞嗒嗒][污][色],<大怪咯>: 哇KIKI我第一 快翻我牌好嘛 爱上超模有你的都看,<嗨萝卜卜>: ki麻有种“嗷嗷这次没有食物道具好不开心好不开心”的感觉(ಡωಡ) [doge]]
kikikang725	如何捱过晚餐[兔子]#夏天到了# ​​​	[<trust-mx>: 运动比节食容易坚持[污]女神超美[心][心]~,<玉沛史>: 哈哈哈哈哈哈[二哈],<_LUOZIYUE>: @柠檬想要满满的回忆,<口口的相机>: 我吃了木瓜和香蕉[鼻涕],<一万小天使回来了>: 我ki怎么看都好看,<自然呆01>: 这平原一望无际呀,<张欢喜阿z>: 本来想熬过这个雨夜，可实在顶不住肚子的召唤，就果断跑寝室楼下买泡面和烤肠,<-许许许你欢颜>: 这个粉很好看诶 但你穿着更好看 我的Kiki妈,<爱吃肉肉的瘦瘦女>: kiki……加油,<古王月耑>: 穿这个颜色好好看,<kikikang康倩雯全球粉丝后援会>: 看你就够了[偷笑],<Maielen>: 赛克西~[好喜欢],<做个柠檬绿茶>: [舔屏][舔屏][舔屏],<Ponyyun>: 今天ki麻好粉嫩啊，晚餐[摊手]熬不过的，我今天已经吃了一份饭现在好饿[泪]坐等夜宵ing[污]减肥什么的！不存在的[泪],<我只是想改个名字_>: 昨天在新天地看到你啦[太开心],<余桉_>: 怎么才能瘦并且保持身材啊🤔🤔,<酒心w>: [太开心][太开心][太开心],<嘉欣candy18>: 内衣我喜欢，在哪买,<国民学委>: 暗搓搓的保存啊啊啊啊啊啊啊啊啊啊,<后海的鱼是鲸鱼>: 好瘦瘦啊[舔屏],<若紫飘兰87>: 看爱上超模认识你，现在每一次看到你依然有惊艳的感觉,<叁盐Salt>: KI妈越来越美了]
kikikang725	朋友都问我最近用了什么护肤品，我说把零食换成水果，把甜品换成燕窝就会越来越好啦[可爱] ​​​	[<kikikang康倩雯>: 回复 @这是一个辨识度不高的名字 :可以的，慢慢来嘛,<乱世佳人9233>: 怎样才能瘦下来？！哎,<这是一个辨识度不高的名字>: 零食[污][污][污][污]换一半可以么,<方方方贝勒>: @TONY青峰   那就……多吃水果,<小小洁洁洁儿>: 毕竟燕窝还是比较贵[笑cry],<王先生印尼燕窝>: 亲你好。需要燕窝来看看哦[嘻嘻][嘻嘻],<上海行动巴西柔术馆--李宁>: 这得把人名币的工资换成美金的工资才行吧[哈哈],<kikikang康倩雯>: 回复 @张昊玥_ :换成酸奶吧，牛奶配燕窝，酸奶饭后消食儿用[馋嘴]赶快来上海给你补生日餐,<TST金卡总代欢子>: 吃不起[哈哈][哈哈],<小Yu吖>: 很好吃的样子，晚上没有吃饭,<N能豆豆piano>: 吃不起[笑cry],<曾曾曾曾鱼肉yo>: 羊肉粉不能换[笑cry]]
