letvletv	弦月似弓，初心如磐。祝大家七夕快乐。 ​​​	[<超级挽>: 回复 @扈憾瞎 :就是就是，我哥买了都说挺好用的，,<QHH时代猫>: 看评论，我会PPT，是不是可以服务贾总[doge],<别对我说-永远永远>: 心如磐石王八吃秤砣铁了心下周不回国,<天涯过客wong>: 虽然如今处境不太好，但终不负有心人， @贾跃亭   ，一直挺你。,<_荷风四面>: 乐视电视会员还有大半年才到期，居然每次开机都提示续费。很大很显眼很无趣。也很招人厌。,<狮子榔头>: 什么时候回国？是个男人就赶紧回来，好歹还有100多个亿呢？说好的借给上市公司的呢？骗子,<慕金锡圭璧>: 弓强还是磐坚，拭目以待,<天河东井>: 支持乐视，支持你！,<钱多多滴滚来>: 从最初就不看好乐视，原因很简单产品不好。唯一拿的出手的乐视电视就产品质量和工业设计也很一般，主打的所谓内容生态，内容没见多少，广告到时一大堆,<用户5630641982>: 回复 @闫忠文 :今天你去舔贾了吗？,<情迷仲夏之夜>: 回复 @闫忠文 : 佩服,<laogao2080>: 小学语文没学好的货色，出来显摆文采，居然一堆人捧臭脚。弦月的弦从字形上已充分表达了似弓的含义，犯这种错误比错用凯旋而归更可笑。,<IT老S机>: 下周回国成传说，拿好绿卡别回国！,<Shenzhen-Cathy>: 能把供应商的钱还了吗？不还钱你说的话鬼都不信！,<老陈的大饼脸>: 回复 @孤芳自赏不染尘埃 :人家说拿钱救公司，结果只是说说而已…哈哈哈,<laogao2080>: 小学语文没学好的货色，出来显摆文采，居然一堆人捧臭脚。弦月的弦从字形上已充分表达了似弓的含义，犯这种错误比错用凯旋而归更可笑。,<浅沫p>: 现在假总造汽车，过段日子说不定假总就宣布了：咳咳，这个汽车嘛，我就主动辞职了，不过我会负责到底，接下来我要造飞机，嘿嘿，来吧，为了梦想窒息,<李有根>: 我家有两台乐视电视，怎么让两台电视用一个会员号？,<看远山如黛>: 回复 @闫忠文 :经营异常企业CEO @闫忠文  力挺乐视罪人贾跃亭，到处发文黑同性恋[吐][吐][吐][吐]评论区下对他不利的评论都删除 ​​​,<乐视客服团长>: 回复 @YING娜_ :您好~团长与您私信联系~,<YING娜_>: 手机坏了   客服没人接   [鄙视][鄙视][怒骂][怒骂][怒骂],<Bruceeeeeeeeeeeeeeeeeee>: 我钱都被你套住了，你七夕夯比了，我飞机都打不起了。,<SpeedU>: 欠债还钱 大骗子！！！！大忽悠！！！,<小盼199811>: 小贾子，千万别回国，你会被砍死的,<hezs123>: 回复 @后知一L一后觉 :估计你这辈子就这样了,<millerliu>: 回复 @闫忠文 :能把欠供应商的钱还了吗？人家也是创业，非常不容易。,<fafafafa2016>: J8贾 [有]️ 现叛逃在美国 居住在湾区的那个令狐 的消息吗 。。。全国人民都关心。。。19Da 后国民会好好招待你们。。。,<老杨爱讲冷笑话>: 我家的乐视没坏过，在心中,<李大本事OOHH>: 回复 @多马西陈瑞 :怎么说你呢,<阿亮阿亮阿亮阿亮>: 你当美国人傻子么 他们不知道你在国内干了什么丢人事儿？,<GFDGKP>: 高位套现、承诺给乐视无息借款期限不低于60个月、结果不到两年在乐视快揭不开锅、被追债倒闭时全部收回私人借款、讲故事做假账诱骗孙宏斌接盘、贾跃亭这一家子、谁还敢说你们不是骗子啊…呵呵。孙宏斌阴沟里翻船、哑巴吃黄连[开心],<莱切斯特pandan>: 你的脸皮之厚是马蓉的n倍,<用户6274498215>:  [lt切克闹]看微博里的视频，有惊喜!!!!!!!!!!!!!!!!!!!!!!!!!!!!!!!!!!!!![浮云],<Bright-J>: 我很支持贾总这个电动车的行业，未来一定有不错的前景。,<Sammckelven>: 回复 @HHHomers :假先生现在申请信托和绿卡，他以为他会没事，但是他不知道狗急了会跳墙，把人逼急了说不定他的债主会比较极端，作为公众人物，道德 信用还是要有的，这个都缺失，现在弄成烂摊子他选择逃跑可见他并不能成大事 法拉第也只是幌子，，后续更精彩,<Sammckelven>: 回复 @HHHomers :东哥，，我真心没有在他家买过东西，也不知道怎么评价他了，毕竟他目前没有做出离谱事情，自己不到他那个规模，思维逻辑都不一样，不过最近他的确有点蹭热度，董大妈做一线销售出生，那种干劲是有的，只是不适合玩资本市场，也不太适合玩新兴行业，格力手机是一次有点闹笑话的故事,<HHHomers>: 回复 @Sammckelven :只希望贾跃亭先救救那些需要救命钱的企业，人家以前把希望给了你，不能把绝望还给人家 个人信用程度的缺失怕是再也回不来，以后有困境怕是没人帮忙,<HHHomers>: 回复 @Sammckelven :马云以前挺好，但是目前更看好刘强东，某些能力也许他比马云差，但是他的企业文化真的很好，喜欢董明珠也是因为格力的品质和她的个人能力，她自己入股银隆其实也是在为她自己后面做打算，格力毕竟是国家队一份子，她稍微高调了,<mason_lin3458>: 回复 @多马西陈瑞 :评论里的水军们，我也想干这个，请问下怎么联系。,<Sammckelven>: 回复 @HHHomers :东哥就算了，也是蹭热度的哥，也有能力，但是和马云这个外星人比就差几十年的思维了，董大妈已经架空，她犯了一个致命错误是她没有创立自己公司，拼了老命甚至做到铁公无私地步为格力，最后被踢走,<Sammckelven>: 回复 @HHHomers :老孙真在想办法把盈利的板块运营再出售，老孙是做地产的，其他的副业应该只是后盾，毕竟现在国内地产泡沫逐渐增大 危险信号越来越强,<Sammckelven>: 回复 @HHHomers :对的，你算是看破了，毕竟很多小公司就那一百几十万资产还要养家糊口和还房贷车贷人工什么的，假哥保守估计身上现金流几十亿是有的，美国豪宅说是ff，那么ff公司主要股东和董事是他，明明是自己钱，当年史玉柱没钱时候坐在办公室任欠债主搬东西电脑什么的，没有离开过,<哦人丑就得多读书>: 回复 @闫忠文 :闫忠文，北京瞭望科技有限公司法人:①最高法公布失信人员②九起劳动诉讼起诉他。③因无法联糸企业劳动场所被北京市工商局列入企业异常名录。,<流觞如你>: 加油贾跃亭，一直支持你三年多了，你的每一次归来都是乐视的腾飞,<猫坐海边唱情歌>: 下周回国贾跃亭，商业奇才邓亚萍，悔创阿里帅马云，小挣一亿王健林，家境普通马化腾，莆田院长李彦宏，冰清玉洁苍井空，铁骨铮铮郭沫若，感情专一房事龙，寸土不让张学良，磁暴步兵杨永信，排队候车任正非，阿弥陀佛释永信,<差不多的先生_1993>: 回复 @王梓蒙Prince :垃圾,<亦又候>: 回复 @阿索夫ASUF :这么不要脸，颠倒黑白的，除了贾跃亭，还有你。,<山枝叶w>: 回复 @王梓蒙Prince :哈哈哈哈哈,<更多更多ty>: 回复 @m阿汤哥 :电动车做出来了也没用，做电动车的传统车企一堆，他外卡好看一点就得买呀，都不是傻子。要技术没技术，要硬件能力没硬件能力的，ppt不是核心竞争力。,<更多更多ty>: 回复 @m阿汤哥 :他那股份，估计他想的是，能有最好，不要也罢，反正套现了几百亿，不出现败家子，不激进投资，够他用十代了。,<更多更多ty>: 回复 @m阿汤哥 :王健林没钱贱卖万达，贾步师高位套现，先还自己4亿多（承诺借70亿，实际最多时不足30亿）不管供应商区区几千万,<qzuser0780的爱>: 弦月似弓，初心如磐。,<qzuser0780的爱>: 我很喜欢乐视，每一次都说不用乐视手机了，但是还是从乐1追到乐视max2现在不追乐3了因为感觉已经很够用了。每次都说换个风格的手机，但是但最终还是买了乐视，乐视虐我千百遍我待乐视如初恋，虽然初恋没有了，但是希望乐视就是初恋，保持最初的那种初心那种一往无前的心态。强者面对困难无所畏惧。,<大萌萌yoho>: 你先把我碎屏的破乐视手机给我退了。我是看你的在发布会上说怎么怎么好才买的。是你没走之前卖的。不找你找谁。还送在场明星一人一个。我估计人家早就尼玛扔了。家里保姆都不愿意用。脑残粉都给我闭嘴先！,<欧菲集装箱咖啡馆>: 杰克马悔创业，一无所有的王大大，下周回国的贾跃亭。中国企业圈的风尘往事。[哈哈][哈哈]]
letvletv	黑夜的存在是等待光去穿透，笃定前行。 ​​​	[<OD好名字>: 回复 @登峰boy :这图可爱,<OD好名字>: 回复 @清风徐来5277 :快播封的好，传播不良反应，影响青少年的三观。,<OD好名字>: 回复 @望气观人 :创业真的九死一生。,<OD好名字>: 回复 @听到风起时 :[笑cry][笑cry]可否一谈。,<嘟吡小牧>: 多少钱一辆?好期待[哈哈],<峰天下6353140305>: 贾总加油，铁杆粉丝，支持你！,<幺蛾子故事>: 小伙子，你会说嘞很么，咋不传销嘞,<ysbl423>: 法律不制裁贾跃亭算不算是纵容犯罪呢？,<开心就是福气1>: 不能量产，就是个车展概念车,<高宏亮的微博>: 回复 @wulin0837 :为什么不敢,<阑干的北斗>: 水军们加油，骗子速度回国领死,<困困特困呀>: 回复 @失之丶我必得 :你这个有困难就很有理可以拖欠别人的钱了……我还TM有困难就可以凌驾于道德之上了，二B一个。,<dongsinx6258>: 回复 @闫忠文 :蹭热点蹭的不错,<空谷幽兰aa66>: 那些睡在乐视大厦门口的供货商，他们的黑夜，不知道是怎样度过的？？？他们辛辛苦苦赚回来的的血汗钱血本无归。,<明熙的小日子>: 上帝保佑水瓶座[鼓掌],<vvvinVincent>: 你的水军真的牛逼。,<比比比豆>: 就这车也能叫做革命？你是来圈钱的吧?,<socketoomarch>: 在乐视网资金状况紧张的当下，乐视网偿还了贾跃亭和其姐姐贾跃芳260万元和4.3亿元的贷款。,<socketoomarch>: 恶心的骗子，欠供应商欠员工的钱不换，自己和姐姐的钱先从乐视拿走了。,<郝晓军456>: 回复 @某年某月某日已成回忆 :放屁真的不用花钱请你滚的远一点,<__卷毛>: 回复 @阳光刺痛俄双眸 :是吧，你呢,<阳光刺痛俄双眸>: 回复 @__卷毛 :厉害了我的哥，中山大学,<__卷毛>: 回复 @阳光刺痛俄双眸 :我问你念的是哪个大学,<阳光刺痛俄双眸>: 回复 @__卷毛 :就知道跟着乱喷的喷子,<远方的世界之路>: 人总有梦想，没有梦想就是一具行尸走肉，万一实现了呢！贾总加油！,<__卷毛>: 回复 @阳光刺痛俄双眸 :你念的哪个大学来着？,<阳光刺痛俄双眸>: 回复 @__卷毛 :一看你就没受过高等教育，没有脑子,<流沙河里寻流沙>: 很努力的做一件事已经够牛了，贾总，相信你肯定能挺过去,<拉拉拉拉拉拉111234>: 回复 @遇见有个小小的梦 :说这些有啥用，卖房啊借高利贷去买乐视股票啊,<土士土士士土土土士>: 钱已进兜，感觉良好,<失之丶我必得>: 回复 @清风徐来5277 :还你的快播，估计你都阳痿了，快成废人了！,<失之丶我必得>: 回复 @天瞳瞳 :不要评论别人的成败！换成是你，你是不是该去跳楼呢？难道一个企业家就不能有困难的时候？不能给别人一点时间？,<失之丶我必得>: 回复 @__卷毛 :别人支持就说水军，你不支持到来落井下石，能不能说:你是猴子请来的逗逼吗？,<天秤路过的云>: 这车还能跑么，快带回国内来看看,<眼光决定未来200603>: 风雨过后就会有彩虹![赞][赞][赞][赞][赞],<圆梦巨人->: 回复 @手机用户1779193223 :供应商的员工跟随的是供应商，和乐视合作是供应商选择，而且供应商的员工工资是供应商的事！供应商和乐视合作就应该知道干任何事情都可能发生风险！,<用户5285538360>: 回复 @威海YS造型龙辉 :由他狂妄就行了，我们拭目以待！,<__卷毛>: 回复 @阳光刺痛俄双眸 :关注74，粉丝16，又都是僵尸。水军你吃饱了吗今天,<手机用户1779193223>: 回复 @圆梦巨人- :欠供应商员工的钱叫投资选择，你老婆被别人日头戴绿帽怎么不叫外遇选择？,<阳光刺痛俄双眸>: 回复 @__卷毛 :你这人呀，呵呵,<5879923550柒柒>: 中文造诣我就服贾总,<hey2bai>: 乐视视频，几百年不更新VIP的好电影了，你们穷的买不起版权了是不是！！我TM充了2年的会员能退不！！！,<闫忠文>: 回复 @闫忠文- :从阅读写在乐视的今天一文：崇拜和唾弃贾跃亭的是同一拨... ” 一文读懂什么才是贼模贼样。点击自己看吧[汗]   http://t.cn/RCSlcTk [伤心],<折光2017>: 回复 @威海YS造型龙辉 :给我出个100万，我也冒险[开心],<折光2017>: 回复 @闫忠文- :[眼泪]看了闫的心灵鸡汤，真6，天津传销大学毕业的吧,<Ag__等>: 我一直相信你，希望我们都可以度过各自的难关！一定会的！[心],<圆梦巨人->: 回复 @天瞳瞳 :即使有很多家庭破产，那也是这些家庭的投资选择。本来就是有输有赢的东西被你讲的好像世界都是无辜的一样,<遊走在城市边缘->: 回覆 @面试学院 :把手机配件工厂改装成汽车工厂了吗？所以从4月起停止配送手机配件，也就是不再有手机售后服务。我说的没错吧，感觉我的乐视手机自动发热严重，随时可能爆炸 [傷心],<遊走在城市边缘->: 把手机配件工厂改装成汽车工厂了吗？所以从4月起停止配送手机配件，也就是不再有手机售后服务。我说的没错吧，感觉我的乐视手机自动发热严重，随时可能爆炸 [傷心],<毛按菁瑗>: 回复 @雨泽283 :如果你说的是真的，贾跃亭怕是药丸，我好像有点明白他为什么不敢回国了[斜眼],<用户5201920899>: 回复 @闫忠文- :乐视手机卡死没售后,<东风选混>: 回复 @闫忠文- :马屁精,<__卷毛>: 回复 @雨泽283 :又怎样？,<雨泽283>: 回复 @__卷毛 :贾跃亭的个人资产，包括乐视网上市体系以外的资产，有的在贬值有的在增值。老贾的抵押物是大于贷款的，招商银行提出财产保全申请，冻结了老贾的个人资产超过300亿，其中包括老贾的乐视网所有股份，要知道只是欠了招商10亿而已，也就说老贾 已经偿还了部分贷款，，，。。]
