makeuptips	涂抹口红技巧，你学会了吗？http://t.cn/Rw0jpoI ​​​	[<娜么美丽TST活酵母>: 可是这么干？真的好么？还是涂点唇膏吧,<西瓜tsama>: 那些说这肯定是上了遮瑕巴拉巴拉的！谁不知道上了遮瑕，关键肯定是嘴唇本身就干啊，上了遮瑕后更干！要是嘴唇润的话上了遮瑕还这么干除非她是把一整罐遮瑕都倒嘴上了[微笑],<网络一线牵珍惜这段缘呵>: 唇部遮暇了才好上浅色口红才能显色[doge][doge][doge]视频省去遮暇步骤你就不知道了还说人家嘴巴干啧啧啧真是捉急,<_小胖手>: 我给你寄个唇膏吧,<峡谷旋风少女>: 回复 @CrazyDoguh :没工具,<321_laughing>: 薄嘴唇才这么干，还是来问我怎么图吧哎，你这个厚嘴唇的人这么图直接可以吃人了,<萌萌的又有屁用>: @super祺祺呢,<YY是小猪>: 求唇膏牌子和色号啊,<Alan念念>: 什么牌子的口红？,<请叫我么么啾>: 这个是什么色号，挺好的,<DenuoDeNaNa>: 嘴部应该是以前遮瑕了 所以看起来干,<笨重绵软胖纸>: 这视频出现好多好多次了，虽然知道是艾斯柏的广告，我还是想吐槽。。。。嘴真的太干了,<啊咯味的兔纸>: 没涂之前嘴唇怎么这么白？,<Nerrey>: 回复 @穆紫敏 :哈哈，收藏了[哆啦A梦微笑][哆啦A梦微笑][哆啦A梦微笑]多谢多谢,<网瘾少女胖天真>: 嘴唇厚怎么办[doge],<Wang佳怡pureyi>: @车车车车车车车春,<小丸子儿2017开心哟>: 干成这样 涂个毛啊,<顺子日记>: 没觉得好，反而不适合日常，喝口水都不方便,<豆豆-豆er>: 好干哦……自带维嘉口语，哈哈哈,<Zz瘦不成闪电>: @间歇性-疯子t  好喜欢这个颜色,<你的甜菜>: @1只芒果子  嘴皮干到我都不能忍,<小小单身男诚>: 额，干成这样真的好化吗[笑cry]请先润唇吧[挖鼻]，还是喜欢 @教您如何去护肤   会耐心的教我，红血～丝一淡化了开森[心][爱你],<叫我闪电FLASH>: 这嘴唇看的我有点不疏忽。。。。,<券券券券券券券券券>: 不想看了就不看了好吗。说别人现眼，你自己有什么德行。看不惯就不看好了，看了非得说那么难听的话，干怎么了，涂完还是好看的啊,<小丸子的世界-017>: 我就纳闷了，这个干巴巴的嘴唇怎么老上热门，我不想再看到了好吗？,<娜80334>: 人家就是这种哑光的,<分享家demi>: 不是每个人都适合这么涂，像我们嘴唇厚的就很恐怖了这样,<罗小猫的猫>: 就他妈干成这鸟样还涂什么口红？？现眼[拜拜],<咪脒>: 干成这鸟样了就别出来丢人现眼了,<风筝人肉代购每月飞东大门>: 特么就喜欢干干的唇纹,<戏精学院小仙女>: 好多唇纹死皮。。。,<婧姐姐的爪机>: 比起口红，更需要一只润唇膏。,<yueyingchen不想说话>: 都是唇纹 干到不行,<对面刺客别抓我>: 这嘴唇干的我难受,<sakura最喜欢胡歌了>: 多喝水吧[微笑],<love羙亾計>: 什么牌子的几号色,<满眼是星晨>: 回复 @修羅20110623 :正解[作揖],<修炼中的修羅小姐>: 回复 @我在失眠的梦里想你 :然后你要有一只同色唇膏,<满眼是星晨>: 首先你要有一支唇膏笔[doge]]
makeuptips	实用化妆技巧，从脸到指甲到头发，一应俱全。 ​​​	[<薛茜雯>: @HJRongRong,<橙汁errr>: 回复 @cholingling :睫毛夹眼线的那个下次试一下,<__马悦>: 别的我都懂，可是把睫毛膏放胸里就能用了是什么梗[拜拜],<我不似从前幼稚>: 用睫毛夹画眼线那个 我书读得少[拜拜],<_孙文辉_>: 那个让头发看起来变长的厉害了,<搞笑短片分享靖>: 原来你们网红都是这样护肤的[最右][最右] @潮流护肤师  [心][心][心],<一只玻璃心的懒兔子>: 吹风机哪来那么多灰,<音黎儿的记事本>: 毫无含金量[doge],<漩涡暖暖luck>: 用睫毛夹做眼线的~我真的笑了~,<叨叨刘ada>: 8.12飞韩国  http://t.cn/RtL6wev,<峡谷旋风少女>: 回复 @CrazyDoguh :实用！,<EE要做小公举->: 一本正经的胡说八道,<手机用户16689234567>: [绿心][绿心][绿心]品味美衣推荐[向右][向右][向右] @uiien  快来看[绿叶][绿叶][绿叶][一箭穿心][一箭穿心][一箭穿心],<就是cho吖>: @哼---橙汁儿,<然然宝宝Eternal>: @水果没有保质期,<Ann-HM>: 蛮实用 收了[爱你],<EYE-YOUNG爱漾美瞳-柚子>: 感觉微博网友都超善良，刚看到一个评论简单五个字“我想上热门”，结果网友真的把他顶到了热门，当时我就感到了人性的光辉和友爱的力量，其实，我想对善良的微博网友说一句 “赞，我，送，美，瞳，[doge][doge]”,<萌萌的又有屁用>: @super祺祺呢,<昵称酱啊a>: 当你又瘦又好  钱包里都是自己努力赚来的钱的时候 你就会恍然大悟 哪有时间患得患失 哪有时间猜东猜西  你若盛开 蝴蝶自来 女孩子可以虚荣 但是你必须靠自己  看看她 @昵称酱欧尼  的逆袭路 跟着她改变生活,<嗨_LMF>: @一块特立独行的馒头,<和兴路小龙王>: @水嫩水嫩的水水水]
makeuptips	2016完整九大色系染发参考，你想要做哪一种？[来] ​​​	[<一米黑白>: 回复 @樱桃是小丸子的 :好看,<o-lnes美瞳贩卖馆>: 需要美瞳的点我[心][心][心],<我是晗哥啊>: @玉欣想要变成星星橙,<晋江阮零>: 回复 @临舟_ :最喜欢3，但怕hold不住,<Change_郭帅>: @Koreyoshi瑶啊瑶,<H-Volly>: 回复 @HuangshiQiiii :[阴险]好的,<H-Volly>: 回复 @HuangshiQiiii :[阴险]好的,<头痛脑热说不清>: 各种资源➕QWAS046 最新电影电视剧持续更新 各种英美剧 港剧 老九门 寒战等最新最新资源请私我[爱你],<HuangshiQiiii>: 回复 @TOERYES :照片上有点看不出来等哪天见真人吧[哈哈],<反正摩羯最酷>: @莫说话015   @依然有爱笑的眼睛,<D姐跑的超快>: 回复 @912同学 :艹[拜拜][拜拜][拜拜]我特么也觉得,<邢大起全宇宙粉丝后援会>: 回复 @D姐跑的超快 :是因为她们 长得 没头发 都好看[拜拜],<王贝依0pr>: @靠谱妞  用了一个月，十几年的逗斗君都滚蛋了，说真的，现在心情美美哒[可爱],<临舟_>: @无法直视的立早章精神病患者   2.3.7 纠结,<H-Volly>: 回复 @HuangshiQiiii :[阴险]不想发发照片,<齐齐亚>: 心心念念的薄藤啊 bucket list之一 [噢耶],<D姐跑的超快>: 回复 @912同学 :艹，就看着哪个，觉得 好好看，,<Lss姍>: @Boomerry   哪个颜色好看,<你有病么_BFX>: @SILENCE----920  蜂蜜茶也不错,<Luycky女神>: @fashion美肤达人   只用了两个月时间，把我多年的顽固性痘痘弄好了。炒鸡开森。[撒花][撒花],<HuangshiQiiii>: 回复 @TOERYES :我告诉你噢我心好痛我现在染的这色,<aMuxiao_>: 我真是醉了。。dh家的假发色板🙄,<懒哈哈z>: @名字起的长点就不会有重名了,<X酒香>: 图片评论  http://t.cn/Rthdq2a,<谢高玲说这不是我>: @谢高颖好想对他说yyl,<o-lnes美瞳贩卖馆>: 美瞳点我啦[兔子][兔子][兔子][兔子][兔子],<咕噜咕噜小曰文>: @等我qu个min  →_→,<能量守恒的999>: 谁知道蜂蜜茶那个发型叫什么？？？[可怜][可怜][可怜],<雎耳>: 淘宝：早时光。有漂亮的耳环  http://t.cn/RthB9GT,<冻豆腐君_>: 回复 @--无处安放i :我看到爱丽小屋新出了一个一次性染发的[思考],<PPPPPink阿>: @萌萌萌萌萌萌哒的我阿,<请叫我康大美>: @金牛菟厷孒lei  我染哪个？,<沈村民>: 打扰了 能不能看下我的微博 我家合法面积被个体开发商强拆了 宅基地合法证据 法院判决书我都po了 如果可以的话 能帮忙转发吗 谢谢 打扰了 尤其是我的新发的一个直播一个视频 不能写字怕屏蔽,<H-Volly>: @HuangshiQiiii,<一棵王智障啊>: 回复 @大雄的哆啦恶梦 :你觉得哪个好，我太黑了,<土豆君木嘛>: @Is大金   @孙哈哈a,<罗娜耶>: 回复 @常妮耶 :薄腾或者砂金怎么样,<木木-木头的木>: 回复 @生鲜小龙虾啊 :头发颜色也不行呐,<--无处安放i>: @董大褂_  都吼吼看啊,<一指西引>: 喜欢薄藤色，但是肤色不白，怕,<名取周七>: @Poetic_Life,<leleiris>: @fuzhaoyang,<__Reynard>: @L1Z1FAN-,<JACK小基>: 回复 @葭宝葭宝葭宝哇_ :我要哪种,<葭宝葭宝葭宝哇_>: @進撃的基基  发色发色,<李一冰在这儿呢>: @peerlessous  巧克力满分,<因为我是淅淅呀>: 第一个染过，后来就金黄金黄的了,<卖个美瞳真几把难>: 正品美瞳 七天完美售后 暑期活动多多 hatata0614,<木糖1200i>: 从来没有觉得染色头发的发质好。羡慕过发质好的只有黑色,<鞋上生了只喵>: 回复 @人丑就该多读书啊哇 :最后一个第二个图蛮好看,<一只小兮_>: @Linda-_--_-,<Luycky女神>: 说实话真没有什么实质性的效果，个人觉得还是 @fashion美肤达人  这个博主比较接地气，不管什么都会及时回复[亲一口][亲一口],<邢大起全宇宙粉丝后援会>: 回复 @D姐跑的超快 :记不住差别,<yyyYuc>: 回复 @余好懒 :我染好啦,<D姐跑的超快>: @912同学  哪个好看[微笑],<罗曼蒂克消亡掉>: 回复 @阿弥陀佛让我么么哒 :嗯～也不错～]
makeuptips	你会对哪一张表赞~？~ ​​​	[<_林七岁_>: 请问第一第二有什么区别[害羞],<社会你淸姐>: 11111111,<M佳佳佳佳_>: 4444444444444444444444444444444,<Hhh海狸海狸>: 1.4[doge][doge][doge],<树旁的草LOVE>: 1 虽然我话不多 但两人相比起来 我还是话多的,<5年去南方>: 还是第一张吧[失望]可是我比较喜欢话多的男孩子，因为不无聊。,<wCheryl_>: 最后一张是怎回事[惊讶]]
makeuptips	男人这辈子最值得自豪的一句话是：我老婆在家等我吃饭。转给那个还不知道的他 ​​​	[<迷失了夏天的蓝>: 回复 @在一个有海的城市安放青春 :才不是。。。,<在一个有海的城市安放青春>: 回复 @迷失了夏天的蓝 :我承认你，你承认我，然后才能获得法律的认同！[哈哈],<迷失了夏天的蓝>: 回复 @在一个有海的城市安放青春 :要是法律和道德都承认的唯一一个才算[懒得理你],<在一个有海的城市安放青春>: 回复 @迷失了夏天的蓝 :[爱你]我只有一个老婆，就是谢晓燕！ @迷失了夏天的蓝,<迷失了夏天的蓝>: 回复 @在一个有海的城市安放青春 :你老婆好多呀。。[懒得理你],<在一个有海的城市安放青春>: 回复 @迷失了夏天的蓝 :是的，我最幸福的事情就是我老婆找我！[爱你],<迷失了夏天的蓝>: 是吗？ @在一个有海的城市安放青春]
makeuptips	伴娘的要求，速来学习！ ​​​	[<奕奕酱>: @H_贝贝贝贝贝,<太阳白了白是法图麦>: @波莉_X   @妞子_Imy欣  ,<Daisy妍妍妍>:   @拜托不要发现我是我    [偷笑][偷笑],<江晶晶同学>:   @sunday-珊,<Sissy_Han>: @runningman让我重拾笑容  宝贝我已经准备好了]
