makeuptips	国货当自强2~ 有哪些安全又好用的国货护肤品和化妆品呢？[心] ​ ​​​	[<伊阳女神>: 回复 @年轻的老司机呦 :睡这么晚,<该改个名字了_>: 怎么没有火烈鸟！？！？所有系列睫毛膏一生强推好不好！！,<重新换了个好听的名字哟>: 回复 @全家可爱店员 :听着很气啊，我买只是因为我喜欢用，觉得效果不错，到了有的人的眼里就是虚荣就是装逼[微笑][微笑][微笑]，那些只要看看成分表就敢高谈阔论大牌如何如何的人，真的，特别好笑。这让我刚起来了那个被扒皮的配方师小新，他最喜欢说％1分界线这种伪科普了,<动物园可爱园长>: 回复 @我说我是阿拉丁神灯你信不 :你要知道，买不起大牌的人就爱这么说[微笑],<羊撕葱>: 回复 @guaishouhello :手心纪,<呦胖次>: 买的是这样的 怎么感觉跟你们的包装不一样呀  http://t.cn/R6CBSs3,<呦胖次>: 丝瓜水用 要不要兑水啊,<陶园_奈奈生>: 回复 @吃多了好像也不会怎样 :[微笑]你有帕金森,<薄凉wwwzzz>: 回复 @本鸟不长这样靴靴 :需要的话可以找我哒[兔子],<薄凉wwwzzz>: 回复 @本鸟不长这样靴靴 :[羞嗒嗒],<不瘦到八十斤不改名的鸟宝宝>: 回复 @小诗法国代购 :我用过的一些法国牌子也很不错~[太开心],<吃多了好像也不会怎样>: 回复 @陶园_奈奈生 :只是手抖点了赞,<陶园_奈奈生>: @吃多了好像也不会怎样  搞得好像你会买一样的[摊手],<guaishouhello>: 回复 @羊撕葱 :什么牌子的,<吃人肉的小太阳>: @wuli甜甜的蜜   @偏执狂lixr,<薄凉wwwzzz>: 回复 @本鸟不长这样靴靴 :痘痘肌用理肤泉挺好的[兔子],<薄凉wwwzzz>: 回复 @秀猪zhu菲宛 :角质层薄不能乱用护肤品   雅漾不错哒,<薄凉wwwzzz>: 回复 @东经109度23分骞蝶 :角质层薄可以用雅漾[兔子],<薄凉wwwzzz>: 回复 @源与千寻希管 :什么的啊,<苍山以南1798>: 看的我都想买个美加净美白一下了 @MISSzhuuu,<素人被动->: 回复 @社会你大鹅姐 :这个我用最好是在洗澡前，先洗脸然后把甘油涂的厚厚的在脸上和脖子上，进去洗澡，甘油可以吸里面的水蒸气，出来感觉皮肤喝饱了水,<落英树下羽>: 回复 @-迷糊蕾 :森田玻尿酸面膜，补水效果挺好的,<用户6017960062>: 回复 @时光蜚蜚 :[可爱],<TYFgirl>: @Myownsunshinelx,<IANDGDAVI>: 回复 @stay-at-here : @LSyy--,<妮妮6152813538>: 千纤草丝瓜水是正品吗，好用吗，适合油皮用吗,<Vormeun小女孩>: 来来来，国产有好货，不干不掉色，私我[爱你]  http://t.cn/R6f0cCR,<Circle_zero>: @胡小胖砸嘻嘻嘻,<倪仪niky>: 美康粉黛的散粉也很好用啊,<微微笑lover>: 感觉国货护肤品大部分都很油很厚重，尤其是各种霜。根本不适合我们这种油性皮肤。萨德前买的悦诗风吟水乳和面膜，用起来都不错，但以后都不会再买韩货了。化妆品用的泰国的牌子，防水防汗不花妆。,<淺淺mint>: 回复 @钟文慧_ :图二拉倒底看,<钟文慧_>: 回复 @淺淺mint :没看到呢,<入江之鲸-T>: 回复 @Qinnaaa :说真的我不敢用[doge],<一只和一支>: 回复 @什么什么ozZ :好东西[爱你],<嗨呀嗨呀的气>: 回复 @叶西柚 :[怒]我要麻瓜霜,<双子座微风-2011>: @木棉花开99133  郁美净不错哦/斜眼笑,<叶西柚>: 哈哈哈买点儿黄什么霜给你擦擦痘痘？ @嗨呀嗨呀的气,<叶西柚>: 回复 @莱银 :是这个理 不过正准备买336哈哈哈,<叶西柚>: 回复 @心里淡淡的 :化妆品很多都是因人而异 不过眉笔我真是觉得不应该 我用卡姿兰眉笔挺好的...你可能颜色没选好？刚画时候买来试着玩的 后来用了资生堂悦诗风吟迪奥感觉差不了多少 这个现在一直在用,<_林细细>: 回复 @淺淺mint :我后来在药监局的网页查过，有备案，然后315的名单上也没有百雀羚的名单，应该没事~试用过了，觉得挺不错呀~,<阿茹ARu->: @BbbbbbbbewithU  [微笑],<亚撇君>: 回复 @梦杰mengjieLee :这种不是纯甘油应该好一点吧,<-陈磨叽>: @a森林木木林森a,<横竖撇捺-A>: 回复 @我说我是阿拉丁神灯你信不 :我说了有牌有证，你怎么想是你的事。你爱买什么我也管不着，阐述自己的观点而已。呵呵什么呢？,<JacksonYee小哥哥>: 回复 @时光蜚蜚 :太香了[二哈],<重新换了个好听的名字哟>: 回复 @横竖撇捺-A :张庭的TST还是明星自己代言的呢，不也是一样的是三无嘛，打广告就是正规牌子了？？呵呵哒,<舞爱希澈>: 支持国货，亲，全球最大的透明质酸生产和研发基地，标准的制定者就在咱们山东济南，山东省药学科学院研发，福瑞达生产，寡聚透明质酸只内销不出口，一款化妆品三个专利，牛逼啊  http://t.cn/R6GfeZW,<玛丽哄哄哄>: 回复 @洛夏Layna :是的我土,<洛夏Layna>: 回复 @玛丽哄哄哄 :土了吧，可好用了,<横竖撇捺-A>: 回复 @我说我是阿拉丁神灯你信不 :三无的确实不能买，但是这个是有牌有证的，只不过没那么多钱做广播而已。可是性价比确实很高啊  http://t.cn/R6GZy3w,<玛丽哄哄哄>: 回复 @洛夏Layna :宫灯身体乳我都没听过,<_容澜>: 回复 @小疯cee :雅邦的睫毛膏和眼线也是很好用的。,<yoga柚咖>: 回复 @我的狗狗叫卡蒂 :搜索315打假化妆品,<oml欧欧欧>: 回复 @用户6076170985 :[爱你],<小star-star>: 回复 @南烟斋少女皖 :哈哈，我也是。一直用韩国的面膜，它们这么不争气，算了，不买，研究国货。]
makeuptips	史上最全！2017早春口红大盘点！不能我一个人剁手[二哈] ​ ​​​	[<霜雪千年雪>: 剁手系列[二哈],<_Su涵>: 求推荐纪梵希适合黄皮的色号[眼泪]西柚色和豆沙色都有了，有别的吗？,<瞪儿哥呀>: [向左]拍拍照就有佣金拿[哈哈],<TYC让生活如花般灿烂>: @进击的rrazoro,<蒋蒋qe网拍赚生活费>: [赞啊][赞啊][给力][给力][威武][围观]爱美爱拍照来找我，充分利用空闲时间，还有礼物收[好喜欢][好喜欢][好喜欢],<v博最会挣票票的小魔女>: 我能带你买买买[嘘][嘘][嘘],<Fragaria_ananassa>: @Shirley_xue02,<-卖美瞳的羊羊羊>: 🤓 DW手表手镯      😎施华洛世奇 🤔你负责买礼物🤔 🙈我负责给你们特惠呀🙈,<小洋洋09261030>: 欧莱雅602好看,<JohnnyLu璐>: @Kryswinklekgowl]
makeuptips	这才是真正的咬唇妆画法[doge]http://t.cn/RqIgM3o ​ ​​​	[<Cindy-辛狄er>: 我们做错了什么 你给我们看这个[doge],<ly马儿>: @Cigarbabby  [眼泪],<小瑶摇啊摇啊摇>: @不脸红的皮卡丘  师父来一个🤗,<_ULiiiiiii>: @CharIie_Tea]
makeuptips	论化妆和减肥的重要性！！请在我又丑又胖的时候珍惜我[拜拜] ​ ​​​	[<真的小熊猫_>: 回复 @快叫我pocky酱 :哈哈哈,<快叫我pocky酱>: 回复 @真的小熊猫_ :嗯 我的下巴 从小就长这样 会很突出像假体一样 但是很多人都是这样的下巴[摊手][摊手]  http://t.cn/RxzSzuV,<圆圆的胖胖i>: 回复 @Sheldon的女性朋友Amy :我说那个评论里面反差那么大是康宝莱减肥产品的图,<桃桃淘淘淘太浪>: 回复 @清明不过一场雨 :哈哈哈没事没事独乐乐不如众乐乐,<AphasicL>: 回复 @KevinShaw丶 :啊那不就好棒棒,<在你脸上啾了一口>: 男票真的是从一个小胖子变成了一个大帅哥啊（至少我是这么认为的hhh）[二哈]  http://t.cn/Rxzb4Z4,<静静碎>: 回复 @爱你的心啊芳芳芳 :不，快过年了，终于有理由放肆吃啦[哈哈]脸上有点肉好看，没必要太追求瘦，我觉得你以前就很好看啊～,<腿粗脸大颜值低>: 回复 @窝窝不家家 :真的啊 [摊手][摊手][摊手]没骗你,<真的小熊猫_>: 回复 @快叫我pocky酱 :下巴,<Devil阿璨>: 回复 @-MleNA :你说的对[笑cry][笑cry][笑cry][笑cry],<弥子酱6058180070>: 突然就自己瘦了[坏笑][坏笑][坏笑]然后 ，， 现在又自己胖了 ，过年回家一个星期胖了10斤[doge][doge]一天一斤都来不及，到底怎么长的[二哈][二哈][二哈]  http://t.cn/Rx7Nuz7,<妹頭漸行漸遠>: 我哩皮肤不好，不然我也是大美女哈哈哈哈哈哈笑屎了。,<安i生r>: 回复 @庸人才会自扰i :所以还是瘦了好[挖鼻],<庸人才会自扰i>: 回复 @安i生r :所以减肥是最大的整容我信，瘦了成双眼皮我也信,<某缪的小铁粉>: 回复 @王某缪 :第四张那个像一个明星,<很迷的迷妹>: 回复 @很迷的迷妹 : @歪哥帅过吴彦祖_,<DLQ_EK>: 回复 @viiiiiiivi :我以为你是想暗示我第四个最后一张长的像白良辰[二哈][二哈][二哈],<一只炫酷的小姐姐>: 回复 @王熹莹啊王熹莹 :你就是评论里的一股清流,<一只炫酷的小姐姐>: 回复 @夏日梦shine :眼睛也是,<一朵小红花____>: 整容了就说整容了[doge],<铜墙铁壁的身躯我叫MT>: 回复 @旧铁皮往lan开 :人家还是要嘛[好爱哦],<梁泰麟>: 回复 @远小璟是个蓝色控 :整他丫的！,<旧铁皮往lan开>: 回复 @铜墙铁壁的身躯我叫MT :本来就乖了[坏笑][坏笑],<梁陀陀>: @Honoshi_Rika   @牛蛋蛋LL   @掉了一颗坎蒂,<U杰宝儿>: 回复 @宝宝贝贝宝贝宝贝222 :就服你,<关于张嫣洁>: 我想问怎么从方脸变成瓜子脸，也真没谁了,<王志鹏在哪里>: 回复 @__fffff在这里 :感受到深深的恶意[摊手][摊手],<BonjourMonsieurWMX>: 回复 @qqqqqxxxxxx :有些一看就整了,<安i生r>: 回复 @Wuli帅琪欧巴 :[doge],<qqqqqxxxxxx>: @aI王梦娴  我可能瞎了,<我是邓女士>: 我要和图四的男孩纸在一起,<Jasmine_wen>: 回复 @囍o二 :还能说什么[二哈],<南桥几经秋kiiky>: 回复 @老衲穿新衣 :你可以的[鼓掌][鼓掌],<kukude邊書琪>: 回复 @安i生r :是真的，我也是,<中山路陆总>: 回复 @宝宝贝贝宝贝宝贝222 :咱俩想的一样,<无敌葡萄妹>: [摊手][摊手]发生了什么事了吗？  http://t.cn/RxhQuYx,<用户08220822520>: 回复 @阿慕夏 :终极目标110，其实120我就很满足了[可怜]小仙女一起加油哈[哈哈],<南桥几经秋kiiky>: 回复 @Keroro说了我是Keroro :找个动力,<我就是张天真啊>: 回复 @阿慕夏 :没有动力怎么办,<南桥几经秋kiiky>: 回复 @Keroro说了我是Keroro :忍忍,<南桥几经秋kiiky>: 回复 @老衲穿新衣 :我们一起定个目标一起加油,<用户08220822520>: 回复 @阿慕夏 :小仙女棒棒哒[爱你][good]，我从160收到130，就卡在130下不去了，已经3年都是130下不去啊[抓狂][抓狂][悲伤],<请一定和我睡>: @葡萄L-  我找不到我的寸头证件照了 [微笑],<我就是张天真啊>: 回复 @阿慕夏 :可我就偏喜欢蛋糕泡芙面包……所以说我胖呀,<榨汁鸡呀>: 瘦了就是瘦了，胖了就是胸大了没什么好辩解的[摊手],<这个昵称被占用啦不给换>: 回复 @-MleNA :很好看啊,<itsnotJuno>: 回复 @阿慕夏 :加油哦[心],<阿喔喔喔额>: 多少人在这期间悄悄二次发育变了脸[doge],<濛凇雨>: @佳猫不是美妞大蜜,<詺柒>: 不是我吹牛逼，你们这不是减肥这他妈是换个人[口罩]]
makeuptips	教你如何处理尴尬刘海教程~马了，提升你的颜值~ http://t.cn/RyR4OFA ​​​	[<落洛咯_>: 回复 @萌妹子小不懂 :我也想知道。。,<落洛咯_>: 回复 @我是静ing静ing :我也。。,<大阳欧尼酱>: @我很帅而且很酷  第二个好可爱,<_sunyw_>: 那也要有这个妹子这么好看呀[泪],<我喜欢大眼睛外星人>: 前提是你得长得好看,<D大大脸子>: 回复 @致知姑娘 :这个需要颜值撑[二哈],<小小小小_影子>: 关键靠颜值[拜拜],<益达张张张>: 要不要这么麻烦，直接用散粉啊,<我是静ing静ing>: 只想知道是什么发蜡,<鬼鬼5021映>: 颜值很重要，主要还是看脸[doge]谢谢你上次介绍的 @日常美妆推荐  博主也很走心，问她就回复，根据她给我搭 配的方 案，最近斑点都淡化了，脸也白皙了，好开森哇~~[哈哈],<一个小青稞>: 换个脸大的试试[微笑],<小小小小小小大大大__>: 喜欢这个颜值呢[兔子][兔子][兔子]冬季皮肤干燥过敏 多亏了 @伊人美妆师  根据我的肤质搭配的 现在脸上的 红 血 丝基本上都有消喔！~也不那么过敏啦[爱你][心][亲亲][亲亲],<Tiramisu不想吃提拉米苏>: 回复 @听见风在我心里 :有可能是佑天兰的,<齐步走一二二>: 什么歌啊，感觉很好听哎,<小情緒來來回回拉扯666>: 首先的有个好看的脸，头发多发际线好看[摊手][摊手],<haimei想重新认识你>: 找个难看一点的人好不好,<小胖星源>: 想在家赚毛爷爷的可以翻翻我的微博你会有收获的[兔子],<我是刘玉玺>: 主要是颜值要好。,<音痴吗>: @小眼睛单眼皮站在路边一直笑  我喜欢最后一个,<IRMAJia>: 回复 @淡魂不是魂淡 :[坏笑][坏笑],<倩倩小小小仙女呀>: @ZXYiiiiiiiii,<我摊开心中愁-你只见眼前秋>: 主要是额头好看才行,<嗯林较瘦>: 回复 @帧眞王 :额头要好看,<帧眞王>: 回复 @刘亚瑟的小提琴 :[哈哈][哈哈]你们真的太赞了,<刘亚瑟的小提琴>: 回复 @帧眞王 :头发还不能太少[摊手],<有强迫症的我是天枰座啊>: 发际线长得不好你不会懂[拜拜],<摆渡人hedia>: 长成这样 扎什么头发不好看[拜拜],<iLoVeme->: 视刘海如命的飘过,<困高-Simi>: 主要 人要好看啊 ,<之往事>: @莫笑少年一时穷001,<潘雪梓在川上曰->: 回复 @荻仁杰的亲侄女 :看起来都好难[二哈],<大毛demo>: 回复 @Cervus- :对啊,<T啧1>: 回复 @冰糖葫芦甜甜 :学到了,<YU_YUYUYUYUYU>: @无聊男人最无趣,<一丝不挂的肉丸>: @YouYouYouTian  学学,<Cervus->: 回复 @honeybabyya :啥意思？让我给你编吗[摊手],<z1a5i0j3i2a5n>: @IRMA嘉  学会了给宝宝编头发,<Gamzukcheung>: 回复 @帧眞王 :发际线要好,<我是小仙女你是大混蛋>: 最起码额头要好看……,<THERESAHC>: 脸大敢这样？[二哈][二哈],<七七钦钦宝>: 这个好看吗？  http://t.cn/RIVqR71,<大毛demo>: @Cervus-,<易会网景招聘>: 主要[看看]脸～,<轩蜜Jungbaby>: @Happy顺其自然33,<Alice--愛>: 自己编不好[抓狂][抓狂],<有种被偷窥的感觉擦>: 回复 @乌托没有邦__苏格拉也没有底 :是的,<青丝girl>: 回复 @乌托没有邦__苏格拉也没有底 :我们这种颜值[思考],<0v0七酱>: 当时刘海尴尬期直接夹子夹头上[哼],<融雪之前请归来>: @准备离开渣浪   @你好李开心  听评论说主要看脸[doge],<郑一一小宝>: [二哈][二哈]首先得有人帮，我这种反手手残党根本没法自己给自己編头发]
makeuptips	原来以前的粉饼是这样制作的！满满的复古优雅感觉 http://t.cn/Rf9htLd ​​​	[<口红馆Hyun>: 适合学生党的口红买一送一💕,<韩冰妮妮妮妮妮>: @张欣hihihihihihihihi,<地瓜lu>: @数学不好不是我的错   @L土豆jun,<雨久花泥>: 回复 @如水何其暖 :哇，想吃[笑cry],<少女八次元>: @雨久花泥  厉害了[舔屏],<朱家大妞儿>: 一度以为是做奶茶,<没吃药药>: @Candy-Ada   @蜜糖糖桐木,<Caifeeeee>: 我以为能吃的[眼泪],<M一庭红雨M>: 回复 @Lydianvip :好精致[可爱],<Lydian宝宝要毕业辣>: @殊不知一庭红雨  [偷笑]厉害了,<Zzzz_捷貳>: 感觉戴帽子的女的侧脸有点像大幂幂[doge],<积极生活的萌宝>: 回复 @爱o下雨 :不错哦,<爱o下雨>: @棒棒萌0317,<赵同学是小仙女>: 只有我以为一个什么好吃的叫粉饼,<zuozen>: @不知道起什么名字的希娅酱  有点酷呀,<crad大军中的一员>: 好像小时候弄的粉笔灰[二哈],<靚靚w>: 那些瓶瓶罐罐，奶茶既视感[摊手][摊手][摊手],<安提妹儿>: 我还在想这个粉饼我怎么没有吃过[doge][doge][doge],<艾雅Aiya>: 想到了纪梵希的四色散粉,<非非非非常美丽的罐子>: @薄荷色草地boomboomboom,<hjjjj_j>: @王豆豆要当学霸,<袁晓彤晓彤>: @D调De华丽2016,<COCOCHEN->: Wow!Amazing!!!,<沐沐汐yms>: @xxxShurly   @暮霭中的幻影,<哟哟万莉啊>: 这是什么电影啊。好想看[偷笑],<墨屿喑鹤-竹生>: 并不优雅，也不复古，不过是一堆粉混混拌拌的[摊手][摊手][摊手],<方曼可>: 回复 @Vivian翁小婷 :神奇,<Vivian翁小婷>: @方曼可  跟我们以前搞橡皮泥一样]
makeuptips	韩国美妆综艺节目《拜托了梳妆台》→_→http://t.cn/RcNFfHs ​​​	[<--wo叫猴子>: 回复 @不知眸 :然而并不值得惊奇[偷笑]，是他们没见过更夸张的，所以她们见到就以为是最牛的了,<杰锅锅456>: 回复 @iiiiiloveme :哈哈哈哈哈哈哈 智障哦[二哈],<iiiiiloveme>: 回复 @Jessicasyyy :拜托了我的未来…… 我的男朋友…………,<杰锅锅456>: 我看到一个评论 哈哈哈哈哈 @iiiiiloveme   拜托了冰箱拜托了衣橱拜托了梳妆台,还能拜托啥[摊手][摊手][摊手],<牛靖雯>: 只有我一个人觉得利特和韩彩英长得超像么,<叶绿大人>: 回复 @小ZOE52- :妈的，差点看成了韩红[喵喵],<不知眸>: 回复 @----梦儿 :韩国节目就是这样，可以发现不管是娱乐综艺、美妆 还是美食，都会表现特别新奇 又很捧场的惊叹声,<飞010224>: 这点口红就哇哇哇的叫，果然是没见过啊我关注了 @精致护肤时尚达人  根据我的肤质搭配。现在斑点基本上  淡的看不出了[太开心]，问就回复,<QuanRuoYun_>: 这个气垫什么牌子,<你好比乌鸦鸟>: 很美啊 说不美的真不知道对你们来说什么是美。依旧很美。,<我想用个假名字>: 回复 @O-天啦 :虽然厉害，看着脸真的好奇怪,<小灰灰的小迷妹>: 觉得她自己画的妆不好看,<L-yyyyyyyy->: @原来是太阳啊-,<Grace范>: @CherryNor16,<O-天啦>: @BETTY-和   @Yangqinyue,<林狗子的九亿分之一少女>: 回复 @Jiao爷不吃羊 :日本的LADUREE拉杜丽花瓣腮红,<Determined_->: 回复 @LI冰ning :我服你,<duorp1->: 回复 @-林Ckeai :那个腮红   在张沫凡那知道的 就是感觉好好看,<SuNeeN_>: 回复 @田紫钰37134 :对啊，那时候多清纯。,<飞010224>: 还挺好玩的谢谢你上次介绍的  @精致护肤时尚达人   博主也很走心，问她就回  复，根据她给我搭 配的方 案，现在粉刺，痘印都好了，好开森哇  ~~[哈哈],<吧吧吧少女miao>: 好像不是素颜吧 拉近的时候看到了眼线 还画了眉,<无所谓小姐与随便先生123>: 素颜更好看啊啊~画完像女鬼,<呃呃呃趋向向天go>: 回复 @CREYUBBOLLLL :你也很好看啊,<___烦心咒___>: 画下眼线的是什么牌子,<小怪兽CD>: 感觉这是再给韩国一个牌子做广告[开心],<Vivian芷蘅>: 回复 @叶绿大人 :我叫韩彩红[喵喵],<Vivian芷蘅>: 回复 @叶绿大人 :我是她妹妹 [害羞][doge],<总会有人爱我如生命>: 想知道洗发水叫什么名 还有隔离霜,<MayMay_1020>: 她素颜比较好看，我觉得她的妆不好看，眼妆的部分,<爱奢会馆>: 她用的是什么牌子气垫啊，我也想买一个,<CuteYangZy>: @kisukisu0,<awhyny>: @呦呦胡悠悠   这么多年了还辣么好看,<Da奶喵>: 想丰 胸的宝宝们快抱抱我[抱抱][抱抱][抱抱]以前本人是飞机场[泪][泪][泪]如今已经大了两个杯了[污][污]快！戳！我！[怒骂][怒骂],<熊宝儿的宝宝>: 只想知道什么牌子的眼线液笔,<香香小烈烈>: 回复 @珉豪的美丽老婆 :羡慕啊[大哭],<427MAN>: @阿拉灯神丁sssss   @娜么逗逼  豪杰春香到现在没变感觉,<--wo叫猴子>: 回复 @_confidence丶man :我也是惊呆了！这叫猿粪[偷笑],<_confidence丶man>: 回复 @----梦儿 :哈哈哈，我真的只是看了下视频然后随手翻评论点了你头像[笑cry][笑cry][笑cry][笑cry][笑cry]我直接惊呆了,<--wo叫猴子>: 回复 @_confidence丶man :我也是惊掉了我的真下巴[哈哈][哈哈]我关注你哈[偷笑],<_confidence丶man>: 回复 @----梦儿 :世界是有多小，我真的只是随便翻了一下评论看这有个美女。。结果是你[眼泪][眼泪][眼泪],<用户253684485>: 我觉得还是很美[doge],<大帅小美啊哦啊>: 回复 @生活跟我闹情绪 :我没看呢,<国民小可爱咦>: 太不专业了，头发不弄起来化妆？[摊手],<慕一babymomLU>: 回复 @Diamonds_cr :我也有缺口 在右边,<飞王爷__>: 回复 @雞汁的趙喵嗚 :韩彩英花的妆太浓了，最近在重新看豪杰春香，刚刚关注微博的时候我也差点认不出来，看中国版两天一夜我也没认出来,<--wo叫猴子>: 回复 @翠花不是hua :这样的场面要这几人看见那得哇成啥了[偷笑],<不告诉你我是谁-->: 只有我想知道洗发水什么牌子和把头发弄蓬的夹子什么牌子吗？,<不告诉你我是谁-->: 回复 @沐歌太平 :我也想知道洗发水什么牌子，还有想知道那个夹子什么牌子（可以把头发弄蓬的那个）,<哩猫兒>: 回复 @LISH1Wen :哈哈哈哈哈哈拜托了棺材哈哈哈哈哈哈哈哈 @豆子是个小guai物   @神灯阿拉丁pia   @窝窝窝你个头  笑崩,<彤仔Long>: 别说韩国都是拜托了啥节目…中国的节目现在大部分还不都按照这个模式买了版权或者改的？,<瑶啊瑶要瘦下来>: 自己画的和拍画报是眼线弧度都不一样。。。。。。。。。。。。。。]
makeuptips	关于韩国化妆品你应该知道的 ​​​	[<生无可恋的小鱼干>: 回复 @易烊撩妹进儿科 :我只买的起innisfree，伊蒂之屋，爱茉莉(开价系列……),<生无可恋的小鱼干>: 回复 @易烊撩妹进儿科 :[笑cry]入了美妆坑的就是随时准备剁手[笑cry],<佳涧成雏>: 韩妆认真的，香精味好重。不爱。,<Emsy_Cola>: 回复 @哈利不是兔纸是比熊 :最近老看到推护品的微博，一堆中高端牌子里里面一定有悦诗风吟,<天下第一唐门傀儡师>: 回复 @鲜奶味小鱼干 :[打脸],<天下第一唐门傀儡师>: 回复 @鲜奶味小鱼干 :[笑cry],<生无可恋的小鱼干>: 回复 @易烊撩妹进儿科 :Armani，YSL圆管我都入了[笑cry]TF买不起，Chanel没太大兴趣……NARS目前没这个打算……Dior看我的心情[笑cry]现在的我只准备剁手YSL超模粉底液[笑cry]还有bb的美妆蛋,<生无可恋的小鱼干>: 回复 @易烊撩妹进儿科 :妈的，扫了一眼看到Whoo就不想点开了[微笑]Whoo贵妇级别的啊！！！！,<这里住着头小怪兽>: 哎 可怜这些汉方护肤品化妆品在我们大天朝却没有拿得出手的产品,<FaNg1g>: 美妆都在 @-Niuuu_  家买的 实惠 主要是没有买到过假货[doge],<多肉咋滴>: [doge]看到大写加粗的买不起,<大橙子lotus>: @t1n9Yu_,<Doeann>: 明星同款，各大专柜同款，[放大镜]蘑菇街店铺  丢丢house @丢丢house   http://t.cn/RcAmYIN,<草莓拼单团>: 回复 @猫猫喵喵喵星人 :55,<安秋的话>: 你猜你并没有用过,<lxmlxm啦啦啦啦>: 悦诗风吟的眼线 眼影 绿瓶 还可以其他的东西.垃圾中的战斗机。,<反正我还是我m>: 回复 @猫猫喵喵喵星人 :私你,<Mandy甘愿来做憨人>: 悦诗风吟是给力你们这些伪网红多少钱 看了你们推荐去买了一堆 真心蜡笔垃圾,<YY杨小羽>: 回复 @猫猫喵喵喵星人 :二百多  http://t.cn/RcApbbs,<Chewyaoo>: @无敌小太阳Nicole,<啪啦啪啦小蘑菇>: 讲真，韩货真心垃圾,<一改什么名字好呢>: 靠谱韩代 每月[飞机]️韩国 有需要的宝宝可以戳我v信 Y1452311693,<我叫顺德_>: 正品韩代哦[下]🏻  http://t.cn/RcAXgCE,<陈小倪巴>: @心未淡9999  一个月一套,<猫猫喵喵喵星人>: 第一张第二个洗面奶多少钱]
