maodanqing	这句广告词绝赞，懂日语的同学知道，谁有神译[哈哈] ​​​	[<亦赤赤赤>: 以后这些低头族就简称“二货”吧，日语音译，洋气。[挖鼻],<土豆君_一期一会三日歌>: 你们这些走路玩手机的都是baka！！！！,<masterobert>: 讲究// @吃一碗安心的飯 : 阿呆才會走路玩手機[doge] // @囧户不亮 :[doge]// @各种烦躁的凡凡小熊 : [doge],<mayleenoie>: 请从今天起，将边看手机边走路的人直接简称为“笨蛋”吧！,<mistery->: @雷祥権  哈哈哈,<奶人多多DJ>: [偷笑][偷笑][偷笑],<晴天小猪Alice>: 走路玩智能机从此变阿呆~~,<VarHug>: 回复 @无敌逍遥巨人 :信达雅,<无敌逍遥巨人>: 天天走路玩手机，从此智能变智障[吃惊],<Hiro微博2011>: 埋头智能手机而不顾周边障碍行进的人，从今天起就叫你“智障”了啊～,<lanyuyi9943>: 以后遇到走路低头玩智能手机的人儿，从今天开始就简称“低能儿”吧！！,<咖啡俺>: ポートライナー看到过[偷笑],<刘战斗君>: @sakuranevercry,<TRESOR_ART>: 涉及到发音还是日语语境里最贴切，关西的「アホ」更给力些，译成中文差点意思。非译的话：对于埋头于智能手机的人今后都简称为“智障”。（或者傻子、呆子）,<rainnelsrren>: 低头族从现在开始都简称为笨族。,<小样儿和慢慢>: 边走路边低头玩智能手机的人以后就简称为低能吧,<Akane想旅游>: 这样说太勉强了吧？！,<马志尼>: 精辟[哆啦A梦吃惊],<阿乐頑張Re___>: 热评第一名那个翻译real服气[微笑][微笑][微笑][微笑],<锁在掌心的云>: 为什么你们都会日语，好高大上的样子！[可怜],<苏我文弘>: 玩手机走路的人 从今以后简略称他们“笨蛋”吧,<XY_夜>: 图片评论  http://t.cn/R5L30nA,<XY_夜>: 从今天起把那些边走边耍智能机的人简称为智障哒！,<歪嘴和尚会念经>: 再译：那些走路还在用死马特疯的人，今天开始就把他们简称为“疯子”好了！ [偷笑],<Cielan_KKWholic>: 回复 @悬崖上一朵花 :哈哈，谢谢,<性急斥候>: 日语发音上的便宜 翻过来也没有实际意义,<歪嘴和尚会念经>: 试译：走路还在用斯玛特疯的人，今天开始就把他们简称为“疯子”好了！,<薄荷树是我>: 回复 @Cielan_Liamholic :高明！！,<赵史编年>: 没法对译。[委屈],<伪学霸L森>: 步行时玩智能机的人，现在开始简称“不智”。,<万事屋JUAN>: 走路都低头玩手机的人，今天开始称他们为“低B”。,<Cielan_KKWholic>: 低头边走边看智能手机的人，从今天开始简称为“低能”吧,<胡铭慧>: 从今天开始把边走路玩手机的人省略，我们以后就叫他们笨蛋吧！,<无脸男养了只猫>: 走路时玩手机的人以后叫他们鸡人吧。。,<加七>: 挺无聊的[挖鼻],<likai中>: 为啥并没觉得多好。。。,<11区的李西饼>: [吃惊][吃惊],<堀澪奈>: 走z着玩智z能机的人 以后就叫做 mdzz,<Monster__董一口>: 有走路手机跟眼睛长一起的人 从现在开始叫有鸡眼的人,<巴松的家>: 这个简称挺好[赞],<阿楚晚生>: 想不出来，没那么容易出第二句 人弗为佛,<荀夜羽>: 念了三次才突然明白梗在肾上。,<碳老师>: 看到了就想笑，这广告效果太好了⋯⋯,<黎明时蒲公英>: 我想低头族应该看不到这款公益广告吧[偷笑],<小鬼海里>: 低头族今天开始就改名为“机奴”吧~~,<楼珈蓝>: 笑点炸了[笑cry][笑cry][笑cry]我就是个あホ,<美是一种天分>: 一边玩手机一边走路的人，从今天起简称“傻瓜”。,<必須美好>: 据说关东和关西对アホ的理解相差甚远…[笑cry],<Ruinijntje>: 我勒个去！简直太智慧！[哈哈],<喬凹司令>: @我自己的爱达荷   哈哈哈]
maodanqing	日本电视说有的代购商品是从中国寄到日本，再从日本寄回中国，冒充日本货[吃惊] ​​​	[<周矮油可以去死了>: 都是中国制造然后在日本卖…很多手办也这样啊,<张文学>: 回复 @游学日本北海道站 :来钱快，暴利，辛辛苦苦经营品牌哪里有骗人快。,<小輞爷>: 不止日本 美国欧洲都这样,<Dali桑>: 老早就有了。。。所以一般日本亚马逊只买自营的,<all_sunday>: @WhenImetyouthatday   @wenie_chan,<洋芋儿泥>: 回复 @一颗红豆的心情 :看产地有啥用，本来有些东西就是国内生产的然后出口出去的。然后国内还买不到,<时差一小时的我>: 我们学校教授也说 中国人最聪明 [笑cry][笑cry][拜拜][拜拜][哼][哼],<俱利鸭des>: 回复 @啊鼠的瓜 :啧啧,<啊鼠的瓜>: @陈酿咸鱼烧酒  会玩[哆啦A梦吃惊],<夏眠非铜壶>: 达芬奇家具以前就是这样做的，坑钱太多被人挂了嘛,<韵ikeda-Japan>: [吃惊][吃惊][吃惊],<一颗红豆的心情>: 专门有一批中国人到浙江义乌订货然后通过物流到日本，所以国人在日购物一定要仔细看产地。,<tongbaby0707>: 中国的劳力便宜吧,<sunwei369_35522>: 跟天朝人到日本留学回来冒充日本人是一样的[偷笑],<flykanon>: 能运到外国去都算负责了，有的就是近海转一圈就回来冒充进口货的[挖鼻],<圈圈儿_儿>: 感觉好丢脸啊……,<小普洱QvQ>: 这 @小乌龙T-T,<马铃薯代盐人>: 回复 @JieL_ :对啊 很多假代购 不止日本的,<明媚是只鱼>: 卖家靠良心 买家靠运气[喵喵],<0工口工口大王0>: 就和开发商不给动迁户钱，宁愿花钱买通有关部门和黑社会进行威逼利诱和强拆一样,<anoky>: 回复 @丨榮丨 :9割不是9成的意思吗[笑cry],<来自喵星的天秤女>: 回复 @丨榮丨 :你的日语不渣，这就是9成的意思[黑线],<丨榮丨>: 日语渣第一眼把9割理解成了九成[拜拜] 吓出一身冷汗,<非温室花朵>: 回复 @Amethystaf :出口转内销[困],<喵星人Calla>: 都这么多年来「 人傻 钱多 速来 」还管用,<终极精神病患者>: 然后无知群众和愤青一起抵制日货[挖鼻],<世界上最努力的人>: 我只想说 该上哪买好货,<SHINKO猫>: 这里说的和评论里有些说的中国制造的代工是两码事。前者是利益熏心的坑钱，后者是正常的贸易关系。,<五楼的李>: 9割引。1折[汗][汗][汗],<一颗小板栗儿>: 真是服气这种聪明,<想要天然呆的猪>: 日代也沦陷了，天朝人民太“聪明”了,<葉子先生酱>: 真是防不胜防[汗],<Elmar_in_IC>: 不奇怪，有些号称“意大利进口”的家具实际上也是意大利转一圈回来而已。,<拿什么拯救你我的小粗腿>: 回复 @李倩宇pisces :你说自营会不会~,<pakelao撕>: 中国人砸这么聪明呢 怎么都赶不上 来气！[哼],<JieL_>:   @BILL烤栗子,<抱紧少帅大腿>: 想不通这个社会是怎么了[傻眼],<木鱼大大>: 这个手法全球通用[挖鼻],<卢七人>: 本来就是，我一同学家叔叔就是专为日本公司做家电产品，做好然后运到日本再卖回中国，中间日本是赚得最多的！,<Amethystaf>: 回复 @辽东小码农 :那不是小利是大利？,<李倩宇pisces>: @拿什么拯救你我的小粗腿,<辽东小码农>: 回复 @Amethystaf :蝇头小利，从何说起？,<辽东小码农>: 我相信我们中国人的智商真么高是能干出来的,<M公孙小小M>: 昨天刚从天猫国际买了防晒霜和洗发水！！！！！,<我是太阳花花花花>: 在乐天上买过来自母国的假货[微笑][微笑][微笑]我觉得还是要注意跑货量，量大又低价的话可能就需要注意一下了。。。,<游学日本北海道站>: 如此不辞辛苦的钻营，这精神和精力为啥不能用在打造自主品牌与服务的细节上[汗],<Your四>: 日本亞馬遜有些東西是中國人在賣 好多都是假貨[微笑],<Amethystaf>: 为了蝇头小利不辞辛苦,<喵小麻爱喝奶茶>: 要说小聪明，我朝人民天下无敌,<AlphonseUndes>: 自己人坑自己人..... 已经对中国的贼奸商无语了....... 上天会惩罚牠们的！！,<滋恩增忒薏谙甜>: 有啊，纸尿裤就有好多，真是到处丢人不嫌多，还怪别人对国人有偏见。]
maodanqing	日本网传七种女孩儿发型不受男孩儿欢迎[吃惊] ​​​	[<动感小奶源H姐>: 看脸好嘛，长的漂亮光头都好看,<胖头银鱼>: 一网打尽啊[笑cry][笑cry][笑cry][笑cry],<左岸无风99>: 女孩子居然有这么多发型，我都没注意到[眼泪],<Elmar_in_IC>: 我觉得这七种几乎涵盖了所有发型吧…而且放到二次元明明萌得飞起,<反逆sei茜>: 还不受男生欢迎发型，呵呵，我啥发型管男的啥事[doge]，我做发型是为了我自己好看，为了跟姐妹们一起漂亮。有些男生就是太自恋了，不要以为女生整个发型、化个妆就是给你看的[挖鼻],<古美门兼续丶>: 把这些都排除了意思就是都喜欢光头妹子吗？[喵喵][doge],<马志尼>: 您想多了，主要还是看脸[拜拜],<趣味吕>: 那不知道还有哪种发型是存在的,<Jonathan测试版>: 确实没一个喜欢的[哈哈],<NEKOfriend>: ？？他们是喜欢秃子是吗？？,<Lidija1015>: 2和4在日本的时尚杂志上可一直都是最受欢迎的发型啊[哆啦A梦吃惊],<土豪宅族育成>: 不好意思，毛老师 @毛丹青  家女性小伙伴的发型是…[睡],<Fleshgod-Apocalypse>: @成都日本人   @客观日本_43497,<终焉月耀>: 明明每一种都有萌点,<世界上最炫酷的王六岁>: 7不是露琪雅吗。。好歹担纲女主啊！,<akemi_prpr>: 男的只要丑 啥发型都救不回来[doge],<阿囧格里到底有底没底>: 1号元气满满 很喜欢xD,<还是那个你的梦>: 可能喜欢的是男孩子所以女孩子什么发型都不好看吧？？？？？,<一枚老太太>: 所以说只有黑长直吗[哈哈],<muybonita>: 那么只剩下黑长直+秃头了吧。。。[挖鼻][挖鼻][挖鼻],<章鱼团子圆滚滚>: 感觉只有黑长直不会被讨厌了。,<片桐Ithaka>: ルキアのつもりwww,<想翻广州噶ku>: 为什么要让男孩欢迎，自己高兴才是最重要的,<Yukie绒>: 什么鬼 女孩常见发型几乎都囊括了啊,<宝石姫>: 还是那两个字 看脸。,<塩薙>: 就想說一幫屌癌女孩子搞什麼髮型關你屁事,<花花种树>: 日式吊癌，抓住一切可以打击女性的机会说“几种不受男人欢迎的XXX”,<_金兑>: 为什么啊，我觉得都很可爱啊,<我是星期天>: 中国说丸子头减龄，日本说像大妈[委屈],<0工口工口大王0>: 我都喜欢，光头也喜欢,<晓娜被抢了>: 这么一说，大家都推成光头吧[笑cry][笑cry],<怪力喵帕斯>: 排除这几种只有洗剪吹杀马特了吧,<WGZHLG>: 画得都挺萌的，12367脑内现实化一下觉得的确是灾难。不是男生喜不喜欢的问题了，完全就是审美的问题，女生也不会喜欢……,<SuyerSong>: 不要在意这么多细节，男孩只看脸,<发发9593>: 脸好看的话，除非光头或者搞成五颜六色，不然都好看[哈哈][哈哈],<文心謹喵>: 236全部躺枪→_→,<助手A>: 腓肠不可靠。发型都是借口吧……[doge],<大闲凉湿>: 长得丑怪发型系列，发型：这个锅我不背[笑cry]  双马尾丸子头大波浪都不喜欢，那除了黑长直就只有光头了,<途荼图>: 没有头发最受欢迎,<罗luo喵>: 他们喜欢板寸圆寸光头的姑娘么？,<沉默的艾特娜>: 最受欢迎的好像也差不多啊[汗],<长岛冰茶不加冰__>: 确定能分清这么多种发型的是直男？[doge][doge][doge],<再胖下去真的找不到对象了亲>: 难道他们喜欢女孩子秃头？？,<RoKoGa>: 除了这七种还有其他吗,<一华夫一>: 那剩下还有什么发型?光头？？[挖鼻]]
maodanqing	电视新闻上的这顶帽子亮了，中文给帽子起个什么名字好呢[哈哈] ​​​	[<璞豆>: @盐班比  哈哈哈哈,<春秋-Live>: 马上去某宝搜了一下,<Lidija1015>: 脑洞大开帽[偷笑],<YES-I-DU啦>: @念安集  哈哈,<Cat_Marie>: 脑洞大开[喵喵],<阿喏是只喵>: 这人有点像冯小刚啊,<rheingold>: 回复 @luyinabnu :你看那两坨鼻孔！,<ououbnu>: 回复 @rheingold :为啥为啥,<rheingold>: 回复 @luyinabnu :叫鼻の穴,<ououbnu>: @rheingold   @XUNXL  好恶劣的[哈哈][哈哈][哈哈],<sensan01>: 一个和尚有水喝[嘻嘻],<视星等六>: @耳可贰一   代购吗,<羅尖牙>: 哈哈哈哈 好想要一顶,<aaaaaawwww>: @ZuZuuuuuuu,<Rye-Whiskey>: 请教：日文或英文叫什么帽子呢？]
maodanqing	旧杂志上的村上春树，该叫他什么范儿呢？[思考] ​​​	[<穿花的蝴蝶>: [哈哈][哈哈][哈哈],<尼克雷温>: 第二张猛一看，好像刘烨,<Boombulbbb_>: 主要看气质[拜拜][拜拜][拜拜],<Tschick_er>: 最後亮了哈哈哈哈,<风也萧萧_雨也萧萧>: 回复 @stardream520 :[笑哈哈][笑哈哈],<Lossy_>: 哈哈哈哈哈哈哈最后那个还是个背景,<明珠JJ>: @林少华  [挤眼]看看,<deniimshin>: “nerd尝试突破和改变自己”即视感[偷笑],<badhairnico>: 可爱い  @伤心煎饺   @花开云谷  ,<stardream520>: @风也萧萧_雨也萧萧,<RoyceDay>: ”劳改”范[笑cry][笑cry][笑cry],<素席说>: 小短裤是镶钻了么…,<艾伦不爱>: 第一张是在监狱里？,<简简单的一>: 有一种范儿叫…这就是我的范儿,<苞芦花>: 乡村复古闷骚范[阴险],<Cherrene>: @毛丹青  我在推特上也看到了这几张图。如果不是老师您原创，也请加上原创者的名字吧…………,<锺點貓>: 有范。// @卫西谛 : 转发微博,<zhou_beibei>: 自带光环范儿[偷笑],<我儿yoyo桑>: 久仰大名，今日一见，丑瞎我眼,<-老Ben->: @air大叔也balapili,<蕴蕴酱酱酱www>: 叔就是帅[爱你],<光影森林工作室>: @Yamashita_Enen  哈哈哈哈哈哈,<海豚般滑溜溜的胃>: 闷骚[doge],<-月浠->: 回复 @绵绵绵球 :同意,<Lidija1015>: スポーティオタク？[偷笑],<大脸猫吃了大椰子>: 70年代，文艺青年摆谱范儿。,<盐水驴>: 原来你是这样的村上,<Andreas-柔韧的多肉的丁文涛>: 中大的宇佐美毅先生最喜欢研究他了233,<尼桑亲我一下吧>: [干杯]最后那个短裤来一条,<克拉克食指>: 第一直觉：五四青年,<圣西罗风暴>: 其实他本人乍看上去挺像那个敢死队的,<icecile>: 傻帽范儿，但是我喜欢。,<小海妖MIKA>: 回复 @我特么同意你出院了吗 :布景和道具服装都如此有个性 特别魔幻[眼泪],<我特么同意你出院了吗>: 回复 @天丿川綺羅羅 :我也是看了第四张之后才反应过来好像都是....应该是几十年前的老照相馆那种[笑cry],<20元钱>: 如果最后一张真是在天安门广场的话，我只想说，村先生你逆行了！（我住在天安门旁边，从小到大还没见过正对着金水桥有过人行横道，当然历史上有没有过我也不敢肯定）,<夏桑菊的春天>: 二八自行车 运动短裤 还有记忆,<小海妖MIKA>: 回复 @我特么同意你出院了吗 :我看4张都像用布拉的背景[眼泪],<孟加拉虎的BLOG>: 希望今年村上先生获得诺贝尔奖。。。连续八年，该给人家了。,<白夜猫纸_Ookpik>: 布景天安门？hhh,<钢铁心先生>: 回复 @霍霍家的来福 :一直都觉得像[哈哈],<霍霍来福>: 回复 @我特么同意你出院了吗 :对呀，桃红配蓝不要太骚哦～～～[笑cry][笑cry][笑cry][笑cry],<喝完再说>: 回复 @霍霍家的来福 :哈哈哈刘以达,<霍霍来福>: 第2张像梦遗大师  http://t.cn/Rqrs4Ia,<我特么同意你出院了吗>: 回复 @霍霍家的来福 :而且看样子还是女式[笑cry],<Vincent_Woody>: 言わせてみりゃ屌丝范…,<霍霍来福>: 回复 @我特么同意你出院了吗 :哈哈哈，裤子还那么短,<马小宪>: Enfant terrible[眼泪][眼泪][眼泪],<missy0210>: 起范儿[鲜花][哈哈],<我特么同意你出院了吗>: 最后一张的天安门是用布拉的背景吧....]
maodanqing	发布了头条文章：《村田先生的太太》 村田先生的太太 ​​​	[<啊阿思>: 所以想表达什么呢？没看懂,<cosmos1026>: 有后续吗[doge],<远光灯-DavidMa>: 怎么？都快成悬疑小说了,<喵星人Calla>: 看題目一開始有點奇怪 為什麼是村田先生的太太 而不是村田太太 看完後...喔 原來如此,<磨磨唧唧小熊猫>: 看了好好奇   有还是没有啊[doge][doge],<格兰杰小y>: 老师，倒数第五段的“保险是这样”应该是“保准是这样”吧[脸红],<伊甸之东-sj>: 这是悬疑小说吗？,<静静讲故事>: 我都好奇了，村田先生到底有没有妻子呢？,<在意大利过夏天>: 你在书里写过这个吧]
maodanqing	网上有人质问：“讲礼节的是谁？”[挖鼻] ​​​	[<轻松茄>: 不过按日本文化，拍照时站最中间的那个不是最先挂么[眼泪],<铃木美妃>: 真tm丢脸…………,<虎式微笑的白野>: 这货最近日子还是过的太顺了。,<叉叉羽>: 评论也是贴心：因为安倍是蠢蛋所以原谅他嘛,<kaku包子不足>: 虽然不喜欢安倍，但是在日本有“三个人照相排正中间的人的死得早”的迷信…也可以理解吧,<sel4rz>: ある程度で礼節は心の修養と言うものでしょう,<papa-phoebe>: 长幼有序不懂么...........,<我叫海蓝之谜>: 禮貌，是聰明人想出來的與愚人保持距離的一種策略。---致安倍,<-砚秋->: [哈哈]第一条评论笑死我了... ...好吧，听你的，我原谅他... ...[拜拜],<梧桦的确良>: 本来都是平等的国家，为什么一定要英国女王站中间？人家夫妻俩站一块也无可非议吧,<茶树菇0>: 安倍は馬鹿だから許してちょうだい[doge],<卢七人>: 我也觉得可能受中国影响l以左为尊,<ComicCelia>: 哈哈哈哈哈评论可爱~,<黑夜道化师>: 是不是中国古代的以右为尊啊，文化差异？,<苍月真冬>: 安部は馬鹿だからこそ許しませんよ。,<一只耷拉眼>: 安倍就是中国男性的表率，要立中～,<风从南逝>: 然而第一条评论也没什么贬义[喵喵],<遊宝尘>: 馬鹿だけど支持率落ちなくないんじゃない[doge]誰か馬鹿だと思うの？,<绎听>: 回复 @王子亂_每天都不禁陷入了沉思 :哈哈哈,<stef泡嘟嘟>: 这应该是东西方文化礼仪的差别吧？,<小Y_金鍂鑫>: 的确……外交礼仪啊…,<皮老板_Mr_皮塔>: 皇朝外的伊丽莎白，谁来跪拜她？[思考]—歌曲《芳华绝代》,<Real_PENNY地地道道>: 安倍は馬鹿でもこんな簡単に許しませんよ。,<浓缩oil>: 因为安倍是蠢蛋，啊哈哈哈哈[笑cry],<王子亂_不凡是普通人的不凡>: 回复 @绎听 :因为安倍是个白痴所以原谅他吧,<扭曲吧_喵帕斯>: 安倍は馬鹿だから許してあげる。(笑),<Doboo多寶>: 安部は馬鹿だからこそ許しませんよ。,<TanPoPo_zzz>: 呵呵，亏得安倍还有脸鼓吹“すべての女性が輝く社会づくり”的施政，有些东西是深入一个人骨髓的,<绎听>: 第一条评论说得啥[疑问],<宝哥哥少女心突破天际>: 下面第一个评论 笑傻了,<半山瑰夏>: 评论也说安倍是马鹿所以咱别跟傻叉计较了～～打扁他就好了……,<玲玲大人o0>: 骨子里头的直男癌,<黄瓜冰吻黑羽心>: 现在觉得安倍在某些方面可以和布什有一拼,<水断愁消>: [doge]这就是日本的待客之道么？,<AlphonseUndes>: 女王快被挤出画面了...... [汗],<KivenZhao>: 看到第一条评论笑爆了,<P4双核>: 看原博第一条评论…[笑cry],<玛尼玛尼泓>: 安倍。。日本的礼仪不是很到位的吗？,<琮琮999>: 哈哈，原谅这个傻子,<-施小西->: 评论亮了，因为安倍是个大傻想，大家帮帮忙原谅他吧。,<七星-高照>: 原谅安倍这个傻子吧！,<爱宁到永远>: 哈哈哈哈哈哈评论第一条[笑cry],<岚猎>: 安倍不仅没让女王站到中间，还站在女士的前方，也表现出他霸道的大男子主义!,<a0705440>: 日本，男尊女卑啊,<听说名字弄长就能变拉风你说是吗>: 哈哈哈哈哈哈哈哈安倍大八嘎]
maodanqing	这位店主的话亮了，有神译吗[哈哈] ​​​	[<sel4rz>: 老板是孙二娘吧[眼泪][眼泪],<东野月亮>: 不服憋着[doge],<荷花如期>: 其他的都是小事儿，请珍惜每一份辛苦。,<懒且傲娇的猫>: 若有怨言，即使微小，也请忍耐。,<花花种树>: 回复 @邵路军 :是的，这个转折特别有笑果。,<claire_ryu>: 不服憋着！[doge],<左手插进右口袋>: 积极认错，坚决不改！,<欢译熊逗逗>: 事无大小，不服憋着。,<白山上>: 不舒坦是不，忍着。[微笑],<Eternitynight>: 爱吃吃不吃滚[doge],<黒水白山城>: 看不惯？忍着！-店主,<山上有只闪光的猫腿>: 勿以事小而为之[喵喵]忍一时风平浪静啊施主,<长不高小不点>: 吃亏不爽什么的，你也只好咬碎牙龈往嘴里吞,<Keiko-_-慧子>: 别屁大点事就叽叽歪歪,<味莪一>: 好好给我吃饭，不许乱说话！,<浮云中的一匹神马>: 亲们，有意见，是吧？憋着！,<希冉一直很認真>: 没事别找我，有事更别找我,<手机用户3300416813>: 如有不满，忍字当头[给力][可爱][嘻嘻],<P4双核>: 哈哈～…～[嘻嘻],<玩命看书的毛桃子>: 有什麼不爽就請憋著[笑cry],<不愿意透露姓名的小公主>: 请不要在意细节[呵呵],<飞鱼小丸子ws>: 不服就忍着[鼓掌][鼓掌],<911果粒橙>: 我就是喜欢你不满我又拿我没办法的样子。,<刘小捻儿>: 想起宋丹丹在小品里对赵本山说:“忍着！”,<MeowAloha>: 店主太有才了[笑cry],<Sophia_Blog>: 中间少了一个字！为什么少了？因为它是——无。,<TRESOR_ART>: 各位客官，本店如若招待不周，事无巨细，烦请忍耐。店主,<邵路军>: 回复 @花花种树  的赞:钦此，是对下面“店主”落款的翻译……呵呵。有体现原文语气转折的作用。,<离家近alex>: 你有不满，请闭嘴哦[微笑][微笑][微笑],<瘦不下去的许大胖>: 给我听好咯，有事也别BB,<邵路军>: 回复 @一只耷拉眼 :原意是：如有感觉不爽之处，哪怕只是一点小事……（本来正常应该下接：敬请告知，我们一定尽力改进，并奉送薄礼…或免单之类的话，但店主话风一转）您还是忍了吧！,<邵路军>: 小店若有怠慢不周，原谅则个。钦此！,<RaisuOnigiri>: @ashesxera  看评论,<irichan>: [笑cry][笑cry][笑cry],<carolynnleeeeee>: 有事别奏，无事退朝～,<翘课看海去>: 不服憋着[微笑],<梓蕗>: 好霸气的店主。。,<杉杉-小宝贝>: 如有怠慢，敬请忍耐,<haruno>: 转给日本开店的朋友，祝她生意兴隆,<狗儿说今年可得清新脱俗>: 不管怎么样都给我忍着。,<小生葉慈>: 有什么不满也别说出来,<不是SHO是SHOww啦>: 各位客人，如果对小店有什么意见，无论多小，都请您自个儿保留。,<C的万水千山>: 爱吃不吃[拜拜],<Isei家的魔術師>: 如有怠慢，敬请忍着！,<结构21趋势>: 有任何不满意的事情，不管大小，请多多包涵！,<刘洛言85>: 对我有什么不满你尽管说出来，反正你说出来我也不会改，你别再憋坏了,<皇尚绿胖>: 你有什么不满就说嘛～反正我也不会改！,<達磨石神>: 小事则忍，大事就滚。,<蚪酱>: 各位客官，如您发现本店有任何不便之处……您就忍了吧！,<YvonneStudio皮皮>: 如果发现碗里有苍蝇，也请闭着眼睛把它吞下去[笑cry],<iamdreamhoo>: 在本店请遵循“小不忍则乱大谋”的原则--店主敬上]
