neihandz	以后再也不能直视这些词了[哈哈][污] ​​​	[<涔上笙歌起>: @Lbw0   你应该关注他我觉得,<-井爷>: 改日行吗？日照香炉生紫烟[污],<狼尾巴摇啊摇>: @GTPan潘家骥,<ZHOUJIAJIE__>: 回复 @LIZHEN_lzlzlz :[轻轨],<LIZHEN_lzlzlz>: @ZHOUJIAJIE__,<花香蕊啊>: @孤独与寂寞无关与青春有染,<努力向前121>: @旋转木马0401,<壹加壹是多少>: [挖鼻]  这样好吗？会不会被打？,<喜欢鹿晗死全家>: 回复 @199509说点儿什么好呢 :张飞说二哥叫云长[笑而不语],<NidaleeMGL>: 回复 @丶无心无念 :[笑cry],<拔兔子的胡萝卜_>: 你喜欢日本帅哥吗 @-Aliceeeeeee,<ZS豆包>: 回复 @想象总是抵不过现实 :你简直是解放了天性哇？,<丶无心无念>: @NidaleeMGL,<假面咒>: 好污好污，我还是个孩子,<天灬涯丬>: 回复 @Vatel有温度的水 :penta kill,<Alice很酷>: @拔兔子的胡萝卜_,<疯狂的幸子>: 回复 @张瑞卿-蓉 :哈哈哈哈,<梅林123>: 锄禾与当午的故事[二哈],<冷漠的小屁孩1996>: 生日快乐，太过分了,<吐槽唐禹哲>: 回复 @炮灰蘭蘭 :我突然想不起来，还有好多呀[doge][doge],<吐槽唐禹哲>: ……行千里，一……不见如隔三秋。哪天王师北定中原……。……久见人心。……以继夜。,<周润秋啦>: 回复 @Vatel有温度的水 :谁知盘中餐，粒粒皆辛苦！[doge],<可董可董>: @我有两瞬间会发光   夜以继日，风和日暖[doge][doge],<愚木6034681187>: 送你俩字:找死！,<院院啊院院>: 回复 @想象总是抵不过现实 :你变了,<我还会回来的9527>: 日出东方，唯我不败,<Vatel有温度的水>: 锄禾日当午，汗滴和下土。就服锄禾，1V3。,<想象总是抵不过现实>: @院院啊院院   @ZS豆包,<川A136370818>: 雪扎高山，霜扎平原，日出水来！,<丑小鸭变唐老鸭>: @bobo是红魔,<冈冈冈冈冈冈>: @Boss_s  久生情,<我是吃人的疯子>: 最后一个过粪了啊,<PULLYOKE_余生>: 回复 @陈啊娟ty :就是你呀[二哈][二哈][二哈]  http://t.cn/RaNtv7z,<唐倩supersugar>: 回复 @Whhhhhh_少侠好走位 :这么酷炫的姿势🤔,<陈啊娟ty>: 回复 @PullYoke_余生 :后再说是谁[doge],<199509说点儿什么好呢>: 图四：（谁）来日方长？？？ 图五：风和（谁）日丽  这是我的问题,<夙颜_>: 日....日.....日本人？？,<沉默不深沉>: @Emperorzjh,<巧克力味儿的胡萝卜>: @我是张琪琪的同桌,<PULLYOKE_余生>: 日后再说[馋嘴][馋嘴],<风里雨里旧城等你h>: @丽江小倩_  快看 笑死了[哈哈],<刘二娃小同学>: @一个处男的小日常,<33-贺>: @-小-新   @v--v-L,<因为爱他才哭过>: @因为爱她才哭过   [允悲][允悲][允悲],<MSN-梅苏内>: [哈哈][哈哈][哈哈],<光消失的地方>: 麻烦小编 多上上网 看点新东西发··,<扁担精>: @一往而深-沈清轩,<Whhhhhh_少侠好走位>: @唐倩supersugar,<有情能使鬼推磨>: 你又没有女盆友[哈欠],<Absolem398>: 好好的一个词变成这样，日！]
neihandz	马冬梅，治好了我多年的耳聋[笑cry] ​​​	[<言吾之信>: 马上有钱，让我过上了富裕的生活,<kiss夏寂>: 马姓 是赵的演变。,<不要忘记人生>: 回复 @不要忘记人生 :马鞭。改变了，嘿嘿嘿嘿。,<不要忘记人生>: 马上来，改变了我对速度的认知。,<下一个微博名你的名字>: 马赛克的那个哈哈哈哈哈哈,<双鱼de浪漫f0f>: 马东，改变了我对一群奇葩的看法～！[可爱][太开心][挤眼],<懿-二代目改>: 回复 @_音讯 :我改变了[doge][doge][doge],<会当凌绝顶z>: 马应龙，一直陪伴我这有志青年的屁股,<如栗RuLee>: @YangCan一  马冬梅啊,<佟宇航5330>: 回复 @夙颜_ :马加爵的666,<邪恶的王GG>: 回复 @夙颜_ :马加爵。。。,<世事苍茫成云烟丶>: 马加爵   改变了我对舍友的看法,<_音讯>: 回复 @懿-二代目改 :你改变了什么[眼泪][眼泪][眼泪],<DAVIDJAM>: 马勒戈壁 改变了我对戈壁沙漠的改观,<FU_CsKn>: 马景涛 改变了我面部的表情,<麦克掰掰>: 马里昂改变了我的投篮姿势。,<王特儿竹笛>: 马屁精，教会了我走上人生巅峰。,<E逼欢乐多>: 马克，颠覆了我对二逼的认知。,<银子胖子oO>: 马龙，改变了我对选老公的标准。,<哇-Wi-Fi>: @公益人马蓉  你怎么看？,<懿-二代目改>: @_音讯   [doge][doge][doge],<顯柱的平凡生活>: 马上就来      改变了我的时间观念[酷],<周帅wei先森>: 段友出征，寸草不生,<拧螺丝的小木匠>: 马什么没[阴险][阴险][阴险],<夙颜_>: 马如龙，改变了我对香港警察的看法[喵喵],<叫我弯弯就好啦>: 翻书：马冬梅 合书：马什么梅 翻书：马冬梅 合书：马东什么 翻书：马冬梅 合书：马冬梅！记住了 考试：玛丽莲,<cibudayi呢>: 马加爵，让我收起枕头下的刀子,<世外惆怅客>: @不要菜菜菜包    @换个名字换运气,<凌原12138>: 马应龙，治好了我多年的痔疮。,<_卷老板>: 骂人的马开头的占据了全世界,<Waopg>: 我姓马 是冬天生的 一生下来我爹就没了,<108大队-猎狐陷阱>: @马占凯  改变了第二条中我们聊天时候的输入速度[偷乐][偷乐][偷乐],<EXO十二只狼夫人>: 哈哈哈！就服你! 喂~你找谁？我找马冬梅[笑cry][笑cry][笑cry]]
neihandz	向女装大佬低头~[二哈] ​​​	[<W梦中猫>: 你是男的又何妨？？？,<费曼德罗>: @-BIGBAOZI  [笑cry],<三级小公举>: @取什么名字才不会被占用啊啊啊啊,<Amphetamine_1996>: 回复 @于我孤奏 :是的,<喜帖街_eason>: 喉结都没有[二哈],<于我孤奏>: 回复 @Amphetamine_1996 :男扮女装？？？？？？？,<Amphetamine_1996>: @于我孤奏   [二哈][二哈][二哈]]
neihandz	今天给人纹身，他还说明天要带他几个兄弟一起过来纹，想想就是商机！[太开心] ​​​	[<笨笨熊丶2015>: @阿兰哒哒   [摊手]左青龙,<以后请叫我纯真小坏坏>: 我有一条小青龙小青龙[笑cry],<紫金花开六月天>: 他可能是叫几个人过来免费给你脸上纹个！,<但衬>: 老板 背上纹条龙,<柚子味的猫c>: 怕是你再叫几个人哦。免得别人说他人多欺负人少。,<你吃把>: 非法纹身[doge]  http://t.cn/Ra9kLFu,<酷酷的付sir>: 和喜羊羊那个是兄弟吧,<Elegy丨挽歌>: 你这是纹身的体位？]
neihandz	现在的人都是机不离身，我一直在想一个问题，古代人没有任何电子产品，闲暇时间做什么消遣？ ​​​	[<-旧-人-不-覆->: 中国人口这么多不是没有原因的！,<吉尔瓦伦丁灬>: 中国成为人口第一大国不是没有原因的[doge],<吐槽唐禹哲>: 回复 @李瑞鑫L :[哈哈][哈哈][哈哈],<李瑞鑫L>: 回复 @炮灰蘭蘭 :乱顶会怀孕,<吐槽唐禹哲>: 回复 @炮灰蘭蘭 :操，居然没有人顶我[doge][doge],<男神美洋洋>: 古代三妻四妾玩什么手机[二哈],<小黄人就是小黄人>: 古代人也是鸡不离身啊[偷笑],<z张先生的微博>: 晚上就啪啪啪.所以以前人生好多孩子,<Suppose丨>: 都一样啊[母鸡]不离身,<韩稳的李明阳>: 后宫都忙不过来  还有时间玩电话？？[喵喵],<-兔兔兔兔兔兔兔兔兔兔>: 古代人的娱乐方式比我们多，出去听戏就是真的听戏，出去吃饭就是真的吃饭，出去喝茶就真的喝茶，现在的人出去干什么都是抱个手机，好单调。,<黄沙里的年华>: 所以他们16岁结婚[摊手],<lucky哓王子>: 孙子：爷爷你们以前没有电脑手机互联网，你们平时都怎么过呀？ 爷爷：臭小子那么多废话，还不赶紧去叫你14叔来吃饭,<卞卞卞变色龙>: 八大胡同，逛窑子,<我他妈上去就是一么么哒>: 所以他们都死了。,<黄家大少70后>: 家里妻妾成群，外面青楼妓院，比我们现代人舒服多了！,<Qe_eQ9527>: 回复 @张宏达有一本故事书i :就服你,<天哪小小军>: 回复 @张宏达有一本故事书i :six six six,<风吹草di烤全羊>: 下棋，喝酒，作诗，做爱……做的事！,<陈叶盛Jason>: 下棋 喝酒 聊天 弹琴都是消遣的方式,<喵爪1314>: 所以啊  过去都是兄弟姐妹十几个啊,<-吃葡萄就吐葡萄皮>: 古代人有三妻四妾是有原因的[doge],<吐槽唐禹哲>: 嗯嗯，文者下棋，武者相互干仗。啥也不会又很无聊的就吵架。。。话说麻将什么时候兴起的啊？[doge][doge],<单身_驴>: 造小孩，生孩子啊,<神仰视我>: 作诗作画练武逛窑子,<一只失宠的小山>: 后宫佳丽三千，谢谢,<_陸人甲_>: 金瓶梅怎么研究的[笑而不语],<你美嘚让我不敢和你说话>: 有一种闲的叫做爱,<小杰杰822>: 他们有赌坊，丽春院,<Unra_Vel>: 回复 @Tommy玩命的追逐 :牛头酋长：牛！逼！！！,<苏弎石>: 吹箫啊～ 一点历史知识都没有～,<你就是个4除2>: 破解啪啪啪的各种姿势，,<hzq325>: 有钱人种人，没钱人种地。,<李朝政so>: 作诗，作画，做爱,<尛咖喱黃不辣>: 要不生那么多孩子,<张宏达有一本故事书i>: 太爷爷：别说那么多没有用的了，快去叫你十七叔来吃饭了,<你的小祖宗吧啦吧啦>: 所以古代人孩子多,<我等你wym>: 王玉梅，李撇撇在等你。,<娃娃鱼ooo>: 可能是古代人发明的撸一发吧,<丶心脏靠左>: 回复 @漫天飘雪丿 :我们要文雅一些…那叫青楼！,<名字太长躲在大树后面会被发现_>: 所以才出现了李师师，陈圆圆等[笑cry],<五星好评凯申物流>: 喝酒吹牛逼啊.....不，做湿！,<誓死不屈的滑稽>: 古代人孩子多，所以你懂[doge],<何武影>: 三十年前就是古代生活,<话盲iii>: 走文艺的  写诗[眼泪],<面包_奔跑>: 读书，考功名，旅游，啪啪啪,<Tommy玩命的追逐>: 回复 @Tommy玩命的追逐 :也是鸡不离身啊,<LAN丶懒人>: 额   写段子书,<漫天飘雪丿>: 古代有个娱乐场所叫妓院]
neihandz	我：老板，买本书。老板：要本什么？我：新华字典。老板：嘘，我给你拿个黑袋子装着，走后门。 ​​​	[<套成>: 回复 @Yao贤运 :滴-滴滴。,<Mr丶丶夏>: 回复 @无常是鬼 :提莫一米五,<z-Hollow>: 看拼音哇[奥特曼][并不简单],<R-有只兔>: 我决定把我家的红皮新华字典藏起来！,<正良th>: 你肯定是今天最 happy的一个,<丶与春秋>: 我觉得这不是涉黄 ，只是一种知识普及,<皮卡Q阿>: 回复 @Yao贤运 :三五瓶？,<LC海南>: 小时候没有新华字典老师还不让进教室[哈哈][哈哈][哈哈],<阿贤哟YO>: 回复 @Yao贤运老婆 :[doge][doge],<一个成精的爱玲酱>: 看图片懂文字不懂,<Yao贤运老婆>: 回复 @Yao贤运 :评论网红提高知名度,<阿贤哟YO>: 回复 @无常是鬼 :段友出征 寸草不生[doge],<无常-X>: 回复 @Yao贤运 :互粉,<无常-X>: 回复 @Yao贤运 :段友出征，寸草不生，，,<阿贤哟YO>: 回复 @无常是鬼 :巨友[doge],<无常-X>: 回复 @Yao贤运 :[眼泪][眼泪]段友，,<阿贤哟YO>: 回复 @无常是鬼 :玉帝日王母,<无常-X>: 天王盖地虎，（巨友们顶起了）,<无常-X>: 回复 @Yao贤运 :天王盖地虎,<Coling_ling>: 你骗我，打不出[喵喵],<zhang蟑蟑螂>: 回复 @小师妹-Tong :姨妈来了合不拢嘴，姨妈走了合不拢腿。,<初二无妄>: 吊大的来解释下啊！,<a木木木木木a>: 回复 @琴棋书画烟酒茶糖 :巨友舅服你,<--三公子-->: 都是老司机呀，我看不懂才来看评论,<吐槽唐禹哲>: 新华字典早就应该列为禁书了[doge][doge],<SheN-Ed>: 网上说新华字典涉黄，但是不知道为什么涉黄,<12D3456h>: 回复 @KylaAries :里面有很多奇妙的文字，比如 否、嫐、之类,<慧眼筛子>: 新华字典也沦陷了？！！,<粗衫素履>: 回复 @Yao贤运 :我就服你,<长臂猿的手比腿更长>: 看到评论都不懂。。。我的好奇心更强烈了,<琴棋书画烟酒茶糖>: 分开读啊    到底不是老司机     巨友前来报道,<KylaAires>: @LEVE007   啥意思,<阿贤哟YO>: 回复 @马梦晨M :内涵段子里面都这样说[二哈],<思念是一种病wan>: 新华字典？？？什么意思呢 @小小怪下士爱思考,<如果当时0404>: 图片评论  http://t.cn/RaK505e,<最佳歌手的格洛米>: 来早了，谁给解释一下[doge],<马梦晨M>: 回复 @Yao贤运 :为什么,<刘东0604>: 新华字典迟早要被禁的[允悲],<阿贤哟YO>: 新华字典距被列为禁书只是时间问题,<认识我>: 几把大的给解释一下]
neihandz	#内涵神吐槽# 段友们配个吐槽语呗~[摊手] ​​​	[<沐夏逝水>: [doge]掉粪坑了？,<德宏街头文化联盟会_马翔哥哥>: 把我毛巾给我递一下，谢谢,<贺小晗>: 这个温泉有点烫啊,<金沐灶漫画>: 哎，别看了，帮我忙把肥皂捡一下,<等一阵风的到来>: 能帮我加个热吗？,<暮落夜雾>: 螃蟹:我操，热死哥了,<朱雀的小时光>: 泡完澡再来个马杀鸡才舒坦。,<s立明>: 师傅前面还有几个搓的？[二哈],<xxxMoNo>: 妈卖批 哪个把火关了！[doge],<侯婷啊婷>: 大哥的洗澡水你们都喝的这么开心～[喵喵],<追梦赤子心XIONG>: 螃蟹:我觉得还能抢救下,<_方瑾>: 我觉得还可以再救一下...........,<孤者1914>: 我死猪不怕开水烫,<躲在春天里看别人过夏天>: 老板 来杯冰水 好热啊,<小马哥点com>: 趴会儿啊，拉的老子虚脱了,<钟情笑笑>: 唔污恶『wu』，我将呕吐,<卖手机壳的95后大叔丶>: 回复 @小马同志____ :兄弟你是要火阿,<tralucenyss>: 螃蟹:我还可以抢救一下[doge],<拔毛的凤凰起飞啦>: 主人！还要不要再热一下,<其实丶一直陌生>: 老板，水脏了，换下水。 我就静静的看着你装B。,<珍惜当下无悔今生>: 太热了，哥出来透透气儿，一会儿老大来了还要继续蒸！,<魁魁0608>: 螃蟹:     瞅啥瞅，说你呢，换个地方继续横着走,<请叫我安六神>: 螃蟹：我就静静的看着你装逼,<AI真的需要勇气>: 老板，来两个妹子搓下背,<__东西>: woc游泳池的水辣么烫  黑店 黑店,<你说晴天会下雨>: @内涵段子   问什么现在段子开始禁止一些言论   有些涉及的事情  不允许段友讨论   一些敏感的话题没有评论显示    群众的言论自由权呢    民主讨论权呢    故意的帮助某些人  某些事遮盖是吗  段子也开始变得不干净了,<M颂颂>: 大哥，拉我一把呗,<千万卢家军>: 你的良心不会痛吗,<Jiiiiiiiiiiiiiiiiiiiiiiiiiiing>: 服务员，来瓶82年拉菲,<黄金都上不了玩锤子LOL>: 我觉得我还能救救,<许士庙街来的憨汉>: 这澡泡的真舒服。,<20lam>: 我就泡个澡 舒服一下[喵喵],<茶女子笑笑>: 螃蟹说：这汤太恶心了，让我出来透透气……,<Vqing丶>: 说好洗澡你咋还放油盐酱醋呢,<周永涛>: 就不能换个大一点的盆嘛[doge],<走着走着就到了心里>: 快给我拍照，我马上要成红螃蟹了,<走着走着就到了心里>: 这个澡好热，快受不了了,<吐槽唐禹哲>: 哼哼，等老子洗完桑拿，就大红大紫了[doge],<遗梦上窗>: 扶朕起来，朕还要宠幸三千佳丽,<生活再糟记得微笑>: 我洗个澡你瞅啥瞅,<来自搜狐的网友>: 你们快来尝尝这汤！真TM香！为什么我也这么香？,<清穗儿>: 螃蟹说:“我觉得我还可以抢救一下！”,<CGNTDNGL>: 让我们嗨起来[眼泪],<冰凝郁尘>: 哎呀我操，这桑拿有点热啊,<小鹿ZLP>: 看我的小眼神儿，别吃我呗,<爱新觉罗--超>: 我认为 我还能再抢救一下,<如果如果有以后>: 兄弟一起来泡澡呀,<絮草翼>: 喂！搓澡的！还愣着干什么，赶紧的啊！,<BeanPaste>: 不好意思，身上泥太多了。,<兜里有塘糖>: 我还能怎么办！我也很绝望啊……,<heidei666>: 哎呦我去，热死我了，,<刪蒢记憶forever>: 我就是出来透口气,<贱_各方面都贱>: 我想我还可以抢救一下,<YA棒棒糖LI>: 服务员加点汤[酷],<Rex方绪欣_MMA>: 太烫，出来缓缓…,<危然>: 嗯，泡澡就是惬意[笑cry][笑cry][笑cry]]
neihandz	尴尬并不可怕，关键是如何强行化解[哈哈] ​​​	[<吐槽唐禹哲>: 回复 @炮灰蘭蘭 :不去看你就奥特了,<Jesse-6e>: 回复 @kian1120 :只是在做健身,<哎呦Z丶HL>: @情愿waitfor,<Loser丶欧>: [喵喵][喵喵][喵喵]以前忘了转发！,<路人阿泽西>: @A老黄的小猫咪,<yy柠檬a>: @搞搞搞搞搞一个,<林萨二>: 最后一个是他么真疼~~~,<Luo-DK>: 回复 @要出走的熊猫 :[害羞][害羞][害羞][害羞],<kian1120>: 图七简直乐崩溃 @Jesse-6e,<w1q1q>: @我是好相处的人,<安honnnNing>: @LIYANRONG597,<尹仙生>: 笑死我了 569,<大-太陽阳阳阳阳>: 回复 @睡不醒的李童鞋 :真是崩溃ke,<你TZ>: @印迹T   泰迪好可爱,<小黑熊KX566>: 最后一个牛逼。下台以后鼻子少一半儿,<我应该在彻底>: 舅父第五个，简直绝了,<任乐要早睡>: @璐哥哥83381,<爱上狂飙>: 最后一个 叫我笑毁了,<我昵称格式不正确>: @猪白菜的小饼干  尴尬,<梦斋书苑>: 回复 @Sadlet :同求出处,<敏酱的小兔几>: 最后一个是真的看一次笑一次,<银子胖子oO>: 没看够。还有吗。[doge],<巴吖巴呀>: @TINGTINGTAN-SMILING    @杨考拉哒,<雾鱼芭蕉>: @Tracy_赵春草,<Sadlet>: 回复 @怪她过分性感 :谢了,<吐槽唐禹哲>: /我微博有视频，这是一款新版摩托车[doge][doge]  http://t.cn/Raoa470,<怪她过分性感>: 回复 @Sadlet :青春失乐园.,<依伊不舍V>: @济南凡事   乐呵乐呵,<得罪了强哥还想走>: 泰迪无敌，寿与天齐,<Sadlet>: 第三个是什么剧啊,<1Mours>: @PLEASEHUGME  [笑cry][笑cry][笑cry],<Mcdullooo>: 回复 @行走而知 :哈哈图三,<大橙子1>: 段友出征，寸草不生[并不简单],<睡不醒的李童鞋>: @大-太陽阳阳阳阳,<小名叫二贺>: @Mcdullooo  哈哈,<烧锅炉的温师傅>: @茗汐茗汐  图3,<冬晶>: @nobodyneed  第七个好有意思,<麦哲伦家的豆豆>: @麦哲伦20170,<YL丶Braveheart>: @哎哟喂searm,<滚出去小明>: [摊手][摊手]]
neihandz	为什么你养的金鱼总会死掉？ ​​​	[<走丶去喂猪>: @Shi光叫我别念Ta    @这个少女不太热-,<黄佳善姓黄>: @0205_YAN,<小亲爱的>: 鱼：说出来你可能不信 我是被丑死的[doge],<一笔画情hua>: 每七秒钟就要被吓一次。能不死吗,<你丑你先走吧>: 扎逼了，老铁[微笑],<17Kuangkuang>: 难怪经常看金鱼容易死。反而不管它还难死,<勒是雾都嘟嘟嘟>: @-小黑先生   哈哈哈哈哈哈,<1982陶>: [吐][吐][吐][吐][吐][吐][吐][吐][吐],<小博子___>: 我以为它是黄鳝，所以。。。,<米诺娃TT>: 回复 @xue_Allison_xue :奇葩葩小黄啊,<xue_Allison_xue>: 回复 @米诺娃TT :能不能不要给我乱改名字嘛！,<米诺娃TT>: 回复 @xue_Allison_xue :[笑cry]怎么会，只是觉得你来我会安心点。雪儿你的手机为什么会有来自奇葩葩的小黄iPhone的标示,<xue_Allison_xue>: 回复 @米诺娃TT :你就刺激我吧,<米诺娃TT>: 回复 @xue_Allison_xue :[干杯]你要来么？我们来巧遇,<xue_Allison_xue>: 回复 @米诺娃TT :玩的开心哦,<米诺娃TT>: 回复 @xue_Allison_xue :已经在机场了，路上估计还有个十多分钟,<xue_Allison_xue>: 回复 @米诺娃TT :你出发了吗,<米诺娃TT>: 回复 @xue_Allison_xue :[笑cry]对对对,<xue_Allison_xue>: 回复 @米诺娃TT :皮皮虾吗,<迈克児乔克>: 我说我养金鱼这么容易死,<A隆先森>: @Hmmmmmmmmmmmmmmmmmmm,<superbella阿>: 回复 @Mac_____ :蜜汁微笑,<米诺娃TT>: 回复 @xue_Allison_xue :因为是虾,<xue_Allison_xue>: 回复 @米诺娃TT :我养的鱼没死呀哈哈哈哈！你觉得是什么原因？哈哈哈哈,<拾荒去流浪>: 养了一年死了N条金鱼，今天终于找到原因了[二哈][二哈][二哈],<Mac_____>: 回复 @superbella贝拉 :唔怪得你话养唔到嘢,<superbella阿>: 回复 @Mac_____ :哈哈哈哈 好似係,<Mac_____>: @superbella贝拉,<黑天鹅ccccc>: 因为鱼只有七秒记忆 你看它一次它吓一次,<子寓鹏>: @胡9怪  哈哈哈哈哈,<我超级热>: 回复 @ENNIS5 :哈哈哈哈哈哈哈哈哈哈哈,<米诺娃TT>: @xue_Allison_xue  科学道理,<好英明>: @随风飘的小亮   我大概明白了,<牧非1996>: @自在如风only,<心里是不是跟着念了>: @春困猪  哈哈哈,<污萌姐妹>: 回复 @铜离铜离slash :哈哈 笑死我啦 [污],<她超级热>: @他超级酷-  笑死我了🤣🤣🤣,<铜离铜离slash>: 七秒前：这个人好丑吓死我了；七秒后：这个人好丑吓死我了…]
neihandz	这是我们被黑的最惨一次！ ​​​	[<elmier>: @漂浮的小瑜儿   [眼泪] [眼泪] [眼泪],<田队->: 回复 @机智勇敢的怪叔叔 :妖怪放了我爷爷！,<南小鸟是我的>: 关注之后，身体一天不如一天了,<机智勇敢的怪叔叔>: 回复 @田队- :带上会喷水的四娃就行了！,<田队->: 回复 @机智勇敢的怪叔叔 :我带五个兄弟伙来救你吗？,<机智勇敢的怪叔叔>: 回复 @田队- :我要死了,<田队->: @机智勇敢的怪叔叔,<i男票一米八>: 回复 @__博主腿长1米2你敢不敢来比呀__ :你要是不刮胡子，我就不刮毛[doge],<雨后_林_晨__>: 蝎子精：会喷水的那个交给我来解决[笑而不语][笑而不语][笑而不语],<雨后_林_晨__>: 回复 @千层套路与千層套路 :求价位[doge],<我是你飞叔啊>: @给我来斤梨i   哈哈哈,<妙妙小仙女mua>: 一大早要笑死我好继承我的支付宝？？,<__暗里_着迷__>: [笑cry][笑cry][笑cry],<薛哲辉_XZH>: 噗…………刚吃下的早点啊,<朝霞孤鹜>: @小巨巨是小baby   哈哈哈哈哈哈,<原单菌>: 回复 @__博主腿长1米2你敢不敢来比呀__ :老铁没毛病,<剑南节度使>: 叫上三个姐妹一起来吧，一个怕你吃不消，，  通宵麻将需要体力,<原单菌>: 话说有位老铁，竟然不长毛，咋回事儿呢[doge],<千寻的心_>: 原谅我发出了杠铃般的笑声]
neihandz	小动物们打瞌睡的瞬间，太萌了，把我都看困了！[太开心] ​​​	[<EI木先生>: @污里哇卡蹦蹦蹦    @这一秒我想你了   小兔叽是把自己摔睡的[笑cry],<凹凸君的看板娘>: 回复 @凹凸的墨染 :好可爱！！！！,<10米深蓝>: @fruityjelly,<_不止眼前的苟且>: @咕噜咕噜咕噜咕噜噜咕咕,<你是杨林高的小太阳>: @省略是审阅的点点,<祁雁来>: 回复 @解雯晴天 :[太开心][太开心][太开心],<是凌不是淋>: @凡大大的小小凡,<解雯晴天>: 回复 @祁雁来 :哈哈哈第三个[坏笑],<分岔路口向左或向右>: 回复 @惠姑爱宅着 :兔子[兔子]睡觉我服,<OkHeidy逗>: @杨鑫蔚不想用真名,<心瑶垚>: 回复 @羞路人 :哈哈哈哈哈哈   兔子为什么这么快,<凹凸的墨染>: @凹凸君的看板娘,<惠姑爱宅着>: 回复 @分岔路口向左或向右 :好萌啊[眼泪],<心瑶垚>: 回复 @羞路人 :我也困的不行了[感冒][感冒][感冒],<浅墨一世>: @轻轻轻侵袭我心  [偷笑][偷笑],<Julie-Maniac>: 回复 @Julie-Maniac : @About_皓,<Julie-Maniac>: 我超像第8图，倒下就睡着,<大张张0301>: @昵爱z-k  [允悲][允悲][允悲],<MENGDEBINBB>: @Lucilla-,<同学叫我詹姆斯>: 哈哈哈，小狗可爱,<小乌鸦飞呀飞>: 我家兔子就是这样前一秒还特精神 吃东西，后一秒翻身睡着了……,<i男票一米八>: 图7好像上学的时候打盹[笑cry],<宿宿宿su>: 兔子过分了啊，睡得快射的快]
neihandz	过分了啊，老子都道歉了！[喵喵] ​​​	[<木易笙萌>: @如果你也听说75,<宇宙无敌大叶子>: ？？？？是你吗[眼泪]  http://t.cn/RaXbLcB,<愿长夜有人陪你聊天>: 回复 @你哭起来真丑ii :哈哈,<只要你有酒去哪我都走>: 以前读大学的时候，我有个舍友逃课在宿舍睡觉。宿管阿姨跑去叫他，怎么都不肯醒来。然后宿管阿姨在外面贴着一张纸条，写着：307宿舍2号床同学在床上硬不起来,<贝尼抗癌学院>: 我也可以向你道歉啊,<长耳朵萌萌兔>: @奈落大王  过分过分]
neihandz	4个人4张卡，让服务员抽，抽到哪张卡，谁结账！以后吃饭就用这招了~[笑cry] ​​​	[<黑米君Ry>: 在中国是不是抽手机,<九爷好销魂>: 我只注意服务员去了,<她们喊我--杨da炮>: 还可以把大家的手机拿出来，让服务员选,<顾新的小屋>: 这个好[污][污][污][笑cry][笑cry][笑cry],<lmw唔>: 明明就是想调戏服务员,<MT马少>: 这服务员太美了吧[开心],<rangoF>: 主要还是服务员漂亮[doge]]
