neihandz	有个好色的女票是种什么体验？[doge] ​​​	[<明娟dare>: 回复 @吐槽唐禹哲 :我没有男票,<兰_老汉>: 没有耕坏的地，只有累死的牛,<tttoooyy>: 1+1×2＝？什么意思啊,<当结束后便是开始>: 回复 @等故事都经过 :我想你是呢[二哈],<等故事都经过>: 回复 @当结束后便是开始 :我又不是[二哈],<当结束后便是开始>: 什么感觉 给我普及一下知识[二哈] @等故事都经过,<锦衣卫朵儿>: 关于还能否贴车贴的问题？我们都想搞清楚?,<兔子小姐姐姐姐姐姐姐姐>: @小北-678  哈哈哈哈哈,<我好喜欢打架鱼的>: 我想问一下，你们男朋友都会要求你们帮他口吗？,<男保姆阿文>: 我来这里就是想问问段子怎么了？一个正常的视频你都不让我通过？段子哥你想怎么地？说说吧,<鸡蛋黄LJW>: 来个男朋友。[污][污],<把鸡腿给我>: 想体验  http://t.cn/RNoNGT1,<没什么关系最好>: 回复 @我是木子小李 :就想试一试腿软的感觉[酷],<許vincy>: @Mr_Gao_HFUT,<豆豆是街霸>: 回复 @宿宿宿su :牛批,<我_何建伟>: 诚信互粉，有粉必回！！！,<我是木子小李>: @没什么关系最好  就问你怕不怕,<WA王王王王王王王XYYY>: 段子哥，我就想问一下内涵段子TV可以贴车吗？,<甜甜甜甜蜜蜜呀>: 听说你膨胀了？ 不让段友们在车上贴logo了？,<壬口玉人>: @solo伞   @万万没想到之阿宁切克闹  哦,<艾齐AllStar>: 你们的车？  http://t.cn/RNio9FW,<滥情改变不了现实>: 回复 @阿权权啊 :[加油][加油][加油][加油],<阿权权啊>: 回复 @滥情改变不了现实 :还好我能把持[二哈]不然废的就是你,<滥情改变不了现实>: @阿权权啊  给我个评价,<一只甜乔s>: @彭逸潇Wayne  ？？？,<Liu_Meteor>: @一只图图酱噢  只是给你看看，没有其他意思[污],<-哈哈好高兴>: @-哈哈好高兴 : 我之前内涵段子是用qq登录的。用了两年收藏了好多东西，结果今天重新下载用qq登陆之后发现所有的东西都没有了，这是什么原因？ @内涵段子   有没有和我一样的,<-哈哈好高兴>: 我之前内涵段子是用qq登录的。用了两年收藏了好多东西，结果今天重新下载用qq登陆之后发现所有的东西都没有了，这是什么原因？,<骑乘Lucky-NeO欧>: [并不简单]今天在广东韶关武江区工业中路看到粤B车屁股贴着很大的内涵段子，是不是你们啊[嘻嘻][拍照],<小钻风哔哔哔>: 回复 @总钻风哩哩哩 :你有切掉的想法[悲伤],<GUAN_小_黑>: 666都是段子手！[鼓掌],<木十八假裝在地球>: 这不叫好色，叫性瘾 @尛冶貓,<YUS1YAN>: 回复 @鸹VIBRATIONS貔 :[喵喵],<鸹VIBRATIONS貔>: @YUS1YAN   很骚,<炎野之>: 真的没什么体验不骗你们。日久日大,<maroon壹>: @Ursoc-Wu,<踏浪追风3>: 段子哥为什么我的投稿被封,<单字一个南i>: 段子ID    Durex总部    我有个投稿标题就是这个,<晒娃娃的大杏仁>: 昨天。我看到后面车窗贴着内涵段子的车，出现在青秀城。是你不？,<哈噶Man>: 回复 @就是你的萝莉俏啊i :司机…停车 我要下去[doge],<黄宇Z>: 有个性冷淡的女朋友是什么体验？,<你把我灌死>: 三星s8app秒退是什么原因啊,<Lyn-619>: 有个会停车堵大门的是一种什么样的体验能说说吗？[哈哈],<我叫夏奇>: 女人好色起来比男人还可怕[害怕],<红成哥哥>: 回复 @红成哥哥 :已经麻木了[白眼],<蹦擦擦try>: 回复 @久矣· :被吓的,<蹦擦擦try>: 回复 @红成哥哥 :打飞机跟啪啪啪能一样啊,<蹦擦擦try>: 回复 @惠贤周周 :哈哈哈,<蹦擦擦try>: 我有个大胆的想法,<Xx久久不遇xX>: 现在十一点零七，我打字慢各位见谅[允悲][允悲]  http://t.cn/RC17wn7,<JAM_WANGG>: 回复 @谢金献 :哈哈哈,<谢金献>: @JAM_WANGG   @JAM_WANGG   @JAM_WANGG,<娃娃鱼咩咩>: 回复 @Li_JiaChang :带我飞,<eleson大斌>: 回复 @35码脚步的女子 :每次烧烤必点腰子，容易么我,<-士多啤麗妹妹->: 回复 @-LeiHuayu :[亲亲],<-LeiHuayu>: 回复 @-士多啤麗妹妹- :[白眼],<35码脚步的女子>: @eleson大斌  我呢[污],<美女小姐姐带你网赚>: 何以琛等了赵默笙   7年 孙悟空等了唐僧       500年 易小川等了玉漱       2000年 夜华等了白浅          三生三世 我等你找我做简职    从未离开       想做简职的私聊我 ​​​]
neihandz	这个图有两点，你发现了吗？[doge] ​​​	[<_洛泽_>: 回复 @全小四全起灵张起四 :老污婆别比比[doge],<全小四全起灵张起四>: 回复 @_洛泽_ :没看懂,<_洛泽_>: 回复 @全小四全起灵张起四 :你没看懂？？我擦,<全小四全起灵张起四>: 回复 @_洛泽_ :没看懂,<左右手风再起时>: 女的在给男的撸 男的在抠女的下面,<_洛泽_>: 我擦[笑cry][笑cry] @全小四全起灵张起四,<宝贝臭臭199410>: 回复 @BL1ZZARD :同时这个女的咬了下嘴唇，手也在动，男的……,<Cecilia胡婷婷>: 回复 @EasyPooon :[黑线],<EasyPooon>: 回复 @Cecilia胡婷婷 :明天验证一下,<搞笑视频121318>: 真的多人，悄悄吃坨屎应该没人发现吧[二哈],<king同学爱老师>: 回复 @BL1ZZARD :这个手的位置离裤裆有点小远,<你美嘚让我不敢和你说话>: 男的舔嘴唇说明想上这女的 女的咬嘴唇说明想被这男的上[doge],<HuangSIyan呐>: 男的闻到了女的口臭。,<lizixiang00>: 失利运动员接受采访，说到遗憾处，记者也跟着惋惜,<周初见i>: 这迷人的小眼神 也是没谁了,<喵小姐姐呀zjy>: 回复 @起个牛逼的名字太难了 :[嘘][嘘],<起个牛逼的名字太难了>: 回复 @喵小姐姐呀zjy :都是老司机，任重道远啊,<l法学院的许可>: 重点是女的的手和男人的距离所体现出的男人的尺寸…,<咮咮咮-Lucky>: 等等我[小黄人高兴]～嗯？[小黄人无奈]不好意思，等错车了……,<XITAnthony>: 他只是想喝水[摊手][摊手],<房东的汪>: @小红帽lwj   看懂了吗[眼泪] 哈哈哈哈哈哈哈,<文案能当饭吃>: ye,ye,ye，wo。。,<余航丿>: 下半身 才是亮点,<yang_别总说来日方长>: 回复 @琅琊山没有五壮士丿 :[允悲],<小阿英喔>: 点在哪啊，看瞎了,<优雅的黑白_转身>: 男的胸肌比女的胸大，女的握话筒的姿势很销魂,<洋二娃的爸比>: 回复 @刘洋84388888 :没看出来女的手很有节奏感么，两个人看起来都很舒服[doge],<喵小姐姐呀zjy>: 回复 @琅琊山没有五壮士丿 :看了评论就发现了啊🤓🤓,<洋二娃的爸比>: 回复 @喵小姐姐呀zjy :你没发现男的胸比女的大么？你没发现他两都在摸下体么[摊手],<Cecilia胡婷婷>: 回复 @EasyPooon :是的！一脸渴望🙉,<EasyPooon>: 回复 @Cecilia胡婷婷 :真滴墨？,<涂什么墙赶紧嗨>: 女的咬嘴唇，男的舔了一下,<Cecilia胡婷婷>: 回复 @EasyPooon :我看你就是这种眼神,<EasyPooon>: @Cecilia胡婷婷  这小眼神,<邓超-zzz>: 杯子是放在什么上面的 女的手在推磨么,<l忆挽青笙尽>: 回复 @内涵段子 :一入段子深似海，从此节操是路人,<LUMIAODING_OFFICIAL>: 只是在找你记着胸部那俩点[污],<法号建人>: 有没看到两点，看到了三点。,<贾俊远>: 声音呢？声音呢？把链接发过来，不然就举报你，，，,<我喜欢你喜欢我喜欢的你>: 女的在采访这个男的  然后这个男的很激动  拿杯子流眼泪   想就出一大罐  然而什么都没有  于是女的有点尴尬,<脉搏上de璀璨>: 这不是去保健院的车，我要下车[doge],<Mr超C>: 是女的看男人的眼神就想，自摸,<jinni哒哒>: 那女的帮他撸？🙈,<笨v拉灯大叔>: 不然你以为玻璃杯靠什么撑起来的[doge],<内涵段子>: 回复 @BL1ZZARD :你很有前途，跟我一起编段子吧,<你看人家开元>: 我是来看评论的[二哈],<不怎么玩的微博>: 回复 @喵小姐姐呀zjy :[哼][哼][哼],<小损洋儿>: 疯狂输出好像太狂了，中等输出吧,<金刚虎路瓦_727>: 女的左手在活动，然后高潮表情[污],<孤酒巷痞>: 男的吐舌头，女的咬下唇,<喵小姐姐呀zjy>: 回复 @不怎么玩的微博 :[污][污],<不怎么玩的微博>: 回复 @喵小姐姐呀zjy :我是新手啊]
neihandz	跟你对象说三遍我要会有什么反应……[污][污][污] ​​​	[<谢金献>: @JAM_WANGG  我要！,<-苏婉晴>: 第三个笑死我了 哈哈哈哈哈,<没有颜色的水流>: 回复 @不合群的喵五郎 :哈哈哈，看到了[嘻嘻],<-CHENGH>: @sutra-z,<不合群的喵五郎>: 回复 @没有颜色的水流 :你往下翻   你是没看完那张图吧[眼泪],<咲梚眦>: 给你，旺旺碎冰冰[挖鼻],<李倩221>: 回复 @偷吃奥利奥的奥利奥 :我才不要说,<偷吃奥利奥的奥利奥>: 回复 @李倩221 :下次你可以当面给我说这三遍,<黄先森杰森不嗨森>: 关键是要有个对象[允悲][允悲][允悲],<ilamfox>: 回复 @一个废材芝士 :尬聊,<李倩221>: @偷吃奥利奥的奥利奥,<帅帅的斌6278262990>: 回复 @Cxx星哥_ :假装看不到水印[doge],<一只图图酱噢>: 回复 @Liu_Meteor :你要喝奶,<Liu_Meteor>: @卑微神  老婆，我要，我要，我要[可爱],<宋宋宋宋施恩>: @文静婧呐_  我也要,<橘子气味vin>: 回复 @大侠我是一只小小鸟 :扎铁了，老心[允悲][允悲],<南栀初夏>: [允悲][允悲][允悲],<NautralLeung>: 熏疼图[8]️男主,<Saxonsc>: 回复 @Doris_刘小君 :最后一个自娱自乐？[允悲],<夏小胖的悠哉游哉>: 回复 @怪叔叔夏夏 :我就说套路蛮,<Doris_刘小君>: @Saxonsc,<Terminallying>: 第六个男朋友是抽奖抽来的,<怪叔叔夏夏>: 回复 @怪叔叔夏夏 :[污][污][眼泪][眼泪],<怪叔叔夏夏>: @夏小胖的悠哉游哉   http://t.cn/RC781x2,<大张旗鼓_>: 哈哈哈哈哈哈笑死了,<Deceber_29>: 回复 @自恃阿 :我是这种人嘛[doge]说对了我就是这种人[阴险],<自恃阿>: 快去找个男淫说 @Deceber_29,<此昵称不可用我知道了>: 回复 @橘子气味vin :图八厉害，感觉这位的肾在抽动,<此昵称不可用我知道了>: 回复 @叫我昡昡i :他是对你有意思吧,<能给我个机会爱你吗>: 回复 @一梦梦三年1 :巧了我老婆也是迪丽热巴,<一梦梦三年1>: 回复 @能给我个机会爱你吗 :是的但我爱我老婆迪丽热巴[doge],<zhang侃>: 就服那个自己曰自己的！[白眼],<骗人丨情话>: 回复 @薄凉性 :滴  滴滴,<周木子呀>: 回复 @叫我昡昡i :因为我想给你看第一个[微笑],<A_katy>: @解忧杂货铺的猫,<橘子气味vin>: 最后一图我墙都不扶就服你[允悲][允悲][允悲],<一直就叫董筅笙>: 回复 @_Mebeforeu :你有求我必硬！,<随风流浪到远方>: 第三张那个很有灵性啊，不觉得吗,<_Mebeforeu>: @一直就叫董筅笙,<g-最佳损友哦>: 回复 @一ZY一 :你要吃屎,<一ZY一>: @g-最佳损友哦,<hercule-poirot>: 愿天下有情人和平分手[二哈][二哈][二哈],<Cxx星哥_>: 回复 @阿土圆圆 :[污][污][污],<颖宝的迷妹i>: 最后一个扎心了[允悲],<小霞槑槑>: 这一个月不要了吧。我听出了其中的心酸[哈哈][哈哈][哈哈],<小屁孩的乐哉生活>: 羡慕有几个号的人，可以和自己聊天。,<Leonardo_LOVE_>: @笑看天下烦心琐事,<Fantastic11->: [拜拜][拜拜][拜拜]  http://t.cn/R9Ecolt,<Nouveau_Depart>: @盒子太圆_Box,<阿土圆圆>: 回复 @Cxx星哥_ :仙女，能撩吗[doge],<周初见i>: 第二天一巴掌伺候在我脸上[微笑],<Cxx星哥_>: 回复 @阿土圆圆 :哈哈哈哈哈,<T丶柠七>: 回复 @周木子呀 :有故事[污],<郭郭郭清宇>: @崔勝鉉今天又帥了嗎]
neihandz	送给那些怕鬼的女孩子 暖心诶[爱心][爱心][爱心] ​​​	[<小霞槑槑>: 并没有舒缓我，看完我特么更怕了[二哈],<幺幺白木L>: 回复 @LOTA1991 :[哼]就不 略略略,<LOTA1991>: @幺幺白木L  [笑而不语]快和爸爸一起看恐怖片,<孤独的大刚>: 回复 @六六爷的二哥 :确实有鬼啊。，只不过共产党不允许而已,<Dou0豆丁>: 小仙女们加我[心],<琥珀色黄昏像糖丶>: 真的有鬼，不信你可以讠,<KKNIGHT丶>: 回复 @榴莲少女耶 :哈哈哈哈[抱抱][抱抱],<榴莲少女耶>: 回复 @KKNIGHT丶 :看了以后更可怕了 薛薛[泪],<叫我徐官人>: 回复 @Chencoeur :我怕个屁，是你在怕,<专业搞基二十年>: 那里暖心了啊喂！[二哈],<塞上江楼月>: [哼][黑线][黑线],<冷面寒枪俏罗成2>: 回复 @刚下凡的_小仙女儿 :新手遇到满级大神，怎么打,<Xinn89Ts>: 回复 @VVHL12138 :7图九吃了[并不简单],<Xinn89Ts>: 回复 @阿尔博特_爱因斯坦 :还有死鬼[并不简单],<老18丶>: @西瓜桑不是酱-,<少年与恶犬>: 额  我也怕鬼[汗],<阿尔博特_爱因斯坦>: 回复 @六六爷的二哥 :对呀，我也好想遇到个鬼瞧一瞧，这样生后就少了寂寞了,<阿尔博特_爱因斯坦>: 回复 @暴走萝莉Zzzzzzzzzz :胆小鬼，饿死鬼，小气鬼，很多鬼，我勉强算个色鬼,<Chencoeur>: @叫我徐官人  不要害怕,<刚下凡的_小仙女儿>: 鬼吓死了你，你变成了鬼，然后：刚刚特么是不是你吓死老子的！！鬼：………,<轻松熊不轻松嗄>: 回复 @亲吉己 :呸 ！ [doge]滚蛋啊智障儿,<亲吉己>: 回复 @轻松熊不轻松嗄 :磨京  爸爸在身边  他不吓你我吓,<KKNIGHT丶>: @榴莲少女耶  别怕,<轻松熊不轻松嗄>: 回复 @亲吉己 :66666666[doge] 越长大越胆小,<亲吉己>: @轻松熊不轻松嗄  哈哈哈哈哈哈哈哈哈哈哈,<_歐陽_Zm>: @粒粒的小宝贝啊_ZYQ,<VVHL12138>: 7呢？被你吃了？！,<谨洛颜>: 好想笑怎么破？我也胆小，哈哈哈,<没梦想的网瘾少女6>: 看了这些我更怕了 本来都不知道那些地方有的。,<黑市野鸡>: 我说我怎么老被鬼压床[眼泪]  http://t.cn/R98Jbjk,<__哦哦哦哦哦哦哦哦哦>: @-Zoelee,<NIM-IUH姐姐>: @一颗柠檬一朵瓜,<敢疯狂拥抱敢将伤痛忘掉>: @Jokeriliar,<这不是大悦嘛>: 等一下，怎么没字？？,<罗悦iii>: 我看完更他妈害怕了！,<子a在川上曰>: 人鬼不一种族，思维不一样,<刘蜜桃rr>: @青春在得瑟  [泪][泪][泪]这些好感人 能暂时缓解我这个小心脏,<我爱刘昊然小鲜肉>: 这么可爱的鬼  [偷笑],<爱耍牛氓>: 回复 @暴走萝莉Zzzzzzzzzz :我信了！,<六六爷的二哥>: 真的其实有鬼是个好现象，真的如果没有的话，人死了就什么都没有了，然后烧了，然后埋了，然后化作土被吸收了，如果有鬼就不一样了，至少我们知道我们死后会怎么样,<暴走萝莉Zzzzzzzzzz>: 相信我 有鬼～[泪][泪][泪]]
neihandz	#内涵问答# 男生从未啪啪啪过是一种什么体验？ ​​​	[<wufarui>: 回复 @看我有多怂 :95的不敢说,<pUtInGbIn蜀黍>: 回复 @常会长y :对,<看我有多怂>: 回复 @鸡蛋糕跟你嘴角果酱我都想尝 :哦  好吧,<鸡蛋糕跟你嘴角果酱我都想尝>: 回复 @看我有多怂 :不正常吗？？25岁之后才可怜吧,<鸡蛋糕跟你嘴角果酱我都想尝>: 回复 @肉肉胖胖 :你第一次多大,<鸡蛋糕跟你嘴角果酱我都想尝>: 回复 @肉肉胖胖 :和女朋友吗,<用户6264344077>: 多半是废了[小黄人得意],<常会长y>: 要不要做小公主，只吃jb不吃苦,<常会长y>: 回复 @星辰南梦 :你们说的好有道理,<常会长y>: 回复 @肉肉胖胖 :很强兄弟,<常会长y>: 回复 @pUtInGbIn蜀黍 :不敢动是想射了吧,<敬祎Eleven>: 回复 @-SENTIMENTAL--- :[二哈]还能什么感觉，就是撸呗！幻想！哈哈,<-SENTIMENTAL--->: @敬祎Eleven   快来喊寒假时候的你回答一下啊我想知道！！！！,<未变爱发呆>: 因为这样我成功认识我的内人，五指姑娘,<看我有多怂>: 回复 @高傲的王1980 :丑八怪唉唉  唉唉唉,<高傲的王1980>: 回复 @看我有多怂 :兄弟你真能忍 96年都可以,<六六爷的二哥>: 回复 @Terminallying :哈哈，我最喜欢吃榴莲了所以不怕,<Terminallying>: 回复 @六六爷的二哥 :你这么聪明她准备用榴莲把你熏翻,<六六爷的二哥>: 回复 @Terminallying :不要以为弄个榴莲给我吃吃我就会妥协,<Terminallying>: 回复 @六六爷的二哥 :你老婆准备好榴莲等你了,<Terminallying>: 回复 @傻乐的乐 :男人30一枝花,<傻可爱墨迹厄纳>: 包皮不破头[哈哈][哈哈],<睡不够坚强>: 双手起茧，律动加强，撕心裂肺，藕断丝连,<特仑苏996>: 看见美女就有一种不含而立，冲洞的想法,<余笙Anning>: 回复 @傻乐的乐 :水土不服 舅扶你。,<Ferent>: 啪啪啪是什么[费解],<橙Butcher>: 回复 @伐不累toys :爱一个人不能天天想着草她[坏笑],<出云气>: 回复 @壮壮君家的金毛 :只怕出不来,<咸鱼哎池>: 回复 @南栀im- :哎呀太美啦,<南栀im->: 回复 @咸鱼哎池 :666,<伐不累toys>: 回复 @橙Butcher :破处了吗？,<花宇满楼>: 回复 @刘二狗村口卖狗 :厉害了  小哥哥,<看我有多怂>: 回复 @宝宝在你身边 :妈妈,<宝宝在你身边>: 回复 @看我有多怂 :96的，我儿子都会打酱油了[笑cry],<樂哥哥6337071115>: 回复 @咸鱼哎池 :唉,<举起酒杯笑着泪>: 看完感觉我可能要性冷淡了,<欺诈师joker>: 回复 @贺悦啊 :[摊手]你什么意思？嘲讽吗？你要试试吗[doge],<一坨正在奔跑的五花肉>: 回复 @咸鱼哎池 :听说过没见过,<咸鱼哎池>: 回复 @一坨正在奔跑的五花肉 :你，，，去过吧这么懂,<咸鱼哎池>: 回复 @樂哥哥6337071115 :唉没办法。她不行,<贺悦heyue>: @欺诈师joker,<樂哥哥6337071115>: 回复 @咸鱼哎池 :第一次见有嫌时间长的,<一坨正在奔跑的五花肉>: 回复 @咸鱼哎池 :我猜的，猜的，,<咸鱼哎池>: 回复 @一坨正在奔跑的五花肉 :你说对了。。我就是去了，因为,<咸鱼哎池>: 回复 @樂哥哥6337071115 :哈哈,<一坨正在奔跑的五花肉>: 我才二十多岁你就问这个？？？,<一坨正在奔跑的五花肉>: 回复 @咸鱼哎池 :兄弟听你说这么像嫖娼呢,<WANG正超>: 回复 @肉肉胖胖 :[眼泪][眼泪],<孤独的大刚>: 回复 @壮壮君家的金毛 :一样一样。。不过我和你一样找个人先试试,<95年出生的空巢老人>: 你说什么呢[doge][doge]我怎么听不懂[doge][doge],<起个牛逼的名字太难了>: 回复 @SSSnnni :666,<用户5841118970>: 回复 @一曲琵琶男 :男的还会痛？,<樂哥哥6337071115>: 回复 @咸鱼哎池 :腻害了,<浴雪飞魂>: 回复 @real张潮 :嗯，是如果感到幸福你就拍拍手,<浴雪飞魂>: 回复 @南风处处 :你应该谢谢他的前男友,<触不到的信笺>: 小编，需要回复的操他妈,<LonglegsGG>: 回复 @内涵段子 :你想让我半夜抓你肛一波?]
neihandz	我的前半生——总是坑爹的朋友想害朕[微笑]你身边有这样的坑货朋友吗？ ​​​	[<zynxwrwsf>: @刘璐-大璐璐  图三笑死我了,<糖糖欧尼咩>: 好疼 @ZHY_有潜力的小胖子    @皮蛋欧巴咩,<Hello-谢先生____>: 回复 @鲸鱼之恋CFA猫舍 :尴尬  回复错了…,<旧笔迹>: 3333看起来很爽的样子哈哈哈哈,<残年梦>: 三其实很疼的 内裤被勒成一条勒在下面很疼的,<段继文s>: @不愿失去这最后,<肉包酸奶小树他爹>: @whosoever_,<Superman小霸王>: 国外内裤质量真的是可以[二哈][二哈][二哈],<Beyond_lby91>: @B1ta0_910626,<詹老闆>: @zrllovejus,<Aaron98启>: @Yang_作作,<佩佩猪哦>: 看到图六实在憋不住了[眼泪],<盒子視界>: [吃惊][吃惊],<你喜欢的蜗牛睡着了>: @sapientia_lee,<No_1->: @林林lin霖霖,<鲸鱼之恋CFA猫舍>: 回复 @Hello-谢先生____ :戴眼镜都知道 那一下特别疼,<1Mours>: @PLEASEHUGME,<偶然冫>: @温文尔雅小啊萍,<Hello-谢先生____>: 图八我真的会捅死他,<晓罟>: @To丶致美丽的你,<X-Teacher马>: @哎呀piupiu,<醒晨->: 回复 @哈库呐玛喳喳 :这可不高贵,<哈库呐玛喳喳>: 回复 @醒晨- :哈哈哈哈哈哈他那个表情哈哈哈哈哈哈哈哈 无聊个p！,<醒晨->: 回复 @哈库呐玛喳喳 :无聊ớ ₃ờ,<哈库呐玛喳喳>: hi哈哈哈哈哈哈哈第五个笑死我了 @醒晨-,<Uoooooooood>: 疼啊[允悲][允悲][允悲],<曾经秒杀一条龙>: @wisteria0103   防不胜防啊,<青春的请输入昵称>: 已经被我的40米大刀给咔嚓了,<cc_-kitty>: 回复 @Dr-CharMing :氢气的话就飞走了 ，空气的话不会爆炸吧,<破竹轻响>: 图三的内裤哪买的，哥也要买来送……自己穿[笑cry][笑cry][笑cry],<cc_-kitty>: 回复 @Dr-CharMing :氧气什么的吧,<戴眼镜的老甘>: 第三张图，一定很爽吧[doge][doge],<Dr-CharMing>: 回复 @cc_-kitty :那个气球里面装的是什么气体呀,<cc_-kitty>: 回复 @Dr-CharMing :气球那个过分了啊 估计要吓尿了[doge],<Dr-CharMing>: @cc_-kitty]
neihandz	男人和女人的区别大全[挖鼻]谁要是全过我，我就…… ​​​	[<你玩的好6啊>: 回复 @不过是个过客 :哈哈哈睁大你的眼睛，一天天的脑子里想的都是啥玩意儿,<如果1364582>: 各位兄弟姐妹们。去我微博里面帮忙转发一条微博。是关于网路诈骗的。谢谢,<No丶别这样>: 很形象啊   段哥[doge][doge][doge][互粉],<苏州城外的微笑1987>: 回复 @薇薇安名字太难起517 :[眼泪]也有奇葩的不是这样的,<L夏7瞳>: 我看到那个孩子的时候，笑了一晚上，晚上十二点笑到邻居来敲门。。。。。不要问我为什么。。。我笑点低。。。哈哈哈哈哈,<残年梦>: 回复 @不过是个过客 :快 给我睁大你的眼睛,<鹿鷺>: 回复 @人不风流枉騒年嗯哼 :那我可能不是完全的女生style[摊手],<人不风流枉騒年嗯哼>: @鹿鷺  没毛病,<村里的小仙女->: 早起得又是我们这群小仙女,<天真岁月不忍欺丿>: @小明的筱是春晓的笑  哈哈哈,<rainbowcheng乐悠悠>: @1此情可待123,<排列整齐的我们丶丶>: 回复 @排列整齐的我- :哈哈，确实,<李是日子里的一阵暖峰>: 这么说有些方面我是男的喽,<wuli喵小莹>: 全过你 你就咋滴？,<要成为女王大人的蔼芸>: 回复 @我不霸道成王何能护我所爱 :根本不是啊,<内涵段子>: 回复 @不过是个过客 :哈哈哈，今日最佳,<Hey-JANE7>: 回复 @向臣哲的向是向臣哲的哲 :我靠，特妈一样不差[喵喵],<无陌寻陌>: 那么问题来了，我是男还是女[二哈][二哈][二哈],<向臣哲的向是向臣哲的哲>: @Hey-JANE7   图7[笑cry],<求实创新666>: @浪漫的冰雪-5776   [笑cry],<排列整齐的我->: 回复 @排列整齐的我们丶丶 :我觉得对孩子的想象那一个我们应该对换一下,<破晓劲风>: 概率、统计……[笑哈哈],<我叫琳仔呀->: 回复 @F-85490 :快回家,<F-85490>: 回复 @我叫琳仔呀- :哈哈哈,<我不霸道成王何能护我所爱>: @要成为女王大人的蔼芸,<孙谦谦3>: 孩子那张，我和男朋友是颠倒的,<一包酥心糖>: 回复 @一包酥心糖 :还有8，单生狗[允悲],<一包酥心糖>: 回复 @一包酥心糖 :除了3,<一包酥心糖>: 我c我应该不是女生[眼泪],<lsw_余生永安>: 有过类似图8的举手[允悲][允悲][允悲],<薇薇安名字太难起517>: @苏州城外的微笑1987   虽然有点夸张，但我觉得应该差不多[笑而不语],<我叫琳仔呀->: @F-85490,<长亭外古道边你TM你咋不上天>: 房间女的比男的还乱🙃,<怪丨咖灬>: 回复 @万屡爱意寄窗扉 :[笑cry]寝室干净无异味   不是伪娘就是gay[笑cry],<怪丨咖灬>: [偷笑]好也是一天   坏也是一天   为什么不天天开心喃[馋嘴],<排列整齐的我们丶丶>: @排列整齐的我-,<NidaleeMGL>: 回复 @丶无心无念 :真像[笑cry],<丶无心无念>: @NidaleeMGL,<殷洪伟童学>: 回复 @不过是个过客 :肉桂好么，什么眼神,<__唐比比>: 还是有那么点道理[笑哈哈],<万屡爱意寄窗扉>: [允悲]可能我是假的男生,<不过是个过客>: 看到第四张的肉棒红，瞬间笑了！,<曲靖工人>: 以前听有的女生说13厘米受不了，会很疼！还有的说9厘米都太长了。但是今天认识一个女汉子，竟然说5厘米也不行，疼得走路都别扭。可我看视频里很多女的20厘米也很享受啊...人跟人的差别真大啊！同样是女的，其实，女的穿个高跟鞋，怎么完全不一样...[doge]。,<醉风夜城>: 全过咋滴[doge][doge],<one吐three哈哈>: 没啥毛病 扎心了[摊手][摊手]]
