neihandz	那是我！你看！那是我！[笑cry] ​​​	[<马布朗就是喜欢李易峰>: 回复 @iwannabereal :[二哈][二哈][二哈][二哈][二哈]我该说些什么,<表弟是谁->: @Tomochi-  23333,<山水一仙>: 回复 @杨州词梦 :我说鬼怪,<杨州词梦>: 回复 @山水一仙 :釜山行这两天刚看，美国的恐怖片，日本的贞子全看过！,<Simon的->: @iliongl  我还是淡定多了,<张小暖YY>: @权世界81463,<程阿玖吖>: 自己演的釜山行哭着也要看完,<文章iii>: @ZOOERNA,<山水一仙>: 回复 @杨州词梦 :你看过鬼怪吗……,<苏苏要傲娇>: 回复 @时不我待16888 :[坏笑],<我是叶子啊叶子啊>: @辰多多OnePunch,<-廖婉秋->: 这是鬼怪多少集的时候啊,<tj他来了请闭眼>: 回复 @Monster_毛毛 :釜山行,<温暖的稻穗>: @Forget-7s,<意外般存在>: @道是无晴却有情_  自己演的被自己吓到，醉了[哈哈],<凤裔残音999>: [脸红][脸红][脸红]死也不看了 @林胜源_Pal,<可嘉少年>: @Caroline-xxxx  妹子，这估计就是我真实的写照[二哈],<LiuSuel_>: 回复 @ritian7 :自己演的釜山行跪着也要看完,<iwannabereal>: @马布朗就是喜欢李易峰  是我,<happy丁璇>: 我想知道鬼怪是第几集,<_Zzz爱琳>: @彼岸浮生若梦  [拜拜],<佳期不可zai>: 釜山行感觉，不过也不咋吓人[挤眼],<巡山小哥bi>: @徐蠢蠢yu  哈哈笑死,<ritian__>: @LiuSuel_,<赵九九的猫>: 回复 @深得喜欢rr :不谢不谢~另外跟你说鬼怪是韩剧，推荐你去   零蛋网看，是一个看韩剧比较方便的网站，因为有的地方好像不播这个片子~我是年前看的，那个时候只有零蛋网可以看完全集，哈哈，这个剧是我第一次看的完整的一个韩剧，以前从没看过，真的好看~画面特效什么的~[喵喵],<是向晋娴Jessie>: 回复 @深深话浅浅地说 :就是哈哈哈笑死了,<Luss哈>: 回复 @英俊吴丫头 :我抱你就行→_→,<英俊吴丫头>: 回复 @Luss哈 :那你就失去了被我抱头的机会,<Luss哈>: 回复 @英俊吴丫头 :我才不怕[攤手],<英俊吴丫头>: 回复 @Luss哈 :你如果这样我得把你头抱住,<深得喜欢rr>: 回复 @青春期嘚小小啊 :谢谢奥 么么哒,<高音區>: @--黄海绵  看过吗,<赵九九的猫>: 回复 @深得喜欢rr :片中片是孔侑的釜山行，这个是孔侑的  孤单又灿烂的神-鬼怪，挺好看的，推荐你~,<石文Tao>: @张奕涵_lemon,<时不我待16888>: @苏苏要傲娇  哈哈哈,<Luss哈>: @英俊吴丫头  哈哈哈,<深得喜欢rr>: 回复 @青春期嘚小小啊 :什么电影啊,<comma91>: @Doris_歪歪,<無視浮華重尋夢>: @彩儿Rainy,<赵九九的猫>: 看这段的时候，我的爆米花都笑撒了,<侯云峰H>: 回复 @Monster_毛毛 :釜山行哇,<Suspect926>: 我演得太渣，你们别看了,<深深话浅浅地说>: @i-am-xjx  哈哈哈 你给我说的那个剧情,<杨州词梦>: 这哥们为了亲近女孩子也够拼的，奥斯卡小金人拿走,<关注我学段子>: 两天突然发现一朋友是个gay,我大喜，我们两个互相坦白后，脱得一干二净，我趴在桌子上撅着屁股，半小时没动静，我回过头，发现他也在撅着屁股尴尬的看着我... ​​​[污][污][污]]
neihandz	这是什么动漫呀？好过分！[笑cry] ​​​	[<Oo文墨oO>: @心有企盼杨柳依依  [二哈][二哈]5公斤的。。,<不减了不减了>: 回复 @Sxdd_ :10公斤的胸,<弋丢丢diu>: @暮茶king  哈哈哈下次称体重我帮你[鼓掌],<大家好我叫慢三拍>: @lucky蜜斯马  学霸，求解。,<o0金大爷0o>: 回复 @陈大大大大东_ :哈哈哈哈哈哈哈哈哈哈哈哈…,<sunzy凉>: 回复 @学习和工作让我快乐 :我去,<七哥你真棒>: @风吹过的丶蒲公英,<横竖钩正文>: @再也找不见的鬼鬼  大琨哥，什么动漫啊,<于果老师>: @y瑶啊瑶瑶到外婆桥,<关于小小蝶>: 回复 @陈大大大大东_ :哈哈哈哈你下次称体重也要这么做,<C_roar>: 回复 @o0金大爷0o :每个5斤,<o0金大爷0o>: 回复 @陈大大大大东_ :所以…你有多少斤？[偷笑][偷笑],<刘智勇-->: 看着都好敦实啊，哈哈！求加关注,<Sean-Jian>: 十斤 @Lolita肖贝  啊哈哈哈,<C_roar>: @关于小小蝶   @胡大宝要完成大项目   @o0金大爷0o   @噜鲈卤路璐   @某某某某谭,<你的小宝贝驾崩了>: @郭正是个乐天派  宝贝[坏笑],<种花的一只兔子>: 回复 @小天爱吃BOY :星期一的女乃子,<WANG棒wb>: 回复 @恩任海静 :哈哈，山西的美女，[坏笑][坏笑],<忧郁De深蓝色>: 回复 @老刘呀 :《封神别传之天王托塔》,<美贞欧尼>: @麦凹最棒   @爱咕咕的桃子呀,<秋风0936>: @妆婊子  确实挺过分的！[哈哈],<我也曾经开心饮过酒>: @肖肖肖肖肖Ty  [爱你],<依宁坠>: @黄金小y  嘿嘿,<砚台观雨季>: 卧槽   这也行[笑cry][笑cry][笑cry],<北岸_初晴丶>: 回复 @老刘呀 :《神探狄仁杰之她的胸为什么那么重》,<会化妆的兔子_>: @会迷路的懒癌患者  一个十斤的胸,<潇拾叁>: 这个叫做周一的奶子。,<長門有希Nagatoyuki>: 周一的丰满，大家都说比村乳业,<老刘呀>: 回复 @arbTsg :没事，反正瞎几把写的都一样,<arbTsg>: 回复 @老刘呀 :老铁 托,<老刘呀>: 《神探狄仁杰之是谁拖起了她的胸》,<小泽又春风>: 星期一的丰满   比村奇石  不谢[doge],<恩任海静>: 有什么好看的鬼片 好好说🌚,<小天爱吃BOY>: 《星期一的丰满》别谢我]
neihandz	作呀作呀，我的骄傲放纵~[摊手] ​​​	[<AlohaUu>: @Lr1s不是萝莉,<战斗民族的希望>: 蛋黄都估计喷了[黑线][黑线],<嘎嘎瓜呱>: 我听到了蛋碎的声音,<---Ben->: 吓得一哆嗦 赶紧往回收[笑cry],<锴哥丶丶>: 再逼逼我他妈废了你[眼泪][眼泪][眼泪],<用户已不存在丿>: 断子绝孙的一个翻身跳,<呆到深处自然蠢吧>: @竹竹大高个  我仿佛看到了 哪吒,<带雪的下雨天>: 跳的好不如接的好[摊手],<Aaron丶丶C>: 这怕是废了哟[摊手][摊手],<KANT-均刃>: 说起来你们可能不信，我屌爆了。,<一Monkey一>: @Lyh李业鸿  闪现送人头[笑cry][笑cry][笑cry],<独处蓬蒿>: 躺着也中枪[摊手][摊手][摊手],<郭浩楠>: 回复 @_范媛媛 :我日他妈呦！！！不活了,<鲁豫豫豫豫_>: 看着一紧[doge],<_范媛媛>: 疼吗[微笑] @郭浩楠,<Little丶Leezi>: 有一种疼是隔着屏幕都感觉疼。,<像细胞一样分裂重组>: @胡贝尔胡半仙儿,<半笙姐姐>: [doge][doge]]
neihandz	男人不一定要有钱，但是......[doge] ​​​	[<寰寰斯密达>: 图片评论  http://t.cn/RJAEyNd,<小新也忧伤>: 骚男人比骚女人可怕,<maidann>: 回复 @王格子啊 :我都说要用了没有我用啥[二哈][二哈][二哈],<王格子啊>: 回复 @我是傳奇夏榮譽 :[偷笑],<王格子啊>: 回复 @maidann :奇怪你没有吗[doge],<巨蟹中的寄居蟹>: 二营长，老子的意大利炮呢,<maidann>: 回复 @王格子啊 :甩出去的是什么我不懂[二哈],<pretty-sx>: 回复 @王格子啊 :求图,<港浩GG>: 图片评论  http://t.cn/RJApR4Y,<我是傳奇夏榮譽>: 回复 @王格子啊 :就服你,<国国是个大帅比>: 回复 @王格子啊 :老哥求原图[二哈],<丶只若初见_>: 男人没有钱不要紧、不帅不要紧、但一定要骚！,<你凶个屁>: 回复 @瓜皮张二彬 :！？？？？？？什么东西,<瓜皮张二彬>: @好肥一只狗  hhhhhh,<幻帐>: 图片评论  http://t.cn/RJAaew3,<wmy红梅>: 辣眼睛[笑cry],<圣剑啊i你有看到那个敌人吗>: @张先森听说爱情雨降临了  骚的飞起,<太阳当空照花儿不爱笑>: 但是一定要有双高跟鞋,<王三s手>: 我不管这个人有多能打，见到他我一定要打死他,<张飞鹏_>: 回复 @迎风吻甜 :老子的刀呢,<小7不是二师兄>: 高跟鞋穿上走的比我都好[拜拜][拜拜][拜拜],<每日一搏>: 要够骚[doge][doge][doge],<-晶晶呐>: 回复 @庄庄庄庄siR :为什么给我看啊 你妹的,<LSW2017>: 为了支持sinon菲律宾小姐的选举才这样,<Semm->: 回复 @王格子啊 :求原图,<我来看我偶像的>: 晕啊，女人则么办？,<慢半拍的曾经>:   @SSS-mi,<NEHZBB>: @-火山哥-  啊哈哈哈哈,<养鸡砖家>: @血气方刚的追鸡少年,<Luminita义>: 一定要有一双高跟鞋,<侯嘉鹏的小迷妹>: 一定要有骚气[笑cry],<阿訫呀>: @你弄丢了我_d  但是一定要骚,<maidann>: 回复 @王格子啊 :[笑cry][笑cry]不能干脆，要用的,<王格子啊>: @maidann  干脆[笑cry]  http://t.cn/RJAUB2t,<學徒麪包師>: @云雾中的高速路2012,<墨言-moyan>: @我要成个小瘦子,<八十歳少女>: 图片评论  http://t.cn/RJAUvBS,<特立独行的小胖妞>: 一定要够浪[拜拜],<张帅豪HY>: 我就喜欢男的哈哈,<Landing·guy>: [doge]  http://t.cn/RJALTkV,<Thiknock>: 我为什么会觉得他穿的很漂亮？！我是疯了么？！！,<暖暖的小棉花>: 我的卡姿兰大眼睛[污][污],<森pom>: 把我的大斧拿来，我要灭了这妖孽,<夏逸coco>: I  like[doge],<JK爱兮HYOJOO>: 回复 @-七爷1 :求原图,<庄庄庄庄siR>: @-我就是晶晶啦,<-李不懂->: [二哈][二哈][二哈] @徐倩倩1994,<-郭润楠>: @快滴入来个碗度o  骚过你吗？,<林国洪_>: 回复 @快乐的小海豚libaby :人家很内敛的！[太开心][太开心],<涂涂家族>: 可以不帅，可以没钱，但是一定要…,<陈欣Chan>: @神经大条的胖子,<不想做柯基的柯基>: 握草.辣到我的卡姿兰大眼睛了[打脸],<警院小痞>: 回复 @是Barry呐 :求无水印[喵喵]]
neihandz	爸妈带孩子的区别[笑cry] ​​​	[<半笙姐姐>: 回复 @葬花吟-乄 :好巧,<简单丶6115159203>: 母亲能让你体会到爱，父亲会让你知道世上百态,<rregereg>: @FIVEEYE,<我就是才才啊>: @我是才才的心疼妖妖吖,<李舜的小迷妹>: 回复 @李偷心 :我觉得爸爸带孩子比较好,<我女神王文静>: @wonder寻暄,<半笙姐姐>: 回复 @黑白aNice :我也是[摊手],<冷冷的姚啊>: 回复 @一个姓李的小玉哥 :我没人要[微笑],<一只昊昊呐>: @一只心怡呐  [可爱],<call米鼬>: 回复 @葬花吟-乄 :搞事情[doge],<-羊杨羊不养羊>: 回复 @Vivian咩咩咩0219 :[兔子],<王琪-乄>: 回复 @call米鼬 :我只要楼主,<call米鼬>: 回复 @葬花吟-乄 :那要楼上的？就是我？,<Vivian咩咩咩0219>: @-羊杨羊不养羊  [兔子],<王琪-乄>: 回复 @call米鼬 :不要楼下的,<call米鼬>: 回复 @葬花吟-乄 :楼下是你的。,<王琪-乄>: 回复 @call米鼬 :是我的，别和我抢,<系君度啊>: 回复 @一个姓李的小玉哥 :我也没有男朋友🙃,<call米鼬>: 回复 @一个姓李的小玉哥 :所以，，，,<call米鼬>: 回复 @葬花吟-乄 :先来后到。,<_生活酝酿美酒>: @_风吹来的都是老故事   @Y1-衣嘉慧,<真的是你大哥>: @所有的风只向他们吹,<半笙姐姐>: 回复 @call米鼬 :好巧,<王琪-乄>: 回复 @一个姓李的小玉哥 :我也没女朋友,<call米鼬>: 回复 @一个姓李的小玉哥 :我没有女朋友,<Hello_Brown>: @Lena-0513,<江小湖丶>: @吃白兔的小萝卜jay  哈哈,<等到二十八岁>: 就是想 @摩羯座的阳光暖心窝017  一哈,<韩泽茜Nicole>: 可爱！ @之前一切都好,<赵小升5257>: @lulu0521  你快用的到了,<认真点别叫我大狗跟狗蛋>: 得先有个女朋友啊[哼],<Lin_Wenwarm>: 回复 @唯爱果_ :[哆啦A梦汗],<_你看从前>: @_ang_ang_,<哇哇哇永锋>: @TENTHREE,<唐大鱼0925>: @周Bultou,<唯爱果_>: @Lin_Wenwarm  [鼓掌][鼓掌],<换个昵称都纠结死人了>: 所以一个孩子的成长最好有母亲父亲一起陪伴,<____旧故事>: 回复 @P-VITO :那废了[摊手],<十九HH>: 喜欢爸爸这样的[眼泪],<傲娇西瓜皮>: 别意淫了，根本不是这样,<王瑞瑞22>: 天天抱着哥哥的孩子，想想自己还没有男朋友[泪][泪][泪][泪][泪],<鲁西西爱吃大西瓜>: @1994斑点狗,<P-VITO>: 回复 @____旧故事 :还是我戴吧,<差不多是信仰>: [doge][doge]最近看到孩子就想到自己还没有女朋友,<____旧故事>: @P-VITO  [哈哈][哈哈],<小马马哥wiliam880>: 我第一个吗[摊手][摊手][摊手],<半笙姐姐>: [拜拜][拜拜]最近看到孩子就想到还没有男朋友]
neihandz	猫：等我成精，一定送我主人去最好的精神病院[喵喵] ​​​	[<婉约的土豆地雷>: @蔡过儿过儿过儿,<静静爱吃四喜丸子>: @LiNjInG_1o24,<赵小升5257>: @lulu0521  哈哈哈哈,<哎呦你个小煎饼>: @丨七丨  跳伞的那个求🐈的心理阴影面积,<寒山远黛73587>: 图四像小时候的我[doge],<-张张张十八>: 回复 @喵喵欧尼酱-O- :我真的经常做些让她想杀了我的冲动🤔,<豆豆的蓝朋友QaQ>: @紫纳城黛-科  [二哈]简直了,<喵喵欧尼酱-O->: @-张张张十八  替圈圈艾特你,<violinLR>: 回复 @VVS晶晶 :哈哈哈哈哈哈。。。。,<Real_陈仁鹏>: 回复 @柴小妮01 :哈哈哈哈哈哈,<onyLia>: 回复 @陳贰狗的妖孽人生 :我觉得第五个最坏了,<Real_陈仁鹏>: 回复 @柴小妮01 :最后一个吓死我[生病],<onyLia>: @hi笑一个吧   @陳贰狗的妖孽人生,<VVS晶晶>: @violinLR  😆😆😆😆,<奔波儿霸和灞波儿奔>: 最后一个过份了啊。[二哈][二哈],<茅台土特产代购丶>: 图片评论  http://t.cn/RJwMndx,<吟啸徐行小天天>: 回复 @ice风沙星辰fly :[二哈][二哈][二哈]精神病人思维广,<ice风沙星辰fly>: @吟啸徐行小天天  铲屎滴，你[怒][怒][怒],<陪我去看海和月亮呐>: @陪你去看海和月亮呀  [笑cry],<朱金玲_Elaine>: @estherxyiii  啊哈哈哈哈可爱,<6Ningt>: @嘴毒心不毒1920,<你的月亮我的鑫Zzz>: 回复 @愿风裁剪你的忧伤 :是要你看第一张图猫的表情哈哈,<愿风裁剪你的忧伤>: 回复 @你的月亮我的鑫Zzz :我不喜欢猫,<轲棱>: 最后一个我是真的笑出声了。[笑cry],<-靖欣>: 跳伞的[攤手]看猫那小腿抖的,<小仙女不是小仙女111>: 第八个隔着屏幕都能感受到猫的绝望,<Zhoi_SeungHyun_Oppa>: 最后两个都可以送去了,<小太阳Viky>: 回复 @Hanspany :智障,<Joan_婧_>: 回复 @S_1213 :不好咩[二哈],<你的月亮我的鑫Zzz>: @愿风裁剪你的忧伤,<林文乐->: 8.9要笑死我了,<Hanspany>: @小太阳Viky,<十年梦里生花>: 建国以后不许成精[馋嘴],<陈陈陈我的陈>: 最后那个[二哈]我尼玛真二逼,<草月文二小>: @阿quu  你快去！,<S_1213>: 回复 @Joan_婧_ :[doge]妳这样真的好么？,<Joan_婧_>: 回复 @S_1213 :第3.4.6我也试过[doge],<S_1213>: @Joan_婧_  [二哈],<痞子女魔头>: 最后一个，猫:妈，快跑快跑，吓死老子了！狗：卧槽你等等我啊，别跑那么快！,<回头无无无岸>: @姐比奥利奥还傲89906  不能我一个人笑[笑cry][笑cry][笑cry],<用户5656675300>: 最后一个哈哈哈哈,<用户5656675300>: 最后一个哈哈哈哈哈,<山西一男的>: 最后一个简直笑劈叉,<半笙姐姐>: [doge][doge],<Gene骏>: [笑cry][笑cry][笑cry]]
neihandz	我突然想到了什么... ​​​	[<满世界都是奔跑的兔子>: 新郑  我来过！！我选406房间  她们当时告诉我  这个不是电动房  我蒙逼了,<-c小雨>: 回复 @吃瓜群众dai表 :图片评论  http://t.cn/RJZNVau,<东门古道>: 这宾馆暗示着一种冲动[嘻嘻][嘻嘻][嘻嘻],<_生活酝酿美酒>: @_风吹来的都是老故事,<waitingYQ>: @呵呵我是土豆男爵,<庸俗记忆>: 哈尔滨见过这家宾馆,<少年仲太阳>: 浙理工生活二区附近有一家[挖鼻][挖鼻],<在路上的Abner>: 至少见过四个同名宾馆，不同地方,<黎明如火>: 老板有想法[灯泡],<花间一壶酒smile>: 我勒个去，这是武汉市新洲区的一家宾馆，连旁边的火车票代售点都拍出来了,<木木木哇啊啊啊>: 回复 @吃瓜群众dai表 :可以给原图吗[可怜][可怜],<Landing·guy>: 老板很有想法啊🤔,<lele忧天>: 老板是一个有内涵的人。,<慧眼识球>: 回复 @我就是我啊huo :知道何为段子吗[坏笑]就是我讲故事你来听[阴险]…本故事纯属虚构，如有雷同那就是真的啦！[二哈][二哈][二哈],<温州没有江南皮革厂>: 杭州下沙学林街也有一个枫林晚酒店，就在理工生活区3区旁边,<怂恿我x>: 漫画《妖怪名单》上有这个宾馆，就是这样🤔,<我就是我啊huo>: 回复 @慧眼识球 :那他女朋友成了你女朋友嘛[摊手][二哈],<我就是我啊huo>: 回复 @慧眼识球 :卧槽666信息量有点儿大，是你偷情别人女朋友，然后和被戴绿帽子的男的成了铁哥们[笑cry][笑cry][笑cry][笑cry],<yuchenadme>: @psypsypsypsypsypsypsypsy,<流鼻涕的西瓜仔>: 没文化的估计看不懂[笑cry][笑cry],<慧眼识球>: 回复 @我就是我啊huo :他们分手了，我跟她的前任成为了铁哥们[笑cry],<我就是我啊huo>: 回复 @慧眼识球 :哈哈哈哈哈哈，结果呢[笑cry],<慧眼识球>: 回复 @我就是我啊huo :无路可逃被抓过现行[污][污][污],<我就是我啊huo>: 回复 @慧眼识球 :看来你是老司机[doge],<不瘦20斤不换昵称哈哈哈别闹>: 回复 @污学君 :那么有韵味的诗句，随着年龄增长反而失了鉴赏之力,<慧眼识球>: 回复 @我就是我啊huo :看窗户[挤眼],<xxx_蟹蟹蟹>: 回复 @慧眼识球 :哎我去,<杨某某47987>: 想到古人车震[二哈],<Antony_ff>: 我们学校旁边就有一个啊哈哈哈哈,<丨丑灬角丨>: 回复 @吃瓜群众dai表 :稳,<linda琪>: 想到枫叶[枫叶],<麓雎>: 回复 @吃瓜群众dai表 :哈哈哈哈哈,<刘小姐会坚强>: 想说住过同名宾馆……这就尴尬了[黑线][黑线]  http://t.cn/RJzJEqm,<囧吖Y>: 门口的车停的，都那么急促，你们知道为什么吗？,<hxymin>: 西安周至…我住过,<我就是我啊huo>: 回复 @慧眼识球 :为什么呀[哈哈],<嗨哥无敌爆炸帅emmmm>: 做爱咯[doge][doge],<苍苍落叶只为归根>: 回复 @H胖子喜欢蓝胖子 :这是初级好吗,<佛曰子瑜>: 回复 @吃瓜群众dai表 :图片评论  http://t.cn/RJzIzBg,<_Mr_Nemo>: 《山行》 杜牧 远上寒山石径斜, 白云生处有人家. 停车坐爱枫林晚, 霜叶红于二月花.  http://t.cn/RJzf1BU,<陛下菊花开了>: 我们那有个枫林晚足浴[眼泪],<路远马亡又何妨>: 回复 @H胖子喜欢蓝胖子 :年龄到了就懂了,<时光你我曾陌路>: 秒懂不赖我，谁让我语文诗词能力好。。（心虚。。。）,<拥抱夏天的风啊>: 哈哈，这个名字不错，简洁明了,<西门qing潘安>: 停车坐爱枫林晚，姨妈红于二月花,<高祖仁圣皇帝>: 停车坐爱枫林晚，霜叶红于二月花,<LIUYAN你>: @福特蒋文峰  你想到了什么[doge][doge],<纤zl>: 可以的  [doge][doge][doge]  这很强势  [doge][doge][doge],<你丫屌逗>: 车震需要旅馆干嘛,<咸鱼高罢了>: 回复 @吃瓜群众dai表 :心蛋糕,<老忠医肥大夫>: 绝对在长沙……以前老是看到,<allzaria>: @-不明真相的吃瓜少年,<污学君>: 停车坐爱枫林晚，霜叶红于二月花,<江山亦温柔z>: 回复 @爱吃奥润汁 :啧啧啧，我就喜欢你这样子]
neihandz	鳄鱼原来怕鞋... ​​​	[<Yshu叔>: 幸亏没把鞋扔湖里，要不鳄鱼全死了,<Allah-xin>: 回复 @丶认真的薛丶 :那是狗[挖鼻],<西瓜味的缙缙>: 他拿的是啥？好像是鞋，还是用鳄鱼皮做的！操，赶紧他妈的跑啊！,<我系你朝思暮想的欧家豪>: 回复 @諾文大叔 :外卖吧,<喧世未予>: 鳄鱼：刚刚发生了什么。我看到个印度人。吓死我了,<低仿薛之谦>: 它是怕后面那只猫,<高大英俊威猛的頭頭>: 你们确定鳄鱼不是怕黑？[笑cry],<小梅花花_媄睸>: 这臭鞋板把旁边狗子都吓了一跳,<黎靖彬SL>: 鳄鱼：吃了那么多年的动物，肠胃都是带屎的，还是被你恶心到了,<周焕呈>: 你确定不是脚气？]
neihandz	这第一跳就能上天！ ​​​	[<YE-西西>: 这个  看起来也太业余了吧,<就不能有个好听的名字吗>: 回复 @贫血的梦游者 :沙坑倒是没跳多远啊,<你雷哥可爱多>: 回复 @梅林123 :第一天还有的说，第二天根本就。。。,<Crazy-Chigga>: @我要吃肉啊-_,<山丘蟹酱>: @就不能有个好听的名字吗  挺生猛啊，,<郜先生_>: 回复 @罗久鸣LJM :必须换腿！三级跳第一跳必须是起跳腿落地！,<珠笑了>: 步子大了 __ ___ ___ ___ ___,<原谅我放浪不拘>: 牛，体育老师不知道怎么教的,<梅林123>: 回复 @你雷哥可爱多 :第一跳太高第二跳萎了,<用户2000342>: @Yours-Linya   @C_ra_vin   @iiixxyyzzz   @Aurora_Leona,<嗄哈嘢>: @ex_x   @月夜冬眠,<monaka莫娜卡>: 回复 @羽墨倾城映兰台 :我怀疑他立定跳能跳出坑,<一只傻阿涵->: 我想说这像是我们青岛农业大学,<十七万分之一的刘杰>: 用的十一米的线吧，目测十二米左右。,<男人丶微博网名要霸气>: 第二跳没力，可以跳更远的,<用户6077483243>: 一鼓作气，再而衰，三而竭。,<村草杨摧花>: 劲儿全使第一步了。。。。,<_Zzz爱琳>: @大晨晨无敌蠢萌的阿堆儿  什么鬼[拜拜],<疯子的世界你不懂2006>: 数学体育老师教的！[眼泪],<V笑le>: 其他人会不会连坑都跳不到,<bingciling>: 这三级跳感觉很一般的哇,<一个傻最初>: 回复 @罗久鸣LJM :看到评论 我又点开看了一遍,<金子-你会花光吧>: 确定这不是的轻功？[笑cry],<你雷哥可爱多>: 呵呵，体育生笑了，三级跳初级,<只爱吹空调外机>: 有点像我当年第一次跳远哈哈哈哈哈哈哈，技能不全撤退……,<罗久鸣LJM>: 空中还换腿啊这个,<LeoChowwww>: 第一跳？？？？在飞,<Reagaz>: @---以梦为马-  [笑cry][笑cry],<温余宁华>: 计算错误 可惜了,<90年代原创歌曲的音乐人>: 回复 @麦田里的epouvantail :一般三级跳10m进坑,<麦田里的epouvantail>: 确定普通人能进坑？！,<如栗RuLee>: @YangCan一,<消不掉的伤疤i>: [眼泪][眼泪],<大叔不用刮胡刀>: @鹿过o  [笑cry][笑cry],<HY想要爱人>: 哈哈哈  猥琐发育  别浪！  http://t.cn/RJ7n28H,<羽墨倾城映兰台>: 他适合立定跳远！！！[酷]]
neihandz	你平时会不会这样... ​​​	[<半笙姐姐>: [doge][doge][doge],<杨杨红红杨红>: 搞什么，纸的[笑cry],<-靖欣>: 不好意思iPhone7太硬我揉不烂[攤手],<柔鹏鹏同学->: @没有秘书的马局长]
neihandz	假的太难喝 ​​​	[<奴良殿下>: 回复 @wwwwzq_ :评论就服你哈哈哈哈哈哈哈哈哈,<SD0532laoshan>: 图片评论  http://t.cn/RJhs2oA,<初遇之秋>: 回复 @ZAXZ-Y :两回事,<Doris-Pattinson>: 我突然辨别不出哪个真哪个假了,<胡胡胡_HUHU>: 回复 @尔尔wh :噗哈哈哈,<_熔炉>: 回复 @星巴卜 :星巴克   星巴卜  你也是假的,<系君度啊>: 正宗的是养元这个牌子🤓,<北鸥菌>: 回复 @哦莫哦莫杨子君 :少白兔[doge],<鹿的香芋巧克力>: 对我来说都难喝[喵喵][喵喵][喵喵],<瞌睡的钥匙>: 图片评论  http://t.cn/RJhoNpl,<孤岛Hiddenlove>: 回复 @囿钳任性 :你应该试试，日了它.,<差不多是信仰>: 回复 @最爱张大翠 :原谅我读书少🙈,<9588到底地方>: 回复 @羅漢rohood :？？？？,<Da鱼鱼L>: 回复 @Mr谢小波 :更厉害啦[污],<iForever彡>: 回复 @差不多是信仰 :阿尔美滋听说过吗,<不二李小新丶>: 卧槽  你先告诉我哪个是假的！！！1[doge][doge],<Mr谢小波>: 回复 @Da鱼鱼L :我的全是核桃,<初遇之秋>: 关键我就没有见过真的啊,<破壳而出的兔叽X>: 我见过“很露”，你们猜是啥？,<小屁的反击>: 听口音不像本地糖啊🙄  http://t.cn/RJhGlLH,<乱写的名字哈哈哈>: 回复 @DengCook :喝起来味道像橡皮泥……[拜拜],<五花肉三斤>: 可日可乐？[抱抱]  http://t.cn/RJh4EMu,<LinlangSama>: [哼]  http://t.cn/RJh4AbC,<蚍蜉撼树苗>: 我喝过“豪牛”牛奶，“雪花飘”啤酒，“脉劫”运动饮料，还看过封面写着“金庸新著”（金庸新      著)的武侠！,<又尔蚊子>: 有假的香蕉牛奶难喝？,<星沉海底cd>: 所以第二个到底是核桃露还是花生露,<还是哥牛比>: 我家吃的是六斤核桃,<李Thebest>: 我在家喝的怎么是99核桃,<喋血复仇>: 我还以为是最强大脑现场[二哈],<康康不喝酒>: 回复 @哦莫哦莫杨子君 :小百兔？,<Match林安>: 还有七个核桃 但喝多了也不补脑 [二哈]可以补肾[喵喵],<Maybe更多>: 回复 @Da鱼鱼L :在中国盗版总是让你防不胜防[眼泪],<Da鱼鱼L>: 回复 @后仰跳投的帅哥 :[眼泪]盗版味道也还不错,<Maybe更多>: 回复 @Da鱼鱼L :核桃越多越补[二哈],<热心网友杨子君>: 图片评论  http://t.cn/RJhzn7W,<顺着网綫去砍你>: 图片评论  http://t.cn/RJh7FYM,<Da鱼鱼L>: 我家为什么是九个核桃🙃,<Lost_Mafia_杨增>: 六个核桃和大个核桃傻傻分不清楚！,<因为丑所以没观众>: 关键真的也不好喝呀！,<尔尔wh>: 我还见过，核桃六个。,<半笙姐姐>: 有喝的就不错了[拜拜],<soho21249>: 又是古法，又是石磨，肯定右边是真的,<差不多是信仰>: [doge][doge][doge]  http://t.cn/RJhhg2m,<l你猜我猜你猜不猜l>: 过年收到一箱假货  叫六个果仁核桃,<手机用户847896>: 说的真的很好喝似得,<会做饭的小鱼人>: 明明是六个核桃花露水[doge],<蜗牛吃云朵>: 你喝那个[哈哈][哈哈],<晓彤桌>: 真的也不咋好喝啊？[摊手][摊手],<心似薄荷天然凉>: 六个核桃＋一个花生，，，大补？？难喝？？[思考],<羅漢rohood>: 人家是六个核桃口味花生露 明明是你没理解人家的名字,<DJ随意吖>: 就是假的才能说明问题,<幼稚园里的幼稚鬼nk>: 你倒是告诉我哪个是假的呀]
