neihandz	话说有个段子男朋友的重要性[笑cry] ​​​	[<小宇哥哥Real-men>: 我就看看那个孙子会是一楼,<释然丨WeiMy>: 回复 @吐槽唐禹哲 :他离婚了,<钱叔叔很适合放下心啊>: 回复 @闫红蕾_ :我找了个假男朋友,<休息来看看>: 具有段子手特质的男生，颜值高的叫风趣绅士，颜值低的叫过节小丑[二哈],<闫红蕾_>: @伜軍  [摊手],<幸运蜡笔c>: 不要紧的，不要紧的,<一枚南方帅哥>: 我没车没房没存款，但是我。。。,<从不知天光天黑的道理>: 不要紧不要紧 @YUdONGXUE-,<小啊小哈喽>: 回复 @Promise诗 :到,<兔爷在修行>: 回复 @凭博海临风 :有风度[眼泪],<嘎嘎瓜呱>: 回复 @努力努力再努力MSW :改换女朋友了？,<是妳呀_>: 哈哈哈[笑cry][笑cry],<绘羽的日常>: [允悲][允悲][允悲],<别让松鼠给抱走了>: @我有个美如画的女票,<13郎啊>: 回复 @13娘啊 :[斜眼],<13娘啊>: 回复 @13郎啊 :不应该是段子女友？,<刘少少帅>: #我们的少年时代# 【我们的少年时代】喜欢段子的可以关注我哦[ali乐和],<吐槽唐禹哲>: 这个嘛，应该吵不起来，我认为薛之谦 @薛之谦   将来有女朋友一定是越吵越开心[微笑],<就你啦ccc>: 回复 @少鲶 :所以呢？,<少鲶>: 回复 @就你啦ccc :套路学多了[并不简单],<就你啦ccc>: 回复 @少鲶 :[失望][失望],<Closelove7>: 回复 @小萝卜记性不好 :好巧,<ruida_z>: 谁有背景原图[微笑],<愿风裁剪你的忧伤>: 回复 @你的月亮我的鑫Zzz :哈哈哈哈,<y牛奶少年>: @ijustneedtosleep,<二两白酒_喝喝喝>: @二两白酒_喝不喝   我又想起了我嫌弃你的发脾气都不认真,<巴山蜀水凄凉处>: 回复 @Promise诗 :[喵喵],<巴山蜀水凄凉处>: 回复 @Promise诗 :互关告诉你,<Ashes苘栀>: 回复 @Promise诗 :？,<巴山蜀水凄凉处>: 回复 @Promise诗 :睡不着了被你弄的,<张xiao-贤>: 污[污][污][污],<不想跟你说话的邓芫蒉>: 回复 @不想跟你说话的邓芫蒉 :评论好污,<周慧周同学>: 回复 @不想跟你说话的邓芫蒉 :[笑cry][笑cry][笑cry],<Ashes苘栀>: 回复 @巴山蜀水凄凉处 :还不睡？,<巴山蜀水凄凉处>: 回复 @Promise诗 :这有什么厉害的,<我叫琳仔呀->: @F-85490,<Ashes苘栀>: 回复 @巴山蜀水凄凉处 :厉害了,<巴山蜀水凄凉处>: 回复 @Promise诗 :我帮你放松一下,<Ashes苘栀>: 回复 @巴山蜀水凄凉处 :扎心,<巴山蜀水凄凉处>: 回复 @Promise诗 :不要紧[笑而不语],<Ashes苘栀>: 没有男朋友的报个到[允悲],<努力努力再努力MSW>: 再也不会有男朋友了,<你的月亮我的鑫Zzz>: @愿风裁剪你的忧伤,<笨笨熊丶2015>: 回复 @阿兰哒哒 :[摊手]紧不紧我还不知道那,<yes郑慧>: 来呀、快活啊[二哈][二哈],<jeeme>: 我一直就想找个没人的地方跟你说说话[费解],<傻猪徐徐>: [笑cry][笑cry][笑cry][笑cry][笑cry],<贱无敌93>: @F增鑫   你吵架就太认真，撩骚都看不出来[允悲][允悲][允悲],<安和桥下清澈的水1998>: 秒懂，，[惊讶][惊讶]太污了,<小萝卜记性不好>: [doge]假装没看懂]
neihandz	这是干啥的，昨天吵完架女友买的[doge] ​​​	[<刘少少帅>: #跨界歌王# 【跨界歌王】喜欢段子手的可以关注我[多云转晴],<葵酱丶>: 9我有一个大胆的想法,<旺旺睡冰冰i>: 回复 @108大队-猎狐陷阱 :正解[doge],<写代码的小菜>: 回复 @小胖子之殇 :老太太都不扶，就服你,<王果杠>: 回复 @小胖子之殇 :舅服你,<韩雪雪雪雪雪丽>: @Iridescent_GC_lxc,<-恍然如梦_>: 替你弟弟捏一把冷汗,<DG_goldseal>: 回复 @小胖子之殇 :这个比尺寸更伤人啊[允悲],<SONGZIMING>: 你的好小哦[微笑],<牧野向北>: 你看看孔的直径，知道为什么吵了吧,<博主全身负能量灬>: 给你买雪茄用的啊,<飛睬涼涼>: 回复 @六月绽放紫金花 :[赞],<热死的南方人>: 大姐我给你留点念想,<山是山水不是水>: 看到你们的评论，感觉要污了！！！[笑cry][笑cry][笑cry],<丶红泥小火炉丶>: 性感女特工，看完你就知道是啥了,<宿Yi>: 她要杀死你的右手女友，切成枯叱,<杜蕾斯的粉丝>: [污]明显的短小啊,<怕是要翻水o>: 看得我都觉得疼？,<小胖子之殇>: 这是剪雪茄的，首先你表面想表达的是剪鸡鸡，但正常情况鸡鸡再小也不会这么小，不然你怎么结婚的？其次那么问题来了，她包里怎么会有，当然是她外遇了，而且他还是有钱人，最重要的是你老婆还要像女奴一样伺候他跟他剪雪茄，啧啧啧。,<白羊座的双重世界>: 让你的鸡儿永垂不朽的,<事逼偏头痛>: 余文乐用来夹林雪的,<杨某某47987>: 那个尺寸，不要也罢[摊手][摊手][摊手][摊手],<108大队-猎狐陷阱>: 据说这两个金属片无法完全重合，你的牙签正好能在缝中存活[挖鼻],<me-XU27>: 第一次见是在天下无贼上,<张兴骏>: 天下无贼里面看过。。,<张兴骏>: 回复 @曹钰婉- :有故事,<曹钰婉->: 早上让男朋出去买早餐 他非要在家点外卖  我决定吵一架……,<贺京1372>: 这个 指甲钳。新上市。,<小师妹儿O>: 回复 @于晓彤_ :[摊手],<小师妹儿O>: 这尺寸，难怪会吵架[摊手],<王康武Rayunion>: 剪指甲的[哈哈],<承诺害死你>: 没事没事，剪雪茄的,<龙小虎是我>: 不是分手，是丧偶。,<alisi峰>: 电影上看过，剪雪茄烟的,<我也有个小_目标>: 中医用的器械，活血化瘀之功效,<紫金花开六月天>: 这尺寸，难怪会吵架！]
neihandz	这才是我要的生活[允悲] ​​​	[<二就是年轻的象征啊>: 回复 @唱至世界尽头的音色 :我能明白,<唱至世界尽头的音色>: @二就是年轻的象征啊   是我是我！！！,<KKNIGHT丶>: @榴莲少女耶  你想要的生活,<SYXUER->: 回复 @邹浩宁 :好棒！！,<Angus97>: @LI_谷神__  哈哈哈哈,<芒果蘸酱油->: @ElenaC1026,<北五环的猫>: 一年 后再见你的时候，已经200斤了,<是我凡人>: 看到你家的冰箱 你这个朋友我交定了！,<其实很多>: 3号病床~在做完一次化疗就不要来了！,<当我隐身的就好>: 那床上的就不是你了,<一勺芥末味的芥末酱>: 在冰箱旁边很暖和[good],<邹浩宁>: @SYXUER-,<-王雨璇啊>: @宜宾学院后门保安  我想要的生活,<逗比胖达学摄影>: 屋里得老热了，放个这个玩意！除非你有空调,<辛不辣>: 回复 @温知夏 :哈哈哈哈哈卖冰棍的哈哈哈,<刘少少帅>: #我们的少年时代# 【我们的少年时代】喜欢段子的可以关注我哦[ali想],<温知夏>: @辛不辣  安静的看！,<x蜗牛慢跑h>: 守着冰柜 会热死,<帅气的林仕跃>: @逼格不够体重来凑   我擦，赛神仙,<我是你的固伦小哥哥>: 对于从来不吃冰淇淋的我，这样的生活没意思,<神清骨秀的由拉特西斯贝格>: 所以这是个伊利的业务吗？？？,<1997-04-28>: 不惊人不休 很好,<洋二娃的爸比>: 我以为会撑起小帐篷。。。,<长歌予一人>: 回复 @丶暗楼子 :知道呢，承让了[笑cry][笑cry],<正品DW手表手镯专卖>: 回复 @河北科技大学门卫大爷 :内涵段子学校听说过吗,<理查德__泰深>: @嘴角上扬开始笑,<破竹轻响>: 卧槽，不行了，心脏受不了，这车转的有点狠[笑cry][笑cry],<长歌予一人>: 回复 @丶暗楼子 :你这回复显出了你略带低调但是却又锋芒毕露的文化程度，敢问大哥是哪个学校的大爷？？,<Xinn89Ts>: 吃完之后又一个脑结冰[并不简单],<正品DW手表手镯专卖>: 回复 @河北科技大学门卫大爷 :大爷稳如狗,<三鼠运水>: 我有一个大胆的想法,<嘤嘤嘤我怕>: 冰箱一堆女人这才是我想要的,<长歌予一人>: 回复 @one吐three哈哈 :哈哈哈，这样的生活多好啊,<one吐three哈哈>: 回复 @河北科技大学门卫大爷 :大爷您厉害了[喵喵],<长歌予一人>: 回复 @内涵段子 :光有冰激凌怎么能够呢？再说了这就一个人啊，吃起来多没味道啊,<内涵段子>: 回复 @河北科技大学门卫大爷 :666,<小小sen伟梁山伯>: @玲玲Merryqi,<长歌予一人>: 一房两人三餐四季五杀，才是我想要的,<传说中的叶大侠>: 第一，打破零回复尴尬[笑cry],<长歌予一人>: 这对我来说是远远不够的]
neihandz	哪个妹子更可爱？[害羞] ​​​	[<雨后_林_晨__>: 回复 @昵称都被注册了1 :最恨你这种人，我都撸完了你才告诉我[允悲][允悲][允悲],<Xinn89Ts>: 都散了吧！全是汉子[并不简单],<和太阳肩并肩orz>: 第二个确定是妹子？ 喉结那么大,<CH-sivi>: 第三个有功夫，那么多水一下子喝了,<杨某某47987>: 眼睛喝水，震惊世人[污][污][污],<天天想上S>: 最后一个，充满活力,<你到底吃不吃火锅>: 33333333,<没有流星有许愿>: 回复 @不爱会发呆丶 :哼,<S炫迈口香糖>: @NeverMissIL   你喜欢哪一个,<-DollyBabe>: 回复 @Warren郑凡 :我啊,<郭俊杰John>: 第三个。不对，第一个。但是第二个又……弱弱问一句，能全选吗？[害羞],<dhdbskdbd>: @-R-ren   你选哪个,<不爱会发呆丶>: 回复 @没有流星有许愿 :都不选,<塌鼻子大叔>: 我是单身狗[二哈][二哈][二哈],<当暧已成往事>: 好眼力[允悲]// @昵称都被注册了1 :第二个喉咙怎么了？[doge],<L1TInGGiRL->: 最后一个哈哈哈哈哈哈哈哈哈,<袁哓轩g>: 我发现我恋爱了，,<洋二娃的爸比>: 能不能不要到处发我老婆照片[doge],<Efforts_to_>: 回复 @昵称都被注册了1 :甲状腺结节,<A_pineapple>: 可爱和你有什么关系？,<Warren郑凡>: @-DollyBabe,<会魔法的安琪拉>: 第二个确定不是秀智？,<旧笔迹>: 当然是我啦[doge]白痴,<吐槽唐禹哲>: 男生可能喜欢第一位[doge][doge],<PengPengWaEr>: @倩小妞_222  图1 图1 图1,<歇斯拉迪>: 两个绿茶一个伪，可爱在哪里？！,<仙女懋>: 回复 @Queen-Irving :男的吧？[允悲],<Pot虞树代>: @巫婆盒盒  你最可爱,<薇薇安名字太难起517>: @娇小可爱胖番鼠,<小怪兽真瘦>: 最后一个！呆萌，而且是最辛苦的！,<小计医生>: 随便给我一个就行，不挑,<木可__木可>: 回复 @Queen-Irving :看看第二个的喉咙,<IwillWaitForU>: 回复 @520冰麒麟520 :男的,<soutwy>: 第三个是出自哪里,<理他莫说>: 回复 @昵称都被注册了1 :好眼力[允悲][允悲],<一个人诠释一颗心>: 必须第三个。第四个要是妹子的话也不错,<应知西风烈>: 妈的，都是套路，前两个都是男的,<诺亚in東京>: @草莓寿司TOKYO  你觉得哪个,<没有流星有许愿>: @不爱会发呆丶   你选哪个,<如果4444>: 回复 @昵称都被注册了1 :大侠好眼力，上厕所都不服舅服你,<刘少少帅>: 挺搞笑，很不错的段子。[不倒翁],<昵称都被注册了1>: 第二个喉咙怎么了？[doge],<520冰麒麟520>: 为什么大家都不选第二个呢[允悲],<Stefard>: 绝逼最后一个呆萌呆萌的]
neihandz	孩子：竞速塞为什么有香蕉皮？[笑cry] ​​​	[<館夫人>: 回复 @故事还长_不是么 :是是是,<故事还长_不是么>: 回复 @館夫人 :是你吧,<館夫人>: 回复 @故事还长_不是么 :哈哈哈哈哈哈哈哈哈哈哈哈哈哈哈哈哈哈哈哈哈哈,<导演寂寞求抚摸>: @-龜兒-  哈哈哈哈哈哈,<13娘啊>: 回复 @13郎啊 :[允悲],<LimboLimbs>: @黄海蒂   @SakanaFang   @BaOoooo0o   @FemaleP_    @第四号传送机  笑死我了我操,<小祈音>: @小饺渣  [笑cry],<L丶Amor_李>: @梁馨月你闹够了没有  你应该懂 哈哈,<大大的乾>: 可怜十年前我跑跑卡丁车还能征服一个年级[泪],<花店师叔>: 在办公室突然爆笑，领导一会让我去办公室，可能要被开除。[拜拜],<永远向着阳光的穎>: 回复 @誠凛賢 :[偷笑],<袋鼠dxh>: 快吃个蓝喷追上去，再来个泡泡弹炸死那个丢焦皮的儿子,<誠凛賢>: @永远向着阳光的颖,<残梦什么时候才能成为NPS>: 还有乌龟壳呢哈哈哈哈,<萧萧冬月>: 回复 @遇见了你cc :18……,<luffy的微笑>: 回复 @那么无花果呢 :[哈哈][哈哈][哈哈]我笑憨了,<Mm宋先生>: @笑眯眯学长   @闵余aka_Tyge,<菅井家的欧阳ciwaye>: 回复 @遇见了你cc :大二...,<消失的夏时间>: 回复 @侄子爱吃大馒头 :死亡飞车,<侄子爱吃大馒头>: 回复 @消失的夏时间 :什么鬼？,<消失的夏时间>: @侄子爱吃大馒头,<去看漫画了>: @-小抱枕儿  [坏笑],<那么无花果呢>: @肉嘟嘟的小施施,<我是落尘啊丶>: 回复 @沐子阿姨 :快了，打到运输船了[doge],<看你瞎bb>: 回复 @遇见了你cc :是qq飞车吗？,<看你瞎bb>: 回复 @沐子阿姨 :3000块钱能干嘛，赶紧给他打个100万,<___V7___>: 回复 @___瑶哥吖 :[笑cry][笑cry]艾玛,<___瑶哥吖>: @___V7___,<吐槽唐禹哲>: 很炫酷[doge][doge],<LA的杰森張>: @玄株晟  兄弟你这车…,<薇薇安名字太难起517>: @娇小可爱胖番鼠,<微de博>: 回复 @遇见了你cc : @一只少女的祈祷,<水达姆>: 哈哈哈哈哈哈哈哈哈哈哈，笑的肚子疼,<微de博>: @一只少女的祈祷  [眼泪][眼泪],<怪她过分性感>: 跑跑卡丁车[悲伤],<Jason-_-z>: [笑cry] @溺爱YN4201231   ,<波海艾>: @啥啥啥啥啥啥傻啥,<启FAN>: 转弯后方向盘没打正……,<周周周_a>: 哈哈哈哈哈哈 生动形象,<柴饱饱>: 回复 @疯帽并不孤独 :哈哈哈哈哈哈哈哈,<时间不等人芯>: 哈哈哈哈············,<你好-飞飞>: 按r啊，，躲在别人后边，防止被丢道具，加氮气加速啊[吃惊]我看到急得,<灬Little丶Love>: 你看看，都把人家孩子给转懵逼了,<Lwyyy_>: 这是一场假的竞速赛  居然有香蕉皮混进来,<Michael丨Jack1>: 我有天使和光盾，完全不慌[喵喵],<yi纸奋斗>: 回复 @波尔多液喷洒小能手 :道具赛,<老于司机>: ARE YOU OK?,<沐子阿姨>: 我刚刚给秦始皇打了3000块钱，现在把工作辞了想在家等着做丞相，我想问下大家，秦始皇现在发兵了吗？打到哪里了？,<炎杀>: 应该是跑第二的放的,<波尔多液喷洒小能手>: @qqq大猪头   @yi纸奋斗,<许CJJJJJJJJJJJJJ>: @不知道好的昵称,<Gabriel_Wang>: 回复 @遇见了你cc :我26，第一次知道这个的时候还是初一]
neihandz	儿子写的作文 ，我该怎样对他说呢?[doge]#内涵神吐槽# ​​​	[<吐槽唐禹哲>: 应该告诉他如何用省略号[doge][doge],<修长的小拇指>: 当然是选择原谅他呀,<Santas5949>: 我就问你，体育课有趣吗[笑cry],<歐陽娜娜的生物锺>: 回复 @鹏鹏鹏爷丶 :[摊手],<刘少少帅>: #欢乐颂2# 【欢乐颂2】喜欢我么[ali甩手],<鹏鹏鹏爷丶>: @歐陽娜娜的生物锺   你儿子啊哈哈哈哈哈哈哈哈哈哈哈,<哆啦公举阿>: @S-baby033,<你自己称>: 回复 @兽面人医赵大力 :写的很好啊,<我要驾着风去旅行>: @弗啻  [开心]six six six,<我的123你的321>: 体育课有趣吗[眼泪]一二一了一节课上数学呢？？,<Mr一凡sun>: 图片评论  http://t.cn/RoVzb0s,<小拾光先生>: 不打是不行了[笑而不语],<吴一岁leo>: @叮噹hello,<windtony>: [笑cry][笑cry][笑cry],<HI-MYC>: 好有趣的呢[doge],<兽面人医赵大力>: 儿子这样，是不是直接动手。 @你自己称,<兽面人医赵大力>: 儿子这样，是不是直接动手。,<__椿兮如梦>: 在我们村这叫记流水账,<石头炻头966>: 以后体育老师会精彩有事，体育课不是上语数外就是政史地或者生理化,<你若成疯->: 我感觉最后一句是嘲讽,<steven7171171>: 怎么了 我看一点毛病没有 我给99分,<ruida_z>: @内心处的另个他,<Chien-KuoChen>: 老师文化程度太水，表示不会批,<张小非同学>: 当然是选择原谅他啦  http://t.cn/RocBEG9,<巡山小精灵kt>: 的确很有趣啊[摊手],<三鼠运水>: 加特林，冒蓝火的，哒哒哒哒哒哒哒哒哒哒哒哒哒哒哒哒哒哒哒哒哒,<奔跑小僧>: 没事。你至少还有个儿子，只要是亲生就好。,<BonjourDemain>: @三只猫耳朵   写得好,<洋二娃的爸比>: 所以？你语文体育老师教的？[doge],<杨某某47987>: 儿子的叙事能力很强啊，表达能力也不错！！完整的表达出了体育课的精髓！！,<科比丶青春>: 没有点名那个吗？把名字全写一遍[doge],<Superman小霸王>: 内涵段子肯定有  内涵,<好伴随>: 这让我想起了小学写的    我的好爸爸。 我有一个爸爸爸爸好爸爸，有一个好爸爸～整整半篇！,<一Garbage>: 还有题记，说明作文功底很好,<敢三的小峰>: 这篇文章利益明确，语言精练，详略得当，绝对是高考满分作文，你的儿子很有出息。,<嘉學長的>: 反正凑齐了[doge],<优质男女来战>: 男人为什么喜欢少妇？ 因为你一拍屁股 她就知道换个姿势 你一躺下来 她就知道坐上来 你一站起来 她就知道跪下来 你一跪下来 她就知道撅起来 而小姑娘你一拍屁股她只会回头问打我屁股干什么。喜欢污的戳我[污] 点进去更精彩[爱心]️[爱心]️ @男女互撩平台,<王二妮是个小太阳>: 有趣[doge][doge][doge]  http://t.cn/Roc8StL,<墨者-风林火山-2000>: 还说个P，直接打吧！]
neihandz	聊天套路，拿走不谢！[笑而不语] ​​​	[<林学鑫75290>: 还有这种操作？[允悲],<idioteqve>: 回复 @Minddz :屌,<Minddz>: @idioteqve   @G58212,<Tony_Tie>: @Quiet丶Inside   @Amber_March   @aboutnanna,<Z_媛yuan>: @王达令要好好的   @粒粒樊_OFFICIAL,<大猫该吃药了>: 回复 @諪錒誔一Tiffanny :[允悲][允悲][允悲][允悲][允悲],<--韩熙>: [二哈]  http://t.cn/RocrMTp,<Cecilialoverlay>: 回复 @一个安静的美男子o :[紧张],<慵懒的阳光吖>: 请给我一个可以套路的男票,<刘少少帅>: #龙珠传奇# 【龙珠传奇】大结局快到了[亲],<花倾素>: 亲测...有狗不按套路走！  http://t.cn/RocfGuH,<l我的紫霞>: @美貌天仙的小仙女   玩套路么[doge][doge],<范潇洒也staunch>: 最后一个什么意思[脸红],<认识这个头像吧>: 我:如果你没有脚，你还会穿鞋嘛？ 女:会 我:[允悲],<一个安静的美男子o>: @Cecilialoverlay    [阴险][阴险],<一个迫切想长高的小可爱>: 楼主你个大屁眼子！  http://t.cn/RocbZ4e,<我只希望你是我的唯一>: 回复 @阿酷_August :。。,<吐槽唐禹哲>: 这是……咱的组织？  http://t.cn/RocUHy3,<李十弎>: 那么请问我TM套路谁[摊手],<不想跟你说话的邓芫蒉>: 回复 @不想跟你说话的邓芫蒉 :耍涨了。想挨打了。敢这样对我了。桑心,<周慧周同学>: 回复 @不想跟你说话的邓芫蒉 :为啥子不敢[二哈][二哈][二哈],<不想跟你说话的邓芫蒉>: 回复 @周慧周同学 :你现在敢给我发这个表情了啊,<周慧周同学>: 回复 @不想跟你说话的邓芫蒉 :[拜拜][拜拜][拜拜][拜拜][拜拜][拜拜],<不想跟你说话的邓芫蒉>: 回复 @周慧周同学 :[顶][顶][顶][顶],<阿鑫呀x>: @原图妈   求图一表情包,<翻天娃子>: 回复 @云与星辰 :都是戏精……,<周慧周同学>: 回复 @不想跟你说话的邓芫蒉 :[拜拜][拜拜][拜拜],<不想跟你说话的邓芫蒉>: 回复 @周慧周同学 :哪里来的个八九十。你给我找出来,<周慧周同学>: 回复 @不想跟你说话的邓芫蒉 :第八九十……  都可以,<不想跟你说话的邓芫蒉>: 回复 @周慧周同学 :要来那一条,<拼搏海阿>: @安身立命的安生   瞅瞅。[并不简单],<周慧周同学>: 回复 @不想跟你说话的邓芫蒉 :[来][来][来],<老男Hai儿>: @小飞飞名字叫悦悦,<情歌故我>: 举报，该内容让我严重不适,<KIM滴小太阳>: 这个套路，会打起来的吧！,<白鹭上青天o>: 回复 @_亦书予i :[哼][哼][哼],<_亦书予>: 回复 @白鹭上青天o :我考完试了，美滋滋，想怼你开心一下,<干杯巧克力3>: 回复 @新新长大 :[微笑],<白鹭上青天o>: 回复 @_亦书予i :嘛呀，骂我干哈啊,<黑衣服的怪人>: 你永远套路不到一个不喜欢你的人[微笑],<痴人YDYSGM>: 如果对方不按套路出牌怎么办,<翠翠是个小公举>: 我要图一的表情。。。求,<翠翠是个小公举>: 有没有图一的表情，求,<谢大大wei>: 你只能套路喜欢你在意你你的人，,<笑的时候想起你>: 回复 @趣网官方微博 :请开始你的表演[摊手],<_亦书予>: 回复 @白鹭上青天o :打死你个王八蛋,<胖到让你无法呼吸>: 谁借我个女朋友试试[允悲],<物语心情美文>: 奇怪，怎么没有互粉的朋友呢？[可爱],<趣网官方微博>: 奇怪，我按你的套路，怎么被妹纸拉黑了？？,<信仰仰爱>: 我的朋友都高智商，我会被反套路的,<李师起>: @Van_CD   @Luona32,<子不语-wx>: @静静聆听静静欣赏]
neihandz	“唐老师，您演了这么多位皇帝会不会分不清戏里戏外？”“不不不，朕不是那种人”[笑cry] ​​​	[<吃藕12138>: 快把皇上演遍了[笑cry],<WeaponSun>: [笑cry]你是没敢放出他演毛爷爷的图吗,<悬糊济世>: 最后一张图乾隆个鬼啊，还是雍正！！！,<洋二娃的爸比>: 演毛爷爷也是极好的,<弥生的stone>: 朱允文那个肯定不是，他都没活到大么大岁数,<Ai凌月>: 沙发[doge]]
