newoutlook	管理员给了老虎一个大纸箱，开心得像个两百多斤的孩子...... ​ ​​​	[<watermelon冯>: 回复 @想成为解忧杂货店店主啊 :我每天都在吸熊猫[二哈],<云霏烟雨>: 看来猫科动物都喜欢纸箱,<想成为解忧杂货店店主啊>: @watermelon冯  吸大猫吗,<Countdown_To_Extinction>: 大型吸猫现场[二哈][二哈][二哈][二哈],<二三期>: 骗我养老虎[怒],<EFSF见习机械师>: [喵喵]毕竟还是猫,<谢让多杰>: 难道看点不是……白虎？这是稀有变种虎啊！,<卫斯理的莉莉周>: 跟我家10斤英短一样,<凌香木木>: 快起开，人家都被你压成饼了[二哈],<汏眼曂犇>: 下面的猫薄荷没看见？[允悲]吸毒呢,<被发配的魔王>: 这不就是只猫么= =,<我买两根黄瓜>: 回复 @露台大叔玩手机 :这都能喂狗粮,<流氓田田田>: 你敢吸这只猫吗？,<世间客旅>: 这不还是猫么[汗],<坤坤这个昵称被占用了>: 暴露了吧[哆啦A梦吃惊],<Cayuga-Live>: @掌柜的橙子   看这个大猫儿[允悲],<叶之云云>: So cute and so sad,<灵力暗永夜>: 怕上面有十斤猫薄荷[允悲],<名字根本没意义也没异议>: 不管大小，纸箱魔法总是能作用于猫,<NEGINEGI_>: 吸大型猫现场[喵喵],<Illusion-de-Beauvoir>: 大猫小猫都抗拒不了纸箱诱惑[二哈][二哈][二哈],<大海狸鼠>: 这是不是猫科的通病，不能拒绝狭小空间的诱惑。,<穆童_MINT>: @马猴烧酒奥斯文,<张可以z_>: [喵喵]这猫本性暴露,<便士麦>: 很明显里边都是猫薄荷,<猫馒头围脖>: 回复 @o青木鱼o :噢，200多斤的孩子,<h_pirate>: 就是说观察者也知道二百斤不含头了咯,<谁是清雅荣华555>: 观察者网赛过我的亲爷爷。,<小卸鸢>: @谷地梦叶酱  [费解],<蓝色的草虫>: 相比其他动物，猫科动物有着更强的好奇心。,<掌中明珠>: 天啦！跟我家的喵喵一个样！,<河边沐春风>: 谁他妈的还不是个宝宝咋的,<redeemer97726>: 身上有跳蚤，才在纸箱上打滚的。,<琨冈听潮声>: 成年的不止两百多斤吧……,<迷之45>: 想起钻纸皮箱的我,<A_PLANT>: 开心不开心都二百多斤,<旧部旌旗>: 从哪看出他是开心了。老虎告诉你的吗？,<穿过梦的旷野>: 原来大猫小猫都一样啊,<露台大叔玩手机>: 回复 @潜水奥利奥 :周日让你的大纸箱好好抱抱你[爱你][心],<L赖佳煦>: @戴丽丽_darlinging,<澜熙OoU>: @优雅的Kaka,<露台大叔玩手机>: 回复 @潜水奥利奥 :虎子妞 虎子妞 纸箱呼叫 miss U[心][爱你][亲亲],<Any-suffering-you-deserve>: 现在真的相信它是猫教的。,<你看见我的巴斯光年了吗->: 果然猫科动物都喜欢瓦楞纸箱子[摊手][摊手],<泉州知府>: 没出息，还是我们崇拜的丛林之王吗？,<无所畏惧张>: 回复 @GothicWorm :你，片，反，,<潜水奥利奥>: 回复 @露台大叔玩手机 :因为你就是纸箱啊,<悠幽儿-_-爱宝贝>: @红队Lee甩枪  大喵也是喵，抵抗不了纸箱的诱惑。,<See_You_NEXT_LEVEL>: 这猫……吸不动了,<叫我夜猫猫>: 个头再大也是个喵！[笑cry][笑cry][笑cry][笑cry],<大同共青团>: 所以，这其实是个大……大……大喵星人？！,<最烧的二哈>: 200多斤的孩子[doge][doge][doge],<陳進裏>: 回复 @GothicWorm :反思]
newoutlook	Saber出来巡视江山啦！！！ ​​​​	[<糖豆ta爹>: @smile_xujun   哈哈哈哈,<吴昭刚>: 回复 @琪琪奇奇奇奇奇 :卡卡,<琪琪奇奇奇奇奇>: 回复 @吴昭刚 :哈哈哈[笑cry],<未完的梦想2012>: 猫加狮子头套？有创意啊,<吴昭刚>: @琪琪奇奇奇奇奇,<加大号的思维空间>: @琳小豚  [哈哈],<第五季节N>: 神tm吾王[摊手],<13寸>: @BoJonny,<文闻__>: @-yInG______,<吳儁宇>: @壹个大艺   这不是你嘛[doge],<火星少女EMMA>: @鹿头是长长长长颈鹿  你要考虑给包包买一个这个！,<风中草芥Z>: 回复 @Okita桑_ :强行不强行“saber”这个词都是指剑士，吾王是人，“saber”是职。,<波爹波爹>: @变异小爆脾气没脑子绵羊,<hath-and-1s>: 回复 @Okita桑_ :不是军刀不错了。,<W_T_F我真不信还有人能找到我>: 这时候就需要再搞一只小猫来cos我莫了[笑cry],<彭家小三100>: 没有比较，也许就会被吓倒，但如果比较起来，呵呵。就知不敢拿它出来比较。,<雅小鱼77>: 把头套给本王脱了，热死了！[喵喵][喵喵],<爱吃橙子的小金金>: 青铜的战力王者的心,<琉璃梦-璎珞舞>: 太萌了[太开心][太开心],<ugbbbb>: saber？？？,<因果轮回矛盾螺旋>: 小编酱又是你上夜班？[笑而不语],<世间客旅>: 你看，头发留长就是狮子。发型很重要,<胡麻君要大圆脸>: @Inin爱捏捏  这个橘猫好可爱,<名字根本没意义也没异议>: 等下，观察者再，再说什么？？？[允悲]天哪！没想到观察者竟然也是这种网，自己人自己人,<Mid南风>: 不好意思借楼，，这个人微博虐猫虐动物真的不忍直视，我的影响力不大，谢谢希望大家可以关注一下让他得到应有惩罚 @我是雷厉mvp,<四夕丹子>: 我擦 @白猫_olo   @血植,<Poppy奈奈生>: @Co_Jerana,<月亮一朵>: 主人病得不轻哈哈哈哈哈哈哈哈,<香港记者号航空母舰>: 点出去，再点进来，再点出去看看，你是不是开错号了直说吧[笑而不语][NO],<踩不死的少女>: @不可爱少女oops,<Sion_Rowe>: 速速跪下！[喵喵] @绿绿绿--,<梦中卝听风>: 狮子王Saber？What？,<辨民安志>: 狮子童年没有鬃毛的，另外这是什么saber？fate的那个？,<千年同行>: 呆毛？？？？又一个月球厨师,<灯下守路人>: 原来是月球人[哆啦A梦吃惊]可以可以,<钟boss的助理良臣>: 超可爱的小狮子王,<逢坂河合律>: 醒一醒啊，月球厨师！！,<减肥50斤追回前女友>: Saber ：老子问你，你他娘的就是老子的马斯特嘛？,<不二華>: 森猛的老猫[喵喵],<赫萝的七个苹果>: “本王的大不列颠怎么如此荒凉。”,<See_You_NEXT_LEVEL>: @不要拖延症的懒癌晚期患者  超凶,<Jegan89D>: 四只脚的自走台钳？[doge],<冯汉庚纵横捭阖>: @batman杯面O_o  saber[哆啦A梦微笑],<龙景天轩>: @理墓骐OP  我觉得你可以给你家猫来一个,<我再晚睡我是猪>: @MM_BiuBiu,<黑暗死士归来>: 我去，没想到汝是这样的观网[允悲]（汝特么是我的妈死特嘛[允悲][允悲][允悲]）,<Yellowchester>: 月球厨师guna,<遗忘的月光被遗忘>: 喵假狮威，戴个头套就不认识你了,<亓小布2013>: 回复 @绯月下的幽星 :观察fate网,<吃瓜逗比>: 回复 @Okita桑_ :(´-ι_-｀)哦。]
newoutlook	昨晚雷雨，俄航又牛大了！[笑cry] ​​​​@环球网 ​​​	[<悠悠青草碧云天>: 回复 @Jegan89D :画面感……天啊,<守着云开>: 回复 @纳不传瓦不射小小豌豆实在了得 :稳当，excuse me?,<liujun192616>: 哪有那么多如果，与其考虑如果，不如去做，看看结果到底如何，只不过俄国人在这一刻宁愿相信自己！,<eadgar已经系中年阿伯了>: 回复 @隐思君 :是啊 原文是说北京无法下 所以只能找北京附近的机场 而北京附近只有上海和仁川能下 广州能下但太远 不叫附近,<换个啥名好呢啊>: 回复 @纳不传瓦不射小小豌豆实在了得 :这可不是好事,<纳须弥斋>: 回复 @岸芷汀兰gaoguan :这得多傻才会相信刘是在为公众谋利益[笑哈哈],<秋江立帆>: 开战斗机的开民航跟玩儿似的,<梁人尹金金金>: @炭烤生蚝多加蒜,<SSS雪鸦>: 回复 @御用男一号 :ʘᴗʘ好像俄航安全记录还可以。emmmm就是俄航国内机子有些老化。国际线的还可以,<宛如疯子>: 回复 @Jegan89D :吨吨吨吨是 伏特加吗[允悲],<你游什么时候会完>: 回复 @今天你吧药丸了吗 :嗝 [二哈],<乌里麻里929>: 只要有沃特嘎就没有毛子飞行员不能降落的地[嘻嘻],<隐思君>: 回复 @eadgar已经系中年阿伯了 :看原文,<蓝芯钻石>: 爸爸妈妈坐了个神仙回来的。。 @Juno_惊醉,<姗8_8姗>: 俄航也太牛叉了吧[笑cry][笑cry][笑cry]果然是战斗民族[作揖],<biang-biang-man>: 回复 @JerrickMA :fightradar24,截图有水印。,<孤云长空社>: 回复 @隔壁老王94666 :如丧考批  如失父母  悲痛欲绝  痛不欲生[doge][doge],<超级厉害的Boss>: @默语Dragon,<喵王Rein>: [笑cry][笑cry][笑cry]  ypa！！！,<金科长烘焙>: 回复 @Jegan89D :好有画面感[允悲],<木目心Fly>: 俄航是不管晚点多久都会准点到达的牛逼存在,<开始学物理新号>: 石家庄正定国际机场理论上也能降落380吧,<隔壁老王94666>: 回复 @岸芷汀兰gaoguan :你可拉倒吧，今天外媒集体高潮，另外附上刘的狗粮账单，去我微博看看[笑cry][笑cry][笑cry],<陇上行的桶桶>: 我想知道是怎么跟踪到的[挤眼],<岚黛惊鸿-蓝岚>: 回复 @岸芷汀兰gaoguan :呵呵，天打雷劈似乎不是啥好词儿吧？哭个屁的丧啊，云孝子！[笑cry][笑cry][笑cry],<圆夫人_>: 有一种讲法说是战斗民族缺[钱]，毕竟返航或是备降都是有费用支出的额,<Lin-东风>: 虽然这么说啦，不怕一万就怕万一，真要出事一次，那就真的完蛋了，还是认怂的好[摊手],<绒太子>: 回复 @隔壁老王94666 :bbc中文真的如同死了爹,<Mr__亓>: 回复 @岸芷汀兰gaoguan :哥，翻出去真的就那么真实么？别看的大妓院和bbc吧…,<木幼声>: 这个技术碉堡了，雷雨等闲事,<唯有轻轻叹息>: 其实飞机都一定有防雷击的能力！关键时刻就看_______[并不简单]（毕竟开过战斗机的再开民用机经验丰富点）,<kuyfgcvbvtdcf>: 回复 @岸芷汀兰gaoguan :谁？不认识，下一个,<JerrickMA>: 好奇那个雷达软件是什么,<取个昵称太困难>: 俄航：不出事就是牛逼，出事了……那就出事呗！话说能不能改善下伙食啊，你看看人家马航吃的东西！,<光de庭院>: 这到底是好事还是坏事呢？,<renleitailei>: 经济越发达贸易越频繁，自然气候越恶劣财。破坏自然结果。你再恶劣不出门总可以吧，猪们识时务。,<Der-zweite-Hund>: 达瓦里希，伏特加[加油]// @Jegan89D :飞行员：什么？有暴雨？…吨吨吨吨，乌拉！！[二哈],<玉树玲珑>: 机长：我大俄航就是不管是刮风下雨下雾霾还是打雷闪电下刀子，都要准时（提前）降落，嗝。,<兰小花小兰花>: 回复 @丶艹丿余震 :脑补了小李子的语气,<晴天年少->: 你们啊，要感谢机长不杀之恩[微笑],<侠十七icon>: 叉会腰，累坏了[允悲],<岸芷汀兰gaoguan>: 回复 @新杨柳絮 :我让他翻墙是让他了解更多的信息，国内主流的信息是一家之言，了解的全面才有资格讲是与非。仅此原因而已，而你的狭隘和浅薄，已然暴露了你看事情的片面。,<史文超Switcher>: 回复 @今天你吧药丸了吗 :哎？我都降落了，地勤呢？！   打雷，雨太大，地勤不敢出来……[二哈][二哈][二哈],<在长城跳骑马舞>: 美联航：乘客：不要丢我下去！ 俄联航：乘客：让我下去！,<隔壁老王94666>: 回复 @岸芷汀兰gaoguan :麻烦你去我微博看看我发的动态[doge][doge][doge],<新杨柳絮>: 回复 @岸芷汀兰gaoguan :好像就你会翻墙一样，朋友发了个恭喜XXX死亡，秧歌扭起来，被脸书封了，要不要看图片！,<以吾之血换汝之心60324>: 回复 @隔壁老王94666 :不好意思，昨天是老夫在渡劫，打扰了。,<岸芷汀兰gaoguan>: 回复 @你们为什么要抢热门 :你自己看我回复上个人的评论吧，我觉得能说出这话的人，我懒得再打一遍给你。,<岸芷汀兰gaoguan>: 回复 @隔壁老王94666 :我建议你翻个墙看看资料，再看看你说的和你听到的，和真实的，是不是一个事。,<woaiguangjie>: 回复 @鲁坚科 :没法安置旅客也是个问题,<熊猫耍武术>: 回复 @隔壁老王94666 :看天气今天晚上是不是又得死个公知啊,<辨民安志>: 你会战斗吗？人家开民航开得像战斗机一样,<HoshizoraMiyuki>: 战斗民族果然威武[二哈],<Aaaaaaa_Starstruck>: @fancy--free,<陈肇泰>: 回复 @隐思君 :能，但是能备上海为什么要去白云？,<陈肇泰>: 回复 @robotech-v :其实宣传多了，想您这么珍惜生命的自然就会避开乘坐俄航,<你们为什么要抢热门>: 回复 @岸芷汀兰gaoguan :一个说希望中国再被殖民几百年的人还tmd为我们谋取好处？？]
newoutlook	秒懂！妈妈带孩子vs爸爸带孩子，太生动了有木有？[微笑]vs[允悲]（人民日报​） ​​​	[<蓝羽鸦>: 我记得图9这种甩法容易把小孩肩关节拉脱臼,<Uncle-Kwok>: 男人就是个大孩子,<极炫星>: 难道不是爹妈一人一个爪机，扔个爱拍给孩子吗？[允悲],<匿名用户魏真>: @伽伽子cc   想带魏饭饭,<StaffSergentBearKing>: 回复 @聴風的世界 :拿…手纸包着?[思考],<牵你的手好吗>: 看了这个，身为95后空巢老人的我默默流下了泪水,<安迪斯晨风>: 平心而论，这个爸爸已经算很不错了，大部分爸爸帮的都是倒忙……,<千玺家小姐姐>: 我可能是个假妈妈真爸爸[允悲][允悲],<北极星空Dr>: 小编是哪个[笑而不语],<休咻咻羞>: 看来我母上大人是个神奇的存在[酷][酷][酷],<聴風的世界>: 那么问题来了，还是单身狗[狗]的该怎么带孩子[思考][思考][思考][阴险] @观察者网,<封板的古月>: 太形象了！小编还没做爸爸吧！,<墨之铭>: 男人就是个大孩子，不是没道理的。[酷],<愿瑾成行yjcx>: 渭南6岁男童被继母虐待致75%颅骨粉碎，双眼视网膜脱落，上门牙脱落，肋骨骨折…被送医时全身紫绀肿胀，无心跳无法自主呼吸！警方证实，鹏鹏经常被继母用殴打捆绑罚跪饥饿等方式虐待，行为残忍令人发指！恳请关注受虐儿童，严惩继母孙小倩生父赵亮 @呼唤鹏鹏 @临渭检察 @渭南临渭法院]
newoutlook	“复兴号”CR400BF型中国标准动车组座位分布，多图！（via 1435mm的距离） ​​​	[<attackUSA>: 你国都这样了，还谈何复兴？[doge],<种花家的布吉岛>: [憧憬]真漂亮！[鼓掌][鼓掌],<carlton李>: 太棒了，中国制造[赞],<醉眼迷离K>: 从和谐号到复兴号,<粽子大清药丸>: 我现在就在G3复兴号上，车型就是CR400BF,<Dao___A>: 回复 @别跟我说民团 :车头不是很好看,<兔子乖or怪>: @Fifty_deGree,<别跟我说民团>: 还是觉得蓝白配色好看多了,<panyongliang001>: 看到了USB口[并不简单][并不简单][并不简单],<快到碗里来n_n>: 名字跟颜值都很正！[笑而不语][笑而不语][笑而不语],<黄瓜菜999>: 天音通信邪教组织的信徒“阳前稳”在上海宝山区菊联路附近，即文宝苑附近的上空２４小时隔空喊话：“杨恒春、杨夏犯罪团伙在文宝苑占山为王，勾结虹口钓鱼党脑控邻居，企图谋财害命，杨恒春用迷糊子给人放毒！“(杨恒春强盗犯罪团伙竟然已经或者正在向上海市政府申请几百万的补助资金，请全国人民监督,<满满de私心>: 内部设施和现在的动车也差不多[傻眼][傻眼][傻眼],<巷子里SZG的童年>: 颜值越来越高，配置也越来越高，中车干得漂亮[鼓掌]]
newoutlook	午休结束了！上班，别睡了！ ​​​	[<Sevnming>: 吓到宝宝了，差评,<不只是无缘>: 回复 @老吴的咸鱼梦 :小竹笋,<大大的木木>: 回复 @不只是无缘 :帮你顶上去打那些自行加戏的人的脸,<不只是无缘>: 这是二岁左右的熊了，体重一百斤左右一只。饲养员添加竹笋时抱着一把笋安静走过去？考虑过饲养员的安全吗。地上的笋是放熊出外场前就放好的，连打扫笋皮和粪便，都要等把熊收进室内后才敢去扫的好吧。,<第三章写完了吗>: @chenily不叫C妮妮,<三星盖乐世note7>: 上班就是，吃[doge][允悲],<汉尼拔五十六>: 回复 @抓小喵的大老鼠 :你这是把大型猛兽当巨婴养了？,<籼米张凯>: 我们午休到两点[微笑],<仰着头-活出姿态>: 我一点半上班，现在开观网这醒脑[困][哈欠][困][睡],<微光與雲>: 我要投诉，投诉奶爸把滚滚吓醒了！！差评差评差评！,<暗白荼蘼>: 这分明是开饭了开饭了！,<桂林-身未动-心已远>: 吓死劳资了，卧槽[笑cry],<风月场的爱>: 回复 @机智的夕凡 :是呀是呀,<Hi橙橙橙2037>: 問題是 動物 常常 這樣 受到 驚嚇 好嗎？ 喜怒哀樂悲恐驚 會影響人體健康 更別說動物了 尤其對於 敏感動物來講 ,<短发飘飘不及腰22222>: 滚滚：TMD吓屎宝宝啦！[允悲],<Hi橙橙橙2037>: 回复 @抓小喵的大老鼠 :喜怒哀樂悲恐驚 影響人體 健康 更別說 動物了 安靜的放在一邊 動物會更舒服,<不只是无缘>: 回复 @抓小喵的大老鼠 :基地有些饲养员确实有问题不否认，但是，这里请你不要强行加戏。这是幼年园的熊，主要负责的饲养员是谭师傅，他兢兢业业工作多年、爱着每一届熊孩子，你问问猫粉们，谁敢说谭奶爸不耐烦？,<随心车>: 看在我中午都没休息的份上，租车吗？[摊手],<呆瓜的微波>: 回复 @抓小喵的大老鼠 :圣母婊？,<Z左岸的咖啡>: 哈哈哈[笑而不语],<有毒的桉树>: 回复 @老吴的咸鱼梦 :笋[允悲],<机智的夕凡>: 回复 @风月场的爱 :巧了巧了,<蓝色的草虫>: 定时发帖骗回复，差评！,<悠闲尘土>: 卖个萌晚上加餐，萌货们。,<super允公子>: @嗲不咯的尾巴   哈哈哈,<老吴的咸鱼梦>: 扔的这是禾柴棒棒？！[费解],<婦聯委員會主任>: 六福猪宝[爱你][爱你][爱你],<高木示>: 一点上班？不是两点半？,<英俊的阿点>: 羡慕两点上班的。。,<Zhao_佚名>: 回复 @抓小喵的大老鼠 :不要搞笑可以吗？[费解],<抠脚小妹儿咿呀呦>: 胸毛 : 妈卖批  嘿死劳资了  上班～上班～,<没记性的楼楼>: [晕]心都吓出来了,<ladkbxq>: 羡慕首都人民朝九晚五[怒],<Xxia兮_L>: 找不到暑假工，在家在家当咸鱼，帮爸爸做饭[二哈][二哈],<我打软件>: 回复 @我打软件 :[摊手],<淡如禅的窝窝>: 夏季不是两点半上班[喵喵][喵喵],<llinPN>: 不好意思，两点上班,<我打软件>: 明明是起床吃饭啦。,<快到碗里来n_n>: 同1点钟上班[笑cry],<聴風的世界>: 这么块上班？不是2点么[挖鼻][挖鼻][挖鼻],<duhy两岸>: 该开始卖下午的萌了！！！[允悲][允悲][允悲],<抓小喵的大老鼠>: 一看这个工作人员就心情不好、一点也不耐烦，把滚滚下成这个样子了。基地出来说明情况！,<风月场的爱>: 怎么同一个时间上班,<嘤嘤咩咩羊>: [允悲][允悲][允悲]工作了工作了]
newoutlook	注意！倒车真的很危险，这些都是血淋淋的教训[伤心] ​（公安部打四黑除四害） ​​​	[<never__bad>: 回复 @橙晓面团君 :我刷微博从昨晚气到现在，看到你这我笑了[doge],<老张ZzMmXx>: 练科二的我瑟瑟发抖…,<杂货店店主>: 妈呀，吓得我不敢练车了[衰],<大爷是不吃猪肉的汉民>: 有些是没看到 有几个好像是踩了油门？,<不值钱的麦兜>: @细臼  4 oh my god 注意安全,<大鱼_Ver_2015>: 我敢肯定，图一三五七都是自动挡车辆……而且都是刚上路没多久的新手，新手容易慌，观察不全面，脚下没分寸。对于大车，所有人都该记得一定要避开一定的距离，大车的盲区太大了,<H_-H_>: @皮皮虹我们走  真的吓死我了，触目惊心啊,<这名字尼玛都被占了>: 回复 @晚风吹柳笛声残 :要是喷子早骂你了，这么惨还能笑？,<莫外如是>: 回复 @HaterOfWealth :一句要么“影射”就看出来反共也算牛B[good],<CohenDH>: 图4最惨。。轮子全压了一遍。。,<徐有容那只死凤凰>: 图五图七是福州的,<fatmanbomb>: 最后那张一定是报废摩托，喇叭都不会响一下,<罗浮山大当家>: 回复 @橙晓面团君 :哈哈，这脑洞[允悲],<hutoo112>: 永远不要站在车的后方，也不要站有车的前方。有车，您就站则面。,<阿良-点儿-COM>: 图二的肠子都崩出去了...,<李永远永远的永远>: 回复 @a欲穷千里目a :我刚要给你发消息,<一個橙-橙子>: 這些根本是蓄意謀殺吧！就是看到人到了車子正後方才加速倒退的,<a欲穷千里目a>: @李永远永远的永远,<我爱好猴子>: 现在不负责任、粗心的司机太多，只能自己当心,<Recovery姚>: 小心大车，大车盲区比较多。自动挡的车是不是都要踩油门？,<仰着头-活出姿态>: 一个刚学车的，看这个暴击1000000+,<爱爬山的狼>: 都是刹车当油门了,<闪闪的红星_1981>: 图4都碾爆了，太惨了，,<坤坤这个昵称被占用了>: 能躲多远躲多远 太可怕了,<KNgray>: 回复 @橙晓面团君 :影射你爹死了？,<一生水卫浴科技>: 必须要警惕啊，生命大于一切！！！,<-BigBigHamster->: 回复 @VIVIANZHOU_ :最后一次胎避震没怎么动了，说明骨头断了,<-BigBigHamster->: 回复 @银河系人类研究院 :仓库单车真的是找死,<4IXEL>: 挂R档踩油门了？,<乐天知命无忧草>: 图四是假人吧，但是图九那俩人急死我了，赶紧跑啊，还等啥啊,<VIVIANZHOU_>: @东沧海   @盛文瑜   @ysong11  太可怕了 每个都是触目惊心 图4的人被碾了4次,<duang嗷君>: 回复 @橙晓面团君 :[作揖],<短发飘飘不及腰22222>: 图四是不是假人？吓死了[生病][生病],<文了一个婧3>: 回复 @交易偶像 :那么大个车斗，有很大一块盲区的。。。应该安个摄像头,<HaterOfWealth>: 回复 @橙晓面团君 :哎，你们反共都反出神经病了嘛[允悲],<黑暗冰麒麟>: 吓出一身身冷汗啊！,<电话线线线线>: @文公子哥儿  你的名字咋个变成这个样子了,<交易偶像>: 大货车强制装后视不行？,<李兜兜是笨兜兜->: 回复 @汕头是个很穷很穷的地方 :不要对女司机有偏见，男司机才是大事故发生的常规人群，更何况，这上面大多都是大货车，OK,<WincestFever>: 回复 @快到碗里来n_n :到车都没有后视镜头吗？,<吸个毛>: 图四估计被碾成肉酱了吧,<子熠翰轩>: 就像在大街上，我倒不怕自己骑车技术不行，我怕的是别人撞着我！,<植物人患者葫芦娃>: 回复 @银河系人类研究院 :你这说的全是路人的问题，明明全部都是司机的问题吧[费解],<爸爸给你举高高>: 回复 @橙晓面团君 :hhhhhhhhhh,<三国之大米粒>: 图6。。。在大马路上找什么呢,<火焰大字爆>: 有几个感觉像是瞄准了一脚油门,<季家小媳妇>: 都是踩着油门倒车？,<蓝血贵族5>: 7莫名喜感，还是三杀，这也太巧了,<军兔章北海_81192>: 怎么感觉都在加速状态啊,<ParasoNa_>: 卧槽，第四张被碾了个扎实的,<快到碗里来n_n>: 看的头皮发麻[衰][衰][衰],<卓曦是甜品达人>: @卓曦家的曹三岁,<唔哩呷呐>: 对自己开车的恐惧有增无减]
