newoutlook	一大波小奶猫正在向你靠近，快来吸猫了！！[色] ​​​	[<四方鱼_>: @af山海亦可平,<马力和苏>: @嗨呀突突是猫   @匀音Sehun,<达昔JHJH>: 骗子！！哪里有大波了！骗子骗子骗子！,<Airyzo_随缘>: @Morikawa-茉莉,<志鹏Nevergiveup>: @Shutterkk  宝贝起床了呦～[羞嗒嗒][羞嗒嗒][羞嗒嗒],<王京_JZ>: @SOS_O人O   🙃,<大德鲁伊袁宝>: @海yan只愿岁月静好,<6号-铺子>: 图8，9是什么品种的？,<宋铭礼>: @屁屁喵与臭臭呱,<鲫鱼豆腐汤汤水水>: @我愿似一块扣肉嘿,<钦定的C菌>: @月半-口阿-木不,<咪_Shirley西西>: @精神抖擞的大豆砸,<dpxgtpdgdwgtj>: 回复 @馨若卷了 :[污][污][污],<馨若卷了>: @dpxgtpdgdwgtj,<不会拍照的社畜君>: 快来吸，吸完感觉一天都不想动了 @日渐圓润的狗崽几,<服装161团支部>: @仿佛若有光gxy,<布鲁克林的冬日战士>: @晴空下的dream,<糖豆ta爹>: @smile_xujun   [哈哈],<一直忧伤的猫咪>: 歪，妖妖灵吗，这里有人聚众吸猫，你们管不管,<卓曦是甜品达人>: @卓曦家的曹三岁,<momo_PON>: @你从来没有见过这么标准的十五字,<弱水三千斤光闪闪>: @申成龙真丑  想抢一只去！,<观澜子>: 等在你家到处乱窜、拉屎拉尿，就不觉得小奶猫那么可爱了！,<机智的压缩饼干>: @美丽的压缩饼干,<M是名君啊>: @县中梁朝伟小奚老师  太幸福了吧……,<腹黑的小傻白甜兔>: 第6个是在干嘛[微笑],<tutugi>: 3456 @独角兽爱上了诸葛兔   [馋嘴][馋嘴][馋嘴],<孤匠snl>: 图八图九是什么猫,<南方曰>: @嗷大喵蓝小胖Meow,<Z_suan>: 回复 @B雨雨雨 :可爱,<我为kz狂>: 前排求个媳妇儿[羞嗒嗒][羞嗒嗒][羞嗒嗒][羞嗒嗒],<大大看大视界>: @Victor维克托_翎子,<wengling20204568>: 早安[西瓜][西瓜]一大清早被暖萌了。[微笑],<天蓝蓝青草香_>: @兮兮很文静  吸,<曦禧熹僖囍>: @苏木子曦   @莫名其妙的无聊   @烦人的人永远烦人,<和平時代Orz金錢論成敗>: 观察动物网   早[doge][挖鼻]]
newoutlook	这个动画人物真是和本尊一模一样了 233 ​​​	[<最近被萌翻的小雨>: 徐老师亲自宣传2333,<Gatoney>: @蚊得不明显  难怪觉得眼熟！！！！,<宿久oppa萌萌哒>: 哈哈哈哈金毛狮王！,<雨中碎乐>: 前几天刚回忆了下仙剑一,<WincestFever>: 回复 @Countdown_To_Extinction :嗯嗯，是个很有内涵的人,<随便起的也被占>: 其实大护法拿在手上的画像更像徐锦江，比动画更像[笑cry],<Countdown_To_Extinction>: 回复 @WincestFever :话说老徐的画展我看过， 太牛逼了,<随便起的也被占>: 哈哈哈哈哈哈哈哈哈哈哈哈昨天去看了，真的很像徐锦江,<_牛何_>: 来人，上dnf四大叔图,<xingyy_77763>: 这片子和去年大鱼海棠比起来，还真是让人惊喜。。。。。,<寒天阁主>: 回复 @寒天阁主 : @电影大护法   恭喜被观察者网翻牌子[doge],<苑忘戍>: 还以为仙剑出动画了[挖鼻][挖鼻],<寒天阁主>: 观察者网也关注大护法么？[憧憬][憧憬][憧憬],<HappyHappyJoeyJoey>: 长得跟动画片里出来的似的[doge] @Danny是最后一只恐龙,<童话里de小橘子>: 就是徐锦江老师原型吧，导演说整个工作室都是他粉丝[笑cry],<一片洞庭湖海天>: 电影很好看哦，小编记得去看哦⊙∀⊙！,<冬天睡不着夏天不起床>: 回复 @观察者网 :是啊是啊，在纽约，一直关注，偶四五年前就是你粉丝了[二哈],<不舍o一一>: 回复 @绿茵背锅俠 :[哈哈][哈哈]太像了,<变来变去的傅立叶>: 《大护法》挺好的,<俊世科客>: 哈哈哈， @徐锦江,<快到碗里来n_n>: 雷神[doge][doge][doge],<观察者网>: 回复 @冬天睡不着夏天不起床 :发现了 美东吗,<辨民安志>: 徐锦江啊，真人不露相，他可是关山月的徒弟,<WincestFever>: 回复 @Countdown_To_Extinction :太内秀了,<炙杖>: 可以说是一模一样了,<冬天睡不着夏天不起床>: 回复 @小明筒子 :已删[二哈],<Countdown_To_Extinction>: 不会拍三级片的画家不是好演员,<小明筒子>: 回复 @冬天睡不着夏天不起床 :反思一下,<人民币Boss>: 给三级片打广告了[偷笑],<你的肥皂我的泡>: 什么？他是徐光头？？[允悲],<巴勒斯坦海军司令>: 谢三哥！我这辈子从没说过谢字！,<冬天睡不着夏天不起床>: 回复 @观察者网 :姜，刚睡醒有点蒙，时差党,<观察者网>: 回复 @冬天睡不着夏天不起床 :那……早？[费解],<婴哲宁>: @安适las   @半醉半醒半痴呆321   @咔咔咔呲啦哒  太子也是一个很饱满的人设呢,<冬天睡不着夏天不起床>: [二哈][二哈][二哈]早,<水果炒菜团>: 2333真的好像啊[笑cry][笑cry]]
newoutlook	无心工作，快热化了。你们家乡现在什么温度[生病] ​​​	[<茜茜小公主的穷爹>: 不知道热不热。反正我一屁股坐到椅子上，屁股就被烫伤了。[允悲],<哈喽-肖>: 今天不是周六么[费解],<透骨生香052>: 21℃昆明。体感温度17℃[二哈],<冰比冰水还要冰>: 现在23°   黑龙江,<JohnHomme>: 37............,<到底取什么名字呢呢>: 暴雨~凉快着呢~,<开罗大帝>: 成都，前天全国出名的暴风雨，然后昨天32，今天35了。,<RW-LC>: 17°，哦，我开着空调[doge],<BUTTERFLOWER99>: 心静自然凉[偷笑][偷笑][偷笑],<daisy200101>: 最近都是37℃，热到爆炸[衰],<LIN-Insane>: 回复 @giantstian :广东下开水，多在屋里瑟瑟发抖,<满屋书香草药香>: 广州，正在下开水[允悲],<清风拂面-醉酒当歌>: 昆明22°晚上17°冷[害羞],<种花家T兔子>: 唔。。昨晚老妈给我换了夏凉被，然后今天我感冒了[摊手][摊手],<岳麓山童姥>: 长沙，36摄氏度。,<在宝宝美颜无敌>: 现在苏州37度，还有雾霾，心累，家乡现在35度[二哈][二哈][二哈],<中年人663>: [阳光][阳光][汗],<吐蕃顽童Q>: 中午24度。很凉爽。欢迎来我家乡避暑 这里没有雾霾 这里没有堵车 这里没有拥挤的人群  这里有蓝蓝的天空 绿绿的草地 清澈的小溪,<中年人663>: 回复 @小强一直在玩泥巴 :[汗][汗][阳光],<amyd真人>: 郑州，从昨天就说要下雨，到现在也没下,<脱非入欧但丁桑>: 33，还行，只要有空调[二哈],<CcCcJn>: 最高31[挤眼],<骑士亚伦>: 武汉[允悲][允悲][允悲],<0411joe>: 大连，北方海滨城市，28。[二哈],<铺满素纸渲梨花>: 回复 @giantstian :马上要去西安的我瑟瑟发抖[二哈][二哈][二哈],<大海的儿子82475>: 现在家里温度27°C，今天只开电扇，没开空调。,<随便想个名儿都让抢了>: 回复 @giantstian :同西安，身上撒把孜然就是烤肉了[二哈][二哈][二哈][二哈],<蛋蛋饺饺>: 空调，手机，wife，大床，这就是我的日常[喵喵],<今年今月今日_此时此分此秒>: 哥，认真点，最后一幅打错字了，是"跟"吧。,<学医我也不奶你>: 大理，20度，长袖。[并不简单],<馨空气净化器供应链中心>: 有谁认识刘德华或刘德华经纪人的联系我一下，我想让他用冷冷的冰雨在我脸上胡乱的拍，谢谢，实在太热了,<妞妞端午的后妈>: 天气显示35度，估计得有38度，热惨了[允悲][允悲],<徐海乔的眼角眉梢>: 云南[doge]反正目前温度还没突破30度。以及晚上要盖好被子 挺冷的。不说了我要加件外衣去,<台湾那点事儿>: 可是里面的人说太冷想出来暖和暖和[骷髅]// @志凯 ：热到想进太平间避暑……,<琪哥儿_啊幽>: 33度[允悲][允悲][允悲],<反穿内裤的超人不会飞_>: 大福州40度……已热成[二哈],<肉饺蒸的肉饺>: 下雨，凉爽[哈哈]舒服,<cobbe卡贝>: 热҈得҈字҈都҈出҈汗҈了҈,<giantstian>: 回复 @Lawsk让我留在你身边 :那是已经热晕了，找个凉快地，刚好倒在地铁站？,<水井湾张学友>: 重庆人抱紧我[允悲][允悲],<NavyZhzM>: 蒸桑拿而已[笑而不语],<Lawsk让我留在你身边>: 回复 @守护SuJuForever :羡慕,<Lawsk让我留在你身边>: 回复 @giantstian :据说有人热晕在地铁站[doge],<啊噢豁>: 六盘水。22度[二哈],<深海金龙咸鱼阿瀛>: 下雨了  也就32度,<月亮一朵>: 三亚，很凉快，台风马上要路过。感觉这个夏天就没怎么热过,<众辈不志道不平>: 白天睡觉，晚上工作？,<小强一直在玩泥巴>: 23℃，快来我大春城避暑啦[二哈],<守护SuJuForever>: 日常20度[doge],<昆明老狼>: 22度[阴险][挤眼]]
newoutlook	想让女儿美美的，从小就带去打耳洞。你怎么看？（英国那些事儿） ​​​	[<清凡姐姐>: 回复 @王骁Albert :[鼓掌][鼓掌][鼓掌][鼓掌],<铺满素纸渲梨花>: 回复 @王骁Albert :不是啊，我清楚的记着我之前在哪儿看到这是个个人网站来着，现在找不到了，难不成是我老眼昏花看错了？,<司徒你慢点走啊>: 其实他只是为了让你翻牌[doge],<王骁Albert>: 回复 @铺满素纸渲梨花 :就是官方啊…醉,<王骁Albert>: 回复 @梦半仙儿 :求您高抬贵手,<王骁Albert>: 回复 @清凡姐姐 :66666,<灰灰家的onesun>: 戏真多，取关就取关呗，who cares？,<我就是我杨希子>: 求求你，别走，求求你。,<仙人掌不爱跳舞>: 回复 @观察者网 :没有礼品就算了，为什么我还被卖片的盯上了？[费解]赔个西瓜我就不举报你微博涉黄了,<只有篮球让我快乐_>: 不说一下怎么表达愤怒。,<gene-cook>: 评论的不是给自己加戏？,<这个昵称已被占用了哦>: 人家粉丝有46个，问你害怕不害怕[笑而不语][笑而不语],<肥墩墩的毛球>: 请问你们知道耳垂瘢痕瘤吗？我得过，具体成因没有定论，与是不是瘢痕体质无关，正常人打耳洞都有机会得，不停的增生，我治疗五年，复发三次，最大增生到小拇指肚大，最后放射才好。我就想问，这是我自己作的，我自己承担没错，如果我父母在我幼时擅自做主导致的，我能不怨？被同学笑，能不自卑？,<中华赵姓宗亲会会长>: 回复 @梦半仙儿 :只听说过敬事房,<不良荣誉>: 还有这种加戏操作？笔记笔记[doge],<猴加糖>: 夸我，我是三观正的好青年。,<CheeseZzz丶>: 太把自己当回事了啊 和蛙蛙一个毛病,<懒人信条_>: 不爱看滚，招你惹你了,<一只闪闪发光的果子狸>: 回复 @鸡大腿的鸡翅根 :只能给自己加个鸡腿儿了[doge][doge][doge],<志凯>: 回复 @观察者网 :我呢我呢？赶紧回我一个[憧憬],<人生也在>: 观察者网天天带节奏[喵喵]，这个他说的很对好吧，但是他自己加戏太多了。那个卡相也怎么评价过观察者网的[二哈],<观察者网>: 回复 @鸡大腿的鸡翅根 :66666,<观察者网>: 回复 @仙人掌不爱跳舞 :给你点个赞吧,<梦半仙儿>: 回复 @中华赵姓宗亲会会长 :南书房,<仙人掌不爱跳舞>: 我评论次数这么多，是不是该发个奖品慰问下[笑而不语],<Fiona小f>: 新闻争议性大不是新闻本身的事情么，为什么怪媒体发出来，不懂,<鸡大腿的鸡翅根>: 我一直都在也不见观察者网翻我牌子！怎么能这样子啊！[允悲][允悲],<爱哟快乐>: [偷笑]→_→// @观察者网 :回复 @叶子吥枯黄 :取关还要在别人下面留言，也是辛苦你了大兄弟……[允悲]// @叶子吥枯黄 :回复 @小白妖妖_艾瑞蒙 :不仅如此，他还得专门发争议性大的，好让微博下的人争论，增加点击量。 我已取关这个sb主页。,<从灰白到橙红>: 大热天，非要给自己加戏。,<I-need-epicurean>: 哪里来的野鸡给自己加戏？[允悲],<清凡姐姐>: [喵喵]虽然小观从来不回我，可我就坚持不取关。谁还没个原则怎么滴？[摊手],<铺满素纸渲梨花>: 观观啊，我怎么记得你们不是官方博，是私人的？我在哪儿看到的来着？,<只陪你走花路>: 快来求我留下[doge],<梦半仙儿>: 我宣布，我要取关你了，快来求我，[doge][doge][doge]哈哈哈哈哈哈,<日理万姬ing>: 硬生生给自己加戏[doge]]
newoutlook	一组抓拍得刚刚好的照片！！[吃惊] ​（via 英国那些事儿） ​​​	[<它的二三事>: 羡慕狗狗[熊猫],<-y1_________>: 图二好恶心。。。。,<俊姐的猫窝>: 看图3有种-1S的感觉。,<秋雨荡漾括弧笑>: 生命长得扭曲了时间,<乔艺东>: @请叫冬健大人爸爸   @却道丶天凉好个秋  我感觉都没有那个山顶照片厉害,<鸡爪子炒鸡蛋a>: 6666666666666666666,<西瑟麟_seliyn>: 真正的粉丝……[并不简单],<-骑山地车车的忧零->: 图8  第六个，有人知道是什么吗 [偷笑][偷笑],<茶叶君123>: 第三张的时间扭曲了[并不简单]这是膜法，要念咒语才能破解桎梏[并不简单]苟,<十年许愿>: 回复 @梦半仙儿 :时间膜法[并不简单],<种花家的兔子A>: 回复 @贝戋民 :一只青蛙从手心跳走的瞬间,<杨某君>: 图三是跳跃的青蛙[青蛙]，所以有人在暴力膜,<种花家的兔子A>: 回复 @只有篮球让我快乐_ :斜着看，一直青蛙从手心跳走的瞬间,<梦半仙儿>: 回复 @十年许愿 :[doge][doge][doge]不准养[狗]。,<唐吉2017>: 第三张就在1s之间 时间的魔法师啊,<孙华扬i>: 看到第三张好像更恶心了。。。,<贝戋民>: 图三是什么[费解][费解][费解],<梦半仙儿>: 第九张不忍直视。,<十年许愿>: 真正的粉丝就算是图变成那样也能认的出来[并不简单][并不简单][并不简单]]
newoutlook	想让女儿美美的，从小就带去打耳洞。你怎么看？（英国那些事儿） ​​​	[<蓺彤->: 回复 @迪克猪仔小毛 :这Tm还有人赞[doge]一群文盲捧一个文盲,<蓺彤->: 回复 @迪克猪仔小毛 :你了解LGBT群体吗文盲[摊手][吐],<阳光下的狗尿苔>: 回复 @叶子吥枯黄 :傻狗，替被你屏蔽的兄弟骂你一句。,<有些人膝盖生根不愿起>: 回复 @叶子吥枯黄 :戏真多，取关了还来说一下好引起注意还是什么。,<小虾米大九节>: 回复 @叶子吥枯黄 :我觉得你应该去财经网，新京报，澎湃底下，那里才是你们族类的乐园,<琨溪>: 回复 @琨溪 :我们这里，老一辈的人说，小时候打耳洞，聪敏享福[doge]，我发炎过几次，就重新打几次,<QianQianQianY_>: 我还挺后悔我爸妈没在小时候给我打耳朵来着[允悲],<暖你的奶>: 回复 @叶子吥枯黄 :恶心不？,<cxf3623>: 回复 @叶子吥枯黄 :赶紧走吧，别用你那愚蠢的气息来污染别人。,<琨溪>: 我带金，银，珀金，白金，都过敏🙈，只要一天就肿到不行[二哈],<用户cvmw6zeqhn>: 回复 @日光倾城三寸长 :另外那么小的孩子耳朵上戴着耳钉、耳环极易挂住衣服等异物，会撕裂耳垂的,<不良荣誉>: 一直都没能理解在身体上戳个窟窿是什么审美，感觉疼死了。感觉跟裹小脚来自同一种审美欲望。[二哈],<Ada狸子喵>: 回复 @这该死的手啊怎么就忍不住的啊 :对啊，我打耳洞的时候，冬天弄得都感染了，疼死我了，小孩的疼痛忍受程度肯定特别低，那小孩不得哭的停不下来,<别转我微博啊>: 回复 @叶子吥枯黄 :魅族会好,<霖小姐的后花园>: 这没什么吧，打耳洞其实并没有多疼啊,<枫落忆往殇>: 回复 @叶子吥枯黄 :兄弟你取关又何必来特意说一句呢...这不是傲娇么...,<作死先锋侠>: 回复 @乱室英雄wtt :我倒是昨天才见完[允悲][允悲],<冰比冰水还要冰>: 我是疤痕体质，所以不敢打，也不敢给以后的孩子打。等孩子长大以后我会跟他说清楚后果，剩下的他自己决定吧,<我想要的昵称已被注册>: 裹小脚当然是从娃娃抓起,<月半丝丝>: 身体发肤授之父母，反对！ @维喆sama,<观察者网>: 回复 @叶子吥枯黄 :取关还要在别人下面留言，也是辛苦你了大兄弟……[允悲],<一圈儿呆毛>: 反对还是很有道理的。。。你给她这么小打了她还没有选择权根本都不知道自己在干什么，长大了打根本不影响啊，说困难也没困难到哪儿去 多等几年能咋了,<柳尘无烟>: 回复 @叶子吥枯黄 :傻狗,<小小老爸向前冲>: 一个刚做了母亲的变态而已,<叫我蜡笔就好>: 回复 @老李滔滔不绝 :醒醒，欧美的,<木木哒188>: 回复 @温斯顿的花园 :敢反对你美爹，扣工资！[doge],<征服之海123>: 侵犯了婴儿的自主权利了吧。。[doge],<爱种花的兔大人>: 我很小的时候老爹就带我去打了，反正我没有疼的印象[摊手]   作为经历者，我觉得幸好我爹给我打了，让我长大后压根不需要烦恼这事，愿意戴耳环就戴，不愿意就让它长起来就好了。反正我觉得那些喷的人都是吃饱了撑的。,<叶子吥枯黄>: 回复 @赵小雷雷雷子 :被窝拉黑了？傻d，没法说话了气不气？,<叶子吥枯黄>: 回复 @赵小雷雷雷子 :哟？管你几把事儿啊？这家伙给了你多少钱啊？哈哈哈，舔的舒服嘛。 来我给你三块钱你也舔舔我？,<没头脑和不高兴的PLF>: 自然让孩子自己决定，想给孩子打扮，还有耳夹呀[摊手][摊手],<若言言在罗马上但丁>: 为什么要反对啊……我在意呆利的朋友说 她们那边打耳洞的话 要么刚出生就打 要么等到十几岁以后……,<小短腿呀_静静>: 今早上和梦梦两个人才把耳钉戳进去，讲真，看到我那一把沾满鲜血的棉签，感慨女生真是可怕[允悲],<乱室英雄wtt>: 回复 @温斯顿的花园 :哟！好久没看见你了呢[doge],<妤妤音>: 打耳孔真的很痛的啊，赶紧摸一下我的耳孔。。。。,<赵小雷雷雷子>: 回复 @叶子吥枯黄 :你看不惯取关了还来评论你是有多贱,<vanecgowen>: 厄瓜多尔女孩子一出生一天就给扎耳洞。,<两袖清风尼克松>: 这么自私的父母[微笑],<月亮打了个饱嗝>: 我当时打了耳洞之后，走路腿都是软的，痛到爆。,<Karina_Ycc>: 我就是怕，23岁了还没打耳洞[二哈],<北海道剁手菌_无敌多多多>: 两句话，一句是关你屁事，一句是关我屁事。,<小白妖妖_艾瑞蒙>: 回复 @叶子吥枯黄 :[笑cry],<喵王Rein>: 这些家长使孩子从某种程度上做到了与狗的相对平等。,<蹭吃蹭喝萝小黑>: 喜欢项链，不喜欢耳环，一切以伤害女性身体换得的美感，我认为都是不可取的,<_李裕子>: 站着说话不腰疼的，走开，打耳洞一点都不痛,<达里亚如是说>: 一定要打了耳洞才能算是美吗[费解],<吃饱了有点困>: 长大了我都不打，何况小孩子,<叶子吥枯黄>: 回复 @小白妖妖_艾瑞蒙 :不仅如此，他还得专门发争议性大的，好让微博下的人争论，增加点击量。 我已取关这个sb主页。,<鲁京生>: 这和剌皮包一个意思吧,<何希光的微博>: 回复 @温斯顿的花园 :[并不简单]这不是美狗么,<肉饺蒸的肉饺>: 回复 @JoeChen8013 :[doge],<司徒你慢点走啊>: 皿煮的国家，父母的爱，自由的耳钉，多好,<沫雨flyer>: 小孩子还在发育，最好不要这样吧……]
newoutlook	健康作息才有健康的身体，不要老是修仙了（山东共青团） ​​​	[<苏尚生活广场>: 回复 @苏尚生活广场 :手机这个磨人的小妖精,<苏尚生活广场>: 道理我都懂，奈何比不过手机魅力大[允悲],<辨民安志>: 我都快羽化登仙，你干嘛把我拉回来[允悲],<giantstian>: [doge]排版乱了小编 没睡醒吗,<瘦狗一号>: 晚八点看金瓶梅的时候没忍住撸了一发，一天的健康生活都白费了[并不简单][并不简单][并不简单],<婷迷如初見>: 能做到的都成仙了,<珑图>: @道門網-正统道教网站  这博主不让我修仙[机智],<NANA_NOOB>: 回复 @NANA_NOOB :我怎么被卖片的盯上了[二哈],<Blaun>: 最后一图那马赛克啥意思[doge],<爱音乐的CXB>: 排版错了吧[二哈],<NANA_NOOB>: 什么鬼配图[二哈][二哈][二哈],<嘤嘤咩咩羊>: [允悲][允悲]我爱修仙，修仙使我快乐[doge]]
newoutlook	电视剧、电影中的九大魔性笑容巨头，不服来战！[嘻嘻][嘻嘻] ​ ​​​	[<凹凸曼呼噜娃>: @七七七七七气气  还是魔兽的笑容最神秘莫测,<你国之声>: 表情包四巨头 姚明 花泽香菜 馆长 张学友 其他都是垃圾,<巧淘购物app省钱神器>: 你永远不知道你在中国有多火,<俊世科客>: 原来姚明表情包是这样来的,<陨落神様>: 兵库北呢[笑而不语],<代号Tian>: 回复 @宁一州 :姚明是啥电影？,<琅琊榜首梅常影>: @善良美丽可人儿,<不许乱说>: 所以偶像剧里鲜肉们都板着脸，面瘫。像图中这两位，偶尔笑一笑，结果笑成了笑话。,<带脑子的雨辰大少>: @带脑子的雨辰大少 :  @带脑子的雨辰大少 :  @带脑子的雨辰大少 : 现在终于知道为什么好多人可以上热门了，原来赞是可以连着点的，长按住不动，赞就会持续上升，不要问我怎么知道的，你们试试就知道了。我叫找奶子的王小二[doge][doge][doge][doge] 。,<雯名遐迩>: 图八这个小孩跟普京什么关系,<宁一州>: 回复 @代号Tian :姚明啊,<檀口轻启吐兰芳>: 回复 @闻夕Hathaway :你仔细看看图二,<聴風的世界>: 午时三刻，烈日当空，监斩官下令：“斩！” 突然，死囚一阵哈哈大笑，监斩官不明，问：“你为何发笑？” 死囚迟疑片刻，道：“专家果然没有说错，每天笑一笑可以延长寿命5秒！”[允悲][允悲][允悲],<代号Tian>: 回复 @代号Tian :第一应该是张学友的表情包，那是电影里的[摊手],<万丰6075739392>: 第八图最有意思。,<代号Tian>: 第一个是电影？电视剧？,<打死不要香菜>: @关你屁事啊关我屁事啊   哈哈哈哈哈哈哈哈,<wengling20204568>: 隔着荧屏都能听到的魔音。[笑cry][笑cry],<梦剧场守夜人>: 九大魔性笑容，兵库北表示不服！[笑cry][笑cry][笑cry],<9秒14分>: 第八个是普京小时候吧[doge],<及妆6291312496>: 金馆长因为这个表情包被韩国人说在中国人情爆高。,<无限的无限yy炮>: 这是一条自带笑声的微博[哈哈][哈哈][哈哈],<骨灰_咕哒雪风>: 兵库北不服[笑而不语],<贰货宋先生>: @Demi噢  看9,<到处溜达的猫三爷>: 8、5、1[阴险],<我的二狗子快来见我>: 无与伦比的美丽……,<流动的原点>: 刚在别的地方看过这九张……[doge][doge],<希夷冰释_>: 黑人问号.jpg？？？]
