sisyochen	日本樱花季甜品 ​​​	[<missusunshine>: @篠-原  没啥 就是想圈下乃,<龙咪宝宝>: [馋嘴]梦幻的颜色,<黑洞吸光光>: [爱心][爱心]，不過我更偏愛紫蘇葉，它能接受酸甜苦辣,<lyannhouse>: // @文茜小妹大 :日本櫻花季每年四月，九州早一些。但我總偏愛京都，理由之一：為了櫻花甜點。櫻花葉鹹鹹的味道，配上手工紅豆餅，甜品在這個季節皆為櫻花粉色。,<願一切無礙>: [爱你][馋嘴],<镶雪>: 喜欢你的文字[心]文如其人[鲜花]优雅的公主,<范太太_Susan>: 我深深体会您的感受！！,<西塞尼米米>: @不大上微薄的马里奥,<bigheadshrimp>: @Claudia1230  来去吃,<从厕所醒来的猴子叔叔>: @维堡妍大不想再胖,<超然悠悠>: 太漂亮了以致不忍吃掉。[花心]早已过了童话梦幻的年龄，即使有这个氛围只会莞尔一笑吧。到了一定年龄入心的人事物总觉得是平常之中的但见涟漪，日常之中的细微温暖。,<少年其美>: [花痴]// @文茜小妹大 :日本櫻花季每年四月。但我總偏愛京都，理由之一：為了櫻花甜點。櫻花葉鹹鹹的味道，配上手工紅豆餅，甜品在這個季節皆為櫻花粉色。人暖暖被一種幸福夢幻的顏色包圍。明明知道這不過是一場童話，但至少故事的結尾在舌尖下，留下的是甜甜的味道。現實人間太苦澀太醜陋，櫻花甜點萬歲！,<优雅地游着Q>: @芋头糯米糍  店长，快看看,<淘氣的_藍色小精靈>: [饞嘴][饞嘴],<SCU小Wendy>: 文茜姐，对现实生活的种种，难得糊涂是大智慧哈～,<兰瑟亚亚2015>: 好漂亮！肯定好吃！！么么哒！！[酷][酷],<Kiss小唄>: 光看就覺得幸福[花心],<琥-Amber_857>: 日本櫻花季每年四月，九州早一些。但我總偏愛京都，理由之一：為了櫻花甜點。櫻花葉鹹鹹的味道，配上手工紅豆餅，甜品在這個季節皆為櫻花粉色。人暖暖被一種幸福夢幻的顏色包圍。明明知道這不過是一場童話，但至少故事的結尾在舌尖下，留下的是甜甜的味道。 精致,<如烟似海>: 好梦幻的樱花甜品哦,<宝珥Boa>:   @快乐的水瓶座02,<风流倜傥薛公子>: 看到這么多好吃的東西，想不破功都難！[嘻嘻],<风流倜傥薛公子>: 文茜姐，快午夜了，发這么多好吃的東西，是和我們這些胖纸有仇啊？[抓狂],<巫婆室长>: 那里是否曾经让你[爱心]️动[亲亲][亲亲][亲亲][亲亲][亲亲][亲亲][亲亲][亲亲],<yansy2011>: 好梦幻，恐怕舍不得吃！,<阿布要貫徹快樂>: 最近也萌生了想看櫻花的念頭,<我d悠长假期>: [good][good]日本櫻花季每年四月，九州早一些。但我總偏愛京都。,<sthbiutiful>: @tingzi03,<快乐芭芘菲菲>: 你说的太好了，有种想去的冲动,<Cinderella视觉手绘>: @李庆园钢琴音乐资料馆,<买华为用4g>: 小时候环城小学都唱樱花啊樱花啊……,<忘忧草喜欢听故事>: ...但谢谢丑成全了我们对美好的渴望！这或是它仅存的价值！,<IT云图>: 漂亮// @文茜小妹大 :日本櫻花季每年四月，九州早一些。但我總偏愛京都，理由之一：為了櫻花甜點。櫻花葉鹹鹹的味道，配上手工紅豆餅，甜品在這個季節皆為櫻花粉色。人暖暖被一種幸福夢幻的顏色包圍。明明知道這不過是一場童話，但至少故事的結尾,<I_am_pizza>: @文茜小妹大  新年快乐[爱你]]
sisyochen	奥斯卡获奖感言精选 ​​​	[<紫荆仙子>: 格局大// @文茜小妹大 :談自殺、談抑鬱不得志、談女性演員被歧視、談人奮戰疾病 // @闾丘露薇 :从平权到分享个人成长，没有鸡汤，充满责任感。当Patricia谈男女同工同酬时，台下的梅姨都坐不住了。,<地下停车场>: 醉翁之意不在酒，谈hongkong那段才是想表达的吧。。。,<地下停车场>: 最稳之意不在酒，谈hongkong那段才是真正想表达的吧。。。,<阿菠萝要登月>: 想要同样的薪酬你也得有相应的价值，女性主角的电影号召力的不大，除了大表姐,<DorothyChou>: 茜姊，此回復讓我倍爽之感！新年快樂！,<岭之儿>:  // @文茜小妹大 :談自殺、談抑鬱不得志、談女性演員被歧視、談人奮戰疾病 // @闾丘露薇 :从平权到分享个人成长，没有鸡汤，充满责任感。当Patricia谈男女同工同酬时，台下的梅姨都坐不住了。,<巧宗妙禪IN-IN>: 大家喜歡過去的規則嗎？反正我不喜歡，也難以適應。未來是新時代來臨了，新時代、新思維、新生活，一切都會很美好的。[许愿]// @文茜小妹大 : 玛雅文明称末日之意：终结哀伤，分享幸福。来自半岛电视台。[哈哈]]
sisyochen	“妈妈说，你结婚后流的汗和泪，都是当年选老公时脑子里进的水。”—— 好狠的话，无奈也得承受。 ​​​	[<爱吃甜品的小猫>:  “妈妈说，你结婚后流的汗和泪，都是当年选老公时脑子里进的水。”—— 好狠的话，无奈也得承受。 // @文茜小妹大 :哈哈大笑！,<_皑如山上雪>: 可我妈一直想让我随便找个经济好点的老公 就行[衰],<吴喜宝>: [赞]// @文茜小妹大 :哈哈大笑！,<徐柏顏>: [思考]迷惘的慌+依靠的安=腦子裡的水。←同感嗎？婚姻能讓這些水慢慢蒸發，有人蒸發後看清事實真相，有人繼續再裝水，婚姻能填補迷惘和依靠的需求，但不管看清真相或沐浴在這些水裡面，總得給自己一個交待，如能給自己一個交待，腦子裡裝的是什麼就不再那麼重要了。問題是...交待什麼？// @文茜小妹大 :,<王文娜5071>: [笑cry][笑cry]// @文茜小妹大 :哈哈大笑！,<cherry_201201>:  // @文茜小妹大 :哈哈大笑！,<For_Rain_>: @VioletCLove   @三丫头小梅,<徐柏顏>: [思考]我的意思是...當年選老公時腦袋裡所裝的水是什麼？// @文茜小妹大 : 哈哈大笑！,<徐柏顏>: [嘻嘻]...小妹...那這些水是什麼？// @文茜小妹大 : 哈哈大笑！,<夏天的ruyixiexie>:  // @文茜小妹大 :哈哈大笑！,<旧山松15>: // @文茜小妹大 : 哈哈大笑！,<徐柏顏>: [哈哈].....// @文茜小妹大 : 哈哈大笑！,<爱玲迷>: 不知道为什么，一点都不喜欢这句话—一点都不好笑！cheap humour!,<一牟>: [doge][doge][doge][doge][doge],<peanut-O3>: @ayawawa  ,<樱桃大丸子yyy>:  // @文茜小妹大 :哈哈大笑！,<常熟市古里镇铁琴北街营业厅>:  // @文茜小妹大 :哈哈大笑！,<寒小灼>: 能说出这话的人是有多愚蠢！,<超然悠悠>: // @文茜小妹大 :哈哈大笑！,<DaisyST>: 结婚这个事情，关乎两方，结婚后流泪流汗在我看来并不是什么大事，也并非坏事，坏的是，这样的事情你总是一个人抗下，你的枕边人对此只是随意。如若两个人一起相守，一起度过，一起为未来奋斗，那么什么都是美好的,<Anearzhou>: [哈哈][good] // @文茜小妹大 :哈哈大笑！,<遥远510>: 另一句:我爹从小教育我不能让女人哭，因为女人的眼泪就是脑子里进的水，脑子里面进的水如果流干的话，以后就不好对付了[哈哈],<莉莉张ly>: @壹花___   @Patty-1   @想名字头壳会痛   @曾静活跃起来嗨起来   @Eating_eatmoon   @苏有涵,<慕牧晓诗>: // @文茜小妹大 :哈哈大笑！  ／／  非常精辟，回味身浸水了。,<一個師奶仔>: [白云]聽過例似的⋯,<信天翁188>: [哈哈][哈哈][哈哈],<遇见霓虹就疯狂>: 我妈今天跟我抱怨我爸…我就是这么回她的…讲完她立马转移话题[囧],<TOFUGG>: 爸爸还说：千万别轻易让你的女人流泪，泪是脑袋里面进的水，流光了女人就不好对付了。 // @文茜小妹大 :哈哈大笑！,<今夕但又何夕>: 照此理，不结婚独身岂不更好？！既不流泪也不流汗……女人嫁给谁都会后悔,<素三仙ssx>:  // @文茜小妹大 :哈哈大笑！,<林飞幸福之路>: [偷笑]把“老公”换成“老婆”，这话也适用，彼此彼此，自作自受，八要怨天怨地怨父母……// @文茜小妹大 : 哈哈大笑！,<Alive陌>: 哈哈哈// @文茜小妹大 :哈哈大笑！,<岁月真切>: [赞][赞][赞],<花画灬在路上>: 文茜姐，美国两房是不是要彻底破产了啊,<丿Zyra>: 文茜姐 新年好！,<FreeSpirit1981>: 男的也可以反过来说,<勤劳的鼹鼠>: [笑cry][笑cry][笑cry][笑cry][笑cry][good][鮮花] // @文茜小妹大 :哈哈大笑！,<小布丁她妈老布丁>: @海边的Annie宝贝  // @文茜小妹大 :哈哈大笑！,<Elena-Liu>: [偷笑] // @文茜小妹大 :哈哈大笑！,<lei爱车匙>: [哈哈][哈哈],<周若存>: 哈哈。// @文茜小妹大 :哈哈大笑！]
sisyochen	图赏丨镜头中的水墨中国，“留白”的空灵之美。 ​​​	[<陶岑>: 看到吴冠中画作的影子～,<唯一坚持de任性>: 宁静！// @文茜小妹大 :白色中國之美。,<王亚非JaneWang>: 确实很美，比之现在的很多水泥垃圾，实在是太美了。// @文茜小妹大 : 白色中國之美。,<Amy-Wu66>:  // @文茜小妹大 :白色中國之美。,<yuji0101>: // @文茜小妹大 : 白色中國之美。]
sisyochen	樹木枝葉仍枯竭，景色荒凉太沉郁。我選擇在此刻，燃燒綻放。～～陽明山中國麗緻飯店旁 ​​​	[<鑫鑫棉织>: 这环境真美呀！！！,<永远的yongyuan>: 这是什么花[害羞]？好艳丽呀[呵呵],<nimotsupan>: 陈老师，不喜欢忧郁的美，我喜欢明亮向上的,<天气晴小姐在垦丁>: 说到阳明山 都会想到林清玄 可以预约的雪]
sisyochen	《致親愛的主人》撰文：陳文茜 《致親愛的主人》撰文：陳文茜 ​​​	[<陆在上海>: 想起我家的宝贝[狗]，去年六月二十八日永远离开了我，我每天都想她，真的不知怎么办⋯⋯,<超然悠悠>: 有爱的狗狗，[爱你]有爱的一家人~[心],<不见琴不散>: 当我灵魂疲倦沮丧时，我的身体也背负着重重困难，我平静地等候，直到你回来，轻坐我身旁。你曾鼓舞着我，站据环山高岗；你鼓舞着我，面对致命疼痛。你陪伴我身边，使我仍然佯装刚强，你鼓舞着我，～～所有诞生的生命皆充满飢渴，当我遇见了你，亲爱的主人，…”心声！！! 我必加倍善待伴在身边的～～,<我布吉岛是什么>: 爱是无价得，愿有来生，彼此还会再相遇.我定会加倍好好爱你[狗],<梅窠淼淼>: 文茜姐姐的文章把我看的流泪了。谢谢姐姐的文章。,<meimei-GAI>: [泪][心]我的狗狗在他十五岁那年离开了我[泪]我抱着他和他说如果有来生就让我们找到彼此[心][心],<historia在说hi>: @以控制工程为纲  你的狗[doge],<婷儿不想念>: 好可爱的狗狗，叫什么呀[爱你]]
sisyochen	【全球肥胖地图】胖子到底哪里多？ 全球肥胖地图 ​​​	[<田鑫China>: 姐姐不胖[挖鼻屎],<都你惹的事>: 北朝鲜全国只有一个胖子吧！[挖鼻屎],<丁叔家的馨姑娘>: 朝鲜0%？那三胖子怎么回事？// @文茜小妹大 :台灣還好，幸好沒有被我壓沈了！,<覃学>: [哈哈][哈哈][神马][浮云]]
sisyochen	世纪婚礼现场的糕点[心][赞][good] ​​​	[<Lisha93>: @小九真的要多读书,<幸福纯果乐2011>: [心]// @文茜小妹大 :Sweet,<-梁景霞>: 回复 @澄仔0617 :哇哇,<love小溪er>: @rougeMonroe_  你看看,<长仔李>: @美欣miyoshi_婚礼策划与设计     // @文茜小妹大 :Sweet,<王浣熊熊>: @小肥羊要健康  粉金蛋糕,<澄招财>: @容真是妞爷   @-梁景霞,<嗨想唱就唱>: 看着都醉了[花心],<G175G>: @LeiYY是番茄困困,<盐会会>: @阿赵赵找阿赵   @未落___   @肚子里的嘉乐妹   @花裙子小姐的summer   @哇刺则法克  你想要的，我都有,<小桃猫_妈咪>: 好精致唯美的甜品！[赞]// @文茜小妹大 : Sweet,<Lynn最爱夏天>: 回复 @深海咖啡馆馆长 :萌萌少女心,<禾刺青一罐子>: 回复 @我亲爱的长笛少年_ :首先得有男盆友,<我亲爱的长笛少年_>: 人家婚礼的糕点~ @-LiaO悅晗,<深海咖啡馆馆长>: 回复 @Lynn最爱夏天 :嗯，看到了，非常漂亮...杰伦就是有这种情节,<惠善的臭豆腐>: 有沒有這麼豪華[鼓掌]恭喜周董,<Lynn最爱夏天>: @深海咖啡馆馆长,<猪肉肉肉肉>: 男朋友，请你一定要幸福呦~~~// @文茜小妹大 : Sweet,<小茉莉oooooo>: 回复 @第二人生的kwonsangwoo :受不了啦![抓狂]这个蛋糕上字母呢设计,这个蛋糕!周杰伦太太太[作揖],<谭明灯>: 应该都是用来摆 不给吃的吧……,<流秋半岛>: 有多少女人想嫁给这场婚礼？ // @文茜小妹大 :Sweet,<springee1991>: 任性的婚禮[鲜花][心]// @文茜小妹大 :Sweet,<第二人生的kwonsangwoo>: @薄荷-森-绿-依然葡萄柚儿  哎哟~~,<weiwei-aan>: 好漂亮。我觉得蛋糕师才是最棒的职业。,<LonelyMick>: [赞][赞][赞] // @文茜小妹大 :Sweet,<云里有个影>: #周杰伦结婚# @猫小蛋冇乜嘢   看不到杰伦新照，就看看甜点吧+_+// @文茜小妹大 :Sweet,<lyannhouse>: 好漂亮！// @文茜小妹大 :Sweet,<宋俪文>: 全世界女生的夢幻婚禮[男孩儿][女孩儿].連細節都很講究的精緻點心[心] // @文茜小妹大 :Sweet,<杜伟冲>: 确切的说，好任性的婚礼～[嘻嘻]// @文茜小妹大 : Sweet,<深白色儿>: 太漂亮 // @文茜小妹大 :Sweet,<菜菜姬>: @yuriko妞   方文山到处拍照片2333,<Sbabyummy忻辰璇熙>: 第四张太甜了～～～～～// @文茜小妹大 :Sweet]
sisyochen	準備飞去參加王子与公主的世紀婚礼，普天同庆[good][good][挤眼][挤眼] ​​​	[<双文双文>: 我的想象里王子眼睛没那么小[喵喵],<Lisha93>: @小九真的要多读书,<哎哟哟Y>: @時光讓我忘记那個夏天,<逆鳞0_0>: 回复 @岑阿豆豆崽 :刚刚看到了,<Elena秋>: @ujkfxh  哇噻,<借風來吹吹>: happy！希望阿信也快点找个小窝吧,<米克裘遇上陈杏红>: @Yang財主   // @文茜小妹大 :周杰倫，Happy Wedding,<永远的红薯饭>: 我会学着放弃你，是因为我太爱你[悲伤][悲伤][悲伤][悲伤][悲伤][悲伤]// @文茜小妹大 :周杰倫，Happy Wedding,<朱雀生南方>: 伦敦，不是巴黎？,<楊楊楊洁爱喝胡辣汤>: 哎～你们都在说他结婚的消息，搞得我都不想上微博了[泪][泪] 陪伴我整个青春期的男人,<爬走虫Lydia>: [喜]// @文茜小妹大 :周杰倫，Happy Wedding,<陈闻异事Jay鹏>: 圆满！ // @文茜小妹大 :周杰倫，Happy Wedding,<僞完待续>: 祝同学的男神新婚快乐[可爱][可爱]]
sisyochen	纽约客下周的封面[伤心] #法国杂志社遇袭# ​​​	[<心又未萌>: 回复 @spring040029 :经典例子“如果我说你妈妈是妓女 而且是拿着高音喇叭大街上喊的” 你作为长子风度比较好 道德高尚 所以你默不作声的忍了当作没听见 但你弟弟是个爆脾气 他掏出刀子杀了人 请问你怎么评价你弟弟？,<spring040029>: 回复 @wish卫士 :你可以憎恨，但用这种憎恨在法律的约束之外伤害他人，就是可恶的，罪有应得的。,<spring040029>: 回复 @叶秋寒 :文明是对自己的约束不是对别人的私刑，尊严是虔诚尊重自己的信仰不是暴力践踏别人的生命。吵吵归吵吵，抄刀就不行。这是进步！,<spring040029>: 回复 @前线广播 :作为中国人看到你说这样的话感觉就是一个字：傻。,<spring040029>: 回复 @叶秋寒 :和着没法律什么事儿，让宗教领袖来统领世界好了,<spring040029>: 回复 @HOMMEMAG :定义所谓“起码”不是那么容易的事情。,<spring040029>: 回复 @每天跑4四圈减掉游泳圈 :事发地在法国，要是他们在自己窝里，绞死个女人什么的，就不会这样了。,<标心者>: 极端分子是全人类的敌人！！,<HOMMEMAG>: 天天攻击别人的信仰，别人武力还击而已，暴力杀人当然不对，但所谓言论自由也要有最起码的尊重！,<七个流露铭>: 自由！自由！唉，自由… // @文茜小妹大 :捍衛一隻筆！,<單為伱涐>: 这个遇袭被很多人扯到了“言论自由”，其实与自由没有半毛钱关系。你天天骂别人的信仰，你自由，别人就有还击的自由，虽然方式偏激了点！很多西方的的媒体喜欢以自由为幌子，却做不到最起码的尊重！犹如今日台湾，很多人打着“民主、自由”的幌子，却连最起码的尊重别人、尊重历史、尊重事实都做不到!,<rtye777>: 笔尖的暴力VS枪口的暴力,<JANE-HSU1959>: 勇气// @文茜小妹大 : 捍衛一隻筆！,<心又未萌>: 回复 @每天跑4四圈减掉游泳圈 :这就是为什么中国是一个文明国家 从古至今都是 因为中国人的人生信条和处世原则是---“己所不欲勿施于人” 这是儒家文明的精髓 也是中华文明的精髓 我们一定要捍卫他 亨廷顿有本书<文明的冲突> 当基督和伊斯兰文明发生冲突的时候 儒家文明是个仲裁的角色 很有意思,<天涯旅人YC>: 纽约客的美编是一位法国人 — Francoise Mouly. 她在悲剧发生后接受了NPR的采访。这是另一篇介绍她的文章。 http://t.cn/RZxRxyv  // @文茜小妹大 :捍衛一隻筆！,<前线广播>: 这些人支持藏独，疆独，台独，希望中国毁灭，用手里的媒体诽谤别人，现在送你上西天是应该的，作为中国人看到这条新闻感觉就是一个字:爽,<前线广播>: 这件事很好发生在法国很好，一支笔胡写，付出代价是应该的，911后，美国的媒体学乖了，欧洲的媒体如果没有规矩，不吃猪肉的人请继续，做点更大的。,<乌尔禾很好>: 西方所谓的言论自由普世价值不代表穆斯林的普世价值，你有信仰，为什么要一再的侮辱讽刺别人的信仰呢？正好通过这个事件，西方甚至包括我们所有人，要反思所谓言论自由有没有一个界限？要不要漫无边际的开玩笑？,<嘻哈是只小LM>: 言论自由的基础是客观平等和互相尊重！同样一件事如果发生在中国，我想杂志封面应该会是达L，热比Y！,<扎西得勒c>: 信仰与一支笔的较量,<行者5467984926>: 河南长葛威武路有689亩土地需要开发。手续齐全。地理位置优越。距离新郑国际机场25公里，京珠高速出口500米，许昌高铁车站25公里。欢迎来开发建设。,<禅悟心自静>: 捍卫信仰不容侵犯与捍卫一只笔的对决，好看了。[围观],<小白壹只>: 国内公知对此事反应比较矛盾，讨论言论自由呢还是讨论信仰自由？貌似都不太能够大肆发挥啊？唉，这次的人血馒头放过了，下次再吃吧,<断夹>: 嘴炮无敌？很有民主思维！这逼装的真好！,<心又未萌>: 言论自由难道是没有限度的么？你的自由伤害了别人 这种自由也要被捍卫么？？如果所有的自由都被捍卫 世界将没有自由和尊严 你侮辱先知 我侮辱上帝 人类有了自由但没了文明 这是进步还是回归原始,<辉煌的光辉>: 恐怖本身就是不容人！// @文茜小妹大 :捍衛一隻筆！,<joycek007>: [给力]// @文茜小妹大 : 捍衛一隻筆！,<18green>: 要真是只有一支笔，还真挺壮烈。轰炸利比亚的时候不是挺牛逼嘛。炸弹是你的，骂人的笔杆子也是你的，便宜不能都占了。,<不沉默的大多数>: 夸耀作用的时候 就说：我一支笔胜过千军万马；需要博取同情的时候 就说：我手无寸铁 只有一支笔。这个逻辑如何自洽呢？ // @文茜小妹大 :捍衛一隻筆！,<老独行侠>: 谴责恐怖暴力。可是西方媒体一直站在文明高度讽刺挖苦贬低，事实上也只是五十步笑百步,<D_Mos>: 回复 @wish卫士 : 是的。我也觉得此事件要两看。报复者的武器是枪，杀人；杂志社的武器是笔，毁人。。孰轻孰重？谁是谁非？真不好说！.... NOZUONODIE,<爬爬羊>: 言论自由是不是应该以尊重其他民族的信仰为前提？否则一支笔也是一把枪，这种软暴力是不是就真的比强暴力更加文明？,<wish卫士>: @不沉默的大多数 : 讽刺一切的虚无主义是自由吗？别的不说 迈克杰克逊死后，封面画一个跳舞的白骨，标题为：迈克杰克逊 终于是白色了。这太过分，不但触及肤色种族问题，对逝者和生命也毫无尊重。极端暴力犯罪须谴责，但发生这样的杯具，法国社会文化同样该反思，而不是借同情来贩卖那种失败的价值观。]
