sisyochen	他說：" 你會找到一個比我好的人。" 你微笑著說：" 但我再也不會對一個人這麼好了。" ​​​	[<胖大海艾玛>: 也许未来你会找到懂你疼你更好的人，下段旅程你一定要更幸福丰盛~// @文茜小妹大 : 接著妳又說：「但從此我懂得對自己更好了。」,<陳陳陳月Xi>: // @文茜小妹大 :接著妳又說：「但從此我懂得對自己更好了。」,<儀銘_me>: 你好，我好，大家好。相見不如懷念。感情受創傷，就好比植物受傷了，長出來的新葉，防禦性更加堅強。,<smallmatches>: 接着他想要说什么.只是这风，太冷了。他想起一条围巾...,<Florence的花花世界>: 与其找个更爱自己的人， 更重要的是好好爱自己:)// @文茜小妹大 : 接著妳又說：「但從此我懂得對自己更好了。」,<關山墨然>: ....后来你笑着对他说:你会找到比我更适合你的...[挖鼻屎],<梦露on>: 懂得爱自己才更加辽阔---刘若英歌曲＜幸福就是＞,<本宫不退位爾等皆為嬪>: [good]// @文茜小妹大 : 接著妳又說：「但從此我懂得對自己更好了。」,<830605屌饲的李毅bitch>: [好棒] // @文茜小妹大 :接著妳又說：「但從此我懂得對自己更好了。」,<喜乐小五>: [赞] // @文茜小妹大 :接著妳又說：「但從此我懂得對自己更好了。」,<HollywoodView>: ~~何必活得如此矫情?! 人生最难: 拿得起, 放得下..........,<pigpig疏影>: // @文茜小妹大 :接著妳又說：「但從此我懂得對自己更好了。」,<ImmerQi艾易思>: // @文茜小妹大 : 接著妳又說：「但從此我懂得對自己更好了。」,<喵小閑>: 会对你说：“你会找到一个比我更好的人。”的人，让他哪凉快凉快去.....,<道妙晴合>: 接得太好了。// @文茜小妹大 :接著妳又說：「但從此我懂得對自己更好了。」,<Jax灵魂伴侣iRene>: 好！！！// @文茜小妹大 :接著妳又說：「但從此我懂得對自己更好了。」,<台北流浪人>: 其實找到一個自己很想去對他/她好的人，是一件很幸福的事。但更重要閃要適當的愛自己。,<青葱红唇>: 言情作家跟女汉子的区别[嘻嘻],<此刻内心是崩溃的啊啊啊啊>: 回复 @流秋半岛 :[偷笑]预言创造现实,<光一Hikaru>: 心裡想:當遇到下一個對象,千萬不要做上一個對你做的// @文茜小妹大 :接著妳又說：「但從此我懂得對自己更好了。」,<没有昵称的小屋>: 爱自己才能更好的爱别人,<夏旭宏>: 1118love@*forever// @文茜小妹大 : 接著妳又說：「但從此我懂得對自己更好了。」,<賴懶皮>: @奶油罐子guo,<流秋半岛>: 这就是张小娴和陈文茜的区别。赞陈文茜。// @文茜小妹大 : 接著妳又說：「但從此我懂得對自己更好了。」,<超然悠悠>: 爱自己没错。懂得爱自己是本能~~容易，懂得爱别人却是种修为的能力~~不是每个人能做到的。,<7-11娘>: 我想说，从很久之前开始到以后的几十年，我会对自己更好！// @文茜小妹大 : 接著妳又說：「但從此我懂得對自己更好了。」,<红红白白奶油蛋糕>: 然后他说：那是你的事，意思意思你还当我真关心了。只要你别再对我好，就一切都好 // @文茜小妹大 :接著妳又說：「但從此我懂得對自己更好了。」,<Ahaamber>: 回复 @刘刘刘pupu :[害羞],<常定居士钟怀京6>: @哈囉李敖  请你用胡适的自由主义，提高满鞑子勇气，喊扯着满洲音，生命不息，不言歇逼，民主斗士，战斗不已！本居士希望你拿起笔做刀枪，拼出最后的疯狂！不要死得灰头垢脸，壮烈一点点……快去叫刘长乐凤凰卫视来帮你丫挺！,<YAMEAILY>: 回复 @北京的秋秋秋 :不要这样对我,<Ahaamber>:   @刘刘刘pupu,<Lively_Ss>: 那新的他多吃亏？,<阿思777>: [泪][泪][泪]// @文茜小妹大 : 接著妳又說：「但從此我懂得對自己更好了。」,<博士未毕业>: 嗯！// @文茜小妹大 : 接著妳又說：「但從此我懂得對自己更好了。」,<bami瑞雪>: 不是不涉足爱情了吗。。,<曾臻有铁骨>: 他松了口气，给你看了墨迹方干的遗嘱。,<小码农唱不出canon>: 幸福，如果不在路上，就在路的尽头。 // @文茜小妹大 :接著妳又說：「但從此我懂得對自己更好了。」,<瑤愷>: 說的真好[悲伤]// @文茜小妹大 :接著妳又說：「但從此我懂得對自己更好了。」,<恩宠难回-_938>: 想让讨厌的痘痘黑头消失掉看 @Jerry小店   隔天见效。~！[可爱][微笑],<晶头>: 爱自己！！！// @文茜小妹大 : 接著妳又說：「但從此我懂得對自己更好了。」,<MilSunny>: 或是，，，更狠 // @文茜小妹大 :接著妳又說：「但從此我懂得對自己更好了。」,<Irene-毅鸿工作室>: 只是还没到下一站，说点好听话罢了，而对方要看过多少风景才知道连说那样的话也需要心情的[挖鼻屎][嘻嘻]， #好# 要么太自恋，要么太武断[偷笑]// @文茜小妹大 :接著妳又說：「但從此我懂得對自己更好了。」,<春三吉全球后援会>: 心疼… // @文茜小妹大 :接著妳又說：「但從此我懂得對自己更好了。」,<颠笑凡尘>: 最后说男人没有一个好东西[挖鼻屎],<一天都光>: 环节出错，战争来了！,<福州爱我>: 他說：" 你會找到一個比我好的人。"= 不想再骗你了！ " 但我再也不會對一個人這麼好了。"=只让你一个人骗！其他人不会了！额！很现实的事情，总是修饰的这么“唯美”和理所当然·······,<忠心散户>: 接着他说：你终于成熟了。。。,<Giovanna-Chen諶某某>:  [赞][赞][赞][赞][赞] // @文茜小妹大 :接著妳又說：「但從此我懂得對自己更好了。」,<卯卯七O_o>: 寻找自我的美妙旅程[鲜花] // @文茜小妹大 : 接著妳又說：「但從此我懂得對自己更好了。」,<大海1968>: 都是自私自恋的人[嘻嘻]]
sisyochen	我和@张欣 一起招待朋友@文茜小妹大 。 ​​​	[<媛媛暖暖66>: 能被文茜佩服，定不簡單！,<這裡是吉公館>: 都厲害，不容易！[good],<范统09>: 惺惺相惜还是互相吹捧[吃惊],<_假装是哑巴>: 两个bitch互相吹喇叭（台湾人这样看大陆）,<L猪猪>: 你们倆也太會互捧了！雖然很欣赏你,<ZZ__XD>: 我觉得您没必要加＂最＂字,<咪猜小猜不猜>: #angelababy#  [坏笑]☆不[yz投降]'错的东东哦[乐和]  http://weibo.com/3755031831/AiEEloBmM,<多拉蒂>: 你就相互吹捧吧！无聊的很，有意思吗？,<尼康D60>: 互吹吗，文茜姐？,<谷中清泉花园>: 成功女人的过人之处在于，不害羞。哪怕互相把话说成这样，也决不脸红。,<二兵和奇异小牛>: 人不要太庸俗好不好，大姐！,<Snowolf911>: 这是双簧吗。。。,<sunrise我喜歡fish>: 哈哈，你两个，不过确实都是聪明绝顶的人。,<zurich09>: 回复 @天天天进步 :兩水桶腰半桶水碰出聲而已。,<THEBOYWHODOESNTEATEGG>: 明天的世界周报会有吗？,<天天天进步>: 这就像两个女人嘴上互夸对方衣服漂亮，其实心里才不是那么想的！// @文茜小妹大 :張欣是我在中國大陸碰到最直率，果決，聰明的女人。她的溫柔在心理，她的正直在骨子裡，她的魄力改變了她的一生。佩服 // @张欣 :文茜真是我心中的才女，思维敏捷、视角广阔。昨晚听她讲台湾历史，讲台湾的人物，精彩、精彩,<肠香肉腊>: 身材让人不忍多看！,<雨季不再来-echo>: 有相互吹捧的感觉。对 @张欣  无好感，一个虚伪的女人,<白云碧空>: 呵呵，拍的不错。,<Summer-gakki>: 张在美国节目里接受采访时说：中国人民不在乎房子车子，在乎的是民主。,<福州爱我>: 好像·····張欣旗下的SOHO正在向李嘉诚看齐，卖上海资产转移到欧洲················,<kimu>: 互相……未免太明显了吧,<无常1911_892>: 两个老女人互相吹捧，真是肉麻啊！,<刘文亮2888>: 成功之人必有过人之处,<妈妈爸爸和宝宝>: 第一直觉是，发生什么了，文茜兄也这么说话的,<ab168888>: 你越来越过分了，作为新闻人应该有自己独立的立场，与喝人民血汗的官商勾结的房地产商人为友还这么高调宣扬，你的骨头还有么？看看李敖，断然拒绝了大陆地产商赠与的100万美元，这才是骨气！,<萌小兔兔小萌>: 潘潘可以和柳传志强强联合，一个种水果一个卖果汁，哦耶！！！[威武],<VanceCai>: 一个出上联，一个出下联，坐等潘石屹出横批,<行走于苍茫大地>: 取消关注！// @文茜小妹大 : 張欣是我在中國大陸碰到最直率，果決，聰明的女人。她的溫柔在心理，她的正直在骨子裡，她的魄力改變了她的一生。佩服 // @张欣 :文茜真是我心中的才女，思维敏捷、视角广阔。昨晚听她讲台湾历史，讲台湾的人物，精彩、精彩，我像好奇的孩子一样，一直问：然后呢？后来呢？,<NL玉衡>: 确定是真的文茜哈 不是许杰辉扮演的吧,<0301jw>: 相互吹捧，其乐融融……,<设计废>: 炸果汁哈哈 // @文茜小妹大 :張欣是我在中國大陸碰到最直率，果決，聰明的女人。她的溫柔在心理，她的正直在骨子裡，她的魄力改變了她的一生。佩服 // @张欣 :文茜真是我心中的才女，思维敏捷、视角广阔。昨晚听她讲台湾历史，讲台湾的人物，精彩、精彩，我像好奇的孩子一样，一直问：然后呢？后来呢？,<fredzeng>: 把潘潘换掉吧，反正潘潘有任志强,<TJW-24>: 茜姐，，这期节目星期天播吗?,<笑雨酱>: 潘总又榨果汁招待客人没，看样吃了甜的,<shikiko>: 商人就没一个正直的，而且还是搞房产的，过份的互相吹捧，反而虚伪，文茜也不过如此,<江鱼007>: 互夸 // @文茜小妹大 :張欣是我在中國大陸碰到最直率，果決，聰明的女人。她的溫柔在心理，她的正直在骨子裡，她的魄力改變了她的一生。佩服 // @张欣 :文茜真是我心中的才女，思维敏捷、视角广阔。昨晚听她讲台湾历史，讲台湾的人物，精彩、精彩，我像好奇的孩子一样，一直问：然后呢？后来呢？,<吴越青年Luke>: 英雄见到了英雄[哈哈]// @文茜 :張欣是我在中國大陸碰到最直率，果決，聰明的女人。她的溫柔在心理，她的正直在骨子裡，她的魄力改變了她的一生。佩服 // @张欣 :文茜真是我心中的才女，思维敏捷、视角广阔。昨晚听她讲台湾历史，讲台湾的人物，精彩、精彩，我像好奇的孩子一样，一直问：然后呢？后来呢？,<刘翔宇jessica>: 你们的对谈一定很有趣，要是个公开采访就好了,<coffeeorteaorme>: 回复 @leah-only :me too,<源函数>: 。。。。。。。。。,<应供的世界>: 好想吐啊！！！[吐],<难忘初心X_X>: 是啊  太明显了,<赏阅而悦>: 精确诠释了中国互相吹捧文化 // @文茜小妹大 :張欣是我在中國大陸碰到最直率，果決，聰明的女人。她的溫柔在心理，她的正直在骨子裡，她的魄力改變了她的一生。佩服 // @张欣 :文茜真是我心中的才女，思维敏捷、视角广阔。昨晚听她讲台湾历史，讲台湾的人物，精彩、精彩，我像好奇的孩子一样，一直问：,<Capella_林>: 文茜 你是优雅女王[哈哈],<假装去日本>: 都是女强人，才女。,<暧郗>: 红配绿 颜色交换一下就更完美了,<恶趣味Ta还挺高兴淣>: 文茜姐别学这个作风[泪],<猥琐要坦荡>: 女人说相声少见// @文茜小妹大 :張欣是我在中國大陸碰到最直率，果決，聰明的女人。她的溫柔在心理，她的正直在骨子裡，她的魄力改變了她的一生。佩服 // @张欣 :文茜真是我心中的才女，思维敏捷、视角广阔。昨晚听她讲台湾历史，讲台湾的人物，精彩、精彩，我像好奇的孩子一样，一直问：然后呢？后来呢？,<憨生皮爸>: 互捧，说明关系一般。,<won-way>: 女人终究还是女人……,<leah-only>: 突然觉得，这两个都不想关注了,<手链儿>: 红帽绿裙太没品味了,<TianHanwr>: 这就是所谓的女人何苦为难女人[哈哈]]
sisyochen	我和@张欣 一起招待朋友@文茜小妹大 。 ​​​	[<DayeQ>: 喜欢穿什么就穿什么，为什么有些人连这个都要judge,<4月17日卖身>: 总是发自内心的尊敬养生的人，尊重生命的人他不会做出伤害别人生命的事情~,<大头娶小猪>: 文茜姐要好好休息啊，身体垮了千金难买~,<hpz6621>: 希望你要爱惜自己身体，多保重。因为你的才华不可多得，你的节目太喜欢看了，再次请珍惜健康！,<mooncyyyyy>: 我觉得这样的搭配方法很不错诶！！颜色配比都是棒棒的！而且能保护身体何乐而不为呢！[亲亲]午安，文茜老师。,<阿蒙smart>: 文茜姐要好好休息啊,<韓道光>: Nice hat!,<光头强的姐姐>: 文茜姐永远都那么耀眼，漂亮，我以后能做到你的一半就非常满意了,<我有年龄包袱>: 这些都需解释，哎。。,<花开晨早>: 还是那么有气质[鼓掌],<grace_any>: 绿色只有大红才配的上，别的颜色只能是黯淡无光[good],<子衿清->: 好好保护身体！[心],<时越松子>: 文茜穿衣服好有品味，有气质！颜色搭配很有视觉冲击力。帽子好可爱*^o^*,<宥-->: 身體健康比較重要，這一身裙裝很漂亮,<Jocolate小胖子>: 我觉得裙子超美的，但是张欣应该学学，不要总是一身黑，偶尔彩色也能端庄大气  让人眼前一亮,<成粒灰>: 文茜姊保重，多喝潘果汁,<长棍面包抹芝士>: 最后一张好逗，验毒呢吧？哈哈哈,<心境沉思>: 多练练瑜伽吧老师,<鼓浪小品>: 跟以前比，瘦身成功了[呵呵],<王小p和尹小瑞>: 很漂亮啊，因为看到这套衣服颜色才打开大图细看呢！多美吖,<占山为鹿>: take care.,<李某某0915>: 我也觉得很好看呢[威武][威武][鼓掌][鼓掌][鼓掌],<big_light>: 我倒觉得挺好看的，挺精神！,<铜陵郑SIR>: 这样一解释就可以接受了。祝早日安康,<蔷薇泡眠>: 很喜欢你，那么智慧，又美丽,<yayadove>: 干嘛老评判人家的衣着，就算穿的不搭又怎么样，需要给所有人做一个解释吗？个人自由好吗！何况是生病了，已经很坚持了！手下留情吧,<梦想改变世界1>: 傻妞[爱你][爱你][爱你][爱你][爱你],<葡萄园的小花匠>: 为你向上帝祈祷。,<采银坊>: 红配绿，赛狗屁，讽刺土豪吗？,<无尘3260168251>: 身体是自己的，别人代替不了，自己保养好身体。每天用温水泡脚至头部出汗后可去风寒邪气。,<攏總這樣>: 好好保重身體，其他都不是那麼重要!!,<shining_theodore>: 哪里穿的奇怪？没觉得。,<吉娃娃况>: 自己舒服就好，无需解释,<时间里的老剧虫>: 现在身材很丰满啊，有人郁闷了 // @文茜小妹大 :因為我今年生了五個月的病，頭疼眼酸，Soho銀河光線太亮，空調風對我太大了。不過是個對病體的保護。 // @黛安-Diane :她的绿色裙子不是挺好的，为什么要戴这种莫明其妙的帽子和眼镜？能不能也请她解读一下？,<這裡是吉公館>: [太开心]紅配綠，對比，挺好地的！,<oldsinajoe>: 請勸勸趙少康選台北市長,比連勝文前景更好,因為趙有彭博的氣質,連將來之問題會不少。,<20-21>: 反映出来穿者的个性吧，面对冲突，挑战冲突。深色的Tiffany Green，让这个红不冲突，又不简单的协调，视觉上反倒有趣。// @文茜小妹大 : 因為我今年生了五個月的病，......。不過是個對病體的保護。 // @黛安-Diane :她的绿色裙子不是挺好的，为什么要戴这种莫明其妙的帽子和眼镜？能不能也请她解读一下？,<yang--JP>: [咖啡][咖啡][咖啡],<神经浪游者>: // @文茜小妹大 :因為我今年生了五個月的病，頭疼眼酸，Soho銀河光線太亮，空調風對我太大了。不過是個對病體的保護。 // @黛安-Diane :她的绿色裙子不是挺好的，为什么要戴这种莫明其妙的帽子和眼镜？能不能也请她解读一下？,<lavender_wawa>: 看中醫調整一下體質，西藥太利什麼都殺,<llss87>: 喜欢你主持的风格,<ANGELINASS7>: 有智慧的女人最美麗~,<海水正男123>: 可是红配绿额！汗// @文茜小妹大 : 因為我今年生了五個月的病，頭疼眼酸，Soho銀河光線太亮，空調風對我太大了。不過是個對病體的保護。 // @黛安-Diane :她的绿色裙子不是挺好的，为什么要戴这种莫明其妙的帽子和眼镜？能不能也请她解读一下？,<Sabrina纽约異想世界>: feel better now?,<暱稱很難射Nina>: 我很喜歡文茜姐姐的穿著，充滿朝氣與希望，對比色能平衡是最美的,我也喜好這麼穿[愛你] @文茜小妹大,<伪球迷也是球迷0014>: 一个才女想成为美女，一个美女想成为才女[偷笑],<深圳博一客>: 呵呵！国人不习惯戴帽。回想以前才女的解读：她们看见你戴帽子，都吓死了。,<大萌是个韶丫头>: 身体最重要哦~~[爱你],<春暖花开夏未央>: 文茜姐，身体重要[爱你],<__dear__>: 我觉得你穿这样挺好看，看谁穿效果不一样,<杜小兔笔记>: 我觉得文茜姐这么搭配很美。,<爱思考的雨滴>: 但凡大病痊愈或大难不死的人,都应懂得感恩,感激上苍的好生之恩.我们佛弟子会感佛恩、菩萨恩、天恩、众生恩、国恩；基督徒也会感上帝恩。不知文茜女士经历大病一场，对人生是否有新的感悟？,<一U84>: 这边较凉的啊，要多注意身体[赞],<陳柏亦_>: 文茜姐好像眼睛一直不太好，一直戴眼鏡的。]
sisyochen	是你的演技太差？還是我看穿的太早？ ​​​	[<YHD-ZS>: 是你敷衍？还是我看花了眼？,<文茜小妹大>: 回复 @令東Jay :記得。今年農曆年來地早，取消了紐約行。,<心平气和766>:   @文茜小妹大  即使演技在好，岂能蒙敝大姐大的一双慧眼？！！,<隆隆陸陸>: 我第一遍看对了，第二遍成穿太少[晕],<Amoy-YAO>: 当然是文茜妹妹看穿的早！你这冰雪聪明的女子,<lucky_girl12>: 太聪明了吧！[good],<颜杰>: 老眼昏花，看成：是你的演技太差？還是你穿的太少？,<Pro-Alpha>: 哎！太聪明的女人就是这样！男人装点，吹点，最好别戳穿！不然11.11永远有你！感情本来就是按照感性来发展的，,<什伐赤>: 故意演太差就是想你早点看穿,<davis-at-sea>: 早安，准备今天飞北京么,<肿肿的山猫>: 是我不敢直言告白，选择故意要你看穿,<令東Jay>: 什麼時候紐約見'''還記得food delivery嗎？[哈哈],<李帛修的文艺生活>: 其實我真的看不懂？？？,<不想失忆的鱼>: 因为演技差所以早看穿。,<_陈yue珍>: 乖，开心点，早安[爱你],<文茜小妹大>: 回复 @瑤愷 :早安。,<来唱小情歌儿>: 姐姐心情不好啊。,<SonneSH>: 是插电的那种吗？为什么不买用蜡烛的那种？靠空气对流是上面的风车旋转，可惜了。这个在晴天的时候是男孩出来，还是女孩出来？,<疯一样的Lion>: 是你太聪明、而那人太自作聪明！,<欣求3>: 你也没演；我也没看。干脆啦、清净了。[嘻嘻],<瑤愷>: 那麼早起床 @文茜小妹大  早上愉快]
sisyochen	生命必须有裂缝，阳光才能照的进来。 ​​​	[<爱情公寓大理客栈>: 好美滴风景~ [爱你] @爱情公寓大理客栈  // @文茜小妹大 :转发微博,<不朽rene>: // @文茜小妹大 :转发微博,<李总总之舟>: [思考]是云动。。还是人动啊。。// @文茜小妹大 : 转发微博,<HotterWang>: 再反馈节目错误：维吾尔族不是回民。说是种族仇恨，对全体中国人没什么好处。,<风中荷>: // @文茜小妹大 : 转发微博,<秩序与文明>: // @文茜小妹大 : 转发微博,<莆田SEO-老三>: #白冰#  独家提供，包[dino咬手帕]⑨你[赞啊]↓满意，快来我的微博看看吧！[冒个泡],<树仔同学>: 生命有裂缝，阳光才能照得进来。嗯[爱你]// @文茜小妹大 : 转发微博,<朱艳秋V>: 回复 @-阳琼- :哈哈，没有，我是之前看陈文茜和奶茶对话的时候听到的，觉得这话说的真好,<橙色沙砾>: // @文茜小妹大 :转发微博,<为成为一片尿不湿而奋斗>: 阳光明媚，我们每天都该积极向上！ @在路上波加曼1983   @不可能怎么会这样,<螢圃里18鄰>: [鼓掌][鼓掌][鼓掌],<育林叟>: 颇有意境、唯美的摄影画面！// @文茜小妹大 : 转发微博,<森淞>: 陈立宏的帮中国人节育言论您怎么看，难道这也是台湾人情味吗？,<贝琪爱宪>: [呵呵]// @文茜小妹大 :转发微博,<优可丽丽>: // @文茜小妹大 :转发微博,<gh5fc584gb>: 这样的缝隙还是太大了// @文茜小妹大 :转发微博,<o西瓜君爱夏天o>: 蘇打綠的歌詞一般很有feel~ [哈哈]// @文茜小妹大 :转发微博,<艾丽塔沙>: // @文茜小妹大 : 转发微博,<生如夏花-榕>: 曾一时间脑子里充斥各种词儿：失望、丢脸、生气、怒斥。。。最终我选择了鼓励,<一天都光>: 裂缝需有隔膜保護，才不至於被陽光灼傷！[偷笑],<芒-Mango>: 你前两天在facebook上写的那篇文章让人觉得很失望。,<我是小諾拉>: 生命必须有裂缝，阳光才能照的进来。[good],<朱艳秋V>: 突然想到，人生就像茶叶蛋，要有裂缝，才能入味,<小曼Cassie>: Morning ～// @文茜小妹大 :转发微博,<一天000>: 连着四个周末加班，终于熬到周五，感觉就是拨开云雾看日出啊。想到可以休息了，瞬间满满正能量。[嘻嘻],<藕花深处听笛声>: // @文茜小妹大 :转发微博,<中乐妈>: [威武] // @文茜小妹大 :转发微博,<逆袭生童小言>: 文茜姐，我想问一下，台湾政治大学MBA和台湾清华大学MBA哪个比较好?我目前正在选择。期待你给我建议。,<妖精之宝LIN>: 我一直莫名爱日出。那是一种无敌的温暖。博大的爱。,<昧青>: // @文茜小妹大 :转发微博,<小花卷爱喝咖啡>: 生命必须有裂缝，阳光才能照的进来。,<员外_>: 搞语录，茜儿你不行[哈哈],<超然悠悠>: // @文茜小妹大 :转发微博,<EQHK>: 生命必须有裂缝，阳光才能照的进来。[转发],<莫名子2011>:  // @文茜小妹大 :转发微博,<Dancing-Cinderella>: // @文茜小妹大 : 转发微博]
sisyochen	旅行的終點，不是結束，而是回憶。富春山居 ​​​	[<Joanne-ZhuY>: 几年前的春节去过一趟，天气始终阴阴湿湿的，所有的一切都笼罩在雾气里，美得有点不真实，寒冷的清晨泡在Jacuzzi中，感受着沁入心扉的萧瑟，有点茫然。空,<Angelia_B_>: [good] ＂旅行的終點，不是結束，而是回憶＂！生命就是靠一点一滴美好的回忆支撑起来的！,<文茜小妹大>: 回复 @urameshi :好主意，在北京？,<宁茶茶>: 一折青山一扇屏，一湾清水一条琴。无声诗兴有声画，须在……,<滚石的咖啡>: 当回忆终结了，所有的就回到了原点！,<路过人世>: 回复 @luck灵灵8 :杭州富阳,<龙子-龙孙>: 就是，过往总在回忆里中招手，盼你再来。,<小清晨兴娜>: 在杭州，我也去过,<Remember_1006F>: 人生終其一生，心靈始終漂流著、哪兒是心靈的歸宿、那兒就是家鄉。,<Lea_69>: 呀，前阵子才去过这酒店呢。,<手机用户2549389037>: 什么地方啊?富阳?西溪?,<weichen1991幸福>: 旅行是一種美的境界。缺乏了美，就不是旅行，只能叫做＂出門＂......,<gaiyi96d94512>: 美丽悠闲的回忆，惬意,<古董恐龍>: 好美... 好想好想受薫陶一下,<赤子之惺>: 陈老师应该来看看太湖，拜拜灵山大佛，曹禺说：＂无锡是个好地方＂！[哈哈][哈哈],<GenGenGentle>: 人生旅途亦是如此,<因为只是我>: 旅行期间除了欣赏风景，一般会做什么呢？我们都只是拍照，急着照风景照自己，却似乎忘记了旅行的目的。,<ronson1102>: 好美 还有柚子。。,<urameshi>: 希望文茜能在大陆搞一次纽约那样的网友聚会,<初见梧桐9>: 人生終其一生，心靈始終漂流著、哪兒是心靈的歸宿、那兒就是家鄉。,<文茜小妹大>: 回复 @朱执勇 :富陽,<加菲龙儿>: 最后一张是360度无死角拍摄的 iphone手机,<胡立峰>: 好地方，杭州是个好地方！,<一意孤行YYGX>: 好美的景色！[good]在哪里呢？[疑问],<阿菜贝瑞塔>: [爱你]意境很美，和妳很相配哦 (>^ω^<),<Gabrielle_shining>: 美丽悠闲的回忆，惬意,<超然悠悠>: 美。百年驿站里有一篇详解富春山居。[耶],<孤舟独寒江>: 终点也是新的起点,<朱执勇>: 什么地方啊?富阳?西溪?,<鉴_AliceKing>: 哇哦，我老家[嘻嘻],<少铝>: 图片总是拍的那么美！,<蛋定的蛋蛋哥>: 还真有这个地方啊....]
