xinjunzhi	改名字了，以前我叫烂段王。 ​​​	[<小文子Vc>: 回复 @杨小妞儿倔了个强 :警察还有五秒到达战场,<哆啦哆啦哆啦哈哈哈哈>: 实物与图片不符，取关！！！,<机智勇敢包子哥>: 朝阳一枝花 我本人,<罗正直->: 回复 @杨小妞儿倔了个强 :红红火火恍恍惚惚,<孤独浪子苏乞儿>: 我就服你这种连自己都骗的人,<酒仙桥第一帅>: 回复 @Ace浅遣 :嗯嗯，开心最重要，不要感到为难。,<Ace浅遣>: [喵喵][喵喵][喵喵]突然不想关注你了,<伱的眼睛有星星->: 马上不一样了[骷髏],<-ElaineElyn>: 这头像？你是我老公吗[抱抱],<海是地上的蓝>: 你可拉倒吧[挖鼻],<msjsjsnbshs->: 好哦 我知道啦～,<小萌叶Hazel>: 哈哈哈哈可你还是没帅过望京四少,<董小姐哟>: 差点取关我的烂烂[二哈],<等一个发芽>: 名字太假，取关[拜拜],<跟你说正经事呢>: 这。。。  http://t.cn/RKA4QsG,<初见的意中人>: 回复 @酒仙桥第一帅 :达成共识[并不简单],<酒仙桥第一帅>: 回复 @初见的意中人 :你我们是同道中人了,<酒仙桥第一帅>: 回复 @-邢子昊- :图片评论  http://t.cn/RKAy9PF,<酒仙桥第一帅>: 回复 @杨小妞儿倔了个强 :跟党走，我不怕。,<初见的意中人>: 我十里堡第一帅[doge],<酒仙桥第一帅>: 回复 @斗图小妹 :图片评论  http://t.cn/RKA2ngD,<酒仙桥第一帅>: 回复 @-ZAni :别调皮，还会好好爱你。,<酒仙桥第一帅>: 回复 @鸭鸭累了 :可以骗你一辈子嘛,<-ZAni>: 哈哈哈好的烂段王  http://t.cn/RKA2cto,<酒仙桥第一帅>: 回复 @集英社幕后社主 :谢谢你们一直不取关。,<阀束>: 还不如叫烂段[二哈][二哈],<集英社幕后社主>: 你还是改回烂段王吧[并不简单]怕一不小心取关[并不简单],<杨小妞儿倔了个强>: 您好，您的ID已经构成了欺诈罪，稍后相关法务人员会和您联系。,<范围>: 哈哈哈哈，第一帅的段]
xinjunzhi	洗澡去了，希望回来有三个人说喜欢我，给我点生活的信心。 ​​​	[<刘矫情_会发光>: 已经有三个了，那我不说了,<-Sodon>: 喜欢你[爱心]️,<捕捉王凯迷妹一只>: 喜欢你……………………才怪🤓,<不出名的小号>: 我叫三个人 喜欢你]
xinjunzhi	祝你生日快乐 ​​​	[<著举>: 生日快乐老铁[干杯],<YINGZHENXIA>: 生日快乐[蛋糕],<翁崇杰>: 咦 你不是天蝎座吗,<_天上的星星眨呀眨>: @烂段王  过生日的人最美，撒浪嘿～  http://t.cn/RI9ePHL,<安丶然_>: @烂段王  过生日的人最美，撒浪嘿～  http://t.cn/Rc1WDAQ,<小萌叶Hazel>: 生日快乐！我的烂～,<月半壹>: [祈祷][祈祷][祈祷][祈祷][祈祷][祈祷][祈祷][祈祷][親親],<新长征路上的一颗手榴弹>: 生日快乐小情人[心],<关爱脑残>: 生日快乐，长命百岁给你+1s,<一一_一一>: 生日快乐～[喵喵],<cherryb512->: 烂烂烂…生日快乐[蛋糕][礼物],<XIATINGTING->: 生日快乐 烂烂 祝福你一切越来越好 早安,<只爱面包不谈情>: 生日快乐[礼花],<减减减减肥呀>: 你和我生日同一天啊 生日快乐,<你脑壳可是斜坡>: 生日快乐  烂烂,<张能睡别闹>: 你和迪丽热巴一天生日,<无所事事晃来晃去的酱油君啊>: @烂段王  蜡烛已点好，生日歌已响起，寿星快许愿吧~  http://t.cn/RI9ePHL,<文静wen文静>: 烂烂生日快乐噢[兔子],<Dan_涙er>: 我身份证上的生日,<闭着眼都上白金>: 生日快乐[鼓掌]🏻,<我的名字叫阿尿>: 过气网红 生日快乐,<DeElfen>: 生日快乐呦[心],<嗷呜呜喵>: 那生日快乐[求关注]]
xinjunzhi	你在干吗 ​​​	[<酒仙桥第一帅>: 回复 @孬孬孬a :是的，但是不能放弃[doge],<阿斯顿三炮>: 卧槽，你是男孩子,<锦鲤祈福>: 回复 @你好今天是 :泥够啦,<酒仙桥第一帅>: 回复 @锦鲤祈福 :抱铁了，老拳]
xinjunzhi	想跟老板抗衡的我 ​​​	[<黄耆英>: @薛定谔的Gwen,<一头在路上的羊>: 回复 @知知知知知知吱- :[doge] 很形象,<毛衣君>: 大炮台一下就geng掉,<不靠谱的花小姐>: @张展展是我   哈哈哈哈,<知知知知知知吱->: @一头在路上的羊,<请输入玩家姓名>: @eirechan,<回音音音_>: 回复 @可是它离我好远啊 :前老板[微笑],<豆芽芽df>: @WwwwCt   @给饱饱爱的摸摸扎   @H-X轩,<Yul_i>: @阿骞Querida,<笑眼乀>: @浮华cccccc,<可是它离我好远啊>: 土炮是你，小兵是你老板！[笑cry] @回音音音_,<Mimomoonx>: @Jennifer是Oliver,<废柴说>: 恍恍惚惚哈哈哈哈红红火火 @你丫太Aby啦,<一只仙人球猪->: 可是老板只剩最后一滴血的时候你确实能打死他[摊手],<饰马头>: 回复 @男妹妹妹 :没错是这样的,<刺客梦想孙尚香>: @-哩狸  惹不起惹不起,<靐克雅未克>: @_皮卡皮卡皮卡丘kiss   [二哈][二哈],<z张蕴涵>: @YNJ是嘉宝宝啊    @Xxxyoyozzz   哈哈哈哈,<钢铁是怎样炼成荆的>: 是时候来一发炸裂的开场了[来],<这么可爱的老安哪里找>: @S3JXY  溜了溜了,<Elehcmi>: @ruruqiu,<一打哈尔滨>: @ZHAOMANXUE,<这两头狗熊又在干嘛>: @小兰cll   @EXO一Melody,<倔强青铜鸭>: @_hhhhhlz,<想一天一个新昵称>: 前者，我，后者，你 @sir英俊,<En-soap>: 回复 @Sense的世界屋脊 :哦,<城郭不洗碗>: 图片评论  http://t.cn/Raf7IE9,<_软软倩livwlyn>: @coral胡萝卜,<Xback兔子>: 哈哈哈哈哈哈哈哈,<佩恩hjm->: 社会你黄忠 @红姜妹,<Sense的世界屋脊>: @En-soap,<_陶格斯_>: @不着调唱反调__  哈哈哈哈哈哈哈,<weirdoww>: @君莫醉_杯莫停,<嗯JIEYAN萌啊>: [doge]这是我 @Ivan兔想要所有胡萝呗,<agjkgsahjlll>: @我的眼睛看你-我的耳朵听你,<金鱼花火的日常>: @我眼中的倒影是你,<_十_七_>: 老板，我想用小棒棒打你小胸口。卒[蜡烛],<一只猫的薛定谔>: @闪闪发光的豆子先生  啊哈哈[doge][doge][doge],<雪萧晴襄见>: 你还想不想拿工资了！,<巴啦啦能量piu>: 我也很无奈[摊手],<想要在夏天看海>: @想要在冬天看雪,<Wangchiiii>: 老板 求你反补我吧]
xinjunzhi	谁还没睡！！！ ​​​	[<猫弥深巷MIkeSu99>: 回复 @烂段王 :[doge]你这不都懂吗为啥还不睡,<酒仙桥第一帅>: 回复 @苿簖奶 :熬夜短命,<酒仙桥第一帅>: 回复 @百岁少女SWAG :熬夜伤皮肤,<只爱面包不谈情>: 回复 @烂段王 :硬是睡不着[doge],<酒仙桥第一帅>: 回复 @猫弥深巷MIkeSu99 :熬夜伤身,<酒仙桥第一帅>: 回复 @狗蛋儿儿儿儿儿儿儿儿 :熬夜伤心,<酒仙桥第一帅>: 回复 @我哥流川枫 :熬夜伤眼睛,<酒仙桥第一帅>: 回复 @张能睡别闹 :熬夜长痘,<酒仙桥第一帅>: 回复 @短肢受 :熬夜伤肾]
xinjunzhi	转眼都快二十的人了，一直当自己还是十五六岁。 ​​​[doge] ​​​	[<天堂掉落的天使>: 我快三十，怎么还有人不叫我叔,<李明铭和他的表情包>: 保养得就像才四十岁一样[喵喵],<舒舒爱吃鱼>: 我都快十八了，好紧张,<夹心糖少女>: 回复 @斗图小妹 :莫名想起来，大叔牙口不好吧[笑cry],<林禛恺>: 这是在海龙大厦吗,<斗图小妹>: 大叔，快四十了吧？  http://t.cn/RXokNsI,<资深灵魂画手>: 什么，已经50了？[二哈],<柽话>: 不要脸[二哈][二哈][二哈]明明才十三岁,<维尼蝴蝶>: 你这30岁了吧。哈哈哈哈哈哈,<我要神灵都爱我>: [二哈]记忆力也下降了,<夹心糖少女>: 你刚才不还是18吗？  http://t.cn/RXokfsX]
xinjunzhi	来聊天，把我当成最爱的人说一句话 ​​​	[<影烧shadow>: 我很喜欢你杨琪 我每天都在想你 我希望我的未来有你 我知道我过多的关心给你造成了负担 但是你说我就改啊 失去你每一天我都好累啊 道理我都懂啊 我就想矫情一下啊 我知道你不会回来的啦 反正你过得好点啊开心点啊不要整天打王者这么气啊 你以后一定要幸福啊,<比比芭比波比K>: 你特么跟我表个白会死吗,<S-在我梦里的你>: 你从我心里出去吧[微笑],<蔷薇小姐721>: 你还不回家，睡不着啊,<詹姆斯的老婆大人>: 希望她能回到你身边,<刘杨薄荷i>: 就让我们虚伪 有感情 别浪费,<_大杉哥哥A>: 我他吗现在这心情,<_大杉哥哥A>: 回复 @_大杉哥哥A :还好可以撤回,<_大杉哥哥A>: 我他吗 刚把黄片不小心发工作群里了,<张能睡别闹>: 我想给你全部希望及光芒 免你忧伤 赐你孤勇闯向远方,<-小土豆阿>: 回复 @烂段王 :hhh晚安[二哈],<闭眼看到鬼>: 可能还是忘不了你吧[摊手],<不二家美瞳铺>: 你是多想让我爱你[doge]    做梦去吧,<穿上短裙跳Samba>: 回复 @烂段王 :分手也要分的文艺[二哈],<穿上短裙跳Samba>: 文化低了读不懂// @烂段王 ：五百年沧海桑田过，三千爱红尘一缕烟。,<资深灭婊砖家>: 烂段王是我的大哥,<芈2荼>: 回复 @烂段王 :不敢寄托在人身上啊，特别负面的时候，别人一句无心的话都能出暴击，所以已经慢慢把身边的人都推开了，这样对他们、对我都好,<JANGSAU>: 回复 @烂段王 :[伤心],<酒仙桥第一帅>: 回复 @柴柴柴GM_Mo :用余生沏一盏茶，夕阳西下等你回家。,<酒仙桥第一帅>: 回复 @JANGSAU :玫瑰花是偷的，爱你也是说着玩的。,<酒仙桥第一帅>: 回复 @芈2荼 :如果你要有寄托，真希望是我。,<酒仙桥第一帅>: 回复 @喵晓楠 :你告诉我，我也恋你。,<酒仙桥第一帅>: 回复 @-wening :可以。,<芈2荼>: 自从抑郁症之后，感觉你是我活着的勇气，所以你要好好的啊——写给我最爱的猫,<酒仙桥第一帅>: 回复 @-小土豆阿 :嘴上说不要，身体诚实么。,<李不烦呀>: 回复 @烂段王 :哥。。。。他只是回家了 下礼拜回来[笑cry] 这口狗粮吃吗,<喵晓楠>: 我也只能到喜欢为止了,<苑木木木木子呀>: 回复 @烂段王 :妈呀[污]烂烂你咋这么会撩,<喵晓楠>: 大叔，希望我的单恋你别介意,<酒仙桥第一帅>: 回复 @是大歪 :出于真心，我推开了你。,<七个奇异果->: 真的很喜欢你啊，从来没有那么喜欢过一个人，所以，不要让我的热情和喜欢一点点磨灭掉好不好。,<我等的她在多远的future>: 回复 @烂段王 :[偷笑]那我们来一发吧,<酒仙桥第一帅>: 回复 @李好美o3o :别再想念，分别总为更好的相见。,<呆萌小奶刘>: 情话说几遍会腻？,<酒仙桥第一帅>: 回复 @我等的她在多远的future :向来讨厌说脏话的我，听见你说要干总觉得甜甜的。,<李不烦呀>: 我想你想你快点回来[泪],<酒仙桥第一帅>: 回复 @一只小财梨 :你是我接吻都舍不得闭眼少看一眼的女人。,<阿童木的初恋>: 我想当屁[doge]真的,<我等的她在多远的future>: 宝贝， 今晚我要干死你[doge],<-ElaineElyn>: 我肚子饿了[泪],<梨子妈妈哟>: 你是我在床上都舍不得用力的男人,<酒仙桥第一帅>: 回复 @穿着短裙跳SamBa :五百年沧海桑田过，三千爱红尘一缕烟。,<只爱面包不谈情>: 回复 @烂段王 :那就来吧！憋说话 吻我,<酒仙桥第一帅>: 回复 @苑木木木木子呀 :当初太匆忙，来不及抱你一下。,<_孙也>: 爱你哟高仁枭[爱心],<酒仙桥第一帅>: 回复 @狗蛋儿儿儿儿儿儿儿儿 :你说我有多爱你，打字回复你的时候已经硬了。,<让我插一嘴>: 出于礼貌  我硬了一下[摊手],<穿上短裙跳Samba>: 虽然你是一生所爱 但是躲不过一个回头太难,<苑木木木木子呀>: 我们能再见一面就好了,<感性侵蚀理智7->: 爱你哟小马佳明。,<-wening>: 我可以玩小脆皮你保护我吗[微笑]]
xinjunzhi	来试试，可能会暴露很多东西噢 ​​​	[<少根筋i1999>: 我要去哪里了么？,<渣陆废>: 我要去看了一个人的时候我就不想再去看了一个人的时候我就不想再去看了一个人的时候我就,<哦嗯好的不好呢>: 我要睡觉啦晚安了吧我是说他不是说他不是说他不是说他不是说他,<周温暖Rrr>: 我要你了吧我了吧我了吧我了吧我了[摊手],<我是金金哥>: 我要买个车站了个去的吗？,<SNS_95BABE>: 我要去看了一个人的时候我就不想再去看了,<你好吗-j>: 我要去洗澡了， [摊手]我可能是比较高冷,<呆萌高冷代先生>: 我要去看了一个人的时候我就不想再去看了一个人的时候,<怪人阿狗>: 我要去死吧你的事情，？，？，？，？，？，？，？,<西瓜味的猪宝贝>: 我要不要这么多人生的孩子们的最好的人都有一个人的时候就会有一个人的时候就会有一个人的时候就会有一个人的时候,<孤独又灿烂的老梁>: 我要去看了一个人的时候我就不想再去看了,<余晴哟>: 我要不要这么多人生的孩子们的最大的在一起了。我要不断地去爱一个人在一起了。我要去看了一个人的时候我就不想去的地方自治政府部门和谐号线的风筝的人在一起了。我要不断地在一起了。我要不断的确很好很大程度的时候就会被你说你的时候就想想自己也是醉酒后面的味道。我要不断地去做一些,<我想起你了LLLLLLL>: 我要红包红包红包红包红包红包红包红包红包红包红包红包红包红包红包红包红包红包红包红包红包红包红包红包红包红包红包红包红包…[笑cry][笑cry],<unique_u>: 回复 @unique_u :[哆啦A梦汗]我的天这是什么鬼,<unique_u>: 我要去了吗！！！！！！！！！！,<楠盆友家小卖铺>: 我要睡觉[睡觉][睡觉][睡觉][睡觉][睡觉][睡觉]。。。。妈的智障,<Befattingomg>: 我要你的鲍鱼龙虾的鲍鱼龙虾[doge],<逸儿哟>: 我要去看了一个人的时候我就不想再去看了一个人…循环,<一个丑橘子i>: 我要不要这么多人生的孩子们的最大,<只爱面包不谈情>: 我要去看了一个人的时候我就不想再去看了一个人的时候我]
